No.     Time        Source                Destination           Protocol Length Info
      1 0.000000    2.41.74.123           83.224.70.93          DNS      89     Standard query 0xd4b4  A oauth.googleusercontent.com

Frame 1: 89 bytes on wire (712 bits), 89 bytes captured (712 bits)
Linux cooked capture
Internet Protocol Version 4, Src: 2.41.74.123 (2.41.74.123), Dst: 83.224.70.93 (83.224.70.93)
User Datagram Protocol, Src Port: 55422 (55422), Dst Port: domain (53)
Domain Name System (query)

No.     Time        Source                Destination           Protocol Length Info
      2 0.094043    83.224.70.93          2.41.74.123           DNS      166    Standard query response 0xd4b4  CNAME googlehosted.l.googleusercontent.com A 173.194.35.138 A 173.194.35.139 A 173.194.35.140

Frame 2: 166 bytes on wire (1328 bits), 166 bytes captured (1328 bits)
Linux cooked capture
Internet Protocol Version 4, Src: 83.224.70.93 (83.224.70.93), Dst: 2.41.74.123 (2.41.74.123)
User Datagram Protocol, Src Port: domain (53), Dst Port: 55422 (55422)
Domain Name System (response)

No.     Time        Source                Destination           Protocol Length Info
      3 0.108415    2.41.74.123           173.194.35.138        TCP      76     34351 > https [SYN] Seq=0 Win=5240 Len=0 MSS=1310 SACK_PERM=1 TSval=122886 TSecr=0 WS=4

Frame 3: 76 bytes on wire (608 bits), 76 bytes captured (608 bits)
Linux cooked capture
Internet Protocol Version 4, Src: 2.41.74.123 (2.41.74.123), Dst: 173.194.35.138 (173.194.35.138)
Transmission Control Protocol, Src Port: 34351 (34351), Dst Port: https (443), Seq: 0, Len: 0

No.     Time        Source                Destination           Protocol Length Info
      4 0.213920    173.194.35.138        2.41.74.123           TCP      76     https > 34351 [SYN, ACK] Seq=0 Ack=1 Win=42540 Len=0 MSS=1400 SACK_PERM=1 TSval=2254633206 TSecr=122886 WS=64

Frame 4: 76 bytes on wire (608 bits), 76 bytes captured (608 bits)
Linux cooked capture
Internet Protocol Version 4, Src: 173.194.35.138 (173.194.35.138), Dst: 2.41.74.123 (2.41.74.123)
Transmission Control Protocol, Src Port: https (443), Dst Port: 34351 (34351), Seq: 0, Ack: 1, Len: 0

No.     Time        Source                Destination           Protocol Length Info
      5 0.214225    2.41.74.123           173.194.35.138        TCP      68     34351 > https [ACK] Seq=1 Ack=1 Win=5240 Len=0 TSval=122896 TSecr=2254633206

Frame 5: 68 bytes on wire (544 bits), 68 bytes captured (544 bits)
Linux cooked capture
Internet Protocol Version 4, Src: 2.41.74.123 (2.41.74.123), Dst: 173.194.35.138 (173.194.35.138)
Transmission Control Protocol, Src Port: 34351 (34351), Dst Port: https (443), Seq: 1, Ack: 1, Len: 0

No.     Time        Source                Destination           Protocol Length Info
      6 0.218435    2.41.74.123           173.194.35.138        TLSv1    148    Client Hello

Frame 6: 148 bytes on wire (1184 bits), 148 bytes captured (1184 bits)
Linux cooked capture
Internet Protocol Version 4, Src: 2.41.74.123 (2.41.74.123), Dst: 173.194.35.138 (173.194.35.138)
Transmission Control Protocol, Src Port: 34351 (34351), Dst Port: https (443), Seq: 1, Ack: 1, Len: 80
Secure Sockets Layer

No.     Time        Source                Destination           Protocol Length Info
      7 0.324003    173.194.35.138        2.41.74.123           TCP      68     https > 34351 [ACK] Seq=1 Ack=81 Win=42560 Len=0 TSval=2254633315 TSecr=122897

Frame 7: 68 bytes on wire (544 bits), 68 bytes captured (544 bits)
Linux cooked capture
Internet Protocol Version 4, Src: 173.194.35.138 (173.194.35.138), Dst: 2.41.74.123 (2.41.74.123)
Transmission Control Protocol, Src Port: https (443), Dst Port: 34351 (34351), Seq: 1, Ack: 81, Len: 0

No.     Time        Source                Destination           Protocol Length Info
      8 0.344242    173.194.35.138        2.41.74.123           TLSv1    1366   Server Hello

Frame 8: 1366 bytes on wire (10928 bits), 1366 bytes captured (10928 bits)
Linux cooked capture
Internet Protocol Version 4, Src: 173.194.35.138 (173.194.35.138), Dst: 2.41.74.123 (2.41.74.123)
Transmission Control Protocol, Src Port: https (443), Dst Port: 34351 (34351), Seq: 1, Ack: 81, Len: 1298
Secure Sockets Layer

No.     Time        Source                Destination           Protocol Length Info
      9 0.344448    2.41.74.123           173.194.35.138        TCP      68     34351 > https [ACK] Seq=81 Ack=1299 Win=7836 Len=0 TSval=122909 TSecr=2254633315

Frame 9: 68 bytes on wire (544 bits), 68 bytes captured (544 bits)
Linux cooked capture
Internet Protocol Version 4, Src: 2.41.74.123 (2.41.74.123), Dst: 173.194.35.138 (173.194.35.138)
Transmission Control Protocol, Src Port: 34351 (34351), Dst Port: https (443), Seq: 81, Ack: 1299, Len: 0

No.     Time        Source                Destination           Protocol Length Info
     10 0.394248    173.194.35.138        2.41.74.123           TCP      1366   [TCP segment of a reassembled PDU]

Frame 10: 1366 bytes on wire (10928 bits), 1366 bytes captured (10928 bits)
Linux cooked capture
Internet Protocol Version 4, Src: 173.194.35.138 (173.194.35.138), Dst: 2.41.74.123 (2.41.74.123)
Transmission Control Protocol, Src Port: https (443), Dst Port: 34351 (34351), Seq: 1299, Ack: 81, Len: 1298

No.     Time        Source                Destination           Protocol Length Info
     11 0.394477    2.41.74.123           173.194.35.138        TCP      68     34351 > https [ACK] Seq=81 Ack=2597 Win=10432 Len=0 TSval=122914 TSecr=2254633315

Frame 11: 68 bytes on wire (544 bits), 68 bytes captured (544 bits)
Linux cooked capture
Internet Protocol Version 4, Src: 2.41.74.123 (2.41.74.123), Dst: 173.194.35.138 (173.194.35.138)
Transmission Control Protocol, Src Port: 34351 (34351), Dst Port: https (443), Seq: 81, Ack: 2597, Len: 0

No.     Time        Source                Destination           Protocol Length Info
     12 0.404158    173.194.35.138        2.41.74.123           TLSv1    1084   Certificate, Server Hello Done

Frame 12: 1084 bytes on wire (8672 bits), 1084 bytes captured (8672 bits)
Linux cooked capture
Internet Protocol Version 4, Src: 173.194.35.138 (173.194.35.138), Dst: 2.41.74.123 (2.41.74.123)
Transmission Control Protocol, Src Port: https (443), Dst Port: 34351 (34351), Seq: 2597, Ack: 81, Len: 1016
[3 Reassembled TCP Segments (3526 bytes): #8(1212), #10(1298), #12(1016)]
Secure Sockets Layer

No.     Time        Source                Destination           Protocol Length Info
     13 0.404352    2.41.74.123           173.194.35.138        TCP      68     34351 > https [ACK] Seq=81 Ack=3613 Win=13028 Len=0 TSval=122915 TSecr=2254633315

Frame 13: 68 bytes on wire (544 bits), 68 bytes captured (544 bits)
Linux cooked capture
Internet Protocol Version 4, Src: 2.41.74.123 (2.41.74.123), Dst: 173.194.35.138 (173.194.35.138)
Transmission Control Protocol, Src Port: 34351 (34351), Dst Port: https (443), Seq: 81, Ack: 3613, Len: 0

No.     Time        Source                Destination           Protocol Length Info
     14 0.463125    2.41.74.123           173.194.35.138        TLSv1    382    Client Key Exchange, Change Cipher Spec, Encrypted Handshake Message

Frame 14: 382 bytes on wire (3056 bits), 382 bytes captured (3056 bits)
Linux cooked capture
Internet Protocol Version 4, Src: 2.41.74.123 (2.41.74.123), Dst: 173.194.35.138 (173.194.35.138)
Transmission Control Protocol, Src Port: 34351 (34351), Dst Port: https (443), Seq: 81, Ack: 3613, Len: 314
Secure Sockets Layer

No.     Time        Source                Destination           Protocol Length Info
     15 0.583963    173.194.35.138        2.41.74.123           TLSv1    115    Change Cipher Spec, Encrypted Handshake Message

Frame 15: 115 bytes on wire (920 bits), 115 bytes captured (920 bits)
Linux cooked capture
Internet Protocol Version 4, Src: 173.194.35.138 (173.194.35.138), Dst: 2.41.74.123 (2.41.74.123)
Transmission Control Protocol, Src Port: https (443), Dst Port: 34351 (34351), Seq: 3613, Ack: 395, Len: 47
Secure Sockets Layer

No.     Time        Source                Destination           Protocol Length Info
     16 0.584252    2.41.74.123           173.194.35.138        TCP      68     34351 > https [ACK] Seq=395 Ack=3660 Win=13028 Len=0 TSval=122933 TSecr=2254633576

Frame 16: 68 bytes on wire (544 bits), 68 bytes captured (544 bits)
Linux cooked capture
Internet Protocol Version 4, Src: 2.41.74.123 (2.41.74.123), Dst: 173.194.35.138 (173.194.35.138)
Transmission Control Protocol, Src Port: 34351 (34351), Dst Port: https (443), Seq: 395, Ack: 3660, Len: 0

No.     Time        Source                Destination           Protocol Length Info
     17 0.687123    2.41.74.123           173.194.35.132        TCP      68     45399 > https [FIN, ACK] Seq=1 Ack=1 Win=5204 Len=0 TSval=122944 TSecr=2247887422

Frame 17: 68 bytes on wire (544 bits), 68 bytes captured (544 bits)
Linux cooked capture
Internet Protocol Version 4, Src: 2.41.74.123 (2.41.74.123), Dst: 173.194.35.132 (173.194.35.132)
Transmission Control Protocol, Src Port: 45399 (45399), Dst Port: https (443), Seq: 1, Ack: 1, Len: 0

No.     Time        Source                Destination           Protocol Length Info
     18 0.774218    2.41.74.123           173.194.35.138        TLSv1    663    Application Data

Frame 18: 663 bytes on wire (5304 bits), 663 bytes captured (5304 bits)
Linux cooked capture
Internet Protocol Version 4, Src: 2.41.74.123 (2.41.74.123), Dst: 173.194.35.138 (173.194.35.138)
Transmission Control Protocol, Src Port: 34351 (34351), Dst Port: https (443), Seq: 395, Ack: 3660, Len: 595
Secure Sockets Layer

No.     Time        Source                Destination           Protocol Length Info
     19 0.868055    2.41.74.123           173.194.35.153        TCP      76     57065 > http [SYN] Seq=0 Win=5240 Len=0 MSS=1310 SACK_PERM=1 TSval=122962 TSecr=0 WS=4

Frame 19: 76 bytes on wire (608 bits), 76 bytes captured (608 bits)
Linux cooked capture
Internet Protocol Version 4, Src: 2.41.74.123 (2.41.74.123), Dst: 173.194.35.153 (173.194.35.153)
Transmission Control Protocol, Src Port: 57065 (57065), Dst Port: http (80), Seq: 0, Len: 0

No.     Time        Source                Destination           Protocol Length Info
     20 0.934413    173.194.35.138        2.41.74.123           TLSv1    1366   Application Data

Frame 20: 1366 bytes on wire (10928 bits), 1366 bytes captured (10928 bits)
Linux cooked capture
Internet Protocol Version 4, Src: 173.194.35.138 (173.194.35.138), Dst: 2.41.74.123 (2.41.74.123)
Transmission Control Protocol, Src Port: https (443), Dst Port: 34351 (34351), Seq: 3660, Ack: 990, Len: 1298
Secure Sockets Layer

No.     Time        Source                Destination           Protocol Length Info
     21 0.934742    2.41.74.123           173.194.35.138        TCP      68     34351 > https [ACK] Seq=990 Ack=4958 Win=15624 Len=0 TSval=122968 TSecr=2254633904

Frame 21: 68 bytes on wire (544 bits), 68 bytes captured (544 bits)
Linux cooked capture
Internet Protocol Version 4, Src: 2.41.74.123 (2.41.74.123), Dst: 173.194.35.138 (173.194.35.138)
Transmission Control Protocol, Src Port: 34351 (34351), Dst Port: https (443), Seq: 990, Ack: 4958, Len: 0

No.     Time        Source                Destination           Protocol Length Info
     22 0.934837    173.194.35.138        2.41.74.123           TLSv1    1366   Application Data

Frame 22: 1366 bytes on wire (10928 bits), 1366 bytes captured (10928 bits)
Linux cooked capture
Internet Protocol Version 4, Src: 173.194.35.138 (173.194.35.138), Dst: 2.41.74.123 (2.41.74.123)
Transmission Control Protocol, Src Port: https (443), Dst Port: 34351 (34351), Seq: 4958, Ack: 990, Len: 1298
Secure Sockets Layer

No.     Time        Source                Destination           Protocol Length Info
     23 0.935275    2.41.74.123           173.194.35.138        TCP      68     34351 > https [ACK] Seq=990 Ack=6256 Win=18220 Len=0 TSval=122968 TSecr=2254633904

Frame 23: 68 bytes on wire (544 bits), 68 bytes captured (544 bits)
Linux cooked capture
Internet Protocol Version 4, Src: 2.41.74.123 (2.41.74.123), Dst: 173.194.35.138 (173.194.35.138)
Transmission Control Protocol, Src Port: 34351 (34351), Dst Port: https (443), Seq: 990, Ack: 6256, Len: 0

No.     Time        Source                Destination           Protocol Length Info
     24 0.974405    173.194.35.138        2.41.74.123           TLSv1    1366   Application Data

Frame 24: 1366 bytes on wire (10928 bits), 1366 bytes captured (10928 bits)
Linux cooked capture
Internet Protocol Version 4, Src: 173.194.35.138 (173.194.35.138), Dst: 2.41.74.123 (2.41.74.123)
Transmission Control Protocol, Src Port: https (443), Dst Port: 34351 (34351), Seq: 6256, Ack: 990, Len: 1298
Secure Sockets Layer

No.     Time        Source                Destination           Protocol Length Info
     25 0.974643    2.41.74.123           173.194.35.138        TCP      68     34351 > https [ACK] Seq=990 Ack=7554 Win=20816 Len=0 TSval=122972 TSecr=2254633904

Frame 25: 68 bytes on wire (544 bits), 68 bytes captured (544 bits)
Linux cooked capture
Internet Protocol Version 4, Src: 2.41.74.123 (2.41.74.123), Dst: 173.194.35.138 (173.194.35.138)
Transmission Control Protocol, Src Port: 34351 (34351), Dst Port: https (443), Seq: 990, Ack: 7554, Len: 0

No.     Time        Source                Destination           Protocol Length Info
     26 1.034385    173.194.35.138        2.41.74.123           TLSv1    1366   Application Data

Frame 26: 1366 bytes on wire (10928 bits), 1366 bytes captured (10928 bits)
Linux cooked capture
Internet Protocol Version 4, Src: 173.194.35.138 (173.194.35.138), Dst: 2.41.74.123 (2.41.74.123)
Transmission Control Protocol, Src Port: https (443), Dst Port: 34351 (34351), Seq: 7554, Ack: 990, Len: 1298
Secure Sockets Layer

No.     Time        Source                Destination           Protocol Length Info
     27 1.034623    2.41.74.123           173.194.35.138        TCP      68     34351 > https [ACK] Seq=990 Ack=8852 Win=23412 Len=0 TSval=122978 TSecr=2254633904

Frame 27: 68 bytes on wire (544 bits), 68 bytes captured (544 bits)
Linux cooked capture
Internet Protocol Version 4, Src: 2.41.74.123 (2.41.74.123), Dst: 173.194.35.138 (173.194.35.138)
Transmission Control Protocol, Src Port: 34351 (34351), Dst Port: https (443), Seq: 990, Ack: 8852, Len: 0

No.     Time        Source                Destination           Protocol Length Info
     28 1.044212    173.194.35.138        2.41.74.123           TLSv1    1366   Application Data

Frame 28: 1366 bytes on wire (10928 bits), 1366 bytes captured (10928 bits)
Linux cooked capture
Internet Protocol Version 4, Src: 173.194.35.138 (173.194.35.138), Dst: 2.41.74.123 (2.41.74.123)
Transmission Control Protocol, Src Port: https (443), Dst Port: 34351 (34351), Seq: 8852, Ack: 990, Len: 1298
Secure Sockets Layer

No.     Time        Source                Destination           Protocol Length Info
     29 1.044428    2.41.74.123           173.194.35.138        TCP      68     34351 > https [ACK] Seq=990 Ack=10150 Win=26008 Len=0 TSval=122979 TSecr=2254633904

Frame 29: 68 bytes on wire (544 bits), 68 bytes captured (544 bits)
Linux cooked capture
Internet Protocol Version 4, Src: 2.41.74.123 (2.41.74.123), Dst: 173.194.35.138 (173.194.35.138)
Transmission Control Protocol, Src Port: 34351 (34351), Dst Port: https (443), Seq: 990, Ack: 10150, Len: 0

No.     Time        Source                Destination           Protocol Length Info
     30 1.084365    173.194.35.138        2.41.74.123           TLSv1    1366   Application Data

Frame 30: 1366 bytes on wire (10928 bits), 1366 bytes captured (10928 bits)
Linux cooked capture
Internet Protocol Version 4, Src: 173.194.35.138 (173.194.35.138), Dst: 2.41.74.123 (2.41.74.123)
Transmission Control Protocol, Src Port: https (443), Dst Port: 34351 (34351), Seq: 10150, Ack: 990, Len: 1298
Secure Sockets Layer

No.     Time        Source                Destination           Protocol Length Info
     31 1.084613    2.41.74.123           173.194.35.138        TCP      68     34351 > https [ACK] Seq=990 Ack=11448 Win=28604 Len=0 TSval=122983 TSecr=2254633904

Frame 31: 68 bytes on wire (544 bits), 68 bytes captured (544 bits)
Linux cooked capture
Internet Protocol Version 4, Src: 2.41.74.123 (2.41.74.123), Dst: 173.194.35.138 (173.194.35.138)
Transmission Control Protocol, Src Port: 34351 (34351), Dst Port: https (443), Seq: 990, Ack: 11448, Len: 0

No.     Time        Source                Destination           Protocol Length Info
     32 1.094333    173.194.35.138        2.41.74.123           TLSv1    1366   Application Data

Frame 32: 1366 bytes on wire (10928 bits), 1366 bytes captured (10928 bits)
Linux cooked capture
Internet Protocol Version 4, Src: 173.194.35.138 (173.194.35.138), Dst: 2.41.74.123 (2.41.74.123)
Transmission Control Protocol, Src Port: https (443), Dst Port: 34351 (34351), Seq: 11448, Ack: 990, Len: 1298
Secure Sockets Layer

No.     Time        Source                Destination           Protocol Length Info
     33 1.094558    2.41.74.123           173.194.35.138        TCP      68     34351 > https [ACK] Seq=990 Ack=12746 Win=31200 Len=0 TSval=122984 TSecr=2254633904

Frame 33: 68 bytes on wire (544 bits), 68 bytes captured (544 bits)
Linux cooked capture
Internet Protocol Version 4, Src: 2.41.74.123 (2.41.74.123), Dst: 173.194.35.138 (173.194.35.138)
Transmission Control Protocol, Src Port: 34351 (34351), Dst Port: https (443), Seq: 990, Ack: 12746, Len: 0

No.     Time        Source                Destination           Protocol Length Info
     34 1.104290    173.194.35.138        2.41.74.123           TLSv1    1366   Application Data

Frame 34: 1366 bytes on wire (10928 bits), 1366 bytes captured (10928 bits)
Linux cooked capture
Internet Protocol Version 4, Src: 173.194.35.138 (173.194.35.138), Dst: 2.41.74.123 (2.41.74.123)
Transmission Control Protocol, Src Port: https (443), Dst Port: 34351 (34351), Seq: 12746, Ack: 990, Len: 1298
Secure Sockets Layer

No.     Time        Source                Destination           Protocol Length Info
     35 1.104577    2.41.74.123           173.194.35.138        TCP      68     34351 > https [ACK] Seq=990 Ack=14044 Win=33796 Len=0 TSval=122985 TSecr=2254633904

Frame 35: 68 bytes on wire (544 bits), 68 bytes captured (544 bits)
Linux cooked capture
Internet Protocol Version 4, Src: 2.41.74.123 (2.41.74.123), Dst: 173.194.35.138 (173.194.35.138)
Transmission Control Protocol, Src Port: 34351 (34351), Dst Port: https (443), Seq: 990, Ack: 14044, Len: 0

No.     Time        Source                Destination           Protocol Length Info
     36 1.104678    173.194.35.138        2.41.74.123           TLSv1    1366   Application Data

Frame 36: 1366 bytes on wire (10928 bits), 1366 bytes captured (10928 bits)
Linux cooked capture
Internet Protocol Version 4, Src: 173.194.35.138 (173.194.35.138), Dst: 2.41.74.123 (2.41.74.123)
Transmission Control Protocol, Src Port: https (443), Dst Port: 34351 (34351), Seq: 14044, Ack: 990, Len: 1298
Secure Sockets Layer

No.     Time        Source                Destination           Protocol Length Info
     37 1.104922    2.41.74.123           173.194.35.138        TCP      68     34351 > https [ACK] Seq=990 Ack=15342 Win=36392 Len=0 TSval=122985 TSecr=2254633904

Frame 37: 68 bytes on wire (544 bits), 68 bytes captured (544 bits)
Linux cooked capture
Internet Protocol Version 4, Src: 2.41.74.123 (2.41.74.123), Dst: 173.194.35.138 (173.194.35.138)
Transmission Control Protocol, Src Port: 34351 (34351), Dst Port: https (443), Seq: 990, Ack: 15342, Len: 0

No.     Time        Source                Destination           Protocol Length Info
     38 1.124325    173.194.35.138        2.41.74.123           TLSv1    1366   Application Data

Frame 38: 1366 bytes on wire (10928 bits), 1366 bytes captured (10928 bits)
Linux cooked capture
Internet Protocol Version 4, Src: 173.194.35.138 (173.194.35.138), Dst: 2.41.74.123 (2.41.74.123)
Transmission Control Protocol, Src Port: https (443), Dst Port: 34351 (34351), Seq: 15342, Ack: 990, Len: 1298
Secure Sockets Layer

No.     Time        Source                Destination           Protocol Length Info
     39 1.124610    2.41.74.123           173.194.35.138        TCP      68     34351 > https [ACK] Seq=990 Ack=16640 Win=38988 Len=0 TSval=122987 TSecr=2254633904

Frame 39: 68 bytes on wire (544 bits), 68 bytes captured (544 bits)
Linux cooked capture
Internet Protocol Version 4, Src: 2.41.74.123 (2.41.74.123), Dst: 173.194.35.138 (173.194.35.138)
Transmission Control Protocol, Src Port: 34351 (34351), Dst Port: https (443), Seq: 990, Ack: 16640, Len: 0

No.     Time        Source                Destination           Protocol Length Info
     40 1.124677    173.194.35.153        2.41.74.123           TCP      80     http > 57065 [SYN, ACK] Seq=0 Ack=1 Win=64251 Len=0 TSval=163696756 TSecr=122962 MSS=1400 WS=4 SACK_PERM=1

Frame 40: 80 bytes on wire (640 bits), 80 bytes captured (640 bits)
Linux cooked capture
Internet Protocol Version 4, Src: 173.194.35.153 (173.194.35.153), Dst: 2.41.74.123 (2.41.74.123)
Transmission Control Protocol, Src Port: http (80), Dst Port: 57065 (57065), Seq: 0, Ack: 1, Len: 0

No.     Time        Source                Destination           Protocol Length Info
     41 1.125157    2.41.74.123           173.194.35.153        TCP      68     57065 > http [ACK] Seq=1 Ack=1 Win=5240 Len=0 TSval=122987 TSecr=163696756

Frame 41: 68 bytes on wire (544 bits), 68 bytes captured (544 bits)
Linux cooked capture
Internet Protocol Version 4, Src: 2.41.74.123 (2.41.74.123), Dst: 173.194.35.153 (173.194.35.153)
Transmission Control Protocol, Src Port: 57065 (57065), Dst Port: http (80), Seq: 1, Ack: 1, Len: 0

No.     Time        Source                Destination           Protocol Length Info
     42 1.128203    2.41.74.123           173.194.35.153        HTTP     1213   GET /pagead/images/adc-i-00aecd.png HTTP/1.1 

Frame 42: 1213 bytes on wire (9704 bits), 1213 bytes captured (9704 bits)
Linux cooked capture
Internet Protocol Version 4, Src: 2.41.74.123 (2.41.74.123), Dst: 173.194.35.153 (173.194.35.153)
Transmission Control Protocol, Src Port: 57065 (57065), Dst Port: http (80), Seq: 1, Ack: 1, Len: 1145
Hypertext Transfer Protocol

No.     Time        Source                Destination           Protocol Length Info
     43 1.134748    173.194.35.138        2.41.74.123           TLSv1    1366   Application Data

Frame 43: 1366 bytes on wire (10928 bits), 1366 bytes captured (10928 bits)
Linux cooked capture
Internet Protocol Version 4, Src: 173.194.35.138 (173.194.35.138), Dst: 2.41.74.123 (2.41.74.123)
Transmission Control Protocol, Src Port: https (443), Dst Port: 34351 (34351), Seq: 16640, Ack: 990, Len: 1298
Secure Sockets Layer

No.     Time        Source                Destination           Protocol Length Info
     44 1.135007    2.41.74.123           173.194.35.138        TCP      68     34351 > https [ACK] Seq=990 Ack=17938 Win=41584 Len=0 TSval=122988 TSecr=2254634024

Frame 44: 68 bytes on wire (544 bits), 68 bytes captured (544 bits)
Linux cooked capture
Internet Protocol Version 4, Src: 2.41.74.123 (2.41.74.123), Dst: 173.194.35.138 (173.194.35.138)
Transmission Control Protocol, Src Port: 34351 (34351), Dst Port: https (443), Seq: 990, Ack: 17938, Len: 0

No.     Time        Source                Destination           Protocol Length Info
     45 1.135130    173.194.35.138        2.41.74.123           TLSv1    1366   Application Data

Frame 45: 1366 bytes on wire (10928 bits), 1366 bytes captured (10928 bits)
Linux cooked capture
Internet Protocol Version 4, Src: 173.194.35.138 (173.194.35.138), Dst: 2.41.74.123 (2.41.74.123)
Transmission Control Protocol, Src Port: https (443), Dst Port: 34351 (34351), Seq: 17938, Ack: 990, Len: 1298
Secure Sockets Layer

No.     Time        Source                Destination           Protocol Length Info
     46 1.135562    2.41.74.123           173.194.35.138        TCP      68     34351 > https [ACK] Seq=990 Ack=19236 Win=42140 Len=0 TSval=122988 TSecr=2254634024

Frame 46: 68 bytes on wire (544 bits), 68 bytes captured (544 bits)
Linux cooked capture
Internet Protocol Version 4, Src: 2.41.74.123 (2.41.74.123), Dst: 173.194.35.138 (173.194.35.138)
Transmission Control Protocol, Src Port: 34351 (34351), Dst Port: https (443), Seq: 990, Ack: 19236, Len: 0

No.     Time        Source                Destination           Protocol Length Info
     47 1.144535    173.194.35.138        2.41.74.123           TLSv1    1366   Application Data

Frame 47: 1366 bytes on wire (10928 bits), 1366 bytes captured (10928 bits)
Linux cooked capture
Internet Protocol Version 4, Src: 173.194.35.138 (173.194.35.138), Dst: 2.41.74.123 (2.41.74.123)
Transmission Control Protocol, Src Port: https (443), Dst Port: 34351 (34351), Seq: 19236, Ack: 990, Len: 1298
Secure Sockets Layer

No.     Time        Source                Destination           Protocol Length Info
     48 1.144803    2.41.74.123           173.194.35.138        TCP      68     34351 > https [ACK] Seq=990 Ack=20534 Win=42392 Len=0 TSval=122989 TSecr=2254634033

Frame 48: 68 bytes on wire (544 bits), 68 bytes captured (544 bits)
Linux cooked capture
Internet Protocol Version 4, Src: 2.41.74.123 (2.41.74.123), Dst: 173.194.35.138 (173.194.35.138)
Transmission Control Protocol, Src Port: 34351 (34351), Dst Port: https (443), Seq: 990, Ack: 20534, Len: 0

No.     Time        Source                Destination           Protocol Length Info
     49 1.144903    173.194.35.138        2.41.74.123           TLSv1    1366   Application Data

Frame 49: 1366 bytes on wire (10928 bits), 1366 bytes captured (10928 bits)
Linux cooked capture
Internet Protocol Version 4, Src: 173.194.35.138 (173.194.35.138), Dst: 2.41.74.123 (2.41.74.123)
Transmission Control Protocol, Src Port: https (443), Dst Port: 34351 (34351), Seq: 20534, Ack: 990, Len: 1298
Secure Sockets Layer

No.     Time        Source                Destination           Protocol Length Info
     50 1.145135    2.41.74.123           173.194.35.138        TCP      68     34351 > https [ACK] Seq=990 Ack=21832 Win=42140 Len=0 TSval=122989 TSecr=2254634033

Frame 50: 68 bytes on wire (544 bits), 68 bytes captured (544 bits)
Linux cooked capture
Internet Protocol Version 4, Src: 2.41.74.123 (2.41.74.123), Dst: 173.194.35.138 (173.194.35.138)
Transmission Control Protocol, Src Port: 34351 (34351), Dst Port: https (443), Seq: 990, Ack: 21832, Len: 0

No.     Time        Source                Destination           Protocol Length Info
     51 1.154552    173.194.35.138        2.41.74.123           TLSv1    1366   Application Data

Frame 51: 1366 bytes on wire (10928 bits), 1366 bytes captured (10928 bits)
Linux cooked capture
Internet Protocol Version 4, Src: 173.194.35.138 (173.194.35.138), Dst: 2.41.74.123 (2.41.74.123)
Transmission Control Protocol, Src Port: https (443), Dst Port: 34351 (34351), Seq: 21832, Ack: 990, Len: 1298
Secure Sockets Layer

No.     Time        Source                Destination           Protocol Length Info
     52 1.154850    2.41.74.123           173.194.35.138        TCP      68     34351 > https [ACK] Seq=990 Ack=23130 Win=42392 Len=0 TSval=122990 TSecr=2254634073

Frame 52: 68 bytes on wire (544 bits), 68 bytes captured (544 bits)
Linux cooked capture
Internet Protocol Version 4, Src: 2.41.74.123 (2.41.74.123), Dst: 173.194.35.138 (173.194.35.138)
Transmission Control Protocol, Src Port: 34351 (34351), Dst Port: https (443), Seq: 990, Ack: 23130, Len: 0

No.     Time        Source                Destination           Protocol Length Info
     53 1.154963    173.194.35.138        2.41.74.123           TLSv1    1366   Application Data

Frame 53: 1366 bytes on wire (10928 bits), 1366 bytes captured (10928 bits)
Linux cooked capture
Internet Protocol Version 4, Src: 173.194.35.138 (173.194.35.138), Dst: 2.41.74.123 (2.41.74.123)
Transmission Control Protocol, Src Port: https (443), Dst Port: 34351 (34351), Seq: 23130, Ack: 990, Len: 1298
Secure Sockets Layer

No.     Time        Source                Destination           Protocol Length Info
     54 1.155410    2.41.74.123           173.194.35.138        TCP      68     34351 > https [ACK] Seq=990 Ack=24428 Win=42140 Len=0 TSval=122990 TSecr=2254634134

Frame 54: 68 bytes on wire (544 bits), 68 bytes captured (544 bits)
Linux cooked capture
Internet Protocol Version 4, Src: 2.41.74.123 (2.41.74.123), Dst: 173.194.35.138 (173.194.35.138)
Transmission Control Protocol, Src Port: 34351 (34351), Dst Port: https (443), Seq: 990, Ack: 24428, Len: 0

No.     Time        Source                Destination           Protocol Length Info
     55 1.164423    173.194.35.138        2.41.74.123           TLSv1    1366   Application Data

Frame 55: 1366 bytes on wire (10928 bits), 1366 bytes captured (10928 bits)
Linux cooked capture
Internet Protocol Version 4, Src: 173.194.35.138 (173.194.35.138), Dst: 2.41.74.123 (2.41.74.123)
Transmission Control Protocol, Src Port: https (443), Dst Port: 34351 (34351), Seq: 24428, Ack: 990, Len: 1298
Secure Sockets Layer

No.     Time        Source                Destination           Protocol Length Info
     56 1.164723    173.194.35.138        2.41.74.123           TLSv1    1366   Application Data

Frame 56: 1366 bytes on wire (10928 bits), 1366 bytes captured (10928 bits)
Linux cooked capture
Internet Protocol Version 4, Src: 173.194.35.138 (173.194.35.138), Dst: 2.41.74.123 (2.41.74.123)
Transmission Control Protocol, Src Port: https (443), Dst Port: 34351 (34351), Seq: 25726, Ack: 990, Len: 1298
Secure Sockets Layer

No.     Time        Source                Destination           Protocol Length Info
     57 1.164950    173.194.35.138        2.41.74.123           TLSv1    184    Application Data

Frame 57: 184 bytes on wire (1472 bits), 184 bytes captured (1472 bits)
Linux cooked capture
Internet Protocol Version 4, Src: 173.194.35.138 (173.194.35.138), Dst: 2.41.74.123 (2.41.74.123)
Transmission Control Protocol, Src Port: https (443), Dst Port: 34351 (34351), Seq: 27024, Ack: 990, Len: 116
Secure Sockets Layer

No.     Time        Source                Destination           Protocol Length Info
     58 1.166360    2.41.74.123           173.194.35.138        TCP      68     34351 > https [ACK] Seq=990 Ack=27140 Win=41180 Len=0 TSval=122991 TSecr=2254634134

Frame 58: 68 bytes on wire (544 bits), 68 bytes captured (544 bits)
Linux cooked capture
Internet Protocol Version 4, Src: 2.41.74.123 (2.41.74.123), Dst: 173.194.35.138 (173.194.35.138)
Transmission Control Protocol, Src Port: 34351 (34351), Dst Port: https (443), Seq: 990, Ack: 27140, Len: 0

No.     Time        Source                Destination           Protocol Length Info
     59 1.200163    2.41.74.123           83.224.70.93          DNS      81     Standard query 0xe210  A cdn.api.twitter.com

Frame 59: 81 bytes on wire (648 bits), 81 bytes captured (648 bits)
Linux cooked capture
Internet Protocol Version 4, Src: 2.41.74.123 (2.41.74.123), Dst: 83.224.70.93 (83.224.70.93)
User Datagram Protocol, Src Port: 59850 (59850), Dst Port: domain (53)
Domain Name System (query)

No.     Time        Source                Destination           Protocol Length Info
     60 1.304058    173.194.35.153        2.41.74.123           TCP      68     http > 57065 [ACK] Seq=1 Ack=1146 Win=257004 Len=0 TSval=163696790 TSecr=122988

Frame 60: 68 bytes on wire (544 bits), 68 bytes captured (544 bits)
Linux cooked capture
Internet Protocol Version 4, Src: 173.194.35.153 (173.194.35.153), Dst: 2.41.74.123 (2.41.74.123)
Transmission Control Protocol, Src Port: http (80), Dst Port: 57065 (57065), Seq: 1, Ack: 1146, Len: 0

No.     Time        Source                Destination           Protocol Length Info
     61 1.304378    173.194.35.153        2.41.74.123           HTTP     736    HTTP/1.1 200 OK  (PNG)

Frame 61: 736 bytes on wire (5888 bits), 736 bytes captured (5888 bits)
Linux cooked capture
Internet Protocol Version 4, Src: 173.194.35.153 (173.194.35.153), Dst: 2.41.74.123 (2.41.74.123)
Transmission Control Protocol, Src Port: http (80), Dst Port: 57065 (57065), Seq: 1, Ack: 1146, Len: 668
Hypertext Transfer Protocol
Portable Network Graphics

No.     Time        Source                Destination           Protocol Length Info
     62 1.304625    2.41.74.123           173.194.35.153        TCP      68     57065 > http [ACK] Seq=1146 Ack=669 Win=7836 Len=0 TSval=123005 TSecr=163696790

Frame 62: 68 bytes on wire (544 bits), 68 bytes captured (544 bits)
Linux cooked capture
Internet Protocol Version 4, Src: 2.41.74.123 (2.41.74.123), Dst: 173.194.35.153 (173.194.35.153)
Transmission Control Protocol, Src Port: 57065 (57065), Dst Port: http (80), Seq: 1146, Ack: 669, Len: 0

No.     Time        Source                Destination           Protocol Length Info
     63 1.324035    83.224.70.93          2.41.74.123           DNS      136    Standard query response 0xe210  CNAME cs107.wac.edgecastcdn.net A 68.232.35.139

Frame 63: 136 bytes on wire (1088 bits), 136 bytes captured (1088 bits)
Linux cooked capture
Internet Protocol Version 4, Src: 83.224.70.93 (83.224.70.93), Dst: 2.41.74.123 (2.41.74.123)
User Datagram Protocol, Src Port: domain (53), Dst Port: 59850 (59850)
Domain Name System (response)

No.     Time        Source                Destination           Protocol Length Info
     64 1.325258    2.41.74.123           68.232.35.139         TCP      76     54768 > http [SYN] Seq=0 Win=5240 Len=0 MSS=1310 SACK_PERM=1 TSval=123007 TSecr=0 WS=4

Frame 64: 76 bytes on wire (608 bits), 76 bytes captured (608 bits)
Linux cooked capture
Internet Protocol Version 4, Src: 2.41.74.123 (2.41.74.123), Dst: 68.232.35.139 (68.232.35.139)
Transmission Control Protocol, Src Port: 54768 (54768), Dst Port: http (80), Seq: 0, Len: 0

No.     Time        Source                Destination           Protocol Length Info
     65 1.413927    68.232.35.139         2.41.74.123           TCP      80     http > 54768 [SYN, ACK] Seq=0 Ack=1 Win=64251 Len=0 TSval=163696801 TSecr=123007 MSS=1400 WS=4 SACK_PERM=1

Frame 65: 80 bytes on wire (640 bits), 80 bytes captured (640 bits)
Linux cooked capture
Internet Protocol Version 4, Src: 68.232.35.139 (68.232.35.139), Dst: 2.41.74.123 (2.41.74.123)
Transmission Control Protocol, Src Port: http (80), Dst Port: 54768 (54768), Seq: 0, Ack: 1, Len: 0

No.     Time        Source                Destination           Protocol Length Info
     66 1.414195    2.41.74.123           68.232.35.139         TCP      68     54768 > http [ACK] Seq=1 Ack=1 Win=5240 Len=0 TSval=123016 TSecr=163696801

Frame 66: 68 bytes on wire (544 bits), 68 bytes captured (544 bits)
Linux cooked capture
Internet Protocol Version 4, Src: 2.41.74.123 (2.41.74.123), Dst: 68.232.35.139 (68.232.35.139)
Transmission Control Protocol, Src Port: 54768 (54768), Dst Port: http (80), Seq: 1, Ack: 1, Len: 0

No.     Time        Source                Destination           Protocol Length Info
     67 1.428837    2.41.74.123           68.232.35.139         HTTP     1040   GET /1/urls/count.json?url=http%3A%2F%2Fwww.whatip.com&callback=twttr.receiveCount HTTP/1.1 

Frame 67: 1040 bytes on wire (8320 bits), 1040 bytes captured (8320 bits)
Linux cooked capture
Internet Protocol Version 4, Src: 2.41.74.123 (2.41.74.123), Dst: 68.232.35.139 (68.232.35.139)
Transmission Control Protocol, Src Port: 54768 (54768), Dst Port: http (80), Seq: 1, Ack: 1, Len: 972
Hypertext Transfer Protocol

No.     Time        Source                Destination           Protocol Length Info
     68 1.584047    68.232.35.139         2.41.74.123           TCP      68     http > 54768 [ACK] Seq=1 Ack=973 Win=257004 Len=0 TSval=163696818 TSecr=123018

Frame 68: 68 bytes on wire (544 bits), 68 bytes captured (544 bits)
Linux cooked capture
Internet Protocol Version 4, Src: 68.232.35.139 (68.232.35.139), Dst: 2.41.74.123 (2.41.74.123)
Transmission Control Protocol, Src Port: http (80), Dst Port: 54768 (54768), Seq: 1, Ack: 973, Len: 0

No.     Time        Source                Destination           Protocol Length Info
     69 1.764078    68.232.35.139         2.41.74.123           HTTP     490    HTTP/1.1 200 OK  (application/javascript)

Frame 69: 490 bytes on wire (3920 bits), 490 bytes captured (3920 bits)
Linux cooked capture
Internet Protocol Version 4, Src: 68.232.35.139 (68.232.35.139), Dst: 2.41.74.123 (2.41.74.123)
Transmission Control Protocol, Src Port: http (80), Dst Port: 54768 (54768), Seq: 1, Ack: 973, Len: 422
Hypertext Transfer Protocol
Media Type

No.     Time        Source                Destination           Protocol Length Info
     70 1.764422    2.41.74.123           68.232.35.139         TCP      68     54768 > http [ACK] Seq=973 Ack=423 Win=7836 Len=0 TSval=123051 TSecr=163696836

Frame 70: 68 bytes on wire (544 bits), 68 bytes captured (544 bits)
Linux cooked capture
Internet Protocol Version 4, Src: 2.41.74.123 (2.41.74.123), Dst: 68.232.35.139 (68.232.35.139)
Transmission Control Protocol, Src Port: 54768 (54768), Dst Port: http (80), Seq: 973, Ack: 423, Len: 0

No.     Time        Source                Destination           Protocol Length Info
     71 1.969587    2.41.74.123           83.224.70.93          DNS      77     Standard query 0x5ee2  A csi.gstatic.com

Frame 71: 77 bytes on wire (616 bits), 77 bytes captured (616 bits)
Linux cooked capture
Internet Protocol Version 4, Src: 2.41.74.123 (2.41.74.123), Dst: 83.224.70.93 (83.224.70.93)
User Datagram Protocol, Src Port: 25233 (25233), Dst Port: domain (53)
Domain Name System (query)

No.     Time        Source                Destination           Protocol Length Info
     72 2.063925    83.224.70.93          2.41.74.123           DNS      93     Standard query response 0x5ee2  A 74.125.21.120

Frame 72: 93 bytes on wire (744 bits), 93 bytes captured (744 bits)
Linux cooked capture
Internet Protocol Version 4, Src: 83.224.70.93 (83.224.70.93), Dst: 2.41.74.123 (2.41.74.123)
User Datagram Protocol, Src Port: domain (53), Dst Port: 25233 (25233)
Domain Name System (response)

No.     Time        Source                Destination           Protocol Length Info
     73 2.065213    2.41.74.123           74.125.21.120         TCP      76     37961 > http [SYN] Seq=0 Win=5240 Len=0 MSS=1310 SACK_PERM=1 TSval=123081 TSecr=0 WS=4

Frame 73: 76 bytes on wire (608 bits), 76 bytes captured (608 bits)
Linux cooked capture
Internet Protocol Version 4, Src: 2.41.74.123 (2.41.74.123), Dst: 74.125.21.120 (74.125.21.120)
Transmission Control Protocol, Src Port: 37961 (37961), Dst Port: http (80), Seq: 0, Len: 0

No.     Time        Source                Destination           Protocol Length Info
     74 2.164022    74.125.21.120         2.41.74.123           TCP      80     http > 37961 [SYN, ACK] Seq=0 Ack=1 Win=64251 Len=0 TSval=163696876 TSecr=123081 MSS=1400 WS=4 SACK_PERM=1

Frame 74: 80 bytes on wire (640 bits), 80 bytes captured (640 bits)
Linux cooked capture
Internet Protocol Version 4, Src: 74.125.21.120 (74.125.21.120), Dst: 2.41.74.123 (2.41.74.123)
Transmission Control Protocol, Src Port: http (80), Dst Port: 37961 (37961), Seq: 0, Ack: 1, Len: 0

No.     Time        Source                Destination           Protocol Length Info
     75 2.164342    2.41.74.123           74.125.21.120         TCP      68     37961 > http [ACK] Seq=1 Ack=1 Win=5240 Len=0 TSval=123091 TSecr=163696876

Frame 75: 68 bytes on wire (544 bits), 68 bytes captured (544 bits)
Linux cooked capture
Internet Protocol Version 4, Src: 2.41.74.123 (2.41.74.123), Dst: 74.125.21.120 (74.125.21.120)
Transmission Control Protocol, Src Port: 37961 (37961), Dst Port: http (80), Seq: 1, Ack: 1, Len: 0

No.     Time        Source                Destination           Protocol Length Info
     76 2.171532    2.41.74.123           74.125.21.120         HTTP     1176   GET /csi?v=3&s=gmob&action=&rt=crf.6749,cri.7896 HTTP/1.1 

Frame 76: 1176 bytes on wire (9408 bits), 1176 bytes captured (9408 bits)
Linux cooked capture
Internet Protocol Version 4, Src: 2.41.74.123 (2.41.74.123), Dst: 74.125.21.120 (74.125.21.120)
Transmission Control Protocol, Src Port: 37961 (37961), Dst Port: http (80), Seq: 1, Ack: 1, Len: 1108
Hypertext Transfer Protocol

No.     Time        Source                Destination           Protocol Length Info
     77 2.344090    74.125.21.120         2.41.74.123           TCP      68     http > 37961 [ACK] Seq=1 Ack=1109 Win=257004 Len=0 TSval=163696894 TSecr=123092

Frame 77: 68 bytes on wire (544 bits), 68 bytes captured (544 bits)
Linux cooked capture
Internet Protocol Version 4, Src: 74.125.21.120 (74.125.21.120), Dst: 2.41.74.123 (2.41.74.123)
Transmission Control Protocol, Src Port: http (80), Dst Port: 37961 (37961), Seq: 1, Ack: 1109, Len: 0

No.     Time        Source                Destination           Protocol Length Info
     78 2.574150    74.125.21.120         2.41.74.123           HTTP     443    HTTP/1.1 204 No Content 

Frame 78: 443 bytes on wire (3544 bits), 443 bytes captured (3544 bits)
Linux cooked capture
Internet Protocol Version 4, Src: 74.125.21.120 (74.125.21.120), Dst: 2.41.74.123 (2.41.74.123)
Transmission Control Protocol, Src Port: http (80), Dst Port: 37961 (37961), Seq: 1, Ack: 1109, Len: 375
Hypertext Transfer Protocol

No.     Time        Source                Destination           Protocol Length Info
     79 2.574538    2.41.74.123           74.125.21.120         TCP      68     37961 > http [ACK] Seq=1109 Ack=376 Win=7836 Len=0 TSval=123132 TSecr=163696917

Frame 79: 68 bytes on wire (544 bits), 68 bytes captured (544 bits)
Linux cooked capture
Internet Protocol Version 4, Src: 2.41.74.123 (2.41.74.123), Dst: 74.125.21.120 (74.125.21.120)
Transmission Control Protocol, Src Port: 37961 (37961), Dst Port: http (80), Seq: 1109, Ack: 376, Len: 0

No.     Time        Source                Destination           Protocol Length Info
     80 2.607123    2.41.74.123           173.194.70.95         TCP      68     40211 > https [FIN, ACK] Seq=1 Ack=1 Win=3906 Len=0 TSval=123136 TSecr=1007564961

Frame 80: 68 bytes on wire (544 bits), 68 bytes captured (544 bits)
Linux cooked capture
Internet Protocol Version 4, Src: 2.41.74.123 (2.41.74.123), Dst: 173.194.70.95 (173.194.70.95)
Transmission Control Protocol, Src Port: 40211 (40211), Dst Port: https (443), Seq: 1, Ack: 1, Len: 0

No.     Time        Source                Destination           Protocol Length Info
     81 2.878357    2.41.74.123           173.194.40.112        TCP      68     50242 > http [FIN, ACK] Seq=1 Ack=1 Win=10396 Len=0 TSval=123163 TSecr=162997415

Frame 81: 68 bytes on wire (544 bits), 68 bytes captured (544 bits)
Linux cooked capture
Internet Protocol Version 4, Src: 2.41.74.123 (2.41.74.123), Dst: 173.194.40.112 (173.194.40.112)
Transmission Control Protocol, Src Port: 50242 (50242), Dst Port: http (80), Seq: 1, Ack: 1, Len: 0

No.     Time        Source                Destination           Protocol Length Info
     82 3.707283    2.41.74.123           173.194.35.154        TCP      68     47134 > http [FIN, ACK] Seq=1 Ack=1 Win=10396 Len=0 TSval=123246 TSecr=163696084

Frame 82: 68 bytes on wire (544 bits), 68 bytes captured (544 bits)
Linux cooked capture
Internet Protocol Version 4, Src: 2.41.74.123 (2.41.74.123), Dst: 173.194.35.154 (173.194.35.154)
Transmission Control Protocol, Src Port: 47134 (47134), Dst Port: http (80), Seq: 1, Ack: 1, Len: 0

No.     Time        Source                Destination           Protocol Length Info
     83 3.793940    173.194.35.154        2.41.74.123           TCP      68     http > 47134 [ACK] Seq=1 Ack=2 Win=64251 Len=0 TSval=163697040 TSecr=123246

Frame 83: 68 bytes on wire (544 bits), 68 bytes captured (544 bits)
Linux cooked capture
Internet Protocol Version 4, Src: 173.194.35.154 (173.194.35.154), Dst: 2.41.74.123 (2.41.74.123)
Transmission Control Protocol, Src Port: http (80), Dst Port: 47134 (47134), Seq: 1, Ack: 2, Len: 0

No.     Time        Source                Destination           Protocol Length Info
     84 3.794278    173.194.35.154        2.41.74.123           TCP      68     http > 47134 [FIN, ACK] Seq=1 Ack=2 Win=64251 Len=0 TSval=163697040 TSecr=123246

Frame 84: 68 bytes on wire (544 bits), 68 bytes captured (544 bits)
Linux cooked capture
Internet Protocol Version 4, Src: 173.194.35.154 (173.194.35.154), Dst: 2.41.74.123 (2.41.74.123)
Transmission Control Protocol, Src Port: http (80), Dst Port: 47134 (47134), Seq: 1, Ack: 2, Len: 0

No.     Time        Source                Destination           Protocol Length Info
     85 3.794385    2.41.74.123           173.194.35.154        TCP      68     47134 > http [ACK] Seq=2 Ack=2 Win=10396 Len=0 TSval=123254 TSecr=163697040

Frame 85: 68 bytes on wire (544 bits), 68 bytes captured (544 bits)
Linux cooked capture
Internet Protocol Version 4, Src: 2.41.74.123 (2.41.74.123), Dst: 173.194.35.154 (173.194.35.154)
Transmission Control Protocol, Src Port: 47134 (47134), Dst Port: http (80), Seq: 2, Ack: 2, Len: 0

No.     Time        Source                Destination           Protocol Length Info
     86 5.184810    2.41.74.123           74.125.21.120         HTTP     1202   GET /csi?v=3&s=gmob&action=&rt=crf.7305,cri.11095 HTTP/1.1 

Frame 86: 1202 bytes on wire (9616 bits), 1202 bytes captured (9616 bits)
Linux cooked capture
Internet Protocol Version 4, Src: 2.41.74.123 (2.41.74.123), Dst: 74.125.21.120 (74.125.21.120)
Transmission Control Protocol, Src Port: 37961 (37961), Dst Port: http (80), Seq: 1109, Ack: 376, Len: 1134
Hypertext Transfer Protocol

No.     Time        Source                Destination           Protocol Length Info
     87 5.344023    74.125.21.120         2.41.74.123           TCP      68     http > 37961 [ACK] Seq=376 Ack=2243 Win=257004 Len=0 TSval=163697194 TSecr=123393

Frame 87: 68 bytes on wire (544 bits), 68 bytes captured (544 bits)
Linux cooked capture
Internet Protocol Version 4, Src: 74.125.21.120 (74.125.21.120), Dst: 2.41.74.123 (2.41.74.123)
Transmission Control Protocol, Src Port: http (80), Dst Port: 37961 (37961), Seq: 376, Ack: 2243, Len: 0

No.     Time        Source                Destination           Protocol Length Info
     88 5.454007    74.125.21.120         2.41.74.123           HTTP     443    HTTP/1.1 204 No Content 

Frame 88: 443 bytes on wire (3544 bits), 443 bytes captured (3544 bits)
Linux cooked capture
Internet Protocol Version 4, Src: 74.125.21.120 (74.125.21.120), Dst: 2.41.74.123 (2.41.74.123)
Transmission Control Protocol, Src Port: http (80), Dst Port: 37961 (37961), Seq: 376, Ack: 2243, Len: 375
Hypertext Transfer Protocol

No.     Time        Source                Destination           Protocol Length Info
     89 5.454360    2.41.74.123           74.125.21.120         TCP      68     37961 > http [ACK] Seq=2243 Ack=751 Win=10432 Len=0 TSval=123420 TSecr=163697206

Frame 89: 68 bytes on wire (544 bits), 68 bytes captured (544 bits)
Linux cooked capture
Internet Protocol Version 4, Src: 2.41.74.123 (2.41.74.123), Dst: 74.125.21.120 (74.125.21.120)
Transmission Control Protocol, Src Port: 37961 (37961), Dst Port: http (80), Seq: 2243, Ack: 751, Len: 0

No.     Time        Source                Destination           Protocol Length Info
     90 5.717563    2.41.74.123           199.16.156.230        TLSv1    95     Encrypted Alert

Frame 90: 95 bytes on wire (760 bits), 95 bytes captured (760 bits)
Linux cooked capture
Internet Protocol Version 4, Src: 2.41.74.123 (2.41.74.123), Dst: 199.16.156.230 (199.16.156.230)
Transmission Control Protocol, Src Port: 50136 (50136), Dst Port: https (443), Seq: 1, Ack: 1, Len: 27
Secure Sockets Layer

No.     Time        Source                Destination           Protocol Length Info
     91 5.718907    2.41.74.123           199.16.156.230        TCP      68     50136 > https [FIN, ACK] Seq=28 Ack=1 Win=3906 Len=0 TSval=123447 TSecr=148275333

Frame 91: 68 bytes on wire (544 bits), 68 bytes captured (544 bits)
Linux cooked capture
Internet Protocol Version 4, Src: 2.41.74.123 (2.41.74.123), Dst: 199.16.156.230 (199.16.156.230)
Transmission Control Protocol, Src Port: 50136 (50136), Dst Port: https (443), Seq: 28, Ack: 1, Len: 0

No.     Time        Source                Destination           Protocol Length Info
     92 5.924018    199.16.156.230        2.41.74.123           TLSv1    95     Encrypted Alert

Frame 92: 95 bytes on wire (760 bits), 95 bytes captured (760 bits)
Linux cooked capture
Internet Protocol Version 4, Src: 199.16.156.230 (199.16.156.230), Dst: 2.41.74.123 (2.41.74.123)
Transmission Control Protocol, Src Port: https (443), Dst Port: 50136 (50136), Seq: 1, Ack: 29, Len: 27
Secure Sockets Layer

No.     Time        Source                Destination           Protocol Length Info
     93 5.924368    2.41.74.123           199.16.156.230        TCP      56     50136 > https [RST] Seq=29 Win=0 Len=0

Frame 93: 56 bytes on wire (448 bits), 56 bytes captured (448 bits)
Linux cooked capture
Internet Protocol Version 4, Src: 2.41.74.123 (2.41.74.123), Dst: 199.16.156.230 (199.16.156.230)
Transmission Control Protocol, Src Port: 50136 (50136), Dst Port: https (443), Seq: 29, Len: 0

No.     Time        Source                Destination           Protocol Length Info
     94 5.924453    199.16.156.230        2.41.74.123           TCP      68     https > 50136 [FIN, ACK] Seq=28 Ack=29 Win=71 Len=0 TSval=148283125 TSecr=123447

Frame 94: 68 bytes on wire (544 bits), 68 bytes captured (544 bits)
Linux cooked capture
Internet Protocol Version 4, Src: 199.16.156.230 (199.16.156.230), Dst: 2.41.74.123 (2.41.74.123)
Transmission Control Protocol, Src Port: https (443), Dst Port: 50136 (50136), Seq: 28, Ack: 29, Len: 0

No.     Time        Source                Destination           Protocol Length Info
     95 5.924677    2.41.74.123           199.16.156.230        TCP      56     50136 > https [RST] Seq=29 Win=0 Len=0

Frame 95: 56 bytes on wire (448 bits), 56 bytes captured (448 bits)
Linux cooked capture
Internet Protocol Version 4, Src: 2.41.74.123 (2.41.74.123), Dst: 199.16.156.230 (199.16.156.230)
Transmission Control Protocol, Src Port: 50136 (50136), Dst Port: https (443), Seq: 29, Len: 0

No.     Time        Source                Destination           Protocol Length Info
     96 6.167077    2.41.74.123           173.194.35.132        TCP      68     45399 > https [FIN, ACK] Seq=1 Ack=1 Win=5204 Len=0 TSval=123492 TSecr=2247887422

Frame 96: 68 bytes on wire (544 bits), 68 bytes captured (544 bits)
Linux cooked capture
Internet Protocol Version 4, Src: 2.41.74.123 (2.41.74.123), Dst: 173.194.35.132 (173.194.35.132)
Transmission Control Protocol, Src Port: 45399 (45399), Dst Port: https (443), Seq: 1, Ack: 1, Len: 0

No.     Time        Source                Destination           Protocol Length Info
     97 7.719702    2.41.74.123           173.194.35.138        TLSv1    95     Encrypted Alert

Frame 97: 95 bytes on wire (760 bits), 95 bytes captured (760 bits)
Linux cooked capture
Internet Protocol Version 4, Src: 2.41.74.123 (2.41.74.123), Dst: 173.194.35.138 (173.194.35.138)
Transmission Control Protocol, Src Port: 34351 (34351), Dst Port: https (443), Seq: 990, Ack: 27140, Len: 27
Secure Sockets Layer

No.     Time        Source                Destination           Protocol Length Info
     98 7.720388    2.41.74.123           173.194.35.138        TCP      68     34351 > https [FIN, ACK] Seq=1017 Ack=27140 Win=42392 Len=0 TSval=123647 TSecr=2254634134

Frame 98: 68 bytes on wire (544 bits), 68 bytes captured (544 bits)
Linux cooked capture
Internet Protocol Version 4, Src: 2.41.74.123 (2.41.74.123), Dst: 173.194.35.138 (173.194.35.138)
Transmission Control Protocol, Src Port: 34351 (34351), Dst Port: https (443), Seq: 1017, Ack: 27140, Len: 0

No.     Time        Source                Destination           Protocol Length Info
     99 7.720643    2.41.74.123           173.194.35.153        TCP      68     57065 > http [FIN, ACK] Seq=1146 Ack=669 Win=7836 Len=0 TSval=123647 TSecr=163696790

Frame 99: 68 bytes on wire (544 bits), 68 bytes captured (544 bits)
Linux cooked capture
Internet Protocol Version 4, Src: 2.41.74.123 (2.41.74.123), Dst: 173.194.35.153 (173.194.35.153)
Transmission Control Protocol, Src Port: 57065 (57065), Dst Port: http (80), Seq: 1146, Ack: 669, Len: 0

No.     Time        Source                Destination           Protocol Length Info
    100 7.814045    173.194.35.153        2.41.74.123           TCP      68     http > 57065 [ACK] Seq=669 Ack=1147 Win=257004 Len=0 TSval=163697442 TSecr=123647

Frame 100: 68 bytes on wire (544 bits), 68 bytes captured (544 bits)
Linux cooked capture
Internet Protocol Version 4, Src: 173.194.35.153 (173.194.35.153), Dst: 2.41.74.123 (2.41.74.123)
Transmission Control Protocol, Src Port: http (80), Dst Port: 57065 (57065), Seq: 669, Ack: 1147, Len: 0

No.     Time        Source                Destination           Protocol Length Info
    101 7.814453    173.194.35.153        2.41.74.123           TCP      68     http > 57065 [FIN, ACK] Seq=669 Ack=1147 Win=257004 Len=0 TSval=163697442 TSecr=123647

Frame 101: 68 bytes on wire (544 bits), 68 bytes captured (544 bits)
Linux cooked capture
Internet Protocol Version 4, Src: 173.194.35.153 (173.194.35.153), Dst: 2.41.74.123 (2.41.74.123)
Transmission Control Protocol, Src Port: http (80), Dst Port: 57065 (57065), Seq: 669, Ack: 1147, Len: 0

No.     Time        Source                Destination           Protocol Length Info
    102 7.814637    2.41.74.123           173.194.35.153        TCP      68     57065 > http [ACK] Seq=1147 Ack=670 Win=7836 Len=0 TSval=123656 TSecr=163697442

Frame 102: 68 bytes on wire (544 bits), 68 bytes captured (544 bits)
Linux cooked capture
Internet Protocol Version 4, Src: 2.41.74.123 (2.41.74.123), Dst: 173.194.35.153 (173.194.35.153)
Transmission Control Protocol, Src Port: 57065 (57065), Dst Port: http (80), Seq: 1147, Ack: 670, Len: 0

No.     Time        Source                Destination           Protocol Length Info
    103 7.824068    173.194.35.138        2.41.74.123           TCP      68     https > 34351 [FIN, ACK] Seq=27140 Ack=1018 Win=42880 Len=0 TSval=2254640815 TSecr=123647

Frame 103: 68 bytes on wire (544 bits), 68 bytes captured (544 bits)
Linux cooked capture
Internet Protocol Version 4, Src: 173.194.35.138 (173.194.35.138), Dst: 2.41.74.123 (2.41.74.123)
Transmission Control Protocol, Src Port: https (443), Dst Port: 34351 (34351), Seq: 27140, Ack: 1018, Len: 0

No.     Time        Source                Destination           Protocol Length Info
    104 7.824293    2.41.74.123           173.194.35.138        TCP      68     34351 > https [ACK] Seq=1018 Ack=27141 Win=42392 Len=0 TSval=123657 TSecr=2254640815

Frame 104: 68 bytes on wire (544 bits), 68 bytes captured (544 bits)
Linux cooked capture
Internet Protocol Version 4, Src: 2.41.74.123 (2.41.74.123), Dst: 173.194.35.138 (173.194.35.138)
Transmission Control Protocol, Src Port: 34351 (34351), Dst Port: https (443), Seq: 1018, Ack: 27141, Len: 0

No.     Time        Source                Destination           Protocol Length Info
    105 8.827154    2.41.74.123           173.194.70.95         TCP      68     40211 > https [FIN, ACK] Seq=1 Ack=1 Win=3906 Len=0 TSval=123758 TSecr=1007564961

Frame 105: 68 bytes on wire (544 bits), 68 bytes captured (544 bits)
Linux cooked capture
Internet Protocol Version 4, Src: 2.41.74.123 (2.41.74.123), Dst: 173.194.70.95 (173.194.70.95)
Transmission Control Protocol, Src Port: 40211 (40211), Dst Port: https (443), Seq: 1, Ack: 1, Len: 0

No.     Time        Source                Destination           Protocol Length Info
    106 9.721288    2.41.74.123           68.232.35.139         TCP      68     54768 > http [FIN, ACK] Seq=973 Ack=423 Win=7836 Len=0 TSval=123847 TSecr=163696836

Frame 106: 68 bytes on wire (544 bits), 68 bytes captured (544 bits)
Linux cooked capture
Internet Protocol Version 4, Src: 2.41.74.123 (2.41.74.123), Dst: 68.232.35.139 (68.232.35.139)
Transmission Control Protocol, Src Port: 54768 (54768), Dst Port: http (80), Seq: 973, Ack: 423, Len: 0

No.     Time        Source                Destination           Protocol Length Info
    107 9.787120    2.41.74.123           173.194.40.112        TCP      68     50242 > http [FIN, ACK] Seq=1 Ack=1 Win=10396 Len=0 TSval=123854 TSecr=162997415

Frame 107: 68 bytes on wire (544 bits), 68 bytes captured (544 bits)
Linux cooked capture
Internet Protocol Version 4, Src: 2.41.74.123 (2.41.74.123), Dst: 173.194.40.112 (173.194.40.112)
Transmission Control Protocol, Src Port: 50242 (50242), Dst Port: http (80), Seq: 1, Ack: 1, Len: 0

No.     Time        Source                Destination           Protocol Length Info
    108 9.803990    68.232.35.139         2.41.74.123           TCP      68     http > 54768 [ACK] Seq=423 Ack=974 Win=257004 Len=0 TSval=163697641 TSecr=123847

Frame 108: 68 bytes on wire (544 bits), 68 bytes captured (544 bits)
Linux cooked capture
Internet Protocol Version 4, Src: 68.232.35.139 (68.232.35.139), Dst: 2.41.74.123 (2.41.74.123)
Transmission Control Protocol, Src Port: http (80), Dst Port: 54768 (54768), Seq: 423, Ack: 974, Len: 0

No.     Time        Source                Destination           Protocol Length Info
    109 9.804348    68.232.35.139         2.41.74.123           TCP      68     http > 54768 [FIN, ACK] Seq=423 Ack=974 Win=257004 Len=0 TSval=163697641 TSecr=123847

Frame 109: 68 bytes on wire (544 bits), 68 bytes captured (544 bits)
Linux cooked capture
Internet Protocol Version 4, Src: 68.232.35.139 (68.232.35.139), Dst: 2.41.74.123 (2.41.74.123)
Transmission Control Protocol, Src Port: http (80), Dst Port: 54768 (54768), Seq: 423, Ack: 974, Len: 0

No.     Time        Source                Destination           Protocol Length Info
    110 9.804520    2.41.74.123           68.232.35.139         TCP      68     54768 > http [ACK] Seq=974 Ack=424 Win=7836 Len=0 TSval=123855 TSecr=163697641

Frame 110: 68 bytes on wire (544 bits), 68 bytes captured (544 bits)
Linux cooked capture
Internet Protocol Version 4, Src: 2.41.74.123 (2.41.74.123), Dst: 68.232.35.139 (68.232.35.139)
Transmission Control Protocol, Src Port: 54768 (54768), Dst Port: http (80), Seq: 974, Ack: 424, Len: 0

No.     Time        Source                Destination           Protocol Length Info
    111 11.722352   2.41.74.123           74.125.21.120         TCP      68     37961 > http [FIN, ACK] Seq=2243 Ack=751 Win=10432 Len=0 TSval=124047 TSecr=163697206

Frame 111: 68 bytes on wire (544 bits), 68 bytes captured (544 bits)
Linux cooked capture
Internet Protocol Version 4, Src: 2.41.74.123 (2.41.74.123), Dst: 74.125.21.120 (74.125.21.120)
Transmission Control Protocol, Src Port: 37961 (37961), Dst Port: http (80), Seq: 2243, Ack: 751, Len: 0

No.     Time        Source                Destination           Protocol Length Info
    112 11.813953   74.125.21.120         2.41.74.123           TCP      68     http > 37961 [ACK] Seq=751 Ack=2244 Win=257004 Len=0 TSval=163697841 TSecr=124047

Frame 112: 68 bytes on wire (544 bits), 68 bytes captured (544 bits)
Linux cooked capture
Internet Protocol Version 4, Src: 74.125.21.120 (74.125.21.120), Dst: 2.41.74.123 (2.41.74.123)
Transmission Control Protocol, Src Port: http (80), Dst Port: 37961 (37961), Seq: 751, Ack: 2244, Len: 0

No.     Time        Source                Destination           Protocol Length Info
    113 11.814347   74.125.21.120         2.41.74.123           TCP      68     http > 37961 [FIN, ACK] Seq=751 Ack=2244 Win=257004 Len=0 TSval=163697841 TSecr=124047

Frame 113: 68 bytes on wire (544 bits), 68 bytes captured (544 bits)
Linux cooked capture
Internet Protocol Version 4, Src: 74.125.21.120 (74.125.21.120), Dst: 2.41.74.123 (2.41.74.123)
Transmission Control Protocol, Src Port: http (80), Dst Port: 37961 (37961), Seq: 751, Ack: 2244, Len: 0

No.     Time        Source                Destination           Protocol Length Info
    114 11.814538   2.41.74.123           74.125.21.120         TCP      68     37961 > http [ACK] Seq=2244 Ack=752 Win=10432 Len=0 TSval=124056 TSecr=163697841

Frame 114: 68 bytes on wire (544 bits), 68 bytes captured (544 bits)
Linux cooked capture
Internet Protocol Version 4, Src: 2.41.74.123 (2.41.74.123), Dst: 74.125.21.120 (74.125.21.120)
Transmission Control Protocol, Src Port: 37961 (37961), Dst Port: http (80), Seq: 2244, Ack: 752, Len: 0

No.     Time        Source                Destination           Protocol Length Info
    115 17.127093   2.41.74.123           173.194.35.132        TCP      68     45399 > https [FIN, ACK] Seq=1 Ack=1 Win=5204 Len=0 TSval=124588 TSecr=2247887422

Frame 115: 68 bytes on wire (544 bits), 68 bytes captured (544 bits)
Linux cooked capture
Internet Protocol Version 4, Src: 2.41.74.123 (2.41.74.123), Dst: 173.194.35.132 (173.194.35.132)
Transmission Control Protocol, Src Port: 45399 (45399), Dst Port: https (443), Seq: 1, Ack: 1, Len: 0

No.     Time        Source                Destination           Protocol Length Info
    116 17.716278   2.41.74.123           50.22.225.73          SSL      97     Continuation Data

Frame 116: 97 bytes on wire (776 bits), 97 bytes captured (776 bits)
Linux cooked capture
Internet Protocol Version 4, Src: 2.41.74.123 (2.41.74.123), Dst: 50.22.225.73 (50.22.225.73)
Transmission Control Protocol, Src Port: 42304 (42304), Dst Port: https (443), Seq: 1, Ack: 1, Len: 29
Secure Sockets Layer

No.     Time        Source                Destination           Protocol Length Info
    117 18.657183   50.22.225.73          2.41.74.123           TCP      68     https > 42304 [ACK] Seq=1 Ack=30 Win=512 Len=0 TSval=3869409844 TSecr=124646

Frame 117: 68 bytes on wire (544 bits), 68 bytes captured (544 bits)
Linux cooked capture
Internet Protocol Version 4, Src: 50.22.225.73 (50.22.225.73), Dst: 2.41.74.123 (2.41.74.123)
Transmission Control Protocol, Src Port: https (443), Dst Port: 42304 (42304), Seq: 1, Ack: 30, Len: 0

No.     Time        Source                Destination           Protocol Length Info
    118 18.657538   2.41.74.123           50.22.225.73          SSL      109    Continuation Data

Frame 118: 109 bytes on wire (872 bits), 109 bytes captured (872 bits)
Linux cooked capture
Internet Protocol Version 4, Src: 2.41.74.123 (2.41.74.123), Dst: 50.22.225.73 (50.22.225.73)
Transmission Control Protocol, Src Port: 42304 (42304), Dst Port: https (443), Seq: 30, Ack: 1, Len: 41
Secure Sockets Layer

No.     Time        Source                Destination           Protocol Length Info
    119 18.937143   50.22.225.73          2.41.74.123           SSL      114    Continuation Data

Frame 119: 114 bytes on wire (912 bits), 114 bytes captured (912 bits)
Linux cooked capture
Internet Protocol Version 4, Src: 50.22.225.73 (50.22.225.73), Dst: 2.41.74.123 (2.41.74.123)
Transmission Control Protocol, Src Port: https (443), Dst Port: 42304 (42304), Seq: 1, Ack: 71, Len: 46
Secure Sockets Layer

No.     Time        Source                Destination           Protocol Length Info
    120 18.940337   2.41.74.123           50.22.225.73          TCP      68     42304 > https [ACK] Seq=71 Ack=47 Win=7574 Len=0 TSval=124769 TSecr=3869410120

Frame 120: 68 bytes on wire (544 bits), 68 bytes captured (544 bits)
Linux cooked capture
Internet Protocol Version 4, Src: 2.41.74.123 (2.41.74.123), Dst: 50.22.225.73 (50.22.225.73)
Transmission Control Protocol, Src Port: 42304 (42304), Dst Port: https (443), Seq: 71, Ack: 47, Len: 0

No.     Time        Source                Destination           Protocol Length Info
    121 20.866092   2.41.74.123           50.22.225.73          SSL      80     Continuation Data

Frame 121: 80 bytes on wire (640 bits), 80 bytes captured (640 bits)
Linux cooked capture
Internet Protocol Version 4, Src: 2.41.74.123 (2.41.74.123), Dst: 50.22.225.73 (50.22.225.73)
Transmission Control Protocol, Src Port: 42304 (42304), Dst Port: https (443), Seq: 71, Ack: 47, Len: 12
Secure Sockets Layer

No.     Time        Source                Destination           Protocol Length Info
    122 21.077122   50.22.225.73          2.41.74.123           SSL      95     Continuation Data

Frame 122: 95 bytes on wire (760 bits), 95 bytes captured (760 bits)
Linux cooked capture
Internet Protocol Version 4, Src: 50.22.225.73 (50.22.225.73), Dst: 2.41.74.123 (2.41.74.123)
Transmission Control Protocol, Src Port: https (443), Dst Port: 42304 (42304), Seq: 47, Ack: 83, Len: 27
Secure Sockets Layer

No.     Time        Source                Destination           Protocol Length Info
    123 21.077685   2.41.74.123           50.22.225.73          SSL      150    Continuation Data

Frame 123: 150 bytes on wire (1200 bits), 150 bytes captured (1200 bits)
Linux cooked capture
Internet Protocol Version 4, Src: 2.41.74.123 (2.41.74.123), Dst: 50.22.225.73 (50.22.225.73)
Transmission Control Protocol, Src Port: 42304 (42304), Dst Port: https (443), Seq: 83, Ack: 74, Len: 82
Secure Sockets Layer

No.     Time        Source                Destination           Protocol Length Info
    124 21.247132   2.41.74.123           173.194.70.95         TCP      68     40211 > https [FIN, ACK] Seq=1 Ack=1 Win=3906 Len=0 TSval=125000 TSecr=1007564961

Frame 124: 68 bytes on wire (544 bits), 68 bytes captured (544 bits)
Linux cooked capture
Internet Protocol Version 4, Src: 2.41.74.123 (2.41.74.123), Dst: 173.194.70.95 (173.194.70.95)
Transmission Control Protocol, Src Port: 40211 (40211), Dst Port: https (443), Seq: 1, Ack: 1, Len: 0

No.     Time        Source                Destination           Protocol Length Info
    125 21.397200   50.22.225.73          2.41.74.123           SSL      113    Continuation Data

Frame 125: 113 bytes on wire (904 bits), 113 bytes captured (904 bits)
Linux cooked capture
Internet Protocol Version 4, Src: 50.22.225.73 (50.22.225.73), Dst: 2.41.74.123 (2.41.74.123)
Transmission Control Protocol, Src Port: https (443), Dst Port: 42304 (42304), Seq: 74, Ack: 165, Len: 45
Secure Sockets Layer

No.     Time        Source                Destination           Protocol Length Info
    126 21.397485   50.22.225.73          2.41.74.123           SSL      87     Continuation Data

Frame 126: 87 bytes on wire (696 bits), 87 bytes captured (696 bits)
Linux cooked capture
Internet Protocol Version 4, Src: 50.22.225.73 (50.22.225.73), Dst: 2.41.74.123 (2.41.74.123)
Transmission Control Protocol, Src Port: https (443), Dst Port: 42304 (42304), Seq: 119, Ack: 165, Len: 19
Secure Sockets Layer

No.     Time        Source                Destination           Protocol Length Info
    127 21.399515   2.41.74.123           50.22.225.73          TCP      68     42304 > https [ACK] Seq=165 Ack=138 Win=7574 Len=0 TSval=125015 TSecr=3869412575

Frame 127: 68 bytes on wire (544 bits), 68 bytes captured (544 bits)
Linux cooked capture
Internet Protocol Version 4, Src: 2.41.74.123 (2.41.74.123), Dst: 50.22.225.73 (50.22.225.73)
Transmission Control Protocol, Src Port: 42304 (42304), Dst Port: https (443), Seq: 165, Ack: 138, Len: 0

No.     Time        Source                Destination           Protocol Length Info
    128 23.567137   2.41.74.123           173.194.40.112        TCP      68     50242 > http [FIN, ACK] Seq=1 Ack=1 Win=10396 Len=0 TSval=125232 TSecr=162997415

Frame 128: 68 bytes on wire (544 bits), 68 bytes captured (544 bits)
Linux cooked capture
Internet Protocol Version 4, Src: 2.41.74.123 (2.41.74.123), Dst: 173.194.40.112 (173.194.40.112)
Transmission Control Protocol, Src Port: 50242 (50242), Dst Port: http (80), Seq: 1, Ack: 1, Len: 0

No.     Time        Source                Destination           Protocol Length Info
    129 23.911913   2.41.74.123           50.22.225.73          SSL      131    Continuation Data

Frame 129: 131 bytes on wire (1048 bits), 131 bytes captured (1048 bits)
Linux cooked capture
Internet Protocol Version 4, Src: 2.41.74.123 (2.41.74.123), Dst: 50.22.225.73 (50.22.225.73)
Transmission Control Protocol, Src Port: 42304 (42304), Dst Port: https (443), Seq: 165, Ack: 138, Len: 63
Secure Sockets Layer

No.     Time        Source                Destination           Protocol Length Info
    130 24.187193   50.22.225.73          2.41.74.123           SSL      113    Continuation Data

Frame 130: 113 bytes on wire (904 bits), 113 bytes captured (904 bits)
Linux cooked capture
Internet Protocol Version 4, Src: 50.22.225.73 (50.22.225.73), Dst: 2.41.74.123 (2.41.74.123)
Transmission Control Protocol, Src Port: https (443), Dst Port: 42304 (42304), Seq: 138, Ack: 228, Len: 45
Secure Sockets Layer

No.     Time        Source                Destination           Protocol Length Info
    131 24.227123   2.41.74.123           50.22.225.73          TCP      68     42304 > https [ACK] Seq=228 Ack=183 Win=7574 Len=0 TSval=125298 TSecr=3869415374

Frame 131: 68 bytes on wire (544 bits), 68 bytes captured (544 bits)
Linux cooked capture
Internet Protocol Version 4, Src: 2.41.74.123 (2.41.74.123), Dst: 50.22.225.73 (50.22.225.73)
Transmission Control Protocol, Src Port: 42304 (42304), Dst Port: https (443), Seq: 228, Ack: 183, Len: 0

No.     Time        Source                Destination           Protocol Length Info
    132 24.887128   54.235.187.3          2.41.74.123           TCP      68     http > 60686 [FIN, ACK] Seq=1 Ack=1 Win=64251 Len=0 TSval=163699149 TSecr=122418

Frame 132: 68 bytes on wire (544 bits), 68 bytes captured (544 bits)
Linux cooked capture
Internet Protocol Version 4, Src: 54.235.187.3 (54.235.187.3), Dst: 2.41.74.123 (2.41.74.123)
Transmission Control Protocol, Src Port: http (80), Dst Port: 60686 (60686), Seq: 1, Ack: 1, Len: 0

No.     Time        Source                Destination           Protocol Length Info
    133 24.927107   2.41.74.123           54.235.187.3          TCP      68     60686 > http [ACK] Seq=1 Ack=2 Win=1959 Len=0 TSval=125368 TSecr=163699149

Frame 133: 68 bytes on wire (544 bits), 68 bytes captured (544 bits)
Linux cooked capture
Internet Protocol Version 4, Src: 2.41.74.123 (2.41.74.123), Dst: 54.235.187.3 (54.235.187.3)
Transmission Control Protocol, Src Port: 60686 (60686), Dst Port: http (80), Seq: 1, Ack: 2, Len: 0

No.     Time        Source                Destination           Protocol Length Info
    134 26.357187   50.22.225.73          2.41.74.123           SSL      111    Continuation Data

Frame 134: 111 bytes on wire (888 bits), 111 bytes captured (888 bits)
Linux cooked capture
Internet Protocol Version 4, Src: 50.22.225.73 (50.22.225.73), Dst: 2.41.74.123 (2.41.74.123)
Transmission Control Protocol, Src Port: https (443), Dst Port: 42304 (42304), Seq: 183, Ack: 228, Len: 43
Secure Sockets Layer

No.     Time        Source                Destination           Protocol Length Info
    135 26.357508   2.41.74.123           50.22.225.73          TCP      68     42304 > https [ACK] Seq=228 Ack=226 Win=7574 Len=0 TSval=125511 TSecr=3869417539

Frame 135: 68 bytes on wire (544 bits), 68 bytes captured (544 bits)
Linux cooked capture
Internet Protocol Version 4, Src: 2.41.74.123 (2.41.74.123), Dst: 50.22.225.73 (50.22.225.73)
Transmission Control Protocol, Src Port: 42304 (42304), Dst Port: https (443), Seq: 228, Ack: 226, Len: 0

No.     Time        Source                Destination           Protocol Length Info
    136 26.372097   2.41.74.123           50.22.225.73          SSL      113    Continuation Data

Frame 136: 113 bytes on wire (904 bits), 113 bytes captured (904 bits)
Linux cooked capture
Internet Protocol Version 4, Src: 2.41.74.123 (2.41.74.123), Dst: 50.22.225.73 (50.22.225.73)
Transmission Control Protocol, Src Port: 42304 (42304), Dst Port: https (443), Seq: 228, Ack: 226, Len: 45
Secure Sockets Layer

No.     Time        Source                Destination           Protocol Length Info
    137 26.557245   50.22.225.73          2.41.74.123           SSL      111    Continuation Data

Frame 137: 111 bytes on wire (888 bits), 111 bytes captured (888 bits)
Linux cooked capture
Internet Protocol Version 4, Src: 50.22.225.73 (50.22.225.73), Dst: 2.41.74.123 (2.41.74.123)
Transmission Control Protocol, Src Port: https (443), Dst Port: 42304 (42304), Seq: 226, Ack: 228, Len: 43
Secure Sockets Layer

No.     Time        Source                Destination           Protocol Length Info
    138 26.557563   50.22.225.73          2.41.74.123           SSL      111    Continuation Data

Frame 138: 111 bytes on wire (888 bits), 111 bytes captured (888 bits)
Linux cooked capture
Internet Protocol Version 4, Src: 50.22.225.73 (50.22.225.73), Dst: 2.41.74.123 (2.41.74.123)
Transmission Control Protocol, Src Port: https (443), Dst Port: 42304 (42304), Seq: 269, Ack: 228, Len: 43
Secure Sockets Layer

No.     Time        Source                Destination           Protocol Length Info
    139 26.570772   2.41.74.123           50.22.225.73          TCP      68     42304 > https [ACK] Seq=273 Ack=312 Win=7574 Len=0 TSval=125532 TSecr=3869417739

Frame 139: 68 bytes on wire (544 bits), 68 bytes captured (544 bits)
Linux cooked capture
Internet Protocol Version 4, Src: 2.41.74.123 (2.41.74.123), Dst: 50.22.225.73 (50.22.225.73)
Transmission Control Protocol, Src Port: 42304 (42304), Dst Port: https (443), Seq: 273, Ack: 312, Len: 0

No.     Time        Source                Destination           Protocol Length Info
    140 26.697152   50.22.225.73          2.41.74.123           TCP      68     https > 42304 [ACK] Seq=312 Ack=273 Win=512 Len=0 TSval=3869417884 TSecr=125512

Frame 140: 68 bytes on wire (544 bits), 68 bytes captured (544 bits)
Linux cooked capture
Internet Protocol Version 4, Src: 50.22.225.73 (50.22.225.73), Dst: 2.41.74.123 (2.41.74.123)
Transmission Control Protocol, Src Port: https (443), Dst Port: 42304 (42304), Seq: 312, Ack: 273, Len: 0

No.     Time        Source                Destination           Protocol Length Info
    141 26.697490   2.41.74.123           50.22.225.73          SSL      158    Continuation Data

Frame 141: 158 bytes on wire (1264 bits), 158 bytes captured (1264 bits)
Linux cooked capture
Internet Protocol Version 4, Src: 2.41.74.123 (2.41.74.123), Dst: 50.22.225.73 (50.22.225.73)
Transmission Control Protocol, Src Port: 42304 (42304), Dst Port: https (443), Seq: 273, Ack: 312, Len: 90
Secure Sockets Layer

No.     Time        Source                Destination           Protocol Length Info
    142 27.027332   50.22.225.73          2.41.74.123           TCP      68     https > 42304 [ACK] Seq=312 Ack=363 Win=512 Len=0 TSval=3869418204 TSecr=125545

Frame 142: 68 bytes on wire (544 bits), 68 bytes captured (544 bits)
Linux cooked capture
Internet Protocol Version 4, Src: 50.22.225.73 (50.22.225.73), Dst: 2.41.74.123 (2.41.74.123)
Transmission Control Protocol, Src Port: https (443), Dst Port: 42304 (42304), Seq: 312, Ack: 363, Len: 0

No.     Time        Source                Destination           Protocol Length Info
    143 27.661295   2.41.74.123           50.22.225.73          SSL      132    Continuation Data

Frame 143: 132 bytes on wire (1056 bits), 132 bytes captured (1056 bits)
Linux cooked capture
Internet Protocol Version 4, Src: 2.41.74.123 (2.41.74.123), Dst: 50.22.225.73 (50.22.225.73)
Transmission Control Protocol, Src Port: 42304 (42304), Dst Port: https (443), Seq: 363, Ack: 312, Len: 64
Secure Sockets Layer

No.     Time        Source                Destination           Protocol Length Info
    144 27.927357   50.22.225.73          2.41.74.123           SSL      113    Continuation Data

Frame 144: 113 bytes on wire (904 bits), 113 bytes captured (904 bits)
Linux cooked capture
Internet Protocol Version 4, Src: 50.22.225.73 (50.22.225.73), Dst: 2.41.74.123 (2.41.74.123)
Transmission Control Protocol, Src Port: https (443), Dst Port: 42304 (42304), Seq: 312, Ack: 427, Len: 45
Secure Sockets Layer

No.     Time        Source                Destination           Protocol Length Info
    145 27.967215   2.41.74.123           50.22.225.73          TCP      68     42304 > https [ACK] Seq=427 Ack=357 Win=7574 Len=0 TSval=125672 TSecr=3869419094

Frame 145: 68 bytes on wire (544 bits), 68 bytes captured (544 bits)
Linux cooked capture
Internet Protocol Version 4, Src: 2.41.74.123 (2.41.74.123), Dst: 50.22.225.73 (50.22.225.73)
Transmission Control Protocol, Src Port: 42304 (42304), Dst Port: https (443), Seq: 427, Ack: 357, Len: 0

No.     Time        Source                Destination           Protocol Length Info
    146 28.327148   50.22.225.73          2.41.74.123           SSL      111    Continuation Data

Frame 146: 111 bytes on wire (888 bits), 111 bytes captured (888 bits)
Linux cooked capture
Internet Protocol Version 4, Src: 50.22.225.73 (50.22.225.73), Dst: 2.41.74.123 (2.41.74.123)
Transmission Control Protocol, Src Port: https (443), Dst Port: 42304 (42304), Seq: 357, Ack: 427, Len: 43
Secure Sockets Layer

No.     Time        Source                Destination           Protocol Length Info
    147 28.327633   2.41.74.123           50.22.225.73          TCP      68     42304 > https [ACK] Seq=427 Ack=400 Win=7574 Len=0 TSval=125708 TSecr=3869419507

Frame 147: 68 bytes on wire (544 bits), 68 bytes captured (544 bits)
Linux cooked capture
Internet Protocol Version 4, Src: 2.41.74.123 (2.41.74.123), Dst: 50.22.225.73 (50.22.225.73)
Transmission Control Protocol, Src Port: 42304 (42304), Dst Port: https (443), Seq: 427, Ack: 400, Len: 0

No.     Time        Source                Destination           Protocol Length Info
    148 28.346485   2.41.74.123           50.22.225.73          SSL      113    Continuation Data

Frame 148: 113 bytes on wire (904 bits), 113 bytes captured (904 bits)
Linux cooked capture
Internet Protocol Version 4, Src: 2.41.74.123 (2.41.74.123), Dst: 50.22.225.73 (50.22.225.73)
Transmission Control Protocol, Src Port: 42304 (42304), Dst Port: https (443), Seq: 427, Ack: 400, Len: 45
Secure Sockets Layer

No.     Time        Source                Destination           Protocol Length Info
    149 28.657360   50.22.225.73          2.41.74.123           TCP      68     https > 42304 [ACK] Seq=400 Ack=472 Win=512 Len=0 TSval=3869419844 TSecr=125709

Frame 149: 68 bytes on wire (544 bits), 68 bytes captured (544 bits)
Linux cooked capture
Internet Protocol Version 4, Src: 50.22.225.73 (50.22.225.73), Dst: 2.41.74.123 (2.41.74.123)
Transmission Control Protocol, Src Port: https (443), Dst Port: 42304 (42304), Seq: 400, Ack: 472, Len: 0

No.     Time        Source                Destination           Protocol Length Info
    150 32.276068   2.41.74.123           50.22.225.73          SSL      134    Continuation Data

Frame 150: 134 bytes on wire (1072 bits), 134 bytes captured (1072 bits)
Linux cooked capture
Internet Protocol Version 4, Src: 2.41.74.123 (2.41.74.123), Dst: 50.22.225.73 (50.22.225.73)
Transmission Control Protocol, Src Port: 42304 (42304), Dst Port: https (443), Seq: 472, Ack: 400, Len: 66
Secure Sockets Layer

No.     Time        Source                Destination           Protocol Length Info
    151 34.067113   2.41.74.123           50.22.225.73          SSL      134    [TCP Retransmission] Continuation Data

Frame 151: 134 bytes on wire (1072 bits), 134 bytes captured (1072 bits)
Linux cooked capture
Internet Protocol Version 4, Src: 2.41.74.123 (2.41.74.123), Dst: 50.22.225.73 (50.22.225.73)
Transmission Control Protocol, Src Port: 42304 (42304), Dst Port: https (443), Seq: 472, Ack: 400, Len: 66
Secure Sockets Layer

No.     Time        Source                Destination           Protocol Length Info
    152 34.337457   50.22.225.73          2.41.74.123           SSL      113    Continuation Data

Frame 152: 113 bytes on wire (904 bits), 113 bytes captured (904 bits)
Linux cooked capture
Internet Protocol Version 4, Src: 50.22.225.73 (50.22.225.73), Dst: 2.41.74.123 (2.41.74.123)
Transmission Control Protocol, Src Port: https (443), Dst Port: 42304 (42304), Seq: 400, Ack: 538, Len: 45
Secure Sockets Layer

No.     Time        Source                Destination           Protocol Length Info
    153 34.337853   50.22.225.73          2.41.74.123           SSL      111    Continuation Data

Frame 153: 111 bytes on wire (888 bits), 111 bytes captured (888 bits)
Linux cooked capture
Internet Protocol Version 4, Src: 50.22.225.73 (50.22.225.73), Dst: 2.41.74.123 (2.41.74.123)
Transmission Control Protocol, Src Port: https (443), Dst Port: 42304 (42304), Seq: 445, Ack: 538, Len: 43
Secure Sockets Layer

No.     Time        Source                Destination           Protocol Length Info
    154 34.352027   2.41.74.123           50.22.225.73          TCP      68     42304 > https [ACK] Seq=538 Ack=488 Win=7574 Len=0 TSval=126310 TSecr=3869423734

Frame 154: 68 bytes on wire (544 bits), 68 bytes captured (544 bits)
Linux cooked capture
Internet Protocol Version 4, Src: 2.41.74.123 (2.41.74.123), Dst: 50.22.225.73 (50.22.225.73)
Transmission Control Protocol, Src Port: 42304 (42304), Dst Port: https (443), Seq: 538, Ack: 488, Len: 0

No.     Time        Source                Destination           Protocol Length Info
    155 34.355083   2.41.74.123           50.22.225.73          SSL      113    Continuation Data

Frame 155: 113 bytes on wire (904 bits), 113 bytes captured (904 bits)
Linux cooked capture
Internet Protocol Version 4, Src: 2.41.74.123 (2.41.74.123), Dst: 50.22.225.73 (50.22.225.73)
Transmission Control Protocol, Src Port: 42304 (42304), Dst Port: https (443), Seq: 538, Ack: 488, Len: 45
Secure Sockets Layer

No.     Time        Source                Destination           Protocol Length Info
    156 34.357388   50.22.225.73          2.41.74.123           SSL      156    [TCP Retransmission] Continuation Data

Frame 156: 156 bytes on wire (1248 bits), 156 bytes captured (1248 bits)
Linux cooked capture
Internet Protocol Version 4, Src: 50.22.225.73 (50.22.225.73), Dst: 2.41.74.123 (2.41.74.123)
Transmission Control Protocol, Src Port: https (443), Dst Port: 42304 (42304), Seq: 400, Ack: 538, Len: 88
Secure Sockets Layer

No.     Time        Source                Destination           Protocol Length Info
    157 34.363662   2.41.74.123           50.22.225.73          TCP      80     [TCP Dup ACK 155#1] 42304 > https [ACK] Seq=583 Ack=488 Win=7574 Len=0 TSval=126311 TSecr=3869425361 SLE=400 SRE=488

Frame 157: 80 bytes on wire (640 bits), 80 bytes captured (640 bits)
Linux cooked capture
Internet Protocol Version 4, Src: 2.41.74.123 (2.41.74.123), Dst: 50.22.225.73 (50.22.225.73)
Transmission Control Protocol, Src Port: 42304 (42304), Dst Port: https (443), Seq: 583, Ack: 488, Len: 0

No.     Time        Source                Destination           Protocol Length Info
    158 34.727412   50.22.225.73          2.41.74.123           TCP      68     https > 42304 [ACK] Seq=488 Ack=583 Win=512 Len=0 TSval=3869425904 TSecr=126310

Frame 158: 68 bytes on wire (544 bits), 68 bytes captured (544 bits)
Linux cooked capture
Internet Protocol Version 4, Src: 50.22.225.73 (50.22.225.73), Dst: 2.41.74.123 (2.41.74.123)
Transmission Control Protocol, Src Port: https (443), Dst Port: 42304 (42304), Seq: 488, Ack: 583, Len: 0

No.     Time        Source                Destination           Protocol Length Info
    159 38.811890   2.41.74.123           50.22.225.73          SSL      138    Continuation Data

Frame 159: 138 bytes on wire (1104 bits), 138 bytes captured (1104 bits)
Linux cooked capture
Internet Protocol Version 4, Src: 2.41.74.123 (2.41.74.123), Dst: 50.22.225.73 (50.22.225.73)
Transmission Control Protocol, Src Port: 42304 (42304), Dst Port: https (443), Seq: 583, Ack: 488, Len: 70
Secure Sockets Layer

No.     Time        Source                Destination           Protocol Length Info
    160 39.007075   2.41.74.123           173.194.35.132        TCP      68     45399 > https [FIN, ACK] Seq=1 Ack=1 Win=5204 Len=0 TSval=126776 TSecr=2247887422

Frame 160: 68 bytes on wire (544 bits), 68 bytes captured (544 bits)
Linux cooked capture
Internet Protocol Version 4, Src: 2.41.74.123 (2.41.74.123), Dst: 173.194.35.132 (173.194.35.132)
Transmission Control Protocol, Src Port: 45399 (45399), Dst Port: https (443), Seq: 1, Ack: 1, Len: 0

No.     Time        Source                Destination           Protocol Length Info
    161 39.087408   50.22.225.73          2.41.74.123           SSL      113    Continuation Data

Frame 161: 113 bytes on wire (904 bits), 113 bytes captured (904 bits)
Linux cooked capture
Internet Protocol Version 4, Src: 50.22.225.73 (50.22.225.73), Dst: 2.41.74.123 (2.41.74.123)
Transmission Control Protocol, Src Port: https (443), Dst Port: 42304 (42304), Seq: 488, Ack: 653, Len: 45
Secure Sockets Layer

No.     Time        Source                Destination           Protocol Length Info
    162 39.087757   2.41.74.123           50.22.225.73          TCP      68     42304 > https [ACK] Seq=653 Ack=533 Win=7574 Len=0 TSval=126784 TSecr=3869430265

Frame 162: 68 bytes on wire (544 bits), 68 bytes captured (544 bits)
Linux cooked capture
Internet Protocol Version 4, Src: 2.41.74.123 (2.41.74.123), Dst: 50.22.225.73 (50.22.225.73)
Transmission Control Protocol, Src Port: 42304 (42304), Dst Port: https (443), Seq: 653, Ack: 533, Len: 0

No.     Time        Source                Destination           Protocol Length Info
    163 41.363565   2.41.74.123           50.22.225.73          SSL      129    Continuation Data

Frame 163: 129 bytes on wire (1032 bits), 129 bytes captured (1032 bits)
Linux cooked capture
Internet Protocol Version 4, Src: 2.41.74.123 (2.41.74.123), Dst: 50.22.225.73 (50.22.225.73)
Transmission Control Protocol, Src Port: 42304 (42304), Dst Port: https (443), Seq: 653, Ack: 533, Len: 61
Secure Sockets Layer

No.     Time        Source                Destination           Protocol Length Info
    164 41.647588   50.22.225.73          2.41.74.123           SSL      113    Continuation Data

Frame 164: 113 bytes on wire (904 bits), 113 bytes captured (904 bits)
Linux cooked capture
Internet Protocol Version 4, Src: 50.22.225.73 (50.22.225.73), Dst: 2.41.74.123 (2.41.74.123)
Transmission Control Protocol, Src Port: https (443), Dst Port: 42304 (42304), Seq: 533, Ack: 714, Len: 45
Secure Sockets Layer

No.     Time        Source                Destination           Protocol Length Info
    165 41.647972   2.41.74.123           50.22.225.73          TCP      68     42304 > https [ACK] Seq=714 Ack=578 Win=7574 Len=0 TSval=127040 TSecr=3869432824

Frame 165: 68 bytes on wire (544 bits), 68 bytes captured (544 bits)
Linux cooked capture
Internet Protocol Version 4, Src: 2.41.74.123 (2.41.74.123), Dst: 50.22.225.73 (50.22.225.73)
Transmission Control Protocol, Src Port: 42304 (42304), Dst Port: https (443), Seq: 714, Ack: 578, Len: 0

No.     Time        Source                Destination           Protocol Length Info
    166 42.957508   50.22.225.73          2.41.74.123           SSL      111    Continuation Data

Frame 166: 111 bytes on wire (888 bits), 111 bytes captured (888 bits)
Linux cooked capture
Internet Protocol Version 4, Src: 50.22.225.73 (50.22.225.73), Dst: 2.41.74.123 (2.41.74.123)
Transmission Control Protocol, Src Port: https (443), Dst Port: 42304 (42304), Seq: 578, Ack: 714, Len: 43
Secure Sockets Layer

No.     Time        Source                Destination           Protocol Length Info
    167 42.957832   2.41.74.123           50.22.225.73          TCP      68     42304 > https [ACK] Seq=714 Ack=621 Win=7574 Len=0 TSval=127171 TSecr=3869434135

Frame 167: 68 bytes on wire (544 bits), 68 bytes captured (544 bits)
Linux cooked capture
Internet Protocol Version 4, Src: 2.41.74.123 (2.41.74.123), Dst: 50.22.225.73 (50.22.225.73)
Transmission Control Protocol, Src Port: 42304 (42304), Dst Port: https (443), Seq: 714, Ack: 621, Len: 0

No.     Time        Source                Destination           Protocol Length Info
    168 42.961003   2.41.74.123           50.22.225.73          SSL      113    Continuation Data

Frame 168: 113 bytes on wire (904 bits), 113 bytes captured (904 bits)
Linux cooked capture
Internet Protocol Version 4, Src: 2.41.74.123 (2.41.74.123), Dst: 50.22.225.73 (50.22.225.73)
Transmission Control Protocol, Src Port: 42304 (42304), Dst Port: https (443), Seq: 714, Ack: 621, Len: 45
Secure Sockets Layer

No.     Time        Source                Destination           Protocol Length Info
    169 43.157410   50.22.225.73          2.41.74.123           SSL      111    Continuation Data

Frame 169: 111 bytes on wire (888 bits), 111 bytes captured (888 bits)
Linux cooked capture
Internet Protocol Version 4, Src: 50.22.225.73 (50.22.225.73), Dst: 2.41.74.123 (2.41.74.123)
Transmission Control Protocol, Src Port: https (443), Dst Port: 42304 (42304), Seq: 621, Ack: 714, Len: 43
Secure Sockets Layer

No.     Time        Source                Destination           Protocol Length Info
    170 43.197098   2.41.74.123           50.22.225.73          TCP      68     42304 > https [ACK] Seq=759 Ack=664 Win=7574 Len=0 TSval=127195 TSecr=3869434327

Frame 170: 68 bytes on wire (544 bits), 68 bytes captured (544 bits)
Linux cooked capture
Internet Protocol Version 4, Src: 2.41.74.123 (2.41.74.123), Dst: 50.22.225.73 (50.22.225.73)
Transmission Control Protocol, Src Port: 42304 (42304), Dst Port: https (443), Seq: 759, Ack: 664, Len: 0

No.     Time        Source                Destination           Protocol Length Info
    171 43.277415   50.22.225.73          2.41.74.123           TCP      68     https > 42304 [ACK] Seq=664 Ack=759 Win=512 Len=0 TSval=3869434453 TSecr=127171

Frame 171: 68 bytes on wire (544 bits), 68 bytes captured (544 bits)
Linux cooked capture
Internet Protocol Version 4, Src: 50.22.225.73 (50.22.225.73), Dst: 2.41.74.123 (2.41.74.123)
Transmission Control Protocol, Src Port: https (443), Dst Port: 42304 (42304), Seq: 664, Ack: 759, Len: 0

No.     Time        Source                Destination           Protocol Length Info
    172 43.277772   2.41.74.123           50.22.225.73          SSL      168    Continuation Data

Frame 172: 168 bytes on wire (1344 bits), 168 bytes captured (1344 bits)
Linux cooked capture
Internet Protocol Version 4, Src: 2.41.74.123 (2.41.74.123), Dst: 50.22.225.73 (50.22.225.73)
Transmission Control Protocol, Src Port: 42304 (42304), Dst Port: https (443), Seq: 759, Ack: 664, Len: 100
Secure Sockets Layer

No.     Time        Source                Destination           Protocol Length Info
    173 43.567408   50.22.225.73          2.41.74.123           SSL      113    Continuation Data

Frame 173: 113 bytes on wire (904 bits), 113 bytes captured (904 bits)
Linux cooked capture
Internet Protocol Version 4, Src: 50.22.225.73 (50.22.225.73), Dst: 2.41.74.123 (2.41.74.123)
Transmission Control Protocol, Src Port: https (443), Dst Port: 42304 (42304), Seq: 664, Ack: 859, Len: 45
Secure Sockets Layer

No.     Time        Source                Destination           Protocol Length Info
    174 43.567748   2.41.74.123           50.22.225.73          TCP      68     42304 > https [ACK] Seq=859 Ack=709 Win=7574 Len=0 TSval=127232 TSecr=3869434744

Frame 174: 68 bytes on wire (544 bits), 68 bytes captured (544 bits)
Linux cooked capture
Internet Protocol Version 4, Src: 2.41.74.123 (2.41.74.123), Dst: 50.22.225.73 (50.22.225.73)
Transmission Control Protocol, Src Port: 42304 (42304), Dst Port: https (443), Seq: 859, Ack: 709, Len: 0

No.     Time        Source                Destination           Protocol Length Info
    175 43.887412   50.22.225.73          2.41.74.123           SSL      111    Continuation Data

Frame 175: 111 bytes on wire (888 bits), 111 bytes captured (888 bits)
Linux cooked capture
Internet Protocol Version 4, Src: 50.22.225.73 (50.22.225.73), Dst: 2.41.74.123 (2.41.74.123)
Transmission Control Protocol, Src Port: https (443), Dst Port: 42304 (42304), Seq: 709, Ack: 859, Len: 43
Secure Sockets Layer

No.     Time        Source                Destination           Protocol Length Info
    176 43.887882   2.41.74.123           50.22.225.73          TCP      68     42304 > https [ACK] Seq=859 Ack=752 Win=7574 Len=0 TSval=127264 TSecr=3869435057

Frame 176: 68 bytes on wire (544 bits), 68 bytes captured (544 bits)
Linux cooked capture
Internet Protocol Version 4, Src: 2.41.74.123 (2.41.74.123), Dst: 50.22.225.73 (50.22.225.73)
Transmission Control Protocol, Src Port: 42304 (42304), Dst Port: https (443), Seq: 859, Ack: 752, Len: 0

No.     Time        Source                Destination           Protocol Length Info
    177 43.908363   2.41.74.123           50.22.225.73          SSL      113    Continuation Data

Frame 177: 113 bytes on wire (904 bits), 113 bytes captured (904 bits)
Linux cooked capture
Internet Protocol Version 4, Src: 2.41.74.123 (2.41.74.123), Dst: 50.22.225.73 (50.22.225.73)
Transmission Control Protocol, Src Port: 42304 (42304), Dst Port: https (443), Seq: 859, Ack: 752, Len: 45
Secure Sockets Layer

No.     Time        Source                Destination           Protocol Length Info
    178 44.237425   50.22.225.73          2.41.74.123           TCP      68     https > 42304 [ACK] Seq=752 Ack=904 Win=512 Len=0 TSval=3869435414 TSecr=127266

Frame 178: 68 bytes on wire (544 bits), 68 bytes captured (544 bits)
Linux cooked capture
Internet Protocol Version 4, Src: 50.22.225.73 (50.22.225.73), Dst: 2.41.74.123 (2.41.74.123)
Transmission Control Protocol, Src Port: https (443), Dst Port: 42304 (42304), Seq: 752, Ack: 904, Len: 0

No.     Time        Source                Destination           Protocol Length Info
    179 44.805262   2.41.74.123           50.22.225.73          SSL      123    Continuation Data

Frame 179: 123 bytes on wire (984 bits), 123 bytes captured (984 bits)
Linux cooked capture
Internet Protocol Version 4, Src: 2.41.74.123 (2.41.74.123), Dst: 50.22.225.73 (50.22.225.73)
Transmission Control Protocol, Src Port: 42304 (42304), Dst Port: https (443), Seq: 904, Ack: 752, Len: 55
Secure Sockets Layer

No.     Time        Source                Destination           Protocol Length Info
    180 45.087425   50.22.225.73          2.41.74.123           SSL      113    Continuation Data

Frame 180: 113 bytes on wire (904 bits), 113 bytes captured (904 bits)
Linux cooked capture
Internet Protocol Version 4, Src: 50.22.225.73 (50.22.225.73), Dst: 2.41.74.123 (2.41.74.123)
Transmission Control Protocol, Src Port: https (443), Dst Port: 42304 (42304), Seq: 752, Ack: 959, Len: 45
Secure Sockets Layer

No.     Time        Source                Destination           Protocol Length Info
    181 45.127227   2.41.74.123           50.22.225.73          TCP      68     42304 > https [ACK] Seq=959 Ack=797 Win=7574 Len=0 TSval=127388 TSecr=3869436264

Frame 181: 68 bytes on wire (544 bits), 68 bytes captured (544 bits)
Linux cooked capture
Internet Protocol Version 4, Src: 2.41.74.123 (2.41.74.123), Dst: 50.22.225.73 (50.22.225.73)
Transmission Control Protocol, Src Port: 42304 (42304), Dst Port: https (443), Seq: 959, Ack: 797, Len: 0

No.     Time        Source                Destination           Protocol Length Info
    182 45.437412   50.22.225.73          2.41.74.123           SSL      111    Continuation Data

Frame 182: 111 bytes on wire (888 bits), 111 bytes captured (888 bits)
Linux cooked capture
Internet Protocol Version 4, Src: 50.22.225.73 (50.22.225.73), Dst: 2.41.74.123 (2.41.74.123)
Transmission Control Protocol, Src Port: https (443), Dst Port: 42304 (42304), Seq: 797, Ack: 959, Len: 43
Secure Sockets Layer

No.     Time        Source                Destination           Protocol Length Info
    183 45.438288   2.41.74.123           50.22.225.73          TCP      68     42304 > https [ACK] Seq=959 Ack=840 Win=7574 Len=0 TSval=127419 TSecr=3869436609

Frame 183: 68 bytes on wire (544 bits), 68 bytes captured (544 bits)
Linux cooked capture
Internet Protocol Version 4, Src: 2.41.74.123 (2.41.74.123), Dst: 50.22.225.73 (50.22.225.73)
Transmission Control Protocol, Src Port: 42304 (42304), Dst Port: https (443), Seq: 959, Ack: 840, Len: 0

No.     Time        Source                Destination           Protocol Length Info
    184 45.444570   2.41.74.123           50.22.225.73          SSL      113    Continuation Data

Frame 184: 113 bytes on wire (904 bits), 113 bytes captured (904 bits)
Linux cooked capture
Internet Protocol Version 4, Src: 2.41.74.123 (2.41.74.123), Dst: 50.22.225.73 (50.22.225.73)
Transmission Control Protocol, Src Port: 42304 (42304), Dst Port: https (443), Seq: 959, Ack: 840, Len: 45
Secure Sockets Layer

No.     Time        Source                Destination           Protocol Length Info
    185 45.757558   50.22.225.73          2.41.74.123           TCP      68     https > 42304 [ACK] Seq=840 Ack=1004 Win=512 Len=0 TSval=3869436934 TSecr=127419

Frame 185: 68 bytes on wire (544 bits), 68 bytes captured (544 bits)
Linux cooked capture
Internet Protocol Version 4, Src: 50.22.225.73 (50.22.225.73), Dst: 2.41.74.123 (2.41.74.123)
Transmission Control Protocol, Src Port: https (443), Dst Port: 42304 (42304), Seq: 840, Ack: 1004, Len: 0

No.     Time        Source                Destination           Protocol Length Info
    186 46.127125   2.41.74.123           173.194.70.95         TCP      68     40211 > https [FIN, ACK] Seq=1 Ack=1 Win=3906 Len=0 TSval=127488 TSecr=1007564961

Frame 186: 68 bytes on wire (544 bits), 68 bytes captured (544 bits)
Linux cooked capture
Internet Protocol Version 4, Src: 2.41.74.123 (2.41.74.123), Dst: 173.194.70.95 (173.194.70.95)
Transmission Control Protocol, Src Port: 40211 (40211), Dst Port: https (443), Seq: 1, Ack: 1, Len: 0

No.     Time        Source                Destination           Protocol Length Info
    187 51.167275   2.41.74.123           173.194.40.112        TCP      68     50242 > http [FIN, ACK] Seq=1 Ack=1 Win=10396 Len=0 TSval=127992 TSecr=162997415

Frame 187: 68 bytes on wire (544 bits), 68 bytes captured (544 bits)
Linux cooked capture
Internet Protocol Version 4, Src: 2.41.74.123 (2.41.74.123), Dst: 173.194.40.112 (173.194.40.112)
Transmission Control Protocol, Src Port: 50242 (50242), Dst Port: http (80), Seq: 1, Ack: 1, Len: 0
