No.     Time        Source                Destination           Protocol Length Info
      1 0.000000    10.164.110.195        173.194.34.52         TCP      68     56487 > http [FIN, ACK] Seq=1 Ack=1 Win=10598 Len=0 TSval=94096 TSecr=1612873401

Frame 1: 68 bytes on wire (544 bits), 68 bytes captured (544 bits)
Linux cooked capture
Internet Protocol Version 4, Src: 10.164.110.195 (10.164.110.195), Dst: 173.194.34.52 (173.194.34.52)
Transmission Control Protocol, Src Port: 56487 (56487), Dst Port: http (80), Seq: 1, Ack: 1, Len: 0

No.     Time        Source                Destination           Protocol Length Info
      2 9.506132    10.164.110.195        83.224.70.77          DNS      77     Standard query 0x099b  A e5.whatsapp.net

Frame 2: 77 bytes on wire (616 bits), 77 bytes captured (616 bits)
Linux cooked capture
Internet Protocol Version 4, Src: 10.164.110.195 (10.164.110.195), Dst: 83.224.70.77 (83.224.70.77)
User Datagram Protocol, Src Port: simple-push (3687), Dst Port: domain (53)
Domain Name System (query)

No.     Time        Source                Destination           Protocol Length Info
      3 9.823503    83.224.70.77          10.164.110.195        DNS      205    Standard query response 0x099b  A 50.22.225.75 A 50.22.225.77 A 50.22.225.87 A 184.173.179.48 A 50.22.225.71 A 50.22.225.72 A 50.22.225.73 A 50.22.225.74

Frame 3: 205 bytes on wire (1640 bits), 205 bytes captured (1640 bits)
Linux cooked capture
Internet Protocol Version 4, Src: 83.224.70.77 (83.224.70.77), Dst: 10.164.110.195 (10.164.110.195)
User Datagram Protocol, Src Port: domain (53), Dst Port: simple-push (3687)
Domain Name System (response)

No.     Time        Source                Destination           Protocol Length Info
      4 9.831667    10.164.110.195        50.22.225.87          TCP      76     53826 > https [SYN] Seq=0 Win=5240 Len=0 MSS=1310 SACK_PERM=1 TSval=95079 TSecr=0 WS=4

Frame 4: 76 bytes on wire (608 bits), 76 bytes captured (608 bits)
Linux cooked capture
Internet Protocol Version 4, Src: 10.164.110.195 (10.164.110.195), Dst: 50.22.225.87 (50.22.225.87)
Transmission Control Protocol, Src Port: 53826 (53826), Dst Port: https (443), Seq: 0, Len: 0

No.     Time        Source                Destination           Protocol Length Info
      5 10.265395   50.22.225.87          10.164.110.195        TCP      76     https > 53826 [SYN, ACK] Seq=0 Ack=1 Win=65535 Len=0 MSS=1310 WS=512 SACK_PERM=1 TSval=1130217988 TSecr=95079

Frame 5: 76 bytes on wire (608 bits), 76 bytes captured (608 bits)
Linux cooked capture
Internet Protocol Version 4, Src: 50.22.225.87 (50.22.225.87), Dst: 10.164.110.195 (10.164.110.195)
Transmission Control Protocol, Src Port: https (443), Dst Port: 53826 (53826), Seq: 0, Ack: 1, Len: 0

No.     Time        Source                Destination           Protocol Length Info
      6 10.265937   10.164.110.195        50.22.225.87          TCP      68     53826 > https [ACK] Seq=1 Ack=1 Win=5240 Len=0 TSval=95122 TSecr=1130217988

Frame 6: 68 bytes on wire (544 bits), 68 bytes captured (544 bits)
Linux cooked capture
Internet Protocol Version 4, Src: 10.164.110.195 (10.164.110.195), Dst: 50.22.225.87 (50.22.225.87)
Transmission Control Protocol, Src Port: 53826 (53826), Dst Port: https (443), Seq: 1, Ack: 1, Len: 0

No.     Time        Source                Destination           Protocol Length Info
      7 10.372825   10.164.110.195        50.22.225.87          SSL      189    Continuation Data

Frame 7: 189 bytes on wire (1512 bits), 189 bytes captured (1512 bits)
Linux cooked capture
Internet Protocol Version 4, Src: 10.164.110.195 (10.164.110.195), Dst: 50.22.225.87 (50.22.225.87)
Transmission Control Protocol, Src Port: 53826 (53826), Dst Port: https (443), Seq: 1, Ack: 1, Len: 121
Secure Sockets Layer

No.     Time        Source                Destination           Protocol Length Info
      8 10.703450   50.22.225.87          10.164.110.195        TCP      68     [TCP Window Update] https > 53826 [ACK] Seq=1 Ack=1 Win=262144 Len=0 TSval=1130218429 TSecr=95122

Frame 8: 68 bytes on wire (544 bits), 68 bytes captured (544 bits)
Linux cooked capture
Internet Protocol Version 4, Src: 50.22.225.87 (50.22.225.87), Dst: 10.164.110.195 (10.164.110.195)
Transmission Control Protocol, Src Port: https (443), Dst Port: 53826 (53826), Seq: 1, Ack: 1, Len: 0

No.     Time        Source                Destination           Protocol Length Info
      9 11.103752   50.22.225.87          10.164.110.195        SSL      157    Continuation Data

Frame 9: 157 bytes on wire (1256 bits), 157 bytes captured (1256 bits)
Linux cooked capture
Internet Protocol Version 4, Src: 50.22.225.87 (50.22.225.87), Dst: 10.164.110.195 (10.164.110.195)
Transmission Control Protocol, Src Port: https (443), Dst Port: 53826 (53826), Seq: 1, Ack: 122, Len: 89
Secure Sockets Layer

No.     Time        Source                Destination           Protocol Length Info
     10 11.104408   10.164.110.195        50.22.225.87          TCP      68     53826 > https [ACK] Seq=122 Ack=90 Win=5240 Len=0 TSval=95206 TSecr=1130218809

Frame 10: 68 bytes on wire (544 bits), 68 bytes captured (544 bits)
Linux cooked capture
Internet Protocol Version 4, Src: 10.164.110.195 (10.164.110.195), Dst: 50.22.225.87 (50.22.225.87)
Transmission Control Protocol, Src Port: 53826 (53826), Dst Port: https (443), Seq: 122, Ack: 90, Len: 0

No.     Time        Source                Destination           Protocol Length Info
     11 11.114605   10.164.110.195        50.22.225.87          SSL      97     Continuation Data

Frame 11: 97 bytes on wire (776 bits), 97 bytes captured (776 bits)
Linux cooked capture
Internet Protocol Version 4, Src: 10.164.110.195 (10.164.110.195), Dst: 50.22.225.87 (50.22.225.87)
Transmission Control Protocol, Src Port: 53826 (53826), Dst Port: https (443), Seq: 122, Ack: 90, Len: 29
Secure Sockets Layer

No.     Time        Source                Destination           Protocol Length Info
     12 11.123833   50.22.225.87          10.164.110.195        SSL      89     Continuation Data

Frame 12: 89 bytes on wire (712 bits), 89 bytes captured (712 bits)
Linux cooked capture
Internet Protocol Version 4, Src: 50.22.225.87 (50.22.225.87), Dst: 10.164.110.195 (10.164.110.195)
Transmission Control Protocol, Src Port: https (443), Dst Port: 53826 (53826), Seq: 90, Ack: 122, Len: 21
Secure Sockets Layer

No.     Time        Source                Destination           Protocol Length Info
     13 11.159967   10.164.110.195        50.22.225.87          TCP      68     53826 > https [ACK] Seq=151 Ack=111 Win=5240 Len=0 TSval=95212 TSecr=1130218835

Frame 13: 68 bytes on wire (544 bits), 68 bytes captured (544 bits)
Linux cooked capture
Internet Protocol Version 4, Src: 10.164.110.195 (10.164.110.195), Dst: 50.22.225.87 (50.22.225.87)
Transmission Control Protocol, Src Port: 53826 (53826), Dst Port: https (443), Seq: 151, Ack: 111, Len: 0

No.     Time        Source                Destination           Protocol Length Info
     14 11.793457   50.22.225.87          10.164.110.195        TCP      68     https > 53826 [ACK] Seq=111 Ack=151 Win=262144 Len=0 TSval=1130219530 TSecr=95207

Frame 14: 68 bytes on wire (544 bits), 68 bytes captured (544 bits)
Linux cooked capture
Internet Protocol Version 4, Src: 50.22.225.87 (50.22.225.87), Dst: 10.164.110.195 (10.164.110.195)
Transmission Control Protocol, Src Port: https (443), Dst Port: 53826 (53826), Seq: 111, Ack: 151, Len: 0

No.     Time        Source                Destination           Protocol Length Info
     15 11.793808   10.164.110.195        50.22.225.87          SSL      160    Continuation Data

Frame 15: 160 bytes on wire (1280 bits), 160 bytes captured (1280 bits)
Linux cooked capture
Internet Protocol Version 4, Src: 10.164.110.195 (10.164.110.195), Dst: 50.22.225.87 (50.22.225.87)
Transmission Control Protocol, Src Port: 53826 (53826), Dst Port: https (443), Seq: 151, Ack: 111, Len: 92
Secure Sockets Layer

No.     Time        Source                Destination           Protocol Length Info
     16 12.413543   50.22.225.87          10.164.110.195        SSL      235    Continuation Data

Frame 16: 235 bytes on wire (1880 bits), 235 bytes captured (1880 bits)
Linux cooked capture
Internet Protocol Version 4, Src: 50.22.225.87 (50.22.225.87), Dst: 10.164.110.195 (10.164.110.195)
Transmission Control Protocol, Src Port: https (443), Dst Port: 53826 (53826), Seq: 111, Ack: 243, Len: 167
Secure Sockets Layer

No.     Time        Source                Destination           Protocol Length Info
     17 12.414363   10.164.110.195        50.22.225.87          TCP      68     53826 > https [ACK] Seq=243 Ack=278 Win=6312 Len=0 TSval=95337 TSecr=1130220102

Frame 17: 68 bytes on wire (544 bits), 68 bytes captured (544 bits)
Linux cooked capture
Internet Protocol Version 4, Src: 10.164.110.195 (10.164.110.195), Dst: 50.22.225.87 (50.22.225.87)
Transmission Control Protocol, Src Port: 53826 (53826), Dst Port: https (443), Seq: 243, Ack: 278, Len: 0

No.     Time        Source                Destination           Protocol Length Info
     18 12.443443   50.22.225.87          10.164.110.195        SSL      114    Continuation Data

Frame 18: 114 bytes on wire (912 bits), 114 bytes captured (912 bits)
Linux cooked capture
Internet Protocol Version 4, Src: 50.22.225.87 (50.22.225.87), Dst: 10.164.110.195 (10.164.110.195)
Transmission Control Protocol, Src Port: https (443), Dst Port: 53826 (53826), Seq: 278, Ack: 243, Len: 46
Secure Sockets Layer

No.     Time        Source                Destination           Protocol Length Info
     19 12.444698   10.164.110.195        50.22.225.87          TCP      68     53826 > https [ACK] Seq=243 Ack=324 Win=6312 Len=0 TSval=95340 TSecr=1130220125

Frame 19: 68 bytes on wire (544 bits), 68 bytes captured (544 bits)
Linux cooked capture
Internet Protocol Version 4, Src: 10.164.110.195 (10.164.110.195), Dst: 50.22.225.87 (50.22.225.87)
Transmission Control Protocol, Src Port: 53826 (53826), Dst Port: https (443), Seq: 243, Ack: 324, Len: 0

No.     Time        Source                Destination           Protocol Length Info
     20 12.476783   10.164.110.195        50.22.225.87          SSL      80     Continuation Data

Frame 20: 80 bytes on wire (640 bits), 80 bytes captured (640 bits)
Linux cooked capture
Internet Protocol Version 4, Src: 10.164.110.195 (10.164.110.195), Dst: 50.22.225.87 (50.22.225.87)
Transmission Control Protocol, Src Port: 53826 (53826), Dst Port: https (443), Seq: 243, Ack: 324, Len: 12
Secure Sockets Layer

No.     Time        Source                Destination           Protocol Length Info
     21 13.083563   50.22.225.87          10.164.110.195        SSL      95     Continuation Data

Frame 21: 95 bytes on wire (760 bits), 95 bytes captured (760 bits)
Linux cooked capture
Internet Protocol Version 4, Src: 50.22.225.87 (50.22.225.87), Dst: 10.164.110.195 (10.164.110.195)
Transmission Control Protocol, Src Port: https (443), Dst Port: 53826 (53826), Seq: 324, Ack: 255, Len: 27
Secure Sockets Layer

No.     Time        Source                Destination           Protocol Length Info
     22 13.084368   10.164.110.195        50.22.225.87          SSL      93     Continuation Data

Frame 22: 93 bytes on wire (744 bits), 93 bytes captured (744 bits)
Linux cooked capture
Internet Protocol Version 4, Src: 10.164.110.195 (10.164.110.195), Dst: 50.22.225.87 (50.22.225.87)
Transmission Control Protocol, Src Port: 53826 (53826), Dst Port: https (443), Seq: 255, Ack: 351, Len: 25
Secure Sockets Layer

No.     Time        Source                Destination           Protocol Length Info
     23 13.172820   10.164.110.195        130.186.6.177         TCP      76     50502 > imaps [SYN] Seq=0 Win=5240 Len=0 MSS=1310 SACK_PERM=1 TSval=95413 TSecr=0 WS=4

Frame 23: 76 bytes on wire (608 bits), 76 bytes captured (608 bits)
Linux cooked capture
Internet Protocol Version 4, Src: 10.164.110.195 (10.164.110.195), Dst: 130.186.6.177 (130.186.6.177)
Transmission Control Protocol, Src Port: 50502 (50502), Dst Port: imaps (993), Seq: 0, Len: 0

No.     Time        Source                Destination           Protocol Length Info
     24 13.503442   50.22.225.87          10.164.110.195        SSL      86     Continuation Data

Frame 24: 86 bytes on wire (688 bits), 86 bytes captured (688 bits)
Linux cooked capture
Internet Protocol Version 4, Src: 50.22.225.87 (50.22.225.87), Dst: 10.164.110.195 (10.164.110.195)
Transmission Control Protocol, Src Port: https (443), Dst Port: 53826 (53826), Seq: 351, Ack: 280, Len: 18
Secure Sockets Layer

No.     Time        Source                Destination           Protocol Length Info
     25 13.549995   10.164.110.195        50.22.225.87          TCP      68     53826 > https [ACK] Seq=280 Ack=369 Win=6312 Len=0 TSval=95451 TSecr=1130221240

Frame 25: 68 bytes on wire (544 bits), 68 bytes captured (544 bits)
Linux cooked capture
Internet Protocol Version 4, Src: 10.164.110.195 (10.164.110.195), Dst: 50.22.225.87 (50.22.225.87)
Transmission Control Protocol, Src Port: 53826 (53826), Dst Port: https (443), Seq: 280, Ack: 369, Len: 0

No.     Time        Source                Destination           Protocol Length Info
     26 13.573480   130.186.6.177         10.164.110.195        TCP      76     imaps > 50502 [SYN, ACK] Seq=0 Ack=1 Win=5792 Len=0 MSS=1400 SACK_PERM=1 TSval=2095241132 TSecr=95413 WS=128

Frame 26: 76 bytes on wire (608 bits), 76 bytes captured (608 bits)
Linux cooked capture
Internet Protocol Version 4, Src: 130.186.6.177 (130.186.6.177), Dst: 10.164.110.195 (10.164.110.195)
Transmission Control Protocol, Src Port: imaps (993), Dst Port: 50502 (50502), Seq: 0, Ack: 1, Len: 0

No.     Time        Source                Destination           Protocol Length Info
     27 13.573752   10.164.110.195        130.186.6.177         TCP      68     50502 > imaps [ACK] Seq=1 Ack=1 Win=5240 Len=0 TSval=95453 TSecr=2095241132

Frame 27: 68 bytes on wire (544 bits), 68 bytes captured (544 bits)
Linux cooked capture
Internet Protocol Version 4, Src: 10.164.110.195 (10.164.110.195), Dst: 130.186.6.177 (130.186.6.177)
Transmission Control Protocol, Src Port: 50502 (50502), Dst Port: imaps (993), Seq: 1, Ack: 1, Len: 0

No.     Time        Source                Destination           Protocol Length Info
     28 13.678652   10.164.110.195        130.186.6.177         TLSv1    180    Client Hello

Frame 28: 180 bytes on wire (1440 bits), 180 bytes captured (1440 bits)
Linux cooked capture
Internet Protocol Version 4, Src: 10.164.110.195 (10.164.110.195), Dst: 130.186.6.177 (130.186.6.177)
Transmission Control Protocol, Src Port: 50502 (50502), Dst Port: imaps (993), Seq: 1, Ack: 1, Len: 112
Secure Sockets Layer

No.     Time        Source                Destination           Protocol Length Info
     29 14.349158   10.164.110.195        50.22.225.87          SSL      122    Continuation Data

Frame 29: 122 bytes on wire (976 bits), 122 bytes captured (976 bits)
Linux cooked capture
Internet Protocol Version 4, Src: 10.164.110.195 (10.164.110.195), Dst: 50.22.225.87 (50.22.225.87)
Transmission Control Protocol, Src Port: 53826 (53826), Dst Port: https (443), Seq: 280, Ack: 369, Len: 54
Secure Sockets Layer

No.     Time        Source                Destination           Protocol Length Info
     30 14.655432   130.186.6.177         10.164.110.195        TCP      68     imaps > 50502 [ACK] Seq=1 Ack=113 Win=5888 Len=0 TSval=2095241788 TSecr=95463

Frame 30: 68 bytes on wire (544 bits), 68 bytes captured (544 bits)
Linux cooked capture
Internet Protocol Version 4, Src: 130.186.6.177 (130.186.6.177), Dst: 10.164.110.195 (10.164.110.195)
Transmission Control Protocol, Src Port: imaps (993), Dst Port: 50502 (50502), Seq: 1, Ack: 113, Len: 0

No.     Time        Source                Destination           Protocol Length Info
     31 14.675563   130.186.6.177         10.164.110.195        TLSv1    1366   Server Hello

Frame 31: 1366 bytes on wire (10928 bits), 1366 bytes captured (10928 bits)
Linux cooked capture
Internet Protocol Version 4, Src: 130.186.6.177 (130.186.6.177), Dst: 10.164.110.195 (10.164.110.195)
Transmission Control Protocol, Src Port: imaps (993), Dst Port: 50502 (50502), Seq: 1, Ack: 113, Len: 1298
Secure Sockets Layer

No.     Time        Source                Destination           Protocol Length Info
     32 14.675777   10.164.110.195        130.186.6.177         TCP      68     50502 > imaps [ACK] Seq=113 Ack=1299 Win=7836 Len=0 TSval=95563 TSecr=2095241788

Frame 32: 68 bytes on wire (544 bits), 68 bytes captured (544 bits)
Linux cooked capture
Internet Protocol Version 4, Src: 10.164.110.195 (10.164.110.195), Dst: 130.186.6.177 (130.186.6.177)
Transmission Control Protocol, Src Port: 50502 (50502), Dst Port: imaps (993), Seq: 113, Ack: 1299, Len: 0

No.     Time        Source                Destination           Protocol Length Info
     33 14.725833   130.186.6.177         10.164.110.195        TCP      1366   [TCP segment of a reassembled PDU]

Frame 33: 1366 bytes on wire (10928 bits), 1366 bytes captured (10928 bits)
Linux cooked capture
Internet Protocol Version 4, Src: 130.186.6.177 (130.186.6.177), Dst: 10.164.110.195 (10.164.110.195)
Transmission Control Protocol, Src Port: imaps (993), Dst Port: 50502 (50502), Seq: 1299, Ack: 113, Len: 1298

No.     Time        Source                Destination           Protocol Length Info
     34 14.726057   10.164.110.195        130.186.6.177         TCP      68     50502 > imaps [ACK] Seq=113 Ack=2597 Win=10432 Len=0 TSval=95568 TSecr=2095241788

Frame 34: 68 bytes on wire (544 bits), 68 bytes captured (544 bits)
Linux cooked capture
Internet Protocol Version 4, Src: 10.164.110.195 (10.164.110.195), Dst: 130.186.6.177 (130.186.6.177)
Transmission Control Protocol, Src Port: 50502 (50502), Dst Port: imaps (993), Seq: 113, Ack: 2597, Len: 0

No.     Time        Source                Destination           Protocol Length Info
     35 14.775667   130.186.6.177         10.164.110.195        TCP      1366   [TCP segment of a reassembled PDU]

Frame 35: 1366 bytes on wire (10928 bits), 1366 bytes captured (10928 bits)
Linux cooked capture
Internet Protocol Version 4, Src: 130.186.6.177 (130.186.6.177), Dst: 10.164.110.195 (10.164.110.195)
Transmission Control Protocol, Src Port: imaps (993), Dst Port: 50502 (50502), Seq: 2597, Ack: 113, Len: 1298

No.     Time        Source                Destination           Protocol Length Info
     36 14.775948   10.164.110.195        130.186.6.177         TCP      68     50502 > imaps [ACK] Seq=113 Ack=3895 Win=13028 Len=0 TSval=95573 TSecr=2095241788

Frame 36: 68 bytes on wire (544 bits), 68 bytes captured (544 bits)
Linux cooked capture
Internet Protocol Version 4, Src: 10.164.110.195 (10.164.110.195), Dst: 130.186.6.177 (130.186.6.177)
Transmission Control Protocol, Src Port: 50502 (50502), Dst Port: imaps (993), Seq: 113, Ack: 3895, Len: 0

No.     Time        Source                Destination           Protocol Length Info
     37 14.776015   50.22.225.87          10.164.110.195        SSL      112    Continuation Data

Frame 37: 112 bytes on wire (896 bits), 112 bytes captured (896 bits)
Linux cooked capture
Internet Protocol Version 4, Src: 50.22.225.87 (50.22.225.87), Dst: 10.164.110.195 (10.164.110.195)
Transmission Control Protocol, Src Port: https (443), Dst Port: 53826 (53826), Seq: 369, Ack: 334, Len: 44
Secure Sockets Layer

No.     Time        Source                Destination           Protocol Length Info
     38 14.776570   10.164.110.195        50.22.225.87          TCP      68     53826 > https [ACK] Seq=334 Ack=413 Win=6312 Len=0 TSval=95573 TSecr=1130222572

Frame 38: 68 bytes on wire (544 bits), 68 bytes captured (544 bits)
Linux cooked capture
Internet Protocol Version 4, Src: 10.164.110.195 (10.164.110.195), Dst: 50.22.225.87 (50.22.225.87)
Transmission Control Protocol, Src Port: 53826 (53826), Dst Port: https (443), Seq: 334, Ack: 413, Len: 0

No.     Time        Source                Destination           Protocol Length Info
     39 14.835658   130.186.6.177         10.164.110.195        TLSv1    1318   Certificate, Server Key Exchange, Server Hello Done

Frame 39: 1318 bytes on wire (10544 bits), 1318 bytes captured (10544 bits)
Linux cooked capture
Internet Protocol Version 4, Src: 130.186.6.177 (130.186.6.177), Dst: 10.164.110.195 (10.164.110.195)
Transmission Control Protocol, Src Port: imaps (993), Dst Port: 50502 (50502), Seq: 3895, Ack: 113, Len: 1250
[4 Reassembled TCP Segments (5058 bytes): #31(1212), #33(1298), #35(1298), #39(1250)]
Secure Sockets Layer

No.     Time        Source                Destination           Protocol Length Info
     40 14.835870   10.164.110.195        130.186.6.177         TCP      68     50502 > imaps [ACK] Seq=113 Ack=5145 Win=15624 Len=0 TSval=95579 TSecr=2095242490

Frame 40: 68 bytes on wire (544 bits), 68 bytes captured (544 bits)
Linux cooked capture
Internet Protocol Version 4, Src: 10.164.110.195 (10.164.110.195), Dst: 130.186.6.177 (130.186.6.177)
Transmission Control Protocol, Src Port: 50502 (50502), Dst Port: imaps (993), Seq: 113, Ack: 5145, Len: 0

No.     Time        Source                Destination           Protocol Length Info
     41 15.338775   10.164.110.195        50.22.225.87          SSL      122    Continuation Data

Frame 41: 122 bytes on wire (976 bits), 122 bytes captured (976 bits)
Linux cooked capture
Internet Protocol Version 4, Src: 10.164.110.195 (10.164.110.195), Dst: 50.22.225.87 (50.22.225.87)
Transmission Control Protocol, Src Port: 53826 (53826), Dst Port: https (443), Seq: 334, Ack: 413, Len: 54
Secure Sockets Layer

No.     Time        Source                Destination           Protocol Length Info
     42 15.384538   10.164.110.195        130.186.6.177         TLSv1    258    Client Key Exchange, Change Cipher Spec, Encrypted Handshake Message

Frame 42: 258 bytes on wire (2064 bits), 258 bytes captured (2064 bits)
Linux cooked capture
Internet Protocol Version 4, Src: 10.164.110.195 (10.164.110.195), Dst: 130.186.6.177 (130.186.6.177)
Transmission Control Protocol, Src Port: 50502 (50502), Dst Port: imaps (993), Seq: 113, Ack: 5145, Len: 190
Secure Sockets Layer

No.     Time        Source                Destination           Protocol Length Info
     43 15.595383   50.22.225.87          10.164.110.195        SSL      112    Continuation Data

Frame 43: 112 bytes on wire (896 bits), 112 bytes captured (896 bits)
Linux cooked capture
Internet Protocol Version 4, Src: 50.22.225.87 (50.22.225.87), Dst: 10.164.110.195 (10.164.110.195)
Transmission Control Protocol, Src Port: https (443), Dst Port: 53826 (53826), Seq: 413, Ack: 388, Len: 44
Secure Sockets Layer

No.     Time        Source                Destination           Protocol Length Info
     44 15.595913   10.164.110.195        50.22.225.87          TCP      68     53826 > https [ACK] Seq=388 Ack=457 Win=6312 Len=0 TSval=95655 TSecr=1130223407

Frame 44: 68 bytes on wire (544 bits), 68 bytes captured (544 bits)
Linux cooked capture
Internet Protocol Version 4, Src: 10.164.110.195 (10.164.110.195), Dst: 50.22.225.87 (50.22.225.87)
Transmission Control Protocol, Src Port: 53826 (53826), Dst Port: https (443), Seq: 388, Ack: 457, Len: 0

No.     Time        Source                Destination           Protocol Length Info
     45 15.625488   130.186.6.177         10.164.110.195        TLSv1    119    Change Cipher Spec, Encrypted Handshake Message

Frame 45: 119 bytes on wire (952 bits), 119 bytes captured (952 bits)
Linux cooked capture
Internet Protocol Version 4, Src: 130.186.6.177 (130.186.6.177), Dst: 10.164.110.195 (10.164.110.195)
Transmission Control Protocol, Src Port: imaps (993), Dst Port: 50502 (50502), Seq: 5145, Ack: 303, Len: 51
Secure Sockets Layer

No.     Time        Source                Destination           Protocol Length Info
     46 15.625740   10.164.110.195        130.186.6.177         TCP      68     50502 > imaps [ACK] Seq=303 Ack=5196 Win=15624 Len=0 TSval=95658 TSecr=2095243292

Frame 46: 68 bytes on wire (544 bits), 68 bytes captured (544 bits)
Linux cooked capture
Internet Protocol Version 4, Src: 10.164.110.195 (10.164.110.195), Dst: 130.186.6.177 (130.186.6.177)
Transmission Control Protocol, Src Port: 50502 (50502), Dst Port: imaps (993), Seq: 303, Ack: 5196, Len: 0

No.     Time        Source                Destination           Protocol Length Info
     47 15.747530   10.164.110.195        157.56.195.250        TCP      68     57797 > imaps [FIN, ACK] Seq=1 Ack=1 Win=7151 Len=0 TSval=95670 TSecr=147999498

Frame 47: 68 bytes on wire (544 bits), 68 bytes captured (544 bits)
Linux cooked capture
Internet Protocol Version 4, Src: 10.164.110.195 (10.164.110.195), Dst: 157.56.195.250 (157.56.195.250)
Transmission Control Protocol, Src Port: 57797 (57797), Dst Port: imaps (993), Seq: 1, Ack: 1, Len: 0

No.     Time        Source                Destination           Protocol Length Info
     48 15.785390   130.186.6.177         10.164.110.195        TLSv1    113    Application Data

Frame 48: 113 bytes on wire (904 bits), 113 bytes captured (904 bits)
Linux cooked capture
Internet Protocol Version 4, Src: 130.186.6.177 (130.186.6.177), Dst: 10.164.110.195 (10.164.110.195)
Transmission Control Protocol, Src Port: imaps (993), Dst Port: 50502 (50502), Seq: 5196, Ack: 303, Len: 45
Secure Sockets Layer

No.     Time        Source                Destination           Protocol Length Info
     49 15.785763   10.164.110.195        130.186.6.177         TCP      68     50502 > imaps [ACK] Seq=303 Ack=5241 Win=15624 Len=0 TSval=95674 TSecr=2095243450

Frame 49: 68 bytes on wire (544 bits), 68 bytes captured (544 bits)
Linux cooked capture
Internet Protocol Version 4, Src: 10.164.110.195 (10.164.110.195), Dst: 130.186.6.177 (130.186.6.177)
Transmission Control Protocol, Src Port: 50502 (50502), Dst Port: imaps (993), Seq: 303, Ack: 5241, Len: 0

No.     Time        Source                Destination           Protocol Length Info
     50 15.787732   10.164.110.195        130.186.6.177         TLSv1    113    Application Data

Frame 50: 113 bytes on wire (904 bits), 113 bytes captured (904 bits)
Linux cooked capture
Internet Protocol Version 4, Src: 10.164.110.195 (10.164.110.195), Dst: 130.186.6.177 (130.186.6.177)
Transmission Control Protocol, Src Port: 50502 (50502), Dst Port: imaps (993), Seq: 303, Ack: 5241, Len: 45
Secure Sockets Layer

No.     Time        Source                Destination           Protocol Length Info
     51 15.895378   157.56.195.250        10.164.110.195        TCP      68     imaps > 57797 [ACK] Seq=1 Ack=2 Win=254 Len=0 TSval=148051109 TSecr=95670

Frame 51: 68 bytes on wire (544 bits), 68 bytes captured (544 bits)
Linux cooked capture
Internet Protocol Version 4, Src: 157.56.195.250 (157.56.195.250), Dst: 10.164.110.195 (10.164.110.195)
Transmission Control Protocol, Src Port: imaps (993), Dst Port: 57797 (57797), Seq: 1, Ack: 2, Len: 0

No.     Time        Source                Destination           Protocol Length Info
     52 15.905335   157.56.195.250        10.164.110.195        TCP      68     imaps > 57797 [FIN, ACK] Seq=1 Ack=2 Win=254 Len=0 TSval=148051109 TSecr=95670

Frame 52: 68 bytes on wire (544 bits), 68 bytes captured (544 bits)
Linux cooked capture
Internet Protocol Version 4, Src: 157.56.195.250 (157.56.195.250), Dst: 10.164.110.195 (10.164.110.195)
Transmission Control Protocol, Src Port: imaps (993), Dst Port: 57797 (57797), Seq: 1, Ack: 2, Len: 0

No.     Time        Source                Destination           Protocol Length Info
     53 15.905548   10.164.110.195        157.56.195.250        TCP      68     57797 > imaps [ACK] Seq=2 Ack=2 Win=7151 Len=0 TSval=95686 TSecr=148051109

Frame 53: 68 bytes on wire (544 bits), 68 bytes captured (544 bits)
Linux cooked capture
Internet Protocol Version 4, Src: 10.164.110.195 (10.164.110.195), Dst: 157.56.195.250 (157.56.195.250)
Transmission Control Protocol, Src Port: 57797 (57797), Dst Port: imaps (993), Seq: 2, Ack: 2, Len: 0

No.     Time        Source                Destination           Protocol Length Info
     54 15.985693   130.186.6.177         10.164.110.195        TLSv1    369    Application Data

Frame 54: 369 bytes on wire (2952 bits), 369 bytes captured (2952 bits)
Linux cooked capture
Internet Protocol Version 4, Src: 130.186.6.177 (130.186.6.177), Dst: 10.164.110.195 (10.164.110.195)
Transmission Control Protocol, Src Port: imaps (993), Dst Port: 50502 (50502), Seq: 5241, Ack: 348, Len: 301
Secure Sockets Layer

No.     Time        Source                Destination           Protocol Length Info
     55 15.995888   10.164.110.195        130.186.6.177         TLSv1    113    Application Data

Frame 55: 113 bytes on wire (904 bits), 113 bytes captured (904 bits)
Linux cooked capture
Internet Protocol Version 4, Src: 10.164.110.195 (10.164.110.195), Dst: 130.186.6.177 (130.186.6.177)
Transmission Control Protocol, Src Port: 50502 (50502), Dst Port: imaps (993), Seq: 348, Ack: 5542, Len: 45
Secure Sockets Layer

No.     Time        Source                Destination           Protocol Length Info
     56 16.185543   130.186.6.177         10.164.110.195        TLSv1    369    Application Data

Frame 56: 369 bytes on wire (2952 bits), 369 bytes captured (2952 bits)
Linux cooked capture
Internet Protocol Version 4, Src: 130.186.6.177 (130.186.6.177), Dst: 10.164.110.195 (10.164.110.195)
Transmission Control Protocol, Src Port: imaps (993), Dst Port: 50502 (50502), Seq: 5542, Ack: 393, Len: 301
Secure Sockets Layer

No.     Time        Source                Destination           Protocol Length Info
     57 16.207292   10.164.110.195        130.186.6.177         TLSv1    145    Application Data

Frame 57: 145 bytes on wire (1160 bits), 145 bytes captured (1160 bits)
Linux cooked capture
Internet Protocol Version 4, Src: 10.164.110.195 (10.164.110.195), Dst: 130.186.6.177 (130.186.6.177)
Transmission Control Protocol, Src Port: 50502 (50502), Dst Port: imaps (993), Seq: 393, Ack: 5843, Len: 77
Secure Sockets Layer

No.     Time        Source                Destination           Protocol Length Info
     58 16.405528   130.186.6.177         10.164.110.195        TLSv1    393    Application Data

Frame 58: 393 bytes on wire (3144 bits), 393 bytes captured (3144 bits)
Linux cooked capture
Internet Protocol Version 4, Src: 130.186.6.177 (130.186.6.177), Dst: 10.164.110.195 (10.164.110.195)
Transmission Control Protocol, Src Port: imaps (993), Dst Port: 50502 (50502), Seq: 5843, Ack: 470, Len: 325
Secure Sockets Layer

No.     Time        Source                Destination           Protocol Length Info
     59 16.433070   10.164.110.195        130.186.6.177         TLSv1    113    Application Data

Frame 59: 113 bytes on wire (904 bits), 113 bytes captured (904 bits)
Linux cooked capture
Internet Protocol Version 4, Src: 10.164.110.195 (10.164.110.195), Dst: 130.186.6.177 (130.186.6.177)
Transmission Control Protocol, Src Port: 50502 (50502), Dst Port: imaps (993), Seq: 470, Ack: 6168, Len: 45
Secure Sockets Layer

No.     Time        Source                Destination           Protocol Length Info
     60 16.595613   130.186.6.177         10.164.110.195        TLSv1    1329   Application Data

Frame 60: 1329 bytes on wire (10632 bits), 1329 bytes captured (10632 bits)
Linux cooked capture
Internet Protocol Version 4, Src: 130.186.6.177 (130.186.6.177), Dst: 10.164.110.195 (10.164.110.195)
Transmission Control Protocol, Src Port: imaps (993), Dst Port: 50502 (50502), Seq: 6168, Ack: 515, Len: 1261
Secure Sockets Layer

No.     Time        Source                Destination           Protocol Length Info
     61 16.629863   10.164.110.195        130.186.6.177         TCP      68     50502 > imaps [ACK] Seq=515 Ack=7429 Win=26008 Len=0 TSval=95759 TSecr=2095244252

Frame 61: 68 bytes on wire (544 bits), 68 bytes captured (544 bits)
Linux cooked capture
Internet Protocol Version 4, Src: 10.164.110.195 (10.164.110.195), Dst: 130.186.6.177 (130.186.6.177)
Transmission Control Protocol, Src Port: 50502 (50502), Dst Port: imaps (993), Seq: 515, Ack: 7429, Len: 0

No.     Time        Source                Destination           Protocol Length Info
     62 17.156107   10.164.110.195        130.186.6.177         TLSv1    105    Application Data

Frame 62: 105 bytes on wire (840 bits), 105 bytes captured (840 bits)
Linux cooked capture
Internet Protocol Version 4, Src: 10.164.110.195 (10.164.110.195), Dst: 130.186.6.177 (130.186.6.177)
Transmission Control Protocol, Src Port: 50502 (50502), Dst Port: imaps (993), Seq: 515, Ack: 7429, Len: 37
Secure Sockets Layer

No.     Time        Source                Destination           Protocol Length Info
     63 17.306853   130.186.6.177         10.164.110.195        TLSv1    121    Application Data

Frame 63: 121 bytes on wire (968 bits), 121 bytes captured (968 bits)
Linux cooked capture
Internet Protocol Version 4, Src: 130.186.6.177 (130.186.6.177), Dst: 10.164.110.195 (10.164.110.195)
Transmission Control Protocol, Src Port: imaps (993), Dst Port: 50502 (50502), Seq: 7429, Ack: 552, Len: 53
Secure Sockets Layer

No.     Time        Source                Destination           Protocol Length Info
     64 17.307307   10.164.110.195        130.186.6.177         TCP      68     50502 > imaps [ACK] Seq=552 Ack=7482 Win=26008 Len=0 TSval=95826 TSecr=2095244971

Frame 64: 68 bytes on wire (544 bits), 68 bytes captured (544 bits)
Linux cooked capture
Internet Protocol Version 4, Src: 10.164.110.195 (10.164.110.195), Dst: 130.186.6.177 (130.186.6.177)
Transmission Control Protocol, Src Port: 50502 (50502), Dst Port: imaps (993), Seq: 552, Ack: 7482, Len: 0

No.     Time        Source                Destination           Protocol Length Info
     65 17.311628   10.164.110.195        130.186.6.177         TLSv1    113    Application Data

Frame 65: 113 bytes on wire (904 bits), 113 bytes captured (904 bits)
Linux cooked capture
Internet Protocol Version 4, Src: 10.164.110.195 (10.164.110.195), Dst: 130.186.6.177 (130.186.6.177)
Transmission Control Protocol, Src Port: 50502 (50502), Dst Port: imaps (993), Seq: 552, Ack: 7482, Len: 45
Secure Sockets Layer

No.     Time        Source                Destination           Protocol Length Info
     66 17.505542   130.186.6.177         10.164.110.195        TLSv1    585    Application Data

Frame 66: 585 bytes on wire (4680 bits), 585 bytes captured (4680 bits)
Linux cooked capture
Internet Protocol Version 4, Src: 130.186.6.177 (130.186.6.177), Dst: 10.164.110.195 (10.164.110.195)
Transmission Control Protocol, Src Port: imaps (993), Dst Port: 50502 (50502), Seq: 7482, Ack: 597, Len: 517
Secure Sockets Layer

No.     Time        Source                Destination           Protocol Length Info
     67 17.506150   10.164.110.195        130.186.6.177         TCP      68     50502 > imaps [ACK] Seq=597 Ack=7999 Win=28604 Len=0 TSval=95846 TSecr=2095245172

Frame 67: 68 bytes on wire (544 bits), 68 bytes captured (544 bits)
Linux cooked capture
Internet Protocol Version 4, Src: 10.164.110.195 (10.164.110.195), Dst: 130.186.6.177 (130.186.6.177)
Transmission Control Protocol, Src Port: 50502 (50502), Dst Port: imaps (993), Seq: 597, Ack: 7999, Len: 0

No.     Time        Source                Destination           Protocol Length Info
     68 17.524548   10.164.110.195        130.186.6.177         TLSv1    129    Application Data

Frame 68: 129 bytes on wire (1032 bits), 129 bytes captured (1032 bits)
Linux cooked capture
Internet Protocol Version 4, Src: 10.164.110.195 (10.164.110.195), Dst: 130.186.6.177 (130.186.6.177)
Transmission Control Protocol, Src Port: 50502 (50502), Dst Port: imaps (993), Seq: 597, Ack: 7999, Len: 61
Secure Sockets Layer

No.     Time        Source                Destination           Protocol Length Info
     69 17.745415   130.186.6.177         10.164.110.195        TLSv1    241    Application Data

Frame 69: 241 bytes on wire (1928 bits), 241 bytes captured (1928 bits)
Linux cooked capture
Internet Protocol Version 4, Src: 130.186.6.177 (130.186.6.177), Dst: 10.164.110.195 (10.164.110.195)
Transmission Control Protocol, Src Port: imaps (993), Dst Port: 50502 (50502), Seq: 7999, Ack: 658, Len: 173
Secure Sockets Layer

No.     Time        Source                Destination           Protocol Length Info
     70 17.775602   10.164.110.195        130.186.6.177         TLSv1    233    Application Data

Frame 70: 233 bytes on wire (1864 bits), 233 bytes captured (1864 bits)
Linux cooked capture
Internet Protocol Version 4, Src: 10.164.110.195 (10.164.110.195), Dst: 130.186.6.177 (130.186.6.177)
Transmission Control Protocol, Src Port: 50502 (50502), Dst Port: imaps (993), Seq: 658, Ack: 8172, Len: 165
Secure Sockets Layer

No.     Time        Source                Destination           Protocol Length Info
     71 18.025525   130.186.6.177         10.164.110.195        TLSv1    137    Application Data

Frame 71: 137 bytes on wire (1096 bits), 137 bytes captured (1096 bits)
Linux cooked capture
Internet Protocol Version 4, Src: 130.186.6.177 (130.186.6.177), Dst: 10.164.110.195 (10.164.110.195)
Transmission Control Protocol, Src Port: imaps (993), Dst Port: 50502 (50502), Seq: 8172, Ack: 823, Len: 69
Secure Sockets Layer

No.     Time        Source                Destination           Protocol Length Info
     72 18.059898   10.164.110.195        130.186.6.177         TCP      68     50502 > imaps [ACK] Seq=823 Ack=8241 Win=31200 Len=0 TSval=95902 TSecr=2095245691

Frame 72: 68 bytes on wire (544 bits), 68 bytes captured (544 bits)
Linux cooked capture
Internet Protocol Version 4, Src: 10.164.110.195 (10.164.110.195), Dst: 130.186.6.177 (130.186.6.177)
Transmission Control Protocol, Src Port: 50502 (50502), Dst Port: imaps (993), Seq: 823, Ack: 8241, Len: 0

No.     Time        Source                Destination           Protocol Length Info
     73 18.205563   130.186.6.177         10.164.110.195        TLSv1    1133   Application Data, Application Data, Application Data, Application Data, Application Data

Frame 73: 1133 bytes on wire (9064 bits), 1133 bytes captured (9064 bits)
Linux cooked capture
Internet Protocol Version 4, Src: 130.186.6.177 (130.186.6.177), Dst: 10.164.110.195 (10.164.110.195)
Transmission Control Protocol, Src Port: imaps (993), Dst Port: 50502 (50502), Seq: 8241, Ack: 823, Len: 1065
Secure Sockets Layer

No.     Time        Source                Destination           Protocol Length Info
     74 18.205780   10.164.110.195        130.186.6.177         TCP      68     50502 > imaps [ACK] Seq=823 Ack=9306 Win=33796 Len=0 TSval=95916 TSecr=2095245850

Frame 74: 68 bytes on wire (544 bits), 68 bytes captured (544 bits)
Linux cooked capture
Internet Protocol Version 4, Src: 10.164.110.195 (10.164.110.195), Dst: 130.186.6.177 (130.186.6.177)
Transmission Control Protocol, Src Port: 50502 (50502), Dst Port: imaps (993), Seq: 823, Ack: 9306, Len: 0

No.     Time        Source                Destination           Protocol Length Info
     75 19.359817   10.164.110.195        173.194.44.4          TCP      68     40177 > https [FIN, ACK] Seq=1 Ack=1 Win=3906 Len=0 TSval=96032 TSecr=782612840

Frame 75: 68 bytes on wire (544 bits), 68 bytes captured (544 bits)
Linux cooked capture
Internet Protocol Version 4, Src: 10.164.110.195 (10.164.110.195), Dst: 173.194.44.4 (173.194.44.4)
Transmission Control Protocol, Src Port: 40177 (40177), Dst Port: https (443), Seq: 1, Ack: 1, Len: 0

No.     Time        Source                Destination           Protocol Length Info
     76 19.375563   50.22.225.87          10.164.110.195        SSL      110    Continuation Data

Frame 76: 110 bytes on wire (880 bits), 110 bytes captured (880 bits)
Linux cooked capture
Internet Protocol Version 4, Src: 50.22.225.87 (50.22.225.87), Dst: 10.164.110.195 (10.164.110.195)
Transmission Control Protocol, Src Port: https (443), Dst Port: 53826 (53826), Seq: 457, Ack: 388, Len: 42
Secure Sockets Layer

No.     Time        Source                Destination           Protocol Length Info
     77 19.375843   50.22.225.87          10.164.110.195        SSL      110    Continuation Data

Frame 77: 110 bytes on wire (880 bits), 110 bytes captured (880 bits)
Linux cooked capture
Internet Protocol Version 4, Src: 50.22.225.87 (50.22.225.87), Dst: 10.164.110.195 (10.164.110.195)
Transmission Control Protocol, Src Port: https (443), Dst Port: 53826 (53826), Seq: 499, Ack: 388, Len: 42
Secure Sockets Layer

No.     Time        Source                Destination           Protocol Length Info
     78 19.376072   10.164.110.195        50.22.225.87          TCP      68     53826 > https [ACK] Seq=388 Ack=499 Win=6312 Len=0 TSval=96033 TSecr=1130227184

Frame 78: 68 bytes on wire (544 bits), 68 bytes captured (544 bits)
Linux cooked capture
Internet Protocol Version 4, Src: 10.164.110.195 (10.164.110.195), Dst: 50.22.225.87 (50.22.225.87)
Transmission Control Protocol, Src Port: 53826 (53826), Dst Port: https (443), Seq: 388, Ack: 499, Len: 0

No.     Time        Source                Destination           Protocol Length Info
     79 19.379158   10.164.110.195        50.22.225.87          TCP      68     53826 > https [ACK] Seq=388 Ack=541 Win=6312 Len=0 TSval=96033 TSecr=1130227184

Frame 79: 68 bytes on wire (544 bits), 68 bytes captured (544 bits)
Linux cooked capture
Internet Protocol Version 4, Src: 10.164.110.195 (10.164.110.195), Dst: 50.22.225.87 (50.22.225.87)
Transmission Control Protocol, Src Port: 53826 (53826), Dst Port: https (443), Seq: 388, Ack: 541, Len: 0

No.     Time        Source                Destination           Protocol Length Info
     80 19.397008   10.164.110.195        50.22.225.87          SSL      112    Continuation Data

Frame 80: 112 bytes on wire (896 bits), 112 bytes captured (896 bits)
Linux cooked capture
Internet Protocol Version 4, Src: 10.164.110.195 (10.164.110.195), Dst: 50.22.225.87 (50.22.225.87)
Transmission Control Protocol, Src Port: 53826 (53826), Dst Port: https (443), Seq: 388, Ack: 541, Len: 44
Secure Sockets Layer

No.     Time        Source                Destination           Protocol Length Info
     81 19.745482   50.22.225.87          10.164.110.195        TCP      68     https > 53826 [ACK] Seq=541 Ack=432 Win=262144 Len=0 TSval=1130227557 TSecr=96035

Frame 81: 68 bytes on wire (544 bits), 68 bytes captured (544 bits)
Linux cooked capture
Internet Protocol Version 4, Src: 50.22.225.87 (50.22.225.87), Dst: 10.164.110.195 (10.164.110.195)
Transmission Control Protocol, Src Port: https (443), Dst Port: 53826 (53826), Seq: 541, Ack: 432, Len: 0

No.     Time        Source                Destination           Protocol Length Info
     82 19.745832   10.164.110.195        50.22.225.87          SSL      112    Continuation Data

Frame 82: 112 bytes on wire (896 bits), 112 bytes captured (896 bits)
Linux cooked capture
Internet Protocol Version 4, Src: 10.164.110.195 (10.164.110.195), Dst: 50.22.225.87 (50.22.225.87)
Transmission Control Protocol, Src Port: 53826 (53826), Dst Port: https (443), Seq: 432, Ack: 541, Len: 44
Secure Sockets Layer

No.     Time        Source                Destination           Protocol Length Info
     83 20.025460   50.22.225.87          10.164.110.195        TCP      68     https > 53826 [ACK] Seq=541 Ack=476 Win=262144 Len=0 TSval=1130227837 TSecr=96070

Frame 83: 68 bytes on wire (544 bits), 68 bytes captured (544 bits)
Linux cooked capture
Internet Protocol Version 4, Src: 50.22.225.87 (50.22.225.87), Dst: 10.164.110.195 (10.164.110.195)
Transmission Control Protocol, Src Port: https (443), Dst Port: 53826 (53826), Seq: 541, Ack: 476, Len: 0

No.     Time        Source                Destination           Protocol Length Info
     84 21.937137   10.164.110.195        50.22.225.87          SSL      145    Continuation Data

Frame 84: 145 bytes on wire (1160 bits), 145 bytes captured (1160 bits)
Linux cooked capture
Internet Protocol Version 4, Src: 10.164.110.195 (10.164.110.195), Dst: 50.22.225.87 (50.22.225.87)
Transmission Control Protocol, Src Port: 53826 (53826), Dst Port: https (443), Seq: 476, Ack: 541, Len: 77
Secure Sockets Layer

No.     Time        Source                Destination           Protocol Length Info
     85 22.195422   50.22.225.87          10.164.110.195        SSL      112    Continuation Data

Frame 85: 112 bytes on wire (896 bits), 112 bytes captured (896 bits)
Linux cooked capture
Internet Protocol Version 4, Src: 50.22.225.87 (50.22.225.87), Dst: 10.164.110.195 (10.164.110.195)
Transmission Control Protocol, Src Port: https (443), Dst Port: 53826 (53826), Seq: 541, Ack: 553, Len: 44
Secure Sockets Layer

No.     Time        Source                Destination           Protocol Length Info
     86 22.229868   10.164.110.195        50.22.225.87          TCP      68     53826 > https [ACK] Seq=553 Ack=585 Win=6312 Len=0 TSval=96319 TSecr=1130230008

Frame 86: 68 bytes on wire (544 bits), 68 bytes captured (544 bits)
Linux cooked capture
Internet Protocol Version 4, Src: 10.164.110.195 (10.164.110.195), Dst: 50.22.225.87 (50.22.225.87)
Transmission Control Protocol, Src Port: 53826 (53826), Dst Port: https (443), Seq: 553, Ack: 585, Len: 0

No.     Time        Source                Destination           Protocol Length Info
     87 24.607358   10.164.110.195        50.22.225.87          SSL      134    Continuation Data

Frame 87: 134 bytes on wire (1072 bits), 134 bytes captured (1072 bits)
Linux cooked capture
Internet Protocol Version 4, Src: 10.164.110.195 (10.164.110.195), Dst: 50.22.225.87 (50.22.225.87)
Transmission Control Protocol, Src Port: 53826 (53826), Dst Port: https (443), Seq: 553, Ack: 585, Len: 66
Secure Sockets Layer

No.     Time        Source                Destination           Protocol Length Info
     88 24.895420   50.22.225.87          10.164.110.195        SSL      112    Continuation Data

Frame 88: 112 bytes on wire (896 bits), 112 bytes captured (896 bits)
Linux cooked capture
Internet Protocol Version 4, Src: 50.22.225.87 (50.22.225.87), Dst: 10.164.110.195 (10.164.110.195)
Transmission Control Protocol, Src Port: https (443), Dst Port: 53826 (53826), Seq: 585, Ack: 619, Len: 44
Secure Sockets Layer

No.     Time        Source                Destination           Protocol Length Info
     89 24.895785   10.164.110.195        50.22.225.87          TCP      68     53826 > https [ACK] Seq=619 Ack=629 Win=6312 Len=0 TSval=96585 TSecr=1130232687

Frame 89: 68 bytes on wire (544 bits), 68 bytes captured (544 bits)
Linux cooked capture
Internet Protocol Version 4, Src: 10.164.110.195 (10.164.110.195), Dst: 50.22.225.87 (50.22.225.87)
Transmission Control Protocol, Src Port: 53826 (53826), Dst Port: https (443), Seq: 619, Ack: 629, Len: 0

No.     Time        Source                Destination           Protocol Length Info
     90 25.095377   54.235.185.74         10.164.110.195        TCP      68     http > 39167 [FIN, ACK] Seq=1 Ack=1 Win=64251 Len=0 TSval=1613418609 TSecr=93646

Frame 90: 68 bytes on wire (544 bits), 68 bytes captured (544 bits)
Linux cooked capture
Internet Protocol Version 4, Src: 54.235.185.74 (54.235.185.74), Dst: 10.164.110.195 (10.164.110.195)
Transmission Control Protocol, Src Port: http (80), Dst Port: 39167 (39167), Seq: 1, Ack: 1, Len: 0

No.     Time        Source                Destination           Protocol Length Info
     91 25.129830   10.164.110.195        54.235.185.74         TCP      68     39167 > http [ACK] Seq=1 Ack=2 Win=1959 Len=0 TSval=96609 TSecr=1613418609

Frame 91: 68 bytes on wire (544 bits), 68 bytes captured (544 bits)
Linux cooked capture
Internet Protocol Version 4, Src: 10.164.110.195 (10.164.110.195), Dst: 54.235.185.74 (54.235.185.74)
Transmission Control Protocol, Src Port: 39167 (39167), Dst Port: http (80), Seq: 1, Ack: 2, Len: 0

No.     Time        Source                Destination           Protocol Length Info
     92 28.475390   50.22.225.87          10.164.110.195        SSL      95     Continuation Data

Frame 92: 95 bytes on wire (760 bits), 95 bytes captured (760 bits)
Linux cooked capture
Internet Protocol Version 4, Src: 50.22.225.87 (50.22.225.87), Dst: 10.164.110.195 (10.164.110.195)
Transmission Control Protocol, Src Port: https (443), Dst Port: 53826 (53826), Seq: 629, Ack: 619, Len: 27
Secure Sockets Layer

No.     Time        Source                Destination           Protocol Length Info
     93 28.475895   10.164.110.195        50.22.225.87          TCP      68     53826 > https [ACK] Seq=619 Ack=656 Win=6312 Len=0 TSval=96943 TSecr=1130236287

Frame 93: 68 bytes on wire (544 bits), 68 bytes captured (544 bits)
Linux cooked capture
Internet Protocol Version 4, Src: 10.164.110.195 (10.164.110.195), Dst: 50.22.225.87 (50.22.225.87)
Transmission Control Protocol, Src Port: 53826 (53826), Dst Port: https (443), Seq: 619, Ack: 656, Len: 0

No.     Time        Source                Destination           Protocol Length Info
     94 29.288270   10.164.110.195        50.22.225.87          SSL      100    Continuation Data

Frame 94: 100 bytes on wire (800 bits), 100 bytes captured (800 bits)
Linux cooked capture
Internet Protocol Version 4, Src: 10.164.110.195 (10.164.110.195), Dst: 50.22.225.87 (50.22.225.87)
Transmission Control Protocol, Src Port: 53826 (53826), Dst Port: https (443), Seq: 619, Ack: 656, Len: 32
Secure Sockets Layer

No.     Time        Source                Destination           Protocol Length Info
     95 29.585400   50.22.225.87          10.164.110.195        TCP      68     https > 53826 [ACK] Seq=656 Ack=651 Win=262144 Len=0 TSval=1130237397 TSecr=97024

Frame 95: 68 bytes on wire (544 bits), 68 bytes captured (544 bits)
Linux cooked capture
Internet Protocol Version 4, Src: 50.22.225.87 (50.22.225.87), Dst: 10.164.110.195 (10.164.110.195)
Transmission Control Protocol, Src Port: https (443), Dst Port: 53826 (53826), Seq: 656, Ack: 651, Len: 0

No.     Time        Source                Destination           Protocol Length Info
     96 29.656330   10.164.110.195        50.22.225.87          SSL      129    Continuation Data

Frame 96: 129 bytes on wire (1032 bits), 129 bytes captured (1032 bits)
Linux cooked capture
Internet Protocol Version 4, Src: 10.164.110.195 (10.164.110.195), Dst: 50.22.225.87 (50.22.225.87)
Transmission Control Protocol, Src Port: 53826 (53826), Dst Port: https (443), Seq: 651, Ack: 656, Len: 61
Secure Sockets Layer

No.     Time        Source                Destination           Protocol Length Info
     97 29.915470   50.22.225.87          10.164.110.195        SSL      113    Continuation Data

Frame 97: 113 bytes on wire (904 bits), 113 bytes captured (904 bits)
Linux cooked capture
Internet Protocol Version 4, Src: 50.22.225.87 (50.22.225.87), Dst: 10.164.110.195 (10.164.110.195)
Transmission Control Protocol, Src Port: https (443), Dst Port: 53826 (53826), Seq: 656, Ack: 712, Len: 45
Secure Sockets Layer

No.     Time        Source                Destination           Protocol Length Info
     98 29.915985   10.164.110.195        50.22.225.87          TCP      68     53826 > https [ACK] Seq=712 Ack=701 Win=6312 Len=0 TSval=97087 TSecr=1130237727

Frame 98: 68 bytes on wire (544 bits), 68 bytes captured (544 bits)
Linux cooked capture
Internet Protocol Version 4, Src: 10.164.110.195 (10.164.110.195), Dst: 50.22.225.87 (50.22.225.87)
Transmission Control Protocol, Src Port: 53826 (53826), Dst Port: https (443), Seq: 712, Ack: 701, Len: 0

No.     Time        Source                Destination           Protocol Length Info
     99 30.735512   50.22.225.87          10.164.110.195        SSL      110    Continuation Data

Frame 99: 110 bytes on wire (880 bits), 110 bytes captured (880 bits)
Linux cooked capture
Internet Protocol Version 4, Src: 50.22.225.87 (50.22.225.87), Dst: 10.164.110.195 (10.164.110.195)
Transmission Control Protocol, Src Port: https (443), Dst Port: 53826 (53826), Seq: 701, Ack: 712, Len: 42
Secure Sockets Layer

No.     Time        Source                Destination           Protocol Length Info
    100 30.735942   50.22.225.87          10.164.110.195        SSL      95     Continuation Data

Frame 100: 95 bytes on wire (760 bits), 95 bytes captured (760 bits)
Linux cooked capture
Internet Protocol Version 4, Src: 50.22.225.87 (50.22.225.87), Dst: 10.164.110.195 (10.164.110.195)
Transmission Control Protocol, Src Port: https (443), Dst Port: 53826 (53826), Seq: 743, Ack: 712, Len: 27
Secure Sockets Layer

No.     Time        Source                Destination           Protocol Length Info
    101 30.736130   10.164.110.195        50.22.225.87          TCP      68     53826 > https [ACK] Seq=712 Ack=743 Win=6312 Len=0 TSval=97169 TSecr=1130238523

Frame 101: 68 bytes on wire (544 bits), 68 bytes captured (544 bits)
Linux cooked capture
Internet Protocol Version 4, Src: 10.164.110.195 (10.164.110.195), Dst: 50.22.225.87 (50.22.225.87)
Transmission Control Protocol, Src Port: 53826 (53826), Dst Port: https (443), Seq: 712, Ack: 743, Len: 0

No.     Time        Source                Destination           Protocol Length Info
    102 30.736308   50.22.225.87          10.164.110.195        SSL      110    Continuation Data

Frame 102: 110 bytes on wire (880 bits), 110 bytes captured (880 bits)
Linux cooked capture
Internet Protocol Version 4, Src: 50.22.225.87 (50.22.225.87), Dst: 10.164.110.195 (10.164.110.195)
Transmission Control Protocol, Src Port: https (443), Dst Port: 53826 (53826), Seq: 770, Ack: 712, Len: 42
Secure Sockets Layer

No.     Time        Source                Destination           Protocol Length Info
    103 30.736673   50.22.225.87          10.164.110.195        SSL      95     Continuation Data

Frame 103: 95 bytes on wire (760 bits), 95 bytes captured (760 bits)
Linux cooked capture
Internet Protocol Version 4, Src: 50.22.225.87 (50.22.225.87), Dst: 10.164.110.195 (10.164.110.195)
Transmission Control Protocol, Src Port: https (443), Dst Port: 53826 (53826), Seq: 812, Ack: 712, Len: 27
Secure Sockets Layer

No.     Time        Source                Destination           Protocol Length Info
    104 30.737002   10.164.110.195        50.22.225.87          TCP      68     53826 > https [ACK] Seq=712 Ack=770 Win=6312 Len=0 TSval=97169 TSecr=1130238524

Frame 104: 68 bytes on wire (544 bits), 68 bytes captured (544 bits)
Linux cooked capture
Internet Protocol Version 4, Src: 10.164.110.195 (10.164.110.195), Dst: 50.22.225.87 (50.22.225.87)
Transmission Control Protocol, Src Port: 53826 (53826), Dst Port: https (443), Seq: 712, Ack: 770, Len: 0

No.     Time        Source                Destination           Protocol Length Info
    105 30.737590   10.164.110.195        50.22.225.87          TCP      68     53826 > https [ACK] Seq=712 Ack=812 Win=6312 Len=0 TSval=97169 TSecr=1130238524

Frame 105: 68 bytes on wire (544 bits), 68 bytes captured (544 bits)
Linux cooked capture
Internet Protocol Version 4, Src: 10.164.110.195 (10.164.110.195), Dst: 50.22.225.87 (50.22.225.87)
Transmission Control Protocol, Src Port: 53826 (53826), Dst Port: https (443), Seq: 712, Ack: 812, Len: 0

No.     Time        Source                Destination           Protocol Length Info
    106 30.742148   10.164.110.195        50.22.225.87          TCP      68     53826 > https [ACK] Seq=712 Ack=839 Win=6312 Len=0 TSval=97169 TSecr=1130238524

Frame 106: 68 bytes on wire (544 bits), 68 bytes captured (544 bits)
Linux cooked capture
Internet Protocol Version 4, Src: 10.164.110.195 (10.164.110.195), Dst: 50.22.225.87 (50.22.225.87)
Transmission Control Protocol, Src Port: 53826 (53826), Dst Port: https (443), Seq: 712, Ack: 839, Len: 0

No.     Time        Source                Destination           Protocol Length Info
    107 30.746023   10.164.110.195        50.22.225.87          SSL      112    Continuation Data

Frame 107: 112 bytes on wire (896 bits), 112 bytes captured (896 bits)
Linux cooked capture
Internet Protocol Version 4, Src: 10.164.110.195 (10.164.110.195), Dst: 50.22.225.87 (50.22.225.87)
Transmission Control Protocol, Src Port: 53826 (53826), Dst Port: https (443), Seq: 712, Ack: 839, Len: 44
Secure Sockets Layer

No.     Time        Source                Destination           Protocol Length Info
    108 30.935402   50.22.225.87          10.164.110.195        SSL      97     Continuation Data

Frame 108: 97 bytes on wire (776 bits), 97 bytes captured (776 bits)
Linux cooked capture
Internet Protocol Version 4, Src: 50.22.225.87 (50.22.225.87), Dst: 10.164.110.195 (10.164.110.195)
Transmission Control Protocol, Src Port: https (443), Dst Port: 53826 (53826), Seq: 839, Ack: 712, Len: 29
Secure Sockets Layer

No.     Time        Source                Destination           Protocol Length Info
    109 30.969883   10.164.110.195        50.22.225.87          TCP      68     53826 > https [ACK] Seq=756 Ack=868 Win=6312 Len=0 TSval=97193 TSecr=1130238751

Frame 109: 68 bytes on wire (544 bits), 68 bytes captured (544 bits)
Linux cooked capture
Internet Protocol Version 4, Src: 10.164.110.195 (10.164.110.195), Dst: 50.22.225.87 (50.22.225.87)
Transmission Control Protocol, Src Port: 53826 (53826), Dst Port: https (443), Seq: 756, Ack: 868, Len: 0

No.     Time        Source                Destination           Protocol Length Info
    110 31.145387   50.22.225.87          10.164.110.195        TCP      68     https > 53826 [ACK] Seq=868 Ack=756 Win=262144 Len=0 TSval=1130238957 TSecr=97170

Frame 110: 68 bytes on wire (544 bits), 68 bytes captured (544 bits)
Linux cooked capture
Internet Protocol Version 4, Src: 50.22.225.87 (50.22.225.87), Dst: 10.164.110.195 (10.164.110.195)
Transmission Control Protocol, Src Port: https (443), Dst Port: 53826 (53826), Seq: 868, Ack: 756, Len: 0

No.     Time        Source                Destination           Protocol Length Info
    111 31.145732   10.164.110.195        50.22.225.87          SSL      144    Continuation Data

Frame 111: 144 bytes on wire (1152 bits), 144 bytes captured (1152 bits)
Linux cooked capture
Internet Protocol Version 4, Src: 10.164.110.195 (10.164.110.195), Dst: 50.22.225.87 (50.22.225.87)
Transmission Control Protocol, Src Port: 53826 (53826), Dst Port: https (443), Seq: 756, Ack: 868, Len: 76
Secure Sockets Layer

No.     Time        Source                Destination           Protocol Length Info
    112 31.165460   50.22.225.87          10.164.110.195        SSL      95     Continuation Data

Frame 112: 95 bytes on wire (760 bits), 95 bytes captured (760 bits)
Linux cooked capture
Internet Protocol Version 4, Src: 50.22.225.87 (50.22.225.87), Dst: 10.164.110.195 (10.164.110.195)
Transmission Control Protocol, Src Port: https (443), Dst Port: 53826 (53826), Seq: 868, Ack: 756, Len: 27
Secure Sockets Layer

No.     Time        Source                Destination           Protocol Length Info
    113 31.165967   10.164.110.195        50.22.225.87          TCP      68     53826 > https [ACK] Seq=832 Ack=895 Win=6312 Len=0 TSval=97212 TSecr=1130238976

Frame 113: 68 bytes on wire (544 bits), 68 bytes captured (544 bits)
Linux cooked capture
Internet Protocol Version 4, Src: 10.164.110.195 (10.164.110.195), Dst: 50.22.225.87 (50.22.225.87)
Transmission Control Protocol, Src Port: 53826 (53826), Dst Port: https (443), Seq: 832, Ack: 895, Len: 0

No.     Time        Source                Destination           Protocol Length Info
    114 31.375482   50.22.225.87          10.164.110.195        SSL      95     Continuation Data

Frame 114: 95 bytes on wire (760 bits), 95 bytes captured (760 bits)
Linux cooked capture
Internet Protocol Version 4, Src: 50.22.225.87 (50.22.225.87), Dst: 10.164.110.195 (10.164.110.195)
Transmission Control Protocol, Src Port: https (443), Dst Port: 53826 (53826), Seq: 895, Ack: 756, Len: 27
Secure Sockets Layer

No.     Time        Source                Destination           Protocol Length Info
    115 31.375757   50.22.225.87          10.164.110.195        SSL      111    Continuation Data

Frame 115: 111 bytes on wire (888 bits), 111 bytes captured (888 bits)
Linux cooked capture
Internet Protocol Version 4, Src: 50.22.225.87 (50.22.225.87), Dst: 10.164.110.195 (10.164.110.195)
Transmission Control Protocol, Src Port: https (443), Dst Port: 53826 (53826), Seq: 922, Ack: 756, Len: 43
Secure Sockets Layer

No.     Time        Source                Destination           Protocol Length Info
    116 31.379610   10.164.110.195        50.22.225.87          TCP      68     53826 > https [ACK] Seq=832 Ack=965 Win=6312 Len=0 TSval=97233 TSecr=1130239190

Frame 116: 68 bytes on wire (544 bits), 68 bytes captured (544 bits)
Linux cooked capture
Internet Protocol Version 4, Src: 10.164.110.195 (10.164.110.195), Dst: 50.22.225.87 (50.22.225.87)
Transmission Control Protocol, Src Port: 53826 (53826), Dst Port: https (443), Seq: 832, Ack: 965, Len: 0

No.     Time        Source                Destination           Protocol Length Info
    117 31.465480   50.22.225.87          10.164.110.195        TCP      68     https > 53826 [ACK] Seq=965 Ack=832 Win=262144 Len=0 TSval=1130239277 TSecr=97210

Frame 117: 68 bytes on wire (544 bits), 68 bytes captured (544 bits)
Linux cooked capture
Internet Protocol Version 4, Src: 50.22.225.87 (50.22.225.87), Dst: 10.164.110.195 (10.164.110.195)
Transmission Control Protocol, Src Port: https (443), Dst Port: 53826 (53826), Seq: 965, Ack: 832, Len: 0

No.     Time        Source                Destination           Protocol Length Info
    118 31.465833   10.164.110.195        50.22.225.87          SSL      113    Continuation Data

Frame 118: 113 bytes on wire (904 bits), 113 bytes captured (904 bits)
Linux cooked capture
Internet Protocol Version 4, Src: 10.164.110.195 (10.164.110.195), Dst: 50.22.225.87 (50.22.225.87)
Transmission Control Protocol, Src Port: 53826 (53826), Dst Port: https (443), Seq: 832, Ack: 965, Len: 45
Secure Sockets Layer

No.     Time        Source                Destination           Protocol Length Info
    119 31.745405   50.22.225.87          10.164.110.195        TCP      68     https > 53826 [ACK] Seq=965 Ack=877 Win=262144 Len=0 TSval=1130239557 TSecr=97242

Frame 119: 68 bytes on wire (544 bits), 68 bytes captured (544 bits)
Linux cooked capture
Internet Protocol Version 4, Src: 50.22.225.87 (50.22.225.87), Dst: 10.164.110.195 (10.164.110.195)
Transmission Control Protocol, Src Port: https (443), Dst Port: 53826 (53826), Seq: 965, Ack: 877, Len: 0

No.     Time        Source                Destination           Protocol Length Info
    120 31.972093   10.164.110.195        50.22.225.87          SSL      100    Continuation Data

Frame 120: 100 bytes on wire (800 bits), 100 bytes captured (800 bits)
Linux cooked capture
Internet Protocol Version 4, Src: 10.164.110.195 (10.164.110.195), Dst: 50.22.225.87 (50.22.225.87)
Transmission Control Protocol, Src Port: 53826 (53826), Dst Port: https (443), Seq: 877, Ack: 965, Len: 32
Secure Sockets Layer

No.     Time        Source                Destination           Protocol Length Info
    121 32.265437   50.22.225.87          10.164.110.195        TCP      68     https > 53826 [ACK] Seq=965 Ack=909 Win=262144 Len=0 TSval=1130240077 TSecr=97293

Frame 121: 68 bytes on wire (544 bits), 68 bytes captured (544 bits)
Linux cooked capture
Internet Protocol Version 4, Src: 50.22.225.87 (50.22.225.87), Dst: 10.164.110.195 (10.164.110.195)
Transmission Control Protocol, Src Port: https (443), Dst Port: 53826 (53826), Seq: 965, Ack: 909, Len: 0

No.     Time        Source                Destination           Protocol Length Info
    122 32.266027   10.164.110.195        50.22.225.87          SSL      132    Continuation Data

Frame 122: 132 bytes on wire (1056 bits), 132 bytes captured (1056 bits)
Linux cooked capture
Internet Protocol Version 4, Src: 10.164.110.195 (10.164.110.195), Dst: 50.22.225.87 (50.22.225.87)
Transmission Control Protocol, Src Port: 53826 (53826), Dst Port: https (443), Seq: 909, Ack: 965, Len: 64
Secure Sockets Layer

No.     Time        Source                Destination           Protocol Length Info
    123 32.515397   50.22.225.87          10.164.110.195        SSL      113    Continuation Data

Frame 123: 113 bytes on wire (904 bits), 113 bytes captured (904 bits)
Linux cooked capture
Internet Protocol Version 4, Src: 50.22.225.87 (50.22.225.87), Dst: 10.164.110.195 (10.164.110.195)
Transmission Control Protocol, Src Port: https (443), Dst Port: 53826 (53826), Seq: 965, Ack: 973, Len: 45
Secure Sockets Layer

No.     Time        Source                Destination           Protocol Length Info
    124 32.515785   10.164.110.195        50.22.225.87          TCP      68     53826 > https [ACK] Seq=973 Ack=1010 Win=6312 Len=0 TSval=97347 TSecr=1130240327

Frame 124: 68 bytes on wire (544 bits), 68 bytes captured (544 bits)
Linux cooked capture
Internet Protocol Version 4, Src: 10.164.110.195 (10.164.110.195), Dst: 50.22.225.87 (50.22.225.87)
Transmission Control Protocol, Src Port: 53826 (53826), Dst Port: https (443), Seq: 973, Ack: 1010, Len: 0

No.     Time        Source                Destination           Protocol Length Info
    125 32.805540   50.22.225.87          10.164.110.195        SSL      111    Continuation Data

Frame 125: 111 bytes on wire (888 bits), 111 bytes captured (888 bits)
Linux cooked capture
Internet Protocol Version 4, Src: 50.22.225.87 (50.22.225.87), Dst: 10.164.110.195 (10.164.110.195)
Transmission Control Protocol, Src Port: https (443), Dst Port: 53826 (53826), Seq: 1010, Ack: 973, Len: 43
Secure Sockets Layer

No.     Time        Source                Destination           Protocol Length Info
    126 32.806080   10.164.110.195        50.22.225.87          TCP      68     53826 > https [ACK] Seq=973 Ack=1053 Win=6312 Len=0 TSval=97376 TSecr=1130240619

Frame 126: 68 bytes on wire (544 bits), 68 bytes captured (544 bits)
Linux cooked capture
Internet Protocol Version 4, Src: 10.164.110.195 (10.164.110.195), Dst: 50.22.225.87 (50.22.225.87)
Transmission Control Protocol, Src Port: 53826 (53826), Dst Port: https (443), Seq: 973, Ack: 1053, Len: 0

No.     Time        Source                Destination           Protocol Length Info
    127 32.822423   10.164.110.195        50.22.225.87          SSL      113    Continuation Data

Frame 127: 113 bytes on wire (904 bits), 113 bytes captured (904 bits)
Linux cooked capture
Internet Protocol Version 4, Src: 10.164.110.195 (10.164.110.195), Dst: 50.22.225.87 (50.22.225.87)
Transmission Control Protocol, Src Port: 53826 (53826), Dst Port: https (443), Seq: 973, Ack: 1053, Len: 45
Secure Sockets Layer

No.     Time        Source                Destination           Protocol Length Info
    128 33.155372   50.22.225.87          10.164.110.195        TCP      68     https > 53826 [ACK] Seq=1053 Ack=1018 Win=262144 Len=0 TSval=1130240957 TSecr=97378

Frame 128: 68 bytes on wire (544 bits), 68 bytes captured (544 bits)
Linux cooked capture
Internet Protocol Version 4, Src: 50.22.225.87 (50.22.225.87), Dst: 10.164.110.195 (10.164.110.195)
Transmission Control Protocol, Src Port: https (443), Dst Port: 53826 (53826), Seq: 1053, Ack: 1018, Len: 0

No.     Time        Source                Destination           Protocol Length Info
    129 34.921727   10.164.110.195        50.22.225.87          SSL      97     Continuation Data

Frame 129: 97 bytes on wire (776 bits), 97 bytes captured (776 bits)
Linux cooked capture
Internet Protocol Version 4, Src: 10.164.110.195 (10.164.110.195), Dst: 50.22.225.87 (50.22.225.87)
Transmission Control Protocol, Src Port: 53826 (53826), Dst Port: https (443), Seq: 1018, Ack: 1053, Len: 29
Secure Sockets Layer

No.     Time        Source                Destination           Protocol Length Info
    130 35.225410   50.22.225.87          10.164.110.195        TCP      68     https > 53826 [ACK] Seq=1053 Ack=1047 Win=262144 Len=0 TSval=1130243037 TSecr=97588

Frame 130: 68 bytes on wire (544 bits), 68 bytes captured (544 bits)
Linux cooked capture
Internet Protocol Version 4, Src: 50.22.225.87 (50.22.225.87), Dst: 10.164.110.195 (10.164.110.195)
Transmission Control Protocol, Src Port: https (443), Dst Port: 53826 (53826), Seq: 1053, Ack: 1047, Len: 0

No.     Time        Source                Destination           Protocol Length Info
    131 35.225765   10.164.110.195        50.22.225.87          SSL      108    Continuation Data

Frame 131: 108 bytes on wire (864 bits), 108 bytes captured (864 bits)
Linux cooked capture
Internet Protocol Version 4, Src: 10.164.110.195 (10.164.110.195), Dst: 50.22.225.87 (50.22.225.87)
Transmission Control Protocol, Src Port: 53826 (53826), Dst Port: https (443), Seq: 1047, Ack: 1053, Len: 40
Secure Sockets Layer

No.     Time        Source                Destination           Protocol Length Info
    132 35.475527   50.22.225.87          10.164.110.195        SSL      113    Continuation Data

Frame 132: 113 bytes on wire (904 bits), 113 bytes captured (904 bits)
Linux cooked capture
Internet Protocol Version 4, Src: 50.22.225.87 (50.22.225.87), Dst: 10.164.110.195 (10.164.110.195)
Transmission Control Protocol, Src Port: https (443), Dst Port: 53826 (53826), Seq: 1053, Ack: 1087, Len: 45
Secure Sockets Layer

No.     Time        Source                Destination           Protocol Length Info
    133 35.509923   10.164.110.195        50.22.225.87          TCP      68     53826 > https [ACK] Seq=1087 Ack=1098 Win=6312 Len=0 TSval=97647 TSecr=1130243292

Frame 133: 68 bytes on wire (544 bits), 68 bytes captured (544 bits)
Linux cooked capture
Internet Protocol Version 4, Src: 10.164.110.195 (10.164.110.195), Dst: 50.22.225.87 (50.22.225.87)
Transmission Control Protocol, Src Port: 53826 (53826), Dst Port: https (443), Seq: 1087, Ack: 1098, Len: 0

No.     Time        Source                Destination           Protocol Length Info
    134 38.375425   50.22.225.87          10.164.110.195        SSL      100    Continuation Data

Frame 134: 100 bytes on wire (800 bits), 100 bytes captured (800 bits)
Linux cooked capture
Internet Protocol Version 4, Src: 50.22.225.87 (50.22.225.87), Dst: 10.164.110.195 (10.164.110.195)
Transmission Control Protocol, Src Port: https (443), Dst Port: 53826 (53826), Seq: 1098, Ack: 1087, Len: 32
Secure Sockets Layer

No.     Time        Source                Destination           Protocol Length Info
    135 38.375970   10.164.110.195        50.22.225.87          TCP      68     53826 > https [ACK] Seq=1087 Ack=1130 Win=6312 Len=0 TSval=97933 TSecr=1130246187

Frame 135: 68 bytes on wire (544 bits), 68 bytes captured (544 bits)
Linux cooked capture
Internet Protocol Version 4, Src: 10.164.110.195 (10.164.110.195), Dst: 50.22.225.87 (50.22.225.87)
Transmission Control Protocol, Src Port: 53826 (53826), Dst Port: https (443), Seq: 1087, Ack: 1130, Len: 0

No.     Time        Source                Destination           Protocol Length Info
    136 39.199887   10.164.110.195        173.194.34.52         TCP      68     56487 > http [FIN, ACK] Seq=1 Ack=1 Win=10598 Len=0 TSval=98016 TSecr=1612873401

Frame 136: 68 bytes on wire (544 bits), 68 bytes captured (544 bits)
Linux cooked capture
Internet Protocol Version 4, Src: 10.164.110.195 (10.164.110.195), Dst: 173.194.34.52 (173.194.34.52)
Transmission Control Protocol, Src Port: 56487 (56487), Dst Port: http (80), Seq: 1, Ack: 1, Len: 0

No.     Time        Source                Destination           Protocol Length Info
    137 39.551858   10.164.110.195        50.22.225.87          SSL      134    Continuation Data

Frame 137: 134 bytes on wire (1072 bits), 134 bytes captured (1072 bits)
Linux cooked capture
Internet Protocol Version 4, Src: 10.164.110.195 (10.164.110.195), Dst: 50.22.225.87 (50.22.225.87)
Transmission Control Protocol, Src Port: 53826 (53826), Dst Port: https (443), Seq: 1087, Ack: 1130, Len: 66
Secure Sockets Layer

No.     Time        Source                Destination           Protocol Length Info
    138 39.795465   50.22.225.87          10.164.110.195        SSL      113    Continuation Data

Frame 138: 113 bytes on wire (904 bits), 113 bytes captured (904 bits)
Linux cooked capture
Internet Protocol Version 4, Src: 50.22.225.87 (50.22.225.87), Dst: 10.164.110.195 (10.164.110.195)
Transmission Control Protocol, Src Port: https (443), Dst Port: 53826 (53826), Seq: 1130, Ack: 1153, Len: 45
Secure Sockets Layer

No.     Time        Source                Destination           Protocol Length Info
    139 39.797020   10.164.110.195        50.22.225.87          TCP      68     53826 > https [ACK] Seq=1153 Ack=1175 Win=6312 Len=0 TSval=98075 TSecr=1130247608

Frame 139: 68 bytes on wire (544 bits), 68 bytes captured (544 bits)
Linux cooked capture
Internet Protocol Version 4, Src: 10.164.110.195 (10.164.110.195), Dst: 50.22.225.87 (50.22.225.87)
Transmission Control Protocol, Src Port: 53826 (53826), Dst Port: https (443), Seq: 1153, Ack: 1175, Len: 0

No.     Time        Source                Destination           Protocol Length Info
    140 41.805803   10.164.110.195        50.22.225.87          SSL      97     Continuation Data

Frame 140: 97 bytes on wire (776 bits), 97 bytes captured (776 bits)
Linux cooked capture
Internet Protocol Version 4, Src: 10.164.110.195 (10.164.110.195), Dst: 50.22.225.87 (50.22.225.87)
Transmission Control Protocol, Src Port: 53826 (53826), Dst Port: https (443), Seq: 1153, Ack: 1175, Len: 29
Secure Sockets Layer

No.     Time        Source                Destination           Protocol Length Info
    141 42.115385   50.22.225.87          10.164.110.195        TCP      68     https > 53826 [ACK] Seq=1175 Ack=1182 Win=262144 Len=0 TSval=1130249917 TSecr=98276

Frame 141: 68 bytes on wire (544 bits), 68 bytes captured (544 bits)
Linux cooked capture
Internet Protocol Version 4, Src: 50.22.225.87 (50.22.225.87), Dst: 10.164.110.195 (10.164.110.195)
Transmission Control Protocol, Src Port: https (443), Dst Port: 53826 (53826), Seq: 1175, Ack: 1182, Len: 0

No.     Time        Source                Destination           Protocol Length Info
    142 42.115738   10.164.110.195        50.22.225.87          SSL      108    Continuation Data

Frame 142: 108 bytes on wire (864 bits), 108 bytes captured (864 bits)
Linux cooked capture
Internet Protocol Version 4, Src: 10.164.110.195 (10.164.110.195), Dst: 50.22.225.87 (50.22.225.87)
Transmission Control Protocol, Src Port: 53826 (53826), Dst Port: https (443), Seq: 1182, Ack: 1175, Len: 40
Secure Sockets Layer

No.     Time        Source                Destination           Protocol Length Info
    143 42.395400   50.22.225.87          10.164.110.195        SSL      113    Continuation Data

Frame 143: 113 bytes on wire (904 bits), 113 bytes captured (904 bits)
Linux cooked capture
Internet Protocol Version 4, Src: 50.22.225.87 (50.22.225.87), Dst: 10.164.110.195 (10.164.110.195)
Transmission Control Protocol, Src Port: https (443), Dst Port: 53826 (53826), Seq: 1175, Ack: 1222, Len: 45
Secure Sockets Layer

No.     Time        Source                Destination           Protocol Length Info
    144 42.395898   10.164.110.195        50.22.225.87          TCP      68     53826 > https [ACK] Seq=1222 Ack=1220 Win=6312 Len=0 TSval=98335 TSecr=1130250208

Frame 144: 68 bytes on wire (544 bits), 68 bytes captured (544 bits)
Linux cooked capture
Internet Protocol Version 4, Src: 10.164.110.195 (10.164.110.195), Dst: 50.22.225.87 (50.22.225.87)
Transmission Control Protocol, Src Port: 53826 (53826), Dst Port: https (443), Seq: 1222, Ack: 1220, Len: 0

No.     Time        Source                Destination           Protocol Length Info
    145 42.945388   50.22.225.87          10.164.110.195        SSL      100    Continuation Data

Frame 145: 100 bytes on wire (800 bits), 100 bytes captured (800 bits)
Linux cooked capture
Internet Protocol Version 4, Src: 50.22.225.87 (50.22.225.87), Dst: 10.164.110.195 (10.164.110.195)
Transmission Control Protocol, Src Port: https (443), Dst Port: 53826 (53826), Seq: 1220, Ack: 1222, Len: 32
Secure Sockets Layer

No.     Time        Source                Destination           Protocol Length Info
    146 42.945738   10.164.110.195        50.22.225.87          TCP      68     53826 > https [ACK] Seq=1222 Ack=1252 Win=6312 Len=0 TSval=98390 TSecr=1130250763

Frame 146: 68 bytes on wire (544 bits), 68 bytes captured (544 bits)
Linux cooked capture
Internet Protocol Version 4, Src: 10.164.110.195 (10.164.110.195), Dst: 50.22.225.87 (50.22.225.87)
Transmission Control Protocol, Src Port: 53826 (53826), Dst Port: https (443), Seq: 1222, Ack: 1252, Len: 0

No.     Time        Source                Destination           Protocol Length Info
    147 45.110922   10.164.110.195        50.22.225.87          SSL      129    Continuation Data

Frame 147: 129 bytes on wire (1032 bits), 129 bytes captured (1032 bits)
Linux cooked capture
Internet Protocol Version 4, Src: 10.164.110.195 (10.164.110.195), Dst: 50.22.225.87 (50.22.225.87)
Transmission Control Protocol, Src Port: 53826 (53826), Dst Port: https (443), Seq: 1222, Ack: 1252, Len: 61
Secure Sockets Layer

No.     Time        Source                Destination           Protocol Length Info
    148 45.355532   50.22.225.87          10.164.110.195        SSL      113    Continuation Data

Frame 148: 113 bytes on wire (904 bits), 113 bytes captured (904 bits)
Linux cooked capture
Internet Protocol Version 4, Src: 50.22.225.87 (50.22.225.87), Dst: 10.164.110.195 (10.164.110.195)
Transmission Control Protocol, Src Port: https (443), Dst Port: 53826 (53826), Seq: 1252, Ack: 1283, Len: 45
Secure Sockets Layer

No.     Time        Source                Destination           Protocol Length Info
    149 45.355893   10.164.110.195        50.22.225.87          TCP      68     53826 > https [ACK] Seq=1283 Ack=1297 Win=6312 Len=0 TSval=98631 TSecr=1130253167

Frame 149: 68 bytes on wire (544 bits), 68 bytes captured (544 bits)
Linux cooked capture
Internet Protocol Version 4, Src: 10.164.110.195 (10.164.110.195), Dst: 50.22.225.87 (50.22.225.87)
Transmission Control Protocol, Src Port: 53826 (53826), Dst Port: https (443), Seq: 1283, Ack: 1297, Len: 0

No.     Time        Source                Destination           Protocol Length Info
    150 48.456807   10.164.110.195        188.125.68.129        TCP      76     57250 > imaps [SYN] Seq=0 Win=5240 Len=0 MSS=1310 SACK_PERM=1 TSval=98941 TSecr=0 WS=4

Frame 150: 76 bytes on wire (608 bits), 76 bytes captured (608 bits)
Linux cooked capture
Internet Protocol Version 4, Src: 10.164.110.195 (10.164.110.195), Dst: 188.125.68.129 (188.125.68.129)
Transmission Control Protocol, Src Port: 57250 (57250), Dst Port: imaps (993), Seq: 0, Len: 0

No.     Time        Source                Destination           Protocol Length Info
    151 48.895377   50.22.225.87          10.164.110.195        SSL      100    Continuation Data

Frame 151: 100 bytes on wire (800 bits), 100 bytes captured (800 bits)
Linux cooked capture
Internet Protocol Version 4, Src: 50.22.225.87 (50.22.225.87), Dst: 10.164.110.195 (10.164.110.195)
Transmission Control Protocol, Src Port: https (443), Dst Port: 53826 (53826), Seq: 1297, Ack: 1283, Len: 32
Secure Sockets Layer

No.     Time        Source                Destination           Protocol Length Info
    152 48.895730   188.125.68.129        10.164.110.195        TCP      72     imaps > 57250 [SYN, ACK] Seq=0 Ack=1 Win=14480 Len=0 MSS=1400 SACK_PERM=1 TSval=1851103691 TSecr=98941

Frame 152: 72 bytes on wire (576 bits), 72 bytes captured (576 bits)
Linux cooked capture
Internet Protocol Version 4, Src: 188.125.68.129 (188.125.68.129), Dst: 10.164.110.195 (10.164.110.195)
Transmission Control Protocol, Src Port: imaps (993), Dst Port: 57250 (57250), Seq: 0, Ack: 1, Len: 0

No.     Time        Source                Destination           Protocol Length Info
    153 48.895935   10.164.110.195        188.125.68.129        TCP      68     57250 > imaps [ACK] Seq=1 Ack=1 Win=5240 Len=0 TSval=98985 TSecr=1851103691

Frame 153: 68 bytes on wire (544 bits), 68 bytes captured (544 bits)
Linux cooked capture
Internet Protocol Version 4, Src: 10.164.110.195 (10.164.110.195), Dst: 188.125.68.129 (188.125.68.129)
Transmission Control Protocol, Src Port: 57250 (57250), Dst Port: imaps (993), Seq: 1, Ack: 1, Len: 0

No.     Time        Source                Destination           Protocol Length Info
    154 48.898158   10.164.110.195        50.22.225.87          TCP      68     53826 > https [ACK] Seq=1283 Ack=1329 Win=6312 Len=0 TSval=98985 TSecr=1130256362

Frame 154: 68 bytes on wire (544 bits), 68 bytes captured (544 bits)
Linux cooked capture
Internet Protocol Version 4, Src: 10.164.110.195 (10.164.110.195), Dst: 50.22.225.87 (50.22.225.87)
Transmission Control Protocol, Src Port: 53826 (53826), Dst Port: https (443), Seq: 1283, Ack: 1329, Len: 0

No.     Time        Source                Destination           Protocol Length Info
    155 48.923597   10.164.110.195        188.125.68.129        TLSv1    180    Client Hello

Frame 155: 180 bytes on wire (1440 bits), 180 bytes captured (1440 bits)
Linux cooked capture
Internet Protocol Version 4, Src: 10.164.110.195 (10.164.110.195), Dst: 188.125.68.129 (188.125.68.129)
Transmission Control Protocol, Src Port: 57250 (57250), Dst Port: imaps (993), Seq: 1, Ack: 1, Len: 112
Secure Sockets Layer

No.     Time        Source                Destination           Protocol Length Info
    156 49.215425   188.125.68.129        10.164.110.195        TCP      68     imaps > 57250 [ACK] Seq=1 Ack=113 Win=14480 Len=0 TSval=1851104291 TSecr=98988

Frame 156: 68 bytes on wire (544 bits), 68 bytes captured (544 bits)
Linux cooked capture
Internet Protocol Version 4, Src: 188.125.68.129 (188.125.68.129), Dst: 10.164.110.195 (10.164.110.195)
Transmission Control Protocol, Src Port: imaps (993), Dst Port: 57250 (57250), Seq: 1, Ack: 113, Len: 0

No.     Time        Source                Destination           Protocol Length Info
    157 49.235608   188.125.68.129        10.164.110.195        TLSv1    1366   Server Hello

Frame 157: 1366 bytes on wire (10928 bits), 1366 bytes captured (10928 bits)
Linux cooked capture
Internet Protocol Version 4, Src: 188.125.68.129 (188.125.68.129), Dst: 10.164.110.195 (10.164.110.195)
Transmission Control Protocol, Src Port: imaps (993), Dst Port: 57250 (57250), Seq: 1, Ack: 113, Len: 1298
Secure Sockets Layer

No.     Time        Source                Destination           Protocol Length Info
    158 49.235838   10.164.110.195        188.125.68.129        TCP      68     57250 > imaps [ACK] Seq=113 Ack=1299 Win=7788 Len=0 TSval=99019 TSecr=1851104291

Frame 158: 68 bytes on wire (544 bits), 68 bytes captured (544 bits)
Linux cooked capture
Internet Protocol Version 4, Src: 10.164.110.195 (10.164.110.195), Dst: 188.125.68.129 (188.125.68.129)
Transmission Control Protocol, Src Port: 57250 (57250), Dst Port: imaps (993), Seq: 113, Ack: 1299, Len: 0

No.     Time        Source                Destination           Protocol Length Info
    159 49.285693   188.125.68.129        10.164.110.195        TCP      1366   [TCP segment of a reassembled PDU]

Frame 159: 1366 bytes on wire (10928 bits), 1366 bytes captured (10928 bits)
Linux cooked capture
Internet Protocol Version 4, Src: 188.125.68.129 (188.125.68.129), Dst: 10.164.110.195 (10.164.110.195)
Transmission Control Protocol, Src Port: imaps (993), Dst Port: 57250 (57250), Seq: 1299, Ack: 113, Len: 1298

No.     Time        Source                Destination           Protocol Length Info
    160 49.285935   10.164.110.195        188.125.68.129        TCP      68     57250 > imaps [ACK] Seq=113 Ack=2597 Win=10384 Len=0 TSval=99024 TSecr=1851104291

Frame 160: 68 bytes on wire (544 bits), 68 bytes captured (544 bits)
Linux cooked capture
Internet Protocol Version 4, Src: 10.164.110.195 (10.164.110.195), Dst: 188.125.68.129 (188.125.68.129)
Transmission Control Protocol, Src Port: 57250 (57250), Dst Port: imaps (993), Seq: 113, Ack: 2597, Len: 0

No.     Time        Source                Destination           Protocol Length Info
    161 49.335518   188.125.68.129        10.164.110.195        TCP      1366   [TCP segment of a reassembled PDU]

Frame 161: 1366 bytes on wire (10928 bits), 1366 bytes captured (10928 bits)
Linux cooked capture
Internet Protocol Version 4, Src: 188.125.68.129 (188.125.68.129), Dst: 10.164.110.195 (10.164.110.195)
Transmission Control Protocol, Src Port: imaps (993), Dst Port: 57250 (57250), Seq: 2597, Ack: 113, Len: 1298

No.     Time        Source                Destination           Protocol Length Info
    162 49.335768   10.164.110.195        188.125.68.129        TCP      68     57250 > imaps [ACK] Seq=113 Ack=3895 Win=12980 Len=0 TSval=99029 TSecr=1851104291

Frame 162: 68 bytes on wire (544 bits), 68 bytes captured (544 bits)
Linux cooked capture
Internet Protocol Version 4, Src: 10.164.110.195 (10.164.110.195), Dst: 188.125.68.129 (188.125.68.129)
Transmission Control Protocol, Src Port: 57250 (57250), Dst Port: imaps (993), Seq: 113, Ack: 3895, Len: 0

No.     Time        Source                Destination           Protocol Length Info
    163 49.335877   188.125.68.129        10.164.110.195        TCP      270    [TCP segment of a reassembled PDU]

Frame 163: 270 bytes on wire (2160 bits), 270 bytes captured (2160 bits)
Linux cooked capture
Internet Protocol Version 4, Src: 188.125.68.129 (188.125.68.129), Dst: 10.164.110.195 (10.164.110.195)
Transmission Control Protocol, Src Port: imaps (993), Dst Port: 57250 (57250), Seq: 3895, Ack: 113, Len: 202

No.     Time        Source                Destination           Protocol Length Info
    164 49.336223   10.164.110.195        188.125.68.129        TCP      68     57250 > imaps [ACK] Seq=113 Ack=4097 Win=15576 Len=0 TSval=99029 TSecr=1851104291

Frame 164: 68 bytes on wire (544 bits), 68 bytes captured (544 bits)
Linux cooked capture
Internet Protocol Version 4, Src: 10.164.110.195 (10.164.110.195), Dst: 188.125.68.129 (188.125.68.129)
Transmission Control Protocol, Src Port: 57250 (57250), Dst Port: imaps (993), Seq: 113, Ack: 4097, Len: 0

No.     Time        Source                Destination           Protocol Length Info
    165 49.585498   188.125.68.129        10.164.110.195        TLSv1    210    Certificate, Server Hello Done

Frame 165: 210 bytes on wire (1680 bits), 210 bytes captured (1680 bits)
Linux cooked capture
Internet Protocol Version 4, Src: 188.125.68.129 (188.125.68.129), Dst: 10.164.110.195 (10.164.110.195)
Transmission Control Protocol, Src Port: imaps (993), Dst Port: 57250 (57250), Seq: 4097, Ack: 113, Len: 142
[5 Reassembled TCP Segments (4152 bytes): #157(1212), #159(1298), #161(1298), #163(202), #165(142)]
Secure Sockets Layer

No.     Time        Source                Destination           Protocol Length Info
    166 49.585817   10.164.110.195        188.125.68.129        TCP      68     57250 > imaps [ACK] Seq=113 Ack=4239 Win=18172 Len=0 TSval=99054 TSecr=1851104651

Frame 166: 68 bytes on wire (544 bits), 68 bytes captured (544 bits)
Linux cooked capture
Internet Protocol Version 4, Src: 10.164.110.195 (10.164.110.195), Dst: 188.125.68.129 (188.125.68.129)
Transmission Control Protocol, Src Port: 57250 (57250), Dst Port: imaps (993), Seq: 113, Ack: 4239, Len: 0

No.     Time        Source                Destination           Protocol Length Info
    167 49.732310   10.164.110.195        130.186.6.177         TCP      68     50502 > imaps [FIN, ACK] Seq=823 Ack=9306 Win=33796 Len=0 TSval=99069 TSecr=2095245850

Frame 167: 68 bytes on wire (544 bits), 68 bytes captured (544 bits)
Linux cooked capture
Internet Protocol Version 4, Src: 10.164.110.195 (10.164.110.195), Dst: 130.186.6.177 (130.186.6.177)
Transmission Control Protocol, Src Port: 50502 (50502), Dst Port: imaps (993), Seq: 823, Ack: 9306, Len: 0

No.     Time        Source                Destination           Protocol Length Info
    168 49.788357   10.164.110.195        188.125.68.129        TLSv1    382    Client Key Exchange, Change Cipher Spec, Encrypted Handshake Message

Frame 168: 382 bytes on wire (3056 bits), 382 bytes captured (3056 bits)
Linux cooked capture
Internet Protocol Version 4, Src: 10.164.110.195 (10.164.110.195), Dst: 188.125.68.129 (188.125.68.129)
Transmission Control Protocol, Src Port: 57250 (57250), Dst Port: imaps (993), Seq: 113, Ack: 4239, Len: 314
Secure Sockets Layer

No.     Time        Source                Destination           Protocol Length Info
    169 49.865385   130.186.6.177         10.164.110.195        TLSv1    145    Application Data

Frame 169: 145 bytes on wire (1160 bits), 145 bytes captured (1160 bits)
Linux cooked capture
Internet Protocol Version 4, Src: 130.186.6.177 (130.186.6.177), Dst: 10.164.110.195 (10.164.110.195)
Transmission Control Protocol, Src Port: imaps (993), Dst Port: 50502 (50502), Seq: 9306, Ack: 824, Len: 77
Secure Sockets Layer

No.     Time        Source                Destination           Protocol Length Info
    170 49.865722   10.164.110.195        130.186.6.177         TCP      56     50502 > imaps [RST] Seq=824 Win=0 Len=0

Frame 170: 56 bytes on wire (448 bits), 56 bytes captured (448 bits)
Linux cooked capture
Internet Protocol Version 4, Src: 10.164.110.195 (10.164.110.195), Dst: 130.186.6.177 (130.186.6.177)
Transmission Control Protocol, Src Port: 50502 (50502), Dst Port: imaps (993), Seq: 824, Len: 0

No.     Time        Source                Destination           Protocol Length Info
    171 49.875408   130.186.6.177         10.164.110.195        TCP      68     imaps > 50502 [FIN, ACK] Seq=9383 Ack=824 Win=7936 Len=0 TSval=2095277530 TSecr=99069

Frame 171: 68 bytes on wire (544 bits), 68 bytes captured (544 bits)
Linux cooked capture
Internet Protocol Version 4, Src: 130.186.6.177 (130.186.6.177), Dst: 10.164.110.195 (10.164.110.195)
Transmission Control Protocol, Src Port: imaps (993), Dst Port: 50502 (50502), Seq: 9383, Ack: 824, Len: 0

No.     Time        Source                Destination           Protocol Length Info
    172 49.875675   10.164.110.195        130.186.6.177         TCP      56     50502 > imaps [RST] Seq=824 Win=0 Len=0

Frame 172: 56 bytes on wire (448 bits), 56 bytes captured (448 bits)
Linux cooked capture
Internet Protocol Version 4, Src: 10.164.110.195 (10.164.110.195), Dst: 130.186.6.177 (130.186.6.177)
Transmission Control Protocol, Src Port: 50502 (50502), Dst Port: imaps (993), Seq: 824, Len: 0

No.     Time        Source                Destination           Protocol Length Info
    173 49.945502   50.22.225.87          10.164.110.195        SSL      100    Continuation Data

Frame 173: 100 bytes on wire (800 bits), 100 bytes captured (800 bits)
Linux cooked capture
Internet Protocol Version 4, Src: 50.22.225.87 (50.22.225.87), Dst: 10.164.110.195 (10.164.110.195)
Transmission Control Protocol, Src Port: https (443), Dst Port: 53826 (53826), Seq: 1329, Ack: 1283, Len: 32
Secure Sockets Layer

No.     Time        Source                Destination           Protocol Length Info
    174 49.946013   10.164.110.195        50.22.225.87          TCP      68     53826 > https [ACK] Seq=1283 Ack=1361 Win=6312 Len=0 TSval=99090 TSecr=1130257763

Frame 174: 68 bytes on wire (544 bits), 68 bytes captured (544 bits)
Linux cooked capture
Internet Protocol Version 4, Src: 10.164.110.195 (10.164.110.195), Dst: 50.22.225.87 (50.22.225.87)
Transmission Control Protocol, Src Port: 53826 (53826), Dst Port: https (443), Seq: 1283, Ack: 1361, Len: 0

No.     Time        Source                Destination           Protocol Length Info
    175 50.155473   188.125.68.129        10.164.110.195        TLSv1    115    Change Cipher Spec, Encrypted Handshake Message

Frame 175: 115 bytes on wire (920 bits), 115 bytes captured (920 bits)
Linux cooked capture
Internet Protocol Version 4, Src: 188.125.68.129 (188.125.68.129), Dst: 10.164.110.195 (10.164.110.195)
Transmission Control Protocol, Src Port: imaps (993), Dst Port: 57250 (57250), Seq: 4239, Ack: 427, Len: 47
Secure Sockets Layer

No.     Time        Source                Destination           Protocol Length Info
    176 50.155873   10.164.110.195        188.125.68.129        TCP      68     57250 > imaps [ACK] Seq=427 Ack=4286 Win=18172 Len=0 TSval=99111 TSecr=1851105229

Frame 176: 68 bytes on wire (544 bits), 68 bytes captured (544 bits)
Linux cooked capture
Internet Protocol Version 4, Src: 10.164.110.195 (10.164.110.195), Dst: 188.125.68.129 (188.125.68.129)
Transmission Control Protocol, Src Port: 57250 (57250), Dst Port: imaps (993), Seq: 427, Ack: 4286, Len: 0

No.     Time        Source                Destination           Protocol Length Info
    177 50.345473   188.125.68.129        10.164.110.195        TLSv1    353    Application Data

Frame 177: 353 bytes on wire (2824 bits), 353 bytes captured (2824 bits)
Linux cooked capture
Internet Protocol Version 4, Src: 188.125.68.129 (188.125.68.129), Dst: 10.164.110.195 (10.164.110.195)
Transmission Control Protocol, Src Port: imaps (993), Dst Port: 57250 (57250), Seq: 4286, Ack: 427, Len: 285
Secure Sockets Layer

No.     Time        Source                Destination           Protocol Length Info
    178 50.345695   10.164.110.195        188.125.68.129        TCP      68     57250 > imaps [ACK] Seq=427 Ack=4571 Win=20768 Len=0 TSval=99130 TSecr=1851105411

Frame 178: 68 bytes on wire (544 bits), 68 bytes captured (544 bits)
Linux cooked capture
Internet Protocol Version 4, Src: 10.164.110.195 (10.164.110.195), Dst: 188.125.68.129 (188.125.68.129)
Transmission Control Protocol, Src Port: 57250 (57250), Dst Port: imaps (993), Seq: 427, Ack: 4571, Len: 0

No.     Time        Source                Destination           Protocol Length Info
    179 50.349435   10.164.110.195        188.125.68.129        TLSv1    107    Application Data

Frame 179: 107 bytes on wire (856 bits), 107 bytes captured (856 bits)
Linux cooked capture
Internet Protocol Version 4, Src: 10.164.110.195 (10.164.110.195), Dst: 188.125.68.129 (188.125.68.129)
Transmission Control Protocol, Src Port: 57250 (57250), Dst Port: imaps (993), Seq: 427, Ack: 4571, Len: 39
Secure Sockets Layer

No.     Time        Source                Destination           Protocol Length Info
    180 50.585502   188.125.68.129        10.164.110.195        TLSv1    301    Application Data

Frame 180: 301 bytes on wire (2408 bits), 301 bytes captured (2408 bits)
Linux cooked capture
Internet Protocol Version 4, Src: 188.125.68.129 (188.125.68.129), Dst: 10.164.110.195 (10.164.110.195)
Transmission Control Protocol, Src Port: imaps (993), Dst Port: 57250 (57250), Seq: 4571, Ack: 466, Len: 233
Secure Sockets Layer

No.     Time        Source                Destination           Protocol Length Info
    181 50.588868   10.164.110.195        188.125.68.129        TLSv1    107    Application Data

Frame 181: 107 bytes on wire (856 bits), 107 bytes captured (856 bits)
Linux cooked capture
Internet Protocol Version 4, Src: 10.164.110.195 (10.164.110.195), Dst: 188.125.68.129 (188.125.68.129)
Transmission Control Protocol, Src Port: 57250 (57250), Dst Port: imaps (993), Seq: 466, Ack: 4804, Len: 39
Secure Sockets Layer
