No.     Time        Source                Destination           Protocol Length Info
      1 0.000000    192.168.1.102         188.125.68.129        TCP      74     60849 > imaps [SYN] Seq=0 Win=5840 Len=0 MSS=1460 SACK_PERM=1 TSval=22957 TSecr=0 WS=8

Frame 1: 74 bytes on wire (592 bits), 74 bytes captured (592 bits)
Ethernet II, Src: aa:aa:03:00:00:00 (aa:aa:03:00:00:00), Dst: 1b:24:63:41:00:44 (1b:24:63:41:00:44)
Internet Protocol Version 4, Src: 192.168.1.102 (192.168.1.102), Dst: 188.125.68.129 (188.125.68.129)
Transmission Control Protocol, Src Port: 60849 (60849), Dst Port: imaps (993), Seq: 0, Len: 0

No.     Time        Source                Destination           Protocol Length Info
      2 0.189412    192.168.1.102         130.186.6.177         TCP      66     38195 > imaps [FIN, ACK] Seq=1 Ack=1 Win=4342 Len=0 TSval=22976 TSecr=1292553658

Frame 2: 66 bytes on wire (528 bits), 66 bytes captured (528 bits)
Ethernet II, Src: aa:aa:03:00:00:00 (aa:aa:03:00:00:00), Dst: 1b:24:63:41:00:3c (1b:24:63:41:00:3c)
Internet Protocol Version 4, Src: 192.168.1.102 (192.168.1.102), Dst: 130.186.6.177 (130.186.6.177)
Transmission Control Protocol, Src Port: 38195 (38195), Dst Port: imaps (993), Seq: 1, Ack: 1, Len: 0

No.     Time        Source                Destination           Protocol Length Info
      3 0.257982    188.125.68.129        192.168.1.102         TCP      70     imaps > 60849 [SYN, ACK] Seq=0 Ack=1 Win=14480 Len=0 MSS=1452 SACK_PERM=1 TSval=1242354270 TSecr=22957

Frame 3: 70 bytes on wire (560 bits), 70 bytes captured (560 bits)
Ethernet II, Src: FonTechn_a5:e9:80 (00:18:84:a5:e9:80), Dst: SamsungE_24:63:41 (cc:05:1b:24:63:41)
Internet Protocol Version 4, Src: 188.125.68.129 (188.125.68.129), Dst: 192.168.1.102 (192.168.1.102)
Transmission Control Protocol, Src Port: imaps (993), Dst Port: 60849 (60849), Seq: 0, Ack: 1, Len: 0

No.     Time        Source                Destination           Protocol Length Info
      4 0.258239    192.168.1.102         188.125.68.129        TCP      66     60849 > imaps [ACK] Seq=1 Ack=1 Win=5840 Len=0 TSval=22983 TSecr=1242354270

Frame 4: 66 bytes on wire (528 bits), 66 bytes captured (528 bits)
Ethernet II, Src: aa:aa:03:00:00:00 (aa:aa:03:00:00:00), Dst: 1b:24:63:41:00:3c (1b:24:63:41:00:3c)
Internet Protocol Version 4, Src: 192.168.1.102 (192.168.1.102), Dst: 188.125.68.129 (188.125.68.129)
Transmission Control Protocol, Src Port: 60849 (60849), Dst Port: imaps (993), Seq: 1, Ack: 1, Len: 0

No.     Time        Source                Destination           Protocol Length Info
      5 0.264112    130.186.6.177         192.168.1.102         TLSv1    143    Application Data

Frame 5: 143 bytes on wire (1144 bits), 143 bytes captured (1144 bits)
Ethernet II, Src: FonTechn_a5:e9:80 (00:18:84:a5:e9:80), Dst: SamsungE_24:63:41 (cc:05:1b:24:63:41)
Internet Protocol Version 4, Src: 130.186.6.177 (130.186.6.177), Dst: 192.168.1.102 (192.168.1.102)
Transmission Control Protocol, Src Port: imaps (993), Dst Port: 38195 (38195), Seq: 1, Ack: 2, Len: 77
Secure Sockets Layer

No.     Time        Source                Destination           Protocol Length Info
      6 0.264339    192.168.1.102         130.186.6.177         TCP      54     38195 > imaps [RST] Seq=2 Win=0 Len=0

Frame 6: 54 bytes on wire (432 bits), 54 bytes captured (432 bits)
Ethernet II, Src: aa:aa:03:00:00:00 (aa:aa:03:00:00:00), Dst: 1b:24:63:41:00:30 (1b:24:63:41:00:30)
Internet Protocol Version 4, Src: 192.168.1.102 (192.168.1.102), Dst: 130.186.6.177 (130.186.6.177)
Transmission Control Protocol, Src Port: 38195 (38195), Dst Port: imaps (993), Seq: 2, Len: 0

No.     Time        Source                Destination           Protocol Length Info
      7 0.264794    130.186.6.177         192.168.1.102         TCP      66     imaps > 38195 [FIN, ACK] Seq=78 Ack=2 Win=62 Len=0 TSval=1292559338 TSecr=22976

Frame 7: 66 bytes on wire (528 bits), 66 bytes captured (528 bits)
Ethernet II, Src: FonTechn_a5:e9:80 (00:18:84:a5:e9:80), Dst: SamsungE_24:63:41 (cc:05:1b:24:63:41)
Internet Protocol Version 4, Src: 130.186.6.177 (130.186.6.177), Dst: 192.168.1.102 (192.168.1.102)
Transmission Control Protocol, Src Port: imaps (993), Dst Port: 38195 (38195), Seq: 78, Ack: 2, Len: 0

No.     Time        Source                Destination           Protocol Length Info
      8 0.264882    192.168.1.102         130.186.6.177         TCP      54     38195 > imaps [RST] Seq=2 Win=0 Len=0

Frame 8: 54 bytes on wire (432 bits), 54 bytes captured (432 bits)
Ethernet II, Src: aa:aa:03:00:00:00 (aa:aa:03:00:00:00), Dst: 1b:24:63:41:00:30 (1b:24:63:41:00:30)
Internet Protocol Version 4, Src: 192.168.1.102 (192.168.1.102), Dst: 130.186.6.177 (130.186.6.177)
Transmission Control Protocol, Src Port: 38195 (38195), Dst Port: imaps (993), Seq: 2, Len: 0

No.     Time        Source                Destination           Protocol Length Info
      9 0.285170    192.168.1.102         188.125.68.129        TLSv1    178    Client Hello

Frame 9: 178 bytes on wire (1424 bits), 178 bytes captured (1424 bits)
Ethernet II, Src: aa:aa:03:00:00:00 (aa:aa:03:00:00:00), Dst: 1b:24:63:41:00:ac (1b:24:63:41:00:ac)
Internet Protocol Version 4, Src: 192.168.1.102 (192.168.1.102), Dst: 188.125.68.129 (188.125.68.129)
Transmission Control Protocol, Src Port: 60849 (60849), Dst Port: imaps (993), Seq: 1, Ack: 1, Len: 112
Secure Sockets Layer

No.     Time        Source                Destination           Protocol Length Info
     10 0.390155    188.125.68.129        192.168.1.102         TCP      66     imaps > 60849 [ACK] Seq=1 Ack=113 Win=14480 Len=0 TSval=1242354544 TSecr=22986

Frame 10: 66 bytes on wire (528 bits), 66 bytes captured (528 bits)
Ethernet II, Src: FonTechn_a5:e9:80 (00:18:84:a5:e9:80), Dst: SamsungE_24:63:41 (cc:05:1b:24:63:41)
Internet Protocol Version 4, Src: 188.125.68.129 (188.125.68.129), Dst: 192.168.1.102 (192.168.1.102)
Transmission Control Protocol, Src Port: imaps (993), Dst Port: 60849 (60849), Seq: 1, Ack: 113, Len: 0

No.     Time        Source                Destination           Protocol Length Info
     11 0.392060    188.125.68.129        192.168.1.102         TLSv1    1506   Server Hello

Frame 11: 1506 bytes on wire (12048 bits), 1506 bytes captured (12048 bits)
Ethernet II, Src: FonTechn_a5:e9:80 (00:18:84:a5:e9:80), Dst: SamsungE_24:63:41 (cc:05:1b:24:63:41)
Internet Protocol Version 4, Src: 188.125.68.129 (188.125.68.129), Dst: 192.168.1.102 (192.168.1.102)
Transmission Control Protocol, Src Port: imaps (993), Dst Port: 60849 (60849), Seq: 1, Ack: 113, Len: 1440
Secure Sockets Layer

No.     Time        Source                Destination           Protocol Length Info
     12 0.392319    192.168.1.102         188.125.68.129        TCP      66     60849 > imaps [ACK] Seq=113 Ack=1441 Win=8640 Len=0 TSval=22997 TSecr=1242354544

Frame 12: 66 bytes on wire (528 bits), 66 bytes captured (528 bits)
Ethernet II, Src: aa:aa:03:00:00:00 (aa:aa:03:00:00:00), Dst: 1b:24:63:41:00:3c (1b:24:63:41:00:3c)
Internet Protocol Version 4, Src: 192.168.1.102 (192.168.1.102), Dst: 188.125.68.129 (188.125.68.129)
Transmission Control Protocol, Src Port: 60849 (60849), Dst Port: imaps (993), Seq: 113, Ack: 1441, Len: 0

No.     Time        Source                Destination           Protocol Length Info
     13 0.393312    188.125.68.129        192.168.1.102         TCP      1506   [TCP segment of a reassembled PDU]

Frame 13: 1506 bytes on wire (12048 bits), 1506 bytes captured (12048 bits)
Ethernet II, Src: FonTechn_a5:e9:80 (00:18:84:a5:e9:80), Dst: SamsungE_24:63:41 (cc:05:1b:24:63:41)
Internet Protocol Version 4, Src: 188.125.68.129 (188.125.68.129), Dst: 192.168.1.102 (192.168.1.102)
Transmission Control Protocol, Src Port: imaps (993), Dst Port: 60849 (60849), Seq: 1441, Ack: 113, Len: 1440

No.     Time        Source                Destination           Protocol Length Info
     14 0.393550    192.168.1.102         188.125.68.129        TCP      66     60849 > imaps [ACK] Seq=113 Ack=2881 Win=11520 Len=0 TSval=22997 TSecr=1242354544

Frame 14: 66 bytes on wire (528 bits), 66 bytes captured (528 bits)
Ethernet II, Src: aa:aa:03:00:00:00 (aa:aa:03:00:00:00), Dst: 1b:24:63:41:00:3c (1b:24:63:41:00:3c)
Internet Protocol Version 4, Src: 192.168.1.102 (192.168.1.102), Dst: 188.125.68.129 (188.125.68.129)
Transmission Control Protocol, Src Port: 60849 (60849), Dst Port: imaps (993), Seq: 113, Ack: 2881, Len: 0

No.     Time        Source                Destination           Protocol Length Info
     15 0.397414    188.125.68.129        192.168.1.102         TCP      1282   [TCP segment of a reassembled PDU]

Frame 15: 1282 bytes on wire (10256 bits), 1282 bytes captured (10256 bits)
Ethernet II, Src: FonTechn_a5:e9:80 (00:18:84:a5:e9:80), Dst: SamsungE_24:63:41 (cc:05:1b:24:63:41)
Internet Protocol Version 4, Src: 188.125.68.129 (188.125.68.129), Dst: 192.168.1.102 (192.168.1.102)
Transmission Control Protocol, Src Port: imaps (993), Dst Port: 60849 (60849), Seq: 2881, Ack: 113, Len: 1216

No.     Time        Source                Destination           Protocol Length Info
     16 0.397695    192.168.1.102         188.125.68.129        TCP      66     60849 > imaps [ACK] Seq=113 Ack=4097 Win=14400 Len=0 TSval=22997 TSecr=1242354544

Frame 16: 66 bytes on wire (528 bits), 66 bytes captured (528 bits)
Ethernet II, Src: aa:aa:03:00:00:00 (aa:aa:03:00:00:00), Dst: 1b:24:63:41:00:3c (1b:24:63:41:00:3c)
Internet Protocol Version 4, Src: 192.168.1.102 (192.168.1.102), Dst: 188.125.68.129 (188.125.68.129)
Transmission Control Protocol, Src Port: 60849 (60849), Dst Port: imaps (993), Seq: 113, Ack: 4097, Len: 0

No.     Time        Source                Destination           Protocol Length Info
     17 0.494149    188.125.68.129        192.168.1.102         TLSv1    208    Certificate, Server Hello Done

Frame 17: 208 bytes on wire (1664 bits), 208 bytes captured (1664 bits)
Ethernet II, Src: FonTechn_a5:e9:80 (00:18:84:a5:e9:80), Dst: SamsungE_24:63:41 (cc:05:1b:24:63:41)
Internet Protocol Version 4, Src: 188.125.68.129 (188.125.68.129), Dst: 192.168.1.102 (192.168.1.102)
Transmission Control Protocol, Src Port: imaps (993), Dst Port: 60849 (60849), Seq: 4097, Ack: 113, Len: 142
[4 Reassembled TCP Segments (4152 bytes): #11(1354), #13(1440), #15(1216), #17(142)]
Secure Sockets Layer

No.     Time        Source                Destination           Protocol Length Info
     18 0.494397    192.168.1.102         188.125.68.129        TCP      66     60849 > imaps [ACK] Seq=113 Ack=4239 Win=17280 Len=0 TSval=23007 TSecr=1242354664

Frame 18: 66 bytes on wire (528 bits), 66 bytes captured (528 bits)
Ethernet II, Src: aa:aa:03:00:00:00 (aa:aa:03:00:00:00), Dst: 1b:24:63:41:00:3c (1b:24:63:41:00:3c)
Internet Protocol Version 4, Src: 192.168.1.102 (192.168.1.102), Dst: 188.125.68.129 (188.125.68.129)
Transmission Control Protocol, Src Port: 60849 (60849), Dst Port: imaps (993), Seq: 113, Ack: 4239, Len: 0

No.     Time        Source                Destination           Protocol Length Info
     19 0.621945    192.168.1.102         188.125.68.129        TLSv1    380    Client Key Exchange, Change Cipher Spec, Encrypted Handshake Message

Frame 19: 380 bytes on wire (3040 bits), 380 bytes captured (3040 bits)
Ethernet II, Src: aa:aa:03:00:00:00 (aa:aa:03:00:00:00), Dst: 1b:24:63:41:01:76 (1b:24:63:41:01:76)
Internet Protocol Version 4, Src: 192.168.1.102 (192.168.1.102), Dst: 188.125.68.129 (188.125.68.129)
Transmission Control Protocol, Src Port: 60849 (60849), Dst Port: imaps (993), Seq: 113, Ack: 4239, Len: 314
Secure Sockets Layer

No.     Time        Source                Destination           Protocol Length Info
     20 0.744072    188.125.68.129        192.168.1.102         TLSv1    113    Change Cipher Spec, Encrypted Handshake Message

Frame 20: 113 bytes on wire (904 bits), 113 bytes captured (904 bits)
Ethernet II, Src: FonTechn_a5:e9:80 (00:18:84:a5:e9:80), Dst: SamsungE_24:63:41 (cc:05:1b:24:63:41)
Internet Protocol Version 4, Src: 188.125.68.129 (188.125.68.129), Dst: 192.168.1.102 (192.168.1.102)
Transmission Control Protocol, Src Port: imaps (993), Dst Port: 60849 (60849), Seq: 4239, Ack: 427, Len: 47
Secure Sockets Layer

No.     Time        Source                Destination           Protocol Length Info
     21 0.744270    192.168.1.102         188.125.68.129        TCP      66     60849 > imaps [ACK] Seq=427 Ack=4286 Win=17280 Len=0 TSval=23032 TSecr=1242354912

Frame 21: 66 bytes on wire (528 bits), 66 bytes captured (528 bits)
Ethernet II, Src: aa:aa:03:00:00:00 (aa:aa:03:00:00:00), Dst: 1b:24:63:41:00:3c (1b:24:63:41:00:3c)
Internet Protocol Version 4, Src: 192.168.1.102 (192.168.1.102), Dst: 188.125.68.129 (188.125.68.129)
Transmission Control Protocol, Src Port: 60849 (60849), Dst Port: imaps (993), Seq: 427, Ack: 4286, Len: 0

No.     Time        Source                Destination           Protocol Length Info
     22 0.844232    188.125.68.129        192.168.1.102         TLSv1    351    Application Data

Frame 22: 351 bytes on wire (2808 bits), 351 bytes captured (2808 bits)
Ethernet II, Src: FonTechn_a5:e9:80 (00:18:84:a5:e9:80), Dst: SamsungE_24:63:41 (cc:05:1b:24:63:41)
Internet Protocol Version 4, Src: 188.125.68.129 (188.125.68.129), Dst: 192.168.1.102 (192.168.1.102)
Transmission Control Protocol, Src Port: imaps (993), Dst Port: 60849 (60849), Seq: 4286, Ack: 427, Len: 285
Secure Sockets Layer

No.     Time        Source                Destination           Protocol Length Info
     23 0.844440    192.168.1.102         188.125.68.129        TCP      66     60849 > imaps [ACK] Seq=427 Ack=4571 Win=20160 Len=0 TSval=23042 TSecr=1242355009

Frame 23: 66 bytes on wire (528 bits), 66 bytes captured (528 bits)
Ethernet II, Src: aa:aa:03:00:00:00 (aa:aa:03:00:00:00), Dst: 1b:24:63:41:00:3c (1b:24:63:41:00:3c)
Internet Protocol Version 4, Src: 192.168.1.102 (192.168.1.102), Dst: 188.125.68.129 (188.125.68.129)
Transmission Control Protocol, Src Port: 60849 (60849), Dst Port: imaps (993), Seq: 427, Ack: 4571, Len: 0

No.     Time        Source                Destination           Protocol Length Info
     24 0.847852    192.168.1.102         188.125.68.129        TLSv1    105    Application Data

Frame 24: 105 bytes on wire (840 bits), 105 bytes captured (840 bits)
Ethernet II, Src: aa:aa:03:00:00:00 (aa:aa:03:00:00:00), Dst: 1b:24:63:41:00:63 (1b:24:63:41:00:63)
Internet Protocol Version 4, Src: 192.168.1.102 (192.168.1.102), Dst: 188.125.68.129 (188.125.68.129)
Transmission Control Protocol, Src Port: 60849 (60849), Dst Port: imaps (993), Seq: 427, Ack: 4571, Len: 39
Secure Sockets Layer

No.     Time        Source                Destination           Protocol Length Info
     25 0.873449    FonTechn_a5:e9:81     Spanning-tree-(for-bridges)_00 STP      52     Conf. Root = 32768/0/00:18:84:a5:e9:80  Cost = 0  Port = 0x8002

Frame 25: 52 bytes on wire (416 bits), 52 bytes captured (416 bits)
IEEE 802.3 Ethernet 
Logical-Link Control
Spanning Tree Protocol

No.     Time        Source                Destination           Protocol Length Info
     26 0.979795    188.125.68.129        192.168.1.102         TLSv1    299    Application Data

Frame 26: 299 bytes on wire (2392 bits), 299 bytes captured (2392 bits)
Ethernet II, Src: FonTechn_a5:e9:80 (00:18:84:a5:e9:80), Dst: SamsungE_24:63:41 (cc:05:1b:24:63:41)
Internet Protocol Version 4, Src: 188.125.68.129 (188.125.68.129), Dst: 192.168.1.102 (192.168.1.102)
Transmission Control Protocol, Src Port: imaps (993), Dst Port: 60849 (60849), Seq: 4571, Ack: 466, Len: 233
Secure Sockets Layer

No.     Time        Source                Destination           Protocol Length Info
     27 0.987417    192.168.1.102         188.125.68.129        TLSv1    105    Application Data

Frame 27: 105 bytes on wire (840 bits), 105 bytes captured (840 bits)
Ethernet II, Src: aa:aa:03:00:00:00 (aa:aa:03:00:00:00), Dst: 1b:24:63:41:00:63 (1b:24:63:41:00:63)
Internet Protocol Version 4, Src: 192.168.1.102 (192.168.1.102), Dst: 188.125.68.129 (188.125.68.129)
Transmission Control Protocol, Src Port: 60849 (60849), Dst Port: imaps (993), Seq: 466, Ack: 4804, Len: 39
Secure Sockets Layer

No.     Time        Source                Destination           Protocol Length Info
     28 1.089857    188.125.68.129        192.168.1.102         TLSv1    299    Application Data

Frame 28: 299 bytes on wire (2392 bits), 299 bytes captured (2392 bits)
Ethernet II, Src: FonTechn_a5:e9:80 (00:18:84:a5:e9:80), Dst: SamsungE_24:63:41 (cc:05:1b:24:63:41)
Internet Protocol Version 4, Src: 188.125.68.129 (188.125.68.129), Dst: 192.168.1.102 (192.168.1.102)
Transmission Control Protocol, Src Port: imaps (993), Dst Port: 60849 (60849), Seq: 4804, Ack: 505, Len: 233
Secure Sockets Layer

No.     Time        Source                Destination           Protocol Length Info
     29 1.105049    192.168.1.102         188.125.68.129        TLSv1    124    Application Data

Frame 29: 124 bytes on wire (992 bits), 124 bytes captured (992 bits)
Ethernet II, Src: aa:aa:03:00:00:00 (aa:aa:03:00:00:00), Dst: 1b:24:63:41:00:76 (1b:24:63:41:00:76)
Internet Protocol Version 4, Src: 192.168.1.102 (192.168.1.102), Dst: 188.125.68.129 (188.125.68.129)
Transmission Control Protocol, Src Port: 60849 (60849), Dst Port: imaps (993), Seq: 505, Ack: 5037, Len: 58
Secure Sockets Layer

No.     Time        Source                Destination           Protocol Length Info
     30 1.239494    188.125.68.129        192.168.1.102         TCP      66     imaps > 60849 [ACK] Seq=5037 Ack=563 Win=15544 Len=0 TSval=1242355411 TSecr=23068

Frame 30: 66 bytes on wire (528 bits), 66 bytes captured (528 bits)
Ethernet II, Src: FonTechn_a5:e9:80 (00:18:84:a5:e9:80), Dst: SamsungE_24:63:41 (cc:05:1b:24:63:41)
Internet Protocol Version 4, Src: 188.125.68.129 (188.125.68.129), Dst: 192.168.1.102 (192.168.1.102)
Transmission Control Protocol, Src Port: imaps (993), Dst Port: 60849 (60849), Seq: 5037, Ack: 563, Len: 0

No.     Time        Source                Destination           Protocol Length Info
     31 1.309335    188.125.68.129        192.168.1.102         TLSv1    155    Application Data

Frame 31: 155 bytes on wire (1240 bits), 155 bytes captured (1240 bits)
Ethernet II, Src: FonTechn_a5:e9:80 (00:18:84:a5:e9:80), Dst: SamsungE_24:63:41 (cc:05:1b:24:63:41)
Internet Protocol Version 4, Src: 188.125.68.129 (188.125.68.129), Dst: 192.168.1.102 (192.168.1.102)
Transmission Control Protocol, Src Port: imaps (993), Dst Port: 60849 (60849), Seq: 5037, Ack: 563, Len: 89
Secure Sockets Layer

No.     Time        Source                Destination           Protocol Length Info
     32 1.311334    192.168.1.102         188.125.68.129        TLSv1    106    Application Data

Frame 32: 106 bytes on wire (848 bits), 106 bytes captured (848 bits)
Ethernet II, Src: aa:aa:03:00:00:00 (aa:aa:03:00:00:00), Dst: 1b:24:63:41:00:64 (1b:24:63:41:00:64)
Internet Protocol Version 4, Src: 192.168.1.102 (192.168.1.102), Dst: 188.125.68.129 (188.125.68.129)
Transmission Control Protocol, Src Port: 60849 (60849), Dst Port: imaps (993), Seq: 563, Ack: 5126, Len: 40
Secure Sockets Layer

No.     Time        Source                Destination           Protocol Length Info
     33 1.409269    188.125.68.129        192.168.1.102         TCP      66     imaps > 60849 [ACK] Seq=5126 Ack=603 Win=15544 Len=0 TSval=1242355574 TSecr=23088

Frame 33: 66 bytes on wire (528 bits), 66 bytes captured (528 bits)
Ethernet II, Src: FonTechn_a5:e9:80 (00:18:84:a5:e9:80), Dst: SamsungE_24:63:41 (cc:05:1b:24:63:41)
Internet Protocol Version 4, Src: 188.125.68.129 (188.125.68.129), Dst: 192.168.1.102 (192.168.1.102)
Transmission Control Protocol, Src Port: imaps (993), Dst Port: 60849 (60849), Seq: 5126, Ack: 603, Len: 0

No.     Time        Source                Destination           Protocol Length Info
     34 1.410130    188.125.68.129        192.168.1.102         TLSv1    385    Application Data

Frame 34: 385 bytes on wire (3080 bits), 385 bytes captured (3080 bits)
Ethernet II, Src: FonTechn_a5:e9:80 (00:18:84:a5:e9:80), Dst: SamsungE_24:63:41 (cc:05:1b:24:63:41)
Internet Protocol Version 4, Src: 188.125.68.129 (188.125.68.129), Dst: 192.168.1.102 (192.168.1.102)
Transmission Control Protocol, Src Port: imaps (993), Dst Port: 60849 (60849), Seq: 5126, Ack: 603, Len: 319
Secure Sockets Layer

No.     Time        Source                Destination           Protocol Length Info
     35 1.410367    192.168.1.102         188.125.68.129        TCP      66     60849 > imaps [ACK] Seq=603 Ack=5445 Win=28800 Len=0 TSval=23098 TSecr=1242355576

Frame 35: 66 bytes on wire (528 bits), 66 bytes captured (528 bits)
Ethernet II, Src: aa:aa:03:00:00:00 (aa:aa:03:00:00:00), Dst: 1b:24:63:41:00:3c (1b:24:63:41:00:3c)
Internet Protocol Version 4, Src: 192.168.1.102 (192.168.1.102), Dst: 188.125.68.129 (188.125.68.129)
Transmission Control Protocol, Src Port: 60849 (60849), Dst Port: imaps (993), Seq: 603, Ack: 5445, Len: 0

No.     Time        Source                Destination           Protocol Length Info
     36 1.747040    192.168.1.102         188.125.68.129        TLSv1    99     Application Data

Frame 36: 99 bytes on wire (792 bits), 99 bytes captured (792 bits)
Ethernet II, Src: aa:aa:03:00:00:00 (aa:aa:03:00:00:00), Dst: 1b:24:63:41:00:5d (1b:24:63:41:00:5d)
Internet Protocol Version 4, Src: 192.168.1.102 (192.168.1.102), Dst: 188.125.68.129 (188.125.68.129)
Transmission Control Protocol, Src Port: 60849 (60849), Dst Port: imaps (993), Seq: 603, Ack: 5445, Len: 33
Secure Sockets Layer

No.     Time        Source                Destination           Protocol Length Info
     37 2.003414    188.125.68.129        192.168.1.102         TLSv1    112    Application Data

Frame 37: 112 bytes on wire (896 bits), 112 bytes captured (896 bits)
Ethernet II, Src: FonTechn_a5:e9:80 (00:18:84:a5:e9:80), Dst: SamsungE_24:63:41 (cc:05:1b:24:63:41)
Internet Protocol Version 4, Src: 188.125.68.129 (188.125.68.129), Dst: 192.168.1.102 (192.168.1.102)
Transmission Control Protocol, Src Port: imaps (993), Dst Port: 60849 (60849), Seq: 5445, Ack: 636, Len: 46
Secure Sockets Layer

No.     Time        Source                Destination           Protocol Length Info
     38 2.007649    192.168.1.102         188.125.68.129        TLSv1    109    Application Data

Frame 38: 109 bytes on wire (872 bits), 109 bytes captured (872 bits)
Ethernet II, Src: aa:aa:03:00:00:00 (aa:aa:03:00:00:00), Dst: 1b:24:63:41:00:67 (1b:24:63:41:00:67)
Internet Protocol Version 4, Src: 192.168.1.102 (192.168.1.102), Dst: 188.125.68.129 (188.125.68.129)
Transmission Control Protocol, Src Port: 60849 (60849), Dst Port: imaps (993), Seq: 636, Ack: 5491, Len: 43
Secure Sockets Layer

No.     Time        Source                Destination           Protocol Length Info
     39 2.204835    188.125.68.129        192.168.1.102         TLSv1    485    Application Data

Frame 39: 485 bytes on wire (3880 bits), 485 bytes captured (3880 bits)
Ethernet II, Src: FonTechn_a5:e9:80 (00:18:84:a5:e9:80), Dst: SamsungE_24:63:41 (cc:05:1b:24:63:41)
Internet Protocol Version 4, Src: 188.125.68.129 (188.125.68.129), Dst: 192.168.1.102 (192.168.1.102)
Transmission Control Protocol, Src Port: imaps (993), Dst Port: 60849 (60849), Seq: 5491, Ack: 679, Len: 419
Secure Sockets Layer

No.     Time        Source                Destination           Protocol Length Info
     40 2.220067    192.168.1.102         188.125.68.129        TLSv1    122    Application Data

Frame 40: 122 bytes on wire (976 bits), 122 bytes captured (976 bits)
Ethernet II, Src: aa:aa:03:00:00:00 (aa:aa:03:00:00:00), Dst: 1b:24:63:41:00:74 (1b:24:63:41:00:74)
Internet Protocol Version 4, Src: 192.168.1.102 (192.168.1.102), Dst: 188.125.68.129 (188.125.68.129)
Transmission Control Protocol, Src Port: 60849 (60849), Dst Port: imaps (993), Seq: 679, Ack: 5910, Len: 56
Secure Sockets Layer

No.     Time        Source                Destination           Protocol Length Info
     41 2.408709    188.125.68.129        192.168.1.102         TLSv1    230    Application Data

Frame 41: 230 bytes on wire (1840 bits), 230 bytes captured (1840 bits)
Ethernet II, Src: FonTechn_a5:e9:80 (00:18:84:a5:e9:80), Dst: SamsungE_24:63:41 (cc:05:1b:24:63:41)
Internet Protocol Version 4, Src: 188.125.68.129 (188.125.68.129), Dst: 192.168.1.102 (192.168.1.102)
Transmission Control Protocol, Src Port: imaps (993), Dst Port: 60849 (60849), Seq: 5910, Ack: 735, Len: 164
Secure Sockets Layer

No.     Time        Source                Destination           Protocol Length Info
     42 2.421659    192.168.1.102         188.125.68.129        TLSv1    217    Application Data

Frame 42: 217 bytes on wire (1736 bits), 217 bytes captured (1736 bits)
Ethernet II, Src: aa:aa:03:00:00:00 (aa:aa:03:00:00:00), Dst: 1b:24:63:41:00:d3 (1b:24:63:41:00:d3)
Internet Protocol Version 4, Src: 192.168.1.102 (192.168.1.102), Dst: 188.125.68.129 (188.125.68.129)
Transmission Control Protocol, Src Port: 60849 (60849), Dst Port: imaps (993), Seq: 735, Ack: 6074, Len: 151
Secure Sockets Layer

No.     Time        Source                Destination           Protocol Length Info
     43 2.818997    FonTechn_a5:e9:81     Spanning-tree-(for-bridges)_00 STP      52     Conf. Root = 32768/0/00:18:84:a5:e9:80  Cost = 0  Port = 0x8002

Frame 43: 52 bytes on wire (416 bits), 52 bytes captured (416 bits)
IEEE 802.3 Ethernet 
Logical-Link Control
Spanning Tree Protocol

No.     Time        Source                Destination           Protocol Length Info
     44 2.819912    188.125.68.129        192.168.1.102         TLSv1    1020   Application Data

Frame 44: 1020 bytes on wire (8160 bits), 1020 bytes captured (8160 bits)
Ethernet II, Src: FonTechn_a5:e9:80 (00:18:84:a5:e9:80), Dst: SamsungE_24:63:41 (cc:05:1b:24:63:41)
Internet Protocol Version 4, Src: 188.125.68.129 (188.125.68.129), Dst: 192.168.1.102 (192.168.1.102)
Transmission Control Protocol, Src Port: imaps (993), Dst Port: 60849 (60849), Seq: 6074, Ack: 886, Len: 954
Secure Sockets Layer

No.     Time        Source                Destination           Protocol Length Info
     45 2.851657    192.168.1.102         188.125.68.129        TCP      66     60849 > imaps [ACK] Seq=886 Ack=7028 Win=34560 Len=0 TSval=23243 TSecr=1242356736

Frame 45: 66 bytes on wire (528 bits), 66 bytes captured (528 bits)
Ethernet II, Src: aa:aa:03:00:00:00 (aa:aa:03:00:00:00), Dst: 1b:24:63:41:00:3c (1b:24:63:41:00:3c)
Internet Protocol Version 4, Src: 192.168.1.102 (192.168.1.102), Dst: 188.125.68.129 (188.125.68.129)
Transmission Control Protocol, Src Port: 60849 (60849), Dst Port: imaps (993), Seq: 886, Ack: 7028, Len: 0

No.     Time        Source                Destination           Protocol Length Info
     46 3.997290    192.168.1.102         188.125.68.129        TCP      66     60849 > imaps [FIN, ACK] Seq=886 Ack=7028 Win=34560 Len=0 TSval=23357 TSecr=1242356736

Frame 46: 66 bytes on wire (528 bits), 66 bytes captured (528 bits)
Ethernet II, Src: aa:aa:03:00:00:00 (aa:aa:03:00:00:00), Dst: 1b:24:63:41:00:3c (1b:24:63:41:00:3c)
Internet Protocol Version 4, Src: 192.168.1.102 (192.168.1.102), Dst: 188.125.68.129 (188.125.68.129)
Transmission Control Protocol, Src Port: 60849 (60849), Dst Port: imaps (993), Seq: 886, Ack: 7028, Len: 0

No.     Time        Source                Destination           Protocol Length Info
     47 4.252084    188.125.68.129        192.168.1.102         TCP      66     imaps > 60849 [FIN, ACK] Seq=7028 Ack=887 Win=16616 Len=0 TSval=1242358254 TSecr=23357

Frame 47: 66 bytes on wire (528 bits), 66 bytes captured (528 bits)
Ethernet II, Src: FonTechn_a5:e9:80 (00:18:84:a5:e9:80), Dst: SamsungE_24:63:41 (cc:05:1b:24:63:41)
Internet Protocol Version 4, Src: 188.125.68.129 (188.125.68.129), Dst: 192.168.1.102 (192.168.1.102)
Transmission Control Protocol, Src Port: imaps (993), Dst Port: 60849 (60849), Seq: 7028, Ack: 887, Len: 0

No.     Time        Source                Destination           Protocol Length Info
     48 4.252524    192.168.1.102         188.125.68.129        TCP      66     60849 > imaps [ACK] Seq=887 Ack=7029 Win=34560 Len=0 TSval=23383 TSecr=1242358254

Frame 48: 66 bytes on wire (528 bits), 66 bytes captured (528 bits)
Ethernet II, Src: aa:aa:03:00:00:00 (aa:aa:03:00:00:00), Dst: 1b:24:63:41:00:3c (1b:24:63:41:00:3c)
Internet Protocol Version 4, Src: 192.168.1.102 (192.168.1.102), Dst: 188.125.68.129 (188.125.68.129)
Transmission Control Protocol, Src Port: 60849 (60849), Dst Port: imaps (993), Seq: 887, Ack: 7029, Len: 0

No.     Time        Source                Destination           Protocol Length Info
     49 8.105397    192.168.1.102         157.56.195.250        TCP      74     48412 > imaps [SYN] Seq=0 Win=5840 Len=0 MSS=1460 SACK_PERM=1 TSval=23768 TSecr=0 WS=8

Frame 49: 74 bytes on wire (592 bits), 74 bytes captured (592 bits)
Ethernet II, Src: aa:aa:03:00:00:00 (aa:aa:03:00:00:00), Dst: 1b:24:63:41:00:44 (1b:24:63:41:00:44)
Internet Protocol Version 4, Src: 192.168.1.102 (192.168.1.102), Dst: 157.56.195.250 (157.56.195.250)
Transmission Control Protocol, Src Port: 48412 (48412), Dst Port: imaps (993), Seq: 0, Len: 0

No.     Time        Source                Destination           Protocol Length Info
     50 8.347499    157.56.195.250        192.168.1.102         TCP      74     imaps > 48412 [SYN, ACK] Seq=0 Ack=1 Win=8192 Len=0 MSS=1452 WS=256 SACK_PERM=1 TSval=86770259 TSecr=23768

Frame 50: 74 bytes on wire (592 bits), 74 bytes captured (592 bits)
Ethernet II, Src: FonTechn_a5:e9:80 (00:18:84:a5:e9:80), Dst: SamsungE_24:63:41 (cc:05:1b:24:63:41)
Internet Protocol Version 4, Src: 157.56.195.250 (157.56.195.250), Dst: 192.168.1.102 (192.168.1.102)
Transmission Control Protocol, Src Port: imaps (993), Dst Port: 48412 (48412), Seq: 0, Ack: 1, Len: 0

No.     Time        Source                Destination           Protocol Length Info
     51 8.771839    192.168.1.102         157.56.195.250        TCP      66     48412 > imaps [ACK] Seq=1 Ack=1 Win=5840 Len=0 TSval=23835 TSecr=86770259

Frame 51: 66 bytes on wire (528 bits), 66 bytes captured (528 bits)
Ethernet II, Src: aa:aa:03:00:00:00 (aa:aa:03:00:00:00), Dst: 1b:24:63:41:00:3c (1b:24:63:41:00:3c)
Internet Protocol Version 4, Src: 192.168.1.102 (192.168.1.102), Dst: 157.56.195.250 (157.56.195.250)
Transmission Control Protocol, Src Port: 48412 (48412), Dst Port: imaps (993), Seq: 1, Ack: 1, Len: 0

No.     Time        Source                Destination           Protocol Length Info
     52 8.812935    192.168.1.102         157.56.195.250        TLSv1    178    Client Hello

Frame 52: 178 bytes on wire (1424 bits), 178 bytes captured (1424 bits)
Ethernet II, Src: aa:aa:03:00:00:00 (aa:aa:03:00:00:00), Dst: 1b:24:63:41:00:ac (1b:24:63:41:00:ac)
Internet Protocol Version 4, Src: 192.168.1.102 (192.168.1.102), Dst: 157.56.195.250 (157.56.195.250)
Transmission Control Protocol, Src Port: 48412 (48412), Dst Port: imaps (993), Seq: 1, Ack: 1, Len: 112
Secure Sockets Layer

No.     Time        Source                Destination           Protocol Length Info
     53 8.859472    FonTechn_a5:e9:81     Spanning-tree-(for-bridges)_00 STP      52     Conf. Root = 32768/0/00:18:84:a5:e9:80  Cost = 0  Port = 0x8002

Frame 53: 52 bytes on wire (416 bits), 52 bytes captured (416 bits)
IEEE 802.3 Ethernet 
Logical-Link Control
Spanning Tree Protocol

No.     Time        Source                Destination           Protocol Length Info
     54 8.962459    157.56.195.250        192.168.1.102         TCP      1506   [TCP segment of a reassembled PDU]

Frame 54: 1506 bytes on wire (12048 bits), 1506 bytes captured (12048 bits)
Ethernet II, Src: FonTechn_a5:e9:80 (00:18:84:a5:e9:80), Dst: SamsungE_24:63:41 (cc:05:1b:24:63:41)
Internet Protocol Version 4, Src: 157.56.195.250 (157.56.195.250), Dst: 192.168.1.102 (192.168.1.102)
Transmission Control Protocol, Src Port: imaps (993), Dst Port: 48412 (48412), Seq: 1, Ack: 113, Len: 1440

No.     Time        Source                Destination           Protocol Length Info
     55 8.963479    157.56.195.250        192.168.1.102         TLSv1    1203   Server Hello, Certificate, Server Hello Done

Frame 55: 1203 bytes on wire (9624 bits), 1203 bytes captured (9624 bits)
Ethernet II, Src: FonTechn_a5:e9:80 (00:18:84:a5:e9:80), Dst: SamsungE_24:63:41 (cc:05:1b:24:63:41)
Internet Protocol Version 4, Src: 157.56.195.250 (157.56.195.250), Dst: 192.168.1.102 (192.168.1.102)
Transmission Control Protocol, Src Port: imaps (993), Dst Port: 48412 (48412), Seq: 1441, Ack: 113, Len: 1137
[2 Reassembled TCP Segments (2577 bytes): #54(1440), #55(1137)]
Secure Sockets Layer

No.     Time        Source                Destination           Protocol Length Info
     56 9.658387    192.168.1.102         157.56.195.250        TCP      66     48412 > imaps [ACK] Seq=113 Ack=1441 Win=8736 Len=0 TSval=23923 TSecr=86770334

Frame 56: 66 bytes on wire (528 bits), 66 bytes captured (528 bits)
Ethernet II, Src: aa:aa:03:00:00:00 (aa:aa:03:00:00:00), Dst: 1b:24:63:41:00:3c (1b:24:63:41:00:3c)
Internet Protocol Version 4, Src: 192.168.1.102 (192.168.1.102), Dst: 157.56.195.250 (157.56.195.250)
Transmission Control Protocol, Src Port: 48412 (48412), Dst Port: imaps (993), Seq: 113, Ack: 1441, Len: 0

No.     Time        Source                Destination           Protocol Length Info
     57 9.661630    192.168.1.102         157.56.195.250        TCP      66     48412 > imaps [ACK] Seq=113 Ack=2578 Win=11632 Len=0 TSval=23924 TSecr=86770334

Frame 57: 66 bytes on wire (528 bits), 66 bytes captured (528 bits)
Ethernet II, Src: aa:aa:03:00:00:00 (aa:aa:03:00:00:00), Dst: 1b:24:63:41:00:3c (1b:24:63:41:00:3c)
Internet Protocol Version 4, Src: 192.168.1.102 (192.168.1.102), Dst: 157.56.195.250 (157.56.195.250)
Transmission Control Protocol, Src Port: 48412 (48412), Dst Port: imaps (993), Seq: 113, Ack: 2578, Len: 0

No.     Time        Source                Destination           Protocol Length Info
     58 10.467069   192.168.1.102         157.56.195.250        TLSv1    392    Client Key Exchange, Change Cipher Spec, Encrypted Handshake Message

Frame 58: 392 bytes on wire (3136 bits), 392 bytes captured (3136 bits)
Ethernet II, Src: aa:aa:03:00:00:00 (aa:aa:03:00:00:00), Dst: 1b:24:63:41:01:82 (1b:24:63:41:01:82)
Internet Protocol Version 4, Src: 192.168.1.102 (192.168.1.102), Dst: 157.56.195.250 (157.56.195.250)
Transmission Control Protocol, Src Port: 48412 (48412), Dst Port: imaps (993), Seq: 113, Ack: 2578, Len: 326
Secure Sockets Layer

No.     Time        Source                Destination           Protocol Length Info
     59 10.805037   FonTechn_a5:e9:81     Spanning-tree-(for-bridges)_00 STP      52     Conf. Root = 32768/0/00:18:84:a5:e9:80  Cost = 0  Port = 0x8002

Frame 59: 52 bytes on wire (416 bits), 52 bytes captured (416 bits)
IEEE 802.3 Ethernet 
Logical-Link Control
Spanning Tree Protocol

No.     Time        Source                Destination           Protocol Length Info
     60 10.806030   157.56.195.250        192.168.1.102         TLSv1    125    Change Cipher Spec, Encrypted Handshake Message

Frame 60: 125 bytes on wire (1000 bits), 125 bytes captured (1000 bits)
Ethernet II, Src: FonTechn_a5:e9:80 (00:18:84:a5:e9:80), Dst: SamsungE_24:63:41 (cc:05:1b:24:63:41)
Internet Protocol Version 4, Src: 157.56.195.250 (157.56.195.250), Dst: 192.168.1.102 (192.168.1.102)
Transmission Control Protocol, Src Port: imaps (993), Dst Port: 48412 (48412), Seq: 2578, Ack: 439, Len: 59
Secure Sockets Layer

No.     Time        Source                Destination           Protocol Length Info
     61 10.806262   192.168.1.102         157.56.195.250        TCP      66     48412 > imaps [ACK] Seq=439 Ack=2637 Win=11632 Len=0 TSval=24038 TSecr=86770494

Frame 61: 66 bytes on wire (528 bits), 66 bytes captured (528 bits)
Ethernet II, Src: aa:aa:03:00:00:00 (aa:aa:03:00:00:00), Dst: 1b:24:63:41:00:3c (1b:24:63:41:00:3c)
Internet Protocol Version 4, Src: 192.168.1.102 (192.168.1.102), Dst: 157.56.195.250 (157.56.195.250)
Transmission Control Protocol, Src Port: 48412 (48412), Dst Port: imaps (993), Seq: 439, Ack: 2637, Len: 0

No.     Time        Source                Destination           Protocol Length Info
     62 10.907584   157.56.195.250        192.168.1.102         TLSv1    167    Application Data

Frame 62: 167 bytes on wire (1336 bits), 167 bytes captured (1336 bits)
Ethernet II, Src: FonTechn_a5:e9:80 (00:18:84:a5:e9:80), Dst: SamsungE_24:63:41 (cc:05:1b:24:63:41)
Internet Protocol Version 4, Src: 157.56.195.250 (157.56.195.250), Dst: 192.168.1.102 (192.168.1.102)
Transmission Control Protocol, Src Port: imaps (993), Dst Port: 48412 (48412), Seq: 2637, Ack: 439, Len: 101
Secure Sockets Layer

No.     Time        Source                Destination           Protocol Length Info
     63 10.941550   192.168.1.102         157.56.195.250        TCP      66     48412 > imaps [ACK] Seq=439 Ack=2738 Win=11632 Len=0 TSval=24052 TSecr=86770529

Frame 63: 66 bytes on wire (528 bits), 66 bytes captured (528 bits)
Ethernet II, Src: aa:aa:03:00:00:00 (aa:aa:03:00:00:00), Dst: 1b:24:63:41:00:3c (1b:24:63:41:00:3c)
Internet Protocol Version 4, Src: 192.168.1.102 (192.168.1.102), Dst: 157.56.195.250 (157.56.195.250)
Transmission Control Protocol, Src Port: 48412 (48412), Dst Port: imaps (993), Seq: 439, Ack: 2738, Len: 0

No.     Time        Source                Destination           Protocol Length Info
     64 11.346705   192.168.1.102         157.56.195.250        TLSv1    119    Application Data

Frame 64: 119 bytes on wire (952 bits), 119 bytes captured (952 bits)
Ethernet II, Src: aa:aa:03:00:00:00 (aa:aa:03:00:00:00), Dst: 1b:24:63:41:00:71 (1b:24:63:41:00:71)
Internet Protocol Version 4, Src: 192.168.1.102 (192.168.1.102), Dst: 157.56.195.250 (157.56.195.250)
Transmission Control Protocol, Src Port: 48412 (48412), Dst Port: imaps (993), Seq: 439, Ack: 2738, Len: 53
Secure Sockets Layer

No.     Time        Source                Destination           Protocol Length Info
     65 12.131055   192.168.1.102         184.173.179.40        TCP      95     [TCP segment of a reassembled PDU]

Frame 65: 95 bytes on wire (760 bits), 95 bytes captured (760 bits)
Ethernet II, Src: aa:aa:03:00:00:00 (aa:aa:03:00:00:00), Dst: 1b:24:63:41:00:59 (1b:24:63:41:00:59)
Internet Protocol Version 4, Src: 192.168.1.102 (192.168.1.102), Dst: 184.173.179.40 (184.173.179.40)
Transmission Control Protocol, Src Port: 57935 (57935), Dst Port: xmpp-client (5222), Seq: 1, Ack: 1, Len: 29

No.     Time        Source                Destination           Protocol Length Info
     66 12.239100   157.56.195.250        192.168.1.102         TLSv1    199    Application Data

Frame 66: 199 bytes on wire (1592 bits), 199 bytes captured (1592 bits)
Ethernet II, Src: FonTechn_a5:e9:80 (00:18:84:a5:e9:80), Dst: SamsungE_24:63:41 (cc:05:1b:24:63:41)
Internet Protocol Version 4, Src: 157.56.195.250 (157.56.195.250), Dst: 192.168.1.102 (192.168.1.102)
Transmission Control Protocol, Src Port: imaps (993), Dst Port: 48412 (48412), Seq: 2738, Ack: 492, Len: 133
Secure Sockets Layer

No.     Time        Source                Destination           Protocol Length Info
     67 12.240657   192.168.1.102         157.56.195.250        TCP      66     48412 > imaps [ACK] Seq=492 Ack=2871 Win=14512 Len=0 TSval=24181 TSecr=86770583

Frame 67: 66 bytes on wire (528 bits), 66 bytes captured (528 bits)
Ethernet II, Src: aa:aa:03:00:00:00 (aa:aa:03:00:00:00), Dst: 1b:24:63:41:00:3c (1b:24:63:41:00:3c)
Internet Protocol Version 4, Src: 192.168.1.102 (192.168.1.102), Dst: 157.56.195.250 (157.56.195.250)
Transmission Control Protocol, Src Port: 48412 (48412), Dst Port: imaps (993), Seq: 492, Ack: 2871, Len: 0

No.     Time        Source                Destination           Protocol Length Info
     68 12.342260   184.173.179.40        192.168.1.102         TCP      54     xmpp-client > 57935 [RST] Seq=1 Win=0 Len=0

