No.     Time        Source                Destination           Protocol Length Info
      1 0.000000    37.179.96.70          173.194.70.84         TLSv1    95     Encrypted Alert

Frame 1: 95 bytes on wire (760 bits), 95 bytes captured (760 bits)
Linux cooked capture
Internet Protocol Version 4, Src: 37.179.96.70 (37.179.96.70), Dst: 173.194.70.84 (173.194.70.84)
Transmission Control Protocol, Src Port: 49112 (49112), Dst Port: https (443), Seq: 1, Ack: 1, Len: 27
Secure Sockets Layer

No.     Time        Source                Destination           Protocol Length Info
      2 0.012425    173.194.70.84         37.179.96.70          TCP      68     https > 49112 [FIN, ACK] Seq=1 Ack=28 Win=670 Len=0 TSval=955528959 TSecr=308367

Frame 2: 68 bytes on wire (544 bits), 68 bytes captured (544 bits)
Linux cooked capture
Internet Protocol Version 4, Src: 173.194.70.84 (173.194.70.84), Dst: 37.179.96.70 (37.179.96.70)
Transmission Control Protocol, Src Port: https (443), Dst Port: 49112 (49112), Seq: 1, Ack: 28, Len: 0

No.     Time        Source                Destination           Protocol Length Info
      3 0.012683    37.179.96.70          173.194.70.84         TCP      68     49112 > https [ACK] Seq=29 Ack=2 Win=3906 Len=0 TSval=308402 TSecr=955528959

Frame 3: 68 bytes on wire (544 bits), 68 bytes captured (544 bits)
Linux cooked capture
Internet Protocol Version 4, Src: 37.179.96.70 (37.179.96.70), Dst: 173.194.70.84 (173.194.70.84)
Transmission Control Protocol, Src Port: 49112 (49112), Dst Port: https (443), Seq: 29, Ack: 2, Len: 0

No.     Time        Source                Destination           Protocol Length Info
      4 0.012753    173.194.70.84         37.179.96.70          TCP      68     https > 49112 [ACK] Seq=2 Ack=29 Win=670 Len=0 TSval=955528968 TSecr=308371

Frame 4: 68 bytes on wire (544 bits), 68 bytes captured (544 bits)
Linux cooked capture
Internet Protocol Version 4, Src: 173.194.70.84 (173.194.70.84), Dst: 37.179.96.70 (37.179.96.70)
Transmission Control Protocol, Src Port: https (443), Dst Port: 49112 (49112), Seq: 2, Ack: 29, Len: 0

No.     Time        Source                Destination           Protocol Length Info
      5 0.082428    173.194.70.84         37.179.96.70          TCP      80     [TCP Dup ACK 4#1] https > 49112 [ACK] Seq=2 Ack=29 Win=670 Len=0 TSval=955529049 TSecr=308401 SLE=1 SRE=29

Frame 5: 80 bytes on wire (640 bits), 80 bytes captured (640 bits)
Linux cooked capture
Internet Protocol Version 4, Src: 173.194.70.84 (173.194.70.84), Dst: 37.179.96.70 (37.179.96.70)
Transmission Control Protocol, Src Port: https (443), Dst Port: 49112 (49112), Seq: 2, Ack: 29, Len: 0

No.     Time        Source                Destination           Protocol Length Info
      6 0.152661    31.13.86.65           37.179.96.70          TLSv1    883    Application Data

Frame 6: 883 bytes on wire (7064 bits), 883 bytes captured (7064 bits)
Linux cooked capture
Internet Protocol Version 4, Src: 31.13.86.65 (31.13.86.65), Dst: 37.179.96.70 (37.179.96.70)
Transmission Control Protocol, Src Port: https (443), Dst Port: 36008 (36008), Seq: 1, Ack: 1, Len: 815
Secure Sockets Layer

No.     Time        Source                Destination           Protocol Length Info
      7 0.152883    37.179.96.70          31.13.86.65           TCP      68     36008 > https [ACK] Seq=1 Ack=816 Win=4555 Len=0 TSval=308416 TSecr=347142269

Frame 7: 68 bytes on wire (544 bits), 68 bytes captured (544 bits)
Linux cooked capture
Internet Protocol Version 4, Src: 37.179.96.70 (37.179.96.70), Dst: 31.13.86.65 (31.13.86.65)
Transmission Control Protocol, Src Port: 36008 (36008), Dst Port: https (443), Seq: 1, Ack: 816, Len: 0

No.     Time        Source                Destination           Protocol Length Info
      8 5.474653    37.179.96.70          157.56.195.250        TCP      68     54011 > imaps [FIN, ACK] Seq=1 Ack=1 Win=7151 Len=0 TSval=308949 TSecr=129805552

Frame 8: 68 bytes on wire (544 bits), 68 bytes captured (544 bits)
Linux cooked capture
Internet Protocol Version 4, Src: 37.179.96.70 (37.179.96.70), Dst: 157.56.195.250 (157.56.195.250)
Transmission Control Protocol, Src Port: 54011 (54011), Dst Port: imaps (993), Seq: 1, Ack: 1, Len: 0

No.     Time        Source                Destination           Protocol Length Info
      9 5.478748    37.179.96.70          188.125.68.129        TCP      68     49092 > imaps [RST, ACK] Seq=1 Ack=1 Win=36344 Len=0 TSval=308949 TSecr=1674844571

Frame 9: 68 bytes on wire (544 bits), 68 bytes captured (544 bits)
Linux cooked capture
Internet Protocol Version 4, Src: 37.179.96.70 (37.179.96.70), Dst: 188.125.68.129 (188.125.68.129)
Transmission Control Protocol, Src Port: 49092 (49092), Dst Port: imaps (993), Seq: 1, Ack: 1, Len: 0

No.     Time        Source                Destination           Protocol Length Info
     10 6.207858    157.56.195.250        37.179.96.70          TCP      68     imaps > 54011 [ACK] Seq=1 Ack=2 Win=254 Len=0 TSval=129841747 TSecr=308949

Frame 10: 68 bytes on wire (544 bits), 68 bytes captured (544 bits)
Linux cooked capture
Internet Protocol Version 4, Src: 157.56.195.250 (157.56.195.250), Dst: 37.179.96.70 (37.179.96.70)
Transmission Control Protocol, Src Port: imaps (993), Dst Port: 54011 (54011), Seq: 1, Ack: 2, Len: 0

No.     Time        Source                Destination           Protocol Length Info
     11 6.208191    157.56.195.250        37.179.96.70          TCP      68     imaps > 54011 [FIN, ACK] Seq=1 Ack=2 Win=254 Len=0 TSval=129841747 TSecr=308949

Frame 11: 68 bytes on wire (544 bits), 68 bytes captured (544 bits)
Linux cooked capture
Internet Protocol Version 4, Src: 157.56.195.250 (157.56.195.250), Dst: 37.179.96.70 (37.179.96.70)
Transmission Control Protocol, Src Port: imaps (993), Dst Port: 54011 (54011), Seq: 1, Ack: 2, Len: 0

No.     Time        Source                Destination           Protocol Length Info
     12 6.208316    37.179.96.70          157.56.195.250        TCP      68     54011 > imaps [ACK] Seq=2 Ack=2 Win=7151 Len=0 TSval=309022 TSecr=129841747

Frame 12: 68 bytes on wire (544 bits), 68 bytes captured (544 bits)
Linux cooked capture
Internet Protocol Version 4, Src: 37.179.96.70 (37.179.96.70), Dst: 157.56.195.250 (157.56.195.250)
Transmission Control Protocol, Src Port: 54011 (54011), Dst Port: imaps (993), Seq: 2, Ack: 2, Len: 0

No.     Time        Source                Destination           Protocol Length Info
     13 6.208525    157.56.195.250        37.179.96.70          TCP      68     imaps > 54011 [FIN, ACK] Seq=1 Ack=2 Win=254 Len=0 TSval=129841793 TSecr=308949

Frame 13: 68 bytes on wire (544 bits), 68 bytes captured (544 bits)
Linux cooked capture
Internet Protocol Version 4, Src: 157.56.195.250 (157.56.195.250), Dst: 37.179.96.70 (37.179.96.70)
Transmission Control Protocol, Src Port: imaps (993), Dst Port: 54011 (54011), Seq: 1, Ack: 2, Len: 0

No.     Time        Source                Destination           Protocol Length Info
     14 6.208658    37.179.96.70          157.56.195.250        TCP      68     [TCP Dup ACK 12#1] 54011 > imaps [ACK] Seq=2 Ack=2 Win=7151 Len=0 TSval=309022 TSecr=129841747

Frame 14: 68 bytes on wire (544 bits), 68 bytes captured (544 bits)
Linux cooked capture
Internet Protocol Version 4, Src: 37.179.96.70 (37.179.96.70), Dst: 157.56.195.250 (157.56.195.250)
Transmission Control Protocol, Src Port: 54011 (54011), Dst Port: imaps (993), Seq: 2, Ack: 2, Len: 0

No.     Time        Source                Destination           Protocol Length Info
     15 6.408230    157.56.195.250        37.179.96.70          TCP      56     imaps > 54011 [RST, ACK] Seq=2 Ack=2 Win=0 Len=0

Frame 15: 56 bytes on wire (448 bits), 56 bytes captured (448 bits)
Linux cooked capture
Internet Protocol Version 4, Src: 157.56.195.250 (157.56.195.250), Dst: 37.179.96.70 (37.179.96.70)
Transmission Control Protocol, Src Port: imaps (993), Dst Port: 54011 (54011), Seq: 2, Ack: 2, Len: 0

No.     Time        Source                Destination           Protocol Length Info
     16 8.028688    37.179.96.70          50.22.225.73          TCP      97     [TCP segment of a reassembled PDU]

Frame 16: 97 bytes on wire (776 bits), 97 bytes captured (776 bits)
Linux cooked capture
Internet Protocol Version 4, Src: 37.179.96.70 (37.179.96.70), Dst: 50.22.225.73 (50.22.225.73)
Transmission Control Protocol, Src Port: 37280 (37280), Dst Port: xmpp-client (5222), Seq: 1, Ack: 1, Len: 29

No.     Time        Source                Destination           Protocol Length Info
     17 8.277663    50.22.225.73          37.179.96.70          TCP      68     xmpp-client > 37280 [ACK] Seq=1 Ack=30 Win=512 Len=0 TSval=3510220210 TSecr=309204

Frame 17: 68 bytes on wire (544 bits), 68 bytes captured (544 bits)
Linux cooked capture
Internet Protocol Version 4, Src: 50.22.225.73 (50.22.225.73), Dst: 37.179.96.70 (37.179.96.70)
Transmission Control Protocol, Src Port: xmpp-client (5222), Dst Port: 37280 (37280), Seq: 1, Ack: 30, Len: 0

No.     Time        Source                Destination           Protocol Length Info
     18 8.278031    37.179.96.70          50.22.225.73          TCP      109    [TCP segment of a reassembled PDU]

Frame 18: 109 bytes on wire (872 bits), 109 bytes captured (872 bits)
Linux cooked capture
Internet Protocol Version 4, Src: 37.179.96.70 (37.179.96.70), Dst: 50.22.225.73 (50.22.225.73)
Transmission Control Protocol, Src Port: 37280 (37280), Dst Port: xmpp-client (5222), Seq: 30, Ack: 1, Len: 41

No.     Time        Source                Destination           Protocol Length Info
     19 8.407658    173.194.35.160        37.179.96.70          TCP      68     https > 52891 [FIN, ACK] Seq=1 Ack=1 Win=670 Len=0 TSval=1661028660 TSecr=297628

Frame 19: 68 bytes on wire (544 bits), 68 bytes captured (544 bits)
Linux cooked capture
Internet Protocol Version 4, Src: 173.194.35.160 (173.194.35.160), Dst: 37.179.96.70 (37.179.96.70)
Transmission Control Protocol, Src Port: https (443), Dst Port: 52891 (52891), Seq: 1, Ack: 1, Len: 0

No.     Time        Source                Destination           Protocol Length Info
     20 8.443090    37.179.96.70          173.194.35.160        TCP      68     52891 > https [ACK] Seq=1 Ack=2 Win=10396 Len=0 TSval=309246 TSecr=1661028660

Frame 20: 68 bytes on wire (544 bits), 68 bytes captured (544 bits)
Linux cooked capture
Internet Protocol Version 4, Src: 37.179.96.70 (37.179.96.70), Dst: 173.194.35.160 (173.194.35.160)
Transmission Control Protocol, Src Port: 52891 (52891), Dst Port: https (443), Seq: 1, Ack: 2, Len: 0

No.     Time        Source                Destination           Protocol Length Info
     21 8.577678    50.22.225.73          37.179.96.70          TCP      115    [TCP segment of a reassembled PDU]

Frame 21: 115 bytes on wire (920 bits), 115 bytes captured (920 bits)
Linux cooked capture
Internet Protocol Version 4, Src: 50.22.225.73 (50.22.225.73), Dst: 37.179.96.70 (37.179.96.70)
Transmission Control Protocol, Src Port: xmpp-client (5222), Dst Port: 37280 (37280), Seq: 1, Ack: 71, Len: 47

No.     Time        Source                Destination           Protocol Length Info
     22 8.578036    37.179.96.70          50.22.225.73          TCP      68     37280 > xmpp-client [ACK] Seq=71 Ack=48 Win=10598 Len=0 TSval=309259 TSecr=3510220511

Frame 22: 68 bytes on wire (544 bits), 68 bytes captured (544 bits)
Linux cooked capture
Internet Protocol Version 4, Src: 37.179.96.70 (37.179.96.70), Dst: 50.22.225.73 (50.22.225.73)
Transmission Control Protocol, Src Port: 37280 (37280), Dst Port: xmpp-client (5222), Seq: 71, Ack: 48, Len: 0

No.     Time        Source                Destination           Protocol Length Info
     23 10.772545   37.179.96.70          50.22.225.73          TCP      80     [TCP segment of a reassembled PDU]

Frame 23: 80 bytes on wire (640 bits), 80 bytes captured (640 bits)
Linux cooked capture
Internet Protocol Version 4, Src: 37.179.96.70 (37.179.96.70), Dst: 50.22.225.73 (50.22.225.73)
Transmission Control Protocol, Src Port: 37280 (37280), Dst Port: xmpp-client (5222), Seq: 71, Ack: 48, Len: 12

No.     Time        Source                Destination           Protocol Length Info
     24 11.008028   50.22.225.73          37.179.96.70          TCP      95     [TCP segment of a reassembled PDU]

Frame 24: 95 bytes on wire (760 bits), 95 bytes captured (760 bits)
Linux cooked capture
Internet Protocol Version 4, Src: 50.22.225.73 (50.22.225.73), Dst: 37.179.96.70 (37.179.96.70)
Transmission Control Protocol, Src Port: xmpp-client (5222), Dst Port: 37280 (37280), Seq: 48, Ack: 83, Len: 27

No.     Time        Source                Destination           Protocol Length Info
     25 11.008965   37.179.96.70          50.22.225.73          TCP      94     [TCP segment of a reassembled PDU]

Frame 25: 94 bytes on wire (752 bits), 94 bytes captured (752 bits)
Linux cooked capture
Internet Protocol Version 4, Src: 37.179.96.70 (37.179.96.70), Dst: 50.22.225.73 (50.22.225.73)
Transmission Control Protocol, Src Port: 37280 (37280), Dst Port: xmpp-client (5222), Seq: 83, Ack: 75, Len: 26

No.     Time        Source                Destination           Protocol Length Info
     26 11.277656   50.22.225.73          37.179.96.70          TCP      87     [TCP segment of a reassembled PDU]

Frame 26: 87 bytes on wire (696 bits), 87 bytes captured (696 bits)
Linux cooked capture
Internet Protocol Version 4, Src: 50.22.225.73 (50.22.225.73), Dst: 37.179.96.70 (37.179.96.70)
Transmission Control Protocol, Src Port: xmpp-client (5222), Dst Port: 37280 (37280), Seq: 75, Ack: 109, Len: 19

No.     Time        Source                Destination           Protocol Length Info
     27 11.313101   37.179.96.70          50.22.225.73          TCP      68     37280 > xmpp-client [ACK] Seq=109 Ack=94 Win=10598 Len=0 TSval=309533 TSecr=3510223210

Frame 27: 68 bytes on wire (544 bits), 68 bytes captured (544 bits)
Linux cooked capture
Internet Protocol Version 4, Src: 37.179.96.70 (37.179.96.70), Dst: 50.22.225.73 (50.22.225.73)
Transmission Control Protocol, Src Port: 37280 (37280), Dst Port: xmpp-client (5222), Seq: 109, Ack: 94, Len: 0

No.     Time        Source                Destination           Protocol Length Info
     28 13.944558   37.179.96.70          50.22.225.73          TCP      133    [TCP segment of a reassembled PDU]

Frame 28: 133 bytes on wire (1064 bits), 133 bytes captured (1064 bits)
Linux cooked capture
Internet Protocol Version 4, Src: 37.179.96.70 (37.179.96.70), Dst: 50.22.225.73 (50.22.225.73)
Transmission Control Protocol, Src Port: 37280 (37280), Dst Port: xmpp-client (5222), Seq: 109, Ack: 94, Len: 65

No.     Time        Source                Destination           Protocol Length Info
     29 14.197673   50.22.225.73          37.179.96.70          TCP      113    [TCP segment of a reassembled PDU]

Frame 29: 113 bytes on wire (904 bits), 113 bytes captured (904 bits)
Linux cooked capture
Internet Protocol Version 4, Src: 50.22.225.73 (50.22.225.73), Dst: 37.179.96.70 (37.179.96.70)
Transmission Control Protocol, Src Port: xmpp-client (5222), Dst Port: 37280 (37280), Seq: 94, Ack: 174, Len: 45

No.     Time        Source                Destination           Protocol Length Info
     30 14.200033   37.179.96.70          50.22.225.73          TCP      68     37280 > xmpp-client [ACK] Seq=174 Ack=139 Win=10598 Len=0 TSval=309821 TSecr=3510226129

Frame 30: 68 bytes on wire (544 bits), 68 bytes captured (544 bits)
Linux cooked capture
Internet Protocol Version 4, Src: 37.179.96.70 (37.179.96.70), Dst: 50.22.225.73 (50.22.225.73)
Transmission Control Protocol, Src Port: 37280 (37280), Dst Port: xmpp-client (5222), Seq: 174, Ack: 139, Len: 0

No.     Time        Source                Destination           Protocol Length Info
     31 17.894000   37.179.96.70          50.22.225.73          TCP      97     [TCP segment of a reassembled PDU]

Frame 31: 97 bytes on wire (776 bits), 97 bytes captured (776 bits)
Linux cooked capture
Internet Protocol Version 4, Src: 37.179.96.70 (37.179.96.70), Dst: 50.22.225.73 (50.22.225.73)
Transmission Control Protocol, Src Port: 37280 (37280), Dst Port: xmpp-client (5222), Seq: 174, Ack: 139, Len: 29

No.     Time        Source                Destination           Protocol Length Info
     32 18.618031   37.179.96.70          83.224.70.77          DNS      77     Standard query 0x9589  A csi.gstatic.com

Frame 32: 77 bytes on wire (616 bits), 77 bytes captured (616 bits)
Linux cooked capture
Internet Protocol Version 4, Src: 37.179.96.70 (37.179.96.70), Dst: 83.224.70.77 (83.224.70.77)
User Datagram Protocol, Src Port: 39008 (39008), Dst Port: domain (53)
Domain Name System (query)

No.     Time        Source                Destination           Protocol Length Info
     33 19.996783   37.179.96.70          83.224.70.77          DNS      81     Standard query 0x5ce7  A orcart.facebook.com

Frame 33: 81 bytes on wire (648 bits), 81 bytes captured (648 bits)
Linux cooked capture
Internet Protocol Version 4, Src: 37.179.96.70 (37.179.96.70), Dst: 83.224.70.77 (83.224.70.77)
User Datagram Protocol, Src Port: 24615 (24615), Dst Port: domain (53)
Domain Name System (query)

No.     Time        Source                Destination           Protocol Length Info
     34 21.983631   50.22.225.73          37.179.96.70          TCP      68     xmpp-client > 37280 [ACK] Seq=139 Ack=203 Win=512 Len=0 TSval=3510230119 TSecr=310191

Frame 34: 68 bytes on wire (544 bits), 68 bytes captured (544 bits)
Linux cooked capture
Internet Protocol Version 4, Src: 50.22.225.73 (50.22.225.73), Dst: 37.179.96.70 (37.179.96.70)
Transmission Control Protocol, Src Port: xmpp-client (5222), Dst Port: 37280 (37280), Seq: 139, Ack: 203, Len: 0

No.     Time        Source                Destination           Protocol Length Info
     35 21.983918   83.224.70.77          37.179.96.70          DNS      93     Standard query response 0x9589  A 74.125.224.143

Frame 35: 93 bytes on wire (744 bits), 93 bytes captured (744 bits)
Linux cooked capture
Internet Protocol Version 4, Src: 83.224.70.77 (83.224.70.77), Dst: 37.179.96.70 (37.179.96.70)
User Datagram Protocol, Src Port: domain (53), Dst Port: 39008 (39008)
Domain Name System (response)

No.     Time        Source                Destination           Protocol Length Info
     36 21.984210   83.224.70.77          37.179.96.70          DNS      120    Standard query response 0x5ce7  CNAME orcart.t.facebook.com A 173.252.103.16

Frame 36: 120 bytes on wire (960 bits), 120 bytes captured (960 bits)
Linux cooked capture
Internet Protocol Version 4, Src: 83.224.70.77 (83.224.70.77), Dst: 37.179.96.70 (37.179.96.70)
User Datagram Protocol, Src Port: domain (53), Dst Port: 24615 (24615)
Domain Name System (response)

No.     Time        Source                Destination           Protocol Length Info
     37 21.984443   37.179.96.70          50.22.225.73          TCP      109    [TCP segment of a reassembled PDU]

Frame 37: 109 bytes on wire (872 bits), 109 bytes captured (872 bits)
Linux cooked capture
Internet Protocol Version 4, Src: 37.179.96.70 (37.179.96.70), Dst: 50.22.225.73 (50.22.225.73)
Transmission Control Protocol, Src Port: 37280 (37280), Dst Port: xmpp-client (5222), Seq: 203, Ack: 139, Len: 41

No.     Time        Source                Destination           Protocol Length Info
     38 21.988123   37.179.96.70          74.125.224.143        TCP      76     58683 > http [SYN] Seq=0 Win=5240 Len=0 MSS=1310 SACK_PERM=1 TSval=310600 TSecr=0 WS=4

Frame 38: 76 bytes on wire (608 bits), 76 bytes captured (608 bits)
Linux cooked capture
Internet Protocol Version 4, Src: 37.179.96.70 (37.179.96.70), Dst: 74.125.224.143 (74.125.224.143)
Transmission Control Protocol, Src Port: 58683 (58683), Dst Port: http (80), Seq: 0, Len: 0

No.     Time        Source                Destination           Protocol Length Info
     39 22.017233   37.179.96.70          173.252.103.16        TCP      76     39984 > https [SYN] Seq=0 Win=5240 Len=0 MSS=1310 SACK_PERM=1 TSval=310603 TSecr=0 WS=4

Frame 39: 76 bytes on wire (608 bits), 76 bytes captured (608 bits)
Linux cooked capture
Internet Protocol Version 4, Src: 37.179.96.70 (37.179.96.70), Dst: 173.252.103.16 (173.252.103.16)
Transmission Control Protocol, Src Port: 39984 (39984), Dst Port: https (443), Seq: 0, Len: 0

No.     Time        Source                Destination           Protocol Length Info
     40 22.088280   37.179.96.70          74.125.224.143        TCP      76     52276 > http [SYN] Seq=0 Win=5240 Len=0 MSS=1310 SACK_PERM=1 TSval=310610 TSecr=0 WS=4

Frame 40: 76 bytes on wire (608 bits), 76 bytes captured (608 bits)
Linux cooked capture
Internet Protocol Version 4, Src: 37.179.96.70 (37.179.96.70), Dst: 74.125.224.143 (74.125.224.143)
Transmission Control Protocol, Src Port: 52276 (52276), Dst Port: http (80), Seq: 0, Len: 0

No.     Time        Source                Destination           Protocol Length Info
     41 22.193571   74.125.224.143        37.179.96.70          TCP      80     http > 58683 [SYN, ACK] Seq=0 Ack=1 Win=64251 Len=0 TSval=85398102 TSecr=310600 MSS=1400 WS=4 SACK_PERM=1

Frame 41: 80 bytes on wire (640 bits), 80 bytes captured (640 bits)
Linux cooked capture
Internet Protocol Version 4, Src: 74.125.224.143 (74.125.224.143), Dst: 37.179.96.70 (37.179.96.70)
Transmission Control Protocol, Src Port: http (80), Dst Port: 58683 (58683), Seq: 0, Ack: 1, Len: 0

No.     Time        Source                Destination           Protocol Length Info
     42 22.193866   37.179.96.70          74.125.224.143        TCP      68     58683 > http [ACK] Seq=1 Ack=1 Win=5240 Len=0 TSval=310621 TSecr=85398102

Frame 42: 68 bytes on wire (544 bits), 68 bytes captured (544 bits)
Linux cooked capture
Internet Protocol Version 4, Src: 37.179.96.70 (37.179.96.70), Dst: 74.125.224.143 (74.125.224.143)
Transmission Control Protocol, Src Port: 58683 (58683), Dst Port: http (80), Seq: 1, Ack: 1, Len: 0

No.     Time        Source                Destination           Protocol Length Info
     43 22.195803   37.179.96.70          74.125.224.143        HTTP     1177   GET /csi?v=3&s=gmob&action=&rt=crf.2154,cri.35190 HTTP/1.1 

Frame 43: 1177 bytes on wire (9416 bits), 1177 bytes captured (9416 bits)
Linux cooked capture
Internet Protocol Version 4, Src: 37.179.96.70 (37.179.96.70), Dst: 74.125.224.143 (74.125.224.143)
Transmission Control Protocol, Src Port: 58683 (58683), Dst Port: http (80), Seq: 1, Ack: 1, Len: 1109
Hypertext Transfer Protocol

No.     Time        Source                Destination           Protocol Length Info
     44 22.277486   74.125.224.143        37.179.96.70          TCP      80     http > 52276 [SYN, ACK] Seq=0 Ack=1 Win=64251 Len=0 TSval=85398110 TSecr=310610 MSS=1400 WS=4 SACK_PERM=1

Frame 44: 80 bytes on wire (640 bits), 80 bytes captured (640 bits)
Linux cooked capture
Internet Protocol Version 4, Src: 74.125.224.143 (74.125.224.143), Dst: 37.179.96.70 (37.179.96.70)
Transmission Control Protocol, Src Port: http (80), Dst Port: 52276 (52276), Seq: 0, Ack: 1, Len: 0

No.     Time        Source                Destination           Protocol Length Info
     45 22.277791   37.179.96.70          74.125.224.143        TCP      68     52276 > http [ACK] Seq=1 Ack=1 Win=5240 Len=0 TSval=310629 TSecr=85398110

Frame 45: 68 bytes on wire (544 bits), 68 bytes captured (544 bits)
Linux cooked capture
Internet Protocol Version 4, Src: 37.179.96.70 (37.179.96.70), Dst: 74.125.224.143 (74.125.224.143)
Transmission Control Protocol, Src Port: 52276 (52276), Dst Port: http (80), Seq: 1, Ack: 1, Len: 0

No.     Time        Source                Destination           Protocol Length Info
     46 22.322001   37.179.96.70          74.125.224.143        HTTP     1202   GET /csi?v=3&s=gmob&action=&rt=crf.1524,cri.36903 HTTP/1.1 

Frame 46: 1202 bytes on wire (9616 bits), 1202 bytes captured (9616 bits)
Linux cooked capture
Internet Protocol Version 4, Src: 37.179.96.70 (37.179.96.70), Dst: 74.125.224.143 (74.125.224.143)
Transmission Control Protocol, Src Port: 52276 (52276), Dst Port: http (80), Seq: 1, Ack: 1, Len: 1134
Hypertext Transfer Protocol

No.     Time        Source                Destination           Protocol Length Info
     47 22.323610   50.22.225.73          37.179.96.70          TCP      114    [TCP segment of a reassembled PDU]

Frame 47: 114 bytes on wire (912 bits), 114 bytes captured (912 bits)
Linux cooked capture
Internet Protocol Version 4, Src: 50.22.225.73 (50.22.225.73), Dst: 37.179.96.70 (37.179.96.70)
Transmission Control Protocol, Src Port: xmpp-client (5222), Dst Port: 37280 (37280), Seq: 139, Ack: 244, Len: 46

No.     Time        Source                Destination           Protocol Length Info
     48 22.323916   37.179.96.70          50.22.225.73          TCP      68     37280 > xmpp-client [ACK] Seq=244 Ack=185 Win=10598 Len=0 TSval=310634 TSecr=3510234250

Frame 48: 68 bytes on wire (544 bits), 68 bytes captured (544 bits)
Linux cooked capture
Internet Protocol Version 4, Src: 37.179.96.70 (37.179.96.70), Dst: 50.22.225.73 (50.22.225.73)
Transmission Control Protocol, Src Port: 37280 (37280), Dst Port: xmpp-client (5222), Seq: 244, Ack: 185, Len: 0

No.     Time        Source                Destination           Protocol Length Info
     49 22.343736   173.252.103.16        37.179.96.70          TCP      76     https > 39984 [SYN, ACK] Seq=0 Ack=1 Win=14480 Len=0 MSS=1400 SACK_PERM=1 TSval=1188386395 TSecr=310603 WS=256

Frame 49: 76 bytes on wire (608 bits), 76 bytes captured (608 bits)
Linux cooked capture
Internet Protocol Version 4, Src: 173.252.103.16 (173.252.103.16), Dst: 37.179.96.70 (37.179.96.70)
Transmission Control Protocol, Src Port: https (443), Dst Port: 39984 (39984), Seq: 0, Ack: 1, Len: 0

No.     Time        Source                Destination           Protocol Length Info
     50 22.343995   37.179.96.70          173.252.103.16        TCP      68     39984 > https [ACK] Seq=1 Ack=1 Win=5240 Len=0 TSval=310636 TSecr=1188386395

Frame 50: 68 bytes on wire (544 bits), 68 bytes captured (544 bits)
Linux cooked capture
Internet Protocol Version 4, Src: 37.179.96.70 (37.179.96.70), Dst: 173.252.103.16 (173.252.103.16)
Transmission Control Protocol, Src Port: 39984 (39984), Dst Port: https (443), Seq: 1, Ack: 1, Len: 0

No.     Time        Source                Destination           Protocol Length Info
     51 22.463940   37.179.96.70          173.252.103.16        TLSv1    182    Client Hello

Frame 51: 182 bytes on wire (1456 bits), 182 bytes captured (1456 bits)
Linux cooked capture
Internet Protocol Version 4, Src: 37.179.96.70 (37.179.96.70), Dst: 173.252.103.16 (173.252.103.16)
Transmission Control Protocol, Src Port: 39984 (39984), Dst Port: https (443), Seq: 1, Ack: 1, Len: 114
Secure Sockets Layer

No.     Time        Source                Destination           Protocol Length Info
     52 22.663911   37.179.96.70          83.224.70.77          DNS      89     Standard query 0x417f  A oauth.googleusercontent.com

Frame 52: 89 bytes on wire (712 bits), 89 bytes captured (712 bits)
Linux cooked capture
Internet Protocol Version 4, Src: 37.179.96.70 (37.179.96.70), Dst: 83.224.70.77 (83.224.70.77)
User Datagram Protocol, Src Port: 17719 (17719), Dst Port: domain (53)
Domain Name System (query)

No.     Time        Source                Destination           Protocol Length Info
     53 22.779086   37.179.96.70          83.224.70.77          DNS      78     Standard query 0x0eb1  A api.facebook.com

Frame 53: 78 bytes on wire (624 bits), 78 bytes captured (624 bits)
Linux cooked capture
Internet Protocol Version 4, Src: 37.179.96.70 (37.179.96.70), Dst: 83.224.70.77 (83.224.70.77)
User Datagram Protocol, Src Port: 4747 (4747), Dst Port: domain (53)
Domain Name System (query)

No.     Time        Source                Destination           Protocol Length Info
     54 22.823133   37.179.96.70          74.125.224.143        HTTP     1177   [TCP Retransmission] GET /csi?v=3&s=gmob&action=&rt=crf.2154,cri.35190 HTTP/1.1 

Frame 54: 1177 bytes on wire (9416 bits), 1177 bytes captured (9416 bits)
Linux cooked capture
Internet Protocol Version 4, Src: 37.179.96.70 (37.179.96.70), Dst: 74.125.224.143 (74.125.224.143)
Transmission Control Protocol, Src Port: 58683 (58683), Dst Port: http (80), Seq: 1, Ack: 1, Len: 1109
Hypertext Transfer Protocol

No.     Time        Source                Destination           Protocol Length Info
     55 22.883170   37.179.96.70          74.125.224.143        HTTP     1202   [TCP Retransmission] GET /csi?v=3&s=gmob&action=&rt=crf.1524,cri.36903 HTTP/1.1 

Frame 55: 1202 bytes on wire (9616 bits), 1202 bytes captured (9616 bits)
Linux cooked capture
Internet Protocol Version 4, Src: 37.179.96.70 (37.179.96.70), Dst: 74.125.224.143 (74.125.224.143)
Transmission Control Protocol, Src Port: 52276 (52276), Dst Port: http (80), Seq: 1, Ack: 1, Len: 1134
Hypertext Transfer Protocol

No.     Time        Source                Destination           Protocol Length Info
     56 22.923538   173.252.103.16        37.179.96.70          TCP      76     https > 39984 [SYN, ACK] Seq=0 Ack=1 Win=14480 Len=0 MSS=1400 SACK_PERM=1 TSval=1188386971 TSecr=310603 WS=256

Frame 56: 76 bytes on wire (608 bits), 76 bytes captured (608 bits)
Linux cooked capture
Internet Protocol Version 4, Src: 173.252.103.16 (173.252.103.16), Dst: 37.179.96.70 (37.179.96.70)
Transmission Control Protocol, Src Port: https (443), Dst Port: 39984 (39984), Seq: 0, Ack: 1, Len: 0

No.     Time        Source                Destination           Protocol Length Info
     57 22.923783   37.179.96.70          173.252.103.16        TCP      80     [TCP Dup ACK 51#1] 39984 > https [ACK] Seq=115 Ack=1 Win=5240 Len=0 TSval=310694 TSecr=1188386971 SLE=0 SRE=1

Frame 57: 80 bytes on wire (640 bits), 80 bytes captured (640 bits)
Linux cooked capture
Internet Protocol Version 4, Src: 37.179.96.70 (37.179.96.70), Dst: 173.252.103.16 (173.252.103.16)
Transmission Control Protocol, Src Port: 39984 (39984), Dst Port: https (443), Seq: 115, Ack: 1, Len: 0

No.     Time        Source                Destination           Protocol Length Info
     58 23.003578   74.125.224.143        37.179.96.70          TCP      68     http > 58683 [ACK] Seq=1 Ack=1110 Win=257004 Len=0 TSval=85398182 TSecr=310621

Frame 58: 68 bytes on wire (544 bits), 68 bytes captured (544 bits)
Linux cooked capture
Internet Protocol Version 4, Src: 74.125.224.143 (74.125.224.143), Dst: 37.179.96.70 (37.179.96.70)
Transmission Control Protocol, Src Port: http (80), Dst Port: 58683 (58683), Seq: 1, Ack: 1110, Len: 0

No.     Time        Source                Destination           Protocol Length Info
     59 23.353671   74.125.224.143        37.179.96.70          HTTP     443    HTTP/1.1 204 No Content 

Frame 59: 443 bytes on wire (3544 bits), 443 bytes captured (3544 bits)
Linux cooked capture
Internet Protocol Version 4, Src: 74.125.224.143 (74.125.224.143), Dst: 37.179.96.70 (37.179.96.70)
Transmission Control Protocol, Src Port: http (80), Dst Port: 58683 (58683), Seq: 1, Ack: 1110, Len: 375
Hypertext Transfer Protocol

No.     Time        Source                Destination           Protocol Length Info
     60 23.354010   37.179.96.70          74.125.224.143        TCP      68     58683 > http [ACK] Seq=1110 Ack=376 Win=7836 Len=0 TSval=310737 TSecr=85398217

Frame 60: 68 bytes on wire (544 bits), 68 bytes captured (544 bits)
Linux cooked capture
Internet Protocol Version 4, Src: 37.179.96.70 (37.179.96.70), Dst: 74.125.224.143 (74.125.224.143)
Transmission Control Protocol, Src Port: 58683 (58683), Dst Port: http (80), Seq: 1110, Ack: 376, Len: 0

No.     Time        Source                Destination           Protocol Length Info
     61 23.523628   173.252.103.16        37.179.96.70          TCP      76     https > 39984 [SYN, ACK] Seq=0 Ack=1 Win=14480 Len=0 MSS=1400 SACK_PERM=1 TSval=1188387573 TSecr=310603 WS=256

Frame 61: 76 bytes on wire (608 bits), 76 bytes captured (608 bits)
Linux cooked capture
Internet Protocol Version 4, Src: 173.252.103.16 (173.252.103.16), Dst: 37.179.96.70 (37.179.96.70)
Transmission Control Protocol, Src Port: https (443), Dst Port: 39984 (39984), Seq: 0, Ack: 1, Len: 0

No.     Time        Source                Destination           Protocol Length Info
     62 23.523861   37.179.96.70          173.252.103.16        TCP      80     [TCP Dup ACK 51#2] 39984 > https [ACK] Seq=115 Ack=1 Win=5240 Len=0 TSval=310754 TSecr=1188387573 SLE=0 SRE=1

Frame 62: 80 bytes on wire (640 bits), 80 bytes captured (640 bits)
Linux cooked capture
Internet Protocol Version 4, Src: 37.179.96.70 (37.179.96.70), Dst: 173.252.103.16 (173.252.103.16)
Transmission Control Protocol, Src Port: 39984 (39984), Dst Port: https (443), Seq: 115, Ack: 1, Len: 0

No.     Time        Source                Destination           Protocol Length Info
     63 23.683680   74.125.224.143        37.179.96.70          TCP      68     http > 52276 [ACK] Seq=1 Ack=1135 Win=257004 Len=0 TSval=85398250 TSecr=310633

Frame 63: 68 bytes on wire (544 bits), 68 bytes captured (544 bits)
Linux cooked capture
Internet Protocol Version 4, Src: 74.125.224.143 (74.125.224.143), Dst: 37.179.96.70 (37.179.96.70)
Transmission Control Protocol, Src Port: http (80), Dst Port: 52276 (52276), Seq: 1, Ack: 1135, Len: 0

No.     Time        Source                Destination           Protocol Length Info
     64 23.873620   74.125.224.143        37.179.96.70          HTTP     443    HTTP/1.1 204 No Content 

Frame 64: 443 bytes on wire (3544 bits), 443 bytes captured (3544 bits)
Linux cooked capture
Internet Protocol Version 4, Src: 74.125.224.143 (74.125.224.143), Dst: 37.179.96.70 (37.179.96.70)
Transmission Control Protocol, Src Port: http (80), Dst Port: 52276 (52276), Seq: 1, Ack: 1135, Len: 375
Hypertext Transfer Protocol

No.     Time        Source                Destination           Protocol Length Info
     65 23.874028   37.179.96.70          74.125.224.143        TCP      68     52276 > http [ACK] Seq=1135 Ack=376 Win=7836 Len=0 TSval=310789 TSecr=85398269

Frame 65: 68 bytes on wire (544 bits), 68 bytes captured (544 bits)
Linux cooked capture
Internet Protocol Version 4, Src: 37.179.96.70 (37.179.96.70), Dst: 74.125.224.143 (74.125.224.143)
Transmission Control Protocol, Src Port: 52276 (52276), Dst Port: http (80), Seq: 1135, Ack: 376, Len: 0

No.     Time        Source                Destination           Protocol Length Info
     66 23.874118   83.224.70.77          37.179.96.70          DNS      166    Standard query response 0x417f  CNAME googlehosted.l.googleusercontent.com A 173.194.35.170 A 173.194.35.171 A 173.194.35.172

Frame 66: 166 bytes on wire (1328 bits), 166 bytes captured (1328 bits)
Linux cooked capture
Internet Protocol Version 4, Src: 83.224.70.77 (83.224.70.77), Dst: 37.179.96.70 (37.179.96.70)
User Datagram Protocol, Src Port: domain (53), Dst Port: 17719 (17719)
Domain Name System (response)

No.     Time        Source                Destination           Protocol Length Info
     67 23.875776   37.179.96.70          173.194.35.170        TCP      76     42452 > https [SYN] Seq=0 Win=5240 Len=0 MSS=1310 SACK_PERM=1 TSval=310789 TSecr=0 WS=4

Frame 67: 76 bytes on wire (608 bits), 76 bytes captured (608 bits)
Linux cooked capture
Internet Protocol Version 4, Src: 37.179.96.70 (37.179.96.70), Dst: 173.194.35.170 (173.194.35.170)
Transmission Control Protocol, Src Port: 42452 (42452), Dst Port: https (443), Seq: 0, Len: 0

No.     Time        Source                Destination           Protocol Length Info
     68 23.913540   83.224.70.77          37.179.96.70          DNS      118    Standard query response 0x0eb1  CNAME star.c10r.facebook.com A 31.13.86.65

Frame 68: 118 bytes on wire (944 bits), 118 bytes captured (944 bits)
Linux cooked capture
Internet Protocol Version 4, Src: 83.224.70.77 (83.224.70.77), Dst: 37.179.96.70 (37.179.96.70)
User Datagram Protocol, Src Port: domain (53), Dst Port: 4747 (4747)
Domain Name System (response)

No.     Time        Source                Destination           Protocol Length Info
     69 23.935536   37.179.96.70          31.13.86.65           TCP      76     45159 > https [SYN] Seq=0 Win=5240 Len=0 MSS=1310 SACK_PERM=1 TSval=310795 TSecr=0 WS=4

Frame 69: 76 bytes on wire (608 bits), 76 bytes captured (608 bits)
Linux cooked capture
Internet Protocol Version 4, Src: 37.179.96.70 (37.179.96.70), Dst: 31.13.86.65 (31.13.86.65)
Transmission Control Protocol, Src Port: 45159 (45159), Dst Port: https (443), Seq: 0, Len: 0

No.     Time        Source                Destination           Protocol Length Info
     70 23.943583   173.252.103.16        37.179.96.70          TCP      68     https > 39984 [ACK] Seq=1 Ack=115 Win=14592 Len=0 TSval=1188387995 TSecr=310648

Frame 70: 68 bytes on wire (544 bits), 68 bytes captured (544 bits)
Linux cooked capture
Internet Protocol Version 4, Src: 173.252.103.16 (173.252.103.16), Dst: 37.179.96.70 (37.179.96.70)
Transmission Control Protocol, Src Port: https (443), Dst Port: 39984 (39984), Seq: 1, Ack: 115, Len: 0

No.     Time        Source                Destination           Protocol Length Info
     71 23.953723   173.252.103.16        37.179.96.70          TLSv1    1366   Server Hello

Frame 71: 1366 bytes on wire (10928 bits), 1366 bytes captured (10928 bits)
Linux cooked capture
Internet Protocol Version 4, Src: 173.252.103.16 (173.252.103.16), Dst: 37.179.96.70 (37.179.96.70)
Transmission Control Protocol, Src Port: https (443), Dst Port: 39984 (39984), Seq: 1, Ack: 115, Len: 1298
Secure Sockets Layer

No.     Time        Source                Destination           Protocol Length Info
     72 23.953928   37.179.96.70          173.252.103.16        TCP      68     39984 > https [ACK] Seq=115 Ack=1299 Win=7836 Len=0 TSval=310797 TSecr=1188387995

Frame 72: 68 bytes on wire (544 bits), 68 bytes captured (544 bits)
Linux cooked capture
Internet Protocol Version 4, Src: 37.179.96.70 (37.179.96.70), Dst: 173.252.103.16 (173.252.103.16)
Transmission Control Protocol, Src Port: 39984 (39984), Dst Port: https (443), Seq: 115, Ack: 1299, Len: 0

No.     Time        Source                Destination           Protocol Length Info
     73 23.993731   173.252.103.16        37.179.96.70          TCP      1366   [TCP segment of a reassembled PDU]

Frame 73: 1366 bytes on wire (10928 bits), 1366 bytes captured (10928 bits)
Linux cooked capture
Internet Protocol Version 4, Src: 173.252.103.16 (173.252.103.16), Dst: 37.179.96.70 (37.179.96.70)
Transmission Control Protocol, Src Port: https (443), Dst Port: 39984 (39984), Seq: 1299, Ack: 115, Len: 1298

No.     Time        Source                Destination           Protocol Length Info
     74 23.993945   37.179.96.70          173.252.103.16        TCP      68     39984 > https [ACK] Seq=115 Ack=2597 Win=10432 Len=0 TSval=310801 TSecr=1188387995

Frame 74: 68 bytes on wire (544 bits), 68 bytes captured (544 bits)
Linux cooked capture
Internet Protocol Version 4, Src: 37.179.96.70 (37.179.96.70), Dst: 173.252.103.16 (173.252.103.16)
Transmission Control Protocol, Src Port: 39984 (39984), Dst Port: https (443), Seq: 115, Ack: 2597, Len: 0

No.     Time        Source                Destination           Protocol Length Info
     75 24.043565   173.252.103.16        37.179.96.70          TLSv1    564    Certificate, Server Hello Done

Frame 75: 564 bytes on wire (4512 bits), 564 bytes captured (4512 bits)
Linux cooked capture
Internet Protocol Version 4, Src: 173.252.103.16 (173.252.103.16), Dst: 37.179.96.70 (37.179.96.70)
Transmission Control Protocol, Src Port: https (443), Dst Port: 39984 (39984), Seq: 2597, Ack: 115, Len: 496
[3 Reassembled TCP Segments (3030 bytes): #71(1236), #73(1298), #75(496)]
Secure Sockets Layer

No.     Time        Source                Destination           Protocol Length Info
