No.     Time        Source                Destination           Protocol Length Info
      1 0.000000    10.165.76.22          173.192.222.186       TCP      97     [TCP segment of a reassembled PDU]

Frame 1: 97 bytes on wire (776 bits), 97 bytes captured (776 bits)
Linux cooked capture
Internet Protocol Version 4, Src: 10.165.76.22 (10.165.76.22), Dst: 173.192.222.186 (173.192.222.186)
Transmission Control Protocol, Src Port: 57261 (57261), Dst Port: xmpp-client (5222), Seq: 1, Ack: 1, Len: 29

No.     Time        Source                Destination           Protocol Length Info
      2 0.489679    173.192.222.186       10.165.76.22          TCP      68     xmpp-client > 57261 [ACK] Seq=1 Ack=30 Win=512 Len=0 TSval=4247029829 TSecr=58863

Frame 2: 68 bytes on wire (544 bits), 68 bytes captured (544 bits)
Linux cooked capture
Internet Protocol Version 4, Src: 173.192.222.186 (173.192.222.186), Dst: 10.165.76.22 (10.165.76.22)
Transmission Control Protocol, Src Port: xmpp-client (5222), Dst Port: 57261 (57261), Seq: 1, Ack: 30, Len: 0

No.     Time        Source                Destination           Protocol Length Info
      3 0.490470    10.165.76.22          173.192.222.186       TCP      108    [TCP segment of a reassembled PDU]

Frame 3: 108 bytes on wire (864 bits), 108 bytes captured (864 bits)
Linux cooked capture
Internet Protocol Version 4, Src: 10.165.76.22 (10.165.76.22), Dst: 173.192.222.186 (173.192.222.186)
Transmission Control Protocol, Src Port: 57261 (57261), Dst Port: xmpp-client (5222), Seq: 30, Ack: 1, Len: 40

No.     Time        Source                Destination           Protocol Length Info
      4 1.049495    173.192.222.186       10.165.76.22          TCP      111    [TCP segment of a reassembled PDU]

Frame 4: 111 bytes on wire (888 bits), 111 bytes captured (888 bits)
Linux cooked capture
Internet Protocol Version 4, Src: 173.192.222.186 (173.192.222.186), Dst: 10.165.76.22 (10.165.76.22)
Transmission Control Protocol, Src Port: xmpp-client (5222), Dst Port: 57261 (57261), Seq: 1, Ack: 70, Len: 43

No.     Time        Source                Destination           Protocol Length Info
      5 1.049977    10.165.76.22          173.192.222.186       TCP      68     57261 > xmpp-client [ACK] Seq=70 Ack=44 Win=2227 Len=0 TSval=58968 TSecr=4247030367

Frame 5: 68 bytes on wire (544 bits), 68 bytes captured (544 bits)
Linux cooked capture
Internet Protocol Version 4, Src: 10.165.76.22 (10.165.76.22), Dst: 173.192.222.186 (173.192.222.186)
Transmission Control Protocol, Src Port: 57261 (57261), Dst Port: xmpp-client (5222), Seq: 70, Ack: 44, Len: 0

No.     Time        Source                Destination           Protocol Length Info
      6 2.897902    10.165.76.22          173.192.222.186       TCP      80     [TCP segment of a reassembled PDU]

Frame 6: 80 bytes on wire (640 bits), 80 bytes captured (640 bits)
Linux cooked capture
Internet Protocol Version 4, Src: 10.165.76.22 (10.165.76.22), Dst: 173.192.222.186 (173.192.222.186)
Transmission Control Protocol, Src Port: 57261 (57261), Dst Port: xmpp-client (5222), Seq: 70, Ack: 44, Len: 12

No.     Time        Source                Destination           Protocol Length Info
      7 3.856532    10.165.76.22          173.192.222.186       TCP      80     [TCP Retransmission] [TCP segment of a reassembled PDU]

Frame 7: 80 bytes on wire (640 bits), 80 bytes captured (640 bits)
Linux cooked capture
Internet Protocol Version 4, Src: 10.165.76.22 (10.165.76.22), Dst: 173.192.222.186 (173.192.222.186)
Transmission Control Protocol, Src Port: 57261 (57261), Dst Port: xmpp-client (5222), Seq: 70, Ack: 44, Len: 12

No.     Time        Source                Destination           Protocol Length Info
      8 5.128160    173.192.222.186       10.165.76.22          TCP      95     [TCP segment of a reassembled PDU]

Frame 8: 95 bytes on wire (760 bits), 95 bytes captured (760 bits)
Linux cooked capture
Internet Protocol Version 4, Src: 173.192.222.186 (173.192.222.186), Dst: 10.165.76.22 (10.165.76.22)
Transmission Control Protocol, Src Port: xmpp-client (5222), Dst Port: 57261 (57261), Seq: 44, Ack: 82, Len: 27

No.     Time        Source                Destination           Protocol Length Info
      9 5.128430    173.192.222.186       10.165.76.22          TCP      95     [TCP Retransmission] [TCP segment of a reassembled PDU]

Frame 9: 95 bytes on wire (760 bits), 95 bytes captured (760 bits)
Linux cooked capture
Internet Protocol Version 4, Src: 173.192.222.186 (173.192.222.186), Dst: 10.165.76.22 (10.165.76.22)
Transmission Control Protocol, Src Port: xmpp-client (5222), Dst Port: 57261 (57261), Seq: 44, Ack: 82, Len: 27

No.     Time        Source                Destination           Protocol Length Info
     10 5.128655    10.165.76.22          173.192.222.186       TCP      93     [TCP segment of a reassembled PDU]

Frame 10: 93 bytes on wire (744 bits), 93 bytes captured (744 bits)
Linux cooked capture
Internet Protocol Version 4, Src: 10.165.76.22 (10.165.76.22), Dst: 173.192.222.186 (173.192.222.186)
Transmission Control Protocol, Src Port: 57261 (57261), Dst Port: xmpp-client (5222), Seq: 82, Ack: 71, Len: 25

No.     Time        Source                Destination           Protocol Length Info
     11 5.131404    10.165.76.22          173.192.222.186       TCP      80     [TCP Dup ACK 10#1] 57261 > xmpp-client [ACK] Seq=107 Ack=71 Win=2227 Len=0 TSval=59376 TSecr=4247033492 SLE=44 SRE=71

Frame 11: 80 bytes on wire (640 bits), 80 bytes captured (640 bits)
Linux cooked capture
Internet Protocol Version 4, Src: 10.165.76.22 (10.165.76.22), Dst: 173.192.222.186 (173.192.222.186)
Transmission Control Protocol, Src Port: 57261 (57261), Dst Port: xmpp-client (5222), Seq: 107, Ack: 71, Len: 0

No.     Time        Source                Destination           Protocol Length Info
     12 5.398092    173.192.222.186       10.165.76.22          TCP      68     xmpp-client > 57261 [ACK] Seq=71 Ack=107 Win=512 Len=0 TSval=4247034824 TSecr=59376

Frame 12: 68 bytes on wire (544 bits), 68 bytes captured (544 bits)
Linux cooked capture
Internet Protocol Version 4, Src: 173.192.222.186 (173.192.222.186), Dst: 10.165.76.22 (10.165.76.22)
Transmission Control Protocol, Src Port: xmpp-client (5222), Dst Port: 57261 (57261), Seq: 71, Ack: 107, Len: 0

No.     Time        Source                Destination           Protocol Length Info
     13 5.398397    173.192.222.186       10.165.76.22          TCP      86     [TCP segment of a reassembled PDU]

Frame 13: 86 bytes on wire (688 bits), 86 bytes captured (688 bits)
Linux cooked capture
Internet Protocol Version 4, Src: 173.192.222.186 (173.192.222.186), Dst: 10.165.76.22 (10.165.76.22)
Transmission Control Protocol, Src Port: xmpp-client (5222), Dst Port: 57261 (57261), Seq: 71, Ack: 107, Len: 18

No.     Time        Source                Destination           Protocol Length Info
     14 5.398782    10.165.76.22          173.192.222.186       TCP      68     57261 > xmpp-client [ACK] Seq=107 Ack=89 Win=2227 Len=0 TSval=59403 TSecr=4247034825

Frame 14: 68 bytes on wire (544 bits), 68 bytes captured (544 bits)
Linux cooked capture
Internet Protocol Version 4, Src: 10.165.76.22 (10.165.76.22), Dst: 173.192.222.186 (173.192.222.186)
Transmission Control Protocol, Src Port: 57261 (57261), Dst Port: xmpp-client (5222), Seq: 107, Ack: 89, Len: 0

No.     Time        Source                Destination           Protocol Length Info
     15 5.738430    10.165.76.22          173.192.222.186       TCP      129    [TCP segment of a reassembled PDU]

Frame 15: 129 bytes on wire (1032 bits), 129 bytes captured (1032 bits)
Linux cooked capture
Internet Protocol Version 4, Src: 10.165.76.22 (10.165.76.22), Dst: 173.192.222.186 (173.192.222.186)
Transmission Control Protocol, Src Port: 57261 (57261), Dst Port: xmpp-client (5222), Seq: 107, Ack: 89, Len: 61

No.     Time        Source                Destination           Protocol Length Info
     16 5.998080    173.192.222.186       10.165.76.22          TCP      112    [TCP segment of a reassembled PDU]

Frame 16: 112 bytes on wire (896 bits), 112 bytes captured (896 bits)
Linux cooked capture
Internet Protocol Version 4, Src: 173.192.222.186 (173.192.222.186), Dst: 10.165.76.22 (10.165.76.22)
Transmission Control Protocol, Src Port: xmpp-client (5222), Dst Port: 57261 (57261), Seq: 89, Ack: 168, Len: 44

No.     Time        Source                Destination           Protocol Length Info
     17 5.998595    10.165.76.22          173.192.222.186       TCP      68     57261 > xmpp-client [ACK] Seq=168 Ack=133 Win=2227 Len=0 TSval=59463 TSecr=4247035425

Frame 17: 68 bytes on wire (544 bits), 68 bytes captured (544 bits)
Linux cooked capture
Internet Protocol Version 4, Src: 10.165.76.22 (10.165.76.22), Dst: 173.192.222.186 (173.192.222.186)
Transmission Control Protocol, Src Port: 57261 (57261), Dst Port: xmpp-client (5222), Seq: 168, Ack: 133, Len: 0

No.     Time        Source                Destination           Protocol Length Info
     18 6.418059    173.192.222.186       10.165.76.22          TCP      110    [TCP segment of a reassembled PDU]

Frame 18: 110 bytes on wire (880 bits), 110 bytes captured (880 bits)
Linux cooked capture
Internet Protocol Version 4, Src: 173.192.222.186 (173.192.222.186), Dst: 10.165.76.22 (10.165.76.22)
Transmission Control Protocol, Src Port: xmpp-client (5222), Dst Port: 57261 (57261), Seq: 133, Ack: 168, Len: 42

No.     Time        Source                Destination           Protocol Length Info
     19 6.418672    10.165.76.22          173.192.222.186       TCP      68     57261 > xmpp-client [ACK] Seq=168 Ack=175 Win=2227 Len=0 TSval=59505 TSecr=4247035843

Frame 19: 68 bytes on wire (544 bits), 68 bytes captured (544 bits)
Linux cooked capture
Internet Protocol Version 4, Src: 10.165.76.22 (10.165.76.22), Dst: 173.192.222.186 (173.192.222.186)
Transmission Control Protocol, Src Port: 57261 (57261), Dst Port: xmpp-client (5222), Seq: 168, Ack: 175, Len: 0

No.     Time        Source                Destination           Protocol Length Info
     20 6.422584    10.165.76.22          173.192.222.186       TCP      112    [TCP segment of a reassembled PDU]

Frame 20: 112 bytes on wire (896 bits), 112 bytes captured (896 bits)
Linux cooked capture
Internet Protocol Version 4, Src: 10.165.76.22 (10.165.76.22), Dst: 173.192.222.186 (173.192.222.186)
Transmission Control Protocol, Src Port: 57261 (57261), Dst Port: xmpp-client (5222), Seq: 168, Ack: 175, Len: 44

No.     Time        Source                Destination           Protocol Length Info
     21 6.748060    173.192.222.186       10.165.76.22          TCP      68     xmpp-client > 57261 [ACK] Seq=175 Ack=212 Win=512 Len=0 TSval=4247036174 TSecr=59505

Frame 21: 68 bytes on wire (544 bits), 68 bytes captured (544 bits)
Linux cooked capture
Internet Protocol Version 4, Src: 173.192.222.186 (173.192.222.186), Dst: 10.165.76.22 (10.165.76.22)
Transmission Control Protocol, Src Port: xmpp-client (5222), Dst Port: 57261 (57261), Seq: 175, Ack: 212, Len: 0

No.     Time        Source                Destination           Protocol Length Info
     22 8.849087    10.165.76.22          173.192.222.186       TCP      127    [TCP segment of a reassembled PDU]

Frame 22: 127 bytes on wire (1016 bits), 127 bytes captured (1016 bits)
Linux cooked capture
Internet Protocol Version 4, Src: 10.165.76.22 (10.165.76.22), Dst: 173.192.222.186 (173.192.222.186)
Transmission Control Protocol, Src Port: 57261 (57261), Dst Port: xmpp-client (5222), Seq: 212, Ack: 175, Len: 59

No.     Time        Source                Destination           Protocol Length Info
     23 9.118082    173.192.222.186       10.165.76.22          TCP      112    [TCP segment of a reassembled PDU]

Frame 23: 112 bytes on wire (896 bits), 112 bytes captured (896 bits)
Linux cooked capture
Internet Protocol Version 4, Src: 173.192.222.186 (173.192.222.186), Dst: 10.165.76.22 (10.165.76.22)
Transmission Control Protocol, Src Port: xmpp-client (5222), Dst Port: 57261 (57261), Seq: 175, Ack: 271, Len: 44

No.     Time        Source                Destination           Protocol Length Info
     24 9.156499    10.165.76.22          173.192.222.186       TCP      68     57261 > xmpp-client [ACK] Seq=271 Ack=219 Win=2227 Len=0 TSval=59779 TSecr=4247038545

Frame 24: 68 bytes on wire (544 bits), 68 bytes captured (544 bits)
Linux cooked capture
Internet Protocol Version 4, Src: 10.165.76.22 (10.165.76.22), Dst: 173.192.222.186 (173.192.222.186)
Transmission Control Protocol, Src Port: 57261 (57261), Dst Port: xmpp-client (5222), Seq: 271, Ack: 219, Len: 0

No.     Time        Source                Destination           Protocol Length Info
     25 9.498125    173.192.222.186       10.165.76.22          TCP      110    [TCP segment of a reassembled PDU]

Frame 25: 110 bytes on wire (880 bits), 110 bytes captured (880 bits)
Linux cooked capture
Internet Protocol Version 4, Src: 173.192.222.186 (173.192.222.186), Dst: 10.165.76.22 (10.165.76.22)
Transmission Control Protocol, Src Port: xmpp-client (5222), Dst Port: 57261 (57261), Seq: 219, Ack: 271, Len: 42

No.     Time        Source                Destination           Protocol Length Info
     26 9.498540    10.165.76.22          173.192.222.186       TCP      68     57261 > xmpp-client [ACK] Seq=271 Ack=261 Win=2227 Len=0 TSval=59813 TSecr=4247038923

Frame 26: 68 bytes on wire (544 bits), 68 bytes captured (544 bits)
Linux cooked capture
Internet Protocol Version 4, Src: 10.165.76.22 (10.165.76.22), Dst: 173.192.222.186 (173.192.222.186)
Transmission Control Protocol, Src Port: 57261 (57261), Dst Port: xmpp-client (5222), Seq: 271, Ack: 261, Len: 0

No.     Time        Source                Destination           Protocol Length Info
     27 9.519345    10.165.76.22          173.192.222.186       TCP      112    [TCP segment of a reassembled PDU]

Frame 27: 112 bytes on wire (896 bits), 112 bytes captured (896 bits)
Linux cooked capture
Internet Protocol Version 4, Src: 10.165.76.22 (10.165.76.22), Dst: 173.192.222.186 (173.192.222.186)
Transmission Control Protocol, Src Port: 57261 (57261), Dst Port: xmpp-client (5222), Seq: 271, Ack: 261, Len: 44

No.     Time        Source                Destination           Protocol Length Info
     28 9.828025    173.192.222.186       10.165.76.22          TCP      68     xmpp-client > 57261 [ACK] Seq=261 Ack=315 Win=512 Len=0 TSval=4247039255 TSecr=59815

Frame 28: 68 bytes on wire (544 bits), 68 bytes captured (544 bits)
Linux cooked capture
Internet Protocol Version 4, Src: 173.192.222.186 (173.192.222.186), Dst: 10.165.76.22 (10.165.76.22)
Transmission Control Protocol, Src Port: xmpp-client (5222), Dst Port: 57261 (57261), Seq: 261, Ack: 315, Len: 0

No.     Time        Source                Destination           Protocol Length Info
     29 16.318957   54.235.185.74         10.165.76.22          TCP      68     http > 44019 [FIN, ACK] Seq=1 Ack=1 Win=64251 Len=0 TSval=258216012 TSecr=57452

Frame 29: 68 bytes on wire (544 bits), 68 bytes captured (544 bits)
Linux cooked capture
Internet Protocol Version 4, Src: 54.235.185.74 (54.235.185.74), Dst: 10.165.76.22 (10.165.76.22)
Transmission Control Protocol, Src Port: http (80), Dst Port: 44019 (44019), Seq: 1, Ack: 1, Len: 0

No.     Time        Source                Destination           Protocol Length Info
     30 16.338922   54.235.185.74         10.165.76.22          TCP      68     http > 44019 [FIN, ACK] Seq=1 Ack=1 Win=64251 Len=0 TSval=258216146 TSecr=57452

Frame 30: 68 bytes on wire (544 bits), 68 bytes captured (544 bits)
Linux cooked capture
Internet Protocol Version 4, Src: 54.235.185.74 (54.235.185.74), Dst: 10.165.76.22 (10.165.76.22)
Transmission Control Protocol, Src Port: http (80), Dst Port: 44019 (44019), Seq: 1, Ack: 1, Len: 0

No.     Time        Source                Destination           Protocol Length Info
     31 16.339047   10.165.76.22          54.235.185.74         TCP      80     44019 > http [ACK] Seq=1 Ack=2 Win=1959 Len=0 TSval=60497 TSecr=258216146 SLE=1 SRE=2

Frame 31: 80 bytes on wire (640 bits), 80 bytes captured (640 bits)
Linux cooked capture
Internet Protocol Version 4, Src: 10.165.76.22 (10.165.76.22), Dst: 54.235.185.74 (54.235.185.74)
Transmission Control Protocol, Src Port: 44019 (44019), Dst Port: http (80), Seq: 1, Ack: 2, Len: 0

No.     Time        Source                Destination           Protocol Length Info
     32 16.635039   10.165.76.22          173.192.222.186       TCP      139    [TCP segment of a reassembled PDU]

Frame 32: 139 bytes on wire (1112 bits), 139 bytes captured (1112 bits)
Linux cooked capture
Internet Protocol Version 4, Src: 10.165.76.22 (10.165.76.22), Dst: 173.192.222.186 (173.192.222.186)
Transmission Control Protocol, Src Port: 57261 (57261), Dst Port: xmpp-client (5222), Seq: 315, Ack: 261, Len: 71

No.     Time        Source                Destination           Protocol Length Info
     33 17.139290   173.192.222.186       10.165.76.22          TCP      112    [TCP segment of a reassembled PDU]

Frame 33: 112 bytes on wire (896 bits), 112 bytes captured (896 bits)
Linux cooked capture
Internet Protocol Version 4, Src: 173.192.222.186 (173.192.222.186), Dst: 10.165.76.22 (10.165.76.22)
Transmission Control Protocol, Src Port: xmpp-client (5222), Dst Port: 57261 (57261), Seq: 261, Ack: 386, Len: 44

No.     Time        Source                Destination           Protocol Length Info
     34 17.176599   10.165.76.22          173.192.222.186       TCP      68     57261 > xmpp-client [ACK] Seq=386 Ack=305 Win=2227 Len=0 TSval=60581 TSecr=4247046472

Frame 34: 68 bytes on wire (544 bits), 68 bytes captured (544 bits)
Linux cooked capture
Internet Protocol Version 4, Src: 10.165.76.22 (10.165.76.22), Dst: 173.192.222.186 (173.192.222.186)
Transmission Control Protocol, Src Port: 57261 (57261), Dst Port: xmpp-client (5222), Seq: 386, Ack: 305, Len: 0

No.     Time        Source                Destination           Protocol Length Info
     35 17.559259   173.192.222.186       10.165.76.22          TCP      110    [TCP segment of a reassembled PDU]

Frame 35: 110 bytes on wire (880 bits), 110 bytes captured (880 bits)
Linux cooked capture
Internet Protocol Version 4, Src: 173.192.222.186 (173.192.222.186), Dst: 10.165.76.22 (10.165.76.22)
Transmission Control Protocol, Src Port: xmpp-client (5222), Dst Port: 57261 (57261), Seq: 305, Ack: 386, Len: 42

No.     Time        Source                Destination           Protocol Length Info
     36 17.559864   10.165.76.22          173.192.222.186       TCP      68     57261 > xmpp-client [ACK] Seq=386 Ack=347 Win=2227 Len=0 TSval=60619 TSecr=4247046893

Frame 36: 68 bytes on wire (544 bits), 68 bytes captured (544 bits)
Linux cooked capture
Internet Protocol Version 4, Src: 10.165.76.22 (10.165.76.22), Dst: 173.192.222.186 (173.192.222.186)
Transmission Control Protocol, Src Port: 57261 (57261), Dst Port: xmpp-client (5222), Seq: 386, Ack: 347, Len: 0

No.     Time        Source                Destination           Protocol Length Info
     37 17.580435   10.165.76.22          173.192.222.186       TCP      112    [TCP segment of a reassembled PDU]

Frame 37: 112 bytes on wire (896 bits), 112 bytes captured (896 bits)
Linux cooked capture
Internet Protocol Version 4, Src: 10.165.76.22 (10.165.76.22), Dst: 173.192.222.186 (173.192.222.186)
Transmission Control Protocol, Src Port: 57261 (57261), Dst Port: xmpp-client (5222), Seq: 386, Ack: 347, Len: 44

No.     Time        Source                Destination           Protocol Length Info
     38 18.158984   173.192.222.186       10.165.76.22          TCP      68     xmpp-client > 57261 [ACK] Seq=347 Ack=430 Win=512 Len=0 TSval=4247047499 TSecr=60621

Frame 38: 68 bytes on wire (544 bits), 68 bytes captured (544 bits)
Linux cooked capture
Internet Protocol Version 4, Src: 173.192.222.186 (173.192.222.186), Dst: 10.165.76.22 (10.165.76.22)
Transmission Control Protocol, Src Port: xmpp-client (5222), Dst Port: 57261 (57261), Seq: 347, Ack: 430, Len: 0

No.     Time        Source                Destination           Protocol Length Info
     39 23.874130   10.165.76.22          173.192.222.186       TCP      136    [TCP segment of a reassembled PDU]

Frame 39: 136 bytes on wire (1088 bits), 136 bytes captured (1088 bits)
Linux cooked capture
Internet Protocol Version 4, Src: 10.165.76.22 (10.165.76.22), Dst: 173.192.222.186 (173.192.222.186)
Transmission Control Protocol, Src Port: 57261 (57261), Dst Port: xmpp-client (5222), Seq: 430, Ack: 347, Len: 68

No.     Time        Source                Destination           Protocol Length Info
     40 24.379102   173.192.222.186       10.165.76.22          TCP      112    [TCP segment of a reassembled PDU]

Frame 40: 112 bytes on wire (896 bits), 112 bytes captured (896 bits)
Linux cooked capture
Internet Protocol Version 4, Src: 173.192.222.186 (173.192.222.186), Dst: 10.165.76.22 (10.165.76.22)
Transmission Control Protocol, Src Port: xmpp-client (5222), Dst Port: 57261 (57261), Seq: 347, Ack: 498, Len: 44

No.     Time        Source                Destination           Protocol Length Info
     41 24.416435   10.165.76.22          173.192.222.186       TCP      68     57261 > xmpp-client [ACK] Seq=498 Ack=391 Win=2227 Len=0 TSval=61305 TSecr=4247053713

Frame 41: 68 bytes on wire (544 bits), 68 bytes captured (544 bits)
Linux cooked capture
Internet Protocol Version 4, Src: 10.165.76.22 (10.165.76.22), Dst: 173.192.222.186 (173.192.222.186)
Transmission Control Protocol, Src Port: 57261 (57261), Dst Port: xmpp-client (5222), Seq: 498, Ack: 391, Len: 0

No.     Time        Source                Destination           Protocol Length Info
     42 25.412100   10.165.76.22          173.192.222.186       TCP      122    [TCP segment of a reassembled PDU]

Frame 42: 122 bytes on wire (976 bits), 122 bytes captured (976 bits)
Linux cooked capture
Internet Protocol Version 4, Src: 10.165.76.22 (10.165.76.22), Dst: 173.192.222.186 (173.192.222.186)
Transmission Control Protocol, Src Port: 57261 (57261), Dst Port: xmpp-client (5222), Seq: 498, Ack: 391, Len: 54

No.     Time        Source                Destination           Protocol Length Info
     43 25.849402   173.192.222.186       10.165.76.22          TCP      112    [TCP segment of a reassembled PDU]

Frame 43: 112 bytes on wire (896 bits), 112 bytes captured (896 bits)
Linux cooked capture
Internet Protocol Version 4, Src: 173.192.222.186 (173.192.222.186), Dst: 10.165.76.22 (10.165.76.22)
Transmission Control Protocol, Src Port: xmpp-client (5222), Dst Port: 57261 (57261), Seq: 391, Ack: 552, Len: 44

No.     Time        Source                Destination           Protocol Length Info
     44 25.850067   10.165.76.22          173.192.222.186       TCP      68     57261 > xmpp-client [ACK] Seq=552 Ack=435 Win=2227 Len=0 TSval=61448 TSecr=4247055184

Frame 44: 68 bytes on wire (544 bits), 68 bytes captured (544 bits)
Linux cooked capture
Internet Protocol Version 4, Src: 10.165.76.22 (10.165.76.22), Dst: 173.192.222.186 (173.192.222.186)
Transmission Control Protocol, Src Port: 57261 (57261), Dst Port: xmpp-client (5222), Seq: 552, Ack: 435, Len: 0

No.     Time        Source                Destination           Protocol Length Info
     45 27.028957   173.192.222.186       10.165.76.22          TCP      110    [TCP segment of a reassembled PDU]

Frame 45: 110 bytes on wire (880 bits), 110 bytes captured (880 bits)
Linux cooked capture
Internet Protocol Version 4, Src: 173.192.222.186 (173.192.222.186), Dst: 10.165.76.22 (10.165.76.22)
Transmission Control Protocol, Src Port: xmpp-client (5222), Dst Port: 57261 (57261), Seq: 435, Ack: 552, Len: 42

No.     Time        Source                Destination           Protocol Length Info
     46 27.029297   10.165.76.22          173.192.222.186       TCP      68     57261 > xmpp-client [ACK] Seq=552 Ack=477 Win=2227 Len=0 TSval=61566 TSecr=4247056356

Frame 46: 68 bytes on wire (544 bits), 68 bytes captured (544 bits)
Linux cooked capture
Internet Protocol Version 4, Src: 10.165.76.22 (10.165.76.22), Dst: 173.192.222.186 (173.192.222.186)
Transmission Control Protocol, Src Port: 57261 (57261), Dst Port: xmpp-client (5222), Seq: 552, Ack: 477, Len: 0

No.     Time        Source                Destination           Protocol Length Info
     47 27.038120   10.165.76.22          173.192.222.186       TCP      112    [TCP segment of a reassembled PDU]

Frame 47: 112 bytes on wire (896 bits), 112 bytes captured (896 bits)
Linux cooked capture
Internet Protocol Version 4, Src: 10.165.76.22 (10.165.76.22), Dst: 173.192.222.186 (173.192.222.186)
Transmission Control Protocol, Src Port: 57261 (57261), Dst Port: xmpp-client (5222), Seq: 552, Ack: 477, Len: 44

No.     Time        Source                Destination           Protocol Length Info
     48 27.539410   173.192.222.186       10.165.76.22          TCP      110    [TCP segment of a reassembled PDU]

Frame 48: 110 bytes on wire (880 bits), 110 bytes captured (880 bits)
Linux cooked capture
Internet Protocol Version 4, Src: 173.192.222.186 (173.192.222.186), Dst: 10.165.76.22 (10.165.76.22)
Transmission Control Protocol, Src Port: xmpp-client (5222), Dst Port: 57261 (57261), Seq: 477, Ack: 552, Len: 42

No.     Time        Source                Destination           Protocol Length Info
     49 27.576412   10.165.76.22          173.192.222.186       TCP      68     57261 > xmpp-client [ACK] Seq=596 Ack=519 Win=2227 Len=0 TSval=61621 TSecr=4247056882

Frame 49: 68 bytes on wire (544 bits), 68 bytes captured (544 bits)
Linux cooked capture
Internet Protocol Version 4, Src: 10.165.76.22 (10.165.76.22), Dst: 173.192.222.186 (173.192.222.186)
Transmission Control Protocol, Src Port: 57261 (57261), Dst Port: xmpp-client (5222), Seq: 596, Ack: 519, Len: 0

No.     Time        Source                Destination           Protocol Length Info
     50 27.658965   173.192.222.186       10.165.76.22          TCP      68     xmpp-client > 57261 [ACK] Seq=519 Ack=596 Win=512 Len=0 TSval=4247056994 TSecr=61567

Frame 50: 68 bytes on wire (544 bits), 68 bytes captured (544 bits)
Linux cooked capture
Internet Protocol Version 4, Src: 173.192.222.186 (173.192.222.186), Dst: 10.165.76.22 (10.165.76.22)
Transmission Control Protocol, Src Port: xmpp-client (5222), Dst Port: 57261 (57261), Seq: 519, Ack: 596, Len: 0

No.     Time        Source                Destination           Protocol Length Info
     51 27.659380   10.165.76.22          173.192.222.186       TCP      112    [TCP segment of a reassembled PDU]

Frame 51: 112 bytes on wire (896 bits), 112 bytes captured (896 bits)
Linux cooked capture
Internet Protocol Version 4, Src: 10.165.76.22 (10.165.76.22), Dst: 173.192.222.186 (173.192.222.186)
Transmission Control Protocol, Src Port: 57261 (57261), Dst Port: xmpp-client (5222), Seq: 596, Ack: 519, Len: 44

No.     Time        Source                Destination           Protocol Length Info
     52 28.229262   173.192.222.186       10.165.76.22          TCP      68     xmpp-client > 57261 [ACK] Seq=519 Ack=640 Win=512 Len=0 TSval=4247057578 TSecr=61629

Frame 52: 68 bytes on wire (544 bits), 68 bytes captured (544 bits)
Linux cooked capture
Internet Protocol Version 4, Src: 173.192.222.186 (173.192.222.186), Dst: 10.165.76.22 (10.165.76.22)
Transmission Control Protocol, Src Port: xmpp-client (5222), Dst Port: 57261 (57261), Seq: 519, Ack: 640, Len: 0

No.     Time        Source                Destination           Protocol Length Info
     53 30.963857   10.165.76.22          173.192.222.186       TCP      135    [TCP segment of a reassembled PDU]

Frame 53: 135 bytes on wire (1080 bits), 135 bytes captured (1080 bits)
Linux cooked capture
Internet Protocol Version 4, Src: 10.165.76.22 (10.165.76.22), Dst: 173.192.222.186 (173.192.222.186)
Transmission Control Protocol, Src Port: 57261 (57261), Dst Port: xmpp-client (5222), Seq: 640, Ack: 519, Len: 67

No.     Time        Source                Destination           Protocol Length Info
     54 31.399275   173.192.222.186       10.165.76.22          TCP      112    [TCP segment of a reassembled PDU]

Frame 54: 112 bytes on wire (896 bits), 112 bytes captured (896 bits)
Linux cooked capture
Internet Protocol Version 4, Src: 173.192.222.186 (173.192.222.186), Dst: 10.165.76.22 (10.165.76.22)
Transmission Control Protocol, Src Port: xmpp-client (5222), Dst Port: 57261 (57261), Seq: 519, Ack: 707, Len: 44

No.     Time        Source                Destination           Protocol Length Info
     55 31.399995   10.165.76.22          173.192.222.186       TCP      68     57261 > xmpp-client [ACK] Seq=707 Ack=563 Win=2227 Len=0 TSval=62003 TSecr=4247060726

Frame 55: 68 bytes on wire (544 bits), 68 bytes captured (544 bits)
Linux cooked capture
Internet Protocol Version 4, Src: 10.165.76.22 (10.165.76.22), Dst: 173.192.222.186 (173.192.222.186)
Transmission Control Protocol, Src Port: 57261 (57261), Dst Port: xmpp-client (5222), Seq: 707, Ack: 563, Len: 0

No.     Time        Source                Destination           Protocol Length Info
     56 31.999265   173.192.222.186       10.165.76.22          TCP      110    [TCP segment of a reassembled PDU]

Frame 56: 110 bytes on wire (880 bits), 110 bytes captured (880 bits)
Linux cooked capture
Internet Protocol Version 4, Src: 173.192.222.186 (173.192.222.186), Dst: 10.165.76.22 (10.165.76.22)
Transmission Control Protocol, Src Port: xmpp-client (5222), Dst Port: 57261 (57261), Seq: 563, Ack: 707, Len: 42

No.     Time        Source                Destination           Protocol Length Info
     57 31.999925   10.165.76.22          173.192.222.186       TCP      68     57261 > xmpp-client [ACK] Seq=707 Ack=605 Win=2227 Len=0 TSval=62063 TSecr=4247061331

Frame 57: 68 bytes on wire (544 bits), 68 bytes captured (544 bits)
Linux cooked capture
Internet Protocol Version 4, Src: 10.165.76.22 (10.165.76.22), Dst: 173.192.222.186 (173.192.222.186)
Transmission Control Protocol, Src Port: 57261 (57261), Dst Port: xmpp-client (5222), Seq: 707, Ack: 605, Len: 0

No.     Time        Source                Destination           Protocol Length Info
     58 32.013970   10.165.76.22          173.192.222.186       TCP      112    [TCP segment of a reassembled PDU]

Frame 58: 112 bytes on wire (896 bits), 112 bytes captured (896 bits)
Linux cooked capture
Internet Protocol Version 4, Src: 10.165.76.22 (10.165.76.22), Dst: 173.192.222.186 (173.192.222.186)
Transmission Control Protocol, Src Port: 57261 (57261), Dst Port: xmpp-client (5222), Seq: 707, Ack: 605, Len: 44

No.     Time        Source                Destination           Protocol Length Info
     59 32.599072   173.192.222.186       10.165.76.22          TCP      68     xmpp-client > 57261 [ACK] Seq=605 Ack=751 Win=512 Len=0 TSval=4247061940 TSecr=62064

Frame 59: 68 bytes on wire (544 bits), 68 bytes captured (544 bits)
Linux cooked capture
Internet Protocol Version 4, Src: 173.192.222.186 (173.192.222.186), Dst: 10.165.76.22 (10.165.76.22)
Transmission Control Protocol, Src Port: xmpp-client (5222), Dst Port: 57261 (57261), Seq: 605, Ack: 751, Len: 0

No.     Time        Source                Destination           Protocol Length Info
     60 35.833194   10.165.76.22          173.192.222.186       TCP      131    [TCP segment of a reassembled PDU]

Frame 60: 131 bytes on wire (1048 bits), 131 bytes captured (1048 bits)
Linux cooked capture
Internet Protocol Version 4, Src: 10.165.76.22 (10.165.76.22), Dst: 173.192.222.186 (173.192.222.186)
Transmission Control Protocol, Src Port: 57261 (57261), Dst Port: xmpp-client (5222), Seq: 751, Ack: 605, Len: 63

No.     Time        Source                Destination           Protocol Length Info
     61 36.269392   173.192.222.186       10.165.76.22          TCP      112    [TCP segment of a reassembled PDU]

Frame 61: 112 bytes on wire (896 bits), 112 bytes captured (896 bits)
Linux cooked capture
Internet Protocol Version 4, Src: 173.192.222.186 (173.192.222.186), Dst: 10.165.76.22 (10.165.76.22)
Transmission Control Protocol, Src Port: xmpp-client (5222), Dst Port: 57261 (57261), Seq: 605, Ack: 814, Len: 44

No.     Time        Source                Destination           Protocol Length Info
     62 36.306605   10.165.76.22          173.192.222.186       TCP      68     57261 > xmpp-client [ACK] Seq=814 Ack=649 Win=2227 Len=0 TSval=62494 TSecr=4247065604

Frame 62: 68 bytes on wire (544 bits), 68 bytes captured (544 bits)
Linux cooked capture
Internet Protocol Version 4, Src: 10.165.76.22 (10.165.76.22), Dst: 173.192.222.186 (173.192.222.186)
Transmission Control Protocol, Src Port: 57261 (57261), Dst Port: xmpp-client (5222), Seq: 814, Ack: 649, Len: 0

No.     Time        Source                Destination           Protocol Length Info
     63 37.099270   173.192.222.186       10.165.76.22          TCP      95     [TCP segment of a reassembled PDU]

Frame 63: 95 bytes on wire (760 bits), 95 bytes captured (760 bits)
Linux cooked capture
Internet Protocol Version 4, Src: 173.192.222.186 (173.192.222.186), Dst: 10.165.76.22 (10.165.76.22)
Transmission Control Protocol, Src Port: xmpp-client (5222), Dst Port: 57261 (57261), Seq: 649, Ack: 814, Len: 27

No.     Time        Source                Destination           Protocol Length Info
     64 37.099919   10.165.76.22          173.192.222.186       TCP      68     57261 > xmpp-client [ACK] Seq=814 Ack=676 Win=2227 Len=0 TSval=62573 TSecr=4247066445

Frame 64: 68 bytes on wire (544 bits), 68 bytes captured (544 bits)
Linux cooked capture
Internet Protocol Version 4, Src: 10.165.76.22 (10.165.76.22), Dst: 173.192.222.186 (173.192.222.186)
Transmission Control Protocol, Src Port: 57261 (57261), Dst Port: xmpp-client (5222), Seq: 814, Ack: 676, Len: 0

No.     Time        Source                Destination           Protocol Length Info
     65 38.529300   173.192.222.186       10.165.76.22          TCP      100    [TCP segment of a reassembled PDU]

Frame 65: 100 bytes on wire (800 bits), 100 bytes captured (800 bits)
Linux cooked capture
Internet Protocol Version 4, Src: 173.192.222.186 (173.192.222.186), Dst: 10.165.76.22 (10.165.76.22)
Transmission Control Protocol, Src Port: xmpp-client (5222), Dst Port: 57261 (57261), Seq: 676, Ack: 814, Len: 32

No.     Time        Source                Destination           Protocol Length Info
     66 38.529927   10.165.76.22          173.192.222.186       TCP      68     57261 > xmpp-client [ACK] Seq=814 Ack=708 Win=2227 Len=0 TSval=62716 TSecr=4247067867

Frame 66: 68 bytes on wire (544 bits), 68 bytes captured (544 bits)
Linux cooked capture
Internet Protocol Version 4, Src: 10.165.76.22 (10.165.76.22), Dst: 173.192.222.186 (173.192.222.186)
Transmission Control Protocol, Src Port: 57261 (57261), Dst Port: xmpp-client (5222), Seq: 814, Ack: 708, Len: 0

No.     Time        Source                Destination           Protocol Length Info
     67 38.559392   173.192.222.186       10.165.76.22          TCP      110    [TCP segment of a reassembled PDU]

Frame 67: 110 bytes on wire (880 bits), 110 bytes captured (880 bits)
Linux cooked capture
Internet Protocol Version 4, Src: 173.192.222.186 (173.192.222.186), Dst: 10.165.76.22 (10.165.76.22)
Transmission Control Protocol, Src Port: xmpp-client (5222), Dst Port: 57261 (57261), Seq: 708, Ack: 814, Len: 42

No.     Time        Source                Destination           Protocol Length Info
     68 38.559812   10.165.76.22          173.192.222.186       TCP      68     57261 > xmpp-client [ACK] Seq=814 Ack=750 Win=2227 Len=0 TSval=62719 TSecr=4247067868

Frame 68: 68 bytes on wire (544 bits), 68 bytes captured (544 bits)
Linux cooked capture
Internet Protocol Version 4, Src: 10.165.76.22 (10.165.76.22), Dst: 173.192.222.186 (173.192.222.186)
Transmission Control Protocol, Src Port: 57261 (57261), Dst Port: xmpp-client (5222), Seq: 814, Ack: 750, Len: 0

No.     Time        Source                Destination           Protocol Length Info
     69 38.574889   10.165.76.22          173.192.222.186       TCP      112    [TCP segment of a reassembled PDU]

Frame 69: 112 bytes on wire (896 bits), 112 bytes captured (896 bits)
Linux cooked capture
Internet Protocol Version 4, Src: 10.165.76.22 (10.165.76.22), Dst: 173.192.222.186 (173.192.222.186)
Transmission Control Protocol, Src Port: 57261 (57261), Dst Port: xmpp-client (5222), Seq: 814, Ack: 750, Len: 44

No.     Time        Source                Destination           Protocol Length Info
     70 39.079430   173.192.222.186       10.165.76.22          TCP      100    [TCP segment of a reassembled PDU]

Frame 70: 100 bytes on wire (800 bits), 100 bytes captured (800 bits)
Linux cooked capture
Internet Protocol Version 4, Src: 173.192.222.186 (173.192.222.186), Dst: 10.165.76.22 (10.165.76.22)
Transmission Control Protocol, Src Port: xmpp-client (5222), Dst Port: 57261 (57261), Seq: 750, Ack: 814, Len: 32

No.     Time        Source                Destination           Protocol Length Info
     71 39.119790   173.192.222.186       10.165.76.22          TCP      151    [TCP segment of a reassembled PDU]

Frame 71: 151 bytes on wire (1208 bits), 151 bytes captured (1208 bits)
Linux cooked capture
Internet Protocol Version 4, Src: 173.192.222.186 (173.192.222.186), Dst: 10.165.76.22 (10.165.76.22)
Transmission Control Protocol, Src Port: xmpp-client (5222), Dst Port: 57261 (57261), Seq: 782, Ack: 814, Len: 83

No.     Time        Source                Destination           Protocol Length Info
     72 39.122605   10.165.76.22          173.192.222.186       TCP      68     57261 > xmpp-client [ACK] Seq=858 Ack=865 Win=2227 Len=0 TSval=62775 TSecr=4247068422

Frame 72: 68 bytes on wire (544 bits), 68 bytes captured (544 bits)
Linux cooked capture
Internet Protocol Version 4, Src: 10.165.76.22 (10.165.76.22), Dst: 173.192.222.186 (173.192.222.186)
Transmission Control Protocol, Src Port: 57261 (57261), Dst Port: xmpp-client (5222), Seq: 858, Ack: 865, Len: 0

No.     Time        Source                Destination           Protocol Length Info
     73 39.591039   173.192.222.186       10.165.76.22          TCP      68     xmpp-client > 57261 [ACK] Seq=865 Ack=858 Win=512 Len=0 TSval=4247068938 TSecr=62720

Frame 73: 68 bytes on wire (544 bits), 68 bytes captured (544 bits)
Linux cooked capture
Internet Protocol Version 4, Src: 173.192.222.186 (173.192.222.186), Dst: 10.165.76.22 (10.165.76.22)
Transmission Control Protocol, Src Port: xmpp-client (5222), Dst Port: 57261 (57261), Seq: 865, Ack: 858, Len: 0

No.     Time        Source                Destination           Protocol Length Info
     74 39.591662   10.165.76.22          173.192.222.186       TCP      119    [TCP segment of a reassembled PDU]

Frame 74: 119 bytes on wire (952 bits), 119 bytes captured (952 bits)
Linux cooked capture
Internet Protocol Version 4, Src: 10.165.76.22 (10.165.76.22), Dst: 173.192.222.186 (173.192.222.186)
Transmission Control Protocol, Src Port: 57261 (57261), Dst Port: xmpp-client (5222), Seq: 858, Ack: 865, Len: 51

No.     Time        Source                Destination           Protocol Length Info
     75 40.169472   173.192.222.186       10.165.76.22          TCP      68     xmpp-client > 57261 [ACK] Seq=865 Ack=909 Win=512 Len=0 TSval=4247069504 TSecr=62822

Frame 75: 68 bytes on wire (544 bits), 68 bytes captured (544 bits)
Linux cooked capture
Internet Protocol Version 4, Src: 173.192.222.186 (173.192.222.186), Dst: 10.165.76.22 (10.165.76.22)
Transmission Control Protocol, Src Port: xmpp-client (5222), Dst Port: 57261 (57261), Seq: 865, Ack: 909, Len: 0

No.     Time        Source                Destination           Protocol Length Info
     76 45.033780   10.165.76.22          173.192.222.186       TCP      100    [TCP segment of a reassembled PDU]

Frame 76: 100 bytes on wire (800 bits), 100 bytes captured (800 bits)
Linux cooked capture
Internet Protocol Version 4, Src: 10.165.76.22 (10.165.76.22), Dst: 173.192.222.186 (173.192.222.186)
Transmission Control Protocol, Src Port: 57261 (57261), Dst Port: xmpp-client (5222), Seq: 909, Ack: 865, Len: 32

No.     Time        Source                Destination           Protocol Length Info
     77 46.358969   173.192.222.186       10.165.76.22          TCP      68     xmpp-client > 57261 [ACK] Seq=865 Ack=941 Win=512 Len=0 TSval=4247074825 TSecr=63366

Frame 77: 68 bytes on wire (544 bits), 68 bytes captured (544 bits)
Linux cooked capture
Internet Protocol Version 4, Src: 173.192.222.186 (173.192.222.186), Dst: 10.165.76.22 (10.165.76.22)
Transmission Control Protocol, Src Port: xmpp-client (5222), Dst Port: 57261 (57261), Seq: 865, Ack: 941, Len: 0

No.     Time        Source                Destination           Protocol Length Info
     78 46.359325   10.165.76.22          173.192.222.186       TCP      154    [TCP segment of a reassembled PDU]

Frame 78: 154 bytes on wire (1232 bits), 154 bytes captured (1232 bits)
Linux cooked capture
Internet Protocol Version 4, Src: 10.165.76.22 (10.165.76.22), Dst: 173.192.222.186 (173.192.222.186)
Transmission Control Protocol, Src Port: 57261 (57261), Dst Port: xmpp-client (5222), Seq: 941, Ack: 865, Len: 86

No.     Time        Source                Destination           Protocol Length Info
     79 48.149782   173.192.222.186       10.165.76.22          TCP      112    [TCP segment of a reassembled PDU]

Frame 79: 112 bytes on wire (896 bits), 112 bytes captured (896 bits)
Linux cooked capture
Internet Protocol Version 4, Src: 173.192.222.186 (173.192.222.186), Dst: 10.165.76.22 (10.165.76.22)
Transmission Control Protocol, Src Port: xmpp-client (5222), Dst Port: 57261 (57261), Seq: 865, Ack: 1027, Len: 44

No.     Time        Source                Destination           Protocol Length Info
     80 48.159767   173.192.222.186       10.165.76.22          TCP      112    [TCP Retransmission] [TCP segment of a reassembled PDU]

Frame 80: 112 bytes on wire (896 bits), 112 bytes captured (896 bits)
Linux cooked capture
Internet Protocol Version 4, Src: 173.192.222.186 (173.192.222.186), Dst: 10.165.76.22 (10.165.76.22)
Transmission Control Protocol, Src Port: xmpp-client (5222), Dst Port: 57261 (57261), Seq: 865, Ack: 1027, Len: 44

No.     Time        Source                Destination           Protocol Length Info
     81 48.160174   10.165.76.22          173.192.222.186       TCP      80     57261 > xmpp-client [ACK] Seq=1027 Ack=909 Win=2227 Len=0 TSval=63679 TSecr=4247077308 SLE=865 SRE=909

Frame 81: 80 bytes on wire (640 bits), 80 bytes captured (640 bits)
Linux cooked capture
Internet Protocol Version 4, Src: 10.165.76.22 (10.165.76.22), Dst: 173.192.222.186 (173.192.222.186)
Transmission Control Protocol, Src Port: 57261 (57261), Dst Port: xmpp-client (5222), Seq: 1027, Ack: 909, Len: 0

No.     Time        Source                Destination           Protocol Length Info
     82 50.594022   173.192.222.186       10.165.76.22          TCP      110    [TCP segment of a reassembled PDU]

Frame 82: 110 bytes on wire (880 bits), 110 bytes captured (880 bits)
Linux cooked capture
Internet Protocol Version 4, Src: 173.192.222.186 (173.192.222.186), Dst: 10.165.76.22 (10.165.76.22)
Transmission Control Protocol, Src Port: xmpp-client (5222), Dst Port: 57261 (57261), Seq: 909, Ack: 1027, Len: 42

No.     Time        Source                Destination           Protocol Length Info
     83 50.595009   173.192.222.186       10.165.76.22          TCP      110    [TCP Retransmission] xmpp-client > 57261 [PSH, ACK] Seq=909 Ack=1027 Win=512 Len=42 TSval=4247079736 TSecr=63679

Frame 83: 110 bytes on wire (880 bits), 110 bytes captured (880 bits)
Linux cooked capture
Internet Protocol Version 4, Src: 173.192.222.186 (173.192.222.186), Dst: 10.165.76.22 (10.165.76.22)
Transmission Control Protocol, Src Port: xmpp-client (5222), Dst Port: 57261 (57261), Seq: 909, Ack: 1027, Len: 42

No.     Time        Source                Destination           Protocol Length Info
     84 50.597649   10.165.76.22          173.192.222.186       TCP      68     57261 > xmpp-client [ACK] Seq=1027 Ack=951 Win=2227 Len=0 TSval=63923 TSecr=4247077725

Frame 84: 68 bytes on wire (544 bits), 68 bytes captured (544 bits)
Linux cooked capture
Internet Protocol Version 4, Src: 10.165.76.22 (10.165.76.22), Dst: 173.192.222.186 (173.192.222.186)
Transmission Control Protocol, Src Port: 57261 (57261), Dst Port: xmpp-client (5222), Seq: 1027, Ack: 951, Len: 0

No.     Time        Source                Destination           Protocol Length Info
     85 50.602309   10.165.76.22          173.192.222.186       TCP      80     [TCP Dup ACK 84#1] 57261 > xmpp-client [ACK] Seq=1027 Ack=951 Win=2227 Len=0 TSval=63923 TSecr=4247079736 SLE=909 SRE=951

Frame 85: 80 bytes on wire (640 bits), 80 bytes captured (640 bits)
Linux cooked capture
Internet Protocol Version 4, Src: 10.165.76.22 (10.165.76.22), Dst: 173.192.222.186 (173.192.222.186)
Transmission Control Protocol, Src Port: 57261 (57261), Dst Port: xmpp-client (5222), Seq: 1027, Ack: 951, Len: 0

No.     Time        Source                Destination           Protocol Length Info
     86 50.647145   10.165.76.22          173.192.222.186       TCP      112    [TCP segment of a reassembled PDU]

Frame 86: 112 bytes on wire (896 bits), 112 bytes captured (896 bits)
Linux cooked capture
Internet Protocol Version 4, Src: 10.165.76.22 (10.165.76.22), Dst: 173.192.222.186 (173.192.222.186)
Transmission Control Protocol, Src Port: 57261 (57261), Dst Port: xmpp-client (5222), Seq: 1027, Ack: 951, Len: 44

No.     Time        Source                Destination           Protocol Length Info
     87 51.769354   173.192.222.186       10.165.76.22          TCP      68     xmpp-client > 57261 [ACK] Seq=951 Ack=1071 Win=512 Len=0 TSval=4247081110 TSecr=63928

Frame 87: 68 bytes on wire (544 bits), 68 bytes captured (544 bits)
Linux cooked capture
Internet Protocol Version 4, Src: 173.192.222.186 (173.192.222.186), Dst: 10.165.76.22 (10.165.76.22)
Transmission Control Protocol, Src Port: xmpp-client (5222), Dst Port: 57261 (57261), Seq: 951, Ack: 1071, Len: 0

No.     Time        Source                Destination           Protocol Length Info
     88 51.769682   10.165.76.22          173.192.222.186       TCP      100    [TCP segment of a reassembled PDU]

Frame 88: 100 bytes on wire (800 bits), 100 bytes captured (800 bits)
Linux cooked capture
Internet Protocol Version 4, Src: 10.165.76.22 (10.165.76.22), Dst: 173.192.222.186 (173.192.222.186)
Transmission Control Protocol, Src Port: 57261 (57261), Dst Port: xmpp-client (5222), Seq: 1071, Ack: 951, Len: 32

No.     Time        Source                Destination           Protocol Length Info
     89 52.309339   173.192.222.186       10.165.76.22          TCP      68     xmpp-client > 57261 [ACK] Seq=951 Ack=1103 Win=512 Len=0 TSval=4247081649 TSecr=64040

Frame 89: 68 bytes on wire (544 bits), 68 bytes captured (544 bits)
Linux cooked capture
Internet Protocol Version 4, Src: 173.192.222.186 (173.192.222.186), Dst: 10.165.76.22 (10.165.76.22)
Transmission Control Protocol, Src Port: xmpp-client (5222), Dst Port: 57261 (57261), Seq: 951, Ack: 1103, Len: 0

No.     Time        Source                Destination           Protocol Length Info
     90 55.325842   173.192.222.186       10.165.76.22          TCP      97     [TCP segment of a reassembled PDU]

Frame 90: 97 bytes on wire (776 bits), 97 bytes captured (776 bits)
Linux cooked capture
Internet Protocol Version 4, Src: 173.192.222.186 (173.192.222.186), Dst: 10.165.76.22 (10.165.76.22)
Transmission Control Protocol, Src Port: xmpp-client (5222), Dst Port: 57261 (57261), Seq: 951, Ack: 1103, Len: 29

No.     Time        Source                Destination           Protocol Length Info
     91 55.326402   10.165.76.22          173.192.222.186       TCP      68     57261 > xmpp-client [ACK] Seq=1103 Ack=980 Win=2227 Len=0 TSval=64395 TSecr=4247083403

Frame 91: 68 bytes on wire (544 bits), 68 bytes captured (544 bits)
Linux cooked capture
Internet Protocol Version 4, Src: 10.165.76.22 (10.165.76.22), Dst: 173.192.222.186 (173.192.222.186)
Transmission Control Protocol, Src Port: 57261 (57261), Dst Port: xmpp-client (5222), Seq: 1103, Ack: 980, Len: 0

No.     Time        Source                Destination           Protocol Length Info
     92 56.040550   10.165.76.22          173.192.222.186       TCP      131    [TCP segment of a reassembled PDU]

Frame 92: 131 bytes on wire (1048 bits), 131 bytes captured (1048 bits)
Linux cooked capture
Internet Protocol Version 4, Src: 10.165.76.22 (10.165.76.22), Dst: 173.192.222.186 (173.192.222.186)
Transmission Control Protocol, Src Port: 57261 (57261), Dst Port: xmpp-client (5222), Seq: 1103, Ack: 980, Len: 63

No.     Time        Source                Destination           Protocol Length Info
     93 56.503814   173.192.222.186       10.165.76.22          TCP      112    [TCP segment of a reassembled PDU]

Frame 93: 112 bytes on wire (896 bits), 112 bytes captured (896 bits)
Linux cooked capture
Internet Protocol Version 4, Src: 173.192.222.186 (173.192.222.186), Dst: 10.165.76.22 (10.165.76.22)
Transmission Control Protocol, Src Port: xmpp-client (5222), Dst Port: 57261 (57261), Seq: 980, Ack: 1166, Len: 44

No.     Time        Source                Destination           Protocol Length Info
     94 56.504470   10.165.76.22          173.192.222.186       TCP      68     57261 > xmpp-client [ACK] Seq=1166 Ack=1024 Win=2227 Len=0 TSval=64513 TSecr=4247085839

Frame 94: 68 bytes on wire (544 bits), 68 bytes captured (544 bits)
Linux cooked capture
Internet Protocol Version 4, Src: 10.165.76.22 (10.165.76.22), Dst: 173.192.222.186 (173.192.222.186)
Transmission Control Protocol, Src Port: 57261 (57261), Dst Port: xmpp-client (5222), Seq: 1166, Ack: 1024, Len: 0

No.     Time        Source                Destination           Protocol Length Info
     95 57.123769   173.192.222.186       10.165.76.22          TCP      110    [TCP segment of a reassembled PDU]

Frame 95: 110 bytes on wire (880 bits), 110 bytes captured (880 bits)
Linux cooked capture
Internet Protocol Version 4, Src: 173.192.222.186 (173.192.222.186), Dst: 10.165.76.22 (10.165.76.22)
Transmission Control Protocol, Src Port: xmpp-client (5222), Dst Port: 57261 (57261), Seq: 1024, Ack: 1166, Len: 42

No.     Time        Source                Destination           Protocol Length Info
     96 57.124409   10.165.76.22          173.192.222.186       TCP      68     57261 > xmpp-client [ACK] Seq=1166 Ack=1066 Win=2227 Len=0 TSval=64575 TSecr=4247086463

Frame 96: 68 bytes on wire (544 bits), 68 bytes captured (544 bits)
Linux cooked capture
Internet Protocol Version 4, Src: 10.165.76.22 (10.165.76.22), Dst: 173.192.222.186 (173.192.222.186)
Transmission Control Protocol, Src Port: 57261 (57261), Dst Port: xmpp-client (5222), Seq: 1166, Ack: 1066, Len: 0

No.     Time        Source                Destination           Protocol Length Info
     97 57.140004   10.165.76.22          173.192.222.186       TCP      112    [TCP segment of a reassembled PDU]

Frame 97: 112 bytes on wire (896 bits), 112 bytes captured (896 bits)
Linux cooked capture
Internet Protocol Version 4, Src: 10.165.76.22 (10.165.76.22), Dst: 173.192.222.186 (173.192.222.186)
Transmission Control Protocol, Src Port: 57261 (57261), Dst Port: xmpp-client (5222), Seq: 1166, Ack: 1066, Len: 44

No.     Time        Source                Destination           Protocol Length Info
     98 57.923747   173.192.222.186       10.165.76.22          TCP      68     xmpp-client > 57261 [ACK] Seq=1066 Ack=1210 Win=512 Len=0 TSval=4247087265 TSecr=64577

Frame 98: 68 bytes on wire (544 bits), 68 bytes captured (544 bits)
Linux cooked capture
Internet Protocol Version 4, Src: 173.192.222.186 (173.192.222.186), Dst: 10.165.76.22 (10.165.76.22)
Transmission Control Protocol, Src Port: xmpp-client (5222), Dst Port: 57261 (57261), Seq: 1066, Ack: 1210, Len: 0
