No.     Time        Source                Destination           Protocol Length Info
      1 0.000000    FonTechn_a5:e9:81     Spanning-tree-(for-bridges)_00 STP      52     Conf. Root = 32768/0/00:18:84:a5:e9:80  Cost = 0  Port = 0x8002

Frame 1: 52 bytes on wire (416 bits), 52 bytes captured (416 bits)
IEEE 802.3 Ethernet 
Logical-Link Control
Spanning Tree Protocol

No.     Time        Source                Destination           Protocol Length Info
      2 1.433556    FonTechn_a5:e9:80     SamsungE_24:63:41     ARP      42     Who has 192.168.1.101?  Tell 192.168.1.1

Frame 2: 42 bytes on wire (336 bits), 42 bytes captured (336 bits)
Ethernet II, Src: FonTechn_a5:e9:80 (00:18:84:a5:e9:80), Dst: SamsungE_24:63:41 (cc:05:1b:24:63:41)
Address Resolution Protocol (request)

No.     Time        Source                Destination           Protocol Length Info
      3 1.433628    aa:aa:03:00:00:00     1b:24:63:41:00:24     ARP      42     192.168.1.101 is at cc:05:1b:24:63:41

Frame 3: 42 bytes on wire (336 bits), 42 bytes captured (336 bits)
Ethernet II, Src: aa:aa:03:00:00:00 (aa:aa:03:00:00:00), Dst: 1b:24:63:41:00:24 (1b:24:63:41:00:24)
Address Resolution Protocol (reply)

No.     Time        Source                Destination           Protocol Length Info
      4 4.891238    192.168.1.101         173.194.116.179       TLSv1    93     Encrypted Alert

Frame 4: 93 bytes on wire (744 bits), 93 bytes captured (744 bits)
Ethernet II, Src: aa:aa:03:00:00:00 (aa:aa:03:00:00:00), Dst: 1b:24:63:41:00:57 (1b:24:63:41:00:57)
Internet Protocol Version 4, Src: 192.168.1.101 (192.168.1.101), Dst: 173.194.116.179 (173.194.116.179)
Transmission Control Protocol, Src Port: 49902 (49902), Dst Port: https (443), Seq: 1, Ack: 1, Len: 27
Secure Sockets Layer

No.     Time        Source                Destination           Protocol Length Info
      5 4.893753    192.168.1.101         173.194.116.179       TCP      66     49902 > https [FIN, ACK] Seq=28 Ack=1 Win=2163 Len=0 TSval=1735571 TSecr=1176327736

Frame 5: 66 bytes on wire (528 bits), 66 bytes captured (528 bits)
Ethernet II, Src: aa:aa:03:00:00:00 (aa:aa:03:00:00:00), Dst: 1b:24:63:41:00:3c (1b:24:63:41:00:3c)
Internet Protocol Version 4, Src: 192.168.1.101 (192.168.1.101), Dst: 173.194.116.179 (173.194.116.179)
Transmission Control Protocol, Src Port: 49902 (49902), Dst Port: https (443), Seq: 28, Ack: 1, Len: 0

No.     Time        Source                Destination           Protocol Length Info
      6 4.986781    173.194.116.179       192.168.1.101         TCP      66     https > 49902 [FIN, ACK] Seq=1 Ack=29 Win=670 Len=0 TSval=1176336367 TSecr=1735570

Frame 6: 66 bytes on wire (528 bits), 66 bytes captured (528 bits)
Ethernet II, Src: FonTechn_a5:e9:80 (00:18:84:a5:e9:80), Dst: SamsungE_24:63:41 (cc:05:1b:24:63:41)
Internet Protocol Version 4, Src: 173.194.116.179 (173.194.116.179), Dst: 192.168.1.101 (192.168.1.101)
Transmission Control Protocol, Src Port: https (443), Dst Port: 49902 (49902), Seq: 1, Ack: 29, Len: 0

No.     Time        Source                Destination           Protocol Length Info
      7 5.063375    192.168.1.101         173.194.116.179       TCP      66     49902 > https [ACK] Seq=29 Ack=2 Win=2163 Len=0 TSval=1735588 TSecr=1176336367

Frame 7: 66 bytes on wire (528 bits), 66 bytes captured (528 bits)
Ethernet II, Src: aa:aa:03:00:00:00 (aa:aa:03:00:00:00), Dst: 1b:24:63:41:00:3c (1b:24:63:41:00:3c)
Internet Protocol Version 4, Src: 192.168.1.101 (192.168.1.101), Dst: 173.194.116.179 (173.194.116.179)
Transmission Control Protocol, Src Port: 49902 (49902), Dst Port: https (443), Seq: 29, Ack: 2, Len: 0

No.     Time        Source                Destination           Protocol Length Info
      8 7.437050    192.168.1.101         65.55.174.170         TLSv1    103    Application Data

Frame 8: 103 bytes on wire (824 bits), 103 bytes captured (824 bits)
Ethernet II, Src: aa:aa:03:00:00:00 (aa:aa:03:00:00:00), Dst: 1b:24:63:41:00:61 (1b:24:63:41:00:61)
Internet Protocol Version 4, Src: 192.168.1.101 (192.168.1.101), Dst: 65.55.174.170 (65.55.174.170)
Transmission Control Protocol, Src Port: 49941 (49941), Dst Port: imaps (993), Seq: 1, Ack: 1, Len: 37
Secure Sockets Layer

No.     Time        Source                Destination           Protocol Length Info
      9 7.616155    192.168.1.101         88.149.128.12         DNS      79     Standard query 0x0650  A static.ak.fbcdn.net

Frame 9: 79 bytes on wire (632 bits), 79 bytes captured (632 bits)
Ethernet II, Src: aa:aa:03:00:00:00 (aa:aa:03:00:00:00), Dst: 1b:24:63:41:00:49 (1b:24:63:41:00:49)
Internet Protocol Version 4, Src: 192.168.1.101 (192.168.1.101), Dst: 88.149.128.12 (88.149.128.12)
User Datagram Protocol, Src Port: proactivesrvr (2722), Dst Port: domain (53)
Domain Name System (query)

No.     Time        Source                Destination           Protocol Length Info
     10 7.989453    FonTechn_a5:e9:81     Spanning-tree-(for-bridges)_00 STP      52     Conf. Root = 32768/0/00:18:84:a5:e9:80  Cost = 0  Port = 0x8002

Frame 10: 52 bytes on wire (416 bits), 52 bytes captured (416 bits)
IEEE 802.3 Ethernet 
Logical-Link Control
Spanning Tree Protocol

No.     Time        Source                Destination           Protocol Length Info
     11 8.089886    88.149.128.12         192.168.1.101         DNS      189    Standard query response 0x0650  CNAME static.ak.facebook.com.edgesuite.net CNAME a749.dsw4.akamai.net A 88.149.196.144 A 88.149.196.147

Frame 11: 189 bytes on wire (1512 bits), 189 bytes captured (1512 bits)
Ethernet II, Src: FonTechn_a5:e9:80 (00:18:84:a5:e9:80), Dst: SamsungE_24:63:41 (cc:05:1b:24:63:41)
Internet Protocol Version 4, Src: 88.149.128.12 (88.149.128.12), Dst: 192.168.1.101 (192.168.1.101)
User Datagram Protocol, Src Port: domain (53), Dst Port: proactivesrvr (2722)
Domain Name System (response)

No.     Time        Source                Destination           Protocol Length Info
     12 8.091818    65.55.174.170         192.168.1.101         TLSv1    119    Application Data

Frame 12: 119 bytes on wire (952 bits), 119 bytes captured (952 bits)
Ethernet II, Src: FonTechn_a5:e9:80 (00:18:84:a5:e9:80), Dst: SamsungE_24:63:41 (cc:05:1b:24:63:41)
Internet Protocol Version 4, Src: 65.55.174.170 (65.55.174.170), Dst: 192.168.1.101 (192.168.1.101)
Transmission Control Protocol, Src Port: imaps (993), Dst Port: 49941 (49941), Seq: 1, Ack: 38, Len: 53
Secure Sockets Layer

No.     Time        Source                Destination           Protocol Length Info
     13 8.092010    192.168.1.101         65.55.174.170         TCP      66     49941 > imaps [ACK] Seq=38 Ack=54 Win=2536 Len=0 TSval=1735890 TSecr=85366299

Frame 13: 66 bytes on wire (528 bits), 66 bytes captured (528 bits)
Ethernet II, Src: aa:aa:03:00:00:00 (aa:aa:03:00:00:00), Dst: 1b:24:63:41:00:3c (1b:24:63:41:00:3c)
Internet Protocol Version 4, Src: 192.168.1.101 (192.168.1.101), Dst: 65.55.174.170 (65.55.174.170)
Transmission Control Protocol, Src Port: 49941 (49941), Dst Port: imaps (993), Seq: 38, Ack: 54, Len: 0

No.     Time        Source                Destination           Protocol Length Info
     14 8.096566    192.168.1.101         65.55.174.170         TLSv1    119    Application Data

Frame 14: 119 bytes on wire (952 bits), 119 bytes captured (952 bits)
Ethernet II, Src: aa:aa:03:00:00:00 (aa:aa:03:00:00:00), Dst: 1b:24:63:41:00:71 (1b:24:63:41:00:71)
Internet Protocol Version 4, Src: 192.168.1.101 (192.168.1.101), Dst: 65.55.174.170 (65.55.174.170)
Transmission Control Protocol, Src Port: 49941 (49941), Dst Port: imaps (993), Seq: 38, Ack: 54, Len: 53
Secure Sockets Layer

No.     Time        Source                Destination           Protocol Length Info
     15 8.098870    192.168.1.101         88.149.196.144        TCP      74     56976 > http [SYN] Seq=0 Win=5840 Len=0 MSS=1460 SACK_PERM=1 TSval=1735891 TSecr=0 WS=8

Frame 15: 74 bytes on wire (592 bits), 74 bytes captured (592 bits)
Ethernet II, Src: aa:aa:03:00:00:00 (aa:aa:03:00:00:00), Dst: 1b:24:63:41:00:44 (1b:24:63:41:00:44)
Internet Protocol Version 4, Src: 192.168.1.101 (192.168.1.101), Dst: 88.149.196.144 (88.149.196.144)
Transmission Control Protocol, Src Port: 56976 (56976), Dst Port: http (80), Seq: 0, Len: 0

No.     Time        Source                Destination           Protocol Length Info
     16 8.206498    88.149.196.144        192.168.1.101         TCP      74     http > 56976 [SYN, ACK] Seq=0 Ack=1 Win=14480 Len=0 MSS=1452 SACK_PERM=1 TSval=1234451608 TSecr=1735891 WS=2

Frame 16: 74 bytes on wire (592 bits), 74 bytes captured (592 bits)
Ethernet II, Src: FonTechn_a5:e9:80 (00:18:84:a5:e9:80), Dst: SamsungE_24:63:41 (cc:05:1b:24:63:41)
Internet Protocol Version 4, Src: 88.149.196.144 (88.149.196.144), Dst: 192.168.1.101 (192.168.1.101)
Transmission Control Protocol, Src Port: http (80), Dst Port: 56976 (56976), Seq: 0, Ack: 1, Len: 0

No.     Time        Source                Destination           Protocol Length Info
     17 8.206753    192.168.1.101         88.149.196.144        TCP      66     56976 > http [ACK] Seq=1 Ack=1 Win=5840 Len=0 TSval=1735902 TSecr=1234451608

Frame 17: 66 bytes on wire (528 bits), 66 bytes captured (528 bits)
Ethernet II, Src: aa:aa:03:00:00:00 (aa:aa:03:00:00:00), Dst: 1b:24:63:41:00:3c (1b:24:63:41:00:3c)
Internet Protocol Version 4, Src: 192.168.1.101 (192.168.1.101), Dst: 88.149.196.144 (88.149.196.144)
Transmission Control Protocol, Src Port: 56976 (56976), Dst Port: http (80), Seq: 1, Ack: 1, Len: 0

No.     Time        Source                Destination           Protocol Length Info
     18 8.209688    192.168.1.101         88.149.196.144        HTTP     925    GET /rsrc.php/v2/ym/r/3oMmlQdugzF.js HTTP/1.1 

Frame 18: 925 bytes on wire (7400 bits), 925 bytes captured (7400 bits)
Ethernet II, Src: aa:aa:03:00:00:00 (aa:aa:03:00:00:00), Dst: 1b:24:63:41:03:97 (1b:24:63:41:03:97)
Internet Protocol Version 4, Src: 192.168.1.101 (192.168.1.101), Dst: 88.149.196.144 (88.149.196.144)
Transmission Control Protocol, Src Port: 56976 (56976), Dst Port: http (80), Seq: 1, Ack: 1, Len: 859
Hypertext Transfer Protocol

No.     Time        Source                Destination           Protocol Length Info
     19 8.286796    88.149.196.144        192.168.1.101         TCP      66     http > 56976 [ACK] Seq=1 Ack=860 Win=16198 Len=0 TSval=1234451689 TSecr=1735902

Frame 19: 66 bytes on wire (528 bits), 66 bytes captured (528 bits)
Ethernet II, Src: FonTechn_a5:e9:80 (00:18:84:a5:e9:80), Dst: SamsungE_24:63:41 (cc:05:1b:24:63:41)
Internet Protocol Version 4, Src: 88.149.196.144 (88.149.196.144), Dst: 192.168.1.101 (192.168.1.101)
Transmission Control Protocol, Src Port: http (80), Dst Port: 56976 (56976), Seq: 1, Ack: 860, Len: 0

No.     Time        Source                Destination           Protocol Length Info
     20 8.288978    88.149.196.144        192.168.1.101         TCP      1506   [TCP segment of a reassembled PDU]

Frame 20: 1506 bytes on wire (12048 bits), 1506 bytes captured (12048 bits)
Ethernet II, Src: FonTechn_a5:e9:80 (00:18:84:a5:e9:80), Dst: SamsungE_24:63:41 (cc:05:1b:24:63:41)
Internet Protocol Version 4, Src: 88.149.196.144 (88.149.196.144), Dst: 192.168.1.101 (192.168.1.101)
Transmission Control Protocol, Src Port: http (80), Dst Port: 56976 (56976), Seq: 1, Ack: 860, Len: 1440

No.     Time        Source                Destination           Protocol Length Info
     21 8.289526    192.168.1.101         88.149.196.144        TCP      66     56976 > http [ACK] Seq=860 Ack=1441 Win=8736 Len=0 TSval=1735910 TSecr=1234451690

Frame 21: 66 bytes on wire (528 bits), 66 bytes captured (528 bits)
Ethernet II, Src: aa:aa:03:00:00:00 (aa:aa:03:00:00:00), Dst: 1b:24:63:41:00:3c (1b:24:63:41:00:3c)
Internet Protocol Version 4, Src: 192.168.1.101 (192.168.1.101), Dst: 88.149.196.144 (88.149.196.144)
Transmission Control Protocol, Src Port: 56976 (56976), Dst Port: http (80), Seq: 860, Ack: 1441, Len: 0

No.     Time        Source                Destination           Protocol Length Info
     22 8.290278    88.149.196.144        192.168.1.101         TCP      1506   [TCP segment of a reassembled PDU]

Frame 22: 1506 bytes on wire (12048 bits), 1506 bytes captured (12048 bits)
Ethernet II, Src: FonTechn_a5:e9:80 (00:18:84:a5:e9:80), Dst: SamsungE_24:63:41 (cc:05:1b:24:63:41)
Internet Protocol Version 4, Src: 88.149.196.144 (88.149.196.144), Dst: 192.168.1.101 (192.168.1.101)
Transmission Control Protocol, Src Port: http (80), Dst Port: 56976 (56976), Seq: 1441, Ack: 860, Len: 1440

No.     Time        Source                Destination           Protocol Length Info
     23 8.290405    192.168.1.101         88.149.196.144        TCP      66     56976 > http [ACK] Seq=860 Ack=2881 Win=11632 Len=0 TSval=1735910 TSecr=1234451690

Frame 23: 66 bytes on wire (528 bits), 66 bytes captured (528 bits)
Ethernet II, Src: aa:aa:03:00:00:00 (aa:aa:03:00:00:00), Dst: 1b:24:63:41:00:3c (1b:24:63:41:00:3c)
Internet Protocol Version 4, Src: 192.168.1.101 (192.168.1.101), Dst: 88.149.196.144 (88.149.196.144)
Transmission Control Protocol, Src Port: 56976 (56976), Dst Port: http (80), Seq: 860, Ack: 2881, Len: 0

No.     Time        Source                Destination           Protocol Length Info
     24 8.294850    88.149.196.144        192.168.1.101         TCP      1506   [TCP segment of a reassembled PDU]

Frame 24: 1506 bytes on wire (12048 bits), 1506 bytes captured (12048 bits)
Ethernet II, Src: FonTechn_a5:e9:80 (00:18:84:a5:e9:80), Dst: SamsungE_24:63:41 (cc:05:1b:24:63:41)
Internet Protocol Version 4, Src: 88.149.196.144 (88.149.196.144), Dst: 192.168.1.101 (192.168.1.101)
Transmission Control Protocol, Src Port: http (80), Dst Port: 56976 (56976), Seq: 2881, Ack: 860, Len: 1440

No.     Time        Source                Destination           Protocol Length Info
     25 8.295025    192.168.1.101         88.149.196.144        TCP      66     56976 > http [ACK] Seq=860 Ack=4321 Win=14528 Len=0 TSval=1735911 TSecr=1234451690

Frame 25: 66 bytes on wire (528 bits), 66 bytes captured (528 bits)
Ethernet II, Src: aa:aa:03:00:00:00 (aa:aa:03:00:00:00), Dst: 1b:24:63:41:00:3c (1b:24:63:41:00:3c)
Internet Protocol Version 4, Src: 192.168.1.101 (192.168.1.101), Dst: 88.149.196.144 (88.149.196.144)
Transmission Control Protocol, Src Port: 56976 (56976), Dst Port: http (80), Seq: 860, Ack: 4321, Len: 0

No.     Time        Source                Destination           Protocol Length Info
     26 8.296050    88.149.196.144        192.168.1.101         TCP      1506   [TCP segment of a reassembled PDU]

Frame 26: 1506 bytes on wire (12048 bits), 1506 bytes captured (12048 bits)
Ethernet II, Src: FonTechn_a5:e9:80 (00:18:84:a5:e9:80), Dst: SamsungE_24:63:41 (cc:05:1b:24:63:41)
Internet Protocol Version 4, Src: 88.149.196.144 (88.149.196.144), Dst: 192.168.1.101 (192.168.1.101)
Transmission Control Protocol, Src Port: http (80), Dst Port: 56976 (56976), Seq: 4321, Ack: 860, Len: 1440

No.     Time        Source                Destination           Protocol Length Info
     27 8.296188    192.168.1.101         88.149.196.144        TCP      66     56976 > http [ACK] Seq=860 Ack=5761 Win=17424 Len=0 TSval=1735911 TSecr=1234451690

Frame 27: 66 bytes on wire (528 bits), 66 bytes captured (528 bits)
Ethernet II, Src: aa:aa:03:00:00:00 (aa:aa:03:00:00:00), Dst: 1b:24:63:41:00:3c (1b:24:63:41:00:3c)
Internet Protocol Version 4, Src: 192.168.1.101 (192.168.1.101), Dst: 88.149.196.144 (88.149.196.144)
Transmission Control Protocol, Src Port: 56976 (56976), Dst Port: http (80), Seq: 860, Ack: 5761, Len: 0

No.     Time        Source                Destination           Protocol Length Info
     28 8.348990    88.149.196.144        192.168.1.101         TCP      1506   [TCP segment of a reassembled PDU]

Frame 28: 1506 bytes on wire (12048 bits), 1506 bytes captured (12048 bits)
Ethernet II, Src: FonTechn_a5:e9:80 (00:18:84:a5:e9:80), Dst: SamsungE_24:63:41 (cc:05:1b:24:63:41)
Internet Protocol Version 4, Src: 88.149.196.144 (88.149.196.144), Dst: 192.168.1.101 (192.168.1.101)
Transmission Control Protocol, Src Port: http (80), Dst Port: 56976 (56976), Seq: 5761, Ack: 860, Len: 1440

No.     Time        Source                Destination           Protocol Length Info
     29 8.349373    192.168.1.101         88.149.196.144        TCP      66     56976 > http [ACK] Seq=860 Ack=7201 Win=20320 Len=0 TSval=1735916 TSecr=1234451749

Frame 29: 66 bytes on wire (528 bits), 66 bytes captured (528 bits)
Ethernet II, Src: aa:aa:03:00:00:00 (aa:aa:03:00:00:00), Dst: 1b:24:63:41:00:3c (1b:24:63:41:00:3c)
Internet Protocol Version 4, Src: 192.168.1.101 (192.168.1.101), Dst: 88.149.196.144 (88.149.196.144)
Transmission Control Protocol, Src Port: 56976 (56976), Dst Port: http (80), Seq: 860, Ack: 7201, Len: 0

No.     Time        Source                Destination           Protocol Length Info
     30 8.350200    88.149.196.144        192.168.1.101         TCP      1506   [TCP segment of a reassembled PDU]

Frame 30: 1506 bytes on wire (12048 bits), 1506 bytes captured (12048 bits)
Ethernet II, Src: FonTechn_a5:e9:80 (00:18:84:a5:e9:80), Dst: SamsungE_24:63:41 (cc:05:1b:24:63:41)
Internet Protocol Version 4, Src: 88.149.196.144 (88.149.196.144), Dst: 192.168.1.101 (192.168.1.101)
Transmission Control Protocol, Src Port: http (80), Dst Port: 56976 (56976), Seq: 7201, Ack: 860, Len: 1440

No.     Time        Source                Destination           Protocol Length Info
     31 8.350330    192.168.1.101         88.149.196.144        TCP      66     56976 > http [ACK] Seq=860 Ack=8641 Win=23216 Len=0 TSval=1735916 TSecr=1234451749

Frame 31: 66 bytes on wire (528 bits), 66 bytes captured (528 bits)
Ethernet II, Src: aa:aa:03:00:00:00 (aa:aa:03:00:00:00), Dst: 1b:24:63:41:00:3c (1b:24:63:41:00:3c)
Internet Protocol Version 4, Src: 192.168.1.101 (192.168.1.101), Dst: 88.149.196.144 (88.149.196.144)
Transmission Control Protocol, Src Port: 56976 (56976), Dst Port: http (80), Seq: 860, Ack: 8641, Len: 0

No.     Time        Source                Destination           Protocol Length Info
     32 8.351945    88.149.196.144        192.168.1.101         TCP      1506   [TCP segment of a reassembled PDU]

Frame 32: 1506 bytes on wire (12048 bits), 1506 bytes captured (12048 bits)
Ethernet II, Src: FonTechn_a5:e9:80 (00:18:84:a5:e9:80), Dst: SamsungE_24:63:41 (cc:05:1b:24:63:41)
Internet Protocol Version 4, Src: 88.149.196.144 (88.149.196.144), Dst: 192.168.1.101 (192.168.1.101)
Transmission Control Protocol, Src Port: http (80), Dst Port: 56976 (56976), Seq: 8641, Ack: 860, Len: 1440

No.     Time        Source                Destination           Protocol Length Info
     33 8.352081    192.168.1.101         88.149.196.144        TCP      66     56976 > http [ACK] Seq=860 Ack=10081 Win=26112 Len=0 TSval=1735916 TSecr=1234451749

Frame 33: 66 bytes on wire (528 bits), 66 bytes captured (528 bits)
Ethernet II, Src: aa:aa:03:00:00:00 (aa:aa:03:00:00:00), Dst: 1b:24:63:41:00:3c (1b:24:63:41:00:3c)
Internet Protocol Version 4, Src: 192.168.1.101 (192.168.1.101), Dst: 88.149.196.144 (88.149.196.144)
Transmission Control Protocol, Src Port: 56976 (56976), Dst Port: http (80), Seq: 860, Ack: 10081, Len: 0

No.     Time        Source                Destination           Protocol Length Info
     34 8.353260    88.149.196.144        192.168.1.101         TCP      1506   [TCP segment of a reassembled PDU]

Frame 34: 1506 bytes on wire (12048 bits), 1506 bytes captured (12048 bits)
Ethernet II, Src: FonTechn_a5:e9:80 (00:18:84:a5:e9:80), Dst: SamsungE_24:63:41 (cc:05:1b:24:63:41)
Internet Protocol Version 4, Src: 88.149.196.144 (88.149.196.144), Dst: 192.168.1.101 (192.168.1.101)
Transmission Control Protocol, Src Port: http (80), Dst Port: 56976 (56976), Seq: 10081, Ack: 860, Len: 1440

No.     Time        Source                Destination           Protocol Length Info
     35 8.353390    192.168.1.101         88.149.196.144        TCP      66     56976 > http [ACK] Seq=860 Ack=11521 Win=29008 Len=0 TSval=1735917 TSecr=1234451749

Frame 35: 66 bytes on wire (528 bits), 66 bytes captured (528 bits)
Ethernet II, Src: aa:aa:03:00:00:00 (aa:aa:03:00:00:00), Dst: 1b:24:63:41:00:3c (1b:24:63:41:00:3c)
Internet Protocol Version 4, Src: 192.168.1.101 (192.168.1.101), Dst: 88.149.196.144 (88.149.196.144)
Transmission Control Protocol, Src Port: 56976 (56976), Dst Port: http (80), Seq: 860, Ack: 11521, Len: 0

No.     Time        Source                Destination           Protocol Length Info
     36 8.354750    88.149.196.144        192.168.1.101         TCP      1506   [TCP segment of a reassembled PDU]

Frame 36: 1506 bytes on wire (12048 bits), 1506 bytes captured (12048 bits)
Ethernet II, Src: FonTechn_a5:e9:80 (00:18:84:a5:e9:80), Dst: SamsungE_24:63:41 (cc:05:1b:24:63:41)
Internet Protocol Version 4, Src: 88.149.196.144 (88.149.196.144), Dst: 192.168.1.101 (192.168.1.101)
Transmission Control Protocol, Src Port: http (80), Dst Port: 56976 (56976), Seq: 11521, Ack: 860, Len: 1440

No.     Time        Source                Destination           Protocol Length Info
     37 8.354898    192.168.1.101         88.149.196.144        TCP      66     56976 > http [ACK] Seq=860 Ack=12961 Win=31904 Len=0 TSval=1735917 TSecr=1234451749

Frame 37: 66 bytes on wire (528 bits), 66 bytes captured (528 bits)
Ethernet II, Src: aa:aa:03:00:00:00 (aa:aa:03:00:00:00), Dst: 1b:24:63:41:00:3c (1b:24:63:41:00:3c)
Internet Protocol Version 4, Src: 192.168.1.101 (192.168.1.101), Dst: 88.149.196.144 (88.149.196.144)
Transmission Control Protocol, Src Port: 56976 (56976), Dst Port: http (80), Seq: 860, Ack: 12961, Len: 0

No.     Time        Source                Destination           Protocol Length Info
     38 8.356051    88.149.196.144        192.168.1.101         TCP      1506   [TCP segment of a reassembled PDU]

Frame 38: 1506 bytes on wire (12048 bits), 1506 bytes captured (12048 bits)
Ethernet II, Src: FonTechn_a5:e9:80 (00:18:84:a5:e9:80), Dst: SamsungE_24:63:41 (cc:05:1b:24:63:41)
Internet Protocol Version 4, Src: 88.149.196.144 (88.149.196.144), Dst: 192.168.1.101 (192.168.1.101)
Transmission Control Protocol, Src Port: http (80), Dst Port: 56976 (56976), Seq: 12961, Ack: 860, Len: 1440

No.     Time        Source                Destination           Protocol Length Info
     39 8.356181    192.168.1.101         88.149.196.144        TCP      66     56976 > http [ACK] Seq=860 Ack=14401 Win=34800 Len=0 TSval=1735917 TSecr=1234451749

Frame 39: 66 bytes on wire (528 bits), 66 bytes captured (528 bits)
Ethernet II, Src: aa:aa:03:00:00:00 (aa:aa:03:00:00:00), Dst: 1b:24:63:41:00:3c (1b:24:63:41:00:3c)
Internet Protocol Version 4, Src: 192.168.1.101 (192.168.1.101), Dst: 88.149.196.144 (88.149.196.144)
Transmission Control Protocol, Src Port: 56976 (56976), Dst Port: http (80), Seq: 860, Ack: 14401, Len: 0

No.     Time        Source                Destination           Protocol Length Info
     40 8.390856    88.149.196.144        192.168.1.101         TCP      1506   [TCP segment of a reassembled PDU]

Frame 40: 1506 bytes on wire (12048 bits), 1506 bytes captured (12048 bits)
Ethernet II, Src: FonTechn_a5:e9:80 (00:18:84:a5:e9:80), Dst: SamsungE_24:63:41 (cc:05:1b:24:63:41)
Internet Protocol Version 4, Src: 88.149.196.144 (88.149.196.144), Dst: 192.168.1.101 (192.168.1.101)
Transmission Control Protocol, Src Port: http (80), Dst Port: 56976 (56976), Seq: 14401, Ack: 860, Len: 1440

No.     Time        Source                Destination           Protocol Length Info
     41 8.391653    88.149.196.144        192.168.1.101         TCP      1506   [TCP segment of a reassembled PDU]

Frame 41: 1506 bytes on wire (12048 bits), 1506 bytes captured (12048 bits)
Ethernet II, Src: FonTechn_a5:e9:80 (00:18:84:a5:e9:80), Dst: SamsungE_24:63:41 (cc:05:1b:24:63:41)
Internet Protocol Version 4, Src: 88.149.196.144 (88.149.196.144), Dst: 192.168.1.101 (192.168.1.101)
Transmission Control Protocol, Src Port: http (80), Dst Port: 56976 (56976), Seq: 15841, Ack: 860, Len: 1440

No.     Time        Source                Destination           Protocol Length Info
     42 8.392131    88.149.196.144        192.168.1.101         TCP      1506   [TCP segment of a reassembled PDU]

Frame 42: 1506 bytes on wire (12048 bits), 1506 bytes captured (12048 bits)
Ethernet II, Src: FonTechn_a5:e9:80 (00:18:84:a5:e9:80), Dst: SamsungE_24:63:41 (cc:05:1b:24:63:41)
Internet Protocol Version 4, Src: 88.149.196.144 (88.149.196.144), Dst: 192.168.1.101 (192.168.1.101)
Transmission Control Protocol, Src Port: http (80), Dst Port: 56976 (56976), Seq: 17281, Ack: 860, Len: 1440

No.     Time        Source                Destination           Protocol Length Info
     43 8.404610    192.168.1.101         88.149.196.144        TCP      66     56976 > http [ACK] Seq=860 Ack=15841 Win=37696 Len=0 TSval=1735922 TSecr=1234451783

Frame 43: 66 bytes on wire (528 bits), 66 bytes captured (528 bits)
Ethernet II, Src: aa:aa:03:00:00:00 (aa:aa:03:00:00:00), Dst: 1b:24:63:41:00:3c (1b:24:63:41:00:3c)
Internet Protocol Version 4, Src: 192.168.1.101 (192.168.1.101), Dst: 88.149.196.144 (88.149.196.144)
Transmission Control Protocol, Src Port: 56976 (56976), Dst Port: http (80), Seq: 860, Ack: 15841, Len: 0

No.     Time        Source                Destination           Protocol Length Info
     44 8.404968    192.168.1.101         88.149.196.144        TCP      66     56976 > http [ACK] Seq=860 Ack=17281 Win=40592 Len=0 TSval=1735922 TSecr=1234451783

Frame 44: 66 bytes on wire (528 bits), 66 bytes captured (528 bits)
Ethernet II, Src: aa:aa:03:00:00:00 (aa:aa:03:00:00:00), Dst: 1b:24:63:41:00:3c (1b:24:63:41:00:3c)
Internet Protocol Version 4, Src: 192.168.1.101 (192.168.1.101), Dst: 88.149.196.144 (88.149.196.144)
Transmission Control Protocol, Src Port: 56976 (56976), Dst Port: http (80), Seq: 860, Ack: 17281, Len: 0

No.     Time        Source                Destination           Protocol Length Info
     45 8.405180    192.168.1.101         88.149.196.144        TCP      66     56976 > http [ACK] Seq=860 Ack=18721 Win=42248 Len=0 TSval=1735922 TSecr=1234451783

Frame 45: 66 bytes on wire (528 bits), 66 bytes captured (528 bits)
Ethernet II, Src: aa:aa:03:00:00:00 (aa:aa:03:00:00:00), Dst: 1b:24:63:41:00:3c (1b:24:63:41:00:3c)
Internet Protocol Version 4, Src: 192.168.1.101 (192.168.1.101), Dst: 88.149.196.144 (88.149.196.144)
Transmission Control Protocol, Src Port: 56976 (56976), Dst Port: http (80), Seq: 860, Ack: 18721, Len: 0

No.     Time        Source                Destination           Protocol Length Info
     46 8.503523    88.149.196.144        192.168.1.101         TCP      1506   [TCP segment of a reassembled PDU]

Frame 46: 1506 bytes on wire (12048 bits), 1506 bytes captured (12048 bits)
Ethernet II, Src: FonTechn_a5:e9:80 (00:18:84:a5:e9:80), Dst: SamsungE_24:63:41 (cc:05:1b:24:63:41)
Internet Protocol Version 4, Src: 88.149.196.144 (88.149.196.144), Dst: 192.168.1.101 (192.168.1.101)
Transmission Control Protocol, Src Port: http (80), Dst Port: 56976 (56976), Seq: 18721, Ack: 860, Len: 1440

No.     Time        Source                Destination           Protocol Length Info
     47 8.504103    192.168.1.101         88.149.196.144        TCP      66     56976 > http [ACK] Seq=860 Ack=20161 Win=42248 Len=0 TSval=1735932 TSecr=1234451900

Frame 47: 66 bytes on wire (528 bits), 66 bytes captured (528 bits)
Ethernet II, Src: aa:aa:03:00:00:00 (aa:aa:03:00:00:00), Dst: 1b:24:63:41:00:3c (1b:24:63:41:00:3c)
Internet Protocol Version 4, Src: 192.168.1.101 (192.168.1.101), Dst: 88.149.196.144 (88.149.196.144)
Transmission Control Protocol, Src Port: 56976 (56976), Dst Port: http (80), Seq: 860, Ack: 20161, Len: 0

No.     Time        Source                Destination           Protocol Length Info
     48 8.504620    88.149.196.144        192.168.1.101         TCP      1506   [TCP segment of a reassembled PDU]

Frame 48: 1506 bytes on wire (12048 bits), 1506 bytes captured (12048 bits)
Ethernet II, Src: FonTechn_a5:e9:80 (00:18:84:a5:e9:80), Dst: SamsungE_24:63:41 (cc:05:1b:24:63:41)
Internet Protocol Version 4, Src: 88.149.196.144 (88.149.196.144), Dst: 192.168.1.101 (192.168.1.101)
Transmission Control Protocol, Src Port: http (80), Dst Port: 56976 (56976), Seq: 20161, Ack: 860, Len: 1440

No.     Time        Source                Destination           Protocol Length Info
     49 8.505186    192.168.1.101         88.149.196.144        TCP      66     56976 > http [ACK] Seq=860 Ack=21601 Win=42248 Len=0 TSval=1735932 TSecr=1234451900

Frame 49: 66 bytes on wire (528 bits), 66 bytes captured (528 bits)
Ethernet II, Src: aa:aa:03:00:00:00 (aa:aa:03:00:00:00), Dst: 1b:24:63:41:00:3c (1b:24:63:41:00:3c)
Internet Protocol Version 4, Src: 192.168.1.101 (192.168.1.101), Dst: 88.149.196.144 (88.149.196.144)
Transmission Control Protocol, Src Port: 56976 (56976), Dst Port: http (80), Seq: 860, Ack: 21601, Len: 0

No.     Time        Source                Destination           Protocol Length Info
     50 8.507671    88.149.196.144        192.168.1.101         TCP      1506   [TCP segment of a reassembled PDU]

Frame 50: 1506 bytes on wire (12048 bits), 1506 bytes captured (12048 bits)
Ethernet II, Src: FonTechn_a5:e9:80 (00:18:84:a5:e9:80), Dst: SamsungE_24:63:41 (cc:05:1b:24:63:41)
Internet Protocol Version 4, Src: 88.149.196.144 (88.149.196.144), Dst: 192.168.1.101 (192.168.1.101)
Transmission Control Protocol, Src Port: http (80), Dst Port: 56976 (56976), Seq: 21601, Ack: 860, Len: 1440

No.     Time        Source                Destination           Protocol Length Info
     51 8.508965    88.149.196.144        192.168.1.101         TCP      1506   [TCP segment of a reassembled PDU]

Frame 51: 1506 bytes on wire (12048 bits), 1506 bytes captured (12048 bits)
Ethernet II, Src: FonTechn_a5:e9:80 (00:18:84:a5:e9:80), Dst: SamsungE_24:63:41 (cc:05:1b:24:63:41)
Internet Protocol Version 4, Src: 88.149.196.144 (88.149.196.144), Dst: 192.168.1.101 (192.168.1.101)
Transmission Control Protocol, Src Port: http (80), Dst Port: 56976 (56976), Seq: 23041, Ack: 860, Len: 1440

No.     Time        Source                Destination           Protocol Length Info
     52 8.509396    192.168.1.101         88.149.196.144        TCP      66     56976 > http [ACK] Seq=860 Ack=24481 Win=42248 Len=0 TSval=1735932 TSecr=1234451900

Frame 52: 66 bytes on wire (528 bits), 66 bytes captured (528 bits)
Ethernet II, Src: aa:aa:03:00:00:00 (aa:aa:03:00:00:00), Dst: 1b:24:63:41:00:3c (1b:24:63:41:00:3c)
Internet Protocol Version 4, Src: 192.168.1.101 (192.168.1.101), Dst: 88.149.196.144 (88.149.196.144)
Transmission Control Protocol, Src Port: 56976 (56976), Dst Port: http (80), Seq: 860, Ack: 24481, Len: 0

No.     Time        Source                Destination           Protocol Length Info
     53 8.510586    88.149.196.144        192.168.1.101         TCP      1506   [TCP segment of a reassembled PDU]

Frame 53: 1506 bytes on wire (12048 bits), 1506 bytes captured (12048 bits)
Ethernet II, Src: FonTechn_a5:e9:80 (00:18:84:a5:e9:80), Dst: SamsungE_24:63:41 (cc:05:1b:24:63:41)
Internet Protocol Version 4, Src: 88.149.196.144 (88.149.196.144), Dst: 192.168.1.101 (192.168.1.101)
Transmission Control Protocol, Src Port: http (80), Dst Port: 56976 (56976), Seq: 24481, Ack: 860, Len: 1440

No.     Time        Source                Destination           Protocol Length Info
     54 8.511953    88.149.196.144        192.168.1.101         TCP      1506   [TCP segment of a reassembled PDU]

Frame 54: 1506 bytes on wire (12048 bits), 1506 bytes captured (12048 bits)
Ethernet II, Src: FonTechn_a5:e9:80 (00:18:84:a5:e9:80), Dst: SamsungE_24:63:41 (cc:05:1b:24:63:41)
Internet Protocol Version 4, Src: 88.149.196.144 (88.149.196.144), Dst: 192.168.1.101 (192.168.1.101)
Transmission Control Protocol, Src Port: http (80), Dst Port: 56976 (56976), Seq: 25921, Ack: 860, Len: 1440

No.     Time        Source                Destination           Protocol Length Info
     55 8.512090    192.168.1.101         88.149.196.144        TCP      66     56976 > http [ACK] Seq=860 Ack=27361 Win=42248 Len=0 TSval=1735932 TSecr=1234451900

Frame 55: 66 bytes on wire (528 bits), 66 bytes captured (528 bits)
Ethernet II, Src: aa:aa:03:00:00:00 (aa:aa:03:00:00:00), Dst: 1b:24:63:41:00:3c (1b:24:63:41:00:3c)
Internet Protocol Version 4, Src: 192.168.1.101 (192.168.1.101), Dst: 88.149.196.144 (88.149.196.144)
Transmission Control Protocol, Src Port: 56976 (56976), Dst Port: http (80), Seq: 860, Ack: 27361, Len: 0

No.     Time        Source                Destination           Protocol Length Info
     56 8.514985    88.149.196.144        192.168.1.101         TCP      1506   [TCP segment of a reassembled PDU]

Frame 56: 1506 bytes on wire (12048 bits), 1506 bytes captured (12048 bits)
Ethernet II, Src: FonTechn_a5:e9:80 (00:18:84:a5:e9:80), Dst: SamsungE_24:63:41 (cc:05:1b:24:63:41)
Internet Protocol Version 4, Src: 88.149.196.144 (88.149.196.144), Dst: 192.168.1.101 (192.168.1.101)
Transmission Control Protocol, Src Port: http (80), Dst Port: 56976 (56976), Seq: 27361, Ack: 860, Len: 1440

No.     Time        Source                Destination           Protocol Length Info
     57 8.516290    88.149.196.144        192.168.1.101         TCP      1506   [TCP segment of a reassembled PDU]

Frame 57: 1506 bytes on wire (12048 bits), 1506 bytes captured (12048 bits)
Ethernet II, Src: FonTechn_a5:e9:80 (00:18:84:a5:e9:80), Dst: SamsungE_24:63:41 (cc:05:1b:24:63:41)
Internet Protocol Version 4, Src: 88.149.196.144 (88.149.196.144), Dst: 192.168.1.101 (192.168.1.101)
Transmission Control Protocol, Src Port: http (80), Dst Port: 56976 (56976), Seq: 28801, Ack: 860, Len: 1440

No.     Time        Source                Destination           Protocol Length Info
     58 8.516413    192.168.1.101         88.149.196.144        TCP      66     56976 > http [ACK] Seq=860 Ack=30241 Win=42248 Len=0 TSval=1735933 TSecr=1234451900

Frame 58: 66 bytes on wire (528 bits), 66 bytes captured (528 bits)
Ethernet II, Src: aa:aa:03:00:00:00 (aa:aa:03:00:00:00), Dst: 1b:24:63:41:00:3c (1b:24:63:41:00:3c)
Internet Protocol Version 4, Src: 192.168.1.101 (192.168.1.101), Dst: 88.149.196.144 (88.149.196.144)
Transmission Control Protocol, Src Port: 56976 (56976), Dst Port: http (80), Seq: 860, Ack: 30241, Len: 0

No.     Time        Source                Destination           Protocol Length Info
     59 8.518073    88.149.196.144        192.168.1.101         TCP      1506   [TCP segment of a reassembled PDU]

Frame 59: 1506 bytes on wire (12048 bits), 1506 bytes captured (12048 bits)
Ethernet II, Src: FonTechn_a5:e9:80 (00:18:84:a5:e9:80), Dst: SamsungE_24:63:41 (cc:05:1b:24:63:41)
Internet Protocol Version 4, Src: 88.149.196.144 (88.149.196.144), Dst: 192.168.1.101 (192.168.1.101)
Transmission Control Protocol, Src Port: http (80), Dst Port: 56976 (56976), Seq: 30241, Ack: 860, Len: 1440

No.     Time        Source                Destination           Protocol Length Info
     60 8.521221    88.149.196.144        192.168.1.101         TCP      1506   [TCP segment of a reassembled PDU]

Frame 60: 1506 bytes on wire (12048 bits), 1506 bytes captured (12048 bits)
Ethernet II, Src: FonTechn_a5:e9:80 (00:18:84:a5:e9:80), Dst: SamsungE_24:63:41 (cc:05:1b:24:63:41)
Internet Protocol Version 4, Src: 88.149.196.144 (88.149.196.144), Dst: 192.168.1.101 (192.168.1.101)
Transmission Control Protocol, Src Port: http (80), Dst Port: 56976 (56976), Seq: 31681, Ack: 860, Len: 1440

No.     Time        Source                Destination           Protocol Length Info
     61 8.521540    88.149.196.144        192.168.1.101         TCP      1506   [TCP segment of a reassembled PDU]

Frame 61: 1506 bytes on wire (12048 bits), 1506 bytes captured (12048 bits)
Ethernet II, Src: FonTechn_a5:e9:80 (00:18:84:a5:e9:80), Dst: SamsungE_24:63:41 (cc:05:1b:24:63:41)
Internet Protocol Version 4, Src: 88.149.196.144 (88.149.196.144), Dst: 192.168.1.101 (192.168.1.101)
Transmission Control Protocol, Src Port: http (80), Dst Port: 56976 (56976), Seq: 33121, Ack: 860, Len: 1440

No.     Time        Source                Destination           Protocol Length Info
     62 8.523581    88.149.196.144        192.168.1.101         TCP      1506   [TCP segment of a reassembled PDU]

Frame 62: 1506 bytes on wire (12048 bits), 1506 bytes captured (12048 bits)
Ethernet II, Src: FonTechn_a5:e9:80 (00:18:84:a5:e9:80), Dst: SamsungE_24:63:41 (cc:05:1b:24:63:41)
Internet Protocol Version 4, Src: 88.149.196.144 (88.149.196.144), Dst: 192.168.1.101 (192.168.1.101)
Transmission Control Protocol, Src Port: http (80), Dst Port: 56976 (56976), Seq: 34561, Ack: 860, Len: 1440

No.     Time        Source                Destination           Protocol Length Info
     63 8.524263    88.149.196.144        192.168.1.101         TCP      1506   [TCP segment of a reassembled PDU]

Frame 63: 1506 bytes on wire (12048 bits), 1506 bytes captured (12048 bits)
Ethernet II, Src: FonTechn_a5:e9:80 (00:18:84:a5:e9:80), Dst: SamsungE_24:63:41 (cc:05:1b:24:63:41)
Internet Protocol Version 4, Src: 88.149.196.144 (88.149.196.144), Dst: 192.168.1.101 (192.168.1.101)
Transmission Control Protocol, Src Port: http (80), Dst Port: 56976 (56976), Seq: 36001, Ack: 860, Len: 1440

No.     Time        Source                Destination           Protocol Length Info
     64 8.525388    88.149.196.144        192.168.1.101         TCP      1506   [TCP segment of a reassembled PDU]

Frame 64: 1506 bytes on wire (12048 bits), 1506 bytes captured (12048 bits)
Ethernet II, Src: FonTechn_a5:e9:80 (00:18:84:a5:e9:80), Dst: SamsungE_24:63:41 (cc:05:1b:24:63:41)
Internet Protocol Version 4, Src: 88.149.196.144 (88.149.196.144), Dst: 192.168.1.101 (192.168.1.101)
Transmission Control Protocol, Src Port: http (80), Dst Port: 56976 (56976), Seq: 37441, Ack: 860, Len: 1440

No.     Time        Source                Destination           Protocol Length Info
     65 8.528063    88.149.196.144        192.168.1.101         TCP      1506   [TCP segment of a reassembled PDU]

Frame 65: 1506 bytes on wire (12048 bits), 1506 bytes captured (12048 bits)
Ethernet II, Src: FonTechn_a5:e9:80 (00:18:84:a5:e9:80), Dst: SamsungE_24:63:41 (cc:05:1b:24:63:41)
Internet Protocol Version 4, Src: 88.149.196.144 (88.149.196.144), Dst: 192.168.1.101 (192.168.1.101)
Transmission Control Protocol, Src Port: http (80), Dst Port: 56976 (56976), Seq: 38881, Ack: 860, Len: 1440

No.     Time        Source                Destination           Protocol Length Info
     66 8.529285    88.149.196.144        192.168.1.101         TCP      1506   [TCP segment of a reassembled PDU]

Frame 66: 1506 bytes on wire (12048 bits), 1506 bytes captured (12048 bits)
Ethernet II, Src: FonTechn_a5:e9:80 (00:18:84:a5:e9:80), Dst: SamsungE_24:63:41 (cc:05:1b:24:63:41)
Internet Protocol Version 4, Src: 88.149.196.144 (88.149.196.144), Dst: 192.168.1.101 (192.168.1.101)
Transmission Control Protocol, Src Port: http (80), Dst Port: 56976 (56976), Seq: 40321, Ack: 860, Len: 1440

No.     Time        Source                Destination           Protocol Length Info
     67 8.530740    88.149.196.144        192.168.1.101         TCP      1506   [TCP segment of a reassembled PDU]

Frame 67: 1506 bytes on wire (12048 bits), 1506 bytes captured (12048 bits)
Ethernet II, Src: FonTechn_a5:e9:80 (00:18:84:a5:e9:80), Dst: SamsungE_24:63:41 (cc:05:1b:24:63:41)
Internet Protocol Version 4, Src: 88.149.196.144 (88.149.196.144), Dst: 192.168.1.101 (192.168.1.101)
Transmission Control Protocol, Src Port: http (80), Dst Port: 56976 (56976), Seq: 41761, Ack: 860, Len: 1440

No.     Time        Source                Destination           Protocol Length Info
     68 8.532108    88.149.196.144        192.168.1.101         TCP      1506   [TCP segment of a reassembled PDU]

Frame 68: 1506 bytes on wire (12048 bits), 1506 bytes captured (12048 bits)
