No.     Time        Source                Destination           Protocol Length Info
      1 0.000000    37.176.195.31         83.224.70.94          DNS      76     Standard query 0xa1f4  A www.google.com

Frame 1: 76 bytes on wire (608 bits), 76 bytes captured (608 bits)
Linux cooked capture
Internet Protocol Version 4, Src: 37.176.195.31 (37.176.195.31), Dst: 83.224.70.94 (83.224.70.94)
User Datagram Protocol, Src Port: 42333 (42333), Dst Port: domain (53)
Domain Name System (query)

No.     Time        Source                Destination           Protocol Length Info
      2 0.318271    83.224.70.94          37.176.195.31         DNS      156    Standard query response 0xa1f4  A 173.194.40.144 A 173.194.40.147 A 173.194.40.146 A 173.194.40.145 A 173.194.40.148

Frame 2: 156 bytes on wire (1248 bits), 156 bytes captured (1248 bits)
Linux cooked capture
Internet Protocol Version 4, Src: 83.224.70.94 (83.224.70.94), Dst: 37.176.195.31 (37.176.195.31)
User Datagram Protocol, Src Port: domain (53), Dst Port: 42333 (42333)
Domain Name System (response)

No.     Time        Source                Destination           Protocol Length Info
      3 0.359690    37.176.195.31         173.194.40.144        TCP      76     52516 > http [SYN] Seq=0 Win=3930 Len=0 MSS=1310 SACK_PERM=1 TSval=1760981 TSecr=0 WS=2

Frame 3: 76 bytes on wire (608 bits), 76 bytes captured (608 bits)
Linux cooked capture
Internet Protocol Version 4, Src: 37.176.195.31 (37.176.195.31), Dst: 173.194.40.144 (173.194.40.144)
Transmission Control Protocol, Src Port: 52516 (52516), Dst Port: http (80), Seq: 0, Len: 0

No.     Time        Source                Destination           Protocol Length Info
      4 0.638193    173.194.40.144        37.176.195.31         TCP      80     http > 52516 [SYN, ACK] Seq=0 Ack=1 Win=64251 Len=0 TSval=246475433 TSecr=1760981 MSS=1400 WS=4 SACK_PERM=1

Frame 4: 80 bytes on wire (640 bits), 80 bytes captured (640 bits)
Linux cooked capture
Internet Protocol Version 4, Src: 173.194.40.144 (173.194.40.144), Dst: 37.176.195.31 (37.176.195.31)
Transmission Control Protocol, Src Port: http (80), Dst Port: 52516 (52516), Seq: 0, Ack: 1, Len: 0

No.     Time        Source                Destination           Protocol Length Info
      5 0.638791    37.176.195.31         173.194.40.144        TCP      68     52516 > http [ACK] Seq=1 Ack=1 Win=3930 Len=0 TSval=1761009 TSecr=246475433

Frame 5: 68 bytes on wire (544 bits), 68 bytes captured (544 bits)
Linux cooked capture
Internet Protocol Version 4, Src: 37.176.195.31 (37.176.195.31), Dst: 173.194.40.144 (173.194.40.144)
Transmission Control Protocol, Src Port: 52516 (52516), Dst Port: http (80), Seq: 1, Ack: 1, Len: 0

No.     Time        Source                Destination           Protocol Length Info
      6 0.654872    37.176.195.31         173.194.40.144        TCP      303    [TCP segment of a reassembled PDU]

Frame 6: 303 bytes on wire (2424 bits), 303 bytes captured (2424 bits)
Linux cooked capture
Internet Protocol Version 4, Src: 37.176.195.31 (37.176.195.31), Dst: 173.194.40.144 (173.194.40.144)
Transmission Control Protocol, Src Port: 52516 (52516), Dst Port: http (80), Seq: 1, Ack: 1, Len: 235

No.     Time        Source                Destination           Protocol Length Info
      7 0.655472    37.176.195.31         173.194.40.144        TCP      1366   [TCP segment of a reassembled PDU]

Frame 7: 1366 bytes on wire (10928 bits), 1366 bytes captured (10928 bits)
Linux cooked capture
Internet Protocol Version 4, Src: 37.176.195.31 (37.176.195.31), Dst: 173.194.40.144 (173.194.40.144)
Transmission Control Protocol, Src Port: 52516 (52516), Dst Port: http (80), Seq: 236, Ack: 1, Len: 1298

No.     Time        Source                Destination           Protocol Length Info
      8 0.655862    37.176.195.31         173.194.40.144        TCP      1366   [TCP segment of a reassembled PDU]

Frame 8: 1366 bytes on wire (10928 bits), 1366 bytes captured (10928 bits)
Linux cooked capture
Internet Protocol Version 4, Src: 37.176.195.31 (37.176.195.31), Dst: 173.194.40.144 (173.194.40.144)
Transmission Control Protocol, Src Port: 52516 (52516), Dst Port: http (80), Seq: 1534, Ack: 1, Len: 1298

No.     Time        Source                Destination           Protocol Length Info
      9 1.491645    37.176.195.31         173.194.40.144        TCP      303    [TCP Retransmission] 52516 > http [PSH, ACK] Seq=1 Ack=1 Win=3930 Len=235 TSval=1761095 TSecr=246475433

Frame 9: 303 bytes on wire (2424 bits), 303 bytes captured (2424 bits)
Linux cooked capture
Internet Protocol Version 4, Src: 37.176.195.31 (37.176.195.31), Dst: 173.194.40.144 (173.194.40.144)
Transmission Control Protocol, Src Port: 52516 (52516), Dst Port: http (80), Seq: 1, Ack: 1, Len: 235

No.     Time        Source                Destination           Protocol Length Info
     10 1.554197    173.194.40.144        37.176.195.31         TCP      68     http > 52516 [ACK] Seq=1 Ack=236 Win=257004 Len=0 TSval=246475532 TSecr=1761011

Frame 10: 68 bytes on wire (544 bits), 68 bytes captured (544 bits)
Linux cooked capture
Internet Protocol Version 4, Src: 173.194.40.144 (173.194.40.144), Dst: 37.176.195.31 (37.176.195.31)
Transmission Control Protocol, Src Port: http (80), Dst Port: 52516 (52516), Seq: 1, Ack: 236, Len: 0

No.     Time        Source                Destination           Protocol Length Info
     11 1.554515    37.176.195.31         173.194.40.144        TCP      1366   [TCP segment of a reassembled PDU]

Frame 11: 1366 bytes on wire (10928 bits), 1366 bytes captured (10928 bits)
Linux cooked capture
Internet Protocol Version 4, Src: 37.176.195.31 (37.176.195.31), Dst: 173.194.40.144 (173.194.40.144)
Transmission Control Protocol, Src Port: 52516 (52516), Dst Port: http (80), Seq: 2832, Ack: 1, Len: 1298

No.     Time        Source                Destination           Protocol Length Info
     12 1.554610    173.194.40.144        37.176.195.31         TCP      68     http > 52516 [ACK] Seq=1 Ack=1534 Win=255704 Len=0 TSval=246475532 TSecr=1761011

Frame 12: 68 bytes on wire (544 bits), 68 bytes captured (544 bits)
Linux cooked capture
Internet Protocol Version 4, Src: 173.194.40.144 (173.194.40.144), Dst: 37.176.195.31 (37.176.195.31)
Transmission Control Protocol, Src Port: http (80), Dst Port: 52516 (52516), Seq: 1, Ack: 1534, Len: 0

No.     Time        Source                Destination           Protocol Length Info
     13 1.555165    37.176.195.31         173.194.40.144        TCP      1366   [TCP segment of a reassembled PDU]

Frame 13: 1366 bytes on wire (10928 bits), 1366 bytes captured (10928 bits)
Linux cooked capture
Internet Protocol Version 4, Src: 37.176.195.31 (37.176.195.31), Dst: 173.194.40.144 (173.194.40.144)
Transmission Control Protocol, Src Port: 52516 (52516), Dst Port: http (80), Seq: 4130, Ack: 1, Len: 1298

No.     Time        Source                Destination           Protocol Length Info
     14 1.573983    173.194.40.144        37.176.195.31         TCP      68     http > 52516 [ACK] Seq=1 Ack=2832 Win=254408 Len=0 TSval=246475534 TSecr=1761011

Frame 14: 68 bytes on wire (544 bits), 68 bytes captured (544 bits)
Linux cooked capture
Internet Protocol Version 4, Src: 173.194.40.144 (173.194.40.144), Dst: 37.176.195.31 (37.176.195.31)
Transmission Control Protocol, Src Port: http (80), Dst Port: 52516 (52516), Seq: 1, Ack: 2832, Len: 0

No.     Time        Source                Destination           Protocol Length Info
     15 1.654308    173.194.40.144        37.176.195.31         TCP      68     http > 52516 [ACK] Seq=1 Ack=4130 Win=255704 Len=0 TSval=246475542 TSecr=1761101

Frame 15: 68 bytes on wire (544 bits), 68 bytes captured (544 bits)
Linux cooked capture
Internet Protocol Version 4, Src: 173.194.40.144 (173.194.40.144), Dst: 37.176.195.31 (37.176.195.31)
Transmission Control Protocol, Src Port: http (80), Dst Port: 52516 (52516), Seq: 1, Ack: 4130, Len: 0

No.     Time        Source                Destination           Protocol Length Info
     16 1.694035    173.194.40.144        37.176.195.31         TCP      68     http > 52516 [FIN, ACK] Seq=1 Ack=5428 Win=257004 Len=0 TSval=246475546 TSecr=1761101

Frame 16: 68 bytes on wire (544 bits), 68 bytes captured (544 bits)
Linux cooked capture
Internet Protocol Version 4, Src: 173.194.40.144 (173.194.40.144), Dst: 37.176.195.31 (37.176.195.31)
Transmission Control Protocol, Src Port: http (80), Dst Port: 52516 (52516), Seq: 1, Ack: 5428, Len: 0

No.     Time        Source                Destination           Protocol Length Info
     17 1.701542    37.176.195.31         173.194.40.144        TCP      68     52516 > http [ACK] Seq=5428 Ack=2 Win=3930 Len=0 TSval=1761116 TSecr=246475546

Frame 17: 68 bytes on wire (544 bits), 68 bytes captured (544 bits)
Linux cooked capture
Internet Protocol Version 4, Src: 37.176.195.31 (37.176.195.31), Dst: 173.194.40.144 (173.194.40.144)
Transmission Control Protocol, Src Port: 52516 (52516), Dst Port: http (80), Seq: 5428, Ack: 2, Len: 0

No.     Time        Source                Destination           Protocol Length Info
     18 1.891672    37.176.195.31         173.194.40.144        HTTP     1048   POST /m/appreq/vs HTTP/1.1  (application/binary)

Frame 18: 1048 bytes on wire (8384 bits), 1048 bytes captured (8384 bits)
Linux cooked capture
Internet Protocol Version 4, Src: 37.176.195.31 (37.176.195.31), Dst: 173.194.40.144 (173.194.40.144)
Transmission Control Protocol, Src Port: 52516 (52516), Dst Port: http (80), Seq: 5428, Ack: 2, Len: 980
[6 Reassembled TCP Segments (6407 bytes): #6(235), #7(1298), #8(1298), #11(1298), #13(1298), #18(980)]
Hypertext Transfer Protocol
Media Type

No.     Time        Source                Destination           Protocol Length Info
     19 2.003967    173.194.40.144        37.176.195.31         TCP      56     http > 52516 [RST] Seq=2 Win=257004 Len=0

Frame 19: 56 bytes on wire (448 bits), 56 bytes captured (448 bits)
Linux cooked capture
Internet Protocol Version 4, Src: 173.194.40.144 (173.194.40.144), Dst: 37.176.195.31 (37.176.195.31)
Transmission Control Protocol, Src Port: http (80), Dst Port: 52516 (52516), Seq: 2, Len: 0

No.     Time        Source                Destination           Protocol Length Info
     20 2.744213    37.176.195.31         184.173.179.40        SSL      97     Continuation Data

Frame 20: 97 bytes on wire (776 bits), 97 bytes captured (776 bits)
Linux cooked capture
Internet Protocol Version 4, Src: 37.176.195.31 (37.176.195.31), Dst: 184.173.179.40 (184.173.179.40)
Transmission Control Protocol, Src Port: 44042 (44042), Dst Port: https (443), Seq: 1, Ack: 1, Len: 29
Secure Sockets Layer

No.     Time        Source                Destination           Protocol Length Info
     21 2.963996    184.173.179.40        37.176.195.31         TCP      68     https > 44042 [ACK] Seq=1 Ack=30 Win=512 Len=0 TSval=3589322217 TSecr=1761220

Frame 21: 68 bytes on wire (544 bits), 68 bytes captured (544 bits)
Linux cooked capture
Internet Protocol Version 4, Src: 184.173.179.40 (184.173.179.40), Dst: 37.176.195.31 (37.176.195.31)
Transmission Control Protocol, Src Port: https (443), Dst Port: 44042 (44042), Seq: 1, Ack: 30, Len: 0

No.     Time        Source                Destination           Protocol Length Info
     22 2.964343    37.176.195.31         184.173.179.40        SSL      108    Continuation Data

Frame 22: 108 bytes on wire (864 bits), 108 bytes captured (864 bits)
Linux cooked capture
Internet Protocol Version 4, Src: 37.176.195.31 (37.176.195.31), Dst: 184.173.179.40 (184.173.179.40)
Transmission Control Protocol, Src Port: 44042 (44042), Dst Port: https (443), Seq: 30, Ack: 1, Len: 40
Secure Sockets Layer

No.     Time        Source                Destination           Protocol Length Info
     23 3.154135    184.173.179.40        37.176.195.31         SSL      112    Continuation Data

Frame 23: 112 bytes on wire (896 bits), 112 bytes captured (896 bits)
Linux cooked capture
Internet Protocol Version 4, Src: 184.173.179.40 (184.173.179.40), Dst: 37.176.195.31 (37.176.195.31)
Transmission Control Protocol, Src Port: https (443), Dst Port: 44042 (44042), Seq: 1, Ack: 70, Len: 44
Secure Sockets Layer

No.     Time        Source                Destination           Protocol Length Info
     24 3.154506    37.176.195.31         184.173.179.40        TCP      68     44042 > https [ACK] Seq=70 Ack=45 Win=2009 Len=0 TSval=1761261 TSecr=3589322404

Frame 24: 68 bytes on wire (544 bits), 68 bytes captured (544 bits)
Linux cooked capture
Internet Protocol Version 4, Src: 37.176.195.31 (37.176.195.31), Dst: 184.173.179.40 (184.173.179.40)
Transmission Control Protocol, Src Port: 44042 (44042), Dst Port: https (443), Seq: 70, Ack: 45, Len: 0

No.     Time        Source                Destination           Protocol Length Info
     25 5.034856    37.176.195.31         188.125.68.71         TCP      68     50734 > imaps [FIN, ACK] Seq=1 Ack=1 Win=5192 Len=0 TSval=1761449 TSecr=2684228168

Frame 25: 68 bytes on wire (544 bits), 68 bytes captured (544 bits)
Linux cooked capture
Internet Protocol Version 4, Src: 37.176.195.31 (37.176.195.31), Dst: 188.125.68.71 (188.125.68.71)
Transmission Control Protocol, Src Port: 50734 (50734), Dst Port: imaps (993), Seq: 1, Ack: 1, Len: 0

No.     Time        Source                Destination           Protocol Length Info
     26 5.183998    188.125.68.71         37.176.195.31         TCP      68     imaps > 50734 [FIN, ACK] Seq=1 Ack=2 Win=16616 Len=0 TSval=2684282772 TSecr=1761449

Frame 26: 68 bytes on wire (544 bits), 68 bytes captured (544 bits)
Linux cooked capture
Internet Protocol Version 4, Src: 188.125.68.71 (188.125.68.71), Dst: 37.176.195.31 (37.176.195.31)
Transmission Control Protocol, Src Port: imaps (993), Dst Port: 50734 (50734), Seq: 1, Ack: 2, Len: 0

No.     Time        Source                Destination           Protocol Length Info
     27 5.184255    37.176.195.31         188.125.68.71         TCP      68     50734 > imaps [ACK] Seq=2 Ack=2 Win=5192 Len=0 TSval=1761464 TSecr=2684282772

Frame 27: 68 bytes on wire (544 bits), 68 bytes captured (544 bits)
Linux cooked capture
Internet Protocol Version 4, Src: 37.176.195.31 (37.176.195.31), Dst: 188.125.68.71 (188.125.68.71)
Transmission Control Protocol, Src Port: 50734 (50734), Dst Port: imaps (993), Seq: 2, Ack: 2, Len: 0

No.     Time        Source                Destination           Protocol Length Info
     28 5.669055    37.176.195.31         184.173.179.40        SSL      80     Continuation Data

Frame 28: 80 bytes on wire (640 bits), 80 bytes captured (640 bits)
Linux cooked capture
Internet Protocol Version 4, Src: 37.176.195.31 (37.176.195.31), Dst: 184.173.179.40 (184.173.179.40)
Transmission Control Protocol, Src Port: 44042 (44042), Dst Port: https (443), Seq: 70, Ack: 45, Len: 12
Secure Sockets Layer

No.     Time        Source                Destination           Protocol Length Info
     29 5.854401    184.173.179.40        37.176.195.31         SSL      95     Continuation Data

Frame 29: 95 bytes on wire (760 bits), 95 bytes captured (760 bits)
Linux cooked capture
Internet Protocol Version 4, Src: 184.173.179.40 (184.173.179.40), Dst: 37.176.195.31 (37.176.195.31)
Transmission Control Protocol, Src Port: https (443), Dst Port: 44042 (44042), Seq: 45, Ack: 82, Len: 27
Secure Sockets Layer

No.     Time        Source                Destination           Protocol Length Info
     30 5.855341    37.176.195.31         184.173.179.40        SSL      93     Continuation Data

Frame 30: 93 bytes on wire (744 bits), 93 bytes captured (744 bits)
Linux cooked capture
Internet Protocol Version 4, Src: 37.176.195.31 (37.176.195.31), Dst: 184.173.179.40 (184.173.179.40)
Transmission Control Protocol, Src Port: 44042 (44042), Dst Port: https (443), Seq: 82, Ack: 72, Len: 25
Secure Sockets Layer

No.     Time        Source                Destination           Protocol Length Info
     31 6.043988    184.173.179.40        37.176.195.31         SSL      86     Continuation Data

Frame 31: 86 bytes on wire (688 bits), 86 bytes captured (688 bits)
Linux cooked capture
Internet Protocol Version 4, Src: 184.173.179.40 (184.173.179.40), Dst: 37.176.195.31 (37.176.195.31)
Transmission Control Protocol, Src Port: https (443), Dst Port: 44042 (44042), Seq: 72, Ack: 107, Len: 18
Secure Sockets Layer

No.     Time        Source                Destination           Protocol Length Info
     32 6.081643    37.176.195.31         184.173.179.40        TCP      68     44042 > https [ACK] Seq=107 Ack=90 Win=2009 Len=0 TSval=1761554 TSecr=3589325298

Frame 32: 68 bytes on wire (544 bits), 68 bytes captured (544 bits)
Linux cooked capture
Internet Protocol Version 4, Src: 37.176.195.31 (37.176.195.31), Dst: 184.173.179.40 (184.173.179.40)
Transmission Control Protocol, Src Port: 44042 (44042), Dst Port: https (443), Seq: 107, Ack: 90, Len: 0

No.     Time        Source                Destination           Protocol Length Info
     33 8.120480    37.176.195.31         184.173.179.40        SSL      125    Continuation Data

Frame 33: 125 bytes on wire (1000 bits), 125 bytes captured (1000 bits)
Linux cooked capture
Internet Protocol Version 4, Src: 37.176.195.31 (37.176.195.31), Dst: 184.173.179.40 (184.173.179.40)
Transmission Control Protocol, Src Port: 44042 (44042), Dst Port: https (443), Seq: 107, Ack: 90, Len: 57
Secure Sockets Layer

No.     Time        Source                Destination           Protocol Length Info
     34 8.314181    184.173.179.40        37.176.195.31         SSL      112    Continuation Data

Frame 34: 112 bytes on wire (896 bits), 112 bytes captured (896 bits)
Linux cooked capture
Internet Protocol Version 4, Src: 184.173.179.40 (184.173.179.40), Dst: 37.176.195.31 (37.176.195.31)
Transmission Control Protocol, Src Port: https (443), Dst Port: 44042 (44042), Seq: 90, Ack: 164, Len: 44
Secure Sockets Layer

No.     Time        Source                Destination           Protocol Length Info
     35 8.314856    37.176.195.31         184.173.179.40        TCP      68     44042 > https [ACK] Seq=164 Ack=134 Win=2009 Len=0 TSval=1761777 TSecr=3589327567

Frame 35: 68 bytes on wire (544 bits), 68 bytes captured (544 bits)
Linux cooked capture
Internet Protocol Version 4, Src: 37.176.195.31 (37.176.195.31), Dst: 184.173.179.40 (184.173.179.40)
Transmission Control Protocol, Src Port: 44042 (44042), Dst Port: https (443), Seq: 164, Ack: 134, Len: 0

No.     Time        Source                Destination           Protocol Length Info
     36 8.854165    173.194.35.164        37.176.195.31         TCP      68     https > 45209 [FIN, ACK] Seq=1 Ack=1 Win=670 Len=0 TSval=2314140078 TSecr=1747751

Frame 36: 68 bytes on wire (544 bits), 68 bytes captured (544 bits)
Linux cooked capture
Internet Protocol Version 4, Src: 173.194.35.164 (173.194.35.164), Dst: 37.176.195.31 (37.176.195.31)
Transmission Control Protocol, Src Port: https (443), Dst Port: 45209 (45209), Seq: 1, Ack: 1, Len: 0

No.     Time        Source                Destination           Protocol Length Info
     37 8.891585    37.176.195.31         173.194.35.164        TCP      68     45209 > https [ACK] Seq=1 Ack=2 Win=2920 Len=0 TSval=1761835 TSecr=2314140078

Frame 37: 68 bytes on wire (544 bits), 68 bytes captured (544 bits)
Linux cooked capture
Internet Protocol Version 4, Src: 37.176.195.31 (37.176.195.31), Dst: 173.194.35.164 (173.194.35.164)
Transmission Control Protocol, Src Port: 45209 (45209), Dst Port: https (443), Seq: 1, Ack: 2, Len: 0

No.     Time        Source                Destination           Protocol Length Info
     38 52.804896   37.176.195.31         184.173.179.40        SSL      139    Continuation Data

Frame 38: 139 bytes on wire (1112 bits), 139 bytes captured (1112 bits)
Linux cooked capture
Internet Protocol Version 4, Src: 37.176.195.31 (37.176.195.31), Dst: 184.173.179.40 (184.173.179.40)
Transmission Control Protocol, Src Port: 44042 (44042), Dst Port: https (443), Seq: 164, Ack: 134, Len: 71
Secure Sockets Layer

No.     Time        Source                Destination           Protocol Length Info
     39 53.698270   184.173.179.40        37.176.195.31         SSL      112    Continuation Data

Frame 39: 112 bytes on wire (896 bits), 112 bytes captured (896 bits)
Linux cooked capture
Internet Protocol Version 4, Src: 184.173.179.40 (184.173.179.40), Dst: 37.176.195.31 (37.176.195.31)
Transmission Control Protocol, Src Port: https (443), Dst Port: 44042 (44042), Seq: 134, Ack: 235, Len: 44
Secure Sockets Layer

No.     Time        Source                Destination           Protocol Length Info
     40 53.698551   37.176.195.31         184.173.179.40        TCP      68     44042 > https [ACK] Seq=235 Ack=178 Win=2009 Len=0 TSval=1766315 TSecr=3589372877

Frame 40: 68 bytes on wire (544 bits), 68 bytes captured (544 bits)
Linux cooked capture
Internet Protocol Version 4, Src: 37.176.195.31 (37.176.195.31), Dst: 184.173.179.40 (184.173.179.40)
Transmission Control Protocol, Src Port: 44042 (44042), Dst Port: https (443), Seq: 235, Ack: 178, Len: 0

No.     Time        Source                Destination           Protocol Length Info
     41 63.205755   37.176.195.31         184.173.179.40        SSL      166    Continuation Data

Frame 41: 166 bytes on wire (1328 bits), 166 bytes captured (1328 bits)
Linux cooked capture
Internet Protocol Version 4, Src: 37.176.195.31 (37.176.195.31), Dst: 184.173.179.40 (184.173.179.40)
Transmission Control Protocol, Src Port: 44042 (44042), Dst Port: https (443), Seq: 235, Ack: 178, Len: 98
Secure Sockets Layer

No.     Time        Source                Destination           Protocol Length Info
     42 63.828591   184.173.179.40        37.176.195.31         SSL      112    Continuation Data

Frame 42: 112 bytes on wire (896 bits), 112 bytes captured (896 bits)
Linux cooked capture
Internet Protocol Version 4, Src: 184.173.179.40 (184.173.179.40), Dst: 37.176.195.31 (37.176.195.31)
Transmission Control Protocol, Src Port: https (443), Dst Port: 44042 (44042), Seq: 178, Ack: 333, Len: 44
Secure Sockets Layer

No.     Time        Source                Destination           Protocol Length Info
     43 63.829293   37.176.195.31         184.173.179.40        TCP      68     44042 > https [ACK] Seq=333 Ack=222 Win=2009 Len=0 TSval=1767328 TSecr=3589382951

Frame 43: 68 bytes on wire (544 bits), 68 bytes captured (544 bits)
Linux cooked capture
Internet Protocol Version 4, Src: 37.176.195.31 (37.176.195.31), Dst: 184.173.179.40 (184.173.179.40)
Transmission Control Protocol, Src Port: 44042 (44042), Dst Port: https (443), Seq: 333, Ack: 222, Len: 0

No.     Time        Source                Destination           Protocol Length Info
     44 66.343620   37.176.195.31         69.171.235.48         TLSv1    95     Application Data

Frame 44: 95 bytes on wire (760 bits), 95 bytes captured (760 bits)
Linux cooked capture
Internet Protocol Version 4, Src: 37.176.195.31 (37.176.195.31), Dst: 69.171.235.48 (69.171.235.48)
Transmission Control Protocol, Src Port: 43721 (43721), Dst Port: https (443), Seq: 1, Ack: 1, Len: 27
Secure Sockets Layer

No.     Time        Source                Destination           Protocol Length Info
     45 66.798335   69.171.235.48         37.176.195.31         TCP      68     https > 43721 [ACK] Seq=1 Ack=28 Win=92 Len=0 TSval=1878627199 TSecr=1767580

Frame 45: 68 bytes on wire (544 bits), 68 bytes captured (544 bits)
Linux cooked capture
Internet Protocol Version 4, Src: 69.171.235.48 (69.171.235.48), Dst: 37.176.195.31 (37.176.195.31)
Transmission Control Protocol, Src Port: https (443), Dst Port: 43721 (43721), Seq: 1, Ack: 28, Len: 0

No.     Time        Source                Destination           Protocol Length Info
     46 66.818351   69.171.235.48         37.176.195.31         TLSv1    95     Application Data

Frame 46: 95 bytes on wire (760 bits), 95 bytes captured (760 bits)
Linux cooked capture
Internet Protocol Version 4, Src: 69.171.235.48 (69.171.235.48), Dst: 37.176.195.31 (37.176.195.31)
Transmission Control Protocol, Src Port: https (443), Dst Port: 43721 (43721), Seq: 1, Ack: 28, Len: 27
Secure Sockets Layer

No.     Time        Source                Destination           Protocol Length Info
     47 66.818573   37.176.195.31         69.171.235.48         TCP      68     43721 > https [ACK] Seq=28 Ack=28 Win=1965 Len=0 TSval=1767627 TSecr=1878627199

Frame 47: 68 bytes on wire (544 bits), 68 bytes captured (544 bits)
Linux cooked capture
Internet Protocol Version 4, Src: 37.176.195.31 (37.176.195.31), Dst: 69.171.235.48 (69.171.235.48)
Transmission Control Protocol, Src Port: 43721 (43721), Dst Port: https (443), Seq: 28, Ack: 28, Len: 0

No.     Time        Source                Destination           Protocol Length Info
     48 107.842245  37.176.195.31         184.173.179.40        SSL      80     Continuation Data

Frame 48: 80 bytes on wire (640 bits), 80 bytes captured (640 bits)
Linux cooked capture
Internet Protocol Version 4, Src: 37.176.195.31 (37.176.195.31), Dst: 184.173.179.40 (184.173.179.40)
Transmission Control Protocol, Src Port: 44042 (44042), Dst Port: https (443), Seq: 333, Ack: 222, Len: 12
Secure Sockets Layer

No.     Time        Source                Destination           Protocol Length Info
     49 108.570823  184.173.179.40        37.176.195.31         SSL      97     Continuation Data

Frame 49: 97 bytes on wire (776 bits), 97 bytes captured (776 bits)
Linux cooked capture
Internet Protocol Version 4, Src: 184.173.179.40 (184.173.179.40), Dst: 37.176.195.31 (37.176.195.31)
Transmission Control Protocol, Src Port: https (443), Dst Port: 44042 (44042), Seq: 222, Ack: 345, Len: 29
Secure Sockets Layer

No.     Time        Source                Destination           Protocol Length Info
     50 108.571170  37.176.195.31         184.173.179.40        TCP      68     44042 > https [ACK] Seq=345 Ack=251 Win=2009 Len=0 TSval=1770902 TSecr=3589427726

Frame 50: 68 bytes on wire (544 bits), 68 bytes captured (544 bits)
Linux cooked capture
Internet Protocol Version 4, Src: 37.176.195.31 (37.176.195.31), Dst: 184.173.179.40 (184.173.179.40)
Transmission Control Protocol, Src Port: 44042 (44042), Dst Port: https (443), Seq: 345, Ack: 251, Len: 0

No.     Time        Source                Destination           Protocol Length Info
     51 108.628470  37.176.195.31         184.173.179.40        SSL      97     Continuation Data

Frame 51: 97 bytes on wire (776 bits), 97 bytes captured (776 bits)
Linux cooked capture
Internet Protocol Version 4, Src: 37.176.195.31 (37.176.195.31), Dst: 184.173.179.40 (184.173.179.40)
Transmission Control Protocol, Src Port: 44042 (44042), Dst Port: https (443), Seq: 345, Ack: 251, Len: 29
Secure Sockets Layer

No.     Time        Source                Destination           Protocol Length Info
     52 109.191040  184.173.179.40        37.176.195.31         TCP      68     https > 44042 [ACK] Seq=251 Ack=374 Win=512 Len=0 TSval=3589428352 TSecr=1770908

Frame 52: 68 bytes on wire (544 bits), 68 bytes captured (544 bits)
Linux cooked capture
Internet Protocol Version 4, Src: 184.173.179.40 (184.173.179.40), Dst: 37.176.195.31 (37.176.195.31)
Transmission Control Protocol, Src Port: https (443), Dst Port: 44042 (44042), Seq: 251, Ack: 374, Len: 0

No.     Time        Source                Destination           Protocol Length Info
     53 109.191416  37.176.195.31         184.173.179.40        SSL      108    Continuation Data

Frame 53: 108 bytes on wire (864 bits), 108 bytes captured (864 bits)
Linux cooked capture
Internet Protocol Version 4, Src: 37.176.195.31 (37.176.195.31), Dst: 184.173.179.40 (184.173.179.40)
Transmission Control Protocol, Src Port: 44042 (44042), Dst Port: https (443), Seq: 374, Ack: 251, Len: 40
Secure Sockets Layer

No.     Time        Source                Destination           Protocol Length Info
     54 110.403138  37.176.195.31         173.194.40.144        TCP      76     36332 > http [SYN] Seq=0 Win=3930 Len=0 MSS=1310 SACK_PERM=1 TSval=1771085 TSecr=0 WS=2

Frame 54: 76 bytes on wire (608 bits), 76 bytes captured (608 bits)
Linux cooked capture
Internet Protocol Version 4, Src: 37.176.195.31 (37.176.195.31), Dst: 173.194.40.144 (173.194.40.144)
Transmission Control Protocol, Src Port: 36332 (36332), Dst Port: http (80), Seq: 0, Len: 0

No.     Time        Source                Destination           Protocol Length Info
     55 111.887340  37.176.195.31         184.173.179.40        SSL      108    [TCP Retransmission] Continuation Data

Frame 55: 108 bytes on wire (864 bits), 108 bytes captured (864 bits)
Linux cooked capture
Internet Protocol Version 4, Src: 37.176.195.31 (37.176.195.31), Dst: 184.173.179.40 (184.173.179.40)
Transmission Control Protocol, Src Port: 44042 (44042), Dst Port: https (443), Seq: 374, Ack: 251, Len: 40
Secure Sockets Layer

No.     Time        Source                Destination           Protocol Length Info
     56 111.991198  173.194.40.144        37.176.195.31         TCP      80     http > 36332 [SYN, ACK] Seq=0 Ack=1 Win=64251 Len=0 TSval=246486566 TSecr=1771085 MSS=1400 WS=4 SACK_PERM=1

Frame 56: 80 bytes on wire (640 bits), 80 bytes captured (640 bits)
Linux cooked capture
Internet Protocol Version 4, Src: 173.194.40.144 (173.194.40.144), Dst: 37.176.195.31 (37.176.195.31)
Transmission Control Protocol, Src Port: http (80), Dst Port: 36332 (36332), Seq: 0, Ack: 1, Len: 0

No.     Time        Source                Destination           Protocol Length Info
     57 111.991586  37.176.195.31         173.194.40.144        TCP      68     36332 > http [ACK] Seq=1 Ack=1 Win=3930 Len=0 TSval=1771244 TSecr=246486566

Frame 57: 68 bytes on wire (544 bits), 68 bytes captured (544 bits)
Linux cooked capture
Internet Protocol Version 4, Src: 37.176.195.31 (37.176.195.31), Dst: 173.194.40.144 (173.194.40.144)
Transmission Control Protocol, Src Port: 36332 (36332), Dst Port: http (80), Seq: 1, Ack: 1, Len: 0

No.     Time        Source                Destination           Protocol Length Info
     58 112.008076  37.176.195.31         173.194.40.144        TCP      303    [TCP segment of a reassembled PDU]

Frame 58: 303 bytes on wire (2424 bits), 303 bytes captured (2424 bits)
Linux cooked capture
Internet Protocol Version 4, Src: 37.176.195.31 (37.176.195.31), Dst: 173.194.40.144 (173.194.40.144)
Transmission Control Protocol, Src Port: 36332 (36332), Dst Port: http (80), Seq: 1, Ack: 1, Len: 235

No.     Time        Source                Destination           Protocol Length Info
     59 112.008645  37.176.195.31         173.194.40.144        TCP      1366   [TCP segment of a reassembled PDU]

Frame 59: 1366 bytes on wire (10928 bits), 1366 bytes captured (10928 bits)
Linux cooked capture
Internet Protocol Version 4, Src: 37.176.195.31 (37.176.195.31), Dst: 173.194.40.144 (173.194.40.144)
Transmission Control Protocol, Src Port: 36332 (36332), Dst Port: http (80), Seq: 236, Ack: 1, Len: 1298

No.     Time        Source                Destination           Protocol Length Info
     60 112.009058  37.176.195.31         173.194.40.144        TCP      1366   [TCP segment of a reassembled PDU]

Frame 60: 1366 bytes on wire (10928 bits), 1366 bytes captured (10928 bits)
Linux cooked capture
Internet Protocol Version 4, Src: 37.176.195.31 (37.176.195.31), Dst: 173.194.40.144 (173.194.40.144)
Transmission Control Protocol, Src Port: 36332 (36332), Dst Port: http (80), Seq: 1534, Ack: 1, Len: 1298

No.     Time        Source                Destination           Protocol Length Info
     61 112.111120  184.173.179.40        37.176.195.31         SSL      112    Continuation Data

Frame 61: 112 bytes on wire (896 bits), 112 bytes captured (896 bits)
Linux cooked capture
Internet Protocol Version 4, Src: 184.173.179.40 (184.173.179.40), Dst: 37.176.195.31 (37.176.195.31)
Transmission Control Protocol, Src Port: https (443), Dst Port: 44042 (44042), Seq: 251, Ack: 414, Len: 44
Secure Sockets Layer

No.     Time        Source                Destination           Protocol Length Info
     62 112.111783  37.176.195.31         184.173.179.40        SSL      105    Continuation Data

Frame 62: 105 bytes on wire (840 bits), 105 bytes captured (840 bits)
Linux cooked capture
Internet Protocol Version 4, Src: 37.176.195.31 (37.176.195.31), Dst: 184.173.179.40 (184.173.179.40)
Transmission Control Protocol, Src Port: 44042 (44042), Dst Port: https (443), Seq: 414, Ack: 295, Len: 37
Secure Sockets Layer

No.     Time        Source                Destination           Protocol Length Info
     63 113.022603  173.194.40.144        37.176.195.31         TCP      80     http > 36332 [SYN, ACK] Seq=0 Ack=1 Win=64251 Len=0 TSval=246486679 TSecr=1771085 MSS=1400 WS=4 SACK_PERM=1

Frame 63: 80 bytes on wire (640 bits), 80 bytes captured (640 bits)
Linux cooked capture
Internet Protocol Version 4, Src: 173.194.40.144 (173.194.40.144), Dst: 37.176.195.31 (37.176.195.31)
Transmission Control Protocol, Src Port: http (80), Dst Port: 36332 (36332), Seq: 0, Ack: 1, Len: 0

No.     Time        Source                Destination           Protocol Length Info
     64 113.022836  37.176.195.31         173.194.40.144        TCP      80     [TCP Dup ACK 60#1] 36332 > http [ACK] Seq=2832 Ack=1 Win=3930 Len=0 TSval=1771347 TSecr=246486679 SLE=0 SRE=1

Frame 64: 80 bytes on wire (640 bits), 80 bytes captured (640 bits)
Linux cooked capture
Internet Protocol Version 4, Src: 37.176.195.31 (37.176.195.31), Dst: 173.194.40.144 (173.194.40.144)
Transmission Control Protocol, Src Port: 36332 (36332), Dst Port: http (80), Seq: 2832, Ack: 1, Len: 0

No.     Time        Source                Destination           Protocol Length Info
     65 113.082716  173.194.40.144        37.176.195.31         TCP      68     http > 36332 [ACK] Seq=1 Ack=236 Win=257004 Len=0 TSval=246486682 TSecr=1771246

Frame 65: 68 bytes on wire (544 bits), 68 bytes captured (544 bits)
Linux cooked capture
Internet Protocol Version 4, Src: 173.194.40.144 (173.194.40.144), Dst: 37.176.195.31 (37.176.195.31)
Transmission Control Protocol, Src Port: http (80), Dst Port: 36332 (36332), Seq: 1, Ack: 236, Len: 0

No.     Time        Source                Destination           Protocol Length Info
     66 113.082963  37.176.195.31         173.194.40.144        TCP      1366   [TCP segment of a reassembled PDU]

Frame 66: 1366 bytes on wire (10928 bits), 1366 bytes captured (10928 bits)
Linux cooked capture
Internet Protocol Version 4, Src: 37.176.195.31 (37.176.195.31), Dst: 173.194.40.144 (173.194.40.144)
Transmission Control Protocol, Src Port: 36332 (36332), Dst Port: http (80), Seq: 2832, Ack: 1, Len: 1298

No.     Time        Source                Destination           Protocol Length Info
     67 113.083833  37.176.195.31         173.194.40.144        TCP      1366   [TCP segment of a reassembled PDU]

Frame 67: 1366 bytes on wire (10928 bits), 1366 bytes captured (10928 bits)
Linux cooked capture
Internet Protocol Version 4, Src: 37.176.195.31 (37.176.195.31), Dst: 173.194.40.144 (173.194.40.144)
Transmission Control Protocol, Src Port: 36332 (36332), Dst Port: http (80), Seq: 4130, Ack: 1, Len: 1298

No.     Time        Source                Destination           Protocol Length Info
     68 113.092480  173.194.40.144        37.176.195.31         TCP      68     http > 36332 [ACK] Seq=1 Ack=1534 Win=255704 Len=0 TSval=246486685 TSecr=1771246

Frame 68: 68 bytes on wire (544 bits), 68 bytes captured (544 bits)
Linux cooked capture
Internet Protocol Version 4, Src: 173.194.40.144 (173.194.40.144), Dst: 37.176.195.31 (37.176.195.31)
Transmission Control Protocol, Src Port: http (80), Dst Port: 36332 (36332), Seq: 1, Ack: 1534, Len: 0

No.     Time        Source                Destination           Protocol Length Info
     69 113.111945  37.176.195.31         173.194.40.144        HTTP     1154   POST /m/appreq/vs HTTP/1.1  (application/binary)

Frame 69: 1154 bytes on wire (9232 bits), 1154 bytes captured (9232 bits)
Linux cooked capture
Internet Protocol Version 4, Src: 37.176.195.31 (37.176.195.31), Dst: 173.194.40.144 (173.194.40.144)
Transmission Control Protocol, Src Port: 36332 (36332), Dst Port: http (80), Seq: 5428, Ack: 1, Len: 1086
[6 Reassembled TCP Segments (6513 bytes): #58(235), #59(1298), #60(1298), #66(1298), #67(1298), #69(1086)]
Hypertext Transfer Protocol
Media Type

No.     Time        Source                Destination           Protocol Length Info
     70 113.182828  173.194.40.144        37.176.195.31         TCP      68     http > 36332 [ACK] Seq=1 Ack=4130 Win=255704 Len=0 TSval=246486694 TSecr=1771246

Frame 70: 68 bytes on wire (544 bits), 68 bytes captured (544 bits)
Linux cooked capture
Internet Protocol Version 4, Src: 173.194.40.144 (173.194.40.144), Dst: 37.176.195.31 (37.176.195.31)
Transmission Control Protocol, Src Port: http (80), Dst Port: 36332 (36332), Seq: 1, Ack: 4130, Len: 0

No.     Time        Source                Destination           Protocol Length Info
     71 113.212840  173.194.40.144        37.176.195.31         TCP      68     http > 36332 [FIN, ACK] Seq=1 Ack=5428 Win=257004 Len=0 TSval=246486697 TSecr=1771353

Frame 71: 68 bytes on wire (544 bits), 68 bytes captured (544 bits)
Linux cooked capture
Internet Protocol Version 4, Src: 173.194.40.144 (173.194.40.144), Dst: 37.176.195.31 (37.176.195.31)
Transmission Control Protocol, Src Port: http (80), Dst Port: 36332 (36332), Seq: 1, Ack: 5428, Len: 0

No.     Time        Source                Destination           Protocol Length Info
     72 113.213238  184.173.179.40        37.176.195.31         TCP      68     https > 44042 [ACK] Seq=295 Ack=451 Win=512 Len=0 TSval=3589432463 TSecr=1771256

Frame 72: 68 bytes on wire (544 bits), 68 bytes captured (544 bits)
Linux cooked capture
Internet Protocol Version 4, Src: 184.173.179.40 (184.173.179.40), Dst: 37.176.195.31 (37.176.195.31)
Transmission Control Protocol, Src Port: https (443), Dst Port: 44042 (44042), Seq: 295, Ack: 451, Len: 0

No.     Time        Source                Destination           Protocol Length Info
     73 113.213526  184.173.179.40        37.176.195.31         SSL      95     Continuation Data

Frame 73: 95 bytes on wire (760 bits), 95 bytes captured (760 bits)
Linux cooked capture
Internet Protocol Version 4, Src: 184.173.179.40 (184.173.179.40), Dst: 37.176.195.31 (37.176.195.31)
Transmission Control Protocol, Src Port: https (443), Dst Port: 44042 (44042), Seq: 295, Ack: 451, Len: 27
Secure Sockets Layer

No.     Time        Source                Destination           Protocol Length Info
     74 113.222768  184.173.179.40        37.176.195.31         SSL      86     Continuation Data

Frame 74: 86 bytes on wire (688 bits), 86 bytes captured (688 bits)
Linux cooked capture
Internet Protocol Version 4, Src: 184.173.179.40 (184.173.179.40), Dst: 37.176.195.31 (37.176.195.31)
Transmission Control Protocol, Src Port: https (443), Dst Port: 44042 (44042), Seq: 322, Ack: 451, Len: 18
Secure Sockets Layer

No.     Time        Source                Destination           Protocol Length Info
     75 113.226988  37.176.195.31         184.173.179.40        TCP      68     44042 > https [ACK] Seq=451 Ack=340 Win=2009 Len=0 TSval=1771367 TSecr=3589432464

Frame 75: 68 bytes on wire (544 bits), 68 bytes captured (544 bits)
Linux cooked capture
Internet Protocol Version 4, Src: 37.176.195.31 (37.176.195.31), Dst: 184.173.179.40 (184.173.179.40)
Transmission Control Protocol, Src Port: 44042 (44042), Dst Port: https (443), Seq: 451, Ack: 340, Len: 0

No.     Time        Source                Destination           Protocol Length Info
     76 113.252580  173.194.40.144        37.176.195.31         TCP      56     http > 36332 [RST] Seq=2 Win=257004 Len=0

Frame 76: 56 bytes on wire (448 bits), 56 bytes captured (448 bits)
Linux cooked capture
Internet Protocol Version 4, Src: 173.194.40.144 (173.194.40.144), Dst: 37.176.195.31 (37.176.195.31)
Transmission Control Protocol, Src Port: http (80), Dst Port: 36332 (36332), Seq: 2, Len: 0

No.     Time        Source                Destination           Protocol Length Info
     77 118.760250  37.176.195.31         184.173.179.40        SSL      138    Continuation Data

Frame 77: 138 bytes on wire (1104 bits), 138 bytes captured (1104 bits)
Linux cooked capture
Internet Protocol Version 4, Src: 37.176.195.31 (37.176.195.31), Dst: 184.173.179.40 (184.173.179.40)
Transmission Control Protocol, Src Port: 44042 (44042), Dst Port: https (443), Seq: 451, Ack: 340, Len: 70
Secure Sockets Layer

No.     Time        Source                Destination           Protocol Length Info
     78 118.982710  184.173.179.40        37.176.195.31         SSL      112    Continuation Data

Frame 78: 112 bytes on wire (896 bits), 112 bytes captured (896 bits)
Linux cooked capture
Internet Protocol Version 4, Src: 184.173.179.40 (184.173.179.40), Dst: 37.176.195.31 (37.176.195.31)
Transmission Control Protocol, Src Port: https (443), Dst Port: 44042 (44042), Seq: 340, Ack: 521, Len: 44
Secure Sockets Layer

No.     Time        Source                Destination           Protocol Length Info
     79 119.017353  37.176.195.31         184.173.179.40        TCP      68     44042 > https [ACK] Seq=521 Ack=384 Win=2009 Len=0 TSval=1771947 TSecr=3589438184

Frame 79: 68 bytes on wire (544 bits), 68 bytes captured (544 bits)
Linux cooked capture
Internet Protocol Version 4, Src: 37.176.195.31 (37.176.195.31), Dst: 184.173.179.40 (184.173.179.40)
Transmission Control Protocol, Src Port: 44042 (44042), Dst Port: https (443), Seq: 521, Ack: 384, Len: 0

No.     Time        Source                Destination           Protocol Length Info
     80 150.376321  37.176.195.31         184.173.179.40        SSL      143    Continuation Data

Frame 80: 143 bytes on wire (1144 bits), 143 bytes captured (1144 bits)
Linux cooked capture
Internet Protocol Version 4, Src: 37.176.195.31 (37.176.195.31), Dst: 184.173.179.40 (184.173.179.40)
Transmission Control Protocol, Src Port: 44042 (44042), Dst Port: https (443), Seq: 521, Ack: 384, Len: 75
Secure Sockets Layer

No.     Time        Source                Destination           Protocol Length Info
     81 152.580503  184.173.179.40        37.176.195.31         SSL      112    Continuation Data

Frame 81: 112 bytes on wire (896 bits), 112 bytes captured (896 bits)
Linux cooked capture
Internet Protocol Version 4, Src: 184.173.179.40 (184.173.179.40), Dst: 37.176.195.31 (37.176.195.31)
Transmission Control Protocol, Src Port: https (443), Dst Port: 44042 (44042), Seq: 384, Ack: 596, Len: 44
Secure Sockets Layer

No.     Time        Source                Destination           Protocol Length Info
     82 152.581676  37.176.195.31         184.173.179.40        TCP      68     44042 > https [ACK] Seq=596 Ack=428 Win=2009 Len=0 TSval=1775303 TSecr=3589471558

Frame 82: 68 bytes on wire (544 bits), 68 bytes captured (544 bits)
Linux cooked capture
Internet Protocol Version 4, Src: 37.176.195.31 (37.176.195.31), Dst: 184.173.179.40 (184.173.179.40)
Transmission Control Protocol, Src Port: 44042 (44042), Dst Port: https (443), Seq: 596, Ack: 428, Len: 0

No.     Time        Source                Destination           Protocol Length Info
     83 155.449860  37.176.195.31         184.173.179.40        SSL      135    Continuation Data

Frame 83: 135 bytes on wire (1080 bits), 135 bytes captured (1080 bits)
Linux cooked capture
Internet Protocol Version 4, Src: 37.176.195.31 (37.176.195.31), Dst: 184.173.179.40 (184.173.179.40)
Transmission Control Protocol, Src Port: 44042 (44042), Dst Port: https (443), Seq: 596, Ack: 428, Len: 67
Secure Sockets Layer

No.     Time        Source                Destination           Protocol Length Info
     84 155.920928  184.173.179.40        37.176.195.31         SSL      112    Continuation Data

Frame 84: 112 bytes on wire (896 bits), 112 bytes captured (896 bits)
Linux cooked capture
Internet Protocol Version 4, Src: 184.173.179.40 (184.173.179.40), Dst: 37.176.195.31 (37.176.195.31)
Transmission Control Protocol, Src Port: https (443), Dst Port: 44042 (44042), Seq: 428, Ack: 663, Len: 44
Secure Sockets Layer

No.     Time        Source                Destination           Protocol Length Info
     85 155.921265  37.176.195.31         184.173.179.40        TCP      68     44042 > https [ACK] Seq=663 Ack=472 Win=2009 Len=0 TSval=1775637 TSecr=3589475065

Frame 85: 68 bytes on wire (544 bits), 68 bytes captured (544 bits)
Linux cooked capture
Internet Protocol Version 4, Src: 37.176.195.31 (37.176.195.31), Dst: 184.173.179.40 (184.173.179.40)
Transmission Control Protocol, Src Port: 44042 (44042), Dst Port: https (443), Seq: 663, Ack: 472, Len: 0

No.     Time        Source                Destination           Protocol Length Info
     86 156.659418  37.176.195.31         184.173.179.40        SSL      123    Continuation Data

Frame 86: 123 bytes on wire (984 bits), 123 bytes captured (984 bits)
Linux cooked capture
Internet Protocol Version 4, Src: 37.176.195.31 (37.176.195.31), Dst: 184.173.179.40 (184.173.179.40)
Transmission Control Protocol, Src Port: 44042 (44042), Dst Port: https (443), Seq: 663, Ack: 472, Len: 55
Secure Sockets Layer

No.     Time        Source                Destination           Protocol Length Info
     87 157.160815  184.173.179.40        37.176.195.31         SSL      112    Continuation Data

Frame 87: 112 bytes on wire (896 bits), 112 bytes captured (896 bits)
Linux cooked capture
Internet Protocol Version 4, Src: 184.173.179.40 (184.173.179.40), Dst: 37.176.195.31 (37.176.195.31)
Transmission Control Protocol, Src Port: https (443), Dst Port: 44042 (44042), Seq: 472, Ack: 718, Len: 44
Secure Sockets Layer

No.     Time        Source                Destination           Protocol Length Info
     88 157.161943  37.176.195.31         184.173.179.40        TCP      68     44042 > https [ACK] Seq=718 Ack=516 Win=2009 Len=0 TSval=1775761 TSecr=3589476308

Frame 88: 68 bytes on wire (544 bits), 68 bytes captured (544 bits)
Linux cooked capture
Internet Protocol Version 4, Src: 37.176.195.31 (37.176.195.31), Dst: 184.173.179.40 (184.173.179.40)
Transmission Control Protocol, Src Port: 44042 (44042), Dst Port: https (443), Seq: 718, Ack: 516, Len: 0

No.     Time        Source                Destination           Protocol Length Info
     89 157.742258  37.176.195.31         184.173.179.40        SSL      123    Continuation Data

Frame 89: 123 bytes on wire (984 bits), 123 bytes captured (984 bits)
Linux cooked capture
Internet Protocol Version 4, Src: 37.176.195.31 (37.176.195.31), Dst: 184.173.179.40 (184.173.179.40)
Transmission Control Protocol, Src Port: 44042 (44042), Dst Port: https (443), Seq: 718, Ack: 516, Len: 55
Secure Sockets Layer

No.     Time        Source                Destination           Protocol Length Info
     90 158.191265  184.173.179.40        37.176.195.31         SSL      112    Continuation Data

Frame 90: 112 bytes on wire (896 bits), 112 bytes captured (896 bits)
Linux cooked capture
Internet Protocol Version 4, Src: 184.173.179.40 (184.173.179.40), Dst: 37.176.195.31 (37.176.195.31)
Transmission Control Protocol, Src Port: https (443), Dst Port: 44042 (44042), Seq: 516, Ack: 773, Len: 44
Secure Sockets Layer

No.     Time        Source                Destination           Protocol Length Info
     91 158.192490  37.176.195.31         184.173.179.40        TCP      68     44042 > https [ACK] Seq=773 Ack=560 Win=2009 Len=0 TSval=1775864 TSecr=3589477354

Frame 91: 68 bytes on wire (544 bits), 68 bytes captured (544 bits)
Linux cooked capture
Internet Protocol Version 4, Src: 37.176.195.31 (37.176.195.31), Dst: 184.173.179.40 (184.173.179.40)
Transmission Control Protocol, Src Port: 44042 (44042), Dst Port: https (443), Seq: 773, Ack: 560, Len: 0
