No.     Time        Source                Destination           Protocol Length Info
      1 0.000000    188.125.68.71         37.176.77.169         TCP      68     imaps > 34050 [ACK] Seq=1 Ack=1 Win=15544 Len=0 TSval=892067127 TSecr=1057469

Frame 1: 68 bytes on wire (544 bits), 68 bytes captured (544 bits)
Linux cooked capture
Internet Protocol Version 4, Src: 188.125.68.71 (188.125.68.71), Dst: 37.176.77.169 (37.176.77.169)
Transmission Control Protocol, Src Port: imaps (993), Dst Port: 34050 (34050), Seq: 1, Ack: 1, Len: 0

No.     Time        Source                Destination           Protocol Length Info
      2 0.049930    188.125.68.71         37.176.77.169         TLSv1    157    Application Data

Frame 2: 157 bytes on wire (1256 bits), 157 bytes captured (1256 bits)
Linux cooked capture
Internet Protocol Version 4, Src: 188.125.68.71 (188.125.68.71), Dst: 37.176.77.169 (37.176.77.169)
Transmission Control Protocol, Src Port: imaps (993), Dst Port: 34050 (34050), Seq: 1, Ack: 1, Len: 89
Secure Sockets Layer

No.     Time        Source                Destination           Protocol Length Info
      3 0.053263    37.176.77.169         188.125.68.71         TLSv1    108    Application Data

Frame 3: 108 bytes on wire (864 bits), 108 bytes captured (864 bits)
Linux cooked capture
Internet Protocol Version 4, Src: 37.176.77.169 (37.176.77.169), Dst: 188.125.68.71 (188.125.68.71)
Transmission Control Protocol, Src Port: 34050 (34050), Dst Port: imaps (993), Seq: 1, Ack: 90, Len: 40
Secure Sockets Layer

No.     Time        Source                Destination           Protocol Length Info
      4 0.209783    188.125.68.71         37.176.77.169         TCP      68     imaps > 34050 [ACK] Seq=90 Ack=41 Win=15544 Len=0 TSval=892067337 TSecr=1057493

Frame 4: 68 bytes on wire (544 bits), 68 bytes captured (544 bits)
Linux cooked capture
Internet Protocol Version 4, Src: 188.125.68.71 (188.125.68.71), Dst: 37.176.77.169 (37.176.77.169)
Transmission Control Protocol, Src Port: imaps (993), Dst Port: 34050 (34050), Seq: 90, Ack: 41, Len: 0

No.     Time        Source                Destination           Protocol Length Info
      5 0.210153    188.125.68.71         37.176.77.169         TLSv1    387    Application Data

Frame 5: 387 bytes on wire (3096 bits), 387 bytes captured (3096 bits)
Linux cooked capture
Internet Protocol Version 4, Src: 188.125.68.71 (188.125.68.71), Dst: 37.176.77.169 (37.176.77.169)
Transmission Control Protocol, Src Port: imaps (993), Dst Port: 34050 (34050), Seq: 90, Ack: 41, Len: 319
Secure Sockets Layer

No.     Time        Source                Destination           Protocol Length Info
      6 0.242147    37.176.77.169         188.125.68.71         TCP      68     34050 > imaps [ACK] Seq=41 Ack=409 Win=28556 Len=0 TSval=1057512 TSecr=892067339

Frame 6: 68 bytes on wire (544 bits), 68 bytes captured (544 bits)
Linux cooked capture
Internet Protocol Version 4, Src: 37.176.77.169 (37.176.77.169), Dst: 188.125.68.71 (188.125.68.71)
Transmission Control Protocol, Src Port: 34050 (34050), Dst Port: imaps (993), Seq: 41, Ack: 409, Len: 0

No.     Time        Source                Destination           Protocol Length Info
      7 0.803817    37.176.77.169         188.125.68.71         TLSv1    101    Application Data

Frame 7: 101 bytes on wire (808 bits), 101 bytes captured (808 bits)
Linux cooked capture
Internet Protocol Version 4, Src: 37.176.77.169 (37.176.77.169), Dst: 188.125.68.71 (188.125.68.71)
Transmission Control Protocol, Src Port: 34050 (34050), Dst Port: imaps (993), Seq: 41, Ack: 409, Len: 33
Secure Sockets Layer

No.     Time        Source                Destination           Protocol Length Info
      8 0.959837    188.125.68.71         37.176.77.169         TLSv1    114    Application Data

Frame 8: 114 bytes on wire (912 bits), 114 bytes captured (912 bits)
Linux cooked capture
Internet Protocol Version 4, Src: 188.125.68.71 (188.125.68.71), Dst: 37.176.77.169 (37.176.77.169)
Transmission Control Protocol, Src Port: imaps (993), Dst Port: 34050 (34050), Seq: 409, Ack: 74, Len: 46
Secure Sockets Layer

No.     Time        Source                Destination           Protocol Length Info
      9 0.960185    37.176.77.169         188.125.68.71         TCP      68     34050 > imaps [ACK] Seq=74 Ack=455 Win=28556 Len=0 TSval=1057583 TSecr=892068087

Frame 9: 68 bytes on wire (544 bits), 68 bytes captured (544 bits)
Linux cooked capture
Internet Protocol Version 4, Src: 37.176.77.169 (37.176.77.169), Dst: 188.125.68.71 (188.125.68.71)
Transmission Control Protocol, Src Port: 34050 (34050), Dst Port: imaps (993), Seq: 74, Ack: 455, Len: 0

No.     Time        Source                Destination           Protocol Length Info
     10 0.964063    37.176.77.169         188.125.68.71         TLSv1    111    Application Data

Frame 10: 111 bytes on wire (888 bits), 111 bytes captured (888 bits)
Linux cooked capture
Internet Protocol Version 4, Src: 37.176.77.169 (37.176.77.169), Dst: 188.125.68.71 (188.125.68.71)
Transmission Control Protocol, Src Port: 34050 (34050), Dst Port: imaps (993), Seq: 74, Ack: 455, Len: 43
Secure Sockets Layer

No.     Time        Source                Destination           Protocol Length Info
     11 1.119830    188.125.68.71         37.176.77.169         TLSv1    487    Application Data

Frame 11: 487 bytes on wire (3896 bits), 487 bytes captured (3896 bits)
Linux cooked capture
Internet Protocol Version 4, Src: 188.125.68.71 (188.125.68.71), Dst: 37.176.77.169 (37.176.77.169)
Transmission Control Protocol, Src Port: imaps (993), Dst Port: 34050 (34050), Seq: 455, Ack: 117, Len: 419
Secure Sockets Layer

No.     Time        Source                Destination           Protocol Length Info
     12 1.147652    37.176.77.169         188.125.68.71         TLSv1    124    Application Data

Frame 12: 124 bytes on wire (992 bits), 124 bytes captured (992 bits)
Linux cooked capture
Internet Protocol Version 4, Src: 37.176.77.169 (37.176.77.169), Dst: 188.125.68.71 (188.125.68.71)
Transmission Control Protocol, Src Port: 34050 (34050), Dst Port: imaps (993), Seq: 117, Ack: 874, Len: 56
Secure Sockets Layer

No.     Time        Source                Destination           Protocol Length Info
     13 1.300242    188.125.68.71         37.176.77.169         TLSv1    235    Application Data

Frame 13: 235 bytes on wire (1880 bits), 235 bytes captured (1880 bits)
Linux cooked capture
Internet Protocol Version 4, Src: 188.125.68.71 (188.125.68.71), Dst: 37.176.77.169 (37.176.77.169)
Transmission Control Protocol, Src Port: imaps (993), Dst Port: 34050 (34050), Seq: 874, Ack: 173, Len: 167
Secure Sockets Layer

No.     Time        Source                Destination           Protocol Length Info
     14 1.313413    37.176.77.169         188.125.68.71         TLSv1    222    Application Data

Frame 14: 222 bytes on wire (1776 bits), 222 bytes captured (1776 bits)
Linux cooked capture
Internet Protocol Version 4, Src: 37.176.77.169 (37.176.77.169), Dst: 188.125.68.71 (188.125.68.71)
Transmission Control Protocol, Src Port: 34050 (34050), Dst Port: imaps (993), Seq: 173, Ack: 1041, Len: 154
Secure Sockets Layer

No.     Time        Source                Destination           Protocol Length Info
     15 1.479933    188.125.68.71         37.176.77.169         TLSv1    1026   Application Data

Frame 15: 1026 bytes on wire (8208 bits), 1026 bytes captured (8208 bits)
Linux cooked capture
Internet Protocol Version 4, Src: 188.125.68.71 (188.125.68.71), Dst: 37.176.77.169 (37.176.77.169)
Transmission Control Protocol, Src Port: imaps (993), Dst Port: 34050 (34050), Seq: 1041, Ack: 327, Len: 958
Secure Sockets Layer

No.     Time        Source                Destination           Protocol Length Info
     16 1.512127    37.176.77.169         188.125.68.71         TCP      68     34050 > imaps [ACK] Seq=327 Ack=1999 Win=36344 Len=0 TSval=1057639 TSecr=892068598

Frame 16: 68 bytes on wire (544 bits), 68 bytes captured (544 bits)
Linux cooked capture
Internet Protocol Version 4, Src: 37.176.77.169 (37.176.77.169), Dst: 188.125.68.71 (188.125.68.71)
Transmission Control Protocol, Src Port: 34050 (34050), Dst Port: imaps (993), Seq: 327, Ack: 1999, Len: 0

No.     Time        Source                Destination           Protocol Length Info
     17 6.801268    37.176.77.169         208.43.122.143        TCP      80     [TCP segment of a reassembled PDU]

Frame 17: 80 bytes on wire (640 bits), 80 bytes captured (640 bits)
Linux cooked capture
Internet Protocol Version 4, Src: 37.176.77.169 (37.176.77.169), Dst: 208.43.122.143 (208.43.122.143)
Transmission Control Protocol, Src Port: 59981 (59981), Dst Port: xmpp-client (5222), Seq: 1, Ack: 1, Len: 12

No.     Time        Source                Destination           Protocol Length Info
     18 7.226658    208.43.122.143        37.176.77.169         TCP      95     [TCP segment of a reassembled PDU]

Frame 18: 95 bytes on wire (760 bits), 95 bytes captured (760 bits)
Linux cooked capture
Internet Protocol Version 4, Src: 208.43.122.143 (208.43.122.143), Dst: 37.176.77.169 (37.176.77.169)
Transmission Control Protocol, Src Port: xmpp-client (5222), Dst Port: 59981 (59981), Seq: 1, Ack: 13, Len: 27

No.     Time        Source                Destination           Protocol Length Info
     19 7.227350    37.176.77.169         208.43.122.143        TCP      93     [TCP segment of a reassembled PDU]

Frame 19: 93 bytes on wire (744 bits), 93 bytes captured (744 bits)
Linux cooked capture
Internet Protocol Version 4, Src: 37.176.77.169 (37.176.77.169), Dst: 208.43.122.143 (208.43.122.143)
Transmission Control Protocol, Src Port: 59981 (59981), Dst Port: xmpp-client (5222), Seq: 13, Ack: 28, Len: 25

No.     Time        Source                Destination           Protocol Length Info
     20 7.246635    208.43.122.143        37.176.77.169         TCP      95     [TCP segment of a reassembled PDU]

Frame 20: 95 bytes on wire (760 bits), 95 bytes captured (760 bits)
Linux cooked capture
Internet Protocol Version 4, Src: 208.43.122.143 (208.43.122.143), Dst: 37.176.77.169 (37.176.77.169)
Transmission Control Protocol, Src Port: xmpp-client (5222), Dst Port: 59981 (59981), Seq: 28, Ack: 13, Len: 27

No.     Time        Source                Destination           Protocol Length Info
     21 7.282253    37.176.77.169         208.43.122.143        TCP      68     59981 > xmpp-client [ACK] Seq=38 Ack=55 Win=1846 Len=0 TSval=1058216 TSecr=2886649677

Frame 21: 68 bytes on wire (544 bits), 68 bytes captured (544 bits)
Linux cooked capture
Internet Protocol Version 4, Src: 37.176.77.169 (37.176.77.169), Dst: 208.43.122.143 (208.43.122.143)
Transmission Control Protocol, Src Port: 59981 (59981), Dst Port: xmpp-client (5222), Seq: 38, Ack: 55, Len: 0

No.     Time        Source                Destination           Protocol Length Info
     22 7.826705    208.43.122.143        37.176.77.169         TCP      86     [TCP segment of a reassembled PDU]

Frame 22: 86 bytes on wire (688 bits), 86 bytes captured (688 bits)
Linux cooked capture
Internet Protocol Version 4, Src: 208.43.122.143 (208.43.122.143), Dst: 37.176.77.169 (37.176.77.169)
Transmission Control Protocol, Src Port: xmpp-client (5222), Dst Port: 59981 (59981), Seq: 55, Ack: 38, Len: 18

No.     Time        Source                Destination           Protocol Length Info
     23 7.827387    37.176.77.169         208.43.122.143        TCP      68     59981 > xmpp-client [ACK] Seq=38 Ack=73 Win=1846 Len=0 TSval=1058270 TSecr=2886650280

Frame 23: 68 bytes on wire (544 bits), 68 bytes captured (544 bits)
Linux cooked capture
Internet Protocol Version 4, Src: 37.176.77.169 (37.176.77.169), Dst: 208.43.122.143 (208.43.122.143)
Transmission Control Protocol, Src Port: 59981 (59981), Dst Port: xmpp-client (5222), Seq: 38, Ack: 73, Len: 0

No.     Time        Source                Destination           Protocol Length Info
     24 10.641668   37.176.77.169         188.125.68.71         TCP      68     34050 > imaps [FIN, ACK] Seq=327 Ack=1999 Win=36344 Len=0 TSval=1058551 TSecr=892068598

Frame 24: 68 bytes on wire (544 bits), 68 bytes captured (544 bits)
Linux cooked capture
Internet Protocol Version 4, Src: 37.176.77.169 (37.176.77.169), Dst: 188.125.68.71 (188.125.68.71)
Transmission Control Protocol, Src Port: 34050 (34050), Dst Port: imaps (993), Seq: 327, Ack: 1999, Len: 0

No.     Time        Source                Destination           Protocol Length Info
     25 11.006388   188.125.68.71         37.176.77.169         TCP      68     imaps > 34050 [FIN, ACK] Seq=1999 Ack=328 Win=16616 Len=0 TSval=892078065 TSecr=1058551

Frame 25: 68 bytes on wire (544 bits), 68 bytes captured (544 bits)
Linux cooked capture
Internet Protocol Version 4, Src: 188.125.68.71 (188.125.68.71), Dst: 37.176.77.169 (37.176.77.169)
Transmission Control Protocol, Src Port: imaps (993), Dst Port: 34050 (34050), Seq: 1999, Ack: 328, Len: 0

No.     Time        Source                Destination           Protocol Length Info
     26 11.006638   37.176.77.169         188.125.68.71         TCP      68     34050 > imaps [ACK] Seq=328 Ack=2000 Win=36344 Len=0 TSval=1058588 TSecr=892078065

Frame 26: 68 bytes on wire (544 bits), 68 bytes captured (544 bits)
Linux cooked capture
Internet Protocol Version 4, Src: 37.176.77.169 (37.176.77.169), Dst: 188.125.68.71 (188.125.68.71)
Transmission Control Protocol, Src Port: 34050 (34050), Dst Port: imaps (993), Seq: 328, Ack: 2000, Len: 0

No.     Time        Source                Destination           Protocol Length Info
     27 11.380850   188.125.68.71         37.176.77.169         TCP      68     imaps > 34050 [FIN, ACK] Seq=1999 Ack=328 Win=16616 Len=0 TSval=892078436 TSecr=1058551

Frame 27: 68 bytes on wire (544 bits), 68 bytes captured (544 bits)
Linux cooked capture
Internet Protocol Version 4, Src: 188.125.68.71 (188.125.68.71), Dst: 37.176.77.169 (37.176.77.169)
Transmission Control Protocol, Src Port: imaps (993), Dst Port: 34050 (34050), Seq: 1999, Ack: 328, Len: 0

No.     Time        Source                Destination           Protocol Length Info
     28 11.381260   37.176.77.169         188.125.68.71         TCP      68     [TCP Dup ACK 26#1] 34050 > imaps [ACK] Seq=328 Ack=2000 Win=36344 Len=0 TSval=1058625 TSecr=892078065

Frame 28: 68 bytes on wire (544 bits), 68 bytes captured (544 bits)
Linux cooked capture
Internet Protocol Version 4, Src: 37.176.77.169 (37.176.77.169), Dst: 188.125.68.71 (188.125.68.71)
Transmission Control Protocol, Src Port: 34050 (34050), Dst Port: imaps (993), Seq: 328, Ack: 2000, Len: 0

No.     Time        Source                Destination           Protocol Length Info
     29 11.826325   188.125.68.71         37.176.77.169         TCP      56     imaps > 34050 [RST] Seq=2000 Win=0 Len=0

Frame 29: 56 bytes on wire (448 bits), 56 bytes captured (448 bits)
Linux cooked capture
Internet Protocol Version 4, Src: 188.125.68.71 (188.125.68.71), Dst: 37.176.77.169 (37.176.77.169)
Transmission Control Protocol, Src Port: imaps (993), Dst Port: 34050 (34050), Seq: 2000, Len: 0

No.     Time        Source                Destination           Protocol Length Info
     30 12.246353   208.43.122.143        37.176.77.169         TCP      97     [TCP segment of a reassembled PDU]

Frame 30: 97 bytes on wire (776 bits), 97 bytes captured (776 bits)
Linux cooked capture
Internet Protocol Version 4, Src: 208.43.122.143 (208.43.122.143), Dst: 37.176.77.169 (37.176.77.169)
Transmission Control Protocol, Src Port: xmpp-client (5222), Dst Port: 59981 (59981), Seq: 73, Ack: 38, Len: 29

No.     Time        Source                Destination           Protocol Length Info
     31 12.246695   37.176.77.169         208.43.122.143        TCP      68     59981 > xmpp-client [ACK] Seq=38 Ack=102 Win=1846 Len=0 TSval=1058712 TSecr=2886654679

Frame 31: 68 bytes on wire (544 bits), 68 bytes captured (544 bits)
Linux cooked capture
Internet Protocol Version 4, Src: 37.176.77.169 (37.176.77.169), Dst: 208.43.122.143 (208.43.122.143)
Transmission Control Protocol, Src Port: 59981 (59981), Dst Port: xmpp-client (5222), Seq: 38, Ack: 102, Len: 0

No.     Time        Source                Destination           Protocol Length Info
     32 13.666402   208.43.122.143        37.176.77.169         TCP      97     [TCP Retransmission] [TCP segment of a reassembled PDU]

Frame 32: 97 bytes on wire (776 bits), 97 bytes captured (776 bits)
Linux cooked capture
Internet Protocol Version 4, Src: 208.43.122.143 (208.43.122.143), Dst: 37.176.77.169 (37.176.77.169)
Transmission Control Protocol, Src Port: xmpp-client (5222), Dst Port: 59981 (59981), Seq: 73, Ack: 38, Len: 29

No.     Time        Source                Destination           Protocol Length Info
     33 13.666748   37.176.77.169         208.43.122.143        TCP      80     [TCP Dup ACK 31#1] 59981 > xmpp-client [ACK] Seq=38 Ack=102 Win=1846 Len=0 TSval=1058854 TSecr=2886656097 SLE=73 SRE=102

Frame 33: 80 bytes on wire (640 bits), 80 bytes captured (640 bits)
Linux cooked capture
Internet Protocol Version 4, Src: 37.176.77.169 (37.176.77.169), Dst: 208.43.122.143 (208.43.122.143)
Transmission Control Protocol, Src Port: 59981 (59981), Dst Port: xmpp-client (5222), Seq: 38, Ack: 102, Len: 0

No.     Time        Source                Destination           Protocol Length Info
     34 14.070178   37.176.77.169         173.194.34.16         TCP      76     33264 > http [SYN] Seq=0 Win=5240 Len=0 MSS=1310 SACK_PERM=1 TSval=1058894 TSecr=0 WS=4

Frame 34: 76 bytes on wire (608 bits), 76 bytes captured (608 bits)
Linux cooked capture
Internet Protocol Version 4, Src: 37.176.77.169 (37.176.77.169), Dst: 173.194.34.16 (173.194.34.16)
Transmission Control Protocol, Src Port: 33264 (33264), Dst Port: http (80), Seq: 0, Len: 0

No.     Time        Source                Destination           Protocol Length Info
     35 15.566360   173.194.34.16         37.176.77.169         TCP      80     http > 33264 [SYN, ACK] Seq=0 Ack=1 Win=64251 Len=0 TSval=212350524 TSecr=1058894 MSS=1400 WS=4 SACK_PERM=1

Frame 35: 80 bytes on wire (640 bits), 80 bytes captured (640 bits)
Linux cooked capture
Internet Protocol Version 4, Src: 173.194.34.16 (173.194.34.16), Dst: 37.176.77.169 (37.176.77.169)
Transmission Control Protocol, Src Port: http (80), Dst Port: 33264 (33264), Seq: 0, Ack: 1, Len: 0

No.     Time        Source                Destination           Protocol Length Info
     36 15.566690   37.176.77.169         173.194.34.16         TCP      68     33264 > http [ACK] Seq=1 Ack=1 Win=5240 Len=0 TSval=1059044 TSecr=212350524

Frame 36: 68 bytes on wire (544 bits), 68 bytes captured (544 bits)
Linux cooked capture
Internet Protocol Version 4, Src: 37.176.77.169 (37.176.77.169), Dst: 173.194.34.16 (173.194.34.16)
Transmission Control Protocol, Src Port: 33264 (33264), Dst Port: http (80), Seq: 1, Ack: 1, Len: 0

No.     Time        Source                Destination           Protocol Length Info
     37 15.566762   173.194.34.16         37.176.77.169         TCP      80     http > 33264 [SYN, ACK] Seq=0 Ack=1 Win=64251 Len=0 TSval=212350637 TSecr=1058894 MSS=1400 WS=4 SACK_PERM=1

Frame 37: 80 bytes on wire (640 bits), 80 bytes captured (640 bits)
Linux cooked capture
Internet Protocol Version 4, Src: 173.194.34.16 (173.194.34.16), Dst: 37.176.77.169 (37.176.77.169)
Transmission Control Protocol, Src Port: http (80), Dst Port: 33264 (33264), Seq: 0, Ack: 1, Len: 0

No.     Time        Source                Destination           Protocol Length Info
     38 15.567687   37.176.77.169         173.194.34.16         TCP      80     [TCP Dup ACK 36#1] 33264 > http [ACK] Seq=1 Ack=1 Win=5240 Len=0 TSval=1059044 TSecr=212350637 SLE=0 SRE=1

Frame 38: 80 bytes on wire (640 bits), 80 bytes captured (640 bits)
Linux cooked capture
Internet Protocol Version 4, Src: 37.176.77.169 (37.176.77.169), Dst: 173.194.34.16 (173.194.34.16)
Transmission Control Protocol, Src Port: 33264 (33264), Dst Port: http (80), Seq: 1, Ack: 1, Len: 0

No.     Time        Source                Destination           Protocol Length Info
     39 15.864720   37.176.77.169         173.194.34.16         TCP      303    [TCP segment of a reassembled PDU]

Frame 39: 303 bytes on wire (2424 bits), 303 bytes captured (2424 bits)
Linux cooked capture
Internet Protocol Version 4, Src: 37.176.77.169 (37.176.77.169), Dst: 173.194.34.16 (173.194.34.16)
Transmission Control Protocol, Src Port: 33264 (33264), Dst Port: http (80), Seq: 1, Ack: 1, Len: 235

No.     Time        Source                Destination           Protocol Length Info
     40 15.880750   37.176.77.169         173.194.34.16         TCP      1366   [TCP segment of a reassembled PDU]

Frame 40: 1366 bytes on wire (10928 bits), 1366 bytes captured (10928 bits)
Linux cooked capture
Internet Protocol Version 4, Src: 37.176.77.169 (37.176.77.169), Dst: 173.194.34.16 (173.194.34.16)
Transmission Control Protocol, Src Port: 33264 (33264), Dst Port: http (80), Seq: 236, Ack: 1, Len: 1298

No.     Time        Source                Destination           Protocol Length Info
     41 15.881053   37.176.77.169         173.194.34.16         TCP      1366   [TCP segment of a reassembled PDU]

Frame 41: 1366 bytes on wire (10928 bits), 1366 bytes captured (10928 bits)
Linux cooked capture
Internet Protocol Version 4, Src: 37.176.77.169 (37.176.77.169), Dst: 173.194.34.16 (173.194.34.16)
Transmission Control Protocol, Src Port: 33264 (33264), Dst Port: http (80), Seq: 1534, Ack: 1, Len: 1298

No.     Time        Source                Destination           Protocol Length Info
     42 16.951183   173.194.34.16         37.176.77.169         TCP      68     http > 33264 [ACK] Seq=1 Ack=236 Win=257004 Len=0 TSval=212350793 TSecr=1059074

Frame 42: 68 bytes on wire (544 bits), 68 bytes captured (544 bits)
Linux cooked capture
Internet Protocol Version 4, Src: 173.194.34.16 (173.194.34.16), Dst: 37.176.77.169 (37.176.77.169)
Transmission Control Protocol, Src Port: http (80), Dst Port: 33264 (33264), Seq: 1, Ack: 236, Len: 0

No.     Time        Source                Destination           Protocol Length Info
     43 16.981103   173.194.34.16         37.176.77.169         TCP      68     http > 33264 [ACK] Seq=1 Ack=1534 Win=255704 Len=0 TSval=212350796 TSecr=1059075

Frame 43: 68 bytes on wire (544 bits), 68 bytes captured (544 bits)
Linux cooked capture
Internet Protocol Version 4, Src: 173.194.34.16 (173.194.34.16), Dst: 37.176.77.169 (37.176.77.169)
Transmission Control Protocol, Src Port: http (80), Dst Port: 33264 (33264), Seq: 1, Ack: 1534, Len: 0

No.     Time        Source                Destination           Protocol Length Info
     44 17.092127   37.176.77.169         173.194.34.16         TCP      1366   [TCP segment of a reassembled PDU]

Frame 44: 1366 bytes on wire (10928 bits), 1366 bytes captured (10928 bits)
Linux cooked capture
Internet Protocol Version 4, Src: 37.176.77.169 (37.176.77.169), Dst: 173.194.34.16 (173.194.34.16)
Transmission Control Protocol, Src Port: 33264 (33264), Dst Port: http (80), Seq: 2832, Ack: 1, Len: 1298

No.     Time        Source                Destination           Protocol Length Info
     45 17.092458   37.176.77.169         173.194.34.16         TCP      1366   [TCP segment of a reassembled PDU]

Frame 45: 1366 bytes on wire (10928 bits), 1366 bytes captured (10928 bits)
Linux cooked capture
Internet Protocol Version 4, Src: 37.176.77.169 (37.176.77.169), Dst: 173.194.34.16 (173.194.34.16)
Transmission Control Protocol, Src Port: 33264 (33264), Dst Port: http (80), Seq: 4130, Ack: 1, Len: 1298

No.     Time        Source                Destination           Protocol Length Info
     46 17.092575   37.176.77.169         173.194.34.16         TCP      1366   [TCP segment of a reassembled PDU]

Frame 46: 1366 bytes on wire (10928 bits), 1366 bytes captured (10928 bits)
Linux cooked capture
Internet Protocol Version 4, Src: 37.176.77.169 (37.176.77.169), Dst: 173.194.34.16 (173.194.34.16)
Transmission Control Protocol, Src Port: 33264 (33264), Dst Port: http (80), Seq: 5428, Ack: 1, Len: 1298

No.     Time        Source                Destination           Protocol Length Info
     47 17.092953   37.176.77.169         173.194.34.16         HTTP     88     POST /m/appreq/vs HTTP/1.1  (application/binary)

Frame 47: 88 bytes on wire (704 bits), 88 bytes captured (704 bits)
Linux cooked capture
Internet Protocol Version 4, Src: 37.176.77.169 (37.176.77.169), Dst: 173.194.34.16 (173.194.34.16)
Transmission Control Protocol, Src Port: 33264 (33264), Dst Port: http (80), Seq: 6726, Ack: 1, Len: 20
[7 Reassembled TCP Segments (6745 bytes): #39(235), #40(1298), #41(1298), #44(1298), #45(1298), #46(1298), #47(20)]
Hypertext Transfer Protocol
Media Type

No.     Time        Source                Destination           Protocol Length Info
     48 17.111065   173.194.34.16         37.176.77.169         TCP      68     http > 33264 [ACK] Seq=1 Ack=2832 Win=257004 Len=0 TSval=212350809 TSecr=1059075

Frame 48: 68 bytes on wire (544 bits), 68 bytes captured (544 bits)
Linux cooked capture
Internet Protocol Version 4, Src: 173.194.34.16 (173.194.34.16), Dst: 37.176.77.169 (37.176.77.169)
Transmission Control Protocol, Src Port: http (80), Dst Port: 33264 (33264), Seq: 1, Ack: 2832, Len: 0

No.     Time        Source                Destination           Protocol Length Info
     49 17.251060   173.194.34.16         37.176.77.169         TCP      68     http > 33264 [ACK] Seq=1 Ack=5428 Win=254408 Len=0 TSval=212350822 TSecr=1059197

Frame 49: 68 bytes on wire (544 bits), 68 bytes captured (544 bits)
Linux cooked capture
Internet Protocol Version 4, Src: 173.194.34.16 (173.194.34.16), Dst: 37.176.77.169 (37.176.77.169)
Transmission Control Protocol, Src Port: http (80), Dst Port: 33264 (33264), Seq: 1, Ack: 5428, Len: 0

No.     Time        Source                Destination           Protocol Length Info
     50 17.271045   173.194.34.16         37.176.77.169         TCP      68     http > 33264 [FIN, ACK] Seq=1 Ack=5428 Win=257004 Len=0 TSval=212350825 TSecr=1059197

Frame 50: 68 bytes on wire (544 bits), 68 bytes captured (544 bits)
Linux cooked capture
Internet Protocol Version 4, Src: 173.194.34.16 (173.194.34.16), Dst: 37.176.77.169 (37.176.77.169)
Transmission Control Protocol, Src Port: http (80), Dst Port: 33264 (33264), Seq: 1, Ack: 5428, Len: 0

No.     Time        Source                Destination           Protocol Length Info
     51 17.271327   173.194.34.16         37.176.77.169         TCP      56     http > 33264 [RST] Seq=2 Win=257004 Len=0

Frame 51: 56 bytes on wire (448 bits), 56 bytes captured (448 bits)
Linux cooked capture
Internet Protocol Version 4, Src: 173.194.34.16 (173.194.34.16), Dst: 37.176.77.169 (37.176.77.169)
Transmission Control Protocol, Src Port: http (80), Dst Port: 33264 (33264), Seq: 2, Len: 0

No.     Time        Source                Destination           Protocol Length Info
     52 17.281132   173.194.34.16         37.176.77.169         TCP      56     http > 33264 [RST] Seq=1 Win=0 Len=0

Frame 52: 56 bytes on wire (448 bits), 56 bytes captured (448 bits)
Linux cooked capture
Internet Protocol Version 4, Src: 173.194.34.16 (173.194.34.16), Dst: 37.176.77.169 (37.176.77.169)
Transmission Control Protocol, Src Port: http (80), Dst Port: 33264 (33264), Seq: 1, Len: 0

No.     Time        Source                Destination           Protocol Length Info
     53 18.176280   37.176.77.169         208.43.122.143        TCP      129    [TCP segment of a reassembled PDU]

Frame 53: 129 bytes on wire (1032 bits), 129 bytes captured (1032 bits)
Linux cooked capture
Internet Protocol Version 4, Src: 37.176.77.169 (37.176.77.169), Dst: 208.43.122.143 (208.43.122.143)
Transmission Control Protocol, Src Port: 59981 (59981), Dst Port: xmpp-client (5222), Seq: 38, Ack: 102, Len: 61

No.     Time        Source                Destination           Protocol Length Info
     54 18.391183   208.43.122.143        37.176.77.169         TCP      112    [TCP segment of a reassembled PDU]

Frame 54: 112 bytes on wire (896 bits), 112 bytes captured (896 bits)
Linux cooked capture
Internet Protocol Version 4, Src: 208.43.122.143 (208.43.122.143), Dst: 37.176.77.169 (37.176.77.169)
Transmission Control Protocol, Src Port: xmpp-client (5222), Dst Port: 59981 (59981), Seq: 102, Ack: 99, Len: 44

No.     Time        Source                Destination           Protocol Length Info
     55 18.391565   37.176.77.169         208.43.122.143        TCP      68     59981 > xmpp-client [ACK] Seq=99 Ack=146 Win=1846 Len=0 TSval=1059326 TSecr=2886660918

Frame 55: 68 bytes on wire (544 bits), 68 bytes captured (544 bits)
Linux cooked capture
Internet Protocol Version 4, Src: 37.176.77.169 (37.176.77.169), Dst: 208.43.122.143 (208.43.122.143)
Transmission Control Protocol, Src Port: 59981 (59981), Dst Port: xmpp-client (5222), Seq: 99, Ack: 146, Len: 0

No.     Time        Source                Destination           Protocol Length Info
     56 21.826028   37.176.77.169         208.43.122.143        TCP      131    [TCP segment of a reassembled PDU]

Frame 56: 131 bytes on wire (1048 bits), 131 bytes captured (1048 bits)
Linux cooked capture
Internet Protocol Version 4, Src: 37.176.77.169 (37.176.77.169), Dst: 208.43.122.143 (208.43.122.143)
Transmission Control Protocol, Src Port: 59981 (59981), Dst Port: xmpp-client (5222), Seq: 99, Ack: 146, Len: 63

No.     Time        Source                Destination           Protocol Length Info
     57 22.021152   208.43.122.143        37.176.77.169         TCP      112    [TCP segment of a reassembled PDU]

Frame 57: 112 bytes on wire (896 bits), 112 bytes captured (896 bits)
Linux cooked capture
Internet Protocol Version 4, Src: 208.43.122.143 (208.43.122.143), Dst: 37.176.77.169 (37.176.77.169)
Transmission Control Protocol, Src Port: xmpp-client (5222), Dst Port: 59981 (59981), Seq: 146, Ack: 162, Len: 44

No.     Time        Source                Destination           Protocol Length Info
     58 22.021495   37.176.77.169         208.43.122.143        TCP      68     59981 > xmpp-client [ACK] Seq=162 Ack=190 Win=1846 Len=0 TSval=1059689 TSecr=2886664563

Frame 58: 68 bytes on wire (544 bits), 68 bytes captured (544 bits)
Linux cooked capture
Internet Protocol Version 4, Src: 37.176.77.169 (37.176.77.169), Dst: 208.43.122.143 (208.43.122.143)
Transmission Control Protocol, Src Port: 59981 (59981), Dst Port: xmpp-client (5222), Seq: 162, Ack: 190, Len: 0

No.     Time        Source                Destination           Protocol Length Info
     59 24.931063   54.235.185.74         37.176.77.169         TCP      68     http > 47015 [FIN, ACK] Seq=1 Ack=1 Win=64251 Len=0 TSval=212351592 TSecr=1057054

Frame 59: 68 bytes on wire (544 bits), 68 bytes captured (544 bits)
Linux cooked capture
Internet Protocol Version 4, Src: 54.235.185.74 (54.235.185.74), Dst: 37.176.77.169 (37.176.77.169)
Transmission Control Protocol, Src Port: http (80), Dst Port: 47015 (47015), Seq: 1, Ack: 1, Len: 0

No.     Time        Source                Destination           Protocol Length Info
     60 24.962067   37.176.77.169         54.235.185.74         TCP      68     47015 > http [ACK] Seq=1 Ack=2 Win=1959 Len=0 TSval=1059984 TSecr=212351592

Frame 60: 68 bytes on wire (544 bits), 68 bytes captured (544 bits)
Linux cooked capture
Internet Protocol Version 4, Src: 37.176.77.169 (37.176.77.169), Dst: 54.235.185.74 (54.235.185.74)
Transmission Control Protocol, Src Port: 47015 (47015), Dst Port: http (80), Seq: 1, Ack: 2, Len: 0

No.     Time        Source                Destination           Protocol Length Info
     61 26.613408   37.176.77.169         208.43.122.143        TCP      128    [TCP segment of a reassembled PDU]

Frame 61: 128 bytes on wire (1024 bits), 128 bytes captured (1024 bits)
Linux cooked capture
Internet Protocol Version 4, Src: 37.176.77.169 (37.176.77.169), Dst: 208.43.122.143 (208.43.122.143)
Transmission Control Protocol, Src Port: 59981 (59981), Dst Port: xmpp-client (5222), Seq: 162, Ack: 190, Len: 60

No.     Time        Source                Destination           Protocol Length Info
     62 26.831100   208.43.122.143        37.176.77.169         TCP      112    [TCP segment of a reassembled PDU]

Frame 62: 112 bytes on wire (896 bits), 112 bytes captured (896 bits)
Linux cooked capture
Internet Protocol Version 4, Src: 208.43.122.143 (208.43.122.143), Dst: 37.176.77.169 (37.176.77.169)
Transmission Control Protocol, Src Port: xmpp-client (5222), Dst Port: 59981 (59981), Seq: 190, Ack: 222, Len: 44

No.     Time        Source                Destination           Protocol Length Info
     63 26.832145   37.176.77.169         208.43.122.143        TCP      68     59981 > xmpp-client [ACK] Seq=222 Ack=234 Win=1846 Len=0 TSval=1060171 TSecr=2886669348

Frame 63: 68 bytes on wire (544 bits), 68 bytes captured (544 bits)
Linux cooked capture
Internet Protocol Version 4, Src: 37.176.77.169 (37.176.77.169), Dst: 208.43.122.143 (208.43.122.143)
Transmission Control Protocol, Src Port: 59981 (59981), Dst Port: xmpp-client (5222), Seq: 222, Ack: 234, Len: 0

No.     Time        Source                Destination           Protocol Length Info
     64 28.380010   37.176.77.169         208.43.122.143        TCP      123    [TCP segment of a reassembled PDU]

Frame 64: 123 bytes on wire (984 bits), 123 bytes captured (984 bits)
Linux cooked capture
Internet Protocol Version 4, Src: 37.176.77.169 (37.176.77.169), Dst: 208.43.122.143 (208.43.122.143)
Transmission Control Protocol, Src Port: 59981 (59981), Dst Port: xmpp-client (5222), Seq: 222, Ack: 234, Len: 55

No.     Time        Source                Destination           Protocol Length Info
     65 28.601592   208.43.122.143        37.176.77.169         TCP      112    [TCP segment of a reassembled PDU]

Frame 65: 112 bytes on wire (896 bits), 112 bytes captured (896 bits)
Linux cooked capture
Internet Protocol Version 4, Src: 208.43.122.143 (208.43.122.143), Dst: 37.176.77.169 (37.176.77.169)
Transmission Control Protocol, Src Port: xmpp-client (5222), Dst Port: 59981 (59981), Seq: 234, Ack: 277, Len: 44

No.     Time        Source                Destination           Protocol Length Info
     66 28.602000   37.176.77.169         208.43.122.143        TCP      68     59981 > xmpp-client [ACK] Seq=277 Ack=278 Win=1846 Len=0 TSval=1060347 TSecr=2886671123

Frame 66: 68 bytes on wire (544 bits), 68 bytes captured (544 bits)
Linux cooked capture
Internet Protocol Version 4, Src: 37.176.77.169 (37.176.77.169), Dst: 208.43.122.143 (208.43.122.143)
Transmission Control Protocol, Src Port: 59981 (59981), Dst Port: xmpp-client (5222), Seq: 277, Ack: 278, Len: 0

No.     Time        Source                Destination           Protocol Length Info
     67 29.652955   37.176.77.169         208.43.122.143        TCP      123    [TCP segment of a reassembled PDU]

Frame 67: 123 bytes on wire (984 bits), 123 bytes captured (984 bits)
Linux cooked capture
Internet Protocol Version 4, Src: 37.176.77.169 (37.176.77.169), Dst: 208.43.122.143 (208.43.122.143)
Transmission Control Protocol, Src Port: 59981 (59981), Dst Port: xmpp-client (5222), Seq: 277, Ack: 278, Len: 55

No.     Time        Source                Destination           Protocol Length Info
     68 29.851157   208.43.122.143        37.176.77.169         TCP      112    [TCP segment of a reassembled PDU]

Frame 68: 112 bytes on wire (896 bits), 112 bytes captured (896 bits)
Linux cooked capture
Internet Protocol Version 4, Src: 208.43.122.143 (208.43.122.143), Dst: 37.176.77.169 (37.176.77.169)
Transmission Control Protocol, Src Port: xmpp-client (5222), Dst Port: 59981 (59981), Seq: 278, Ack: 332, Len: 44

No.     Time        Source                Destination           Protocol Length Info
     69 29.851665   37.176.77.169         208.43.122.143        TCP      68     59981 > xmpp-client [ACK] Seq=332 Ack=322 Win=1846 Len=0 TSval=1060472 TSecr=2886672383

Frame 69: 68 bytes on wire (544 bits), 68 bytes captured (544 bits)
Linux cooked capture
Internet Protocol Version 4, Src: 37.176.77.169 (37.176.77.169), Dst: 208.43.122.143 (208.43.122.143)
Transmission Control Protocol, Src Port: 59981 (59981), Dst Port: xmpp-client (5222), Seq: 332, Ack: 322, Len: 0

No.     Time        Source                Destination           Protocol Length Info
     70 31.144163   37.176.77.169         208.43.122.143        TCP      120    [TCP segment of a reassembled PDU]

Frame 70: 120 bytes on wire (960 bits), 120 bytes captured (960 bits)
Linux cooked capture
Internet Protocol Version 4, Src: 37.176.77.169 (37.176.77.169), Dst: 208.43.122.143 (208.43.122.143)
Transmission Control Protocol, Src Port: 59981 (59981), Dst Port: xmpp-client (5222), Seq: 332, Ack: 322, Len: 52

No.     Time        Source                Destination           Protocol Length Info
     71 31.361210   208.43.122.143        37.176.77.169         TCP      112    [TCP segment of a reassembled PDU]

Frame 71: 112 bytes on wire (896 bits), 112 bytes captured (896 bits)
Linux cooked capture
Internet Protocol Version 4, Src: 208.43.122.143 (208.43.122.143), Dst: 37.176.77.169 (37.176.77.169)
Transmission Control Protocol, Src Port: xmpp-client (5222), Dst Port: 59981 (59981), Seq: 322, Ack: 384, Len: 44

No.     Time        Source                Destination           Protocol Length Info
     72 31.361575   37.176.77.169         208.43.122.143        TCP      68     59981 > xmpp-client [ACK] Seq=384 Ack=366 Win=1846 Len=0 TSval=1060623 TSecr=2886673888

Frame 72: 68 bytes on wire (544 bits), 68 bytes captured (544 bits)
Linux cooked capture
Internet Protocol Version 4, Src: 37.176.77.169 (37.176.77.169), Dst: 208.43.122.143 (208.43.122.143)
Transmission Control Protocol, Src Port: 59981 (59981), Dst Port: xmpp-client (5222), Seq: 384, Ack: 366, Len: 0

No.     Time        Source                Destination           Protocol Length Info
     73 35.146317   37.176.77.169         208.43.122.143        TCP      130    [TCP segment of a reassembled PDU]

Frame 73: 130 bytes on wire (1040 bits), 130 bytes captured (1040 bits)
Linux cooked capture
Internet Protocol Version 4, Src: 37.176.77.169 (37.176.77.169), Dst: 208.43.122.143 (208.43.122.143)
Transmission Control Protocol, Src Port: 59981 (59981), Dst Port: xmpp-client (5222), Seq: 384, Ack: 366, Len: 62

No.     Time        Source                Destination           Protocol Length Info
     74 35.441223   208.43.122.143        37.176.77.169         TCP      112    [TCP segment of a reassembled PDU]

Frame 74: 112 bytes on wire (896 bits), 112 bytes captured (896 bits)
Linux cooked capture
Internet Protocol Version 4, Src: 208.43.122.143 (208.43.122.143), Dst: 37.176.77.169 (37.176.77.169)
Transmission Control Protocol, Src Port: xmpp-client (5222), Dst Port: 59981 (59981), Seq: 366, Ack: 446, Len: 44

No.     Time        Source                Destination           Protocol Length Info
     75 35.441580   37.176.77.169         208.43.122.143        TCP      68     59981 > xmpp-client [ACK] Seq=446 Ack=410 Win=1846 Len=0 TSval=1061031 TSecr=2886677968

Frame 75: 68 bytes on wire (544 bits), 68 bytes captured (544 bits)
Linux cooked capture
Internet Protocol Version 4, Src: 37.176.77.169 (37.176.77.169), Dst: 208.43.122.143 (208.43.122.143)
Transmission Control Protocol, Src Port: 59981 (59981), Dst Port: xmpp-client (5222), Seq: 446, Ack: 410, Len: 0

No.     Time        Source                Destination           Protocol Length Info
     76 37.455850   37.176.77.169         208.43.122.143        TCP      123    [TCP segment of a reassembled PDU]

Frame 76: 123 bytes on wire (984 bits), 123 bytes captured (984 bits)
Linux cooked capture
Internet Protocol Version 4, Src: 37.176.77.169 (37.176.77.169), Dst: 208.43.122.143 (208.43.122.143)
Transmission Control Protocol, Src Port: 59981 (59981), Dst Port: xmpp-client (5222), Seq: 446, Ack: 410, Len: 55

No.     Time        Source                Destination           Protocol Length Info
     77 37.761152   208.43.122.143        37.176.77.169         TCP      112    [TCP segment of a reassembled PDU]

Frame 77: 112 bytes on wire (896 bits), 112 bytes captured (896 bits)
Linux cooked capture
Internet Protocol Version 4, Src: 208.43.122.143 (208.43.122.143), Dst: 37.176.77.169 (37.176.77.169)
Transmission Control Protocol, Src Port: xmpp-client (5222), Dst Port: 59981 (59981), Seq: 410, Ack: 501, Len: 44

No.     Time        Source                Destination           Protocol Length Info
     78 37.761648   37.176.77.169         208.43.122.143        TCP      68     59981 > xmpp-client [ACK] Seq=501 Ack=454 Win=1846 Len=0 TSval=1061263 TSecr=2886680288

Frame 78: 68 bytes on wire (544 bits), 68 bytes captured (544 bits)
Linux cooked capture
Internet Protocol Version 4, Src: 37.176.77.169 (37.176.77.169), Dst: 208.43.122.143 (208.43.122.143)
Transmission Control Protocol, Src Port: 59981 (59981), Dst Port: xmpp-client (5222), Seq: 501, Ack: 454, Len: 0
