No.     Time        Source                Destination           Protocol Length Info
      1 0.000000    37.179.72.189         108.168.176.233       SSL      80     Continuation Data

Frame 1: 80 bytes on wire (640 bits), 80 bytes captured (640 bits)
Linux cooked capture
Internet Protocol Version 4, Src: 37.179.72.189 (37.179.72.189), Dst: 108.168.176.233 (108.168.176.233)
Transmission Control Protocol, Src Port: 52065 (52065), Dst Port: https (443), Seq: 1, Ack: 1, Len: 12
Secure Sockets Layer

No.     Time        Source                Destination           Protocol Length Info
      2 0.783140    108.168.176.233       37.179.72.189         SSL      95     Continuation Data

Frame 2: 95 bytes on wire (760 bits), 95 bytes captured (760 bits)
Linux cooked capture
Internet Protocol Version 4, Src: 108.168.176.233 (108.168.176.233), Dst: 37.179.72.189 (37.179.72.189)
Transmission Control Protocol, Src Port: https (443), Dst Port: 52065 (52065), Seq: 1, Ack: 13, Len: 27
Secure Sockets Layer

No.     Time        Source                Destination           Protocol Length Info
      3 0.783483    37.179.72.189         108.168.176.233       SSL      93     Continuation Data

Frame 3: 93 bytes on wire (744 bits), 93 bytes captured (744 bits)
Linux cooked capture
Internet Protocol Version 4, Src: 37.179.72.189 (37.179.72.189), Dst: 108.168.176.233 (108.168.176.233)
Transmission Control Protocol, Src Port: 52065 (52065), Dst Port: https (443), Seq: 13, Ack: 28, Len: 25
Secure Sockets Layer

No.     Time        Source                Destination           Protocol Length Info
      4 1.053075    108.168.176.233       37.179.72.189         SSL      86     Continuation Data

Frame 4: 86 bytes on wire (688 bits), 86 bytes captured (688 bits)
Linux cooked capture
Internet Protocol Version 4, Src: 108.168.176.233 (108.168.176.233), Dst: 37.179.72.189 (37.179.72.189)
Transmission Control Protocol, Src Port: https (443), Dst Port: 52065 (52065), Seq: 28, Ack: 38, Len: 18
Secure Sockets Layer

No.     Time        Source                Destination           Protocol Length Info
      5 1.086141    37.179.72.189         108.168.176.233       TCP      68     52065 > https [ACK] Seq=38 Ack=46 Win=1578 Len=0 TSval=448061 TSecr=3516200201

Frame 5: 68 bytes on wire (544 bits), 68 bytes captured (544 bits)
Linux cooked capture
Internet Protocol Version 4, Src: 37.179.72.189 (37.179.72.189), Dst: 108.168.176.233 (108.168.176.233)
Transmission Control Protocol, Src Port: 52065 (52065), Dst Port: https (443), Seq: 38, Ack: 46, Len: 0

No.     Time        Source                Destination           Protocol Length Info
      6 2.937378    37.179.72.189         108.168.176.233       SSL      97     Continuation Data

Frame 6: 97 bytes on wire (776 bits), 97 bytes captured (776 bits)
Linux cooked capture
Internet Protocol Version 4, Src: 37.179.72.189 (37.179.72.189), Dst: 108.168.176.233 (108.168.176.233)
Transmission Control Protocol, Src Port: 52065 (52065), Dst Port: https (443), Seq: 38, Ack: 46, Len: 29
Secure Sockets Layer

No.     Time        Source                Destination           Protocol Length Info
      7 3.243083    108.168.176.233       37.179.72.189         TCP      68     https > 52065 [ACK] Seq=46 Ack=67 Win=512 Len=0 TSval=3516202391 TSecr=448246

Frame 7: 68 bytes on wire (544 bits), 68 bytes captured (544 bits)
Linux cooked capture
Internet Protocol Version 4, Src: 108.168.176.233 (108.168.176.233), Dst: 37.179.72.189 (37.179.72.189)
Transmission Control Protocol, Src Port: https (443), Dst Port: 52065 (52065), Seq: 46, Ack: 67, Len: 0

No.     Time        Source                Destination           Protocol Length Info
      8 3.243485    37.179.72.189         108.168.176.233       SSL      108    Continuation Data

Frame 8: 108 bytes on wire (864 bits), 108 bytes captured (864 bits)
Linux cooked capture
Internet Protocol Version 4, Src: 37.179.72.189 (37.179.72.189), Dst: 108.168.176.233 (108.168.176.233)
Transmission Control Protocol, Src Port: 52065 (52065), Dst Port: https (443), Seq: 67, Ack: 46, Len: 40
Secure Sockets Layer

No.     Time        Source                Destination           Protocol Length Info
      9 3.503103    108.168.176.233       37.179.72.189         SSL      114    Continuation Data

Frame 9: 114 bytes on wire (912 bits), 114 bytes captured (912 bits)
Linux cooked capture
Internet Protocol Version 4, Src: 108.168.176.233 (108.168.176.233), Dst: 37.179.72.189 (37.179.72.189)
Transmission Control Protocol, Src Port: https (443), Dst Port: 52065 (52065), Seq: 46, Ack: 107, Len: 46
Secure Sockets Layer

No.     Time        Source                Destination           Protocol Length Info
     10 3.503545    37.179.72.189         108.168.176.233       TCP      68     52065 > https [ACK] Seq=107 Ack=92 Win=1578 Len=0 TSval=448302 TSecr=3516202646

Frame 10: 68 bytes on wire (544 bits), 68 bytes captured (544 bits)
Linux cooked capture
Internet Protocol Version 4, Src: 37.179.72.189 (37.179.72.189), Dst: 108.168.176.233 (108.168.176.233)
Transmission Control Protocol, Src Port: 52065 (52065), Dst Port: https (443), Seq: 107, Ack: 92, Len: 0

No.     Time        Source                Destination           Protocol Length Info
     11 9.953635    37.179.72.189         108.168.176.233       SSL      135    Continuation Data

Frame 11: 135 bytes on wire (1080 bits), 135 bytes captured (1080 bits)
Linux cooked capture
Internet Protocol Version 4, Src: 37.179.72.189 (37.179.72.189), Dst: 108.168.176.233 (108.168.176.233)
Transmission Control Protocol, Src Port: 52065 (52065), Dst Port: https (443), Seq: 107, Ack: 92, Len: 67
Secure Sockets Layer

No.     Time        Source                Destination           Protocol Length Info
     12 11.593791   108.168.176.233       37.179.72.189         SSL      112    Continuation Data

Frame 12: 112 bytes on wire (896 bits), 112 bytes captured (896 bits)
Linux cooked capture
Internet Protocol Version 4, Src: 108.168.176.233 (108.168.176.233), Dst: 37.179.72.189 (37.179.72.189)
Transmission Control Protocol, Src Port: https (443), Dst Port: 52065 (52065), Seq: 92, Ack: 174, Len: 44
Secure Sockets Layer

No.     Time        Source                Destination           Protocol Length Info
     13 11.594458   37.179.72.189         108.168.176.233       TCP      68     52065 > https [ACK] Seq=174 Ack=136 Win=1578 Len=0 TSval=449111 TSecr=3516209367

Frame 13: 68 bytes on wire (544 bits), 68 bytes captured (544 bits)
Linux cooked capture
Internet Protocol Version 4, Src: 37.179.72.189 (37.179.72.189), Dst: 108.168.176.233 (108.168.176.233)
Transmission Control Protocol, Src Port: 52065 (52065), Dst Port: https (443), Seq: 174, Ack: 136, Len: 0

No.     Time        Source                Destination           Protocol Length Info
     14 11.623821   108.168.176.233       37.179.72.189         SSL      112    [TCP Retransmission] Continuation Data

Frame 14: 112 bytes on wire (896 bits), 112 bytes captured (896 bits)
Linux cooked capture
Internet Protocol Version 4, Src: 108.168.176.233 (108.168.176.233), Dst: 37.179.72.189 (37.179.72.189)
Transmission Control Protocol, Src Port: https (443), Dst Port: 52065 (52065), Seq: 92, Ack: 174, Len: 44
Secure Sockets Layer

No.     Time        Source                Destination           Protocol Length Info
     15 11.624803   37.179.72.189         108.168.176.233       TCP      80     [TCP Dup ACK 13#1] 52065 > https [ACK] Seq=174 Ack=136 Win=1578 Len=0 TSval=449114 TSecr=3516210672 SLE=92 SRE=136

Frame 15: 80 bytes on wire (640 bits), 80 bytes captured (640 bits)
Linux cooked capture
Internet Protocol Version 4, Src: 37.179.72.189 (37.179.72.189), Dst: 108.168.176.233 (108.168.176.233)
Transmission Control Protocol, Src Port: 52065 (52065), Dst Port: https (443), Seq: 174, Ack: 136, Len: 0

No.     Time        Source                Destination           Protocol Length Info
     16 15.568323   37.179.72.189         188.125.68.71         TCP      76     41462 > imaps [SYN] Seq=0 Win=5240 Len=0 MSS=1310 SACK_PERM=1 TSval=449509 TSecr=0 WS=4

Frame 16: 76 bytes on wire (608 bits), 76 bytes captured (608 bits)
Linux cooked capture
Internet Protocol Version 4, Src: 37.179.72.189 (37.179.72.189), Dst: 188.125.68.71 (188.125.68.71)
Transmission Control Protocol, Src Port: 41462 (41462), Dst Port: imaps (993), Seq: 0, Len: 0

No.     Time        Source                Destination           Protocol Length Info
     17 15.903600   188.125.68.71         37.179.72.189         TCP      72     imaps > 41462 [SYN, ACK] Seq=0 Ack=1 Win=14480 Len=0 MSS=1400 SACK_PERM=1 TSval=1556339087 TSecr=449509

Frame 17: 72 bytes on wire (576 bits), 72 bytes captured (576 bits)
Linux cooked capture
Internet Protocol Version 4, Src: 188.125.68.71 (188.125.68.71), Dst: 37.179.72.189 (37.179.72.189)
Transmission Control Protocol, Src Port: imaps (993), Dst Port: 41462 (41462), Seq: 0, Ack: 1, Len: 0

No.     Time        Source                Destination           Protocol Length Info
     18 15.903961   37.179.72.189         188.125.68.71         TCP      68     41462 > imaps [ACK] Seq=1 Ack=1 Win=5240 Len=0 TSval=449542 TSecr=1556339087

Frame 18: 68 bytes on wire (544 bits), 68 bytes captured (544 bits)
Linux cooked capture
Internet Protocol Version 4, Src: 37.179.72.189 (37.179.72.189), Dst: 188.125.68.71 (188.125.68.71)
Transmission Control Protocol, Src Port: 41462 (41462), Dst Port: imaps (993), Seq: 1, Ack: 1, Len: 0

No.     Time        Source                Destination           Protocol Length Info
     19 15.934138   37.179.72.189         188.125.68.71         TLSv1    180    Client Hello

Frame 19: 180 bytes on wire (1440 bits), 180 bytes captured (1440 bits)
Linux cooked capture
Internet Protocol Version 4, Src: 37.179.72.189 (37.179.72.189), Dst: 188.125.68.71 (188.125.68.71)
Transmission Control Protocol, Src Port: 41462 (41462), Dst Port: imaps (993), Seq: 1, Ack: 1, Len: 112
Secure Sockets Layer

No.     Time        Source                Destination           Protocol Length Info
     20 16.916108   37.179.72.189         188.125.68.71         TLSv1    180    [TCP Retransmission] Client Hello

Frame 20: 180 bytes on wire (1440 bits), 180 bytes captured (1440 bits)
Linux cooked capture
Internet Protocol Version 4, Src: 37.179.72.189 (37.179.72.189), Dst: 188.125.68.71 (188.125.68.71)
Transmission Control Protocol, Src Port: 41462 (41462), Dst Port: imaps (993), Seq: 1, Ack: 1, Len: 112
Secure Sockets Layer

No.     Time        Source                Destination           Protocol Length Info
     21 17.255383   188.125.68.71         37.179.72.189         TCP      68     imaps > 41462 [ACK] Seq=1 Ack=113 Win=14480 Len=0 TSval=1556339789 TSecr=449545

Frame 21: 68 bytes on wire (544 bits), 68 bytes captured (544 bits)
Linux cooked capture
Internet Protocol Version 4, Src: 188.125.68.71 (188.125.68.71), Dst: 37.179.72.189 (37.179.72.189)
Transmission Control Protocol, Src Port: imaps (993), Dst Port: 41462 (41462), Seq: 1, Ack: 113, Len: 0

No.     Time        Source                Destination           Protocol Length Info
     22 17.265478   188.125.68.71         37.179.72.189         TLSv1    1366   Server Hello

Frame 22: 1366 bytes on wire (10928 bits), 1366 bytes captured (10928 bits)
Linux cooked capture
Internet Protocol Version 4, Src: 188.125.68.71 (188.125.68.71), Dst: 37.179.72.189 (37.179.72.189)
Transmission Control Protocol, Src Port: imaps (993), Dst Port: 41462 (41462), Seq: 1, Ack: 113, Len: 1298
Secure Sockets Layer

No.     Time        Source                Destination           Protocol Length Info
     23 17.265601   37.179.72.189         188.125.68.71         TCP      68     41462 > imaps [ACK] Seq=113 Ack=1299 Win=7788 Len=0 TSval=449678 TSecr=1556339789

Frame 23: 68 bytes on wire (544 bits), 68 bytes captured (544 bits)
Linux cooked capture
Internet Protocol Version 4, Src: 37.179.72.189 (37.179.72.189), Dst: 188.125.68.71 (188.125.68.71)
Transmission Control Protocol, Src Port: 41462 (41462), Dst Port: imaps (993), Seq: 113, Ack: 1299, Len: 0

No.     Time        Source                Destination           Protocol Length Info
     24 17.305575   188.125.68.71         37.179.72.189         TCP      1366   [TCP segment of a reassembled PDU]

Frame 24: 1366 bytes on wire (10928 bits), 1366 bytes captured (10928 bits)
Linux cooked capture
Internet Protocol Version 4, Src: 188.125.68.71 (188.125.68.71), Dst: 37.179.72.189 (37.179.72.189)
Transmission Control Protocol, Src Port: imaps (993), Dst Port: 41462 (41462), Seq: 1299, Ack: 113, Len: 1298

No.     Time        Source                Destination           Protocol Length Info
     25 17.305795   37.179.72.189         188.125.68.71         TCP      68     41462 > imaps [ACK] Seq=113 Ack=2597 Win=10384 Len=0 TSval=449682 TSecr=1556339789

Frame 25: 68 bytes on wire (544 bits), 68 bytes captured (544 bits)
Linux cooked capture
Internet Protocol Version 4, Src: 37.179.72.189 (37.179.72.189), Dst: 188.125.68.71 (188.125.68.71)
Transmission Control Protocol, Src Port: 41462 (41462), Dst Port: imaps (993), Seq: 113, Ack: 2597, Len: 0

No.     Time        Source                Destination           Protocol Length Info
     26 17.305923   188.125.68.71         37.179.72.189         TCP      1366   [TCP segment of a reassembled PDU]

Frame 26: 1366 bytes on wire (10928 bits), 1366 bytes captured (10928 bits)
Linux cooked capture
Internet Protocol Version 4, Src: 188.125.68.71 (188.125.68.71), Dst: 37.179.72.189 (37.179.72.189)
Transmission Control Protocol, Src Port: imaps (993), Dst Port: 41462 (41462), Seq: 2597, Ack: 113, Len: 1298

No.     Time        Source                Destination           Protocol Length Info
     27 17.306128   188.125.68.71         37.179.72.189         TCP      270    [TCP segment of a reassembled PDU]

Frame 27: 270 bytes on wire (2160 bits), 270 bytes captured (2160 bits)
Linux cooked capture
Internet Protocol Version 4, Src: 188.125.68.71 (188.125.68.71), Dst: 37.179.72.189 (37.179.72.189)
Transmission Control Protocol, Src Port: imaps (993), Dst Port: 41462 (41462), Seq: 3895, Ack: 113, Len: 202

No.     Time        Source                Destination           Protocol Length Info
     28 17.306380   188.125.68.71         37.179.72.189         TCP      80     [TCP Dup ACK 27#1] imaps > 41462 [ACK] Seq=4097 Ack=113 Win=14480 Len=0 TSval=1556340570 TSecr=449644 SLE=1 SRE=113

Frame 28: 80 bytes on wire (640 bits), 80 bytes captured (640 bits)
Linux cooked capture
Internet Protocol Version 4, Src: 188.125.68.71 (188.125.68.71), Dst: 37.179.72.189 (37.179.72.189)
Transmission Control Protocol, Src Port: imaps (993), Dst Port: 41462 (41462), Seq: 4097, Ack: 113, Len: 0

No.     Time        Source                Destination           Protocol Length Info
     29 17.307880   37.179.72.189         188.125.68.71         TCP      68     41462 > imaps [ACK] Seq=113 Ack=3895 Win=12980 Len=0 TSval=449682 TSecr=1556339789

Frame 29: 68 bytes on wire (544 bits), 68 bytes captured (544 bits)
Linux cooked capture
Internet Protocol Version 4, Src: 37.179.72.189 (37.179.72.189), Dst: 188.125.68.71 (188.125.68.71)
Transmission Control Protocol, Src Port: 41462 (41462), Dst Port: imaps (993), Seq: 113, Ack: 3895, Len: 0

No.     Time        Source                Destination           Protocol Length Info
     30 17.307936   37.179.72.189         188.125.68.71         TCP      68     41462 > imaps [ACK] Seq=113 Ack=4097 Win=15576 Len=0 TSval=449683 TSecr=1556339789

Frame 30: 68 bytes on wire (544 bits), 68 bytes captured (544 bits)
Linux cooked capture
Internet Protocol Version 4, Src: 37.179.72.189 (37.179.72.189), Dst: 188.125.68.71 (188.125.68.71)
Transmission Control Protocol, Src Port: 41462 (41462), Dst Port: imaps (993), Seq: 113, Ack: 4097, Len: 0

No.     Time        Source                Destination           Protocol Length Info
     31 17.535316   54.235.187.3          37.179.72.189         TCP      68     http > 36368 [FIN, ACK] Seq=1 Ack=1 Win=64251 Len=0 TSval=1685778424 TSecr=446712

Frame 31: 68 bytes on wire (544 bits), 68 bytes captured (544 bits)
Linux cooked capture
Internet Protocol Version 4, Src: 54.235.187.3 (54.235.187.3), Dst: 37.179.72.189 (37.179.72.189)
Transmission Control Protocol, Src Port: http (80), Dst Port: 36368 (36368), Seq: 1, Ack: 1, Len: 0

No.     Time        Source                Destination           Protocol Length Info
     32 17.545265   188.125.68.71         37.179.72.189         TLSv1    210    Certificate, Server Hello Done

Frame 32: 210 bytes on wire (1680 bits), 210 bytes captured (1680 bits)
Linux cooked capture
Internet Protocol Version 4, Src: 188.125.68.71 (188.125.68.71), Dst: 37.179.72.189 (37.179.72.189)
Transmission Control Protocol, Src Port: imaps (993), Dst Port: 41462 (41462), Seq: 4097, Ack: 113, Len: 142
[5 Reassembled TCP Segments (4152 bytes): #22(1212), #24(1298), #26(1298), #27(202), #32(142)]
Secure Sockets Layer

No.     Time        Source                Destination           Protocol Length Info
     33 17.545411   37.179.72.189         188.125.68.71         TCP      68     41462 > imaps [ACK] Seq=113 Ack=4239 Win=18172 Len=0 TSval=449706 TSecr=1556340805

Frame 33: 68 bytes on wire (544 bits), 68 bytes captured (544 bits)
Linux cooked capture
Internet Protocol Version 4, Src: 37.179.72.189 (37.179.72.189), Dst: 188.125.68.71 (188.125.68.71)
Transmission Control Protocol, Src Port: 41462 (41462), Dst Port: imaps (993), Seq: 113, Ack: 4239, Len: 0

No.     Time        Source                Destination           Protocol Length Info
     34 17.566138   37.179.72.189         54.235.187.3          TCP      68     36368 > http [ACK] Seq=1 Ack=2 Win=1959 Len=0 TSval=449709 TSecr=1685778424

Frame 34: 68 bytes on wire (544 bits), 68 bytes captured (544 bits)
Linux cooked capture
Internet Protocol Version 4, Src: 37.179.72.189 (37.179.72.189), Dst: 54.235.187.3 (54.235.187.3)
Transmission Control Protocol, Src Port: 36368 (36368), Dst Port: http (80), Seq: 1, Ack: 2, Len: 0

No.     Time        Source                Destination           Protocol Length Info
     35 17.720965   37.179.72.189         108.168.176.233       SSL      138    Continuation Data

Frame 35: 138 bytes on wire (1104 bits), 138 bytes captured (1104 bits)
Linux cooked capture
Internet Protocol Version 4, Src: 37.179.72.189 (37.179.72.189), Dst: 108.168.176.233 (108.168.176.233)
Transmission Control Protocol, Src Port: 52065 (52065), Dst Port: https (443), Seq: 174, Ack: 136, Len: 70
Secure Sockets Layer

No.     Time        Source                Destination           Protocol Length Info
     36 18.005345   108.168.176.233       37.179.72.189         SSL      112    Continuation Data

Frame 36: 112 bytes on wire (896 bits), 112 bytes captured (896 bits)
Linux cooked capture
Internet Protocol Version 4, Src: 108.168.176.233 (108.168.176.233), Dst: 37.179.72.189 (37.179.72.189)
Transmission Control Protocol, Src Port: https (443), Dst Port: 52065 (52065), Seq: 136, Ack: 244, Len: 44
Secure Sockets Layer

No.     Time        Source                Destination           Protocol Length Info
     37 18.005743   37.179.72.189         108.168.176.233       TCP      68     52065 > https [ACK] Seq=244 Ack=180 Win=1578 Len=0 TSval=449752 TSecr=3516217149

Frame 37: 68 bytes on wire (544 bits), 68 bytes captured (544 bits)
Linux cooked capture
Internet Protocol Version 4, Src: 37.179.72.189 (37.179.72.189), Dst: 108.168.176.233 (108.168.176.233)
Transmission Control Protocol, Src Port: 52065 (52065), Dst Port: https (443), Seq: 244, Ack: 180, Len: 0

No.     Time        Source                Destination           Protocol Length Info
     38 18.214006   37.179.72.189         130.186.6.177         TCP      68     47011 > imaps [FIN, ACK] Seq=1 Ack=1 Win=8449 Len=0 TSval=449773 TSecr=2624680587

Frame 38: 68 bytes on wire (544 bits), 68 bytes captured (544 bits)
Linux cooked capture
Internet Protocol Version 4, Src: 37.179.72.189 (37.179.72.189), Dst: 130.186.6.177 (130.186.6.177)
Transmission Control Protocol, Src Port: 47011 (47011), Dst Port: imaps (993), Seq: 1, Ack: 1, Len: 0

No.     Time        Source                Destination           Protocol Length Info
     39 18.216268   37.179.72.189         65.55.174.170         TCP      68     41004 > imaps [FIN, ACK] Seq=1 Ack=1 Win=7151 Len=0 TSval=449774 TSecr=221965274

Frame 39: 68 bytes on wire (544 bits), 68 bytes captured (544 bits)
Linux cooked capture
Internet Protocol Version 4, Src: 37.179.72.189 (37.179.72.189), Dst: 65.55.174.170 (65.55.174.170)
Transmission Control Protocol, Src Port: 41004 (41004), Dst Port: imaps (993), Seq: 1, Ack: 1, Len: 0

No.     Time        Source                Destination           Protocol Length Info
     40 18.243540   37.179.72.189         188.125.68.71         TLSv1    382    Client Key Exchange, Change Cipher Spec, Encrypted Handshake Message

Frame 40: 382 bytes on wire (3056 bits), 382 bytes captured (3056 bits)
Linux cooked capture
Internet Protocol Version 4, Src: 37.179.72.189 (37.179.72.189), Dst: 188.125.68.71 (188.125.68.71)
Transmission Control Protocol, Src Port: 41462 (41462), Dst Port: imaps (993), Seq: 113, Ack: 4239, Len: 314
Secure Sockets Layer

No.     Time        Source                Destination           Protocol Length Info
     41 18.355313   130.186.6.177         37.179.72.189         TLSv1    145    Application Data

Frame 41: 145 bytes on wire (1160 bits), 145 bytes captured (1160 bits)
Linux cooked capture
Internet Protocol Version 4, Src: 130.186.6.177 (130.186.6.177), Dst: 37.179.72.189 (37.179.72.189)
Transmission Control Protocol, Src Port: imaps (993), Dst Port: 47011 (47011), Seq: 1, Ack: 2, Len: 77
Secure Sockets Layer

No.     Time        Source                Destination           Protocol Length Info
     42 18.355706   37.179.72.189         130.186.6.177         TCP      56     47011 > imaps [RST] Seq=2 Win=0 Len=0

Frame 42: 56 bytes on wire (448 bits), 56 bytes captured (448 bits)
Linux cooked capture
Internet Protocol Version 4, Src: 37.179.72.189 (37.179.72.189), Dst: 130.186.6.177 (130.186.6.177)
Transmission Control Protocol, Src Port: 47011 (47011), Dst Port: imaps (993), Seq: 2, Len: 0

No.     Time        Source                Destination           Protocol Length Info
     43 18.355813   130.186.6.177         37.179.72.189         TCP      68     imaps > 47011 [FIN, ACK] Seq=78 Ack=2 Win=62 Len=0 TSval=2624746101 TSecr=449773

Frame 43: 68 bytes on wire (544 bits), 68 bytes captured (544 bits)
Linux cooked capture
Internet Protocol Version 4, Src: 130.186.6.177 (130.186.6.177), Dst: 37.179.72.189 (37.179.72.189)
Transmission Control Protocol, Src Port: imaps (993), Dst Port: 47011 (47011), Seq: 78, Ack: 2, Len: 0

No.     Time        Source                Destination           Protocol Length Info
     44 18.356215   37.179.72.189         130.186.6.177         TCP      56     47011 > imaps [RST] Seq=2 Win=0 Len=0

Frame 44: 56 bytes on wire (448 bits), 56 bytes captured (448 bits)
Linux cooked capture
Internet Protocol Version 4, Src: 37.179.72.189 (37.179.72.189), Dst: 130.186.6.177 (130.186.6.177)
Transmission Control Protocol, Src Port: 47011 (47011), Dst Port: imaps (993), Seq: 2, Len: 0

No.     Time        Source                Destination           Protocol Length Info
     45 18.495313   65.55.174.170         37.179.72.189         TCP      68     imaps > 41004 [ACK] Seq=1 Ack=2 Win=254 Len=0 TSval=222000341 TSecr=449774

Frame 45: 68 bytes on wire (544 bits), 68 bytes captured (544 bits)
Linux cooked capture
Internet Protocol Version 4, Src: 65.55.174.170 (65.55.174.170), Dst: 37.179.72.189 (37.179.72.189)
Transmission Control Protocol, Src Port: imaps (993), Dst Port: 41004 (41004), Seq: 1, Ack: 2, Len: 0

No.     Time        Source                Destination           Protocol Length Info
     46 18.625270   188.125.68.71         37.179.72.189         TCP      68     imaps > 41462 [ACK] Seq=4239 Ack=427 Win=15544 Len=0 TSval=1556341885 TSecr=449776

Frame 46: 68 bytes on wire (544 bits), 68 bytes captured (544 bits)
Linux cooked capture
Internet Protocol Version 4, Src: 188.125.68.71 (188.125.68.71), Dst: 37.179.72.189 (37.179.72.189)
Transmission Control Protocol, Src Port: imaps (993), Dst Port: 41462 (41462), Seq: 4239, Ack: 427, Len: 0

No.     Time        Source                Destination           Protocol Length Info
     47 18.645271   188.125.68.71         37.179.72.189         TLSv1    115    Change Cipher Spec, Encrypted Handshake Message

Frame 47: 115 bytes on wire (920 bits), 115 bytes captured (920 bits)
Linux cooked capture
Internet Protocol Version 4, Src: 188.125.68.71 (188.125.68.71), Dst: 37.179.72.189 (37.179.72.189)
Transmission Control Protocol, Src Port: imaps (993), Dst Port: 41462 (41462), Seq: 4239, Ack: 427, Len: 47
Secure Sockets Layer

No.     Time        Source                Destination           Protocol Length Info
     48 18.645478   37.179.72.189         188.125.68.71         TCP      68     41462 > imaps [ACK] Seq=427 Ack=4286 Win=18172 Len=0 TSval=449816 TSecr=1556341908

Frame 48: 68 bytes on wire (544 bits), 68 bytes captured (544 bits)
Linux cooked capture
Internet Protocol Version 4, Src: 37.179.72.189 (37.179.72.189), Dst: 188.125.68.71 (188.125.68.71)
Transmission Control Protocol, Src Port: 41462 (41462), Dst Port: imaps (993), Seq: 427, Ack: 4286, Len: 0

No.     Time        Source                Destination           Protocol Length Info
     49 18.665336   65.55.174.170         37.179.72.189         TCP      68     imaps > 41004 [FIN, ACK] Seq=1 Ack=2 Win=254 Len=0 TSval=222000357 TSecr=449774

Frame 49: 68 bytes on wire (544 bits), 68 bytes captured (544 bits)
Linux cooked capture
Internet Protocol Version 4, Src: 65.55.174.170 (65.55.174.170), Dst: 37.179.72.189 (37.179.72.189)
Transmission Control Protocol, Src Port: imaps (993), Dst Port: 41004 (41004), Seq: 1, Ack: 2, Len: 0

No.     Time        Source                Destination           Protocol Length Info
     50 18.665651   37.179.72.189         65.55.174.170         TCP      68     41004 > imaps [ACK] Seq=2 Ack=2 Win=7151 Len=0 TSval=449818 TSecr=222000357

Frame 50: 68 bytes on wire (544 bits), 68 bytes captured (544 bits)
Linux cooked capture
Internet Protocol Version 4, Src: 37.179.72.189 (37.179.72.189), Dst: 65.55.174.170 (65.55.174.170)
Transmission Control Protocol, Src Port: 41004 (41004), Dst Port: imaps (993), Seq: 2, Ack: 2, Len: 0

No.     Time        Source                Destination           Protocol Length Info
     51 18.825340   188.125.68.71         37.179.72.189         TLSv1    353    Application Data

Frame 51: 353 bytes on wire (2824 bits), 353 bytes captured (2824 bits)
Linux cooked capture
Internet Protocol Version 4, Src: 188.125.68.71 (188.125.68.71), Dst: 37.179.72.189 (37.179.72.189)
Transmission Control Protocol, Src Port: imaps (993), Dst Port: 41462 (41462), Seq: 4286, Ack: 427, Len: 285
Secure Sockets Layer

No.     Time        Source                Destination           Protocol Length Info
     52 18.825650   37.179.72.189         188.125.68.71         TCP      68     41462 > imaps [ACK] Seq=427 Ack=4571 Win=20768 Len=0 TSval=449834 TSecr=1556342086

Frame 52: 68 bytes on wire (544 bits), 68 bytes captured (544 bits)
Linux cooked capture
Internet Protocol Version 4, Src: 37.179.72.189 (37.179.72.189), Dst: 188.125.68.71 (188.125.68.71)
Transmission Control Protocol, Src Port: 41462 (41462), Dst Port: imaps (993), Seq: 427, Ack: 4571, Len: 0

No.     Time        Source                Destination           Protocol Length Info
     53 18.833500   37.179.72.189         188.125.68.71         TLSv1    107    Application Data

Frame 53: 107 bytes on wire (856 bits), 107 bytes captured (856 bits)
Linux cooked capture
Internet Protocol Version 4, Src: 37.179.72.189 (37.179.72.189), Dst: 188.125.68.71 (188.125.68.71)
Transmission Control Protocol, Src Port: 41462 (41462), Dst Port: imaps (993), Seq: 427, Ack: 4571, Len: 39
Secure Sockets Layer

No.     Time        Source                Destination           Protocol Length Info
     54 19.085366   188.125.68.71         37.179.72.189         TLSv1    301    Application Data

Frame 54: 301 bytes on wire (2408 bits), 301 bytes captured (2408 bits)
Linux cooked capture
Internet Protocol Version 4, Src: 188.125.68.71 (188.125.68.71), Dst: 37.179.72.189 (37.179.72.189)
Transmission Control Protocol, Src Port: imaps (993), Dst Port: 41462 (41462), Seq: 4571, Ack: 466, Len: 233
Secure Sockets Layer

No.     Time        Source                Destination           Protocol Length Info
     55 19.092436   37.179.72.189         188.125.68.71         TLSv1    107    Application Data

Frame 55: 107 bytes on wire (856 bits), 107 bytes captured (856 bits)
Linux cooked capture
Internet Protocol Version 4, Src: 37.179.72.189 (37.179.72.189), Dst: 188.125.68.71 (188.125.68.71)
Transmission Control Protocol, Src Port: 41462 (41462), Dst Port: imaps (993), Seq: 466, Ack: 4804, Len: 39
Secure Sockets Layer

No.     Time        Source                Destination           Protocol Length Info
     56 19.305500   188.125.68.71         37.179.72.189         TLSv1    301    Application Data

Frame 56: 301 bytes on wire (2408 bits), 301 bytes captured (2408 bits)
Linux cooked capture
Internet Protocol Version 4, Src: 188.125.68.71 (188.125.68.71), Dst: 37.179.72.189 (37.179.72.189)
Transmission Control Protocol, Src Port: imaps (993), Dst Port: 41462 (41462), Seq: 4804, Ack: 505, Len: 233
Secure Sockets Layer

No.     Time        Source                Destination           Protocol Length Info
     57 19.322761   37.179.72.189         188.125.68.71         TLSv1    126    Application Data

Frame 57: 126 bytes on wire (1008 bits), 126 bytes captured (1008 bits)
Linux cooked capture
Internet Protocol Version 4, Src: 37.179.72.189 (37.179.72.189), Dst: 188.125.68.71 (188.125.68.71)
Transmission Control Protocol, Src Port: 41462 (41462), Dst Port: imaps (993), Seq: 505, Ack: 5037, Len: 58
Secure Sockets Layer

No.     Time        Source                Destination           Protocol Length Info
     58 19.585280   188.125.68.71         37.179.72.189         TCP      68     imaps > 41462 [ACK] Seq=5037 Ack=563 Win=15544 Len=0 TSval=1556342845 TSecr=449884

Frame 58: 68 bytes on wire (544 bits), 68 bytes captured (544 bits)
Linux cooked capture
Internet Protocol Version 4, Src: 188.125.68.71 (188.125.68.71), Dst: 37.179.72.189 (37.179.72.189)
Transmission Control Protocol, Src Port: imaps (993), Dst Port: 41462 (41462), Seq: 5037, Ack: 563, Len: 0

No.     Time        Source                Destination           Protocol Length Info
     59 19.635306   188.125.68.71         37.179.72.189         TLSv1    157    Application Data

Frame 59: 157 bytes on wire (1256 bits), 157 bytes captured (1256 bits)
Linux cooked capture
Internet Protocol Version 4, Src: 188.125.68.71 (188.125.68.71), Dst: 37.179.72.189 (37.179.72.189)
Transmission Control Protocol, Src Port: imaps (993), Dst Port: 41462 (41462), Seq: 5037, Ack: 563, Len: 89
Secure Sockets Layer

No.     Time        Source                Destination           Protocol Length Info
     60 19.638568   37.179.72.189         188.125.68.71         TLSv1    108    Application Data

Frame 60: 108 bytes on wire (864 bits), 108 bytes captured (864 bits)
Linux cooked capture
Internet Protocol Version 4, Src: 37.179.72.189 (37.179.72.189), Dst: 188.125.68.71 (188.125.68.71)
Transmission Control Protocol, Src Port: 41462 (41462), Dst Port: imaps (993), Seq: 563, Ack: 5126, Len: 40
Secure Sockets Layer

No.     Time        Source                Destination           Protocol Length Info
     61 19.865385   188.125.68.71         37.179.72.189         TCP      68     imaps > 41462 [ACK] Seq=5126 Ack=603 Win=15544 Len=0 TSval=1556343125 TSecr=449916

Frame 61: 68 bytes on wire (544 bits), 68 bytes captured (544 bits)
Linux cooked capture
Internet Protocol Version 4, Src: 188.125.68.71 (188.125.68.71), Dst: 37.179.72.189 (37.179.72.189)
Transmission Control Protocol, Src Port: imaps (993), Dst Port: 41462 (41462), Seq: 5126, Ack: 603, Len: 0

No.     Time        Source                Destination           Protocol Length Info
     62 19.865721   188.125.68.71         37.179.72.189         TLSv1    387    Application Data

Frame 62: 387 bytes on wire (3096 bits), 387 bytes captured (3096 bits)
Linux cooked capture
Internet Protocol Version 4, Src: 188.125.68.71 (188.125.68.71), Dst: 37.179.72.189 (37.179.72.189)
Transmission Control Protocol, Src Port: imaps (993), Dst Port: 41462 (41462), Seq: 5126, Ack: 603, Len: 319
Secure Sockets Layer

No.     Time        Source                Destination           Protocol Length Info
     63 19.896203   37.179.72.189         188.125.68.71         TCP      68     41462 > imaps [ACK] Seq=603 Ack=5445 Win=28556 Len=0 TSval=449942 TSecr=1556343126

Frame 63: 68 bytes on wire (544 bits), 68 bytes captured (544 bits)
Linux cooked capture
Internet Protocol Version 4, Src: 37.179.72.189 (37.179.72.189), Dst: 188.125.68.71 (188.125.68.71)
Transmission Control Protocol, Src Port: 41462 (41462), Dst Port: imaps (993), Seq: 603, Ack: 5445, Len: 0

No.     Time        Source                Destination           Protocol Length Info
     64 20.139996   37.179.72.189         188.125.68.71         TLSv1    101    Application Data

Frame 64: 101 bytes on wire (808 bits), 101 bytes captured (808 bits)
Linux cooked capture
Internet Protocol Version 4, Src: 37.179.72.189 (37.179.72.189), Dst: 188.125.68.71 (188.125.68.71)
Transmission Control Protocol, Src Port: 41462 (41462), Dst Port: imaps (993), Seq: 603, Ack: 5445, Len: 33
Secure Sockets Layer

No.     Time        Source                Destination           Protocol Length Info
     65 20.345341   188.125.68.71         37.179.72.189         TLSv1    114    Application Data

Frame 65: 114 bytes on wire (912 bits), 114 bytes captured (912 bits)
Linux cooked capture
Internet Protocol Version 4, Src: 188.125.68.71 (188.125.68.71), Dst: 37.179.72.189 (37.179.72.189)
Transmission Control Protocol, Src Port: imaps (993), Dst Port: 41462 (41462), Seq: 5445, Ack: 636, Len: 46
Secure Sockets Layer

No.     Time        Source                Destination           Protocol Length Info
     66 20.347953   37.179.72.189         188.125.68.71         TCP      68     41462 > imaps [ACK] Seq=636 Ack=5491 Win=28556 Len=0 TSval=449987 TSecr=1556343606

Frame 66: 68 bytes on wire (544 bits), 68 bytes captured (544 bits)
Linux cooked capture
Internet Protocol Version 4, Src: 37.179.72.189 (37.179.72.189), Dst: 188.125.68.71 (188.125.68.71)
Transmission Control Protocol, Src Port: 41462 (41462), Dst Port: imaps (993), Seq: 636, Ack: 5491, Len: 0

No.     Time        Source                Destination           Protocol Length Info
     67 20.351740   37.179.72.189         188.125.68.71         TLSv1    111    Application Data

Frame 67: 111 bytes on wire (888 bits), 111 bytes captured (888 bits)
Linux cooked capture
Internet Protocol Version 4, Src: 37.179.72.189 (37.179.72.189), Dst: 188.125.68.71 (188.125.68.71)
Transmission Control Protocol, Src Port: 41462 (41462), Dst Port: imaps (993), Seq: 636, Ack: 5491, Len: 43
Secure Sockets Layer

No.     Time        Source                Destination           Protocol Length Info
     68 20.585488   188.125.68.71         37.179.72.189         TLSv1    487    Application Data

Frame 68: 487 bytes on wire (3896 bits), 487 bytes captured (3896 bits)
Linux cooked capture
Internet Protocol Version 4, Src: 188.125.68.71 (188.125.68.71), Dst: 37.179.72.189 (37.179.72.189)
Transmission Control Protocol, Src Port: imaps (993), Dst Port: 41462 (41462), Seq: 5491, Ack: 679, Len: 419
Secure Sockets Layer

No.     Time        Source                Destination           Protocol Length Info
     69 20.602256   37.179.72.189         188.125.68.71         TLSv1    124    Application Data

Frame 69: 124 bytes on wire (992 bits), 124 bytes captured (992 bits)
Linux cooked capture
Internet Protocol Version 4, Src: 37.179.72.189 (37.179.72.189), Dst: 188.125.68.71 (188.125.68.71)
Transmission Control Protocol, Src Port: 41462 (41462), Dst Port: imaps (993), Seq: 679, Ack: 5910, Len: 56
Secure Sockets Layer

No.     Time        Source                Destination           Protocol Length Info
     70 20.845398   188.125.68.71         37.179.72.189         TLSv1    232    Application Data

Frame 70: 232 bytes on wire (1856 bits), 232 bytes captured (1856 bits)
Linux cooked capture
Internet Protocol Version 4, Src: 188.125.68.71 (188.125.68.71), Dst: 37.179.72.189 (37.179.72.189)
Transmission Control Protocol, Src Port: imaps (993), Dst Port: 41462 (41462), Seq: 5910, Ack: 735, Len: 164
Secure Sockets Layer

No.     Time        Source                Destination           Protocol Length Info
     71 20.857746   37.179.72.189         188.125.68.71         TLSv1    219    Application Data

Frame 71: 219 bytes on wire (1752 bits), 219 bytes captured (1752 bits)
Linux cooked capture
Internet Protocol Version 4, Src: 37.179.72.189 (37.179.72.189), Dst: 188.125.68.71 (188.125.68.71)
Transmission Control Protocol, Src Port: 41462 (41462), Dst Port: imaps (993), Seq: 735, Ack: 6074, Len: 151
Secure Sockets Layer

No.     Time        Source                Destination           Protocol Length Info
     72 21.175896   188.125.68.71         37.179.72.189         TLSv1    1022   Application Data

Frame 72: 1022 bytes on wire (8176 bits), 1022 bytes captured (8176 bits)
Linux cooked capture
Internet Protocol Version 4, Src: 188.125.68.71 (188.125.68.71), Dst: 37.179.72.189 (37.179.72.189)
Transmission Control Protocol, Src Port: imaps (993), Dst Port: 41462 (41462), Seq: 6074, Ack: 886, Len: 954
Secure Sockets Layer

No.     Time        Source                Destination           Protocol Length Info
     73 21.206130   37.179.72.189         188.125.68.71         TCP      68     41462 > imaps [ACK] Seq=886 Ack=7028 Win=36344 Len=0 TSval=450073 TSecr=1556344406

Frame 73: 68 bytes on wire (544 bits), 68 bytes captured (544 bits)
Linux cooked capture
Internet Protocol Version 4, Src: 37.179.72.189 (37.179.72.189), Dst: 188.125.68.71 (188.125.68.71)
Transmission Control Protocol, Src Port: 41462 (41462), Dst Port: imaps (993), Seq: 886, Ack: 7028, Len: 0

No.     Time        Source                Destination           Protocol Length Info
     74 28.683561   37.179.72.189         108.168.176.233       SSL      125    Continuation Data

Frame 74: 125 bytes on wire (1000 bits), 125 bytes captured (1000 bits)
Linux cooked capture
Internet Protocol Version 4, Src: 37.179.72.189 (37.179.72.189), Dst: 108.168.176.233 (108.168.176.233)
Transmission Control Protocol, Src Port: 52065 (52065), Dst Port: https (443), Seq: 244, Ack: 180, Len: 57
Secure Sockets Layer

No.     Time        Source                Destination           Protocol Length Info
     75 29.364673   108.168.176.233       37.179.72.189         SSL      112    Continuation Data

Frame 75: 112 bytes on wire (896 bits), 112 bytes captured (896 bits)
Linux cooked capture
Internet Protocol Version 4, Src: 108.168.176.233 (108.168.176.233), Dst: 37.179.72.189 (37.179.72.189)
Transmission Control Protocol, Src Port: https (443), Dst Port: 52065 (52065), Seq: 180, Ack: 301, Len: 44
Secure Sockets Layer

No.     Time        Source                Destination           Protocol Length Info
     76 29.365331   37.179.72.189         108.168.176.233       TCP      68     52065 > https [ACK] Seq=301 Ack=224 Win=1578 Len=0 TSval=450888 TSecr=3516228239

Frame 76: 68 bytes on wire (544 bits), 68 bytes captured (544 bits)
Linux cooked capture
Internet Protocol Version 4, Src: 37.179.72.189 (37.179.72.189), Dst: 108.168.176.233 (108.168.176.233)
Transmission Control Protocol, Src Port: 52065 (52065), Dst Port: https (443), Seq: 301, Ack: 224, Len: 0

No.     Time        Source                Destination           Protocol Length Info
     77 42.050645   37.179.72.189         108.168.176.233       SSL      150    Continuation Data

Frame 77: 150 bytes on wire (1200 bits), 150 bytes captured (1200 bits)
Linux cooked capture
Internet Protocol Version 4, Src: 37.179.72.189 (37.179.72.189), Dst: 108.168.176.233 (108.168.176.233)
Transmission Control Protocol, Src Port: 52065 (52065), Dst Port: https (443), Seq: 301, Ack: 224, Len: 82
Secure Sockets Layer

No.     Time        Source                Destination           Protocol Length Info
     78 42.624033   108.168.176.233       37.179.72.189         SSL      112    Continuation Data

Frame 78: 112 bytes on wire (896 bits), 112 bytes captured (896 bits)
Linux cooked capture
Internet Protocol Version 4, Src: 108.168.176.233 (108.168.176.233), Dst: 37.179.72.189 (37.179.72.189)
Transmission Control Protocol, Src Port: https (443), Dst Port: 52065 (52065), Seq: 224, Ack: 383, Len: 44
Secure Sockets Layer

No.     Time        Source                Destination           Protocol Length Info
     79 42.624440   37.179.72.189         108.168.176.233       TCP      68     52065 > https [ACK] Seq=383 Ack=268 Win=1578 Len=0 TSval=452214 TSecr=3516241681

Frame 79: 68 bytes on wire (544 bits), 68 bytes captured (544 bits)
Linux cooked capture
Internet Protocol Version 4, Src: 37.179.72.189 (37.179.72.189), Dst: 108.168.176.233 (108.168.176.233)
Transmission Control Protocol, Src Port: 52065 (52065), Dst Port: https (443), Seq: 383, Ack: 268, Len: 0

No.     Time        Source                Destination           Protocol Length Info
     80 46.074676   37.179.72.189         108.168.176.233       SSL      133    Continuation Data

Frame 80: 133 bytes on wire (1064 bits), 133 bytes captured (1064 bits)
Linux cooked capture
Internet Protocol Version 4, Src: 37.179.72.189 (37.179.72.189), Dst: 108.168.176.233 (108.168.176.233)
Transmission Control Protocol, Src Port: 52065 (52065), Dst Port: https (443), Seq: 383, Ack: 268, Len: 65
Secure Sockets Layer

No.     Time        Source                Destination           Protocol Length Info
     81 46.603800   108.168.176.233       37.179.72.189         SSL      112    Continuation Data

Frame 81: 112 bytes on wire (896 bits), 112 bytes captured (896 bits)
Linux cooked capture
Internet Protocol Version 4, Src: 108.168.176.233 (108.168.176.233), Dst: 37.179.72.189 (37.179.72.189)
Transmission Control Protocol, Src Port: https (443), Dst Port: 52065 (52065), Seq: 268, Ack: 448, Len: 44
Secure Sockets Layer

No.     Time        Source                Destination           Protocol Length Info
     82 46.604460   37.179.72.189         108.168.176.233       TCP      68     52065 > https [ACK] Seq=448 Ack=312 Win=1578 Len=0 TSval=452612 TSecr=3516245648

Frame 82: 68 bytes on wire (544 bits), 68 bytes captured (544 bits)
Linux cooked capture
Internet Protocol Version 4, Src: 37.179.72.189 (37.179.72.189), Dst: 108.168.176.233 (108.168.176.233)
Transmission Control Protocol, Src Port: 52065 (52065), Dst Port: https (443), Seq: 448, Ack: 312, Len: 0
