No.     Time        Source                Destination           Protocol Length Info
      1 0.000000    5.94.228.252          31.13.86.33           TLSv1    95     Encrypted Alert

Frame 1: 95 bytes on wire (760 bits), 95 bytes captured (760 bits)
Linux cooked capture
Internet Protocol Version 4, Src: 5.94.228.252 (5.94.228.252), Dst: 31.13.86.33 (31.13.86.33)
Transmission Control Protocol, Src Port: 45377 (45377), Dst Port: https (443), Seq: 1, Ack: 1, Len: 27
Secure Sockets Layer

No.     Time        Source                Destination           Protocol Length Info
      2 0.001016    5.94.228.252          31.13.86.33           TCP      68     45377 > https [FIN, ACK] Seq=28 Ack=1 Win=3906 Len=0 TSval=161177 TSecr=2109841827

Frame 2: 68 bytes on wire (544 bits), 68 bytes captured (544 bits)
Linux cooked capture
Internet Protocol Version 4, Src: 5.94.228.252 (5.94.228.252), Dst: 31.13.86.33 (31.13.86.33)
Transmission Control Protocol, Src Port: 45377 (45377), Dst Port: https (443), Seq: 28, Ack: 1, Len: 0

No.     Time        Source                Destination           Protocol Length Info
      3 0.611975    31.13.86.33           5.94.228.252          TCP      68     https > 45377 [ACK] Seq=1 Ack=28 Win=80 Len=0 TSval=2109850040 TSecr=161177

Frame 3: 68 bytes on wire (544 bits), 68 bytes captured (544 bits)
Linux cooked capture
Internet Protocol Version 4, Src: 31.13.86.33 (31.13.86.33), Dst: 5.94.228.252 (5.94.228.252)
Transmission Control Protocol, Src Port: https (443), Dst Port: 45377 (45377), Seq: 1, Ack: 28, Len: 0

No.     Time        Source                Destination           Protocol Length Info
      4 0.612353    31.13.86.33           5.94.228.252          TLSv1    95     Encrypted Alert

Frame 4: 95 bytes on wire (760 bits), 95 bytes captured (760 bits)
Linux cooked capture
Internet Protocol Version 4, Src: 31.13.86.33 (31.13.86.33), Dst: 5.94.228.252 (5.94.228.252)
Transmission Control Protocol, Src Port: https (443), Dst Port: 45377 (45377), Seq: 1, Ack: 28, Len: 27
Secure Sockets Layer

No.     Time        Source                Destination           Protocol Length Info
      5 0.612591    5.94.228.252          31.13.86.33           TCP      56     45377 > https [RST] Seq=28 Win=0 Len=0

Frame 5: 56 bytes on wire (448 bits), 56 bytes captured (448 bits)
Linux cooked capture
Internet Protocol Version 4, Src: 5.94.228.252 (5.94.228.252), Dst: 31.13.86.33 (31.13.86.33)
Transmission Control Protocol, Src Port: 45377 (45377), Dst Port: https (443), Seq: 28, Len: 0

No.     Time        Source                Destination           Protocol Length Info
      6 0.612703    31.13.86.33           5.94.228.252          TCP      68     [TCP Previous segment not captured] https > 45377 [ACK] Seq=29 Ack=29 Win=80 Len=0 TSval=2109850040 TSecr=161177

Frame 6: 68 bytes on wire (544 bits), 68 bytes captured (544 bits)
Linux cooked capture
Internet Protocol Version 4, Src: 31.13.86.33 (31.13.86.33), Dst: 5.94.228.252 (5.94.228.252)
Transmission Control Protocol, Src Port: https (443), Dst Port: 45377 (45377), Seq: 29, Ack: 29, Len: 0

No.     Time        Source                Destination           Protocol Length Info
      7 0.612895    31.13.86.33           5.94.228.252          TCP      68     https > 45377 [FIN, ACK] Seq=28 Ack=28 Win=80 Len=0 TSval=2109850040 TSecr=161177

Frame 7: 68 bytes on wire (544 bits), 68 bytes captured (544 bits)
Linux cooked capture
Internet Protocol Version 4, Src: 31.13.86.33 (31.13.86.33), Dst: 5.94.228.252 (5.94.228.252)
Transmission Control Protocol, Src Port: https (443), Dst Port: 45377 (45377), Seq: 28, Ack: 28, Len: 0

No.     Time        Source                Destination           Protocol Length Info
      8 0.613278    5.94.228.252          31.13.86.33           TCP      56     45377 > https [RST] Seq=29 Win=0 Len=0

Frame 8: 56 bytes on wire (448 bits), 56 bytes captured (448 bits)
Linux cooked capture
Internet Protocol Version 4, Src: 5.94.228.252 (5.94.228.252), Dst: 31.13.86.33 (31.13.86.33)
Transmission Control Protocol, Src Port: 45377 (45377), Dst Port: https (443), Seq: 29, Len: 0

No.     Time        Source                Destination           Protocol Length Info
      9 0.613378    5.94.228.252          31.13.86.33           TCP      56     45377 > https [RST] Seq=28 Win=0 Len=0

Frame 9: 56 bytes on wire (448 bits), 56 bytes captured (448 bits)
Linux cooked capture
Internet Protocol Version 4, Src: 5.94.228.252 (5.94.228.252), Dst: 31.13.86.33 (31.13.86.33)
Transmission Control Protocol, Src Port: 45377 (45377), Dst Port: https (443), Seq: 28, Len: 0

No.     Time        Source                Destination           Protocol Length Info
     10 6.626655    5.94.228.252          173.194.40.208        TCP      68     50978 > http [FIN, ACK] Seq=1 Ack=1 Win=10598 Len=0 TSval=161840 TSecr=1568995344

Frame 10: 68 bytes on wire (544 bits), 68 bytes captured (544 bits)
Linux cooked capture
Internet Protocol Version 4, Src: 5.94.228.252 (5.94.228.252), Dst: 173.194.40.208 (173.194.40.208)
Transmission Control Protocol, Src Port: 50978 (50978), Dst Port: http (80), Seq: 1, Ack: 1, Len: 0

No.     Time        Source                Destination           Protocol Length Info
     11 13.063106   5.94.228.252          173.192.222.185       TCP      97     [TCP segment of a reassembled PDU]

Frame 11: 97 bytes on wire (776 bits), 97 bytes captured (776 bits)
Linux cooked capture
Internet Protocol Version 4, Src: 5.94.228.252 (5.94.228.252), Dst: 173.192.222.185 (173.192.222.185)
Transmission Control Protocol, Src Port: 49857 (49857), Dst Port: xmpp-client (5222), Seq: 1, Ack: 1, Len: 29

No.     Time        Source                Destination           Protocol Length Info
     12 13.357701   173.192.222.185       5.94.228.252          TCP      68     xmpp-client > 49857 [ACK] Seq=1 Ack=30 Win=512 Len=0 TSval=578687974 TSecr=162483

Frame 12: 68 bytes on wire (544 bits), 68 bytes captured (544 bits)
Linux cooked capture
Internet Protocol Version 4, Src: 173.192.222.185 (173.192.222.185), Dst: 5.94.228.252 (5.94.228.252)
Transmission Control Protocol, Src Port: xmpp-client (5222), Dst Port: 49857 (49857), Seq: 1, Ack: 30, Len: 0

No.     Time        Source                Destination           Protocol Length Info
     13 13.358343   5.94.228.252          173.192.222.185       TCP      109    [TCP segment of a reassembled PDU]

Frame 13: 109 bytes on wire (872 bits), 109 bytes captured (872 bits)
Linux cooked capture
Internet Protocol Version 4, Src: 5.94.228.252 (5.94.228.252), Dst: 173.192.222.185 (173.192.222.185)
Transmission Control Protocol, Src Port: 49857 (49857), Dst Port: xmpp-client (5222), Seq: 30, Ack: 1, Len: 41

No.     Time        Source                Destination           Protocol Length Info
     14 13.617685   173.192.222.185       5.94.228.252          TCP      113    [TCP segment of a reassembled PDU]

Frame 14: 113 bytes on wire (904 bits), 113 bytes captured (904 bits)
Linux cooked capture
Internet Protocol Version 4, Src: 173.192.222.185 (173.192.222.185), Dst: 5.94.228.252 (5.94.228.252)
Transmission Control Protocol, Src Port: xmpp-client (5222), Dst Port: 49857 (49857), Seq: 1, Ack: 71, Len: 45

No.     Time        Source                Destination           Protocol Length Info
     15 13.618040   5.94.228.252          173.192.222.185       TCP      68     49857 > xmpp-client [ACK] Seq=71 Ack=46 Win=10598 Len=0 TSval=162539 TSecr=578688227

Frame 15: 68 bytes on wire (544 bits), 68 bytes captured (544 bits)
Linux cooked capture
Internet Protocol Version 4, Src: 5.94.228.252 (5.94.228.252), Dst: 173.192.222.185 (173.192.222.185)
Transmission Control Protocol, Src Port: 49857 (49857), Dst Port: xmpp-client (5222), Seq: 71, Ack: 46, Len: 0

No.     Time        Source                Destination           Protocol Length Info
     16 16.043111   5.94.228.252          173.192.222.185       TCP      80     [TCP segment of a reassembled PDU]

Frame 16: 80 bytes on wire (640 bits), 80 bytes captured (640 bits)
Linux cooked capture
Internet Protocol Version 4, Src: 5.94.228.252 (5.94.228.252), Dst: 173.192.222.185 (173.192.222.185)
Transmission Control Protocol, Src Port: 49857 (49857), Dst Port: xmpp-client (5222), Seq: 71, Ack: 46, Len: 12

No.     Time        Source                Destination           Protocol Length Info
     17 16.247773   173.192.222.185       5.94.228.252          TCP      95     [TCP segment of a reassembled PDU]

Frame 17: 95 bytes on wire (760 bits), 95 bytes captured (760 bits)
Linux cooked capture
Internet Protocol Version 4, Src: 173.192.222.185 (173.192.222.185), Dst: 5.94.228.252 (5.94.228.252)
Transmission Control Protocol, Src Port: xmpp-client (5222), Dst Port: 49857 (49857), Seq: 46, Ack: 83, Len: 27

No.     Time        Source                Destination           Protocol Length Info
     18 16.248110   5.94.228.252          173.192.222.185       TCP      94     [TCP segment of a reassembled PDU]

Frame 18: 94 bytes on wire (752 bits), 94 bytes captured (752 bits)
Linux cooked capture
Internet Protocol Version 4, Src: 5.94.228.252 (5.94.228.252), Dst: 173.192.222.185 (173.192.222.185)
Transmission Control Protocol, Src Port: 49857 (49857), Dst Port: xmpp-client (5222), Seq: 83, Ack: 73, Len: 26

No.     Time        Source                Destination           Protocol Length Info
     19 16.487770   173.192.222.185       5.94.228.252          TCP      87     [TCP segment of a reassembled PDU]

Frame 19: 87 bytes on wire (696 bits), 87 bytes captured (696 bits)
Linux cooked capture
Internet Protocol Version 4, Src: 173.192.222.185 (173.192.222.185), Dst: 5.94.228.252 (5.94.228.252)
Transmission Control Protocol, Src Port: xmpp-client (5222), Dst Port: 49857 (49857), Seq: 73, Ack: 109, Len: 19

No.     Time        Source                Destination           Protocol Length Info
     20 16.526671   5.94.228.252          173.192.222.185       TCP      68     49857 > xmpp-client [ACK] Seq=109 Ack=92 Win=10598 Len=0 TSval=162830 TSecr=578691104

Frame 20: 68 bytes on wire (544 bits), 68 bytes captured (544 bits)
Linux cooked capture
Internet Protocol Version 4, Src: 5.94.228.252 (5.94.228.252), Dst: 173.192.222.185 (173.192.222.185)
Transmission Control Protocol, Src Port: 49857 (49857), Dst Port: xmpp-client (5222), Seq: 109, Ack: 92, Len: 0

No.     Time        Source                Destination           Protocol Length Info
     21 17.745686   5.94.228.252          173.194.34.19         TCP      76     46284 > http [SYN] Seq=0 Win=5240 Len=0 MSS=1310 SACK_PERM=1 TSval=162951 TSecr=0 WS=4

Frame 21: 76 bytes on wire (608 bits), 76 bytes captured (608 bits)
Linux cooked capture
Internet Protocol Version 4, Src: 5.94.228.252 (5.94.228.252), Dst: 173.194.34.19 (173.194.34.19)
Transmission Control Protocol, Src Port: 46284 (46284), Dst Port: http (80), Seq: 0, Len: 0

No.     Time        Source                Destination           Protocol Length Info
     22 17.867800   173.194.34.19         5.94.228.252          TCP      80     http > 46284 [SYN, ACK] Seq=0 Ack=1 Win=64251 Len=0 TSval=1569717829 TSecr=162951 MSS=1400 WS=4 SACK_PERM=1

Frame 22: 80 bytes on wire (640 bits), 80 bytes captured (640 bits)
Linux cooked capture
Internet Protocol Version 4, Src: 173.194.34.19 (173.194.34.19), Dst: 5.94.228.252 (5.94.228.252)
Transmission Control Protocol, Src Port: http (80), Dst Port: 46284 (46284), Seq: 0, Ack: 1, Len: 0

No.     Time        Source                Destination           Protocol Length Info
     23 18.199055   5.94.228.252          173.194.34.19         TCP      68     46284 > http [ACK] Seq=1 Ack=1 Win=5240 Len=0 TSval=162997 TSecr=1569717829

Frame 23: 68 bytes on wire (544 bits), 68 bytes captured (544 bits)
Linux cooked capture
Internet Protocol Version 4, Src: 5.94.228.252 (5.94.228.252), Dst: 173.194.34.19 (173.194.34.19)
Transmission Control Protocol, Src Port: 46284 (46284), Dst Port: http (80), Seq: 1, Ack: 1, Len: 0

No.     Time        Source                Destination           Protocol Length Info
     24 18.231043   5.94.228.252          173.194.34.19         TCP      302    [TCP segment of a reassembled PDU]

Frame 24: 302 bytes on wire (2416 bits), 302 bytes captured (2416 bits)
Linux cooked capture
Internet Protocol Version 4, Src: 5.94.228.252 (5.94.228.252), Dst: 173.194.34.19 (173.194.34.19)
Transmission Control Protocol, Src Port: 46284 (46284), Dst Port: http (80), Seq: 1, Ack: 1, Len: 234

No.     Time        Source                Destination           Protocol Length Info
     25 18.467678   173.194.34.19         5.94.228.252          TCP      68     http > 46284 [ACK] Seq=1 Ack=235 Win=257004 Len=0 TSval=1569717889 TSecr=163000

Frame 25: 68 bytes on wire (544 bits), 68 bytes captured (544 bits)
Linux cooked capture
Internet Protocol Version 4, Src: 173.194.34.19 (173.194.34.19), Dst: 5.94.228.252 (5.94.228.252)
Transmission Control Protocol, Src Port: http (80), Dst Port: 46284 (46284), Seq: 1, Ack: 235, Len: 0

No.     Time        Source                Destination           Protocol Length Info
     26 18.774196   5.94.228.252          173.192.222.185       TCP      131    [TCP segment of a reassembled PDU]

Frame 26: 131 bytes on wire (1048 bits), 131 bytes captured (1048 bits)
Linux cooked capture
Internet Protocol Version 4, Src: 5.94.228.252 (5.94.228.252), Dst: 173.192.222.185 (173.192.222.185)
Transmission Control Protocol, Src Port: 49857 (49857), Dst Port: xmpp-client (5222), Seq: 109, Ack: 92, Len: 63

No.     Time        Source                Destination           Protocol Length Info
     27 19.047773   173.192.222.185       5.94.228.252          TCP      113    [TCP segment of a reassembled PDU]

Frame 27: 113 bytes on wire (904 bits), 113 bytes captured (904 bits)
Linux cooked capture
Internet Protocol Version 4, Src: 173.192.222.185 (173.192.222.185), Dst: 5.94.228.252 (5.94.228.252)
Transmission Control Protocol, Src Port: xmpp-client (5222), Dst Port: 49857 (49857), Seq: 92, Ack: 172, Len: 45

No.     Time        Source                Destination           Protocol Length Info
     28 19.048133   5.94.228.252          173.192.222.185       TCP      68     49857 > xmpp-client [ACK] Seq=172 Ack=137 Win=10598 Len=0 TSval=163082 TSecr=578693664

Frame 28: 68 bytes on wire (544 bits), 68 bytes captured (544 bits)
Linux cooked capture
Internet Protocol Version 4, Src: 5.94.228.252 (5.94.228.252), Dst: 173.192.222.185 (173.192.222.185)
Transmission Control Protocol, Src Port: 49857 (49857), Dst Port: xmpp-client (5222), Seq: 172, Ack: 137, Len: 0

No.     Time        Source                Destination           Protocol Length Info
     29 19.186856   5.94.228.252          173.194.34.19         HTTP     615    POST /m/appreq/vs HTTP/1.1  (application/binary)

Frame 29: 615 bytes on wire (4920 bits), 615 bytes captured (4920 bits)
Linux cooked capture
Internet Protocol Version 4, Src: 5.94.228.252 (5.94.228.252), Dst: 173.194.34.19 (173.194.34.19)
Transmission Control Protocol, Src Port: 46284 (46284), Dst Port: http (80), Seq: 235, Ack: 1, Len: 547
[2 Reassembled TCP Segments (781 bytes): #24(234), #29(547)]
Hypertext Transfer Protocol
Media Type

No.     Time        Source                Destination           Protocol Length Info
     30 19.637733   173.194.34.19         5.94.228.252          TCP      68     http > 46284 [ACK] Seq=1 Ack=782 Win=257004 Len=0 TSval=1569718001 TSecr=163096

Frame 30: 68 bytes on wire (544 bits), 68 bytes captured (544 bits)
Linux cooked capture
Internet Protocol Version 4, Src: 173.194.34.19 (173.194.34.19), Dst: 5.94.228.252 (5.94.228.252)
Transmission Control Protocol, Src Port: http (80), Dst Port: 46284 (46284), Seq: 1, Ack: 782, Len: 0

No.     Time        Source                Destination           Protocol Length Info
     31 19.677830   173.194.34.19         5.94.228.252          TCP      1366   [TCP segment of a reassembled PDU]

Frame 31: 1366 bytes on wire (10928 bits), 1366 bytes captured (10928 bits)
Linux cooked capture
Internet Protocol Version 4, Src: 173.194.34.19 (173.194.34.19), Dst: 5.94.228.252 (5.94.228.252)
Transmission Control Protocol, Src Port: http (80), Dst Port: 46284 (46284), Seq: 1, Ack: 782, Len: 1298

No.     Time        Source                Destination           Protocol Length Info
     32 19.687688   173.194.34.19         5.94.228.252          HTTP     372    HTTP/1.1 404 Not Found  (text/html)

Frame 32: 372 bytes on wire (2976 bits), 372 bytes captured (2976 bits)
Linux cooked capture
Internet Protocol Version 4, Src: 173.194.34.19 (173.194.34.19), Dst: 5.94.228.252 (5.94.228.252)
Transmission Control Protocol, Src Port: http (80), Dst Port: 46284 (46284), Seq: 1299, Ack: 782, Len: 304
[2 Reassembled TCP Segments (1602 bytes): #31(1298), #32(304)]
Hypertext Transfer Protocol
Line-based text data: text/html

No.     Time        Source                Destination           Protocol Length Info
     33 19.728811   5.94.228.252          173.194.34.19         TCP      68     46284 > http [ACK] Seq=782 Ack=1299 Win=7836 Len=0 TSval=163150 TSecr=1569718001

Frame 33: 68 bytes on wire (544 bits), 68 bytes captured (544 bits)
Linux cooked capture
Internet Protocol Version 4, Src: 5.94.228.252 (5.94.228.252), Dst: 173.194.34.19 (173.194.34.19)
Transmission Control Protocol, Src Port: 46284 (46284), Dst Port: http (80), Seq: 782, Ack: 1299, Len: 0

No.     Time        Source                Destination           Protocol Length Info
     34 19.729025   5.94.228.252          173.194.34.19         TCP      68     46284 > http [ACK] Seq=782 Ack=1603 Win=10432 Len=0 TSval=163150 TSecr=1569718001

Frame 34: 68 bytes on wire (544 bits), 68 bytes captured (544 bits)
Linux cooked capture
Internet Protocol Version 4, Src: 5.94.228.252 (5.94.228.252), Dst: 173.194.34.19 (173.194.34.19)
Transmission Control Protocol, Src Port: 46284 (46284), Dst Port: http (80), Seq: 782, Ack: 1603, Len: 0

No.     Time        Source                Destination           Protocol Length Info
     35 19.877951   173.192.222.185       5.94.228.252          TCP      111    [TCP segment of a reassembled PDU]

Frame 35: 111 bytes on wire (888 bits), 111 bytes captured (888 bits)
Linux cooked capture
Internet Protocol Version 4, Src: 173.192.222.185 (173.192.222.185), Dst: 5.94.228.252 (5.94.228.252)
Transmission Control Protocol, Src Port: xmpp-client (5222), Dst Port: 49857 (49857), Seq: 137, Ack: 172, Len: 43

No.     Time        Source                Destination           Protocol Length Info
     36 19.878981   5.94.228.252          173.192.222.185       TCP      68     49857 > xmpp-client [ACK] Seq=172 Ack=180 Win=10598 Len=0 TSval=163165 TSecr=578694488

Frame 36: 68 bytes on wire (544 bits), 68 bytes captured (544 bits)
Linux cooked capture
Internet Protocol Version 4, Src: 5.94.228.252 (5.94.228.252), Dst: 173.192.222.185 (173.192.222.185)
Transmission Control Protocol, Src Port: 49857 (49857), Dst Port: xmpp-client (5222), Seq: 172, Ack: 180, Len: 0

No.     Time        Source                Destination           Protocol Length Info
     37 19.885290   5.94.228.252          173.192.222.185       TCP      113    [TCP segment of a reassembled PDU]

Frame 37: 113 bytes on wire (904 bits), 113 bytes captured (904 bits)
Linux cooked capture
Internet Protocol Version 4, Src: 5.94.228.252 (5.94.228.252), Dst: 173.192.222.185 (173.192.222.185)
Transmission Control Protocol, Src Port: 49857 (49857), Dst Port: xmpp-client (5222), Seq: 172, Ack: 180, Len: 45

No.     Time        Source                Destination           Protocol Length Info
     38 20.197748   173.192.222.185       5.94.228.252          TCP      68     xmpp-client > 49857 [ACK] Seq=180 Ack=217 Win=512 Len=0 TSval=578694814 TSecr=163165

Frame 38: 68 bytes on wire (544 bits), 68 bytes captured (544 bits)
Linux cooked capture
Internet Protocol Version 4, Src: 173.192.222.185 (173.192.222.185), Dst: 5.94.228.252 (5.94.228.252)
Transmission Control Protocol, Src Port: xmpp-client (5222), Dst Port: 49857 (49857), Seq: 180, Ack: 217, Len: 0

No.     Time        Source                Destination           Protocol Length Info
     39 22.615531   5.94.228.252          83.224.70.78          DNS      82     Standard query 0x25c6  A univr.mail.cineca.it

Frame 39: 82 bytes on wire (656 bits), 82 bytes captured (656 bits)
Linux cooked capture
Internet Protocol Version 4, Src: 5.94.228.252 (5.94.228.252), Dst: 83.224.70.78 (83.224.70.78)
User Datagram Protocol, Src Port: 9826 (9826), Dst Port: domain (53)
Domain Name System (query)

No.     Time        Source                Destination           Protocol Length Info
     40 22.827691   83.224.70.78          5.94.228.252          DNS      131    Standard query response 0x25c6  CNAME zimbrauniv-prod-15.cineca.it A 130.186.6.177

Frame 40: 131 bytes on wire (1048 bits), 131 bytes captured (1048 bits)
Linux cooked capture
Internet Protocol Version 4, Src: 83.224.70.78 (83.224.70.78), Dst: 5.94.228.252 (5.94.228.252)
User Datagram Protocol, Src Port: domain (53), Dst Port: 9826 (9826)
Domain Name System (response)

No.     Time        Source                Destination           Protocol Length Info
     41 23.211295   5.94.228.252          130.186.6.177         TCP      76     55548 > imaps [SYN] Seq=0 Win=5240 Len=0 MSS=1310 SACK_PERM=1 TSval=163498 TSecr=0 WS=4

Frame 41: 76 bytes on wire (608 bits), 76 bytes captured (608 bits)
Linux cooked capture
Internet Protocol Version 4, Src: 5.94.228.252 (5.94.228.252), Dst: 130.186.6.177 (130.186.6.177)
Transmission Control Protocol, Src Port: 55548 (55548), Dst Port: imaps (993), Seq: 0, Len: 0

No.     Time        Source                Destination           Protocol Length Info
     42 24.077766   130.186.6.177         5.94.228.252          TCP      76     imaps > 55548 [SYN, ACK] Seq=0 Ack=1 Win=5792 Len=0 MSS=1400 SACK_PERM=1 TSval=1658223639 TSecr=163498 WS=128

Frame 42: 76 bytes on wire (608 bits), 76 bytes captured (608 bits)
Linux cooked capture
Internet Protocol Version 4, Src: 130.186.6.177 (130.186.6.177), Dst: 5.94.228.252 (5.94.228.252)
Transmission Control Protocol, Src Port: imaps (993), Dst Port: 55548 (55548), Seq: 0, Ack: 1, Len: 0

No.     Time        Source                Destination           Protocol Length Info
     43 24.078023   5.94.228.252          130.186.6.177         TCP      68     55548 > imaps [ACK] Seq=1 Ack=1 Win=5240 Len=0 TSval=163585 TSecr=1658223639

Frame 43: 68 bytes on wire (544 bits), 68 bytes captured (544 bits)
Linux cooked capture
Internet Protocol Version 4, Src: 5.94.228.252 (5.94.228.252), Dst: 130.186.6.177 (130.186.6.177)
Transmission Control Protocol, Src Port: 55548 (55548), Dst Port: imaps (993), Seq: 1, Ack: 1, Len: 0

No.     Time        Source                Destination           Protocol Length Info
     44 24.137750   54.243.73.193         5.94.228.252          TCP      68     http > 37781 [FIN, ACK] Seq=1 Ack=1 Win=64251 Len=0 TSval=1569718455 TSecr=160611

Frame 44: 68 bytes on wire (544 bits), 68 bytes captured (544 bits)
Linux cooked capture
Internet Protocol Version 4, Src: 54.243.73.193 (54.243.73.193), Dst: 5.94.228.252 (5.94.228.252)
Transmission Control Protocol, Src Port: http (80), Dst Port: 37781 (37781), Seq: 1, Ack: 1, Len: 0

No.     Time        Source                Destination           Protocol Length Info
     45 24.145443   5.94.228.252          130.186.6.177         TLSv1    148    Client Hello

Frame 45: 148 bytes on wire (1184 bits), 148 bytes captured (1184 bits)
Linux cooked capture
Internet Protocol Version 4, Src: 5.94.228.252 (5.94.228.252), Dst: 130.186.6.177 (130.186.6.177)
Transmission Control Protocol, Src Port: 55548 (55548), Dst Port: imaps (993), Seq: 1, Ack: 1, Len: 80
Secure Sockets Layer

No.     Time        Source                Destination           Protocol Length Info
     46 24.176700   5.94.228.252          54.243.73.193         TCP      68     37781 > http [ACK] Seq=1 Ack=2 Win=1959 Len=0 TSval=163595 TSecr=1569718455

Frame 46: 68 bytes on wire (544 bits), 68 bytes captured (544 bits)
Linux cooked capture
Internet Protocol Version 4, Src: 5.94.228.252 (5.94.228.252), Dst: 54.243.73.193 (54.243.73.193)
Transmission Control Protocol, Src Port: 37781 (37781), Dst Port: http (80), Seq: 1, Ack: 2, Len: 0

No.     Time        Source                Destination           Protocol Length Info
     47 24.357691   130.186.6.177         5.94.228.252          TCP      68     imaps > 55548 [ACK] Seq=1 Ack=81 Win=5888 Len=0 TSval=1658223918 TSecr=163591

Frame 47: 68 bytes on wire (544 bits), 68 bytes captured (544 bits)
Linux cooked capture
Internet Protocol Version 4, Src: 130.186.6.177 (130.186.6.177), Dst: 5.94.228.252 (5.94.228.252)
Transmission Control Protocol, Src Port: imaps (993), Dst Port: 55548 (55548), Seq: 1, Ack: 81, Len: 0

No.     Time        Source                Destination           Protocol Length Info
     48 24.367846   130.186.6.177         5.94.228.252          TLSv1    1366   Server Hello

Frame 48: 1366 bytes on wire (10928 bits), 1366 bytes captured (10928 bits)
Linux cooked capture
Internet Protocol Version 4, Src: 130.186.6.177 (130.186.6.177), Dst: 5.94.228.252 (5.94.228.252)
Transmission Control Protocol, Src Port: imaps (993), Dst Port: 55548 (55548), Seq: 1, Ack: 81, Len: 1298
Secure Sockets Layer

No.     Time        Source                Destination           Protocol Length Info
     49 24.368081   5.94.228.252          130.186.6.177         TCP      68     55548 > imaps [ACK] Seq=81 Ack=1299 Win=7836 Len=0 TSval=163614 TSecr=1658223918

Frame 49: 68 bytes on wire (544 bits), 68 bytes captured (544 bits)
Linux cooked capture
Internet Protocol Version 4, Src: 5.94.228.252 (5.94.228.252), Dst: 130.186.6.177 (130.186.6.177)
Transmission Control Protocol, Src Port: 55548 (55548), Dst Port: imaps (993), Seq: 81, Ack: 1299, Len: 0

No.     Time        Source                Destination           Protocol Length Info
     50 24.407826   130.186.6.177         5.94.228.252          TCP      1366   [TCP segment of a reassembled PDU]

Frame 50: 1366 bytes on wire (10928 bits), 1366 bytes captured (10928 bits)
Linux cooked capture
Internet Protocol Version 4, Src: 130.186.6.177 (130.186.6.177), Dst: 5.94.228.252 (5.94.228.252)
Transmission Control Protocol, Src Port: imaps (993), Dst Port: 55548 (55548), Seq: 1299, Ack: 81, Len: 1298

No.     Time        Source                Destination           Protocol Length Info
     51 24.408046   5.94.228.252          130.186.6.177         TCP      68     55548 > imaps [ACK] Seq=81 Ack=2597 Win=10432 Len=0 TSval=163618 TSecr=1658223918

Frame 51: 68 bytes on wire (544 bits), 68 bytes captured (544 bits)
Linux cooked capture
Internet Protocol Version 4, Src: 5.94.228.252 (5.94.228.252), Dst: 130.186.6.177 (130.186.6.177)
Transmission Control Protocol, Src Port: 55548 (55548), Dst Port: imaps (993), Seq: 81, Ack: 2597, Len: 0

No.     Time        Source                Destination           Protocol Length Info
     52 24.457855   130.186.6.177         5.94.228.252          TCP      1366   [TCP segment of a reassembled PDU]

Frame 52: 1366 bytes on wire (10928 bits), 1366 bytes captured (10928 bits)
Linux cooked capture
Internet Protocol Version 4, Src: 130.186.6.177 (130.186.6.177), Dst: 5.94.228.252 (5.94.228.252)
Transmission Control Protocol, Src Port: imaps (993), Dst Port: 55548 (55548), Seq: 2597, Ack: 81, Len: 1298

No.     Time        Source                Destination           Protocol Length Info
     53 24.458066   5.94.228.252          130.186.6.177         TCP      68     55548 > imaps [ACK] Seq=81 Ack=3895 Win=13028 Len=0 TSval=163623 TSecr=1658223918

Frame 53: 68 bytes on wire (544 bits), 68 bytes captured (544 bits)
Linux cooked capture
Internet Protocol Version 4, Src: 5.94.228.252 (5.94.228.252), Dst: 130.186.6.177 (130.186.6.177)
Transmission Control Protocol, Src Port: 55548 (55548), Dst Port: imaps (993), Seq: 81, Ack: 3895, Len: 0

No.     Time        Source                Destination           Protocol Length Info
     54 24.508070   130.186.6.177         5.94.228.252          TLSv1    1318   Certificate, Server Key Exchange, Server Hello Done

Frame 54: 1318 bytes on wire (10544 bits), 1318 bytes captured (10544 bits)
Linux cooked capture
Internet Protocol Version 4, Src: 130.186.6.177 (130.186.6.177), Dst: 5.94.228.252 (5.94.228.252)
Transmission Control Protocol, Src Port: imaps (993), Dst Port: 55548 (55548), Seq: 3895, Ack: 81, Len: 1250
[4 Reassembled TCP Segments (5058 bytes): #48(1212), #50(1298), #52(1298), #54(1250)]
Secure Sockets Layer

No.     Time        Source                Destination           Protocol Length Info
     55 24.508298   5.94.228.252          130.186.6.177         TCP      68     55548 > imaps [ACK] Seq=81 Ack=5145 Win=15624 Len=0 TSval=163628 TSecr=1658224039

Frame 55: 68 bytes on wire (544 bits), 68 bytes captured (544 bits)
Linux cooked capture
Internet Protocol Version 4, Src: 5.94.228.252 (5.94.228.252), Dst: 130.186.6.177 (130.186.6.177)
Transmission Control Protocol, Src Port: 55548 (55548), Dst Port: imaps (993), Seq: 81, Ack: 5145, Len: 0

No.     Time        Source                Destination           Protocol Length Info
     56 24.880541   5.94.228.252          83.224.70.78          DNS      81     Standard query 0x28e1  A orcart.facebook.com

Frame 56: 81 bytes on wire (648 bits), 81 bytes captured (648 bits)
Linux cooked capture
Internet Protocol Version 4, Src: 5.94.228.252 (5.94.228.252), Dst: 83.224.70.78 (83.224.70.78)
User Datagram Protocol, Src Port: 11617 (11617), Dst Port: domain (53)
Domain Name System (query)

No.     Time        Source                Destination           Protocol Length Info
     57 24.997698   83.224.70.78          5.94.228.252          DNS      120    Standard query response 0x28e1  CNAME orcart.t.facebook.com A 173.252.103.16

Frame 57: 120 bytes on wire (960 bits), 120 bytes captured (960 bits)
Linux cooked capture
Internet Protocol Version 4, Src: 83.224.70.78 (83.224.70.78), Dst: 5.94.228.252 (5.94.228.252)
User Datagram Protocol, Src Port: domain (53), Dst Port: 11617 (11617)
Domain Name System (response)

No.     Time        Source                Destination           Protocol Length Info
     58 25.106660   5.94.228.252          173.194.70.95         TCP      68     47822 > https [FIN, ACK] Seq=1 Ack=1 Win=3906 Len=0 TSval=163688 TSecr=489603214

Frame 58: 68 bytes on wire (544 bits), 68 bytes captured (544 bits)
Linux cooked capture
Internet Protocol Version 4, Src: 5.94.228.252 (5.94.228.252), Dst: 173.194.70.95 (173.194.70.95)
Transmission Control Protocol, Src Port: 47822 (47822), Dst Port: https (443), Seq: 1, Ack: 1, Len: 0

No.     Time        Source                Destination           Protocol Length Info
     59 25.273553   5.94.228.252          173.192.222.185       TCP      138    [TCP segment of a reassembled PDU]

Frame 59: 138 bytes on wire (1104 bits), 138 bytes captured (1104 bits)
Linux cooked capture
Internet Protocol Version 4, Src: 5.94.228.252 (5.94.228.252), Dst: 173.192.222.185 (173.192.222.185)
Transmission Control Protocol, Src Port: 49857 (49857), Dst Port: xmpp-client (5222), Seq: 217, Ack: 180, Len: 70

No.     Time        Source                Destination           Protocol Length Info
     60 25.398081   5.94.228.252          173.252.103.16        TCP      76     35630 > https [SYN] Seq=0 Win=5240 Len=0 MSS=1310 SACK_PERM=1 TSval=163717 TSecr=0 WS=4

Frame 60: 76 bytes on wire (608 bits), 76 bytes captured (608 bits)
Linux cooked capture
Internet Protocol Version 4, Src: 5.94.228.252 (5.94.228.252), Dst: 173.252.103.16 (173.252.103.16)
Transmission Control Protocol, Src Port: 35630 (35630), Dst Port: https (443), Seq: 0, Len: 0

No.     Time        Source                Destination           Protocol Length Info
     61 25.527680   173.192.222.185       5.94.228.252          TCP      113    [TCP segment of a reassembled PDU]

Frame 61: 113 bytes on wire (904 bits), 113 bytes captured (904 bits)
Linux cooked capture
Internet Protocol Version 4, Src: 173.192.222.185 (173.192.222.185), Dst: 5.94.228.252 (5.94.228.252)
Transmission Control Protocol, Src Port: xmpp-client (5222), Dst Port: 49857 (49857), Seq: 180, Ack: 287, Len: 45

No.     Time        Source                Destination           Protocol Length Info
     62 25.566696   5.94.228.252          173.192.222.185       TCP      68     49857 > xmpp-client [ACK] Seq=287 Ack=225 Win=10598 Len=0 TSval=163734 TSecr=578700144

Frame 62: 68 bytes on wire (544 bits), 68 bytes captured (544 bits)
Linux cooked capture
Internet Protocol Version 4, Src: 5.94.228.252 (5.94.228.252), Dst: 173.192.222.185 (173.192.222.185)
Transmission Control Protocol, Src Port: 49857 (49857), Dst Port: xmpp-client (5222), Seq: 287, Ack: 225, Len: 0

No.     Time        Source                Destination           Protocol Length Info
     63 25.617685   173.252.103.16        5.94.228.252          TCP      76     https > 35630 [SYN, ACK] Seq=0 Ack=1 Win=14480 Len=0 MSS=1400 SACK_PERM=1 TSval=197833475 TSecr=163717 WS=256

Frame 63: 76 bytes on wire (608 bits), 76 bytes captured (608 bits)
Linux cooked capture
Internet Protocol Version 4, Src: 173.252.103.16 (173.252.103.16), Dst: 5.94.228.252 (5.94.228.252)
Transmission Control Protocol, Src Port: https (443), Dst Port: 35630 (35630), Seq: 0, Ack: 1, Len: 0

No.     Time        Source                Destination           Protocol Length Info
     64 25.617988   5.94.228.252          173.252.103.16        TCP      68     35630 > https [ACK] Seq=1 Ack=1 Win=5240 Len=0 TSval=163739 TSecr=197833475

Frame 64: 68 bytes on wire (544 bits), 68 bytes captured (544 bits)
Linux cooked capture
Internet Protocol Version 4, Src: 5.94.228.252 (5.94.228.252), Dst: 173.252.103.16 (173.252.103.16)
Transmission Control Protocol, Src Port: 35630 (35630), Dst Port: https (443), Seq: 1, Ack: 1, Len: 0

No.     Time        Source                Destination           Protocol Length Info
     65 25.729043   5.94.228.252          173.252.103.16        TLSv1    182    Client Hello

Frame 65: 182 bytes on wire (1456 bits), 182 bytes captured (1456 bits)
Linux cooked capture
Internet Protocol Version 4, Src: 5.94.228.252 (5.94.228.252), Dst: 173.252.103.16 (173.252.103.16)
Transmission Control Protocol, Src Port: 35630 (35630), Dst Port: https (443), Seq: 1, Ack: 1, Len: 114
Secure Sockets Layer

No.     Time        Source                Destination           Protocol Length Info
     66 25.847711   173.192.222.185       5.94.228.252          TCP      111    [TCP segment of a reassembled PDU]

Frame 66: 111 bytes on wire (888 bits), 111 bytes captured (888 bits)
Linux cooked capture
Internet Protocol Version 4, Src: 173.192.222.185 (173.192.222.185), Dst: 5.94.228.252 (5.94.228.252)
Transmission Control Protocol, Src Port: xmpp-client (5222), Dst Port: 49857 (49857), Seq: 225, Ack: 287, Len: 43

No.     Time        Source                Destination           Protocol Length Info
     67 25.848033   5.94.228.252          173.192.222.185       TCP      68     49857 > xmpp-client [ACK] Seq=287 Ack=268 Win=10598 Len=0 TSval=163762 TSecr=578700442

Frame 67: 68 bytes on wire (544 bits), 68 bytes captured (544 bits)
Linux cooked capture
Internet Protocol Version 4, Src: 5.94.228.252 (5.94.228.252), Dst: 173.192.222.185 (173.192.222.185)
Transmission Control Protocol, Src Port: 49857 (49857), Dst Port: xmpp-client (5222), Seq: 287, Ack: 268, Len: 0

No.     Time        Source                Destination           Protocol Length Info
     68 25.858243   5.94.228.252          173.192.222.185       TCP      113    [TCP segment of a reassembled PDU]

Frame 68: 113 bytes on wire (904 bits), 113 bytes captured (904 bits)
Linux cooked capture
Internet Protocol Version 4, Src: 5.94.228.252 (5.94.228.252), Dst: 173.192.222.185 (173.192.222.185)
Transmission Control Protocol, Src Port: 49857 (49857), Dst Port: xmpp-client (5222), Seq: 287, Ack: 268, Len: 45

No.     Time        Source                Destination           Protocol Length Info
     69 26.017655   173.252.103.16        5.94.228.252          TCP      68     https > 35630 [ACK] Seq=1 Ack=115 Win=14592 Len=0 TSval=197833875 TSecr=163750

Frame 69: 68 bytes on wire (544 bits), 68 bytes captured (544 bits)
Linux cooked capture
Internet Protocol Version 4, Src: 173.252.103.16 (173.252.103.16), Dst: 5.94.228.252 (5.94.228.252)
Transmission Control Protocol, Src Port: https (443), Dst Port: 35630 (35630), Seq: 1, Ack: 115, Len: 0

No.     Time        Source                Destination           Protocol Length Info
     70 26.057863   173.252.103.16        5.94.228.252          TLSv1    1366   Server Hello

Frame 70: 1366 bytes on wire (10928 bits), 1366 bytes captured (10928 bits)
Linux cooked capture
Internet Protocol Version 4, Src: 173.252.103.16 (173.252.103.16), Dst: 5.94.228.252 (5.94.228.252)
Transmission Control Protocol, Src Port: https (443), Dst Port: 35630 (35630), Seq: 1, Ack: 115, Len: 1298
Secure Sockets Layer

No.     Time        Source                Destination           Protocol Length Info
     71 26.058085   5.94.228.252          173.252.103.16        TCP      68     35630 > https [ACK] Seq=115 Ack=1299 Win=7836 Len=0 TSval=163783 TSecr=197833875

Frame 71: 68 bytes on wire (544 bits), 68 bytes captured (544 bits)
Linux cooked capture
Internet Protocol Version 4, Src: 5.94.228.252 (5.94.228.252), Dst: 173.252.103.16 (173.252.103.16)
Transmission Control Protocol, Src Port: 35630 (35630), Dst Port: https (443), Seq: 115, Ack: 1299, Len: 0

No.     Time        Source                Destination           Protocol Length Info
     72 26.077813   173.252.103.16        5.94.228.252          TCP      1366   [TCP segment of a reassembled PDU]

Frame 72: 1366 bytes on wire (10928 bits), 1366 bytes captured (10928 bits)
Linux cooked capture
Internet Protocol Version 4, Src: 173.252.103.16 (173.252.103.16), Dst: 5.94.228.252 (5.94.228.252)
Transmission Control Protocol, Src Port: https (443), Dst Port: 35630 (35630), Seq: 1299, Ack: 115, Len: 1298

No.     Time        Source                Destination           Protocol Length Info
     73 26.077983   5.94.228.252          173.252.103.16        TCP      68     35630 > https [ACK] Seq=115 Ack=2597 Win=10432 Len=0 TSval=163785 TSecr=197833875

Frame 73: 68 bytes on wire (544 bits), 68 bytes captured (544 bits)
Linux cooked capture
Internet Protocol Version 4, Src: 5.94.228.252 (5.94.228.252), Dst: 173.252.103.16 (173.252.103.16)
Transmission Control Protocol, Src Port: 35630 (35630), Dst Port: https (443), Seq: 115, Ack: 2597, Len: 0

No.     Time        Source                Destination           Protocol Length Info
     74 26.087695   173.252.103.16        5.94.228.252          TLSv1    564    Certificate, Server Hello Done

Frame 74: 564 bytes on wire (4512 bits), 564 bytes captured (4512 bits)
Linux cooked capture
Internet Protocol Version 4, Src: 173.252.103.16 (173.252.103.16), Dst: 5.94.228.252 (5.94.228.252)
Transmission Control Protocol, Src Port: https (443), Dst Port: 35630 (35630), Seq: 2597, Ack: 115, Len: 496
[3 Reassembled TCP Segments (3030 bytes): #70(1236), #72(1298), #74(496)]
Secure Sockets Layer

No.     Time        Source                Destination           Protocol Length Info
     75 26.087860   5.94.228.252          173.252.103.16        TCP      68     35630 > https [ACK] Seq=115 Ack=3093 Win=13028 Len=0 TSval=163786 TSecr=197833875

Frame 75: 68 bytes on wire (544 bits), 68 bytes captured (544 bits)
Linux cooked capture
Internet Protocol Version 4, Src: 5.94.228.252 (5.94.228.252), Dst: 173.252.103.16 (173.252.103.16)
Transmission Control Protocol, Src Port: 35630 (35630), Dst Port: https (443), Seq: 115, Ack: 3093, Len: 0

No.     Time        Source                Destination           Protocol Length Info
