No.     Time        Source                Destination           Protocol Length Info
      1 0.000000    100.77.50.79          173.192.222.175       TCP      97     [TCP segment of a reassembled PDU]

Frame 1: 97 bytes on wire (776 bits), 97 bytes captured (776 bits)
Linux cooked capture
Internet Protocol Version 4, Src: 100.77.50.79 (100.77.50.79), Dst: 173.192.222.175 (173.192.222.175)
Transmission Control Protocol, Src Port: 35150 (35150), Dst Port: xmpp-client (5222), Seq: 1, Ack: 1, Len: 29

No.     Time        Source                Destination           Protocol Length Info
      2 1.809890    100.77.50.79          54.243.73.193         TCP      68     57848 > http [FIN, ACK] Seq=1 Ack=1 Win=1965 Len=0 TSval=1317339 TSecr=297896596

Frame 2: 68 bytes on wire (544 bits), 68 bytes captured (544 bits)
Linux cooked capture
Internet Protocol Version 4, Src: 100.77.50.79 (100.77.50.79), Dst: 54.243.73.193 (54.243.73.193)
Transmission Control Protocol, Src Port: 57848 (57848), Dst Port: http (80), Seq: 1, Ack: 1, Len: 0

No.     Time        Source                Destination           Protocol Length Info
      3 2.854036    100.77.50.79          54.243.73.193         TCP      68     57848 > http [FIN, ACK] Seq=1 Ack=1 Win=1965 Len=0 TSval=1317444 TSecr=297896596

Frame 3: 68 bytes on wire (544 bits), 68 bytes captured (544 bits)
Linux cooked capture
Internet Protocol Version 4, Src: 100.77.50.79 (100.77.50.79), Dst: 54.243.73.193 (54.243.73.193)
Transmission Control Protocol, Src Port: 57848 (57848), Dst Port: http (80), Seq: 1, Ack: 1, Len: 0

No.     Time        Source                Destination           Protocol Length Info
      4 3.104043    100.77.50.79          173.192.222.175       TCP      97     [TCP Retransmission] 35150 > xmpp-client [PSH, ACK] Seq=1 Ack=1 Win=1965 Len=29 TSval=1317469 TSecr=1611284417

Frame 4: 97 bytes on wire (776 bits), 97 bytes captured (776 bits)
Linux cooked capture
Internet Protocol Version 4, Src: 100.77.50.79 (100.77.50.79), Dst: 173.192.222.175 (173.192.222.175)
Transmission Control Protocol, Src Port: 35150 (35150), Dst Port: xmpp-client (5222), Seq: 1, Ack: 1, Len: 29

No.     Time        Source                Destination           Protocol Length Info
      5 3.365915    173.192.222.175       100.77.50.79          TCP      68     xmpp-client > 35150 [ACK] Seq=1 Ack=30 Win=512 Len=0 TSval=1611995025 TSecr=1317158

Frame 5: 68 bytes on wire (544 bits), 68 bytes captured (544 bits)
Linux cooked capture
Internet Protocol Version 4, Src: 173.192.222.175 (173.192.222.175), Dst: 100.77.50.79 (100.77.50.79)
Transmission Control Protocol, Src Port: xmpp-client (5222), Dst Port: 35150 (35150), Seq: 1, Ack: 30, Len: 0

No.     Time        Source                Destination           Protocol Length Info
      6 3.366193    100.77.50.79          173.192.222.175       TCP      145    [TCP segment of a reassembled PDU]

Frame 6: 145 bytes on wire (1160 bits), 145 bytes captured (1160 bits)
Linux cooked capture
Internet Protocol Version 4, Src: 100.77.50.79 (100.77.50.79), Dst: 173.192.222.175 (173.192.222.175)
Transmission Control Protocol, Src Port: 35150 (35150), Dst Port: xmpp-client (5222), Seq: 30, Ack: 1, Len: 77

No.     Time        Source                Destination           Protocol Length Info
      7 3.545933    54.243.73.193         100.77.50.79          TCP      68     http > 57848 [ACK] Seq=1 Ack=2 Win=64251 Len=0 TSval=297897372 TSecr=1317339

Frame 7: 68 bytes on wire (544 bits), 68 bytes captured (544 bits)
Linux cooked capture
Internet Protocol Version 4, Src: 54.243.73.193 (54.243.73.193), Dst: 100.77.50.79 (100.77.50.79)
Transmission Control Protocol, Src Port: http (80), Dst Port: 57848 (57848), Seq: 1, Ack: 2, Len: 0

No.     Time        Source                Destination           Protocol Length Info
      8 3.546256    54.243.73.193         100.77.50.79          TCP      68     http > 57848 [FIN, ACK] Seq=1 Ack=2 Win=64251 Len=0 TSval=297897372 TSecr=1317339

Frame 8: 68 bytes on wire (544 bits), 68 bytes captured (544 bits)
Linux cooked capture
Internet Protocol Version 4, Src: 54.243.73.193 (54.243.73.193), Dst: 100.77.50.79 (100.77.50.79)
Transmission Control Protocol, Src Port: http (80), Dst Port: 57848 (57848), Seq: 1, Ack: 2, Len: 0

No.     Time        Source                Destination           Protocol Length Info
      9 3.546356    100.77.50.79          54.243.73.193         TCP      68     57848 > http [ACK] Seq=2 Ack=2 Win=1965 Len=0 TSval=1317513 TSecr=297897372

Frame 9: 68 bytes on wire (544 bits), 68 bytes captured (544 bits)
Linux cooked capture
Internet Protocol Version 4, Src: 100.77.50.79 (100.77.50.79), Dst: 54.243.73.193 (54.243.73.193)
Transmission Control Protocol, Src Port: 57848 (57848), Dst Port: http (80), Seq: 2, Ack: 2, Len: 0

No.     Time        Source                Destination           Protocol Length Info
     10 3.575966    54.243.73.193         100.77.50.79          TCP      68     [TCP Dup ACK 8#1] http > 57848 [ACK] Seq=2 Ack=2 Win=64251 Len=0 TSval=297897376 TSecr=1317339

Frame 10: 68 bytes on wire (544 bits), 68 bytes captured (544 bits)
Linux cooked capture
Internet Protocol Version 4, Src: 54.243.73.193 (54.243.73.193), Dst: 100.77.50.79 (100.77.50.79)
Transmission Control Protocol, Src Port: http (80), Dst Port: 57848 (57848), Seq: 2, Ack: 2, Len: 0

No.     Time        Source                Destination           Protocol Length Info
     11 3.675823    173.192.222.175       100.77.50.79          TCP      68     [TCP Dup ACK 5#1] xmpp-client > 35150 [ACK] Seq=1 Ack=30 Win=512 Len=0 TSval=1611997743 TSecr=1317469

Frame 11: 68 bytes on wire (544 bits), 68 bytes captured (544 bits)
Linux cooked capture
Internet Protocol Version 4, Src: 173.192.222.175 (173.192.222.175), Dst: 100.77.50.79 (100.77.50.79)
Transmission Control Protocol, Src Port: xmpp-client (5222), Dst Port: 35150 (35150), Seq: 1, Ack: 30, Len: 0

No.     Time        Source                Destination           Protocol Length Info
     12 3.755931    173.192.222.175       100.77.50.79          TCP      95     [TCP segment of a reassembled PDU]

Frame 12: 95 bytes on wire (760 bits), 95 bytes captured (760 bits)
Linux cooked capture
Internet Protocol Version 4, Src: 173.192.222.175 (173.192.222.175), Dst: 100.77.50.79 (100.77.50.79)
Transmission Control Protocol, Src Port: xmpp-client (5222), Dst Port: 35150 (35150), Seq: 1, Ack: 107, Len: 27

No.     Time        Source                Destination           Protocol Length Info
     13 3.756270    100.77.50.79          173.192.222.175       TCP      68     35150 > xmpp-client [ACK] Seq=107 Ack=28 Win=1965 Len=0 TSval=1317534 TSecr=1611997823

Frame 13: 68 bytes on wire (544 bits), 68 bytes captured (544 bits)
Linux cooked capture
Internet Protocol Version 4, Src: 100.77.50.79 (100.77.50.79), Dst: 173.192.222.175 (173.192.222.175)
Transmission Control Protocol, Src Port: 35150 (35150), Dst Port: xmpp-client (5222), Seq: 107, Ack: 28, Len: 0

No.     Time        Source                Destination           Protocol Length Info
     14 3.759363    100.77.50.79          173.192.222.175       TCP      125    [TCP segment of a reassembled PDU]

Frame 14: 125 bytes on wire (1000 bits), 125 bytes captured (1000 bits)
Linux cooked capture
Internet Protocol Version 4, Src: 100.77.50.79 (100.77.50.79), Dst: 173.192.222.175 (173.192.222.175)
Transmission Control Protocol, Src Port: 35150 (35150), Dst Port: xmpp-client (5222), Seq: 107, Ack: 28, Len: 57

No.     Time        Source                Destination           Protocol Length Info
     15 3.765880    173.192.222.175       100.77.50.79          TCP      86     [TCP segment of a reassembled PDU]

Frame 15: 86 bytes on wire (688 bits), 86 bytes captured (688 bits)
Linux cooked capture
Internet Protocol Version 4, Src: 173.192.222.175 (173.192.222.175), Dst: 100.77.50.79 (100.77.50.79)
Transmission Control Protocol, Src Port: xmpp-client (5222), Dst Port: 35150 (35150), Seq: 28, Ack: 107, Len: 18

No.     Time        Source                Destination           Protocol Length Info
     16 3.775823    173.192.222.175       100.77.50.79          TCP      112    [TCP segment of a reassembled PDU]

Frame 16: 112 bytes on wire (896 bits), 112 bytes captured (896 bits)
Linux cooked capture
Internet Protocol Version 4, Src: 173.192.222.175 (173.192.222.175), Dst: 100.77.50.79 (100.77.50.79)
Transmission Control Protocol, Src Port: xmpp-client (5222), Dst Port: 35150 (35150), Seq: 46, Ack: 107, Len: 44

No.     Time        Source                Destination           Protocol Length Info
     17 3.779318    100.77.50.79          173.192.222.175       TCP      68     35150 > xmpp-client [ACK] Seq=164 Ack=90 Win=1965 Len=0 TSval=1317536 TSecr=1611997824

Frame 17: 68 bytes on wire (544 bits), 68 bytes captured (544 bits)
Linux cooked capture
Internet Protocol Version 4, Src: 100.77.50.79 (100.77.50.79), Dst: 173.192.222.175 (173.192.222.175)
Transmission Control Protocol, Src Port: 35150 (35150), Dst Port: xmpp-client (5222), Seq: 164, Ack: 90, Len: 0

No.     Time        Source                Destination           Protocol Length Info
     18 4.105845    173.192.222.175       100.77.50.79          TCP      112    [TCP segment of a reassembled PDU]

Frame 18: 112 bytes on wire (896 bits), 112 bytes captured (896 bits)
Linux cooked capture
Internet Protocol Version 4, Src: 173.192.222.175 (173.192.222.175), Dst: 100.77.50.79 (100.77.50.79)
Transmission Control Protocol, Src Port: xmpp-client (5222), Dst Port: 35150 (35150), Seq: 90, Ack: 164, Len: 44

No.     Time        Source                Destination           Protocol Length Info
     19 4.144126    100.77.50.79          173.192.222.175       TCP      68     35150 > xmpp-client [ACK] Seq=164 Ack=134 Win=1965 Len=0 TSval=1317573 TSecr=1611998143

Frame 19: 68 bytes on wire (544 bits), 68 bytes captured (544 bits)
Linux cooked capture
Internet Protocol Version 4, Src: 100.77.50.79 (100.77.50.79), Dst: 173.192.222.175 (173.192.222.175)
Transmission Control Protocol, Src Port: 35150 (35150), Dst Port: xmpp-client (5222), Seq: 164, Ack: 134, Len: 0

No.     Time        Source                Destination           Protocol Length Info
     20 13.608213   100.77.50.79          173.192.222.175       TCP      144    [TCP segment of a reassembled PDU]

Frame 20: 144 bytes on wire (1152 bits), 144 bytes captured (1152 bits)
Linux cooked capture
Internet Protocol Version 4, Src: 100.77.50.79 (100.77.50.79), Dst: 173.192.222.175 (173.192.222.175)
Transmission Control Protocol, Src Port: 35150 (35150), Dst Port: xmpp-client (5222), Seq: 164, Ack: 134, Len: 76

No.     Time        Source                Destination           Protocol Length Info
     21 13.811533   100.77.50.79          173.194.45.49         TCP      68     40363 > https [FIN, ACK] Seq=1 Ack=1 Win=3906 Len=0 TSval=1318538 TSecr=3726668859

Frame 21: 68 bytes on wire (544 bits), 68 bytes captured (544 bits)
Linux cooked capture
Internet Protocol Version 4, Src: 100.77.50.79 (100.77.50.79), Dst: 173.194.45.49 (173.194.45.49)
Transmission Control Protocol, Src Port: 40363 (40363), Dst Port: https (443), Seq: 1, Ack: 1, Len: 0

No.     Time        Source                Destination           Protocol Length Info
     22 14.684025   100.77.50.79          173.194.45.49         TCP      68     40363 > https [FIN, ACK] Seq=1 Ack=1 Win=3906 Len=0 TSval=1318627 TSecr=3726668859

Frame 22: 68 bytes on wire (544 bits), 68 bytes captured (544 bits)
Linux cooked capture
Internet Protocol Version 4, Src: 100.77.50.79 (100.77.50.79), Dst: 173.194.45.49 (173.194.45.49)
Transmission Control Protocol, Src Port: 40363 (40363), Dst Port: https (443), Seq: 1, Ack: 1, Len: 0

No.     Time        Source                Destination           Protocol Length Info
     23 16.060651   173.192.222.175       100.77.50.79          TCP      112    [TCP segment of a reassembled PDU]

Frame 23: 112 bytes on wire (896 bits), 112 bytes captured (896 bits)
Linux cooked capture
Internet Protocol Version 4, Src: 173.192.222.175 (173.192.222.175), Dst: 100.77.50.79 (100.77.50.79)
Transmission Control Protocol, Src Port: xmpp-client (5222), Dst Port: 35150 (35150), Seq: 134, Ack: 240, Len: 44

No.     Time        Source                Destination           Protocol Length Info
     24 16.060990   100.77.50.79          173.192.222.175       TCP      68     35150 > xmpp-client [ACK] Seq=240 Ack=178 Win=1965 Len=0 TSval=1318764 TSecr=1612010128

Frame 24: 68 bytes on wire (544 bits), 68 bytes captured (544 bits)
Linux cooked capture
Internet Protocol Version 4, Src: 100.77.50.79 (100.77.50.79), Dst: 173.192.222.175 (173.192.222.175)
Transmission Control Protocol, Src Port: 35150 (35150), Dst Port: xmpp-client (5222), Seq: 240, Ack: 178, Len: 0

No.     Time        Source                Destination           Protocol Length Info
     25 16.444283   100.77.50.79          173.194.45.49         TCP      68     40363 > https [FIN, ACK] Seq=1 Ack=1 Win=3906 Len=0 TSval=1318803 TSecr=3726668859

Frame 25: 68 bytes on wire (544 bits), 68 bytes captured (544 bits)
Linux cooked capture
Internet Protocol Version 4, Src: 100.77.50.79 (100.77.50.79), Dst: 173.194.45.49 (173.194.45.49)
Transmission Control Protocol, Src Port: 40363 (40363), Dst Port: https (443), Seq: 1, Ack: 1, Len: 0

No.     Time        Source                Destination           Protocol Length Info
     26 18.541786   100.77.50.79          173.192.222.175       TCP      136    [TCP segment of a reassembled PDU]

Frame 26: 136 bytes on wire (1088 bits), 136 bytes captured (1088 bits)
Linux cooked capture
Internet Protocol Version 4, Src: 100.77.50.79 (100.77.50.79), Dst: 173.192.222.175 (173.192.222.175)
Transmission Control Protocol, Src Port: 35150 (35150), Dst Port: xmpp-client (5222), Seq: 240, Ack: 178, Len: 68

No.     Time        Source                Destination           Protocol Length Info
     27 18.820620   173.192.222.175       100.77.50.79          TCP      112    [TCP segment of a reassembled PDU]

Frame 27: 112 bytes on wire (896 bits), 112 bytes captured (896 bits)
Linux cooked capture
Internet Protocol Version 4, Src: 173.192.222.175 (173.192.222.175), Dst: 100.77.50.79 (100.77.50.79)
Transmission Control Protocol, Src Port: xmpp-client (5222), Dst Port: 35150 (35150), Seq: 178, Ack: 308, Len: 44

No.     Time        Source                Destination           Protocol Length Info
     28 18.820966   100.77.50.79          173.192.222.175       TCP      68     35150 > xmpp-client [ACK] Seq=308 Ack=222 Win=1965 Len=0 TSval=1319040 TSecr=1612012888

Frame 28: 68 bytes on wire (544 bits), 68 bytes captured (544 bits)
Linux cooked capture
Internet Protocol Version 4, Src: 100.77.50.79 (100.77.50.79), Dst: 173.192.222.175 (173.192.222.175)
Transmission Control Protocol, Src Port: 35150 (35150), Dst Port: xmpp-client (5222), Seq: 308, Ack: 222, Len: 0

No.     Time        Source                Destination           Protocol Length Info
     29 19.974043   100.77.50.79          173.194.45.49         TCP      68     40363 > https [FIN, ACK] Seq=1 Ack=1 Win=3906 Len=0 TSval=1319156 TSecr=3726668859

Frame 29: 68 bytes on wire (544 bits), 68 bytes captured (544 bits)
Linux cooked capture
Internet Protocol Version 4, Src: 100.77.50.79 (100.77.50.79), Dst: 173.194.45.49 (173.194.45.49)
Transmission Control Protocol, Src Port: 40363 (40363), Dst Port: https (443), Seq: 1, Ack: 1, Len: 0

No.     Time        Source                Destination           Protocol Length Info
     30 21.531570   100.77.50.79          173.192.222.175       TCP      127    [TCP segment of a reassembled PDU]

Frame 30: 127 bytes on wire (1016 bits), 127 bytes captured (1016 bits)
Linux cooked capture
Internet Protocol Version 4, Src: 100.77.50.79 (100.77.50.79), Dst: 173.192.222.175 (173.192.222.175)
Transmission Control Protocol, Src Port: 35150 (35150), Dst Port: xmpp-client (5222), Seq: 308, Ack: 222, Len: 59

No.     Time        Source                Destination           Protocol Length Info
     31 21.790713   173.192.222.175       100.77.50.79          TCP      112    [TCP segment of a reassembled PDU]

Frame 31: 112 bytes on wire (896 bits), 112 bytes captured (896 bits)
Linux cooked capture
Internet Protocol Version 4, Src: 173.192.222.175 (173.192.222.175), Dst: 100.77.50.79 (100.77.50.79)
Transmission Control Protocol, Src Port: xmpp-client (5222), Dst Port: 35150 (35150), Seq: 222, Ack: 367, Len: 44

No.     Time        Source                Destination           Protocol Length Info
     32 21.791343   100.77.50.79          173.192.222.175       TCP      68     35150 > xmpp-client [ACK] Seq=367 Ack=266 Win=1965 Len=0 TSval=1319337 TSecr=1612015848

Frame 32: 68 bytes on wire (544 bits), 68 bytes captured (544 bits)
Linux cooked capture
Internet Protocol Version 4, Src: 100.77.50.79 (100.77.50.79), Dst: 173.192.222.175 (173.192.222.175)
Transmission Control Protocol, Src Port: 35150 (35150), Dst Port: xmpp-client (5222), Seq: 367, Ack: 266, Len: 0

No.     Time        Source                Destination           Protocol Length Info
     33 22.415243   100.77.50.79          130.186.6.177         TCP      68     59465 > imaps [FIN, ACK] Seq=1 Ack=1 Win=2920 Len=0 TSval=1319400 TSecr=3086730866

Frame 33: 68 bytes on wire (544 bits), 68 bytes captured (544 bits)
Linux cooked capture
Internet Protocol Version 4, Src: 100.77.50.79 (100.77.50.79), Dst: 130.186.6.177 (130.186.6.177)
Transmission Control Protocol, Src Port: 59465 (59465), Dst Port: imaps (993), Seq: 1, Ack: 1, Len: 0

No.     Time        Source                Destination           Protocol Length Info
     34 22.440086   100.77.50.79          188.125.68.129        TCP      68     53272 > imaps [FIN, ACK] Seq=1 Ack=1 Win=5192 Len=0 TSval=1319402 TSecr=2841210423

Frame 34: 68 bytes on wire (544 bits), 68 bytes captured (544 bits)
Linux cooked capture
Internet Protocol Version 4, Src: 100.77.50.79 (100.77.50.79), Dst: 188.125.68.129 (188.125.68.129)
Transmission Control Protocol, Src Port: 53272 (53272), Dst Port: imaps (993), Seq: 1, Ack: 1, Len: 0

No.     Time        Source                Destination           Protocol Length Info
     35 22.640668   130.186.6.177         100.77.50.79          TLSv1    145    Application Data

Frame 35: 145 bytes on wire (1160 bits), 145 bytes captured (1160 bits)
Linux cooked capture
Internet Protocol Version 4, Src: 130.186.6.177 (130.186.6.177), Dst: 100.77.50.79 (100.77.50.79)
Transmission Control Protocol, Src Port: imaps (993), Dst Port: 59465 (59465), Seq: 1, Ack: 2, Len: 77
Secure Sockets Layer

No.     Time        Source                Destination           Protocol Length Info
     36 22.641003   100.77.50.79          130.186.6.177         TCP      56     59465 > imaps [RST] Seq=2 Win=0 Len=0

Frame 36: 56 bytes on wire (448 bits), 56 bytes captured (448 bits)
Linux cooked capture
Internet Protocol Version 4, Src: 100.77.50.79 (100.77.50.79), Dst: 130.186.6.177 (130.186.6.177)
Transmission Control Protocol, Src Port: 59465 (59465), Dst Port: imaps (993), Seq: 2, Len: 0

No.     Time        Source                Destination           Protocol Length Info
     37 22.641086   130.186.6.177         100.77.50.79          TCP      68     imaps > 59465 [FIN, ACK] Seq=78 Ack=2 Win=62 Len=0 TSval=3086801445 TSecr=1319400

Frame 37: 68 bytes on wire (544 bits), 68 bytes captured (544 bits)
Linux cooked capture
Internet Protocol Version 4, Src: 130.186.6.177 (130.186.6.177), Dst: 100.77.50.79 (100.77.50.79)
Transmission Control Protocol, Src Port: imaps (993), Dst Port: 59465 (59465), Seq: 78, Ack: 2, Len: 0

No.     Time        Source                Destination           Protocol Length Info
     38 22.641293   100.77.50.79          130.186.6.177         TCP      56     59465 > imaps [RST] Seq=2 Win=0 Len=0

Frame 38: 56 bytes on wire (448 bits), 56 bytes captured (448 bits)
Linux cooked capture
Internet Protocol Version 4, Src: 100.77.50.79 (100.77.50.79), Dst: 130.186.6.177 (130.186.6.177)
Transmission Control Protocol, Src Port: 59465 (59465), Dst Port: imaps (993), Seq: 2, Len: 0

No.     Time        Source                Destination           Protocol Length Info
     39 22.690866   188.125.68.129        100.77.50.79          TCP      68     imaps > 53272 [FIN, ACK] Seq=1 Ack=2 Win=17688 Len=0 TSval=2841473386 TSecr=1319402

Frame 39: 68 bytes on wire (544 bits), 68 bytes captured (544 bits)
Linux cooked capture
Internet Protocol Version 4, Src: 188.125.68.129 (188.125.68.129), Dst: 100.77.50.79 (100.77.50.79)
Transmission Control Protocol, Src Port: imaps (993), Dst Port: 53272 (53272), Seq: 1, Ack: 2, Len: 0

No.     Time        Source                Destination           Protocol Length Info
     40 22.691130   100.77.50.79          188.125.68.129        TCP      68     53272 > imaps [ACK] Seq=2 Ack=2 Win=5192 Len=0 TSval=1319427 TSecr=2841473386

Frame 40: 68 bytes on wire (544 bits), 68 bytes captured (544 bits)
Linux cooked capture
Internet Protocol Version 4, Src: 100.77.50.79 (100.77.50.79), Dst: 188.125.68.129 (188.125.68.129)
Transmission Control Protocol, Src Port: 53272 (53272), Dst Port: imaps (993), Seq: 2, Ack: 2, Len: 0

No.     Time        Source                Destination           Protocol Length Info
     41 24.169410   100.77.50.79          83.224.70.93          DNS      76     Standard query 0x3196  A www.google.com

Frame 41: 76 bytes on wire (608 bits), 76 bytes captured (608 bits)
Linux cooked capture
Internet Protocol Version 4, Src: 100.77.50.79 (100.77.50.79), Dst: 83.224.70.93 (83.224.70.93)
User Datagram Protocol, Src Port: 13617 (13617), Dst Port: domain (53)
Domain Name System (query)

No.     Time        Source                Destination           Protocol Length Info
     42 24.320560   83.224.70.93          100.77.50.79          DNS      156    Standard query response 0x3196  A 173.194.45.51 A 173.194.45.52 A 173.194.45.50 A 173.194.45.48 A 173.194.45.49

Frame 42: 156 bytes on wire (1248 bits), 156 bytes captured (1248 bits)
Linux cooked capture
Internet Protocol Version 4, Src: 83.224.70.93 (83.224.70.93), Dst: 100.77.50.79 (100.77.50.79)
User Datagram Protocol, Src Port: domain (53), Dst Port: 13617 (13617)
Domain Name System (response)

No.     Time        Source                Destination           Protocol Length Info
     43 24.386308   100.77.50.79          173.194.45.51         TCP      76     48853 > https [SYN] Seq=0 Win=3930 Len=0 MSS=1310 SACK_PERM=1 TSval=1319597 TSecr=0 WS=2

Frame 43: 76 bytes on wire (608 bits), 76 bytes captured (608 bits)
Linux cooked capture
Internet Protocol Version 4, Src: 100.77.50.79 (100.77.50.79), Dst: 173.194.45.51 (173.194.45.51)
Transmission Control Protocol, Src Port: 48853 (48853), Dst Port: https (443), Seq: 0, Len: 0

No.     Time        Source                Destination           Protocol Length Info
     44 24.540603   173.194.45.51         100.77.50.79          TCP      76     https > 48853 [SYN, ACK] Seq=0 Ack=1 Win=42540 Len=0 MSS=1400 SACK_PERM=1 TSval=3737738558 TSecr=1319597 WS=64

Frame 44: 76 bytes on wire (608 bits), 76 bytes captured (608 bits)
Linux cooked capture
Internet Protocol Version 4, Src: 173.194.45.51 (173.194.45.51), Dst: 100.77.50.79 (100.77.50.79)
Transmission Control Protocol, Src Port: https (443), Dst Port: 48853 (48853), Seq: 0, Ack: 1, Len: 0

No.     Time        Source                Destination           Protocol Length Info
     45 24.540901   100.77.50.79          173.194.45.51         TCP      68     48853 > https [ACK] Seq=1 Ack=1 Win=3930 Len=0 TSval=1319612 TSecr=3737738558

Frame 45: 68 bytes on wire (544 bits), 68 bytes captured (544 bits)
Linux cooked capture
Internet Protocol Version 4, Src: 100.77.50.79 (100.77.50.79), Dst: 173.194.45.51 (173.194.45.51)
Transmission Control Protocol, Src Port: 48853 (48853), Dst Port: https (443), Seq: 1, Ack: 1, Len: 0

No.     Time        Source                Destination           Protocol Length Info
     46 24.797928   100.77.50.79          173.192.222.175       TCP      125    [TCP segment of a reassembled PDU]

Frame 46: 125 bytes on wire (1000 bits), 125 bytes captured (1000 bits)
Linux cooked capture
Internet Protocol Version 4, Src: 100.77.50.79 (100.77.50.79), Dst: 173.192.222.175 (173.192.222.175)
Transmission Control Protocol, Src Port: 35150 (35150), Dst Port: xmpp-client (5222), Seq: 367, Ack: 266, Len: 57

No.     Time        Source                Destination           Protocol Length Info
     47 24.885116   100.77.50.79          173.194.45.51         TLSv1    148    Client Hello

Frame 47: 148 bytes on wire (1184 bits), 148 bytes captured (1184 bits)
Linux cooked capture
Internet Protocol Version 4, Src: 100.77.50.79 (100.77.50.79), Dst: 173.194.45.51 (173.194.45.51)
Transmission Control Protocol, Src Port: 48853 (48853), Dst Port: https (443), Seq: 1, Ack: 1, Len: 80
Secure Sockets Layer

No.     Time        Source                Destination           Protocol Length Info
     48 25.060653   173.194.45.51         100.77.50.79          TCP      68     https > 48853 [ACK] Seq=1 Ack=81 Win=42560 Len=0 TSval=3737739078 TSecr=1319647

Frame 48: 68 bytes on wire (544 bits), 68 bytes captured (544 bits)
Linux cooked capture
Internet Protocol Version 4, Src: 173.194.45.51 (173.194.45.51), Dst: 100.77.50.79 (100.77.50.79)
Transmission Control Protocol, Src Port: https (443), Dst Port: 48853 (48853), Seq: 1, Ack: 81, Len: 0

No.     Time        Source                Destination           Protocol Length Info
     49 25.240830   173.194.45.51         100.77.50.79          TLSv1    1366   Server Hello

Frame 49: 1366 bytes on wire (10928 bits), 1366 bytes captured (10928 bits)
Linux cooked capture
Internet Protocol Version 4, Src: 173.194.45.51 (173.194.45.51), Dst: 100.77.50.79 (100.77.50.79)
Transmission Control Protocol, Src Port: https (443), Dst Port: 48853 (48853), Seq: 1, Ack: 81, Len: 1298
Secure Sockets Layer

No.     Time        Source                Destination           Protocol Length Info
     50 25.241153   100.77.50.79          173.194.45.51         TCP      68     48853 > https [ACK] Seq=81 Ack=1299 Win=4018 Len=0 TSval=1319682 TSecr=3737739078

Frame 50: 68 bytes on wire (544 bits), 68 bytes captured (544 bits)
Linux cooked capture
Internet Protocol Version 4, Src: 100.77.50.79 (100.77.50.79), Dst: 173.194.45.51 (173.194.45.51)
Transmission Control Protocol, Src Port: 48853 (48853), Dst Port: https (443), Seq: 81, Ack: 1299, Len: 0

No.     Time        Source                Destination           Protocol Length Info
     51 25.420623   173.194.45.51         100.77.50.79          TLSv1    663    [TCP Previous segment not captured] Ignored Unknown Record

Frame 51: 663 bytes on wire (5304 bits), 663 bytes captured (5304 bits)
Linux cooked capture
Internet Protocol Version 4, Src: 173.194.45.51 (173.194.45.51), Dst: 100.77.50.79 (100.77.50.79)
Transmission Control Protocol, Src Port: https (443), Dst Port: 48853 (48853), Seq: 2597, Ack: 81, Len: 595
Secure Sockets Layer

No.     Time        Source                Destination           Protocol Length Info
     52 25.420848   100.77.50.79          173.194.45.51         TCP      80     [TCP Dup ACK 50#1] 48853 > https [ACK] Seq=81 Ack=1299 Win=4018 Len=0 TSval=1319700 TSecr=3737739078 SLE=2597 SRE=3192

Frame 52: 80 bytes on wire (640 bits), 80 bytes captured (640 bits)
Linux cooked capture
Internet Protocol Version 4, Src: 100.77.50.79 (100.77.50.79), Dst: 173.194.45.51 (173.194.45.51)
Transmission Control Protocol, Src Port: 48853 (48853), Dst Port: https (443), Seq: 81, Ack: 1299, Len: 0

No.     Time        Source                Destination           Protocol Length Info
     53 25.660785   173.194.45.51         100.77.50.79          TCP      1366   [TCP Retransmission] [TCP segment of a reassembled PDU]

Frame 53: 1366 bytes on wire (10928 bits), 1366 bytes captured (10928 bits)
Linux cooked capture
Internet Protocol Version 4, Src: 173.194.45.51 (173.194.45.51), Dst: 100.77.50.79 (100.77.50.79)
Transmission Control Protocol, Src Port: https (443), Dst Port: 48853 (48853), Seq: 1299, Ack: 81, Len: 1298

No.     Time        Source                Destination           Protocol Length Info
     54 25.661045   100.77.50.79          173.194.45.51         TCP      68     48853 > https [ACK] Seq=81 Ack=3192 Win=4018 Len=0 TSval=1319724 TSecr=3737739078

Frame 54: 68 bytes on wire (544 bits), 68 bytes captured (544 bits)
Linux cooked capture
Internet Protocol Version 4, Src: 100.77.50.79 (100.77.50.79), Dst: 173.194.45.51 (173.194.45.51)
Transmission Control Protocol, Src Port: 48853 (48853), Dst Port: https (443), Seq: 81, Ack: 3192, Len: 0

No.     Time        Source                Destination           Protocol Length Info
     55 25.670631   173.192.222.175       100.77.50.79          TCP      112    [TCP segment of a reassembled PDU]

Frame 55: 112 bytes on wire (896 bits), 112 bytes captured (896 bits)
Linux cooked capture
Internet Protocol Version 4, Src: 173.192.222.175 (173.192.222.175), Dst: 100.77.50.79 (100.77.50.79)
Transmission Control Protocol, Src Port: xmpp-client (5222), Dst Port: 35150 (35150), Seq: 266, Ack: 424, Len: 44

No.     Time        Source                Destination           Protocol Length Info
     56 25.671156   100.77.50.79          173.192.222.175       TCP      68     35150 > xmpp-client [ACK] Seq=424 Ack=310 Win=1965 Len=0 TSval=1319725 TSecr=1612019129

Frame 56: 68 bytes on wire (544 bits), 68 bytes captured (544 bits)
Linux cooked capture
Internet Protocol Version 4, Src: 100.77.50.79 (100.77.50.79), Dst: 173.192.222.175 (173.192.222.175)
Transmission Control Protocol, Src Port: 35150 (35150), Dst Port: xmpp-client (5222), Seq: 424, Ack: 310, Len: 0

No.     Time        Source                Destination           Protocol Length Info
     57 25.770726   173.194.45.51         100.77.50.79          TCP      1366   [TCP Retransmission] [TCP segment of a reassembled PDU]

Frame 57: 1366 bytes on wire (10928 bits), 1366 bytes captured (10928 bits)
Linux cooked capture
Internet Protocol Version 4, Src: 173.194.45.51 (173.194.45.51), Dst: 100.77.50.79 (100.77.50.79)
Transmission Control Protocol, Src Port: https (443), Dst Port: 48853 (48853), Seq: 1299, Ack: 81, Len: 1298

No.     Time        Source                Destination           Protocol Length Info
     58 25.770958   100.77.50.79          173.194.45.51         TCP      80     [TCP Dup ACK 54#1] 48853 > https [ACK] Seq=81 Ack=3192 Win=4018 Len=0 TSval=1319735 TSecr=3737739078 SLE=1299 SRE=2597

Frame 58: 80 bytes on wire (640 bits), 80 bytes captured (640 bits)
Linux cooked capture
Internet Protocol Version 4, Src: 100.77.50.79 (100.77.50.79), Dst: 173.194.45.51 (173.194.45.51)
Transmission Control Protocol, Src Port: 48853 (48853), Dst Port: https (443), Seq: 81, Ack: 3192, Len: 0

No.     Time        Source                Destination           Protocol Length Info
     59 26.368196   100.77.50.79          173.194.45.51         TLSv1    382    Client Key Exchange, Change Cipher Spec, Encrypted Handshake Message

Frame 59: 382 bytes on wire (3056 bits), 382 bytes captured (3056 bits)
Linux cooked capture
Internet Protocol Version 4, Src: 100.77.50.79 (100.77.50.79), Dst: 173.194.45.51 (173.194.45.51)
Transmission Control Protocol, Src Port: 48853 (48853), Dst Port: https (443), Seq: 81, Ack: 3192, Len: 314
Secure Sockets Layer

No.     Time        Source                Destination           Protocol Length Info
     60 26.710983   173.194.45.51         100.77.50.79          TLSv1    115    Change Cipher Spec, Encrypted Handshake Message

Frame 60: 115 bytes on wire (920 bits), 115 bytes captured (920 bits)
Linux cooked capture
Internet Protocol Version 4, Src: 173.194.45.51 (173.194.45.51), Dst: 100.77.50.79 (100.77.50.79)
Transmission Control Protocol, Src Port: https (443), Dst Port: 48853 (48853), Seq: 3192, Ack: 395, Len: 47
Secure Sockets Layer

No.     Time        Source                Destination           Protocol Length Info
     61 26.711241   100.77.50.79          173.194.45.51         TCP      68     48853 > https [ACK] Seq=395 Ack=3239 Win=4018 Len=0 TSval=1319829 TSecr=3737740679

Frame 61: 68 bytes on wire (544 bits), 68 bytes captured (544 bits)
Linux cooked capture
Internet Protocol Version 4, Src: 100.77.50.79 (100.77.50.79), Dst: 173.194.45.51 (173.194.45.51)
Transmission Control Protocol, Src Port: 48853 (48853), Dst Port: https (443), Seq: 395, Ack: 3239, Len: 0

No.     Time        Source                Destination           Protocol Length Info
     62 26.828021   100.77.50.79          173.192.222.175       XMPP/XML 123    UNKNOWN PACKET 

Frame 62: 123 bytes on wire (984 bits), 123 bytes captured (984 bits)
Linux cooked capture
Internet Protocol Version 4, Src: 100.77.50.79 (100.77.50.79), Dst: 173.192.222.175 (173.192.222.175)
Transmission Control Protocol, Src Port: 35150 (35150), Dst Port: xmpp-client (5222), Seq: 424, Ack: 310, Len: 55
[8 Reassembled TCP Segments (478 bytes): #1(29), #6(77), #14(57), #20(76), #26(68), #30(59), #46(57), #62(55)]
XMPP Protocol

No.     Time        Source                Destination           Protocol Length Info
     63 27.034025   100.77.50.79          173.194.45.49         TCP      68     40363 > https [FIN, ACK] Seq=1 Ack=1 Win=3906 Len=0 TSval=1319862 TSecr=3726668859

Frame 63: 68 bytes on wire (544 bits), 68 bytes captured (544 bits)
Linux cooked capture
Internet Protocol Version 4, Src: 100.77.50.79 (100.77.50.79), Dst: 173.194.45.49 (173.194.45.49)
Transmission Control Protocol, Src Port: 40363 (40363), Dst Port: https (443), Seq: 1, Ack: 1, Len: 0

No.     Time        Source                Destination           Protocol Length Info
     64 27.150728   173.192.222.175       100.77.50.79          TCP      112    [TCP segment of a reassembled PDU]

Frame 64: 112 bytes on wire (896 bits), 112 bytes captured (896 bits)
Linux cooked capture
Internet Protocol Version 4, Src: 173.192.222.175 (173.192.222.175), Dst: 100.77.50.79 (100.77.50.79)
Transmission Control Protocol, Src Port: xmpp-client (5222), Dst Port: 35150 (35150), Seq: 310, Ack: 479, Len: 44

No.     Time        Source                Destination           Protocol Length Info
     65 27.151338   100.77.50.79          173.192.222.175       TCP      68     35150 > xmpp-client [ACK] Seq=479 Ack=354 Win=1965 Len=0 TSval=1319873 TSecr=1612021168

Frame 65: 68 bytes on wire (544 bits), 68 bytes captured (544 bits)
Linux cooked capture
Internet Protocol Version 4, Src: 100.77.50.79 (100.77.50.79), Dst: 173.192.222.175 (173.192.222.175)
Transmission Control Protocol, Src Port: 35150 (35150), Dst Port: xmpp-client (5222), Seq: 479, Ack: 354, Len: 0

No.     Time        Source                Destination           Protocol Length Info
     66 27.799783   100.77.50.79          83.224.70.93          DNS      88     Standard query 0xd5f0  PTR 51.45.194.173.in-addr.arpa

Frame 66: 88 bytes on wire (704 bits), 88 bytes captured (704 bits)
Linux cooked capture
Internet Protocol Version 4, Src: 100.77.50.79 (100.77.50.79), Dst: 83.224.70.93 (83.224.70.93)
User Datagram Protocol, Src Port: 55584 (55584), Dst Port: domain (53)
Domain Name System (query)

No.     Time        Source                Destination           Protocol Length Info
     67 28.050510   83.224.70.93          100.77.50.79          DNS      127    Standard query response 0xd5f0  PTR par03s12-in-f19.1e100.net

Frame 67: 127 bytes on wire (1016 bits), 127 bytes captured (1016 bits)
Linux cooked capture
Internet Protocol Version 4, Src: 83.224.70.93 (83.224.70.93), Dst: 100.77.50.79 (100.77.50.79)
User Datagram Protocol, Src Port: domain (53), Dst Port: 55584 (55584)
Domain Name System (response)

No.     Time        Source                Destination           Protocol Length Info
     68 28.071025   100.77.50.79          173.194.45.51         TLSv1    281    Application Data

Frame 68: 281 bytes on wire (2248 bits), 281 bytes captured (2248 bits)
Linux cooked capture
Internet Protocol Version 4, Src: 100.77.50.79 (100.77.50.79), Dst: 173.194.45.51 (173.194.45.51)
Transmission Control Protocol, Src Port: 48853 (48853), Dst Port: https (443), Seq: 395, Ack: 3239, Len: 213
Secure Sockets Layer

No.     Time        Source                Destination           Protocol Length Info
     69 28.071848   100.77.50.79          173.194.45.51         TLSv1    386    Application Data

Frame 69: 386 bytes on wire (3088 bits), 386 bytes captured (3088 bits)
Linux cooked capture
Internet Protocol Version 4, Src: 100.77.50.79 (100.77.50.79), Dst: 173.194.45.51 (173.194.45.51)
Transmission Control Protocol, Src Port: 48853 (48853), Dst Port: https (443), Seq: 608, Ack: 3239, Len: 318
Secure Sockets Layer

No.     Time        Source                Destination           Protocol Length Info
     70 28.390526   173.194.45.51         100.77.50.79          TCP      68     https > 48853 [ACK] Seq=3239 Ack=608 Win=42880 Len=0 TSval=3737742403 TSecr=1319965

Frame 70: 68 bytes on wire (544 bits), 68 bytes captured (544 bits)
Linux cooked capture
Internet Protocol Version 4, Src: 173.194.45.51 (173.194.45.51), Dst: 100.77.50.79 (100.77.50.79)
Transmission Control Protocol, Src Port: https (443), Dst Port: 48853 (48853), Seq: 3239, Ack: 608, Len: 0

No.     Time        Source                Destination           Protocol Length Info
     71 28.750533   173.194.45.51         100.77.50.79          TCP      68     https > 48853 [ACK] Seq=3239 Ack=926 Win=42880 Len=0 TSval=3737742563 TSecr=1319965

Frame 71: 68 bytes on wire (544 bits), 68 bytes captured (544 bits)
Linux cooked capture
Internet Protocol Version 4, Src: 173.194.45.51 (173.194.45.51), Dst: 100.77.50.79 (100.77.50.79)
Transmission Control Protocol, Src Port: https (443), Dst Port: 48853 (48853), Seq: 3239, Ack: 926, Len: 0

No.     Time        Source                Destination           Protocol Length Info
     72 28.830530   173.194.45.51         100.77.50.79          TLSv1    589    Application Data

Frame 72: 589 bytes on wire (4712 bits), 589 bytes captured (4712 bits)
Linux cooked capture
Internet Protocol Version 4, Src: 173.194.45.51 (173.194.45.51), Dst: 100.77.50.79 (100.77.50.79)
Transmission Control Protocol, Src Port: https (443), Dst Port: 48853 (48853), Seq: 3239, Ack: 926, Len: 521
Secure Sockets Layer

No.     Time        Source                Destination           Protocol Length Info
     73 28.830745   100.77.50.79          173.194.45.51         TCP      68     48853 > https [ACK] Seq=926 Ack=3760 Win=4018 Len=0 TSval=1320041 TSecr=3737742570

Frame 73: 68 bytes on wire (544 bits), 68 bytes captured (544 bits)
Linux cooked capture
Internet Protocol Version 4, Src: 100.77.50.79 (100.77.50.79), Dst: 173.194.45.51 (173.194.45.51)
Transmission Control Protocol, Src Port: 48853 (48853), Dst Port: https (443), Seq: 926, Ack: 3760, Len: 0
