No.     Time        Source                Destination           Protocol Length Info
      1 0.000000    10.165.60.219         108.168.176.239       TCP      80     [TCP segment of a reassembled PDU]

Frame 1: 80 bytes on wire (640 bits), 80 bytes captured (640 bits)
Linux cooked capture
Internet Protocol Version 4, Src: 10.165.60.219 (10.165.60.219), Dst: 108.168.176.239 (108.168.176.239)
Transmission Control Protocol, Src Port: 58892 (58892), Dst Port: xmpp-client (5222), Seq: 1, Ack: 1, Len: 12

No.     Time        Source                Destination           Protocol Length Info
      2 0.242277    108.168.176.239       10.165.60.219         TCP      97     [TCP segment of a reassembled PDU]

Frame 2: 97 bytes on wire (776 bits), 97 bytes captured (776 bits)
Linux cooked capture
Internet Protocol Version 4, Src: 108.168.176.239 (108.168.176.239), Dst: 10.165.60.219 (10.165.60.219)
Transmission Control Protocol, Src Port: xmpp-client (5222), Dst Port: 58892 (58892), Seq: 1, Ack: 13, Len: 29

No.     Time        Source                Destination           Protocol Length Info
      3 0.242760    10.165.60.219         108.168.176.239       TCP      68     58892 > xmpp-client [ACK] Seq=13 Ack=30 Win=1965 Len=0 TSval=179020 TSecr=2730023343

Frame 3: 68 bytes on wire (544 bits), 68 bytes captured (544 bits)
Linux cooked capture
Internet Protocol Version 4, Src: 10.165.60.219 (10.165.60.219), Dst: 108.168.176.239 (108.168.176.239)
Transmission Control Protocol, Src Port: 58892 (58892), Dst Port: xmpp-client (5222), Seq: 13, Ack: 30, Len: 0

No.     Time        Source                Destination           Protocol Length Info
      4 1.700697    10.165.60.219         54.243.73.193         TCP      68     46902 > http [FIN, ACK] Seq=1 Ack=1 Win=2009 Len=0 TSval=179166 TSecr=69078376

Frame 4: 68 bytes on wire (544 bits), 68 bytes captured (544 bits)
Linux cooked capture
Internet Protocol Version 4, Src: 10.165.60.219 (10.165.60.219), Dst: 54.243.73.193 (54.243.73.193)
Transmission Control Protocol, Src Port: 46902 (46902), Dst Port: http (80), Seq: 1, Ack: 1, Len: 0

No.     Time        Source                Destination           Protocol Length Info
      5 1.832508    54.243.73.193         10.165.60.219         TCP      68     http > 46902 [ACK] Seq=1 Ack=2 Win=64251 Len=0 TSval=69079216 TSecr=179166

Frame 5: 68 bytes on wire (544 bits), 68 bytes captured (544 bits)
Linux cooked capture
Internet Protocol Version 4, Src: 54.243.73.193 (54.243.73.193), Dst: 10.165.60.219 (10.165.60.219)
Transmission Control Protocol, Src Port: http (80), Dst Port: 46902 (46902), Seq: 1, Ack: 2, Len: 0

No.     Time        Source                Destination           Protocol Length Info
      6 1.832863    54.243.73.193         10.165.60.219         TCP      68     http > 46902 [FIN, ACK] Seq=1 Ack=2 Win=64251 Len=0 TSval=69079216 TSecr=179166

Frame 6: 68 bytes on wire (544 bits), 68 bytes captured (544 bits)
Linux cooked capture
Internet Protocol Version 4, Src: 54.243.73.193 (54.243.73.193), Dst: 10.165.60.219 (10.165.60.219)
Transmission Control Protocol, Src Port: http (80), Dst Port: 46902 (46902), Seq: 1, Ack: 2, Len: 0

No.     Time        Source                Destination           Protocol Length Info
      7 1.832970    10.165.60.219         54.243.73.193         TCP      68     46902 > http [ACK] Seq=2 Ack=2 Win=2009 Len=0 TSval=179179 TSecr=69079216

Frame 7: 68 bytes on wire (544 bits), 68 bytes captured (544 bits)
Linux cooked capture
Internet Protocol Version 4, Src: 10.165.60.219 (10.165.60.219), Dst: 54.243.73.193 (54.243.73.193)
Transmission Control Protocol, Src Port: 46902 (46902), Dst Port: http (80), Seq: 2, Ack: 2, Len: 0

No.     Time        Source                Destination           Protocol Length Info
      8 5.463367    10.165.60.219         108.168.176.239       TCP      97     [TCP segment of a reassembled PDU]

Frame 8: 97 bytes on wire (776 bits), 97 bytes captured (776 bits)
Linux cooked capture
Internet Protocol Version 4, Src: 10.165.60.219 (10.165.60.219), Dst: 108.168.176.239 (108.168.176.239)
Transmission Control Protocol, Src Port: 58892 (58892), Dst Port: xmpp-client (5222), Seq: 13, Ack: 30, Len: 29

No.     Time        Source                Destination           Protocol Length Info
      9 6.845028    108.168.176.239       10.165.60.219         TCP      68     xmpp-client > 58892 [ACK] Seq=30 Ack=42 Win=512 Len=0 TSval=2730028852 TSecr=179542

Frame 9: 68 bytes on wire (544 bits), 68 bytes captured (544 bits)
Linux cooked capture
Internet Protocol Version 4, Src: 108.168.176.239 (108.168.176.239), Dst: 10.165.60.219 (10.165.60.219)
Transmission Control Protocol, Src Port: xmpp-client (5222), Dst Port: 58892 (58892), Seq: 30, Ack: 42, Len: 0

No.     Time        Source                Destination           Protocol Length Info
     10 6.845367    10.165.60.219         108.168.176.239       TCP      108    [TCP segment of a reassembled PDU]

Frame 10: 108 bytes on wire (864 bits), 108 bytes captured (864 bits)
Linux cooked capture
Internet Protocol Version 4, Src: 10.165.60.219 (10.165.60.219), Dst: 108.168.176.239 (108.168.176.239)
Transmission Control Protocol, Src Port: 58892 (58892), Dst Port: xmpp-client (5222), Seq: 42, Ack: 30, Len: 40

No.     Time        Source                Destination           Protocol Length Info
     11 7.415108    108.168.176.239       10.165.60.219         TCP      112    [TCP segment of a reassembled PDU]

Frame 11: 112 bytes on wire (896 bits), 112 bytes captured (896 bits)
Linux cooked capture
Internet Protocol Version 4, Src: 108.168.176.239 (108.168.176.239), Dst: 10.165.60.219 (10.165.60.219)
Transmission Control Protocol, Src Port: xmpp-client (5222), Dst Port: 58892 (58892), Seq: 30, Ack: 82, Len: 44

No.     Time        Source                Destination           Protocol Length Info
     12 7.417460    10.165.60.219         108.168.176.239       TCP      68     58892 > xmpp-client [ACK] Seq=82 Ack=74 Win=1965 Len=0 TSval=179737 TSecr=2730030432

Frame 12: 68 bytes on wire (544 bits), 68 bytes captured (544 bits)
Linux cooked capture
Internet Protocol Version 4, Src: 10.165.60.219 (10.165.60.219), Dst: 108.168.176.239 (108.168.176.239)
Transmission Control Protocol, Src Port: 58892 (58892), Dst Port: xmpp-client (5222), Seq: 82, Ack: 74, Len: 0

No.     Time        Source                Destination           Protocol Length Info
     13 8.453220    10.165.60.219         108.168.176.239       TCP      80     [TCP segment of a reassembled PDU]

Frame 13: 80 bytes on wire (640 bits), 80 bytes captured (640 bits)
Linux cooked capture
Internet Protocol Version 4, Src: 10.165.60.219 (10.165.60.219), Dst: 108.168.176.239 (108.168.176.239)
Transmission Control Protocol, Src Port: 58892 (58892), Dst Port: xmpp-client (5222), Seq: 82, Ack: 74, Len: 12

No.     Time        Source                Destination           Protocol Length Info
     14 8.881652    108.168.176.239       10.165.60.219         TCP      95     [TCP segment of a reassembled PDU]

Frame 14: 95 bytes on wire (760 bits), 95 bytes captured (760 bits)
Linux cooked capture
Internet Protocol Version 4, Src: 108.168.176.239 (108.168.176.239), Dst: 10.165.60.219 (10.165.60.219)
Transmission Control Protocol, Src Port: xmpp-client (5222), Dst Port: 58892 (58892), Seq: 74, Ack: 94, Len: 27

No.     Time        Source                Destination           Protocol Length Info
     15 8.882262    10.165.60.219         108.168.176.239       TCP      93     [TCP segment of a reassembled PDU]

Frame 15: 93 bytes on wire (744 bits), 93 bytes captured (744 bits)
Linux cooked capture
Internet Protocol Version 4, Src: 10.165.60.219 (10.165.60.219), Dst: 108.168.176.239 (108.168.176.239)
Transmission Control Protocol, Src Port: 58892 (58892), Dst Port: xmpp-client (5222), Seq: 94, Ack: 101, Len: 25

No.     Time        Source                Destination           Protocol Length Info
     16 9.341600    108.168.176.239       10.165.60.219         TCP      86     [TCP segment of a reassembled PDU]

Frame 16: 86 bytes on wire (688 bits), 86 bytes captured (688 bits)
Linux cooked capture
Internet Protocol Version 4, Src: 108.168.176.239 (108.168.176.239), Dst: 10.165.60.219 (10.165.60.219)
Transmission Control Protocol, Src Port: xmpp-client (5222), Dst Port: 58892 (58892), Seq: 101, Ack: 119, Len: 18

No.     Time        Source                Destination           Protocol Length Info
     17 9.380467    10.165.60.219         108.168.176.239       TCP      68     58892 > xmpp-client [ACK] Seq=119 Ack=119 Win=1965 Len=0 TSval=179934 TSecr=2730032364

Frame 17: 68 bytes on wire (544 bits), 68 bytes captured (544 bits)
Linux cooked capture
Internet Protocol Version 4, Src: 10.165.60.219 (10.165.60.219), Dst: 108.168.176.239 (108.168.176.239)
Transmission Control Protocol, Src Port: 58892 (58892), Dst Port: xmpp-client (5222), Seq: 119, Ack: 119, Len: 0

No.     Time        Source                Destination           Protocol Length Info
     18 16.623725   10.165.60.219         108.168.176.239       TCP      138    [TCP segment of a reassembled PDU]

Frame 18: 138 bytes on wire (1104 bits), 138 bytes captured (1104 bits)
Linux cooked capture
Internet Protocol Version 4, Src: 10.165.60.219 (10.165.60.219), Dst: 108.168.176.239 (108.168.176.239)
Transmission Control Protocol, Src Port: 58892 (58892), Dst Port: xmpp-client (5222), Seq: 119, Ack: 119, Len: 70

No.     Time        Source                Destination           Protocol Length Info
     19 17.121775   108.168.176.239       10.165.60.219         TCP      112    [TCP segment of a reassembled PDU]

Frame 19: 112 bytes on wire (896 bits), 112 bytes captured (896 bits)
Linux cooked capture
Internet Protocol Version 4, Src: 108.168.176.239 (108.168.176.239), Dst: 10.165.60.219 (10.165.60.219)
Transmission Control Protocol, Src Port: xmpp-client (5222), Dst Port: 58892 (58892), Seq: 119, Ack: 189, Len: 44

No.     Time        Source                Destination           Protocol Length Info
     20 17.122433   10.165.60.219         108.168.176.239       TCP      68     58892 > xmpp-client [ACK] Seq=189 Ack=163 Win=1965 Len=0 TSval=180708 TSecr=2730040122

Frame 20: 68 bytes on wire (544 bits), 68 bytes captured (544 bits)
Linux cooked capture
Internet Protocol Version 4, Src: 10.165.60.219 (10.165.60.219), Dst: 108.168.176.239 (108.168.176.239)
Transmission Control Protocol, Src Port: 58892 (58892), Dst Port: xmpp-client (5222), Seq: 189, Ack: 163, Len: 0

No.     Time        Source                Destination           Protocol Length Info
     21 19.568935   10.165.60.219         108.168.176.239       TCP      122    [TCP segment of a reassembled PDU]

Frame 21: 122 bytes on wire (976 bits), 122 bytes captured (976 bits)
Linux cooked capture
Internet Protocol Version 4, Src: 10.165.60.219 (10.165.60.219), Dst: 108.168.176.239 (108.168.176.239)
Transmission Control Protocol, Src Port: 58892 (58892), Dst Port: xmpp-client (5222), Seq: 189, Ack: 163, Len: 54

No.     Time        Source                Destination           Protocol Length Info
     22 20.001753   108.168.176.239       10.165.60.219         TCP      112    [TCP segment of a reassembled PDU]

Frame 22: 112 bytes on wire (896 bits), 112 bytes captured (896 bits)
Linux cooked capture
Internet Protocol Version 4, Src: 108.168.176.239 (108.168.176.239), Dst: 10.165.60.219 (10.165.60.219)
Transmission Control Protocol, Src Port: xmpp-client (5222), Dst Port: 58892 (58892), Seq: 163, Ack: 243, Len: 44

No.     Time        Source                Destination           Protocol Length Info
     23 20.002388   10.165.60.219         108.168.176.239       TCP      68     58892 > xmpp-client [ACK] Seq=243 Ack=207 Win=1965 Len=0 TSval=180996 TSecr=2730043015

Frame 23: 68 bytes on wire (544 bits), 68 bytes captured (544 bits)
Linux cooked capture
Internet Protocol Version 4, Src: 10.165.60.219 (10.165.60.219), Dst: 108.168.176.239 (108.168.176.239)
Transmission Control Protocol, Src Port: 58892 (58892), Dst Port: xmpp-client (5222), Seq: 243, Ack: 207, Len: 0

No.     Time        Source                Destination           Protocol Length Info
     24 34.406252   10.165.60.219         108.168.176.239       TCP      152    [TCP segment of a reassembled PDU]

Frame 24: 152 bytes on wire (1216 bits), 152 bytes captured (1216 bits)
Linux cooked capture
Internet Protocol Version 4, Src: 10.165.60.219 (10.165.60.219), Dst: 108.168.176.239 (108.168.176.239)
Transmission Control Protocol, Src Port: 58892 (58892), Dst Port: xmpp-client (5222), Seq: 243, Ack: 207, Len: 84

No.     Time        Source                Destination           Protocol Length Info
     25 34.941900   108.168.176.239       10.165.60.219         TCP      112    [TCP segment of a reassembled PDU]

Frame 25: 112 bytes on wire (896 bits), 112 bytes captured (896 bits)
Linux cooked capture
Internet Protocol Version 4, Src: 108.168.176.239 (108.168.176.239), Dst: 10.165.60.219 (10.165.60.219)
Transmission Control Protocol, Src Port: xmpp-client (5222), Dst Port: 58892 (58892), Seq: 207, Ack: 327, Len: 44

No.     Time        Source                Destination           Protocol Length Info
     26 34.942557   10.165.60.219         108.168.176.239       TCP      68     58892 > xmpp-client [ACK] Seq=327 Ack=251 Win=1965 Len=0 TSval=182490 TSecr=2730057941

Frame 26: 68 bytes on wire (544 bits), 68 bytes captured (544 bits)
Linux cooked capture
Internet Protocol Version 4, Src: 10.165.60.219 (10.165.60.219), Dst: 108.168.176.239 (108.168.176.239)
Transmission Control Protocol, Src Port: 58892 (58892), Dst Port: xmpp-client (5222), Seq: 327, Ack: 251, Len: 0

No.     Time        Source                Destination           Protocol Length Info
     27 37.176758   10.165.60.219         108.168.176.239       TCP      122    [TCP segment of a reassembled PDU]

Frame 27: 122 bytes on wire (976 bits), 122 bytes captured (976 bits)
Linux cooked capture
Internet Protocol Version 4, Src: 10.165.60.219 (10.165.60.219), Dst: 108.168.176.239 (108.168.176.239)
Transmission Control Protocol, Src Port: 58892 (58892), Dst Port: xmpp-client (5222), Seq: 327, Ack: 251, Len: 54

No.     Time        Source                Destination           Protocol Length Info
     28 37.611800   108.168.176.239       10.165.60.219         TCP      112    [TCP segment of a reassembled PDU]

Frame 28: 112 bytes on wire (896 bits), 112 bytes captured (896 bits)
Linux cooked capture
Internet Protocol Version 4, Src: 108.168.176.239 (108.168.176.239), Dst: 10.165.60.219 (10.165.60.219)
Transmission Control Protocol, Src Port: xmpp-client (5222), Dst Port: 58892 (58892), Seq: 251, Ack: 381, Len: 44

No.     Time        Source                Destination           Protocol Length Info
     29 37.612473   10.165.60.219         108.168.176.239       TCP      68     58892 > xmpp-client [ACK] Seq=381 Ack=295 Win=1965 Len=0 TSval=182757 TSecr=2730060624

Frame 29: 68 bytes on wire (544 bits), 68 bytes captured (544 bits)
Linux cooked capture
Internet Protocol Version 4, Src: 10.165.60.219 (10.165.60.219), Dst: 108.168.176.239 (108.168.176.239)
Transmission Control Protocol, Src Port: 58892 (58892), Dst Port: xmpp-client (5222), Seq: 381, Ack: 295, Len: 0

No.     Time        Source                Destination           Protocol Length Info
     30 43.182328   10.165.60.219         108.168.176.239       TCP      129    [TCP segment of a reassembled PDU]

Frame 30: 129 bytes on wire (1032 bits), 129 bytes captured (1032 bits)
Linux cooked capture
Internet Protocol Version 4, Src: 10.165.60.219 (10.165.60.219), Dst: 108.168.176.239 (108.168.176.239)
Transmission Control Protocol, Src Port: 58892 (58892), Dst Port: xmpp-client (5222), Seq: 381, Ack: 295, Len: 61

No.     Time        Source                Destination           Protocol Length Info
     31 43.651795   108.168.176.239       10.165.60.219         TCP      112    [TCP segment of a reassembled PDU]

Frame 31: 112 bytes on wire (896 bits), 112 bytes captured (896 bits)
Linux cooked capture
Internet Protocol Version 4, Src: 108.168.176.239 (108.168.176.239), Dst: 10.165.60.219 (10.165.60.219)
Transmission Control Protocol, Src Port: xmpp-client (5222), Dst Port: 58892 (58892), Seq: 295, Ack: 442, Len: 44

No.     Time        Source                Destination           Protocol Length Info
     32 43.652473   10.165.60.219         108.168.176.239       TCP      68     58892 > xmpp-client [ACK] Seq=442 Ack=339 Win=1965 Len=0 TSval=183361 TSecr=2730066646

Frame 32: 68 bytes on wire (544 bits), 68 bytes captured (544 bits)
Linux cooked capture
Internet Protocol Version 4, Src: 10.165.60.219 (10.165.60.219), Dst: 108.168.176.239 (108.168.176.239)
Transmission Control Protocol, Src Port: 58892 (58892), Dst Port: xmpp-client (5222), Seq: 442, Ack: 339, Len: 0

No.     Time        Source                Destination           Protocol Length Info
     33 45.485837   10.165.60.219         108.168.176.239       TCP      128    [TCP segment of a reassembled PDU]

Frame 33: 128 bytes on wire (1024 bits), 128 bytes captured (1024 bits)
Linux cooked capture
Internet Protocol Version 4, Src: 10.165.60.219 (10.165.60.219), Dst: 108.168.176.239 (108.168.176.239)
Transmission Control Protocol, Src Port: 58892 (58892), Dst Port: xmpp-client (5222), Seq: 442, Ack: 339, Len: 60

No.     Time        Source                Destination           Protocol Length Info
     34 45.911875   108.168.176.239       10.165.60.219         TCP      112    [TCP segment of a reassembled PDU]

Frame 34: 112 bytes on wire (896 bits), 112 bytes captured (896 bits)
Linux cooked capture
Internet Protocol Version 4, Src: 108.168.176.239 (108.168.176.239), Dst: 10.165.60.219 (10.165.60.219)
Transmission Control Protocol, Src Port: xmpp-client (5222), Dst Port: 58892 (58892), Seq: 339, Ack: 502, Len: 44

No.     Time        Source                Destination           Protocol Length Info
     35 45.912563   10.165.60.219         108.168.176.239       TCP      68     58892 > xmpp-client [ACK] Seq=502 Ack=383 Win=1965 Len=0 TSval=183587 TSecr=2730068924

Frame 35: 68 bytes on wire (544 bits), 68 bytes captured (544 bits)
Linux cooked capture
Internet Protocol Version 4, Src: 10.165.60.219 (10.165.60.219), Dst: 108.168.176.239 (108.168.176.239)
Transmission Control Protocol, Src Port: 58892 (58892), Dst Port: xmpp-client (5222), Seq: 502, Ack: 383, Len: 0

No.     Time        Source                Destination           Protocol Length Info
     36 60.121597   108.168.176.239       10.165.60.219         TCP      162    [TCP segment of a reassembled PDU]

Frame 36: 162 bytes on wire (1296 bits), 162 bytes captured (1296 bits)
Linux cooked capture
Internet Protocol Version 4, Src: 108.168.176.239 (108.168.176.239), Dst: 10.165.60.219 (10.165.60.219)
Transmission Control Protocol, Src Port: xmpp-client (5222), Dst Port: 58892 (58892), Seq: 383, Ack: 502, Len: 94

No.     Time        Source                Destination           Protocol Length Info
     37 60.122005   10.165.60.219         108.168.176.239       TCP      68     58892 > xmpp-client [ACK] Seq=502 Ack=477 Win=1965 Len=0 TSval=185008 TSecr=2730083129

Frame 37: 68 bytes on wire (544 bits), 68 bytes captured (544 bits)
Linux cooked capture
Internet Protocol Version 4, Src: 10.165.60.219 (10.165.60.219), Dst: 108.168.176.239 (108.168.176.239)
Transmission Control Protocol, Src Port: 58892 (58892), Dst Port: xmpp-client (5222), Seq: 502, Ack: 477, Len: 0

No.     Time        Source                Destination           Protocol Length Info
     38 60.203538   10.165.60.219         108.168.176.239       TCP      111    [TCP segment of a reassembled PDU]

Frame 38: 111 bytes on wire (888 bits), 111 bytes captured (888 bits)
Linux cooked capture
Internet Protocol Version 4, Src: 10.165.60.219 (10.165.60.219), Dst: 108.168.176.239 (108.168.176.239)
Transmission Control Protocol, Src Port: 58892 (58892), Dst Port: xmpp-client (5222), Seq: 502, Ack: 477, Len: 43

No.     Time        Source                Destination           Protocol Length Info
     39 60.732607   108.168.176.239       10.165.60.219         TCP      68     xmpp-client > 58892 [ACK] Seq=477 Ack=545 Win=512 Len=0 TSval=2730083752 TSecr=185016

Frame 39: 68 bytes on wire (544 bits), 68 bytes captured (544 bits)
Linux cooked capture
Internet Protocol Version 4, Src: 108.168.176.239 (108.168.176.239), Dst: 10.165.60.219 (10.165.60.219)
Transmission Control Protocol, Src Port: xmpp-client (5222), Dst Port: 58892 (58892), Seq: 477, Ack: 545, Len: 0
