No.     Time        Source                Destination           Protocol Length Info
      1 0.000000    10.162.228.83         173.194.35.142        TCP      68     58443 > https [FIN, ACK] Seq=1 Ack=1 Win=2920 Len=0 TSval=1660810 TSecr=2382031292

Frame 1: 68 bytes on wire (544 bits), 68 bytes captured (544 bits)
Linux cooked capture
Internet Protocol Version 4, Src: 10.162.228.83 (10.162.228.83), Dst: 173.194.35.142 (173.194.35.142)
Transmission Control Protocol, Src Port: 58443 (58443), Dst Port: https (443), Seq: 1, Ack: 1, Len: 0

No.     Time        Source                Destination           Protocol Length Info
      2 0.035538    173.194.35.154        10.162.228.83         TCP      68     http > 47601 [ACK] Seq=1 Ack=1 Win=64251 Len=0 TSval=176437461 TSecr=1660636

Frame 2: 68 bytes on wire (544 bits), 68 bytes captured (544 bits)
Linux cooked capture
Internet Protocol Version 4, Src: 173.194.35.154 (173.194.35.154), Dst: 10.162.228.83 (10.162.228.83)
Transmission Control Protocol, Src Port: http (80), Dst Port: 47601 (47601), Seq: 1, Ack: 1, Len: 0

No.     Time        Source                Destination           Protocol Length Info
      3 0.035990    173.194.35.154        10.162.228.83         TCP      68     http > 47601 [FIN, ACK] Seq=1 Ack=1 Win=64251 Len=0 TSval=176437461 TSecr=1660636

Frame 3: 68 bytes on wire (544 bits), 68 bytes captured (544 bits)
Linux cooked capture
Internet Protocol Version 4, Src: 173.194.35.154 (173.194.35.154), Dst: 10.162.228.83 (10.162.228.83)
Transmission Control Protocol, Src Port: http (80), Dst Port: 47601 (47601), Seq: 1, Ack: 1, Len: 0

No.     Time        Source                Destination           Protocol Length Info
      4 0.036147    10.162.228.83         173.194.35.154        TCP      68     47601 > http [ACK] Seq=1 Ack=2 Win=2920 Len=0 TSval=1660813 TSecr=176437461

Frame 4: 68 bytes on wire (544 bits), 68 bytes captured (544 bits)
Linux cooked capture
Internet Protocol Version 4, Src: 10.162.228.83 (10.162.228.83), Dst: 173.194.35.154 (173.194.35.154)
Transmission Control Protocol, Src Port: 47601 (47601), Dst Port: http (80), Seq: 1, Ack: 2, Len: 0

No.     Time        Source                Destination           Protocol Length Info
      5 0.036272    173.194.35.154        10.162.228.83         TCP      68     http > 47664 [ACK] Seq=1 Ack=1 Win=64251 Len=0 TSval=176437465 TSecr=1660639

Frame 5: 68 bytes on wire (544 bits), 68 bytes captured (544 bits)
Linux cooked capture
Internet Protocol Version 4, Src: 173.194.35.154 (173.194.35.154), Dst: 10.162.228.83 (10.162.228.83)
Transmission Control Protocol, Src Port: http (80), Dst Port: 47664 (47664), Seq: 1, Ack: 1, Len: 0

No.     Time        Source                Destination           Protocol Length Info
      6 0.037092    173.194.35.154        10.162.228.83         TCP      68     http > 47664 [FIN, ACK] Seq=1 Ack=1 Win=64251 Len=0 TSval=176437465 TSecr=1660639

Frame 6: 68 bytes on wire (544 bits), 68 bytes captured (544 bits)
Linux cooked capture
Internet Protocol Version 4, Src: 173.194.35.154 (173.194.35.154), Dst: 10.162.228.83 (10.162.228.83)
Transmission Control Protocol, Src Port: http (80), Dst Port: 47664 (47664), Seq: 1, Ack: 1, Len: 0

No.     Time        Source                Destination           Protocol Length Info
      7 0.037220    10.162.228.83         173.194.35.154        TCP      68     47664 > http [ACK] Seq=1 Ack=2 Win=2920 Len=0 TSval=1660813 TSecr=176437465

Frame 7: 68 bytes on wire (544 bits), 68 bytes captured (544 bits)
Linux cooked capture
Internet Protocol Version 4, Src: 10.162.228.83 (10.162.228.83), Dst: 173.194.35.154 (173.194.35.154)
Transmission Control Protocol, Src Port: 47664 (47664), Dst Port: http (80), Seq: 1, Ack: 2, Len: 0

No.     Time        Source                Destination           Protocol Length Info
      8 0.037370    173.194.35.142        10.162.228.83         TCP      68     https > 58443 [FIN, ACK] Seq=1 Ack=2 Win=670 Len=0 TSval=2382048786 TSecr=1660639

Frame 8: 68 bytes on wire (544 bits), 68 bytes captured (544 bits)
Linux cooked capture
Internet Protocol Version 4, Src: 173.194.35.142 (173.194.35.142), Dst: 10.162.228.83 (10.162.228.83)
Transmission Control Protocol, Src Port: https (443), Dst Port: 58443 (58443), Seq: 1, Ack: 2, Len: 0

No.     Time        Source                Destination           Protocol Length Info
      9 0.037715    108.168.176.252       10.162.228.83         TCP      68     https > 49755 [ACK] Seq=1 Ack=1 Win=512 Len=0 TSval=703060892 TSecr=1660636

Frame 9: 68 bytes on wire (544 bits), 68 bytes captured (544 bits)
Linux cooked capture
Internet Protocol Version 4, Src: 108.168.176.252 (108.168.176.252), Dst: 10.162.228.83 (10.162.228.83)
Transmission Control Protocol, Src Port: https (443), Dst Port: 49755 (49755), Seq: 1, Ack: 1, Len: 0

No.     Time        Source                Destination           Protocol Length Info
     10 0.038013    173.194.35.153        10.162.228.83         TCP      68     http > 56117 [ACK] Seq=1 Ack=1 Win=64251 Len=0 TSval=176437485 TSecr=1660636

Frame 10: 68 bytes on wire (544 bits), 68 bytes captured (544 bits)
Linux cooked capture
Internet Protocol Version 4, Src: 173.194.35.153 (173.194.35.153), Dst: 10.162.228.83 (10.162.228.83)
Transmission Control Protocol, Src Port: http (80), Dst Port: 56117 (56117), Seq: 1, Ack: 1, Len: 0

No.     Time        Source                Destination           Protocol Length Info
     11 0.038352    173.194.35.153        10.162.228.83         TCP      68     http > 56117 [FIN, ACK] Seq=0 Ack=1 Win=64251 Len=0 TSval=176437514 TSecr=1660636

Frame 11: 68 bytes on wire (544 bits), 68 bytes captured (544 bits)
Linux cooked capture
Internet Protocol Version 4, Src: 173.194.35.153 (173.194.35.153), Dst: 10.162.228.83 (10.162.228.83)
Transmission Control Protocol, Src Port: http (80), Dst Port: 56117 (56117), Seq: 0, Ack: 1, Len: 0

No.     Time        Source                Destination           Protocol Length Info
     12 0.038643    173.194.35.142        10.162.228.83         TCP      80     [TCP Dup ACK 8#1] https > 58443 [ACK] Seq=2 Ack=2 Win=670 Len=0 TSval=2382049266 TSecr=1660696 SLE=1 SRE=2

Frame 12: 80 bytes on wire (640 bits), 80 bytes captured (640 bits)
Linux cooked capture
Internet Protocol Version 4, Src: 173.194.35.142 (173.194.35.142), Dst: 10.162.228.83 (10.162.228.83)
Transmission Control Protocol, Src Port: https (443), Dst Port: 58443 (58443), Seq: 2, Ack: 2, Len: 0

No.     Time        Source                Destination           Protocol Length Info
     13 0.039598    10.162.228.83         173.194.35.142        TCP      68     58443 > https [ACK] Seq=2 Ack=2 Win=2920 Len=0 TSval=1660813 TSecr=2382048786

Frame 13: 68 bytes on wire (544 bits), 68 bytes captured (544 bits)
Linux cooked capture
Internet Protocol Version 4, Src: 10.162.228.83 (10.162.228.83), Dst: 173.194.35.142 (173.194.35.142)
Transmission Control Protocol, Src Port: 58443 (58443), Dst Port: https (443), Seq: 2, Ack: 2, Len: 0

No.     Time        Source                Destination           Protocol Length Info
     14 0.039833    10.162.228.83         173.194.35.153        TCP      68     56117 > http [ACK] Seq=1 Ack=1 Win=2920 Len=0 TSval=1660813 TSecr=176437485

Frame 14: 68 bytes on wire (544 bits), 68 bytes captured (544 bits)
Linux cooked capture
Internet Protocol Version 4, Src: 10.162.228.83 (10.162.228.83), Dst: 173.194.35.153 (173.194.35.153)
Transmission Control Protocol, Src Port: 56117 (56117), Dst Port: http (80), Seq: 1, Ack: 1, Len: 0

No.     Time        Source                Destination           Protocol Length Info
     15 0.045470    173.194.35.154        10.162.228.83         TCP      68     http > 47601 [FIN, ACK] Seq=1 Ack=1 Win=64251 Len=0 TSval=176437520 TSecr=1660636

Frame 15: 68 bytes on wire (544 bits), 68 bytes captured (544 bits)
Linux cooked capture
Internet Protocol Version 4, Src: 173.194.35.154 (173.194.35.154), Dst: 10.162.228.83 (10.162.228.83)
Transmission Control Protocol, Src Port: http (80), Dst Port: 47601 (47601), Seq: 1, Ack: 1, Len: 0

No.     Time        Source                Destination           Protocol Length Info
     16 0.045703    10.162.228.83         173.194.35.154        TCP      68     [TCP Dup ACK 4#1] 47601 > http [ACK] Seq=1 Ack=2 Win=2920 Len=0 TSval=1660814 TSecr=176437461

Frame 16: 68 bytes on wire (544 bits), 68 bytes captured (544 bits)
Linux cooked capture
Internet Protocol Version 4, Src: 10.162.228.83 (10.162.228.83), Dst: 173.194.35.154 (173.194.35.154)
Transmission Control Protocol, Src Port: 47601 (47601), Dst Port: http (80), Seq: 1, Ack: 2, Len: 0

No.     Time        Source                Destination           Protocol Length Info
     17 0.046010    108.168.176.252       10.162.228.83         SSL      157    Continuation Data

Frame 17: 157 bytes on wire (1256 bits), 157 bytes captured (1256 bits)
Linux cooked capture
Internet Protocol Version 4, Src: 108.168.176.252 (108.168.176.252), Dst: 10.162.228.83 (10.162.228.83)
Transmission Control Protocol, Src Port: https (443), Dst Port: 49755 (49755), Seq: 1, Ack: 122, Len: 89
Secure Sockets Layer

No.     Time        Source                Destination           Protocol Length Info
     18 0.046248    10.162.228.83         108.168.176.252       TCP      68     49755 > https [ACK] Seq=122 Ack=90 Win=1965 Len=0 TSval=1660814 TSecr=703061423

Frame 18: 68 bytes on wire (544 bits), 68 bytes captured (544 bits)
Linux cooked capture
Internet Protocol Version 4, Src: 10.162.228.83 (10.162.228.83), Dst: 108.168.176.252 (108.168.176.252)
Transmission Control Protocol, Src Port: 49755 (49755), Dst Port: https (443), Seq: 122, Ack: 90, Len: 0

No.     Time        Source                Destination           Protocol Length Info
     19 0.047300    173.194.35.154        10.162.228.83         TCP      68     [TCP Dup ACK 6#1] http > 47664 [ACK] Seq=2 Ack=1 Win=64251 Len=0 TSval=176437525 TSecr=1660639

Frame 19: 68 bytes on wire (544 bits), 68 bytes captured (544 bits)
Linux cooked capture
Internet Protocol Version 4, Src: 173.194.35.154 (173.194.35.154), Dst: 10.162.228.83 (10.162.228.83)
Transmission Control Protocol, Src Port: http (80), Dst Port: 47664 (47664), Seq: 2, Ack: 1, Len: 0

No.     Time        Source                Destination           Protocol Length Info
     20 0.047723    108.168.176.252       10.162.228.83         SSL      89     Continuation Data

Frame 20: 89 bytes on wire (712 bits), 89 bytes captured (712 bits)
Linux cooked capture
Internet Protocol Version 4, Src: 108.168.176.252 (108.168.176.252), Dst: 10.162.228.83 (10.162.228.83)
Transmission Control Protocol, Src Port: https (443), Dst Port: 49755 (49755), Seq: 90, Ack: 122, Len: 21
Secure Sockets Layer

No.     Time        Source                Destination           Protocol Length Info
     21 0.047843    10.162.228.83         108.168.176.252       TCP      68     49755 > https [ACK] Seq=122 Ack=111 Win=1965 Len=0 TSval=1660814 TSecr=703061442

Frame 21: 68 bytes on wire (544 bits), 68 bytes captured (544 bits)
Linux cooked capture
Internet Protocol Version 4, Src: 10.162.228.83 (10.162.228.83), Dst: 108.168.176.252 (108.168.176.252)
Transmission Control Protocol, Src Port: 49755 (49755), Dst Port: https (443), Seq: 122, Ack: 111, Len: 0

No.     Time        Source                Destination           Protocol Length Info
     22 0.048347    157.56.195.250        10.162.228.83         TCP      76     imaps > 41648 [SYN, ACK] Seq=0 Ack=0 Win=8192 Len=0 MSS=1400 WS=256 SACK_PERM=1 TSval=126276557 TSecr=1660703

Frame 22: 76 bytes on wire (608 bits), 76 bytes captured (608 bits)
Linux cooked capture
Internet Protocol Version 4, Src: 157.56.195.250 (157.56.195.250), Dst: 10.162.228.83 (10.162.228.83)
Transmission Control Protocol, Src Port: imaps (993), Dst Port: 41648 (41648), Seq: 0, Ack: 0, Len: 0

No.     Time        Source                Destination           Protocol Length Info
     23 0.048548    10.162.228.83         157.56.195.250        TCP      68     41648 > imaps [ACK] Seq=0 Ack=1 Win=1965 Len=0 TSval=1660814 TSecr=126276557

Frame 23: 68 bytes on wire (544 bits), 68 bytes captured (544 bits)
Linux cooked capture
Internet Protocol Version 4, Src: 10.162.228.83 (10.162.228.83), Dst: 157.56.195.250 (157.56.195.250)
Transmission Control Protocol, Src Port: 41648 (41648), Dst Port: imaps (993), Seq: 0, Ack: 1, Len: 0

No.     Time        Source                Destination           Protocol Length Info
     24 0.049422    173.194.35.154        10.162.228.83         TCP      68     [TCP Dup ACK 15#1] http > 47601 [ACK] Seq=2 Ack=1 Win=64251 Len=0 TSval=176437529 TSecr=1660636

Frame 24: 68 bytes on wire (544 bits), 68 bytes captured (544 bits)
Linux cooked capture
Internet Protocol Version 4, Src: 173.194.35.154 (173.194.35.154), Dst: 10.162.228.83 (10.162.228.83)
Transmission Control Protocol, Src Port: http (80), Dst Port: 47601 (47601), Seq: 2, Ack: 1, Len: 0

No.     Time        Source                Destination           Protocol Length Info
     25 0.050500    173.194.35.154        10.162.228.83         TCP      68     http > 47664 [FIN, ACK] Seq=1 Ack=1 Win=64251 Len=0 TSval=176437554 TSecr=1660639

Frame 25: 68 bytes on wire (544 bits), 68 bytes captured (544 bits)
Linux cooked capture
Internet Protocol Version 4, Src: 173.194.35.154 (173.194.35.154), Dst: 10.162.228.83 (10.162.228.83)
Transmission Control Protocol, Src Port: http (80), Dst Port: 47664 (47664), Seq: 1, Ack: 1, Len: 0

No.     Time        Source                Destination           Protocol Length Info
     26 0.050653    10.162.228.83         173.194.35.154        TCP      68     [TCP Dup ACK 7#1] 47664 > http [ACK] Seq=1 Ack=2 Win=2920 Len=0 TSval=1660815 TSecr=176437525

Frame 26: 68 bytes on wire (544 bits), 68 bytes captured (544 bits)
Linux cooked capture
Internet Protocol Version 4, Src: 10.162.228.83 (10.162.228.83), Dst: 173.194.35.154 (173.194.35.154)
Transmission Control Protocol, Src Port: 47664 (47664), Dst Port: http (80), Seq: 1, Ack: 2, Len: 0

No.     Time        Source                Destination           Protocol Length Info
     27 0.050797    173.194.35.142        10.162.228.83         TCP      68     https > 58443 [FIN, ACK] Seq=1 Ack=2 Win=670 Len=0 TSval=2382049840 TSecr=1660696

Frame 27: 68 bytes on wire (544 bits), 68 bytes captured (544 bits)
Linux cooked capture
Internet Protocol Version 4, Src: 173.194.35.142 (173.194.35.142), Dst: 10.162.228.83 (10.162.228.83)
Transmission Control Protocol, Src Port: https (443), Dst Port: 58443 (58443), Seq: 1, Ack: 2, Len: 0

No.     Time        Source                Destination           Protocol Length Info
     28 0.051673    10.162.228.83         173.194.35.142        TCP      68     [TCP Dup ACK 13#1] 58443 > https [ACK] Seq=2 Ack=2 Win=2920 Len=0 TSval=1660815 TSecr=2382049266

Frame 28: 68 bytes on wire (544 bits), 68 bytes captured (544 bits)
Linux cooked capture
Internet Protocol Version 4, Src: 10.162.228.83 (10.162.228.83), Dst: 173.194.35.142 (173.194.35.142)
Transmission Control Protocol, Src Port: 58443 (58443), Dst Port: https (443), Seq: 2, Ack: 2, Len: 0

No.     Time        Source                Destination           Protocol Length Info
     29 0.054383    10.162.228.83         108.168.176.252       SSL      97     Continuation Data

Frame 29: 97 bytes on wire (776 bits), 97 bytes captured (776 bits)
Linux cooked capture
Internet Protocol Version 4, Src: 10.162.228.83 (10.162.228.83), Dst: 108.168.176.252 (108.168.176.252)
Transmission Control Protocol, Src Port: 49755 (49755), Dst Port: https (443), Seq: 122, Ack: 111, Len: 29
Secure Sockets Layer

No.     Time        Source                Destination           Protocol Length Info
     30 0.137933    10.162.228.83         157.56.195.250        TLSv1    148    Client Hello

Frame 30: 148 bytes on wire (1184 bits), 148 bytes captured (1184 bits)
Linux cooked capture
Internet Protocol Version 4, Src: 10.162.228.83 (10.162.228.83), Dst: 157.56.195.250 (157.56.195.250)
Transmission Control Protocol, Src Port: 41648 (41648), Dst Port: imaps (993), Seq: 0, Ack: 1, Len: 80
Secure Sockets Layer

No.     Time        Source                Destination           Protocol Length Info
     31 0.145418    173.194.35.142        10.162.228.83         TCP      80     [TCP Dup ACK 27#1] https > 58443 [ACK] Seq=2 Ack=2 Win=670 Len=0 TSval=2382050346 TSecr=1660810 SLE=1 SRE=2

Frame 31: 80 bytes on wire (640 bits), 80 bytes captured (640 bits)
Linux cooked capture
Internet Protocol Version 4, Src: 173.194.35.142 (173.194.35.142), Dst: 10.162.228.83 (10.162.228.83)
Transmission Control Protocol, Src Port: https (443), Dst Port: 58443 (58443), Seq: 2, Ack: 2, Len: 0

No.     Time        Source                Destination           Protocol Length Info
     32 0.295528    108.168.176.252       10.162.228.83         SSL      178    [TCP Retransmission] Continuation Data

Frame 32: 178 bytes on wire (1424 bits), 178 bytes captured (1424 bits)
Linux cooked capture
Internet Protocol Version 4, Src: 108.168.176.252 (108.168.176.252), Dst: 10.162.228.83 (10.162.228.83)
Transmission Control Protocol, Src Port: https (443), Dst Port: 49755 (49755), Seq: 1, Ack: 122, Len: 110
Secure Sockets Layer

No.     Time        Source                Destination           Protocol Length Info
     33 0.295902    10.162.228.83         108.168.176.252       TCP      80     [TCP Dup ACK 29#1] 49755 > https [ACK] Seq=151 Ack=111 Win=1965 Len=0 TSval=1660839 TSecr=703062583 SLE=1 SRE=111

Frame 33: 80 bytes on wire (640 bits), 80 bytes captured (640 bits)
Linux cooked capture
Internet Protocol Version 4, Src: 10.162.228.83 (10.162.228.83), Dst: 108.168.176.252 (108.168.176.252)
Transmission Control Protocol, Src Port: 49755 (49755), Dst Port: https (443), Seq: 151, Ack: 111, Len: 0

No.     Time        Source                Destination           Protocol Length Info
     34 0.335382    173.194.35.153        10.162.228.83         TCP      56     http > 56117 [RST] Seq=1 Win=0 Len=0

Frame 34: 56 bytes on wire (448 bits), 56 bytes captured (448 bits)
Linux cooked capture
Internet Protocol Version 4, Src: 173.194.35.153 (173.194.35.153), Dst: 10.162.228.83 (10.162.228.83)
Transmission Control Protocol, Src Port: http (80), Dst Port: 56117 (56117), Seq: 1, Len: 0

No.     Time        Source                Destination           Protocol Length Info
     35 0.345395    173.194.35.154        10.162.228.83         TCP      56     http > 47601 [RST] Seq=2 Win=0 Len=0

Frame 35: 56 bytes on wire (448 bits), 56 bytes captured (448 bits)
Linux cooked capture
Internet Protocol Version 4, Src: 173.194.35.154 (173.194.35.154), Dst: 10.162.228.83 (10.162.228.83)
Transmission Control Protocol, Src Port: http (80), Dst Port: 47601 (47601), Seq: 2, Len: 0

No.     Time        Source                Destination           Protocol Length Info
     36 0.516070    173.194.35.154        10.162.228.83         TCP      56     http > 47664 [RST] Seq=2 Win=0 Len=0

Frame 36: 56 bytes on wire (448 bits), 56 bytes captured (448 bits)
Linux cooked capture
Internet Protocol Version 4, Src: 173.194.35.154 (173.194.35.154), Dst: 10.162.228.83 (10.162.228.83)
Transmission Control Protocol, Src Port: http (80), Dst Port: 47664 (47664), Seq: 2, Len: 0

No.     Time        Source                Destination           Protocol Length Info
     37 0.545387    173.194.35.142        10.162.228.83         TCP      56     https > 58443 [RST] Seq=2 Win=0 Len=0

Frame 37: 56 bytes on wire (448 bits), 56 bytes captured (448 bits)
Linux cooked capture
Internet Protocol Version 4, Src: 173.194.35.142 (173.194.35.142), Dst: 10.162.228.83 (10.162.228.83)
Transmission Control Protocol, Src Port: https (443), Dst Port: 58443 (58443), Seq: 2, Len: 0

No.     Time        Source                Destination           Protocol Length Info
     38 0.695620    108.168.176.252       10.162.228.83         TCP      68     https > 49755 [ACK] Seq=111 Ack=151 Win=512 Len=0 TSval=703063002 TSecr=1660815

Frame 38: 68 bytes on wire (544 bits), 68 bytes captured (544 bits)
Linux cooked capture
Internet Protocol Version 4, Src: 108.168.176.252 (108.168.176.252), Dst: 10.162.228.83 (10.162.228.83)
Transmission Control Protocol, Src Port: https (443), Dst Port: 49755 (49755), Seq: 111, Ack: 151, Len: 0

No.     Time        Source                Destination           Protocol Length Info
     39 0.695983    10.162.228.83         108.168.176.252       SSL      121    Continuation Data

Frame 39: 121 bytes on wire (968 bits), 121 bytes captured (968 bits)
Linux cooked capture
Internet Protocol Version 4, Src: 10.162.228.83 (10.162.228.83), Dst: 108.168.176.252 (108.168.176.252)
Transmission Control Protocol, Src Port: 49755 (49755), Dst Port: https (443), Seq: 151, Ack: 111, Len: 53
Secure Sockets Layer

No.     Time        Source                Destination           Protocol Length Info
     40 0.775672    157.56.195.250        10.162.228.83         TCP      1366   [TCP segment of a reassembled PDU]

Frame 40: 1366 bytes on wire (10928 bits), 1366 bytes captured (10928 bits)
Linux cooked capture
Internet Protocol Version 4, Src: 157.56.195.250 (157.56.195.250), Dst: 10.162.228.83 (10.162.228.83)
Transmission Control Protocol, Src Port: imaps (993), Dst Port: 41648 (41648), Seq: 1, Ack: 80, Len: 1298

No.     Time        Source                Destination           Protocol Length Info
     41 0.775943    10.162.228.83         157.56.195.250        TCP      68     41648 > imaps [ACK] Seq=80 Ack=1299 Win=2009 Len=0 TSval=1660887 TSecr=126276717

Frame 41: 68 bytes on wire (544 bits), 68 bytes captured (544 bits)
Linux cooked capture
Internet Protocol Version 4, Src: 10.162.228.83 (10.162.228.83), Dst: 157.56.195.250 (157.56.195.250)
Transmission Control Protocol, Src Port: 41648 (41648), Dst Port: imaps (993), Seq: 80, Ack: 1299, Len: 0

No.     Time        Source                Destination           Protocol Length Info
     42 0.815522    157.56.195.250        10.162.228.83         TLSv1    1347   Server Hello, Certificate, Server Hello Done

Frame 42: 1347 bytes on wire (10776 bits), 1347 bytes captured (10776 bits)
Linux cooked capture
Internet Protocol Version 4, Src: 157.56.195.250 (157.56.195.250), Dst: 10.162.228.83 (10.162.228.83)
Transmission Control Protocol, Src Port: imaps (993), Dst Port: 41648 (41648), Seq: 1299, Ack: 80, Len: 1279
[2 Reassembled TCP Segments (2577 bytes): #40(1298), #42(1279)]
Secure Sockets Layer

No.     Time        Source                Destination           Protocol Length Info
     43 0.819933    10.162.228.83         157.56.195.250        TCP      68     41648 > imaps [ACK] Seq=80 Ack=2578 Win=2009 Len=0 TSval=1660892 TSecr=126276717

Frame 43: 68 bytes on wire (544 bits), 68 bytes captured (544 bits)
Linux cooked capture
Internet Protocol Version 4, Src: 10.162.228.83 (10.162.228.83), Dst: 157.56.195.250 (157.56.195.250)
Transmission Control Protocol, Src Port: 41648 (41648), Dst Port: imaps (993), Seq: 80, Ack: 2578, Len: 0

No.     Time        Source                Destination           Protocol Length Info
     44 0.955462    108.168.176.252       10.162.228.83         SSL      109    Continuation Data

Frame 44: 109 bytes on wire (872 bits), 109 bytes captured (872 bits)
Linux cooked capture
Internet Protocol Version 4, Src: 108.168.176.252 (108.168.176.252), Dst: 10.162.228.83 (10.162.228.83)
Transmission Control Protocol, Src Port: https (443), Dst Port: 49755 (49755), Seq: 111, Ack: 204, Len: 41
Secure Sockets Layer

No.     Time        Source                Destination           Protocol Length Info
     45 0.955823    10.162.228.83         108.168.176.252       TCP      68     49755 > https [ACK] Seq=204 Ack=152 Win=1965 Len=0 TSval=1660905 TSecr=703063254

Frame 45: 68 bytes on wire (544 bits), 68 bytes captured (544 bits)
Linux cooked capture
Internet Protocol Version 4, Src: 10.162.228.83 (10.162.228.83), Dst: 108.168.176.252 (108.168.176.252)
Transmission Control Protocol, Src Port: 49755 (49755), Dst Port: https (443), Seq: 204, Ack: 152, Len: 0

No.     Time        Source                Destination           Protocol Length Info
     46 0.965397    108.168.176.252       10.162.228.83         SSL      237    Continuation Data

Frame 46: 237 bytes on wire (1896 bits), 237 bytes captured (1896 bits)
Linux cooked capture
Internet Protocol Version 4, Src: 108.168.176.252 (108.168.176.252), Dst: 10.162.228.83 (10.162.228.83)
Transmission Control Protocol, Src Port: https (443), Dst Port: 49755 (49755), Seq: 152, Ack: 204, Len: 169
Secure Sockets Layer

No.     Time        Source                Destination           Protocol Length Info
     47 0.965923    10.162.228.83         108.168.176.252       TCP      68     49755 > https [ACK] Seq=204 Ack=321 Win=1965 Len=0 TSval=1660906 TSecr=703063254

Frame 47: 68 bytes on wire (544 bits), 68 bytes captured (544 bits)
Linux cooked capture
Internet Protocol Version 4, Src: 10.162.228.83 (10.162.228.83), Dst: 108.168.176.252 (108.168.176.252)
Transmission Control Protocol, Src Port: 49755 (49755), Dst Port: https (443), Seq: 204, Ack: 321, Len: 0

No.     Time        Source                Destination           Protocol Length Info
     48 1.360790    10.162.228.83         157.56.195.250        TLSv1    394    Client Key Exchange, Change Cipher Spec, Encrypted Handshake Message

Frame 48: 394 bytes on wire (3152 bits), 394 bytes captured (3152 bits)
Linux cooked capture
Internet Protocol Version 4, Src: 10.162.228.83 (10.162.228.83), Dst: 157.56.195.250 (157.56.195.250)
Transmission Control Protocol, Src Port: 41648 (41648), Dst Port: imaps (993), Seq: 80, Ack: 2578, Len: 326
Secure Sockets Layer

No.     Time        Source                Destination           Protocol Length Info
     49 1.715470    157.56.195.250        10.162.228.83         TLSv1    127    Change Cipher Spec, Encrypted Handshake Message

Frame 49: 127 bytes on wire (1016 bits), 127 bytes captured (1016 bits)
Linux cooked capture
Internet Protocol Version 4, Src: 157.56.195.250 (157.56.195.250), Dst: 10.162.228.83 (10.162.228.83)
Transmission Control Protocol, Src Port: imaps (993), Dst Port: 41648 (41648), Seq: 2578, Ack: 406, Len: 59
Secure Sockets Layer

No.     Time        Source                Destination           Protocol Length Info
     50 1.716377    10.162.228.83         157.56.195.250        TCP      68     41648 > imaps [ACK] Seq=406 Ack=2637 Win=2009 Len=0 TSval=1660981 TSecr=126276813

Frame 50: 68 bytes on wire (544 bits), 68 bytes captured (544 bits)
Linux cooked capture
Internet Protocol Version 4, Src: 10.162.228.83 (10.162.228.83), Dst: 157.56.195.250 (157.56.195.250)
Transmission Control Protocol, Src Port: 41648 (41648), Dst Port: imaps (993), Seq: 406, Ack: 2637, Len: 0

No.     Time        Source                Destination           Protocol Length Info
     51 1.935543    157.56.195.250        10.162.228.83         TLSv1    169    Application Data

Frame 51: 169 bytes on wire (1352 bits), 169 bytes captured (1352 bits)
Linux cooked capture
Internet Protocol Version 4, Src: 157.56.195.250 (157.56.195.250), Dst: 10.162.228.83 (10.162.228.83)
Transmission Control Protocol, Src Port: imaps (993), Dst Port: 41648 (41648), Seq: 2637, Ack: 406, Len: 101
Secure Sockets Layer

No.     Time        Source                Destination           Protocol Length Info
     52 1.936860    10.162.228.83         157.56.195.250        TCP      68     41648 > imaps [ACK] Seq=406 Ack=2738 Win=2009 Len=0 TSval=1661003 TSecr=126276836

Frame 52: 68 bytes on wire (544 bits), 68 bytes captured (544 bits)
Linux cooked capture
Internet Protocol Version 4, Src: 10.162.228.83 (10.162.228.83), Dst: 157.56.195.250 (157.56.195.250)
Transmission Control Protocol, Src Port: 41648 (41648), Dst Port: imaps (993), Seq: 406, Ack: 2738, Len: 0

No.     Time        Source                Destination           Protocol Length Info
     53 2.008142    10.162.228.83         157.56.195.250        TLSv1    121    Application Data

Frame 53: 121 bytes on wire (968 bits), 121 bytes captured (968 bits)
Linux cooked capture
Internet Protocol Version 4, Src: 10.162.228.83 (10.162.228.83), Dst: 157.56.195.250 (157.56.195.250)
Transmission Control Protocol, Src Port: 41648 (41648), Dst Port: imaps (993), Seq: 406, Ack: 2738, Len: 53
Secure Sockets Layer

No.     Time        Source                Destination           Protocol Length Info
     54 2.095953    10.162.228.83         83.224.70.93          DNS      88     Standard query 0x0037  A android.clients.google.com

Frame 54: 88 bytes on wire (704 bits), 88 bytes captured (704 bits)
Linux cooked capture
Internet Protocol Version 4, Src: 10.162.228.83 (10.162.228.83), Dst: 83.224.70.93 (83.224.70.93)
User Datagram Protocol, Src Port: d-cinema-rrp (1173), Dst Port: domain (53)
Domain Name System (query)

No.     Time        Source                Destination           Protocol Length Info
     55 2.235545    83.224.70.93          10.162.228.83         DNS      288    Standard query response 0x0037  CNAME android.l.google.com A 173.194.35.136 A 173.194.35.128 A 173.194.35.135 A 173.194.35.130 A 173.194.35.134 A 173.194.35.129 A 173.194.35.132 A 173.194.35.133 A 173.194.35.131 A 173.194.35.137 A 173.194.35.142

Frame 55: 288 bytes on wire (2304 bits), 288 bytes captured (2304 bits)
Linux cooked capture
Internet Protocol Version 4, Src: 83.224.70.93 (83.224.70.93), Dst: 10.162.228.83 (10.162.228.83)
User Datagram Protocol, Src Port: domain (53), Dst Port: d-cinema-rrp (1173)
Domain Name System (response)

No.     Time        Source                Destination           Protocol Length Info
     56 2.235818    157.56.195.250        10.162.228.83         TLSv1    201    Application Data

Frame 56: 201 bytes on wire (1608 bits), 201 bytes captured (1608 bits)
Linux cooked capture
Internet Protocol Version 4, Src: 157.56.195.250 (157.56.195.250), Dst: 10.162.228.83 (10.162.228.83)
Transmission Control Protocol, Src Port: imaps (993), Dst Port: 41648 (41648), Seq: 2738, Ack: 459, Len: 133
Secure Sockets Layer

No.     Time        Source                Destination           Protocol Length Info
     57 2.238315    10.162.228.83         173.194.35.136        TCP      76     48859 > https [SYN] Seq=0 Win=3930 Len=0 MSS=1310 SACK_PERM=1 TSval=1661033 TSecr=0 WS=2

Frame 57: 76 bytes on wire (608 bits), 76 bytes captured (608 bits)
Linux cooked capture
Internet Protocol Version 4, Src: 10.162.228.83 (10.162.228.83), Dst: 173.194.35.136 (173.194.35.136)
Transmission Control Protocol, Src Port: 48859 (48859), Dst Port: https (443), Seq: 0, Len: 0

No.     Time        Source                Destination           Protocol Length Info
     58 2.238683    10.162.228.83         157.56.195.250        TCP      68     41648 > imaps [ACK] Seq=459 Ack=2871 Win=2009 Len=0 TSval=1661033 TSecr=126276866

Frame 58: 68 bytes on wire (544 bits), 68 bytes captured (544 bits)
Linux cooked capture
Internet Protocol Version 4, Src: 10.162.228.83 (10.162.228.83), Dst: 157.56.195.250 (157.56.195.250)
Transmission Control Protocol, Src Port: 41648 (41648), Dst Port: imaps (993), Seq: 459, Ack: 2871, Len: 0

No.     Time        Source                Destination           Protocol Length Info
     59 2.425407    173.194.35.136        10.162.228.83         TCP      76     https > 48859 [SYN, ACK] Seq=0 Ack=1 Win=42540 Len=0 MSS=1400 SACK_PERM=1 TSval=2382052306 TSecr=1661033 WS=64

Frame 59: 76 bytes on wire (608 bits), 76 bytes captured (608 bits)
Linux cooked capture
Internet Protocol Version 4, Src: 173.194.35.136 (173.194.35.136), Dst: 10.162.228.83 (10.162.228.83)
Transmission Control Protocol, Src Port: https (443), Dst Port: 48859 (48859), Seq: 0, Ack: 1, Len: 0

No.     Time        Source                Destination           Protocol Length Info
     60 2.425720    10.162.228.83         173.194.35.136        TCP      68     48859 > https [ACK] Seq=1 Ack=1 Win=3930 Len=0 TSval=1661052 TSecr=2382052306

Frame 60: 68 bytes on wire (544 bits), 68 bytes captured (544 bits)
Linux cooked capture
Internet Protocol Version 4, Src: 10.162.228.83 (10.162.228.83), Dst: 173.194.35.136 (173.194.35.136)
Transmission Control Protocol, Src Port: 48859 (48859), Dst Port: https (443), Seq: 1, Ack: 1, Len: 0

No.     Time        Source                Destination           Protocol Length Info
     61 2.465408    157.56.195.250        10.162.228.83         TLSv1    121    Application Data

Frame 61: 121 bytes on wire (968 bits), 121 bytes captured (968 bits)
Linux cooked capture
Internet Protocol Version 4, Src: 157.56.195.250 (157.56.195.250), Dst: 10.162.228.83 (10.162.228.83)
Transmission Control Protocol, Src Port: imaps (993), Dst Port: 41648 (41648), Seq: 2871, Ack: 459, Len: 53
Secure Sockets Layer

No.     Time        Source                Destination           Protocol Length Info
     62 2.470018    10.162.228.83         157.56.195.250        TCP      68     41648 > imaps [ACK] Seq=459 Ack=2924 Win=2009 Len=0 TSval=1661057 TSecr=126276889

Frame 62: 68 bytes on wire (544 bits), 68 bytes captured (544 bits)
Linux cooked capture
Internet Protocol Version 4, Src: 10.162.228.83 (10.162.228.83), Dst: 157.56.195.250 (157.56.195.250)
Transmission Control Protocol, Src Port: 41648 (41648), Dst Port: imaps (993), Seq: 459, Ack: 2924, Len: 0

No.     Time        Source                Destination           Protocol Length Info
     63 2.471413    10.162.228.83         157.56.195.250        TLSv1    121    Application Data

Frame 63: 121 bytes on wire (968 bits), 121 bytes captured (968 bits)
Linux cooked capture
Internet Protocol Version 4, Src: 10.162.228.83 (10.162.228.83), Dst: 157.56.195.250 (157.56.195.250)
Transmission Control Protocol, Src Port: 41648 (41648), Dst Port: imaps (993), Seq: 459, Ack: 2924, Len: 53
Secure Sockets Layer

No.     Time        Source                Destination           Protocol Length Info
     64 2.511328    10.162.228.83         173.194.35.136        TLSv1    148    Client Hello

Frame 64: 148 bytes on wire (1184 bits), 148 bytes captured (1184 bits)
Linux cooked capture
Internet Protocol Version 4, Src: 10.162.228.83 (10.162.228.83), Dst: 173.194.35.136 (173.194.35.136)
Transmission Control Protocol, Src Port: 48859 (48859), Dst Port: https (443), Seq: 1, Ack: 1, Len: 80
Secure Sockets Layer

No.     Time        Source                Destination           Protocol Length Info
     65 2.755507    157.56.195.250        10.162.228.83         TLSv1    201    Application Data

Frame 65: 201 bytes on wire (1608 bits), 201 bytes captured (1608 bits)
Linux cooked capture
Internet Protocol Version 4, Src: 157.56.195.250 (157.56.195.250), Dst: 10.162.228.83 (10.162.228.83)
Transmission Control Protocol, Src Port: imaps (993), Dst Port: 41648 (41648), Seq: 2924, Ack: 512, Len: 133
Secure Sockets Layer

No.     Time        Source                Destination           Protocol Length Info
     66 2.789867    10.162.228.83         157.56.195.250        TCP      68     41648 > imaps [ACK] Seq=512 Ack=3057 Win=2009 Len=0 TSval=1661089 TSecr=126276916

Frame 66: 68 bytes on wire (544 bits), 68 bytes captured (544 bits)
Linux cooked capture
Internet Protocol Version 4, Src: 10.162.228.83 (10.162.228.83), Dst: 157.56.195.250 (157.56.195.250)
Transmission Control Protocol, Src Port: 41648 (41648), Dst Port: imaps (993), Seq: 512, Ack: 3057, Len: 0

No.     Time        Source                Destination           Protocol Length Info
     67 2.795563    173.194.35.136        10.162.228.83         TCP      68     https > 48859 [ACK] Seq=1 Ack=81 Win=42560 Len=0 TSval=2382052666 TSecr=1661061

Frame 67: 68 bytes on wire (544 bits), 68 bytes captured (544 bits)
Linux cooked capture
Internet Protocol Version 4, Src: 173.194.35.136 (173.194.35.136), Dst: 10.162.228.83 (10.162.228.83)
Transmission Control Protocol, Src Port: https (443), Dst Port: 48859 (48859), Seq: 1, Ack: 81, Len: 0

No.     Time        Source                Destination           Protocol Length Info
     68 2.805527    173.194.35.136        10.162.228.83         TLSv1    1366   Server Hello

Frame 68: 1366 bytes on wire (10928 bits), 1366 bytes captured (10928 bits)
Linux cooked capture
Internet Protocol Version 4, Src: 173.194.35.136 (173.194.35.136), Dst: 10.162.228.83 (10.162.228.83)
Transmission Control Protocol, Src Port: https (443), Dst Port: 48859 (48859), Seq: 1, Ack: 81, Len: 1298
Secure Sockets Layer

No.     Time        Source                Destination           Protocol Length Info
     69 2.805760    10.162.228.83         173.194.35.136        TCP      68     48859 > https [ACK] Seq=81 Ack=1299 Win=4018 Len=0 TSval=1661090 TSecr=2382052666

Frame 69: 68 bytes on wire (544 bits), 68 bytes captured (544 bits)
Linux cooked capture
Internet Protocol Version 4, Src: 10.162.228.83 (10.162.228.83), Dst: 173.194.35.136 (173.194.35.136)
Transmission Control Protocol, Src Port: 48859 (48859), Dst Port: https (443), Seq: 81, Ack: 1299, Len: 0

No.     Time        Source                Destination           Protocol Length Info
     70 2.835617    173.194.35.136        10.162.228.83         TCP      1366   [TCP segment of a reassembled PDU]

Frame 70: 1366 bytes on wire (10928 bits), 1366 bytes captured (10928 bits)
Linux cooked capture
Internet Protocol Version 4, Src: 173.194.35.136 (173.194.35.136), Dst: 10.162.228.83 (10.162.228.83)
Transmission Control Protocol, Src Port: https (443), Dst Port: 48859 (48859), Seq: 1299, Ack: 81, Len: 1298

No.     Time        Source                Destination           Protocol Length Info
     71 2.879880    10.162.228.83         173.194.35.136        TCP      68     48859 > https [ACK] Seq=81 Ack=2597 Win=4018 Len=0 TSval=1661098 TSecr=2382052666

Frame 71: 68 bytes on wire (544 bits), 68 bytes captured (544 bits)
Linux cooked capture
Internet Protocol Version 4, Src: 10.162.228.83 (10.162.228.83), Dst: 173.194.35.136 (173.194.35.136)
Transmission Control Protocol, Src Port: 48859 (48859), Dst Port: https (443), Seq: 81, Ack: 2597, Len: 0

No.     Time        Source                Destination           Protocol Length Info
     72 2.885610    173.194.35.136        10.162.228.83         TCP      1366   [TCP segment of a reassembled PDU]

Frame 72: 1366 bytes on wire (10928 bits), 1366 bytes captured (10928 bits)
Linux cooked capture
Internet Protocol Version 4, Src: 173.194.35.136 (173.194.35.136), Dst: 10.162.228.83 (10.162.228.83)
Transmission Control Protocol, Src Port: https (443), Dst Port: 48859 (48859), Seq: 2597, Ack: 81, Len: 1298

No.     Time        Source                Destination           Protocol Length Info
     73 2.885883    173.194.35.136        10.162.228.83         TLSv1    78     Certificate, Server Hello Done

Frame 73: 78 bytes on wire (624 bits), 78 bytes captured (624 bits)
Linux cooked capture
Internet Protocol Version 4, Src: 173.194.35.136 (173.194.35.136), Dst: 10.162.228.83 (10.162.228.83)
Transmission Control Protocol, Src Port: https (443), Dst Port: 48859 (48859), Seq: 3895, Ack: 81, Len: 10
[4 Reassembled TCP Segments (3818 bytes): #68(1212), #70(1298), #72(1298), #73(10)]
Secure Sockets Layer

No.     Time        Source                Destination           Protocol Length Info
     74 2.885973    10.162.228.83         173.194.35.136        TCP      68     48859 > https [ACK] Seq=81 Ack=3905 Win=4018 Len=0 TSval=1661098 TSecr=2382052666

Frame 74: 68 bytes on wire (544 bits), 68 bytes captured (544 bits)
Linux cooked capture
Internet Protocol Version 4, Src: 10.162.228.83 (10.162.228.83), Dst: 173.194.35.136 (173.194.35.136)
Transmission Control Protocol, Src Port: 48859 (48859), Dst Port: https (443), Seq: 81, Ack: 3905, Len: 0

No.     Time        Source                Destination           Protocol Length Info
     75 3.025425    157.56.195.250        10.162.228.83         TLSv1    121    Application Data

Frame 75: 121 bytes on wire (968 bits), 121 bytes captured (968 bits)
Linux cooked capture
