No.     Time        Source                Destination           Protocol Length Info
      1 0.000000    2.42.183.60           54.235.187.3          TCP      68     56999 > http [FIN, ACK] Seq=1 Ack=1 Win=2009 Len=0 TSval=1893551 TSecr=1609372476

Frame 1: 68 bytes on wire (544 bits), 68 bytes captured (544 bits)
Linux cooked capture
Internet Protocol Version 4, Src: 2.42.183.60 (2.42.183.60), Dst: 54.235.187.3 (54.235.187.3)
Transmission Control Protocol, Src Port: 56999 (56999), Dst Port: http (80), Seq: 1, Ack: 1, Len: 0

No.     Time        Source                Destination           Protocol Length Info
      2 0.283448    54.235.187.3          2.42.183.60           TCP      68     http > 56999 [ACK] Seq=1 Ack=2 Win=64251 Len=0 TSval=1609373509 TSecr=1893551

Frame 2: 68 bytes on wire (544 bits), 68 bytes captured (544 bits)
Linux cooked capture
Internet Protocol Version 4, Src: 54.235.187.3 (54.235.187.3), Dst: 2.42.183.60 (2.42.183.60)
Transmission Control Protocol, Src Port: http (80), Dst Port: 56999 (56999), Seq: 1, Ack: 2, Len: 0

No.     Time        Source                Destination           Protocol Length Info
      3 0.303403    54.235.187.3          2.42.183.60           TCP      68     http > 56999 [FIN, ACK] Seq=1 Ack=2 Win=64251 Len=0 TSval=1609373509 TSecr=1893551

Frame 3: 68 bytes on wire (544 bits), 68 bytes captured (544 bits)
Linux cooked capture
Internet Protocol Version 4, Src: 54.235.187.3 (54.235.187.3), Dst: 2.42.183.60 (2.42.183.60)
Transmission Control Protocol, Src Port: http (80), Dst Port: 56999 (56999), Seq: 1, Ack: 2, Len: 0

No.     Time        Source                Destination           Protocol Length Info
      4 0.303650    2.42.183.60           54.235.187.3          TCP      68     56999 > http [ACK] Seq=2 Ack=2 Win=2009 Len=0 TSval=1893582 TSecr=1609373509

Frame 4: 68 bytes on wire (544 bits), 68 bytes captured (544 bits)
Linux cooked capture
Internet Protocol Version 4, Src: 2.42.183.60 (2.42.183.60), Dst: 54.235.187.3 (54.235.187.3)
Transmission Control Protocol, Src Port: 56999 (56999), Dst Port: http (80), Seq: 2, Ack: 2, Len: 0

No.     Time        Source                Destination           Protocol Length Info
      5 1.533473    54.235.187.3          2.42.183.60           TCP      68     http > 56999 [FIN, ACK] Seq=1 Ack=2 Win=64251 Len=0 TSval=1609373635 TSecr=1893551

Frame 5: 68 bytes on wire (544 bits), 68 bytes captured (544 bits)
Linux cooked capture
Internet Protocol Version 4, Src: 54.235.187.3 (54.235.187.3), Dst: 2.42.183.60 (2.42.183.60)
Transmission Control Protocol, Src Port: http (80), Dst Port: 56999 (56999), Seq: 1, Ack: 2, Len: 0

No.     Time        Source                Destination           Protocol Length Info
      6 1.533892    2.42.183.60           54.235.187.3          TCP      68     [TCP Dup ACK 4#1] 56999 > http [ACK] Seq=2 Ack=2 Win=2009 Len=0 TSval=1893705 TSecr=1609373509

Frame 6: 68 bytes on wire (544 bits), 68 bytes captured (544 bits)
Linux cooked capture
Internet Protocol Version 4, Src: 2.42.183.60 (2.42.183.60), Dst: 54.235.187.3 (54.235.187.3)
Transmission Control Protocol, Src Port: 56999 (56999), Dst Port: http (80), Seq: 2, Ack: 2, Len: 0

No.     Time        Source                Destination           Protocol Length Info
      7 2.023407    54.235.187.3          2.42.183.60           TCP      56     http > 56999 [RST] Seq=2 Win=0 Len=0

Frame 7: 56 bytes on wire (448 bits), 56 bytes captured (448 bits)
Linux cooked capture
Internet Protocol Version 4, Src: 54.235.187.3 (54.235.187.3), Dst: 2.42.183.60 (2.42.183.60)
Transmission Control Protocol, Src Port: http (80), Dst Port: 56999 (56999), Seq: 2, Len: 0

No.     Time        Source                Destination           Protocol Length Info
      8 7.602448    2.42.183.60           50.22.225.76          SSL      97     Continuation Data

Frame 8: 97 bytes on wire (776 bits), 97 bytes captured (776 bits)
Linux cooked capture
Internet Protocol Version 4, Src: 2.42.183.60 (2.42.183.60), Dst: 50.22.225.76 (50.22.225.76)
Transmission Control Protocol, Src Port: 43015 (43015), Dst Port: https (443), Seq: 1, Ack: 1, Len: 29
Secure Sockets Layer

No.     Time        Source                Destination           Protocol Length Info
      9 8.103198    50.22.225.76          2.42.183.60           TCP      68     https > 43015 [ACK] Seq=1 Ack=30 Win=512 Len=0 TSval=2075606889 TSecr=1894311

Frame 9: 68 bytes on wire (544 bits), 68 bytes captured (544 bits)
Linux cooked capture
Internet Protocol Version 4, Src: 50.22.225.76 (50.22.225.76), Dst: 2.42.183.60 (2.42.183.60)
Transmission Control Protocol, Src Port: https (443), Dst Port: 43015 (43015), Seq: 1, Ack: 30, Len: 0

No.     Time        Source                Destination           Protocol Length Info
     10 8.103540    2.42.183.60           50.22.225.76          SSL      108    Continuation Data

Frame 10: 108 bytes on wire (864 bits), 108 bytes captured (864 bits)
Linux cooked capture
Internet Protocol Version 4, Src: 2.42.183.60 (2.42.183.60), Dst: 50.22.225.76 (50.22.225.76)
Transmission Control Protocol, Src Port: 43015 (43015), Dst Port: https (443), Seq: 30, Ack: 1, Len: 40
Secure Sockets Layer

No.     Time        Source                Destination           Protocol Length Info
     11 8.653263    50.22.225.76          2.42.183.60           SSL      113    Continuation Data

Frame 11: 113 bytes on wire (904 bits), 113 bytes captured (904 bits)
Linux cooked capture
Internet Protocol Version 4, Src: 50.22.225.76 (50.22.225.76), Dst: 2.42.183.60 (2.42.183.60)
Transmission Control Protocol, Src Port: https (443), Dst Port: 43015 (43015), Seq: 1, Ack: 70, Len: 45
Secure Sockets Layer

No.     Time        Source                Destination           Protocol Length Info
     12 8.653691    2.42.183.60           50.22.225.76          TCP      68     43015 > https [ACK] Seq=70 Ack=46 Win=1965 Len=0 TSval=1894417 TSecr=2075607443

Frame 12: 68 bytes on wire (544 bits), 68 bytes captured (544 bits)
Linux cooked capture
Internet Protocol Version 4, Src: 2.42.183.60 (2.42.183.60), Dst: 50.22.225.76 (50.22.225.76)
Transmission Control Protocol, Src Port: 43015 (43015), Dst Port: https (443), Seq: 70, Ack: 46, Len: 0

No.     Time        Source                Destination           Protocol Length Info
     13 9.183438    50.22.225.76          2.42.183.60           SSL      113    [TCP Retransmission] Continuation Data

Frame 13: 113 bytes on wire (904 bits), 113 bytes captured (904 bits)
Linux cooked capture
Internet Protocol Version 4, Src: 50.22.225.76 (50.22.225.76), Dst: 2.42.183.60 (2.42.183.60)
Transmission Control Protocol, Src Port: https (443), Dst Port: 43015 (43015), Seq: 1, Ack: 70, Len: 45
Secure Sockets Layer

No.     Time        Source                Destination           Protocol Length Info
     14 9.184415    2.42.183.60           50.22.225.76          TCP      80     [TCP Dup ACK 12#1] 43015 > https [ACK] Seq=70 Ack=46 Win=1965 Len=0 TSval=1894470 TSecr=2075607971 SLE=1 SRE=46

Frame 14: 80 bytes on wire (640 bits), 80 bytes captured (640 bits)
Linux cooked capture
Internet Protocol Version 4, Src: 2.42.183.60 (2.42.183.60), Dst: 50.22.225.76 (50.22.225.76)
Transmission Control Protocol, Src Port: 43015 (43015), Dst Port: https (443), Seq: 70, Ack: 46, Len: 0

No.     Time        Source                Destination           Protocol Length Info
     15 9.573358    173.194.34.50         2.42.183.60           TCP      68     http > 60912 [FIN, ACK] Seq=1 Ack=1 Win=64251 Len=0 TSval=1609374438 TSecr=1891595

Frame 15: 68 bytes on wire (544 bits), 68 bytes captured (544 bits)
Linux cooked capture
Internet Protocol Version 4, Src: 173.194.34.50 (173.194.34.50), Dst: 2.42.183.60 (2.42.183.60)
Transmission Control Protocol, Src Port: http (80), Dst Port: 60912 (60912), Seq: 1, Ack: 1, Len: 0

No.     Time        Source                Destination           Protocol Length Info
     16 9.653201    2.42.183.60           173.194.34.50         TCP      68     60912 > http [ACK] Seq=1 Ack=2 Win=2009 Len=0 TSval=1894517 TSecr=1609374438

Frame 16: 68 bytes on wire (544 bits), 68 bytes captured (544 bits)
Linux cooked capture
Internet Protocol Version 4, Src: 2.42.183.60 (2.42.183.60), Dst: 173.194.34.50 (173.194.34.50)
Transmission Control Protocol, Src Port: 60912 (60912), Dst Port: http (80), Seq: 1, Ack: 2, Len: 0

No.     Time        Source                Destination           Protocol Length Info
     17 10.444640   2.42.183.60           50.22.225.76          SSL      121    Continuation Data

Frame 17: 121 bytes on wire (968 bits), 121 bytes captured (968 bits)
Linux cooked capture
Internet Protocol Version 4, Src: 2.42.183.60 (2.42.183.60), Dst: 50.22.225.76 (50.22.225.76)
Transmission Control Protocol, Src Port: 43015 (43015), Dst Port: https (443), Seq: 70, Ack: 46, Len: 53
Secure Sockets Layer

No.     Time        Source                Destination           Protocol Length Info
     18 10.954385   50.22.225.76          2.42.183.60           SSL      112    Continuation Data

Frame 18: 112 bytes on wire (896 bits), 112 bytes captured (896 bits)
Linux cooked capture
Internet Protocol Version 4, Src: 50.22.225.76 (50.22.225.76), Dst: 2.42.183.60 (2.42.183.60)
Transmission Control Protocol, Src Port: https (443), Dst Port: 43015 (43015), Seq: 46, Ack: 123, Len: 44
Secure Sockets Layer

No.     Time        Source                Destination           Protocol Length Info
     19 10.955008   2.42.183.60           50.22.225.76          SSL      105    Continuation Data

Frame 19: 105 bytes on wire (840 bits), 105 bytes captured (840 bits)
Linux cooked capture
Internet Protocol Version 4, Src: 2.42.183.60 (2.42.183.60), Dst: 50.22.225.76 (50.22.225.76)
Transmission Control Protocol, Src Port: 43015 (43015), Dst Port: https (443), Seq: 123, Ack: 90, Len: 37
Secure Sockets Layer

No.     Time        Source                Destination           Protocol Length Info
     20 11.593195   50.22.225.76          2.42.183.60           SSL      95     Continuation Data

Frame 20: 95 bytes on wire (760 bits), 95 bytes captured (760 bits)
Linux cooked capture
Internet Protocol Version 4, Src: 50.22.225.76 (50.22.225.76), Dst: 2.42.183.60 (2.42.183.60)
Transmission Control Protocol, Src Port: https (443), Dst Port: 43015 (43015), Seq: 90, Ack: 160, Len: 27
Secure Sockets Layer

No.     Time        Source                Destination           Protocol Length Info
     21 11.613213   50.22.225.76          2.42.183.60           SSL      86     Continuation Data

Frame 21: 86 bytes on wire (688 bits), 86 bytes captured (688 bits)
Linux cooked capture
Internet Protocol Version 4, Src: 50.22.225.76 (50.22.225.76), Dst: 2.42.183.60 (2.42.183.60)
Transmission Control Protocol, Src Port: https (443), Dst Port: 43015 (43015), Seq: 117, Ack: 160, Len: 18
Secure Sockets Layer

No.     Time        Source                Destination           Protocol Length Info
     22 11.613721   2.42.183.60           50.22.225.76          TCP      68     43015 > https [ACK] Seq=160 Ack=135 Win=1965 Len=0 TSval=1894713 TSecr=2075610392

Frame 22: 68 bytes on wire (544 bits), 68 bytes captured (544 bits)
Linux cooked capture
Internet Protocol Version 4, Src: 2.42.183.60 (2.42.183.60), Dst: 50.22.225.76 (50.22.225.76)
Transmission Control Protocol, Src Port: 43015 (43015), Dst Port: https (443), Seq: 160, Ack: 135, Len: 0

No.     Time        Source                Destination           Protocol Length Info
     23 13.673215   50.22.225.76          2.42.183.60           SSL      110    Continuation Data

Frame 23: 110 bytes on wire (880 bits), 110 bytes captured (880 bits)
Linux cooked capture
Internet Protocol Version 4, Src: 50.22.225.76 (50.22.225.76), Dst: 2.42.183.60 (2.42.183.60)
Transmission Control Protocol, Src Port: https (443), Dst Port: 43015 (43015), Seq: 135, Ack: 160, Len: 42
Secure Sockets Layer

No.     Time        Source                Destination           Protocol Length Info
     24 13.713231   2.42.183.60           50.22.225.76          TCP      68     43015 > https [ACK] Seq=160 Ack=177 Win=1965 Len=0 TSval=1894923 TSecr=2075612468

Frame 24: 68 bytes on wire (544 bits), 68 bytes captured (544 bits)
Linux cooked capture
Internet Protocol Version 4, Src: 2.42.183.60 (2.42.183.60), Dst: 50.22.225.76 (50.22.225.76)
Transmission Control Protocol, Src Port: 43015 (43015), Dst Port: https (443), Seq: 160, Ack: 177, Len: 0

No.     Time        Source                Destination           Protocol Length Info
     25 13.725566   2.42.183.60           50.22.225.76          SSL      112    Continuation Data

Frame 25: 112 bytes on wire (896 bits), 112 bytes captured (896 bits)
Linux cooked capture
Internet Protocol Version 4, Src: 2.42.183.60 (2.42.183.60), Dst: 50.22.225.76 (50.22.225.76)
Transmission Control Protocol, Src Port: 43015 (43015), Dst Port: https (443), Seq: 160, Ack: 177, Len: 44
Secure Sockets Layer

No.     Time        Source                Destination           Protocol Length Info
     26 14.563546   50.22.225.76          2.42.183.60           TCP      68     https > 43015 [ACK] Seq=177 Ack=204 Win=512 Len=0 TSval=2075613345 TSecr=1894924

Frame 26: 68 bytes on wire (544 bits), 68 bytes captured (544 bits)
Linux cooked capture
Internet Protocol Version 4, Src: 50.22.225.76 (50.22.225.76), Dst: 2.42.183.60 (2.42.183.60)
Transmission Control Protocol, Src Port: https (443), Dst Port: 43015 (43015), Seq: 177, Ack: 204, Len: 0

No.     Time        Source                Destination           Protocol Length Info
     27 14.565230   2.42.183.60           50.22.225.76          SSL      131    Continuation Data

Frame 27: 131 bytes on wire (1048 bits), 131 bytes captured (1048 bits)
Linux cooked capture
Internet Protocol Version 4, Src: 2.42.183.60 (2.42.183.60), Dst: 50.22.225.76 (50.22.225.76)
Transmission Control Protocol, Src Port: 43015 (43015), Dst Port: https (443), Seq: 204, Ack: 177, Len: 63
Secure Sockets Layer

No.     Time        Source                Destination           Protocol Length Info
     28 15.133146   50.22.225.76          2.42.183.60           SSL      112    Continuation Data

Frame 28: 112 bytes on wire (896 bits), 112 bytes captured (896 bits)
Linux cooked capture
Internet Protocol Version 4, Src: 50.22.225.76 (50.22.225.76), Dst: 2.42.183.60 (2.42.183.60)
Transmission Control Protocol, Src Port: https (443), Dst Port: 43015 (43015), Seq: 177, Ack: 267, Len: 44
Secure Sockets Layer

No.     Time        Source                Destination           Protocol Length Info
     29 15.135255   2.42.183.60           50.22.225.76          TCP      68     43015 > https [ACK] Seq=267 Ack=221 Win=1965 Len=0 TSval=1895065 TSecr=2075613912

Frame 29: 68 bytes on wire (544 bits), 68 bytes captured (544 bits)
Linux cooked capture
Internet Protocol Version 4, Src: 2.42.183.60 (2.42.183.60), Dst: 50.22.225.76 (50.22.225.76)
Transmission Control Protocol, Src Port: 43015 (43015), Dst Port: https (443), Seq: 267, Ack: 221, Len: 0

No.     Time        Source                Destination           Protocol Length Info
     30 15.273180   50.22.225.76          2.42.183.60           SSL      95     Continuation Data

Frame 30: 95 bytes on wire (760 bits), 95 bytes captured (760 bits)
Linux cooked capture
Internet Protocol Version 4, Src: 50.22.225.76 (50.22.225.76), Dst: 2.42.183.60 (2.42.183.60)
Transmission Control Protocol, Src Port: https (443), Dst Port: 43015 (43015), Seq: 221, Ack: 267, Len: 27
Secure Sockets Layer

No.     Time        Source                Destination           Protocol Length Info
     31 15.273720   2.42.183.60           50.22.225.76          TCP      68     43015 > https [ACK] Seq=267 Ack=248 Win=1965 Len=0 TSval=1895079 TSecr=2075614061

Frame 31: 68 bytes on wire (544 bits), 68 bytes captured (544 bits)
Linux cooked capture
Internet Protocol Version 4, Src: 2.42.183.60 (2.42.183.60), Dst: 50.22.225.76 (50.22.225.76)
Transmission Control Protocol, Src Port: 43015 (43015), Dst Port: https (443), Seq: 267, Ack: 248, Len: 0

No.     Time        Source                Destination           Protocol Length Info
     32 15.493156   50.22.225.76          2.42.183.60           SSL      110    Continuation Data

Frame 32: 110 bytes on wire (880 bits), 110 bytes captured (880 bits)
Linux cooked capture
Internet Protocol Version 4, Src: 50.22.225.76 (50.22.225.76), Dst: 2.42.183.60 (2.42.183.60)
Transmission Control Protocol, Src Port: https (443), Dst Port: 43015 (43015), Seq: 248, Ack: 267, Len: 42
Secure Sockets Layer

No.     Time        Source                Destination           Protocol Length Info
     33 15.493763   2.42.183.60           50.22.225.76          TCP      68     43015 > https [ACK] Seq=267 Ack=290 Win=1965 Len=0 TSval=1895101 TSecr=2075614263

Frame 33: 68 bytes on wire (544 bits), 68 bytes captured (544 bits)
Linux cooked capture
Internet Protocol Version 4, Src: 2.42.183.60 (2.42.183.60), Dst: 50.22.225.76 (50.22.225.76)
Transmission Control Protocol, Src Port: 43015 (43015), Dst Port: https (443), Seq: 267, Ack: 290, Len: 0

No.     Time        Source                Destination           Protocol Length Info
     34 15.504346   2.42.183.60           50.22.225.76          SSL      112    Continuation Data

Frame 34: 112 bytes on wire (896 bits), 112 bytes captured (896 bits)
Linux cooked capture
Internet Protocol Version 4, Src: 2.42.183.60 (2.42.183.60), Dst: 50.22.225.76 (50.22.225.76)
Transmission Control Protocol, Src Port: 43015 (43015), Dst Port: https (443), Seq: 267, Ack: 290, Len: 44
Secure Sockets Layer

No.     Time        Source                Destination           Protocol Length Info
     35 16.244133   50.22.225.76          2.42.183.60           TCP      68     https > 43015 [ACK] Seq=290 Ack=311 Win=512 Len=0 TSval=2075615041 TSecr=1895102

Frame 35: 68 bytes on wire (544 bits), 68 bytes captured (544 bits)
Linux cooked capture
Internet Protocol Version 4, Src: 50.22.225.76 (50.22.225.76), Dst: 2.42.183.60 (2.42.183.60)
Transmission Control Protocol, Src Port: https (443), Dst Port: 43015 (43015), Seq: 290, Ack: 311, Len: 0

No.     Time        Source                Destination           Protocol Length Info
     36 16.799535   2.42.183.60           50.22.225.76          SSL      100    Continuation Data

Frame 36: 100 bytes on wire (800 bits), 100 bytes captured (800 bits)
Linux cooked capture
Internet Protocol Version 4, Src: 2.42.183.60 (2.42.183.60), Dst: 50.22.225.76 (50.22.225.76)
Transmission Control Protocol, Src Port: 43015 (43015), Dst Port: https (443), Seq: 311, Ack: 290, Len: 32
Secure Sockets Layer

No.     Time        Source                Destination           Protocol Length Info
     37 17.303436   50.22.225.76          2.42.183.60           TCP      68     https > 43015 [ACK] Seq=290 Ack=343 Win=512 Len=0 TSval=2075616104 TSecr=1895231

Frame 37: 68 bytes on wire (544 bits), 68 bytes captured (544 bits)
Linux cooked capture
Internet Protocol Version 4, Src: 50.22.225.76 (50.22.225.76), Dst: 2.42.183.60 (2.42.183.60)
Transmission Control Protocol, Src Port: https (443), Dst Port: 43015 (43015), Seq: 290, Ack: 343, Len: 0

No.     Time        Source                Destination           Protocol Length Info
     38 17.304095   2.42.183.60           50.22.225.76          SSL      127    Continuation Data

Frame 38: 127 bytes on wire (1016 bits), 127 bytes captured (1016 bits)
Linux cooked capture
Internet Protocol Version 4, Src: 2.42.183.60 (2.42.183.60), Dst: 50.22.225.76 (50.22.225.76)
Transmission Control Protocol, Src Port: 43015 (43015), Dst Port: https (443), Seq: 343, Ack: 290, Len: 59
Secure Sockets Layer

No.     Time        Source                Destination           Protocol Length Info
     39 17.503400   50.22.225.76          2.42.183.60           SSL      100    Continuation Data

Frame 39: 100 bytes on wire (800 bits), 100 bytes captured (800 bits)
Linux cooked capture
Internet Protocol Version 4, Src: 50.22.225.76 (50.22.225.76), Dst: 2.42.183.60 (2.42.183.60)
Transmission Control Protocol, Src Port: https (443), Dst Port: 43015 (43015), Seq: 290, Ack: 343, Len: 32
Secure Sockets Layer

No.     Time        Source                Destination           Protocol Length Info
     40 17.543358   2.42.183.60           50.22.225.76          TCP      68     43015 > https [ACK] Seq=402 Ack=322 Win=1965 Len=0 TSval=1895306 TSecr=2075616286

Frame 40: 68 bytes on wire (544 bits), 68 bytes captured (544 bits)
Linux cooked capture
Internet Protocol Version 4, Src: 2.42.183.60 (2.42.183.60), Dst: 50.22.225.76 (50.22.225.76)
Transmission Control Protocol, Src Port: 43015 (43015), Dst Port: https (443), Seq: 402, Ack: 322, Len: 0

No.     Time        Source                Destination           Protocol Length Info
     41 17.723433   50.22.225.76          2.42.183.60           SSL      159    Continuation Data

Frame 41: 159 bytes on wire (1272 bits), 159 bytes captured (1272 bits)
Linux cooked capture
Internet Protocol Version 4, Src: 50.22.225.76 (50.22.225.76), Dst: 2.42.183.60 (2.42.183.60)
Transmission Control Protocol, Src Port: https (443), Dst Port: 43015 (43015), Seq: 322, Ack: 343, Len: 91
Secure Sockets Layer

No.     Time        Source                Destination           Protocol Length Info
     42 17.725823   2.42.183.60           50.22.225.76          TCP      68     43015 > https [ACK] Seq=402 Ack=413 Win=1965 Len=0 TSval=1895324 TSecr=2075616489

Frame 42: 68 bytes on wire (544 bits), 68 bytes captured (544 bits)
Linux cooked capture
Internet Protocol Version 4, Src: 2.42.183.60 (2.42.183.60), Dst: 50.22.225.76 (50.22.225.76)
Transmission Control Protocol, Src Port: 43015 (43015), Dst Port: https (443), Seq: 402, Ack: 413, Len: 0

No.     Time        Source                Destination           Protocol Length Info
     43 17.933175   50.22.225.76          2.42.183.60           SSL      112    Continuation Data

Frame 43: 112 bytes on wire (896 bits), 112 bytes captured (896 bits)
Linux cooked capture
Internet Protocol Version 4, Src: 50.22.225.76 (50.22.225.76), Dst: 2.42.183.60 (2.42.183.60)
Transmission Control Protocol, Src Port: https (443), Dst Port: 43015 (43015), Seq: 413, Ack: 402, Len: 44
Secure Sockets Layer

No.     Time        Source                Destination           Protocol Length Info
     44 17.934963   2.42.183.60           50.22.225.76          SSL      120    Continuation Data

Frame 44: 120 bytes on wire (960 bits), 120 bytes captured (960 bits)
Linux cooked capture
Internet Protocol Version 4, Src: 2.42.183.60 (2.42.183.60), Dst: 50.22.225.76 (50.22.225.76)
Transmission Control Protocol, Src Port: 43015 (43015), Dst Port: https (443), Seq: 402, Ack: 457, Len: 52
Secure Sockets Layer

No.     Time        Source                Destination           Protocol Length Info
     45 18.753131   50.22.225.76          2.42.183.60           SSL      110    Continuation Data

Frame 45: 110 bytes on wire (880 bits), 110 bytes captured (880 bits)
Linux cooked capture
Internet Protocol Version 4, Src: 50.22.225.76 (50.22.225.76), Dst: 2.42.183.60 (2.42.183.60)
Transmission Control Protocol, Src Port: https (443), Dst Port: 43015 (43015), Seq: 457, Ack: 402, Len: 42
Secure Sockets Layer

No.     Time        Source                Destination           Protocol Length Info
     46 18.793226   2.42.183.60           50.22.225.76          TCP      68     43015 > https [ACK] Seq=454 Ack=499 Win=1965 Len=0 TSval=1895431 TSecr=2075617517

Frame 46: 68 bytes on wire (544 bits), 68 bytes captured (544 bits)
Linux cooked capture
Internet Protocol Version 4, Src: 2.42.183.60 (2.42.183.60), Dst: 50.22.225.76 (50.22.225.76)
Transmission Control Protocol, Src Port: 43015 (43015), Dst Port: https (443), Seq: 454, Ack: 499, Len: 0

No.     Time        Source                Destination           Protocol Length Info
     47 19.393423   50.22.225.76          2.42.183.60           TCP      68     https > 43015 [ACK] Seq=499 Ack=454 Win=512 Len=0 TSval=2075618176 TSecr=1895345

Frame 47: 68 bytes on wire (544 bits), 68 bytes captured (544 bits)
Linux cooked capture
Internet Protocol Version 4, Src: 50.22.225.76 (50.22.225.76), Dst: 2.42.183.60 (2.42.183.60)
Transmission Control Protocol, Src Port: https (443), Dst Port: 43015 (43015), Seq: 499, Ack: 454, Len: 0

No.     Time        Source                Destination           Protocol Length Info
     48 19.394066   2.42.183.60           50.22.225.76          SSL      112    Continuation Data

Frame 48: 112 bytes on wire (896 bits), 112 bytes captured (896 bits)
Linux cooked capture
Internet Protocol Version 4, Sr