No.     Time        Source                Destination           Protocol Length Info
      1 0.000000    10.164.92.154         130.186.6.177         TCP      68     55294 > imaps [ACK] Seq=1 Ack=1 Win=5853 Len=0 TSval=1738067 TSecr=1079456575

Frame 1: 68 bytes on wire (544 bits), 68 bytes captured (544 bits)
Linux cooked capture
Internet Protocol Version 4, Src: 10.164.92.154 (10.164.92.154), Dst: 130.186.6.177 (130.186.6.177)
Transmission Control Protocol, Src Port: 55294 (55294), Dst Port: imaps (993), Seq: 1, Ack: 1, Len: 0

No.     Time        Source                Destination           Protocol Length Info
      2 0.774755    10.164.92.154         130.186.6.177         TLSv1    113    Application Data

Frame 2: 113 bytes on wire (904 bits), 113 bytes captured (904 bits)
Linux cooked capture
Internet Protocol Version 4, Src: 10.164.92.154 (10.164.92.154), Dst: 130.186.6.177 (130.186.6.177)
Transmission Control Protocol, Src Port: 55294 (55294), Dst Port: imaps (993), Seq: 1, Ack: 1, Len: 45
Secure Sockets Layer

No.     Time        Source                Destination           Protocol Length Info
      3 0.971135    130.186.6.177         10.164.92.154         TLSv1    1329   Application Data

Frame 3: 1329 bytes on wire (10632 bits), 1329 bytes captured (10632 bits)
Linux cooked capture
Internet Protocol Version 4, Src: 130.186.6.177 (130.186.6.177), Dst: 10.164.92.154 (10.164.92.154)
Transmission Control Protocol, Src Port: imaps (993), Dst Port: 55294 (55294), Seq: 1, Ack: 46, Len: 1261
Secure Sockets Layer

No.     Time        Source                Destination           Protocol Length Info
      4 0.971388    10.164.92.154         130.186.6.177         TCP      68     55294 > imaps [ACK] Seq=46 Ack=1262 Win=6502 Len=0 TSval=1738164 TSecr=1079458495

Frame 4: 68 bytes on wire (544 bits), 68 bytes captured (544 bits)
Linux cooked capture
Internet Protocol Version 4, Src: 10.164.92.154 (10.164.92.154), Dst: 130.186.6.177 (130.186.6.177)
Transmission Control Protocol, Src Port: 55294 (55294), Dst Port: imaps (993), Seq: 46, Ack: 1262, Len: 0

No.     Time        Source                Destination           Protocol Length Info
      5 2.544522    10.164.92.154         69.171.248.65         TLSv1    293    Application Data

Frame 5: 293 bytes on wire (2344 bits), 293 bytes captured (2344 bits)
Linux cooked capture
Internet Protocol Version 4, Src: 10.164.92.154 (10.164.92.154), Dst: 69.171.248.65 (69.171.248.65)
Transmission Control Protocol, Src Port: 55716 (55716), Dst Port: https (443), Seq: 1, Ack: 1, Len: 225
Secure Sockets Layer

No.     Time        Source                Destination           Protocol Length Info
      6 2.950820    69.171.248.65         10.164.92.154         TCP      68     https > 55716 [ACK] Seq=1 Ack=226 Win=92 Len=0 TSval=4085343836 TSecr=1738321

Frame 6: 68 bytes on wire (544 bits), 68 bytes captured (544 bits)
Linux cooked capture
Internet Protocol Version 4, Src: 69.171.248.65 (69.171.248.65), Dst: 10.164.92.154 (10.164.92.154)
Transmission Control Protocol, Src Port: https (443), Dst Port: 55716 (55716), Seq: 1, Ack: 226, Len: 0

No.     Time        Source                Destination           Protocol Length Info
      7 3.364815    10.164.92.154         130.186.6.177         TLSv1    105    Application Data

Frame 7: 105 bytes on wire (840 bits), 105 bytes captured (840 bits)
Linux cooked capture
Internet Protocol Version 4, Src: 10.164.92.154 (10.164.92.154), Dst: 130.186.6.177 (130.186.6.177)
Transmission Control Protocol, Src Port: 55294 (55294), Dst Port: imaps (993), Seq: 46, Ack: 1262, Len: 37
Secure Sockets Layer

No.     Time        Source                Destination           Protocol Length Info
      8 3.550867    130.186.6.177         10.164.92.154         TLSv1    121    Application Data

Frame 8: 121 bytes on wire (968 bits), 121 bytes captured (968 bits)
Linux cooked capture
Internet Protocol Version 4, Src: 130.186.6.177 (130.186.6.177), Dst: 10.164.92.154 (10.164.92.154)
Transmission Control Protocol, Src Port: imaps (993), Dst Port: 55294 (55294), Seq: 1262, Ack: 83, Len: 53
Secure Sockets Layer

No.     Time        Source                Destination           Protocol Length Info
      9 3.551205    10.164.92.154         130.186.6.177         TCP      68     55294 > imaps [ACK] Seq=83 Ack=1315 Win=6502 Len=0 TSval=1738422 TSecr=1079461091

Frame 9: 68 bytes on wire (544 bits), 68 bytes captured (544 bits)
Linux cooked capture
Internet Protocol Version 4, Src: 10.164.92.154 (10.164.92.154), Dst: 130.186.6.177 (130.186.6.177)
Transmission Control Protocol, Src Port: 55294 (55294), Dst Port: imaps (993), Seq: 83, Ack: 1315, Len: 0

No.     Time        Source                Destination           Protocol Length Info
     10 3.559830    10.164.92.154         130.186.6.177         TLSv1    113    Application Data

Frame 10: 113 bytes on wire (904 bits), 113 bytes captured (904 bits)
Linux cooked capture
Internet Protocol Version 4, Src: 10.164.92.154 (10.164.92.154), Dst: 130.186.6.177 (130.186.6.177)
Transmission Control Protocol, Src Port: 55294 (55294), Dst Port: imaps (993), Seq: 83, Ack: 1315, Len: 45
Secure Sockets Layer

No.     Time        Source                Destination           Protocol Length Info
     11 3.801118    130.186.6.177         10.164.92.154         TLSv1    641    Application Data

Frame 11: 641 bytes on wire (5128 bits), 641 bytes captured (5128 bits)
Linux cooked capture
Internet Protocol Version 4, Src: 130.186.6.177 (130.186.6.177), Dst: 10.164.92.154 (10.164.92.154)
Transmission Control Protocol, Src Port: imaps (993), Dst Port: 55294 (55294), Seq: 1315, Ack: 128, Len: 573
Secure Sockets Layer

No.     Time        Source                Destination           Protocol Length Info
     12 3.828605    10.164.92.154         130.186.6.177         TLSv1    129    Application Data

Frame 12: 129 bytes on wire (1032 bits), 129 bytes captured (1032 bits)
Linux cooked capture
Internet Protocol Version 4, Src: 10.164.92.154 (10.164.92.154), Dst: 130.186.6.177 (130.186.6.177)
Transmission Control Protocol, Src Port: 55294 (55294), Dst Port: imaps (993), Seq: 128, Ack: 1888, Len: 61
Secure Sockets Layer

No.     Time        Source                Destination           Protocol Length Info
     13 3.940980    10.164.92.154         50.22.225.86          TCP      68     41743 > https [FIN, ACK] Seq=1 Ack=1 Win=1578 Len=0 TSval=1738461 TSecr=3825606120

Frame 13: 68 bytes on wire (544 bits), 68 bytes captured (544 bits)
Linux cooked capture
Internet Protocol Version 4, Src: 10.164.92.154 (10.164.92.154), Dst: 50.22.225.86 (50.22.225.86)
Transmission Control Protocol, Src Port: 41743 (41743), Dst Port: https (443), Seq: 1, Ack: 1, Len: 0

No.     Time        Source                Destination           Protocol Length Info
     14 4.030853    130.186.6.177         10.164.92.154         TLSv1    241    Application Data

Frame 14: 241 bytes on wire (1928 bits), 241 bytes captured (1928 bits)
Linux cooked capture
Internet Protocol Version 4, Src: 130.186.6.177 (130.186.6.177), Dst: 10.164.92.154 (10.164.92.154)
Transmission Control Protocol, Src Port: imaps (993), Dst Port: 55294 (55294), Seq: 1888, Ack: 189, Len: 173
Secure Sockets Layer

No.     Time        Source                Destination           Protocol Length Info
     15 4.046948    10.164.92.154         130.186.6.177         TLSv1    233    Application Data

Frame 15: 233 bytes on wire (1864 bits), 233 bytes captured (1864 bits)
Linux cooked capture
Internet Protocol Version 4, Src: 10.164.92.154 (10.164.92.154), Dst: 130.186.6.177 (130.186.6.177)
Transmission Control Protocol, Src Port: 55294 (55294), Dst Port: imaps (993), Seq: 189, Ack: 2061, Len: 165
Secure Sockets Layer

No.     Time        Source                Destination           Protocol Length Info
     16 4.170860    50.22.225.86          10.164.92.154         TCP      68     https > 41743 [ACK] Seq=1 Ack=2 Win=512 Len=0 TSval=3825720858 TSecr=1738461

Frame 16: 68 bytes on wire (544 bits), 68 bytes captured (544 bits)
Linux cooked capture
Internet Protocol Version 4, Src: 50.22.225.86 (50.22.225.86), Dst: 10.164.92.154 (10.164.92.154)
Transmission Control Protocol, Src Port: https (443), Dst Port: 41743 (41743), Seq: 1, Ack: 2, Len: 0

No.     Time        Source                Destination           Protocol Length Info
     17 4.171293    50.22.225.86          10.164.92.154         TCP      68     https > 41743 [FIN, ACK] Seq=1 Ack=2 Win=512 Len=0 TSval=3825720858 TSecr=1738461

Frame 17: 68 bytes on wire (544 bits), 68 bytes captured (544 bits)
Linux cooked capture
Internet Protocol Version 4, Src: 50.22.225.86 (50.22.225.86), Dst: 10.164.92.154 (10.164.92.154)
Transmission Control Protocol, Src Port: https (443), Dst Port: 41743 (41743), Seq: 1, Ack: 2, Len: 0

No.     Time        Source                Destination           Protocol Length Info
     18 4.171478    10.164.92.154         50.22.225.86          TCP      68     41743 > https [ACK] Seq=2 Ack=2 Win=1578 Len=0 TSval=1738484 TSecr=3825720858

Frame 18: 68 bytes on wire (544 bits), 68 bytes captured (544 bits)
Linux cooked capture
Internet Protocol Version 4, Src: 10.164.92.154 (10.164.92.154), Dst: 50.22.225.86 (50.22.225.86)
Transmission Control Protocol, Src Port: 41743 (41743), Dst Port: https (443), Seq: 2, Ack: 2, Len: 0

No.     Time        Source                Destination           Protocol Length Info
     19 4.350975    130.186.6.177         10.164.92.154         TLSv1    137    Application Data

Frame 19: 137 bytes on wire (1096 bits), 137 bytes captured (1096 bits)
Linux cooked capture
Internet Protocol Version 4, Src: 130.186.6.177 (130.186.6.177), Dst: 10.164.92.154 (10.164.92.154)
Transmission Control Protocol, Src Port: imaps (993), Dst Port: 55294 (55294), Seq: 2061, Ack: 354, Len: 69
Secure Sockets Layer

No.     Time        Source                Destination           Protocol Length Info
     20 4.389682    10.164.92.154         130.186.6.177         TCP      68     55294 > imaps [ACK] Seq=354 Ack=2130 Win=7800 Len=0 TSval=1738506 TSecr=1079461891

Frame 20: 68 bytes on wire (544 bits), 68 bytes captured (544 bits)
Linux cooked capture
Internet Protocol Version 4, Src: 10.164.92.154 (10.164.92.154), Dst: 130.186.6.177 (130.186.6.177)
Transmission Control Protocol, Src Port: 55294 (55294), Dst Port: imaps (993), Seq: 354, Ack: 2130, Len: 0

No.     Time        Source                Destination           Protocol Length Info
     21 4.561053    130.186.6.177         10.164.92.154         TLSv1    1075   Application Data, Application Data, Application Data

Frame 21: 1075 bytes on wire (8600 bits), 1075 bytes captured (8600 bits)
Linux cooked capture
Internet Protocol Version 4, Src: 130.186.6.177 (130.186.6.177), Dst: 10.164.92.154 (10.164.92.154)
Transmission Control Protocol, Src Port: imaps (993), Dst Port: 55294 (55294), Seq: 2130, Ack: 354, Len: 1007
Secure Sockets Layer

No.     Time        Source                Destination           Protocol Length Info
     22 4.561273    10.164.92.154         130.186.6.177         TCP      68     55294 > imaps [ACK] Seq=354 Ack=3137 Win=8449 Len=0 TSval=1738523 TSecr=1079462090

Frame 22: 68 bytes on wire (544 bits), 68 bytes captured (544 bits)
Linux cooked capture
Internet Protocol Version 4, Src: 10.164.92.154 (10.164.92.154), Dst: 130.186.6.177 (130.186.6.177)
Transmission Control Protocol, Src Port: 55294 (55294), Dst Port: imaps (993), Seq: 354, Ack: 3137, Len: 0

No.     Time        Source                Destination           Protocol Length Info
     23 12.769638   10.164.92.154         173.194.40.147        TCP      68     58116 > http [FIN, ACK] Seq=1 Ack=1 Win=1578 Len=0 TSval=1739344 TSecr=1530209114

Frame 23: 68 bytes on wire (544 bits), 68 bytes captured (544 bits)
Linux cooked capture
Internet Protocol Version 4, Src: 10.164.92.154 (10.164.92.154), Dst: 173.194.40.147 (173.194.40.147)
Transmission Control Protocol, Src Port: 58116 (58116), Dst Port: http (80), Seq: 1, Ack: 1, Len: 0

No.     Time        Source                Destination           Protocol Length Info
     24 17.329660   10.164.92.154         173.194.40.148        TCP      68     52495 > http [FIN, ACK] Seq=1 Ack=1 Win=1578 Len=0 TSval=1739800 TSecr=1531117560

Frame 24: 68 bytes on wire (544 bits), 68 bytes captured (544 bits)
Linux cooked capture
Internet Protocol Version 4, Src: 10.164.92.154 (10.164.92.154), Dst: 173.194.40.148 (173.194.40.148)
Transmission Control Protocol, Src Port: 52495 (52495), Dst Port: http (80), Seq: 1, Ack: 1, Len: 0

No.     Time        Source                Destination           Protocol Length Info
     25 17.813225   10.164.92.154         83.224.70.77          DNS      78     Standard query 0x14ba  A e16.whatsapp.net

Frame 25: 78 bytes on wire (624 bits), 78 bytes captured (624 bits)
Linux cooked capture
Internet Protocol Version 4, Src: 10.164.92.154 (10.164.92.154), Dst: 83.224.70.77 (83.224.70.77)
User Datagram Protocol, Src Port: 6164 (6164), Dst Port: domain (53)
Domain Name System (query)

No.     Time        Source                Destination           Protocol Length Info
     26 18.122608   83.224.70.77          10.164.92.154         DNS      206    Standard query response 0x14ba  A 108.168.176.196 A 108.168.176.197 A 108.168.176.198 A 108.168.176.253 A 108.168.176.254 A 184.173.179.42 A 108.168.176.194 A 108.168.176.195

Frame 26: 206 bytes on wire (1648 bits), 206 bytes captured (1648 bits)
Linux cooked capture
Internet Protocol Version 4, Src: 83.224.70.77 (83.224.70.77), Dst: 10.164.92.154 (10.164.92.154)
User Datagram Protocol, Src Port: domain (53), Dst Port: 6164 (6164)
Domain Name System (response)

No.     Time        Source                Destination           Protocol Length Info
     27 18.146088   10.164.92.154         108.168.176.195       TCP      76     41741 > https [SYN] Seq=0 Win=5240 Len=0 MSS=1310 SACK_PERM=1 TSval=1739881 TSecr=0 WS=4

Frame 27: 76 bytes on wire (608 bits), 76 bytes captured (608 bits)
Linux cooked capture
Internet Protocol Version 4, Src: 10.164.92.154 (10.164.92.154), Dst: 108.168.176.195 (108.168.176.195)
Transmission Control Protocol, Src Port: 41741 (41741), Dst Port: https (443), Seq: 0, Len: 0

No.     Time        Source                Destination           Protocol Length Info
     28 18.548425   108.168.176.195       10.164.92.154         TCP      76     https > 41741 [SYN, ACK] Seq=0 Ack=1 Win=65535 Len=0 MSS=1310 WS=512 SACK_PERM=1 TSval=1437913100 TSecr=1739881

Frame 28: 76 bytes on wire (608 bits), 76 bytes captured (608 bits)
Linux cooked capture
Internet Protocol Version 4, Src: 108.168.176.195 (108.168.176.195), Dst: 10.164.92.154 (10.164.92.154)
Transmission Control Protocol, Src Port: https (443), Dst Port: 41741 (41741), Seq: 0, Ack: 1, Len: 0

No.     Time        Source                Destination           Protocol Length Info
     29 18.548740   10.164.92.154         108.168.176.195       TCP      68     41741 > https [ACK] Seq=1 Ack=1 Win=5240 Len=0 TSval=1739921 TSecr=1437913100

Frame 29: 68 bytes on wire (544 bits), 68 bytes captured (544 bits)
Linux cooked capture
Internet Protocol Version 4, Src: 10.164.92.154 (10.164.92.154), Dst: 108.168.176.195 (108.168.176.195)
Transmission Control Protocol, Src Port: 41741 (41741), Dst Port: https (443), Seq: 1, Ack: 1, Len: 0

No.     Time        Source                Destination           Protocol Length Info
     30 18.755988   10.164.92.154         108.168.176.195       SSL      189    Continuation Data

Frame 30: 189 bytes on wire (1512 bits), 189 bytes captured (1512 bits)
Linux cooked capture
Internet Protocol Version 4, Src: 10.164.92.154 (10.164.92.154), Dst: 108.168.176.195 (108.168.176.195)
Transmission Control Protocol, Src Port: 41741 (41741), Dst Port: https (443), Seq: 1, Ack: 1, Len: 121
Secure Sockets Layer

No.     Time        Source                Destination           Protocol Length Info
     31 18.988428   108.168.176.195       10.164.92.154         TCP      68     [TCP Window Update] https > 41741 [ACK] Seq=1 Ack=1 Win=262144 Len=0 TSval=1437913552 TSecr=1739921

Frame 31: 68 bytes on wire (544 bits), 68 bytes captured (544 bits)
Linux cooked capture
Internet Protocol Version 4, Src: 108.168.176.195 (108.168.176.195), Dst: 10.164.92.154 (10.164.92.154)
Transmission Control Protocol, Src Port: https (443), Dst Port: 41741 (41741), Seq: 1, Ack: 1, Len: 0

No.     Time        Source                Destination           Protocol Length Info
     32 19.409515   108.168.176.195       10.164.92.154         SSL      157    Continuation Data

Frame 32: 157 bytes on wire (1256 bits), 157 bytes captured (1256 bits)
Linux cooked capture
Internet Protocol Version 4, Src: 108.168.176.195 (108.168.176.195), Dst: 10.164.92.154 (10.164.92.154)
Transmission Control Protocol, Src Port: https (443), Dst Port: 41741 (41741), Seq: 1, Ack: 122, Len: 89
Secure Sockets Layer

No.     Time        Source                Destination           Protocol Length Info
     33 19.409998   10.164.92.154         108.168.176.195       TCP      68     41741 > https [ACK] Seq=122 Ack=90 Win=5240 Len=0 TSval=1740008 TSecr=1437913947

Frame 33: 68 bytes on wire (544 bits), 68 bytes captured (544 bits)
Linux cooked capture
Internet Protocol Version 4, Src: 10.164.92.154 (10.164.92.154), Dst: 108.168.176.195 (108.168.176.195)
Transmission Control Protocol, Src Port: 41741 (41741), Dst Port: https (443), Seq: 122, Ack: 90, Len: 0

No.     Time        Source                Destination           Protocol Length Info
     34 19.438377   108.168.176.195       10.164.92.154         SSL      89     Continuation Data

Frame 34: 89 bytes on wire (712 bits), 89 bytes captured (712 bits)
Linux cooked capture
Internet Protocol Version 4, Src: 108.168.176.195 (108.168.176.195), Dst: 10.164.92.154 (10.164.92.154)
Transmission Control Protocol, Src Port: https (443), Dst Port: 41741 (41741), Seq: 90, Ack: 122, Len: 21
Secure Sockets Layer

No.     Time        Source                Destination           Protocol Length Info
     35 19.438603   10.164.92.154         108.168.176.195       TCP      68     41741 > https [ACK] Seq=122 Ack=111 Win=5240 Len=0 TSval=1740010 TSecr=1437914001

Frame 35: 68 bytes on wire (544 bits), 68 bytes captured (544 bits)
Linux cooked capture
Internet Protocol Version 4, Src: 10.164.92.154 (10.164.92.154), Dst: 108.168.176.195 (108.168.176.195)
Transmission Control Protocol, Src Port: 41741 (41741), Dst Port: https (443), Seq: 122, Ack: 111, Len: 0

No.     Time        Source                Destination           Protocol Length Info
     36 19.475273   10.164.92.154         108.168.176.195       SSL      97     Continuation Data

Frame 36: 97 bytes on wire (776 bits), 97 bytes captured (776 bits)
Linux cooked capture
Internet Protocol Version 4, Src: 10.164.92.154 (10.164.92.154), Dst: 108.168.176.195 (108.168.176.195)
Transmission Control Protocol, Src Port: 41741 (41741), Dst Port: https (443), Seq: 122, Ack: 111, Len: 29
Secure Sockets Layer

No.     Time        Source                Destination           Protocol Length Info
     37 20.120457   108.168.176.195       10.164.92.154         TCP      68     https > 41741 [ACK] Seq=111 Ack=151 Win=262144 Len=0 TSval=1437914683 TSecr=1740014

Frame 37: 68 bytes on wire (544 bits), 68 bytes captured (544 bits)
Linux cooked capture
Internet Protocol Version 4, Src: 108.168.176.195 (108.168.176.195), Dst: 10.164.92.154 (10.164.92.154)
Transmission Control Protocol, Src Port: https (443), Dst Port: 41741 (41741), Seq: 111, Ack: 151, Len: 0

No.     Time        Source                Destination           Protocol Length Info
     38 20.121057   10.164.92.154         108.168.176.195       SSL      146    Continuation Data

Frame 38: 146 bytes on wire (1168 bits), 146 bytes captured (1168 bits)
Linux cooked capture
Internet Protocol Version 4, Src: 10.164.92.154 (10.164.92.154), Dst: 108.168.176.195 (108.168.176.195)
Transmission Control Protocol, Src Port: 41741 (41741), Dst Port: https (443), Seq: 151, Ack: 111, Len: 78
Secure Sockets Layer

No.     Time        Source                Destination           Protocol Length Info
     39 21.314180   108.168.176.195       10.164.92.154         SSL      252    Continuation Data

Frame 39: 252 bytes on wire (2016 bits), 252 bytes captured (2016 bits)
Linux cooked capture
Internet Protocol Version 4, Src: 108.168.176.195 (108.168.176.195), Dst: 10.164.92.154 (10.164.92.154)
Transmission Control Protocol, Src Port: https (443), Dst Port: 41741 (41741), Seq: 111, Ack: 229, Len: 184
Secure Sockets Layer

No.     Time        Source                Destination           Protocol Length Info
     40 21.314458   108.168.176.195       10.164.92.154         SSL      109    Continuation Data

Frame 40: 109 bytes on wire (872 bits), 109 bytes captured (872 bits)
Linux cooked capture
Internet Protocol Version 4, Src: 108.168.176.195 (108.168.176.195), Dst: 10.164.92.154 (10.164.92.154)
Transmission Control Protocol, Src Port: https (443), Dst Port: 41741 (41741), Seq: 295, Ack: 229, Len: 41
Secure Sockets Layer

No.     Time        Source                Destination           Protocol Length Info
     41 21.314862   108.168.176.195       10.164.92.154         SSL      237    Continuation Data

Frame 41: 237 bytes on wire (1896 bits), 237 bytes captured (1896 bits)
Linux cooked capture
Internet Protocol Version 4, Src: 108.168.176.195 (108.168.176.195), Dst: 10.164.92.154 (10.164.92.154)
Transmission Control Protocol, Src Port: https (443), Dst Port: 41741 (41741), Seq: 336, Ack: 229, Len: 169
Secure Sockets Layer

No.     Time        Source                Destination           Protocol Length Info
     42 21.315913   10.164.92.154         108.168.176.195       TCP      68     41741 > https [ACK] Seq=229 Ack=295 Win=6312 Len=0 TSval=1740198 TSecr=1437915271

Frame 42: 68 bytes on wire (544 bits), 68 bytes captured (544 bits)
Linux cooked capture
Internet Protocol Version 4, Src: 10.164.92.154 (10.164.92.154), Dst: 108.168.176.195 (108.168.176.195)
Transmission Control Protocol, Src Port: 41741 (41741), Dst Port: https (443), Seq: 229, Ack: 295, Len: 0

No.     Time        Source                Destination           Protocol Length Info
     43 21.319433   10.164.92.154         108.168.176.195       TCP      68     41741 > https [ACK] Seq=229 Ack=336 Win=6312 Len=0 TSval=1740198 TSecr=1437915274

Frame 43: 68 bytes on wire (544 bits), 68 bytes captured (544 bits)
Linux cooked capture
Internet Protocol Version 4, Src: 10.164.92.154 (10.164.92.154), Dst: 108.168.176.195 (108.168.176.195)
Transmission Control Protocol, Src Port: 41741 (41741), Dst Port: https (443), Seq: 229, Ack: 336, Len: 0

No.     Time        Source                Destination           Protocol Length Info
     44 21.320042   10.164.92.154         108.168.176.195       TCP      68     41741 > https [ACK] Seq=229 Ack=505 Win=7384 Len=0 TSval=1740198 TSecr=1437915275

Frame 44: 68 bytes on wire (544 bits), 68 bytes captured (544 bits)
Linux cooked capture
Internet Protocol Version 4, Src: 10.164.92.154 (10.164.92.154), Dst: 108.168.176.195 (108.168.176.195)
Transmission Control Protocol, Src Port: 41741 (41741), Dst Port: https (443), Seq: 229, Ack: 505, Len: 0

No.     Time        Source                Destination           Protocol Length Info
     45 21.570617   10.164.92.154         173.194.40.148        TCP      76     60844 > http [SYN] Seq=0 Win=5240 Len=0 MSS=1310 SACK_PERM=1 TSval=1740224 TSecr=0 WS=4

Frame 45: 76 bytes on wire (608 bits), 76 bytes captured (608 bits)
Linux cooked capture
Internet Protocol Version 4, Src: 10.164.92.154 (10.164.92.154), Dst: 173.194.40.148 (173.194.40.148)
Transmission Control Protocol, Src Port: 60844 (60844), Dst Port: http (80), Seq: 0, Len: 0

No.     Time        Source                Destination           Protocol Length Info
     46 21.724063   173.194.40.148        10.164.92.154         TCP      80     http > 60844 [SYN, ACK] Seq=0 Ack=1 Win=64251 Len=0 TSval=1531275908 TSecr=1740224 MSS=1400 WS=4 SACK_PERM=1

Frame 46: 80 bytes on wire (640 bits), 80 bytes captured (640 bits)
Linux cooked capture
Internet Protocol Version 4, Src: 173.194.40.148 (173.194.40.148), Dst: 10.164.92.154 (10.164.92.154)
Transmission Control Protocol, Src Port: http (80), Dst Port: 60844 (60844), Seq: 0, Ack: 1, Len: 0

No.     Time        Source                Destination           Protocol Length Info
     47 21.724327   10.164.92.154         173.194.40.148        TCP      68     60844 > http [ACK] Seq=1 Ack=1 Win=5240 Len=0 TSval=1740239 TSecr=1531275908

Frame 47: 68 bytes on wire (544 bits), 68 bytes captured (544 bits)
Linux cooked capture
Internet Protocol Version 4, Src: 10.164.92.154 (10.164.92.154), Dst: 173.194.40.148 (173.194.40.148)
Transmission Control Protocol, Src Port: 60844 (60844), Dst Port: http (80), Seq: 1, Ack: 1, Len: 0

No.     Time        Source                Destination           Protocol Length Info
     48 21.738560   10.164.92.154         173.194.40.148        TCP      303    [TCP segment of a reassembled PDU]

Frame 48: 303 bytes on wire (2424 bits), 303 bytes captured (2424 bits)
Linux cooked capture
Internet Protocol Version 4, Src: 10.164.92.154 (10.164.92.154), Dst: 173.194.40.148 (173.194.40.148)
Transmission Control Protocol, Src Port: 60844 (60844), Dst Port: http (80), Seq: 1, Ack: 1, Len: 235

No.     Time        Source                Destination           Protocol Length Info
     49 21.769877   10.164.92.154         173.194.40.148        TCP      1366   [TCP segment of a reassembled PDU]

Frame 49: 1366 bytes on wire (10928 bits), 1366 bytes captured (10928 bits)
Linux cooked capture
Internet Protocol Version 4, Src: 10.164.92.154 (10.164.92.154), Dst: 173.194.40.148 (173.194.40.148)
Transmission Control Protocol, Src Port: 60844 (60844), Dst Port: http (80), Seq: 236, Ack: 1, Len: 1298

No.     Time        Source                Destination           Protocol Length Info
     50 21.770422   10.164.92.154         173.194.40.148        TCP      1366   [TCP segment of a reassembled PDU]

Frame 50: 1366 bytes on wire (10928 bits), 1366 bytes captured (10928 bits)
Linux cooked capture
Internet Protocol Version 4, Src: 10.164.92.154 (10.164.92.154), Dst: 173.194.40.148 (173.194.40.148)
Transmission Control Protocol, Src Port: 60844 (60844), Dst Port: http (80), Seq: 1534, Ack: 1, Len: 1298

No.     Time        Source                Destination           Protocol Length Info
     51 22.034028   173.194.40.148        10.164.92.154         TCP      68     http > 60844 [ACK] Seq=1 Ack=236 Win=257004 Len=0 TSval=1531275940 TSecr=1740240

Frame 51: 68 bytes on wire (544 bits), 68 bytes captured (544 bits)
Linux cooked capture
Internet Protocol Version 4, Src: 173.194.40.148 (173.194.40.148), Dst: 10.164.92.154 (10.164.92.154)
Transmission Control Protocol, Src Port: http (80), Dst Port: 60844 (60844), Seq: 1, Ack: 236, Len: 0

No.     Time        Source                Destination           Protocol Length Info
     52 22.069748   10.164.92.154         173.194.40.148        HTTP     803    POST /m/appreq/vs HTTP/1.1  (application/binary)

Frame 52: 803 bytes on wire (6424 bits), 803 bytes captured (6424 bits)
Linux cooked capture
Internet Protocol Version 4, Src: 10.164.92.154 (10.164.92.154), Dst: 173.194.40.148 (173.194.40.148)
Transmission Control Protocol, Src Port: 60844 (60844), Dst Port: http (80), Seq: 2832, Ack: 1, Len: 735
[5 Reassembled TCP Segments (3566 bytes): #48(235), #49(1298), #53(1298), #50(1298), #52(735)]
Hypertext Transfer Protocol
Media Type

No.     Time        Source                Destination           Protocol Length Info
     53 22.659657   10.164.92.154         173.194.40.148        TCP      1366   [TCP Retransmission] [TCP segment of a reassembled PDU]

Frame 53: 1366 bytes on wire (10928 bits), 1366 bytes captured (10928 bits)
Linux cooked capture
Internet Protocol Version 4, Src: 10.164.92.154 (10.164.92.154), Dst: 173.194.40.148 (173.194.40.148)
Transmission Control Protocol, Src Port: 60844 (60844), Dst Port: http (80), Seq: 236, Ack: 1, Len: 1298

No.     Time        Source                Destination           Protocol Length Info
     54 22.764167   173.194.40.148        10.164.92.154         TCP      68     http > 60844 [ACK] Seq=1 Ack=1534 Win=255704 Len=0 TSval=1531276012 TSecr=1740244

Frame 54: 68 bytes on wire (544 bits), 68 bytes captured (544 bits)
Linux cooked capture
Internet Protocol Version 4, Src: 173.194.40.148 (173.194.40.148), Dst: 10.164.92.154 (10.164.92.154)
Transmission Control Protocol, Src Port: http (80), Dst Port: 60844 (60844), Seq: 1, Ack: 1534, Len: 0

No.     Time        Source                Destination           Protocol Length Info
     55 22.852182   10.164.92.154         173.194.40.148        TCP      76     49804 > http [SYN] Seq=0 Win=5240 Len=0 MSS=1310 SACK_PERM=1 TSval=1740352 TSecr=0 WS=4

Frame 55: 76 bytes on wire (608 bits), 76 bytes captured (608 bits)
Linux cooked capture
Internet Protocol Version 4, Src: 10.164.92.154 (10.164.92.154), Dst: 173.194.40.148 (173.194.40.148)
Transmission Control Protocol, Src Port: 49804 (49804), Dst Port: http (80), Seq: 0, Len: 0

No.     Time        Source                Destination           Protocol Length Info
     56 22.970323   10.164.92.154         108.168.176.195       SSL      123    Continuation Data

Frame 56: 123 bytes on wire (984 bits), 123 bytes captured (984 bits)
Linux cooked capture
Internet Protocol Version 4, Src: 10.164.92.154 (10.164.92.154), Dst: 108.168.176.195 (108.168.176.195)
Transmission Control Protocol, Src Port: 41741 (41741), Dst Port: https (443), Seq: 229, Ack: 505, Len: 55
Secure Sockets Layer

No.     Time        Source                Destination           Protocol Length Info
     57 23.174260   10.164.92.154         83.224.70.77          DNS      88     Standard query 0x97ea  A android.clients.google.com

Frame 57: 88 bytes on wire (704 bits), 88 bytes captured (704 bits)
Linux cooked capture
Internet Protocol Version 4, Src: 10.164.92.154 (10.164.92.154), Dst: 83.224.70.77 (83.224.70.77)
User Datagram Protocol, Src Port: 39809 (39809), Dst Port: domain (53)
Domain Name System (query)

No.     Time        Source                Destination           Protocol Length Info
     58 23.494045   173.194.40.148        10.164.92.154         TCP      68     http > 60844 [FIN, ACK] Seq=1 Ack=2832 Win=257004 Len=0 TSval=1531276086 TSecr=1740244

Frame 58: 68 bytes on wire (544 bits), 68 bytes captured (544 bits)
Linux cooked capture
Internet Protocol Version 4, Src: 173.194.40.148 (173.194.40.148), Dst: 10.164.92.154 (10.164.92.154)
Transmission Control Protocol, Src Port: http (80), Dst Port: 60844 (60844), Seq: 1, Ack: 2832, Len: 0

No.     Time        Source                Destination           Protocol Length Info
     59 23.509672   10.164.92.154         173.194.40.148        TCP      68     60844 > http [ACK] Seq=3567 Ack=2 Win=5240 Len=0 TSval=1740418 TSecr=1531276086

Frame 59: 68 bytes on wire (544 bits), 68 bytes captured (544 bits)
Linux cooked capture
Internet Protocol Version 4, Src: 10.164.92.154 (10.164.92.154), Dst: 173.194.40.148 (173.194.40.148)
Transmission Control Protocol, Src Port: 60844 (60844), Dst Port: http (80), Seq: 3567, Ack: 2, Len: 0

No.     Time        Source                Destination           Protocol Length Info
     60 23.874043   173.194.40.148        10.164.92.154         TCP      56     http > 60844 [RST] Seq=2 Win=257004 Len=0

Frame 60: 56 bytes on wire (448 bits), 56 bytes captured (448 bits)
Linux cooked capture
Internet Protocol Version 4, Src: 173.194.40.148 (173.194.40.148), Dst: 10.164.92.154 (10.164.92.154)
Transmission Control Protocol, Src Port: http (80), Dst Port: 60844 (60844), Seq: 2, Len: 0

No.     Time        Source                Destination           Protocol Length Info
     61 24.173648   10.164.92.154         173.194.40.148        TCP      76     53578 > http [SYN] Seq=0 Win=5240 Len=0 MSS=1310 SACK_PERM=1 TSval=1740484 TSecr=0 WS=4

Frame 61: 76 bytes on wire (608 bits), 76 bytes captured (608 bits)
Linux cooked capture
Internet Protocol Version 4, Src: 10.164.92.154 (10.164.92.154), Dst: 173.194.40.148 (173.194.40.148)
Transmission Control Protocol, Src Port: 53578 (53578), Dst Port: http (80), Seq: 0, Len: 0

No.     Time        Source                Destination           Protocol Length Info
     62 24.554100   173.194.40.148        10.164.92.154         TCP      56     http > 60844 [RST] Seq=1 Win=0 Len=0

Frame 62: 56 bytes on wire (448 bits), 56 bytes captured (448 bits)
Linux cooked capture
Internet Protocol Version 4, Src: 173.194.40.148 (173.194.40.148), Dst: 10.164.92.154 (10.164.92.154)
Transmission Control Protocol, Src Port: http (80), Dst Port: 60844 (60844), Seq: 1, Len: 0

No.     Time        Source                Destination           Protocol Length Info
     63 24.604022   173.194.40.148        10.164.92.154         TCP      80     http > 49804 [SYN, ACK] Seq=0 Ack=1 Win=64251 Len=0 TSval=1531276196 TSecr=1740352 MSS=1400 WS=4 SACK_PERM=1

Frame 63: 80 bytes on wire (640 bits), 80 bytes captured (640 bits)
Linux cooked capture
Internet Protocol Version 4, Src: 173.194.40.148 (173.194.40.148), Dst: 10.164.92.154 (10.164.92.154)
Transmission Control Protocol, Src Port: http (80), Dst Port: 49804 (49804), Seq: 0, Ack: 1, Len: 0

No.     Time        Source                Destination           Protocol Length Info
     64 24.604283   10.164.92.154         173.194.40.148        TCP      68     49804 > http [ACK] Seq=1 Ack=1 Win=5240 Len=0 TSval=1740527 TSecr=1531276196

Frame 64: 68 bytes on wire (544 bits), 68 bytes captured (544 bits)
Linux cooked capture
Internet Protocol Version 4, Src: 10.164.92.154 (10.164.92.154), Dst: 173.194.40.148 (173.194.40.148)
Transmission Control Protocol, Src Port: 49804 (49804), Dst Port: http (80), Seq: 1, Ack: 1, Len: 0

No.     Time        Source                Destination           Protocol Length Info
     65 24.605917   10.164.92.154         173.194.40.148        TCP      302    [TCP segment of a reassembled PDU]

Frame 65: 302 bytes on wire (2416 bits), 302 bytes captured (2416 bits)
Linux cooked capture
Internet Protocol Version 4, Src: 10.164.92.154 (10.164.92.154), Dst: 173.194.40.148 (173.194.40.148)
Transmission Control Protocol, Src Port: 49804 (49804), Dst Port: http (80), Seq: 1, Ack: 1, Len: 234

No.     Time        Source                Destination           Protocol Length Info
     66 24.714010   173.194.40.148        10.164.92.154         TCP      56     http > 60844 [RST] Seq=2 Win=0 Len=0

Frame 66: 56 bytes on wire (448 bits), 56 bytes captured (448 bits)
Linux cooked capture
Internet Protocol Version 4, Src: 173.194.40.148 (173.194.40.148), Dst: 10.164.92.154 (10.164.92.154)
Transmission Control Protocol, Src Port: http (80), Dst Port: 60844 (60844), Seq: 2, Len: 0

No.     Time        Source                Destination           Protocol Length Info
     67 24.724147   83.224.70.77          10.164.92.154         DNS      288    Standard query response 0x97ea  CNAME android.l.google.com A 173.194.35.160 A 173.194.35.167 A 173.194.35.166 A 173.194.35.174 A 173.194.35.169 A 173.194.35.165 A 173.194.35.163 A 173.194.35.164 A 173.194.35.161 A 173.194.35.168 A 173.194.35.162

Frame 67: 288 bytes on wire (2304 bits), 288 bytes captured (2304 bits)
Linux cooked capture
Internet Protocol Version 4, Src: 83.224.70.77 (83.224.70.77), Dst: 10.164.92.154 (10.164.92.154)
User Datagram Protocol, Src Port: domain (53), Dst Port: 39809 (39809)
Domain Name System (response)

No.     Time        Source                Destination           Protocol Length Info
     68 24.727277   10.164.92.154         173.194.35.160        TCP      76     50662 > https [SYN] Seq=0 Win=5240 Len=0 MSS=1310 SACK_PERM=1 TSval=1740539 TSecr=0 WS=4

Frame 68: 76 bytes on wire (608 bits), 76 bytes captured (608 bits)
Linux cooked capture
Internet Protocol Version 4, Src: 10.164.92.154 (10.164.92.154), Dst: 173.194.35.160 (173.194.35.160)
Transmission Control Protocol, Src Port: 50662 (50662), Dst Port: https (443), Seq: 0, Len: 0

No.     Time        Source                Destination           Protocol Length Info
     69 24.754017   108.168.176.195       10.164.92.154         SSL      101    Continuation Data

Frame 69: 101 bytes on wire (808 bits), 101 bytes captured (808 bits)
Linux cooked capture
Internet Protocol Version 4, Src: 108.168.176.195 (108.168.176.195), Dst: 10.164.92.154 (10.164.92.154)
Transmission Control Protocol, Src Port: https (443), Dst Port: 41741 (41741), Seq: 505, Ack: 284, Len: 33
Secure Sockets Layer

No.     Time        Source                Destination           Protocol Length Info
     70 24.754370   10.164.92.154         108.168.176.195       SSL      110    Continuation Data

Frame 70: 110 bytes on wire (880 bits), 110 bytes captured (880 bits)
Linux cooked capture
Internet Protocol Version 4, Src: 10.164.92.154 (10.164.92.154), Dst: 108.168.176.195 (108.168.176.195)
Transmission Control Protocol, Src Port: 41741 (41741), Dst Port: https (443), Seq: 284, Ack: 538, Len: 42
Secure Sockets Layer

No.     Time        Source                Destination           Protocol Length Info
     71 24.794005   173.194.40.148        10.164.92.154         TCP      80     http > 53578 [SYN, ACK] Seq=0 Ack=1 Win=64251 Len=0 TSval=1531276216 TSecr=1740484 MSS=1400 WS=4 SACK_PERM=1

Frame 71: 80 bytes on wire (640 bits), 80 bytes captured (640 bits)
Linux cooked capture
Internet Protocol Version 4, Src: 173.194.40.148 (173.194.40.148), Dst: 10.164.92.154 (10.164.92.154)
Transmission Control Protocol, Src Port: http (80), Dst Port: 53578 (53578), Seq: 0, Ack: 1, Len: 0

No.     Time        Source                Destination           Protocol Length Info
     72 24.794275   10.164.92.154         173.194.40.148        TCP      68     53578 > http [ACK] Seq=1 Ack=1 Win=5240 Len=0 TSval=1740546 TSecr=1531276216

Frame 72: 68 bytes on wire (544 bits), 68 bytes captured (544 bits)
Linux cooked capture
Internet Protocol Version 4, Src: 10.164.92.154 (10.164.92.154), Dst: 173.194.40.148 (173.194.40.148)
Transmission Control Protocol, Src Port: 53578 (53578), Dst Port: http (80), Seq: 1, Ack: 1, Len: 0

No.     Time        Source                Destination           Protocol Length Info
     73 24.795893   10.164.92.154         173.194.40.148        TCP      302    [TCP segment of a reassembled PDU]

Frame 73: 302 bytes on wire (2416 bits), 302 bytes captured (2416 bits)
Linux cooked capture
Internet Protocol Version 4, Src: 10.164.92.154 (10.164.92.154), Dst: 173.194.40.148 (173.194.40.148)
Transmission Control Protocol, Src Port: 53578 (53578), Dst Port: http (80), Seq: 1, Ack: 1, Len: 234

No.     Time        Source                Destination           Protocol Length Info
     74 24.994038   173.194.40.148        10.164.92.154         TCP      68     http > 49804 [ACK] Seq=1 Ack=235 Win=257004 Len=0 TSval=1531276236 TSecr=1740527

Frame 74: 68 bytes on wire (544 bits), 68 bytes captured (544 bits)
Linux cooked capture
Internet Protocol Version 4, Src: 173.194.40.148 (173.194.40.148), Dst: 10.164.92.154 (10.164.92.154)
Transmission Control Protocol, Src Port: http (80), Dst Port: 49804 (49804), Seq: 1, Ack: 235, Len: 0

No.     Time        Source                Destination           Protocol Length Info
     75 24.994393   10.164.92.154         173.194.40.148        HTTP     183    POST /m/appreq/vs HTTP/1.1  (application/binary)

Frame 75: 183 bytes on wire (1464 bits), 183 bytes captured (1464 bits)
Linux cooked capture
Internet Protocol Version 4, Src: 10.164.92.154 (10.164.92.154), Dst: 173.194.40.148 (173.194.40.148)
Transmission Control Protocol, Src Port: 49804 (49804), Dst Port: http (80), Seq: 235, Ack: 1, Len: 115
[2 Reassembled TCP Segments (349 bytes): #65(234), #75(115)]
Hypertext Transfer Protocol
Media Type

