No.     Time        Source                Destination           Protocol Length Info
      1 0.000000    192.168.1.101         173.194.70.188        TCP      74     40830 > hpvroom [SYN] Seq=0 Win=5840 Len=0 MSS=1460 SACK_PERM=1 TSval=33914 TSecr=0 WS=8

Frame 1: 74 bytes on wire (592 bits), 74 bytes captured (592 bits)
Ethernet II, Src: aa:aa:03:00:00:00 (aa:aa:03:00:00:00), Dst: 1b:24:63:41:00:44 (1b:24:63:41:00:44)
Internet Protocol Version 4, Src: 192.168.1.101 (192.168.1.101), Dst: 173.194.70.188 (173.194.70.188)
Transmission Control Protocol, Src Port: 40830 (40830), Dst Port: hpvroom (5228), Seq: 0, Len: 0

No.     Time        Source                Destination           Protocol Length Info
      2 1.301105    173.194.70.188        192.168.1.101         TCP      74     hpvroom > 40830 [SYN, ACK] Seq=0 Ack=1 Win=42540 Len=0 MSS=1430 SACK_PERM=1 TSval=2863532196 TSecr=33914 WS=64

Frame 2: 74 bytes on wire (592 bits), 74 bytes captured (592 bits)
Ethernet II, Src: FonTechn_a5:e9:80 (00:18:84:a5:e9:80), Dst: SamsungE_24:63:41 (cc:05:1b:24:63:41)
Internet Protocol Version 4, Src: 173.194.70.188 (173.194.70.188), Dst: 192.168.1.101 (192.168.1.101)
Transmission Control Protocol, Src Port: hpvroom (5228), Dst Port: 40830 (40830), Seq: 0, Ack: 1, Len: 0

No.     Time        Source                Destination           Protocol Length Info
      3 1.301615    192.168.1.101         173.194.70.188        TCP      66     40830 > hpvroom [ACK] Seq=1 Ack=1 Win=5840 Len=0 TSval=34044 TSecr=2863532196

Frame 3: 66 bytes on wire (528 bits), 66 bytes captured (528 bits)
Ethernet II, Src: aa:aa:03:00:00:00 (aa:aa:03:00:00:00), Dst: 1b:24:63:41:00:3c (1b:24:63:41:00:3c)
Internet Protocol Version 4, Src: 192.168.1.101 (192.168.1.101), Dst: 173.194.70.188 (173.194.70.188)
Transmission Control Protocol, Src Port: 40830 (40830), Dst Port: hpvroom (5228), Seq: 1, Ack: 1, Len: 0

No.     Time        Source                Destination           Protocol Length Info
      4 1.302523    173.194.70.188        192.168.1.101         TCP      74     hpvroom > 40830 [SYN, ACK] Seq=0 Ack=1 Win=42540 Len=0 MSS=1430 SACK_PERM=1 TSval=2863532581 TSecr=33914 WS=64

Frame 4: 74 bytes on wire (592 bits), 74 bytes captured (592 bits)
Ethernet II, Src: FonTechn_a5:e9:80 (00:18:84:a5:e9:80), Dst: SamsungE_24:63:41 (cc:05:1b:24:63:41)
Internet Protocol Version 4, Src: 173.194.70.188 (173.194.70.188), Dst: 192.168.1.101 (192.168.1.101)
Transmission Control Protocol, Src Port: hpvroom (5228), Dst Port: 40830 (40830), Seq: 0, Ack: 1, Len: 0

No.     Time        Source                Destination           Protocol Length Info
      5 1.302743    192.168.1.101         173.194.70.188        TCP      78     [TCP Dup ACK 3#1] 40830 > hpvroom [ACK] Seq=1 Ack=1 Win=5840 Len=0 TSval=34044 TSecr=2863532581 SLE=0 SRE=1

Frame 5: 78 bytes on wire (624 bits), 78 bytes captured (624 bits)
Ethernet II, Src: aa:aa:03:00:00:00 (aa:aa:03:00:00:00), Dst: 1b:24:63:41:00:48 (1b:24:63:41:00:48)
Internet Protocol Version 4, Src: 192.168.1.101 (192.168.1.101), Dst: 173.194.70.188 (173.194.70.188)
Transmission Control Protocol, Src Port: 40830 (40830), Dst Port: hpvroom (5228), Seq: 1, Ack: 1, Len: 0

No.     Time        Source                Destination           Protocol Length Info
      6 1.721558    192.168.1.101         88.149.128.12         DNS      76     Standard query 0xde0d  A e15.whatsapp.net

Frame 6: 76 bytes on wire (608 bits), 76 bytes captured (608 bits)
Ethernet II, Src: aa:aa:03:00:00:00 (aa:aa:03:00:00:00), Dst: 1b:24:63:41:00:46 (1b:24:63:41:00:46)
Internet Protocol Version 4, Src: 192.168.1.101 (192.168.1.101), Dst: 88.149.128.12 (88.149.128.12)
User Datagram Protocol, Src Port: 41485 (41485), Dst Port: domain (53)
Domain Name System (query)

No.     Time        Source                Destination           Protocol Length Info
      7 2.025362    192.168.1.101         173.194.70.188        TCP      146    40830 > hpvroom [PSH, ACK] Seq=1 Ack=1 Win=5840 Len=80 TSval=34117 TSecr=2863532581

Frame 7: 146 bytes on wire (1168 bits), 146 bytes captured (1168 bits)
Ethernet II, Src: aa:aa:03:00:00:00 (aa:aa:03:00:00:00), Dst: 1b:24:63:41:00:8c (1b:24:63:41:00:8c)
Internet Protocol Version 4, Src: 192.168.1.101 (192.168.1.101), Dst: 173.194.70.188 (173.194.70.188)
Transmission Control Protocol, Src Port: 40830 (40830), Dst Port: hpvroom (5228), Seq: 1, Ack: 1, Len: 80
Data (80 bytes)

0000  16 03 01 00 4b 01 00 00 47 03 01 53 85 6f ae 1e   ....K...G..S.o..
0010  4d b0 1e a1 98 8b ce 31 5b 2f 83 c5 ed 04 b5 25   M......1[/.....%
0020  86 af 6f 58 92 05 ad fc 15 94 94 00 00 20 00 04   ..oX......... ..
0030  00 05 00 2f 00 33 00 32 00 0a 00 16 00 13 00 09   .../.3.2........
0040  00 15 00 12 00 03 00 08 00 14 00 11 00 ff 01 00   ................

No.     Time        Source                Destination           Protocol Length Info
      8 2.119613    88.149.128.12         192.168.1.101         DNS      287    Standard query response 0xde0d  A 108.168.176.252 A 108.168.176.248 A 108.168.176.246 A 108.168.176.245 A 108.168.176.251 A 184.173.179.39 A 108.168.176.250 A 108.168.176.249

Frame 8: 287 bytes on wire (2296 bits), 287 bytes captured (2296 bits)
Ethernet II, Src: FonTechn_a5:e9:80 (00:18:84:a5:e9:80), Dst: SamsungE_24:63:41 (cc:05:1b:24:63:41)
Internet Protocol Version 4, Src: 88.149.128.12 (88.149.128.12), Dst: 192.168.1.101 (192.168.1.101)
User Datagram Protocol, Src Port: domain (53), Dst Port: 41485 (41485)
Domain Name System (response)

No.     Time        Source                Destination           Protocol Length Info
      9 2.120483    198.232.124.224       192.168.1.101         TCP      66     http > 43770 [FIN, ACK] Seq=1 Ack=1 Win=59 Len=0 TSval=2960442885 TSecr=33715

Frame 9: 66 bytes on wire (528 bits), 66 bytes captured (528 bits)
Ethernet II, Src: FonTechn_a5:e9:80 (00:18:84:a5:e9:80), Dst: SamsungE_24:63:41 (cc:05:1b:24:63:41)
Internet Protocol Version 4, Src: 198.232.124.224 (198.232.124.224), Dst: 192.168.1.101 (192.168.1.101)
Transmission Control Protocol, Src Port: http (80), Dst Port: 43770 (43770), Seq: 1, Ack: 1, Len: 0

No.     Time        Source                Destination           Protocol Length Info
     10 2.140352    173.194.70.188        192.168.1.101         TCP      66     hpvroom > 40830 [ACK] Seq=1 Ack=81 Win=42560 Len=0 TSval=2863534241 TSecr=34117

Frame 10: 66 bytes on wire (528 bits), 66 bytes captured (528 bits)
Ethernet II, Src: FonTechn_a5:e9:80 (00:18:84:a5:e9:80), Dst: SamsungE_24:63:41 (cc:05:1b:24:63:41)
Internet Protocol Version 4, Src: 173.194.70.188 (173.194.70.188), Dst: 192.168.1.101 (192.168.1.101)
Transmission Control Protocol, Src Port: hpvroom (5228), Dst Port: 40830 (40830), Seq: 1, Ack: 81, Len: 0

No.     Time        Source                Destination           Protocol Length Info
     11 2.141592    173.194.70.188        192.168.1.101         TCP      1484   hpvroom > 40830 [ACK] Seq=1 Ack=81 Win=42560 Len=1418 TSval=2863534241 TSecr=34117

Frame 11: 1484 bytes on wire (11872 bits), 1484 bytes captured (11872 bits)
Ethernet II, Src: FonTechn_a5:e9:80 (00:18:84:a5:e9:80), Dst: SamsungE_24:63:41 (cc:05:1b:24:63:41)
Internet Protocol Version 4, Src: 173.194.70.188 (173.194.70.188), Dst: 192.168.1.101 (192.168.1.101)
Transmission Control Protocol, Src Port: hpvroom (5228), Dst Port: 40830 (40830), Seq: 1, Ack: 81, Len: 1418
Data (1418 bytes)

0000  16 03 01 00 51 02 00 00 4d 03 01 53 85 6f ab 10   ....Q...M..S.o..
0010  2e c3 a1 e0 73 c0 5a 68 d3 b6 d2 6c a7 3b 76 63   ....s.Zh...l.;vc
0020  1f 34 f9 61 c4 ee 4e a4 7c d0 35 20 fc 60 ba 1d   .4.a..N.|.5 .`..
0030  07 fa f8 c6 de 72 5b dc d5 42 0b a8 c1 47 af 2d   .....r[..B...G.-
0040  c7 24 b6 47 0f a2 93 6f 2d 6a 53 04 00 05 00 00   .$.G...o-jS.....
0050  05 ff 01 00 01 00 16 03 01 0e dc 0b 00 0e d8 00   ................
0060  0e d5 00 07 43 30 82 07 3f 30 82 06 27 a0 03 02   ....C0..?0..'...
0070  01 02 02 08 1d da 37 08 d5 95 4c 9c 30 0d 06 09   ......7...L.0...
0080  2a 86 48 86 f7 0d 01 01 05 05 00 30 49 31 0b 30   *.H........0I1.0
0090  09 06 03 55 04 06 13 02 55 53 31 13 30 11 06 03   ...U....US1.0...
00a0  55 04 0a 13 0a 47 6f 6f 67 6c 65 20 49 6e 63 31   U....Google Inc1
00b0  25 30 23 06 03 55 04 03 13 1c 47 6f 6f 67 6c 65   %0#..U....Google
00c0  20 49 6e 74 65 72 6e 65 74 20 41 75 74 68 6f 72    Internet Author
00d0  69 74 79 20 47 32 30 1e 17 0d 31 34 30 35 32 32   ity G20...140522
00e0  31 32 30 33 33 39 5a 17 0d 31 34 30 38 32 30 30   120339Z..1408200
00f0  30 30 30 30 30 5a 30 66 31 0b 30 09 06 03 55 04   00000Z0f1.0...U.
0100  06 13 02 55 53 31 13 30 11 06 03 55 04 08 0c 0a   ...US1.0...U....
0110  43 61 6c 69 66 6f 72 6e 69 61 31 16 30 14 06 03   California1.0...
0120  55 04 07 0c 0d 4d 6f 75 6e 74 61 69 6e 20 56 69   U....Mountain Vi
0130  65 77 31 13 30 11 06 03 55 04 0a 0c 0a 47 6f 6f   ew1.0...U....Goo
0140  67 6c 65 20 49 6e 63 31 15 30 13 06 03 55 04 03   gle Inc1.0...U..
0150  0c 0c 2a 2e 67 6f 6f 67 6c 65 2e 63 6f 6d 30 82   ..*.google.com0.
0160  01 22 30 0d 06 09 2a 86 48 86 f7 0d 01 01 01 05   ."0...*.H.......
0170  00 03 82 01 0f 00 30 82 01 0a 02 82 01 01 00 82   ......0.........
0180  3a 86 4a cb 3f 84 c4 bb 56 c4 10 67 e9 f3 e5 1c   :.J.?...V..g....
0190  93 7e 78 10 e5 c4 51 a1 c5 85 59 4f b9 b7 36 9e   .~x...Q...YO..6.
01a0  4a 66 4e ef d6 ba 66 f2 ce c7 d3 88 50 a5 7b 61   JfN...f.....P.{a
01b0  22 43 e3 53 ed 91 2f ef 33 f8 01 2b 91 ec 0a 58   "C.S../.3..+...X
01c0  66 79 8e 66 ed eb d0 71 d6 64 e8 2f 3f 90 9d 34   fy.f...q.d./?..4
01d0  4a e1 27 d1 e6 9e 7c f4 d4 25 52 29 41 11 d6 c0   J.'...|..%R)A...
01e0  ff c0 d4 37 b9 ed 3f 3a 76 49 65 ea 88 14 f0 44   ...7..?:vIe....D
01f0  8a f3 12 ff 7b 72 28 38 84 07 78 d0 07 d6 38 1a   ....{r(8..x...8.
0200  e8 9b ce a6 d5 ac ff 11 5e e6 30 e5 21 94 ba 10   ........^.0.!...
0210  6b 19 29 53 46 cd 86 cc 28 9f e1 b5 60 a8 96 5c   k.)SF...(...`..\
0220  f1 f9 95 3c fc 08 2e 7f 83 cf 49 96 33 a1 5d 4f   ...<......I.3.]O
0230  61 62 03 6f 49 8b e4 a9 32 82 d3 c8 3f 9b eb 5e   ab.oI...2...?..^
0240  7b f5 2c 22 f6 f7 e0 6f e8 24 61 b3 56 d3 57 e0   {.,"...o.$a.V.W.
0250  ff 65 02 94 b6 89 fe 96 47 9e 72 69 48 9b bd 60   .e......G.riH..`
0260  28 df 83 c3 ba 79 52 d2 1e 09 e2 98 74 7c 19 c8   (....yR.....t|..
0270  0b a9 8b c4 06 b1 dd e3 c8 fe 3b 0b 90 b6 97 02   ..........;.....
0280  03 01 00 01 a3 82 04 0c 30 82 04 08 30 1d 06 03   ........0...0...
0290  55 1d 25 04 16 30 14 06 08 2b 06 01 05 05 07 03   U.%..0...+......
02a0  01 06 08 2b 06 01 05 05 07 03 02 30 82 02 e2 06   ...+.......0....
02b0  03 55 1d 11 04 82 02 d9 30 82 02 d5 82 0c 2a 2e   .U......0.....*.
02c0  67 6f 6f 67 6c 65 2e 63 6f 6d 82 0d 2a 2e 61 6e   google.com..*.an
02d0  64 72 6f 69 64 2e 63 6f 6d 82 16 2a 2e 61 70 70   droid.com..*.app
02e0  65 6e 67 69 6e 65 2e 67 6f 6f 67 6c 65 2e 63 6f   engine.google.co
02f0  6d 82 12 2a 2e 63 6c 6f 75 64 2e 67 6f 6f 67 6c   m..*.cloud.googl
0300  65 2e 63 6f 6d 82 16 2a 2e 67 6f 6f 67 6c 65 2d   e.com..*.google-
0310  61 6e 61 6c 79 74 69 63 73 2e 63 6f 6d 82 0b 2a   analytics.com..*
0320  2e 67 6f 6f 67 6c 65 2e 63 61 82 0b 2a 2e 67 6f   .google.ca..*.go
0330  6f 67 6c 65 2e 63 6c 82 0e 2a 2e 67 6f 6f 67 6c   ogle.cl..*.googl
0340  65 2e 63 6f 2e 69 6e 82 0e 2a 2e 67 6f 6f 67 6c   e.co.in..*.googl
0350  65 2e 63 6f 2e 6a 70 82 0e 2a 2e 67 6f 6f 67 6c   e.co.jp..*.googl
0360  65 2e 63 6f 2e 75 6b 82 0f 2a 2e 67 6f 6f 67 6c   e.co.uk..*.googl
0370  65 2e 63 6f 6d 2e 61 72 82 0f 2a 2e 67 6f 6f 67   e.com.ar..*.goog
0380  6c 65 2e 63 6f 6d 2e 61 75 82 0f 2a 2e 67 6f 6f   le.com.au..*.goo
0390  67 6c 65 2e 63 6f 6d 2e 62 72 82 0f 2a 2e 67 6f   gle.com.br..*.go
03a0  6f 67 6c 65 2e 63 6f 6d 2e 63 6f 82 0f 2a 2e 67   ogle.com.co..*.g
03b0  6f 6f 67 6c 65 2e 63 6f 6d 2e 6d 78 82 0f 2a 2e   oogle.com.mx..*.
03c0  67 6f 6f 67 6c 65 2e 63 6f 6d 2e 74 72 82 0f 2a   google.com.tr..*
03d0  2e 67 6f 6f 67 6c 65 2e 63 6f 6d 2e 76 6e 82 0b   .google.com.vn..
03e0  2a 2e 67 6f 6f 67 6c 65 2e 64 65 82 0b 2a 2e 67   *.google.de..*.g
03f0  6f 6f 67 6c 65 2e 65 73 82 0b 2a 2e 67 6f 6f 67   oogle.es..*.goog
0400  6c 65 2e 66 72 82 0b 2a 2e 67 6f 6f 67 6c 65 2e   le.fr..*.google.
0410  68 75 82 0b 2a 2e 67 6f 6f 67 6c 65 2e 69 74 82   hu..*.google.it.
0420  0b 2a 2e 67 6f 6f 67 6c 65 2e 6e 6c 82 0b 2a 2e   .*.google.nl..*.
0430  67 6f 6f 67 6c 65 2e 70 6c 82 0b 2a 2e 67 6f 6f   google.pl..*.goo
0440  67 6c 65 2e 70 74 82 0f 2a 2e 67 6f 6f 67 6c 65   gle.pt..*.google
0450  61 70 69 73 2e 63 6e 82 14 2a 2e 67 6f 6f 67 6c   apis.cn..*.googl
0460  65 63 6f 6d 6d 65 72 63 65 2e 63 6f 6d 82 11 2a   ecommerce.com..*
0470  2e 67 6f 6f 67 6c 65 76 69 64 65 6f 2e 63 6f 6d   .googlevideo.com
0480  82 0d 2a 2e 67 73 74 61 74 69 63 2e 63 6f 6d 82   ..*.gstatic.com.
0490  0a 2a 2e 67 76 74 31 2e 63 6f 6d 82 0c 2a 2e 75   .*.gvt1.com..*.u
04a0  72 63 68 69 6e 2e 63 6f 6d 82 10 2a 2e 75 72 6c   rchin.com..*.url
04b0  2e 67 6f 6f 67 6c 65 2e 63 6f 6d 82 16 2a 2e 79   .google.com..*.y
04c0  6f 75 74 75 62 65 2d 6e 6f 63 6f 6f 6b 69 65 2e   outube-nocookie.
04d0  63 6f 6d 82 0d 2a 2e 79 6f 75 74 75 62 65 2e 63   com..*.youtube.c
04e0  6f 6d 82 16 2a 2e 79 6f 75 74 75 62 65 65 64 75   om..*.youtubeedu
04f0  63 61 74 69 6f 6e 2e 63 6f 6d 82 0b 2a 2e 79 74   cation.com..*.yt
0500  69 6d 67 2e 63 6f 6d 82 0b 61 6e 64 72 6f 69 64   img.com..android
0510  2e 63 6f 6d 82 04 67 2e 63 6f 82 06 67 6f 6f 2e   .com..g.co..goo.
0520  67 6c 82 14 67 6f 6f 67 6c 65 2d 61 6e 61 6c 79   gl..google-analy
0530  74 69 63 73 2e 63 6f 6d 82 0a 67 6f 6f 67 6c 65   tics.com..google
0540  2e 63 6f 6d 82 12 67 6f 6f 67 6c 65 63 6f 6d 6d   .com..googlecomm
0550  65 72 63 65 2e 63 6f 6d 82 0a 75 72 63 68 69 6e   erce.com..urchin
0560  2e 63 6f 6d 82 08 79 6f 75 74 75 2e 62 65 82 0b   .com..youtu.be..
0570  79 6f 75 74 75 62 65 2e 63 6f 6d 82 14 79 6f 75   youtube.com..you
0580  74 75 62 65 65 64 75 63 61 74                     tubeeducat

No.     Time        Source                Destination           Protocol Length Info
     12 2.141863    192.168.1.101         173.194.70.188        TCP      66     40830 > hpvroom [ACK] Seq=81 Ack=1419 Win=8736 Len=0 TSval=34128 TSecr=2863534241

Frame 12: 66 bytes on wire (528 bits), 66 bytes captured (528 bits)
Ethernet II, Src: aa:aa:03:00:00:00 (aa:aa:03:00:00:00), Dst: 1b:24:63:41:00:3c (1b:24:63:41:00:3c)
Internet Protocol Version 4, Src: 192.168.1.101 (192.168.1.101), Dst: 173.194.70.188 (173.194.70.188)
Transmission Control Protocol, Src Port: 40830 (40830), Dst Port: hpvroom (5228), Seq: 81, Ack: 1419, Len: 0

No.     Time        Source                Destination           Protocol Length Info
     13 2.142792    173.194.70.188        192.168.1.101         TCP      1484   hpvroom > 40830 [ACK] Seq=1419 Ack=81 Win=42560 Len=1418 TSval=2863534241 TSecr=34117

Frame 13: 1484 bytes on wire (11872 bits), 1484 bytes captured (11872 bits)
Ethernet II, Src: FonTechn_a5:e9:80 (00:18:84:a5:e9:80), Dst: SamsungE_24:63:41 (cc:05:1b:24:63:41)
Internet Protocol Version 4, Src: 173.194.70.188 (173.194.70.188), Dst: 192.168.1.101 (192.168.1.101)
Transmission Control Protocol, Src Port: hpvroom (5228), Dst Port: 40830 (40830), Seq: 1419, Ack: 81, Len: 1418
Data (1418 bytes)

0000  69 6f 6e 2e 63 6f 6d 30 68 06 08 2b 06 01 05 05   ion.com0h..+....
0010  07 01 01 04 5c 30 5a 30 2b 06 08 2b 06 01 05 05   ....\0Z0+..+....
0020  07 30 02 86 1f 68 74 74 70 3a 2f 2f 70 6b 69 2e   .0...http://pki.
0030  67 6f 6f 67 6c 65 2e 63 6f 6d 2f 47 49 41 47 32   google.com/GIAG2
0040  2e 63 72 74 30 2b 06 08 2b 06 01 05 05 07 30 01   .crt0+..+.....0.
0050  86 1f 68 74 74 70 3a 2f 2f 63 6c 69 65 6e 74 73   ..http://clients
0060  31 2e 67 6f 6f 67 6c 65 2e 63 6f 6d 2f 6f 63 73   1.google.com/ocs
0070  70 30 1d 06 03 55 1d 0e 04 16 04 14 5a ac 35 7f   p0...U......Z.5.
0080  7a fe 53 03 33 1e 99 e9 11 8f aa 6f 40 33 fc e0   z.S.3......o@3..
0090  30 0c 06 03 55 1d 13 01 01 ff 04 02 30 00 30 1f   0...U.......0.0.
00a0  06 03 55 1d 23 04 18 30 16 80 14 4a dd 06 16 1b   ..U.#..0...J....
00b0  bc f6 68 b5 76 f5 81 b6 bb 62 1a ba 5a 81 2f 30   ..h.v....b..Z./0
00c0  17 06 03 55 1d 20 04 10 30 0e 30 0c 06 0a 2b 06   ...U. ..0.0...+.
00d0  01 04 01 d6 79 02 05 01 30 30 06 03 55 1d 1f 04   ....y...00..U...
00e0  29 30 27 30 25 a0 23 a0 21 86 1f 68 74 74 70 3a   )0'0%.#.!..http:
00f0  2f 2f 70 6b 69 2e 67 6f 6f 67 6c 65 2e 63 6f 6d   //pki.google.com
0100  2f 47 49 41 47 32 2e 63 72 6c 30 0d 06 09 2a 86   /GIAG2.crl0...*.
0110  48 86 f7 0d 01 01 05 05 00 03 82 01 01 00 17 6a   H..............j
0120  5f e1 1e 35 95 ca a9 f3 a3 3b 61 42 24 e9 24 3a   _..5.....;aB$.$:
0130  0d d3 de 89 7c 03 69 76 44 39 89 c1 03 fe a0 8b   ....|.ivD9......
0140  fd 39 94 63 18 8d 0c fd 1c d8 fa 01 b1 4c 35 01   .9.c.........L5.
0150  18 7a 1a 6c ba 3d 1f f7 a0 0e 82 7b db cc 74 93   .z.l.=.....{..t.
0160  6b 9d 52 e6 6a 24 1c 87 8a 07 13 b8 4e c7 07 d0   k.R.j$......N...
0170  93 01 af 1d e2 e3 fa 58 ff 47 60 e4 4b 65 b0 75   .......X.G`.Ke.u
0180  7c f0 df 04 f1 57 8d 79 cc 83 ad c3 93 48 66 d2   |....W.y.....Hf.
0190  af aa aa 25 0a e1 89 b0 84 59 0d 4a 77 5c 39 a5   ...%.....Y.Jw\9.
01a0  e0 f5 d9 65 d2 da e5 af 30 0f 89 bd 9a 64 a5 94   ...e....0....d..
01b0  25 fb ce 37 e3 67 e4 88 07 1d 27 00 0d 11 37 77   %..7.g....'...7w
01c0  3a 6f 76 27 30 e7 b5 af ea e1 cd 39 78 f3 fe c0   :ov'0......9x...
01d0  ef 04 6d b7 45 43 ff 72 b8 8c bd a5 60 04 26 f2   ..m.EC.r....`.&.
01e0  3c 53 87 a8 0f a2 c8 f6 e3 a3 5d 44 b3 34 b4 cc   <S........]D.4..
01f0  46 68 42 99 15 49 39 2b 0d 0f 4e eb b1 47 6d 68   FhB..I9+..N..Gmh
0200  c5 4b 5a df 1c c8 1a e0 cf 7c b0 fb 6d f2 01 f1   .KZ......|..m...
0210  8e 15 68 13 00 b5 74 c3 a8 80 c1 f7 72 d0 00 04   ..h...t.....r...
0220  08 30 82 04 04 30 82 02 ec a0 03 02 01 02 02 03   .0...0..........
0230  02 3a 69 30 0d 06 09 2a 86 48 86 f7 0d 01 01 05   .:i0...*.H......
0240  05 00 30 42 31 0b 30 09 06 03 55 04 06 13 02 55   ..0B1.0...U....U
0250  53 31 16 30 14 06 03 55 04 0a 13 0d 47 65 6f 54   S1.0...U....GeoT
0260  72 75 73 74 20 49 6e 63 2e 31 1b 30 19 06 03 55   rust Inc.1.0...U
0270  04 03 13 12 47 65 6f 54 72 75 73 74 20 47 6c 6f   ....GeoTrust Glo
0280  62 61 6c 20 43 41 30 1e 17 0d 31 33 30 34 30 35   bal CA0...130405
0290  31 35 31 35 35 35 5a 17 0d 31 35 30 34 30 34 31   151555Z..1504041
02a0  35 31 35 35 35 5a 30 49 31 0b 30 09 06 03 55 04   51555Z0I1.0...U.
02b0  06 13 02 55 53 31 13 30 11 06 03 55 04 0a 13 0a   ...US1.0...U....
02c0  47 6f 6f 67 6c 65 20 49 6e 63 31 25 30 23 06 03   Google Inc1%0#..
02d0  55 04 03 13 1c 47 6f 6f 67 6c 65 20 49 6e 74 65   U....Google Inte
02e0  72 6e 65 74 20 41 75 74 68 6f 72 69 74 79 20 47   rnet Authority G
02f0  32 30 82 01 22 30 0d 06 09 2a 86 48 86 f7 0d 01   20.."0...*.H....
0300  01 01 05 00 03 82 01 0f 00 30 82 01 0a 02 82 01   .........0......
0310  01 00 9c 2a 04 77 5c d8 50 91 3a 06 a3 82 e0 d8   ...*.w\.P.:.....
0320  50 48 bc 89 3f f1 19 70 1a 88 46 7e e0 8f c5 f1   PH..?..p..F~....
0330  89 ce 21 ee 5a fe 61 0d b7 32 44 89 a0 74 0b 53   ..!.Z.a..2D..t.S
0340  4f 55 a4 ce 82 62 95 ee eb 59 5f c6 e1 05 80 12   OU...b...Y_.....
0350  c4 5e 94 3f bc 5b 48 38 f4 53 f7 24 e6 fb 91 e9   .^.?.[H8.S.$....
0360  15 c4 cf f4 53 0d f4 4a fc 9f 54 de 7d be a0 6b   ....S..J..T.}..k
0370  6f 87 c0 d0 50 1f 28 30 03 40 da 08 73 51 6c 7f   o...P.(0.@..sQl.
0380  ff 3a 3c a7 37 06 8e bd 4b 11 04 eb 7d 24 de e6   .:<.7...K...}$..
0390  f9 fc 31 71 fb 94 d5 60 f3 2e 4a af 42 d2 cb ea   ..1q...`..J.B...
03a0  c4 6a 1a b2 cc 53 dd 15 4b 8b 1f c8 19 61 1f cd   .j...S..K....a..
03b0  9d a8 3e 63 2b 84 35 69 65 84 c8 19 c5 46 22 f8   ..>c+.5ie....F".
03c0  53 95 be e3 80 4a 10 c6 2a ec ba 97 20 11 c7 39   S....J..*... ..9
03d0  99 10 04 a0 f0 61 7a 95 25 8c 4e 52 75 e2 b6 ed   .....az.%.NRu...
03e0  08 ca 14 fc ce 22 6a b3 4e cf 46 03 97 97 03 7e   ....."j.N.F....~
03f0  c0 b1 de 7b af 45 33 cf ba 3e 71 b7 de f4 25 25   ...{.E3..>q...%%
0400  c2 0d 35 89 9d 9d fb 0e 11 79 89 1e 37 c5 af 8e   ..5......y..7...
0410  72 69 02 03 01 00 01 a3 81 fb 30 81 f8 30 1f 06   ri........0..0..
0420  03 55 1d 23 04 18 30 16 80 14 c0 7a 98 68 8d 89   .U.#..0....z.h..
0430  fb ab 05 64 0c 11 7d aa 7d 65 b8 ca cc 4e 30 1d   ...d..}.}e...N0.
0440  06 03 55 1d 0e 04 16 04 14 4a dd 06 16 1b bc f6   ..U......J......
0450  68 b5 76 f5 81 b6 bb 62 1a ba 5a 81 2f 30 12 06   h.v....b..Z./0..
0460  03 55 1d 13 01 01 ff 04 08 30 06 01 01 ff 02 01   .U.......0......
0470  00 30 0e 06 03 55 1d 0f 01 01 ff 04 04 03 02 01   .0...U..........
0480  06 30 3a 06 03 55 1d 1f 04 33 30 31 30 2f a0 2d   .0:..U...3010/.-
0490  a0 2b 86 29 68 74 74 70 3a 2f 2f 63 72 6c 2e 67   .+.)http://crl.g
04a0  65 6f 74 72 75 73 74 2e 63 6f 6d 2f 63 72 6c 73   eotrust.com/crls
04b0  2f 67 74 67 6c 6f 62 61 6c 2e 63 72 6c 30 3d 06   /gtglobal.crl0=.
04c0  08 2b 06 01 05 05 07 01 01 04 31 30 2f 30 2d 06   .+........10/0-.
04d0  08 2b 06 01 05 05 07 30 01 86 21 68 74 74 70 3a   .+.....0..!http:
04e0  2f 2f 67 74 67 6c 6f 62 61 6c 2d 6f 63 73 70 2e   //gtglobal-ocsp.
04f0  67 65 6f 74 72 75 73 74 2e 63 6f 6d 30 17 06 03   geotrust.com0...
0500  55 1d 20 04 10 30 0e 30 0c 06 0a 2b 06 01 04 01   U. ..0.0...+....
0510  d6 79 02 05 01 30 0d 06 09 2a 86 48 86 f7 0d 01   .y...0...*.H....
0520  01 05 05 00 03 82 01 01 00 36 d7 06 80 11 27 ad   .........6....'.
0530  2a 14 9b 38 77 b3 23 a0 75 58 bb b1 7e 83 42 ba   *..8w.#.uX..~.B.
0540  72 da 1e d8 8e 36 06 97 e0 f0 95 3b 37 fd 1b 42   r....6.....;7..B
0550  58 fe 22 c8 6b bd 38 5e d1 3b 25 6e 12 eb 5e 67   X.".k.8^.;%n..^g
0560  76 46 40 90 da 14 c8 78 0d ed 95 66 da 8e 86 6f   vF@....x...f...o
0570  80 a1 ba 56 32 95 86 dc dc 6a ca 04 8c 5b 7f f6   ...V2....j...[..
0580  bf cc 6f 85 03 58 c3 68 51 13                     ..o..X.hQ.

No.     Time        Source                Destination           Protocol Length Info
     14 2.143018    192.168.1.101         173.194.70.188        TCP      66     40830 > hpvroom [ACK] Seq=81 Ack=2837 Win=11632 Len=0 TSval=34128 TSecr=2863534241

Frame 14: 66 bytes on wire (528 bits), 66 bytes captured (528 bits)
Ethernet II, Src: aa:aa:03:00:00:00 (aa:aa:03:00:00:00), Dst: 1b:24:63:41:00:3c (1b:24:63:41:00:3c)
Internet Protocol Version 4, Src: 192.168.1.101 (192.168.1.101), Dst: 173.194.70.188 (173.194.70.188)
Transmission Control Protocol, Src Port: 40830 (40830), Dst Port: hpvroom (5228), Seq: 81, Ack: 2837, Len: 0

No.     Time        Source                Destination           Protocol Length Info
     15 2.145408    173.194.70.188        192.168.1.101         TCP      1134   hpvroom > 40830 [PSH, ACK] Seq=2837 Ack=81 Win=42560 Len=1068 TSval=2863534241 TSecr=34117

Frame 15: 1134 bytes on wire (9072 bits), 1134 bytes captured (9072 bits)
Ethernet II, Src: FonTechn_a5:e9:80 (00:18:84:a5:e9:80), Dst: SamsungE_24:63:41 (cc:05:1b:24:63:41)
Internet Protocol Version 4, Src: 173.194.70.188 (173.194.70.188), Dst: 192.168.1.101 (192.168.1.101)
Transmission Control Protocol, Src Port: hpvroom (5228), Dst Port: 40830 (40830), Seq: 2837, Ack: 81, Len: 1068
Data (1068 bytes)

0000  cd fd c8 f7 79 3d 99 35 f0 56 a3 bd e0 59 ed 4f   ....y=.5.V...Y.O
0010  44 09 a3 9e 38 7a f6 46 d1 1d 12 9d 4f be d0 40   D...8z.F....O..@
0020  fc 55 fe 06 5e 3c da 1c 56 bd 96 51 7b 6f 57 2a   .U..^<..V..Q{oW*
0030  db a2 aa 96 dc 8c 74 c2 95 be f0 6e 95 13 ff 17   ......t....n....
0040  f0 3c ac b2 10 8d cc 73 fb e8 8f 02 c6 f0 fb 33   .<.....s.......3
0050  b3 95 3b e3 c2 cb 68 58 73 db a8 24 62 3b 06 35   ..;...hXs..$b;.5
0060  9d 0d a9 33 bd 78 03 90 2e 4c 78 5d 50 3a 81 d4   ...3.x...Lx]P:..
0070  ee a0 c8 70 38 dc b2 f9 67 fa 87 40 5d 61 c0 51   ...p8...g..@]a.Q
0080  8f 6b 83 6b cd 05 3a ca e1 a7 05 78 fc ca da 94   .k.k..:....x....
0090  d0 2c 08 3d 7e 16 79 c8 a0 50 20 24 54 33 71 00   .,.=~.y..P $T3q.
00a0  03 81 30 82 03 7d 30 82 02 e6 a0 03 02 01 02 02   ..0..}0.........
00b0  03 12 bb e6 30 0d 06 09 2a 86 48 86 f7 0d 01 01   ....0...*.H.....
00c0  05 05 00 30 4e 31 0b 30 09 06 03 55 04 06 13 02   ...0N1.0...U....
00d0  55 53 31 10 30 0e 06 03 55 04 0a 13 07 45 71 75   US1.0...U....Equ
00e0  69 66 61 78 31 2d 30 2b 06 03 55 04 0b 13 24 45   ifax1-0+..U...$E
00f0  71 75 69 66 61 78 20 53 65 63 75 72 65 20 43 65   quifax Secure Ce
0100  72 74 69 66 69 63 61 74 65 20 41 75 74 68 6f 72   rtificate Author
0110  69 74 79 30 1e 17 0d 30 32 30 35 32 31 30 34 30   ity0...020521040
0120  30 30 30 5a 17 0d 31 38 30 38 32 31 30 34 30 30   000Z..1808210400
0130  30 30 5a 30 42 31 0b 30 09 06 03 55 04 06 13 02   00Z0B1.0...U....
0140  55 53 31 16 30 14 06 03 55 04 0a 13 0d 47 65 6f   US1.0...U....Geo
0150  54 72 75 73 74 20 49 6e 63 2e 31 1b 30 19 06 03   Trust Inc.1.0...
0160  55 04 03 13 12 47 65 6f 54 72 75 73 74 20 47 6c   U....GeoTrust Gl
0170  6f 62 61 6c 20 43 41 30 82 01 22 30 0d 06 09 2a   obal CA0.."0...*
0180  86 48 86 f7 0d 01 01 01 05 00 03 82 01 0f 00 30   .H.............0
0190  82 01 0a 02 82 01 01 00 da cc 18 63 30 fd f4 17   ...........c0...
01a0  23 1a 56 7e 5b df 3c 6c 38 e4 71 b7 78 91 d4 bc   #.V~[.<l8.q.x...
01b0  a1 d8 4c f8 a8 43 b6 03 e9 4d 21 07 08 88 da 58   ..L..C...M!....X
01c0  2f 66 39 29 bd 05 78 8b 9d 38 e8 05 b7 6a 7e 71   /f9)..x..8...j~q
01d0  a4 e6 c4 60 a6 b0 ef 80 e4 89 28 0f 9e 25 d6 ed   ...`......(..%..
01e0  83 f3 ad a6 91 c7 98 c9 42 18 35 14 9d ad 98 46   ........B.5....F
01f0  92 2e 4f ca f1 87 43 c1 16 95 57 2d 50 ef 89 2d   ..O...C...W-P..-
0200  80 7a 57 ad f2 ee 5f 6b d2 00 8d b9 14 f8 14 15   .zW..._k........
0210  35 d9 c0 46 a3 7b 72 c8 91 bf c9 55 2b cd d0 97   5..F.{r....U+...
0220  3e 9c 26 64 cc df ce 83 19 71 ca 4e e6 d4 d5 7b   >.&d.....q.N...{
0230  a9 19 cd 55 de c8 ec d2 5e 38 53 e5 5c 4f 8c 2d   ...U....^8S.\O.-
0240  fe 50 23 36 fc 66 e6 cb 8e a4 39 19 00 b7 95 02   .P#6.f....9.....
0250  39 91 0b 0e fe 38 2e d1 1d 05 9a f6 4d 3e 6f 0f   9....8......M>o.
0260  07 1d af 2c 1e 8f 60 39 e2 fa 36 53 13 39 d4 5e   ...,..`9..6S.9.^
0270  26 2b db 3d a8 14 bd 32 eb 18 03 28 52 04 71 e5   &+.=...2...(R.q.
0280  ab 33 3d e1 38 bb 07 36 84 62 9c 79 ea 16 30 f4   .3=.8..6.b.y..0.
0290  5f c0 2b e8 71 6b e4 f9 02 03 01 00 01 a3 81 f0   _.+.qk..........
02a0  30 81 ed 30 1f 06 03 55 1d 23 04 18 30 16 80 14   0..0...U.#..0...
02b0  48 e6 68 f9 2b d2 b2 95 d7 47 d8 23 20 10 4f 33   H.h.+....G.# .O3
02c0  98 90 9f d4 30 1d 06 03 55 1d 0e 04 16 04 14 c0   ....0...U.......
02d0  7a 98 68 8d 89 fb ab 05 64 0c 11 7d aa 7d 65 b8   z.h.....d..}.}e.
02e0  ca cc 4e 30 0f 06 03 55 1d 13 01 01 ff 04 05 30   ..N0...U.......0
02f0  03 01 01 ff 30 0e 06 03 55 1d 0f 01 01 ff 04 04   ....0...U.......
0300  03 02 01 06 30 3a 06 03 55 1d 1f 04 33 30 31 30   ....0:..U...3010
0310  2f a0 2d a0 2b 86 29 68 74 74 70 3a 2f 2f 63 72   /.-.+.)http://cr
0320  6c 2e 67 65 6f 74 72 75 73 74 2e 63 6f 6d 2f 63   l.geotrust.com/c
0330  72 6c 73 2f 73 65 63 75 72 65 63 61 2e 63 72 6c   rls/secureca.crl
0340  30 4e 06 03 55 1d 20 04 47 30 45 30 43 06 04 55   0N..U. .G0E0C..U
0350  1d 20 00 30 3b 30 39 06 08 2b 06 01 05 05 07 02   . .0;09..+......
0360  01 16 2d 68 74 74 70 73 3a 2f 2f 77 77 77 2e 67   ..-https://www.g
0370  65 6f 74 72 75 73 74 2e 63 6f 6d 2f 72 65 73 6f   eotrust.com/reso
0380  75 72 63 65 73 2f 72 65 70 6f 73 69 74 6f 72 79   urces/repository
0390  30 0d 06 09 2a 86 48 86 f7 0d 01 01 05 05 00 03   0...*.H.........
03a0  81 81 00 76 e1 12 6e 4e 4b 16 12 86 30 06 b2 81   ...v..nNK...0...
03b0  08 cf f0 08 c7 c7 71 7e 66 ee c2 ed d4 3b 1f ff   ......q~f....;..
03c0  f0 f0 c8 4e d6 43 38 b0 b9 30 7d 18 d0 55 83 a2   ...N.C8..0}..U..
03d0  6a cb 36 11 9c e8 48 66 a3 6d 7f b8 13 d4 47 fe   j.6...Hf.m....G.
03e0  8b 5a 5c 73 fc ae d9 1b 32 19 38 ab 97 34 14 aa   .Z\s....2.8..4..
03f0  96 d2 eb a3 1c 14 08 49 b6 bb e5 91 ef 83 36 eb   .......I......6.
0400  1d 56 6f ca da bc 73 63 90 e4 7f 7b 3e 22 cb 3d   .Vo...sc...{>".=
0410  07 ed 5f 38 74 9c e3 03 50 4e a1 af 98 ee 61 f2   .._8t...PN....a.
0420  84 3f 12 16 03 01 00 04 0e 00 00 00               .?..........

No.     Time        Source                Destination           Protocol Length Info
     16 2.145683    192.168.1.101         173.194.70.188        TCP      66     40830 > hpvroom [ACK] Seq=81 Ack=3905 Win=14528 Len=0 TSval=34129 TSecr=2863534241

Frame 16: 66 bytes on wire (528 bits), 66 bytes captured (528 bits)
Ethernet II, Src: aa:aa:03:00:00:00 (aa:aa:03:00:00:00), Dst: 1b:24:63:41:00:3c (1b:24:63:41:00:3c)
Internet Protocol Version 4, Src: 192.168.1.101 (192.168.1.101), Dst: 173.194.70.188 (173.194.70.188)
Transmission Control Protocol, Src Port: 40830 (40830), Dst Port: hpvroom (5228), Seq: 81, Ack: 3905, Len: 0

No.     Time        Source                Destination           Protocol Length Info
     17 2.155287    192.168.1.101         198.232.124.224       TCP      66     43770 > http [ACK] Seq=1 Ack=2 Win=864 Len=0 TSval=34130 TSecr=2960442885

Frame 17: 66 bytes on wire (528 bits), 66 bytes captured (528 bits)
Ethernet II, Src: aa:aa:03:00:00:00 (aa:aa:03:00:00:00), Dst: 1b:24:63:41:00:3c (1b:24:63:41:00:3c)
Internet Protocol Version 4, Src: 192.168.1.101 (192.168.1.101), Dst: 198.232.124.224 (198.232.124.224)
Transmission Control Protocol, Src Port: 43770 (43770), Dst Port: http (80), Seq: 1, Ack: 2, Len: 0

No.     Time        Source                Destination           Protocol Length Info
     18 2.201968    192.168.1.101         108.168.176.249       TCP      74     34097 > https [SYN] Seq=0 Win=5840 Len=0 MSS=1460 SACK_PERM=1 TSval=34134 TSecr=0 WS=8

Frame 18: 74 bytes on wire (592 bits), 74 bytes captured (592 bits)
Ethernet II, Src: aa:aa:03:00:00:00 (aa:aa:03:00:00:00), Dst: 1b:24:63:41:00:44 (1b:24:63:41:00:44)
Internet Protocol Version 4, Src: 192.168.1.101 (192.168.1.101), Dst: 108.168.176.249 (108.168.176.249)
Transmission Control Protocol, Src Port: 34097 (34097), Dst Port: https (443), Seq: 0, Len: 0

No.     Time        Source                Destination           Protocol Length Info
     19 2.353967    108.168.176.249       192.168.1.101         TCP      74     https > 34097 [SYN, ACK] Seq=0 Ack=1 Win=65535 Len=0 MSS=1452 WS=512 SACK_PERM=1 TSval=1864093712 TSecr=34134

Frame 19: 74 bytes on wire (592 bits), 74 bytes captured (592 bits)
Ethernet II, Src: FonTechn_a5:e9:80 (00:18:84:a5:e9:80), Dst: SamsungE_24:63:41 (cc:05:1b:24:63:41)
Internet Protocol Version 4, Src: 108.168.176.249 (108.168.176.249), Dst: 192.168.1.101 (192.168.1.101)
Transmission Control Protocol, Src Port: https (443), Dst Port: 34097 (34097), Seq: 0, Ack: 1, Len: 0

No.     Time        Source                Destination           Protocol Length Info
     20 2.354262    192.168.1.101         108.168.176.249       TCP      66     34097 > https [ACK] Seq=1 Ack=1 Win=5840 Len=0 TSval=34149 TSecr=1864093712

Frame 20: 66 bytes on wire (528 bits), 66 bytes captured (528 bits)
Ethernet II, Src: aa:aa:03:00:00:00 (aa:aa:03:00:00:00), Dst: 1b:24:63:41:00:3c (1b:24:63:41:00:3c)
Internet Protocol Version 4, Src: 192.168.1.101 (192.168.1.101), Dst: 108.168.176.249 (108.168.176.249)
Transmission Control Protocol, Src Port: 34097 (34097), Dst Port: https (443), Seq: 1, Ack: 1, Len: 0

No.     Time        Source                Destination           Protocol Length Info
     21 2.426317    FonTechn_a5:e9:81     Spanning-tree-(for-bridges)_00 STP      52     Conf. Root = 32768/0/00:18:84:a5:e9:80  Cost = 0  Port = 0x8002

Frame 21: 52 bytes on wire (416 bits), 52 bytes captured (416 bits)
IEEE 802.3 Ethernet 
Logical-Link Control
Spanning Tree Protocol

No.     Time        Source                Destination           Protocol Length Info
     22 2.437238    192.168.1.101         108.168.176.249       SSL      187    Continuation Data

Frame 22: 187 bytes on wire (1496 bits), 187 bytes captured (1496 bits)
Ethernet II, Src: aa:aa:03:00:00:00 (aa:aa:03:00:00:00), Dst: 1b:24:63:41:00:b5 (1b:24:63:41:00:b5)
Internet Protocol Version 4, Src: 192.168.1.101 (192.168.1.101), Dst: 108.168.176.249 (108.168.176.249)
Transmission Control Protocol, Src Port: 34097 (34097), Dst Port: https (443), Seq: 1, Ack: 1, Len: 121
Secure Sockets Layer

No.     Time        Source                Destination           Protocol Length Info
     23 2.539937    108.168.176.249       192.168.1.101         TCP      66     [TCP Window Update] https > 34097 [ACK] Seq=1 Ack=1 Win=263168 Len=0 TSval=1864093896 TSecr=34149

Frame 23: 66 bytes on wire (528 bits), 66 bytes captured (528 bits)
Ethernet II, Src: FonTechn_a5:e9:80 (00:18:84:a5:e9:80), Dst: SamsungE_24:63:41 (cc:05:1b:24:63:41)
Internet Protocol Version 4, Src: 108.168.176.249 (108.168.176.249), Dst: 192.168.1.101 (192.168.1.101)
Transmission Control Protocol, Src Port: https (443), Dst Port: 34097 (34097), Seq: 1, Ack: 1, Len: 0

No.     Time        Source                Destination           Protocol Length Info
     24 2.557322    192.168.1.101         173.194.70.188        TCP      380    40830 > hpvroom [PSH, ACK] Seq=81 Ack=3905 Win=14528 Len=314 TSval=34170 TSecr=2863534241

Frame 24: 380 bytes on wire (3040 bits), 380 bytes captured (3040 bits)
Ethernet II, Src: aa:aa:03:00:00:00 (aa:aa:03:00:00:00), Dst: 1b:24:63:41:01:76 (1b:24:63:41:01:76)
Internet Protocol Version 4, Src: 192.168.1.101 (192.168.1.101), Dst: 173.194.70.188 (173.194.70.188)
Transmission Control Protocol, Src Port: 40830 (40830), Dst Port: hpvroom (5228), Seq: 81, Ack: 3905, Len: 314
Data (314 bytes)

0000  16 03 01 01 06 10 00 01 02 01 00 75 98 4e 66 a2   ...........u.Nf.
0010  34 b0 36 56 58 0c be 06 a4 6c 7f f9 7d 7d a2 89   4.6VX....l..}}..
0020  f9 bd f9 3a db 85 84 73 99 99 de 6d e0 5d 38 dc   ...:...s...m.]8.
0030  df 28 db 56 fe b3 fb c7 c0 db ae 5c de b0 f8 42   .(.V.......\...B
0040  e6 98 e4 ab 02 b3 28 16 c5 6a f4 09 0b 0e c7 1e   ......(..j......
0050  9a 88 f9 3e ae c9 56 b5 7e 6f 4f 3c 50 f4 ad d0   ...>..V.~oO<P...
0060  4a 37 c1 72 e8 55 00 3c 3b e7 c7 37 f0 da 59 df   J7.r.U.<;..7..Y.
0070  b5 62 d5 ef 22 73 31 8b f8 b5 6c 58 97 a7 b4 7e   .b.."s1...lX...~
0080  29 82 e2 f0 f6 aa 52 3d 5e eb c6 0e 78 f2 ca a8   ).....R=^...x...
0090  a6 4a 10 f0 0a b9 41 a9 e6 39 0e 78 6d 92 9f f9   .J....A..9.xm...
00a0  d1 36 d3 3b 9e 74 24 e0 47 3b 84 4e 6c c9 ae db   .6.;.t$.G;.Nl...
00b0  78 25 a7 b9 ac e1 a7 ae 6f f6 ae 44 e8 ad 70 a2   x%......o..D..p.
00c0  f5 af dc 78 18 cf d3 a7 50 fb 77 6e 3d 87 83 28   ...x....P.wn=..(
00d0  43 ba c0 e4 78 35 46 8b a2 d1 6d 21 37 6d d7 20   C...x5F...m!7m. 
00e0  54 b4 db 74 ca 64 ce 69 85 fe bf f4 7e cd a3 88   T..t.d.i....~...
00f0  e2 6b d9 6c e0 d7 33 0c 4d b1 6b 56 2d 6a 3c fe   .k.l..3.M.kV-j<.
0100  5f 2b c0 33 df ee 13 99 75 33 2b 14 03 01 00 01   _+.3....u3+.....
0110  01 16 03 01 00 24 a1 dd 3f e5 67 e5 68 72 b0 48   .....$..?.g.hr.H
0120  ae 1d 32 d8 15 76 fa 33 14 85 87 85 2f b6 52 05   ..2..v.3..../.R.
0130  9d ba 87 c1 4a d4 68 f3 4b 7c                     ....J.h.K|

No.     Time        Source                Destination           Protocol Length Info
     25 2.618640    108.168.176.249       192.168.1.101         SSL      155    Continuation Data

Frame 25: 155 bytes on wire (1240 bits), 155 bytes captured (1240 bits)
Ethernet II, Src: FonTechn_a5:e9:80 (00:18:84:a5:e9:80), Dst: SamsungE_24:63:41 (cc:05:1b:24:63:41)
Internet Protocol Version 4, Src: 108.168.176.249 (108.168.176.249), Dst: 192.168.1.101 (192.168.1.101)
Transmission Control Protocol, Src Port: https (443), Dst Port: 34097 (34097), Seq: 1, Ack: 122, Len: 89
Secure Sockets Layer

No.     Time        Source                Destination           Protocol Length Info
     26 2.619230    192.168.1.101         108.168.176.249       TCP      66     34097 > https [ACK] Seq=122 Ack=90 Win=5840 Len=0 TSval=34176 TSecr=1864093978

Frame 26: 66 bytes on wire (528 bits), 66 bytes captured (528 bits)
Ethernet II, Src: aa:aa:03:00:00:00 (aa:aa:03:00:00:00), Dst: 1b:24:63:41:00:3c (1b:24:63:41:00:3c)
Internet Protocol Version 4, Src: 192.168.1.101 (192.168.1.101), Dst: 108.168.176.249 (108.168.176.249)
Transmission Control Protocol, Src Port: 34097 (34097), Dst Port: https (443), Seq: 122, Ack: 90, Len: 0

No.     Time        Source                Destination           Protocol Length Info
     27 2.632952    192.168.1.101         108.168.176.249       SSL      95     Continuation Data

Frame 27: 95 bytes on wire (760 bits), 95 bytes captured (760 bits)
Ethernet II, Src: aa:aa:03:00:00:00 (aa:aa:03:00:00:00), Dst: 1b:24:63:41:00:59 (1b:24:63:41:00:59)
Internet Protocol Version 4, Src: 192.168.1.101 (192.168.1.101), Dst: 108.168.176.249 (108.168.176.249)
Transmission Control Protocol, Src Port: 34097 (34097), Dst Port: https (443), Seq: 122, Ack: 90, Len: 29
Secure Sockets Layer

No.     Time        Source                Destination           Protocol Length Info
     28 2.649275    173.194.70.188        192.168.1.101         TCP      113    hpvroom > 40830 [PSH, ACK] Seq=3905 Ack=395 Win=42880 Len=47 TSval=2863534757 TSecr=34170

Frame 28: 113 bytes on wire (904 bits), 113 bytes captured (904 bits)
Ethernet II, Src: FonTechn_a5:e9:80 (00:18:84:a5:e9:80), Dst: SamsungE_24:63:41 (cc:05:1b:24:63:41)
Internet Protocol Version 4, Src: 173.194.70.188 (173.194.70.188), Dst: 192.168.1.101 (192.168.1.101)
Transmission Control Protocol, Src Port: hpvroom (5228), Dst Port: 40830 (40830), Seq: 3905, Ack: 395, Len: 47
Data (47 bytes)

0000  14 03 01 00 01 01 16 03 01 00 24 6f 9c 0a 53 06   ..........$o..S.
0010  09 e2 bb c5 09 b5 c7 4d 09 be 77 61 72 7c 64 81   .......M..war|d.
0020  01 fd 48 82 4a 18 f3 cb 3c 02 f1 2d 7b 28 0b      ..H.J...<..-{(.

No.     Time        Source                Destination           Protocol Length Info
     29 2.649705    192.168.1.101         173.194.70.188        TCP      66     40830 > hpvroom [ACK] Seq=395 Ack=3952 Win=14528 Len=0 TSval=34179 TSecr=2863534757

Frame 29: 66 bytes on wire (528 bits), 66 bytes captured (528 bits)
Ethernet II, Src: aa:aa:03:00:00:00 (aa:aa:03:00:00:00), Dst: 1b:24:63:41:00:3c (1b:24:63:41:00:3c)
Internet Protocol Version 4, Src: 192.168.1.101 (192.168.1.101), Dst: 173.194.70.188 (173.194.70.188)
Transmission Control Protocol, Src Port: 40830 (40830), Dst Port: hpvroom (5228), Seq: 395, Ack: 3952, Len: 0

No.     Time        Source                Destination           Protocol Length Info
     30 2.677195    108.168.176.249       192.168.1.101         SSL      87     Continuation Data

Frame 30: 87 bytes on wire (696 bits), 87 bytes captured (696 bits)
Ethernet II, Src: FonTechn_a5:e9:80 (00:18:84:a5:e9:80), Dst: SamsungE_24:63:41 (cc:05:1b:24:63:41)
Internet Protocol Version 4, Src: 108.168.176.249 (108.168.176.249), Dst: 192.168.1.101 (192.168.1.101)
Transmission Control Protocol, Src Port: https (443), Dst Port: 34097 (34097), Seq: 90, Ack: 122, Len: 21
Secure Sockets Layer

No.     Time        Source                Destination           Protocol Length Info
     31 2.715103    192.168.1.101         108.168.176.249       TCP      66     34097 > https [ACK] Seq=151 Ack=111 Win=5840 Len=0 TSval=34186 TSecr=1864094036

Frame 31: 66 bytes on wire (528 bits), 66 bytes captured (528 bits)
Ethernet II, Src: aa:aa:03:00:00:00 (aa:aa:03:00:00:00), Dst: 1b:24:63:41:00:3c (1b:24:63:41:00:3c)
Internet Protocol Version 4, Src: 192.168.1.101 (192.168.1.101), Dst: 108.168.176.249 (108.168.176.249)
Transmission Control Protocol, Src Port: 34097 (34097), Dst Port: https (443), Seq: 151, Ack: 111, Len: 0

No.     Time        Source                Destination           Protocol Length Info
     32 2.838948    108.168.176.249       192.168.1.101         TCP      66     https > 34097 [ACK] Seq=111 Ack=151 Win=263168 Len=0 TSval=1864094196 TSecr=34177

Frame 32: 66 bytes on wire (528 bits), 66 bytes captured (528 bits)
Ethernet II, Src: FonTechn_a5:e9:80 (00:18:84:a5:e9:80), Dst: SamsungE_24:63:41 (cc:05:1b:24:63:41)
Internet Protocol Version 4, Src: 108.168.176.249 (108.168.176.249), Dst: 192.168.1.101 (192.168.1.101)
Transmission Control Protocol, Src Port: https (443), Dst Port: 34097 (34097), Seq: 111, Ack: 151, Len: 0

No.     Time        Source                Destination           Protocol Length Info
     33 2.839320    192.168.1.101         108.168.176.249       SSL      89     Continuation Data

Frame 33: 89 bytes on wire (712 bits), 89 bytes captured (712 bits)
Ethernet II, Src: aa:aa:03:00:00:00 (aa:aa:03:00:00:00), Dst: 1b:24:63:41:00:53 (1b:24:63:41:00:53)
Internet Protocol Version 4, Src: 192.168.1.101 (192.168.1.101), Dst: 108.168.176.249 (108.168.176.249)
Transmission Control Protocol, Src Port: 34097 (34097), Dst Port: https (443), Seq: 151, Ack: 111, Len: 23
Secure Sockets Layer

No.     Time        Source                Destination           Protocol Length Info
     34 2.965465    192.168.1.101         173.194.70.188        TCP      92     40830 > hpvroom [PSH, ACK] Seq=395 Ack=3952 Win=14528 Len=26 TSval=34211 TSecr=2863534757

Frame 34: 92 bytes on wire (736 bits), 92 bytes captured (736 bits)
Ethernet II, Src: aa:aa:03:00:00:00 (aa:aa:03:00:00:00), Dst: 1b:24:63:41:00:56 (1b:24:63:41:00:56)
Internet Protocol Version 4, Src: 192.168.1.101 (192.168.1.101), Dst: 173.194.70.188 (173.194.70.188)
Transmission Control Protocol, Src Port: 40830 (40830), Dst Port: hpvroom (5228), Seq: 395, Ack: 3952, Len: 26
Data (26 bytes)

0000  17 03 01 00 15 07 7e 1f b2 c4 9f 6a 3b ce 7e bb   ......~....j;.~.
0010  46 d0 2b f6 31 ae fb 70 b3 d0                     F.+.1..p..

No.     Time        Source                Destination           Protocol Length Info
     35 3.049098    108.168.176.249       192.168.1.101         SSL      233    Continuation Data

Frame 35: 233 bytes on wire (1864 bits), 233 bytes captured (1864 bits)
Ethernet II, Src: FonTechn_a5:e9:80 (00:18:84:a5:e9:80), Dst: SamsungE_24:63:41 (cc:05:1b:24:63:41)
Internet Protocol Version 4, Src: 108.168.176.249 (108.168.176.249), Dst: 192.168.1.101 (192.168.1.101)
Transmission Control Protocol, Src Port: https (443), Dst Port: 34097 (34097), Seq: 111, Ack: 174, Len: 167
Secure Sockets Layer

No.     Time        Source                Destination           Protocol Length Info
     36 3.049478    192.168.1.101         108.168.176.249       TCP      66     34097 > https [ACK] Seq=174 Ack=278 Win=6912 Len=0 TSval=34219 TSecr=1864094388

Frame 36: 66 bytes on wire (528 bits), 66 bytes captured (528 bits)
Ethernet II, Src: aa:aa:03:00:00:00 (aa:aa:03:00:00:00), Dst: 1b:24:63:41:00:3c (1b:24:63:41:00:3c)
Internet Protocol Version 4, Src: 192.168.1.101 (192.168.1.101), Dst: 108.168.176.249 (108.168.176.249)
Transmission Control Protocol, Src Port: 34097 (34097), Dst Port: https (443), Seq: 174, Ack: 278, Len: 0

No.     Time        Source                Destination           Protocol Length Info
     37 3.083637    173.194.70.188        192.168.1.101         TCP      92     hpvroom > 40830 [PSH, ACK] Seq=3952 Ack=421 Win=42880 Len=26 TSval=2863535184 TSecr=34211

Frame 37: 92 bytes on wire (736 bits), 92 bytes captured (736 bits)
Ethernet II, Src: FonTechn_a5:e9:80 (00:18:84:a5:e9:80), Dst: SamsungE_24:63:41 (cc:05:1b:24:63:41)
Internet Protocol Version 4, Src: 173.194.70.188 (173.194.70.188), Dst: 192.168.1.101 (192.168.1.101)
Transmission Control Protocol, Src Port: hpvroom (5228), Dst Port: 40830 (40830), Seq: 3952, Ack: 421, Len: 26
Data (26 bytes)

0000  17 03 01 00 15 e7 a4 3b 25 4c 27 92 23 06 8c 1e   .......;%L'.#...
0010  41 c6 fc ec 5a 17 72 39 62 8c                     A...Z.r9b.

No.     Time        Source                Destination           Protocol Length Info
     38 3.084105    192.168.1.101         173.194.70.188        TCP      66     40830 > hpvroom [ACK] Seq=421 Ack=3978 Win=14528 Len=0 TSval=34222 TSecr=2863535184

Frame 38: 66 bytes on wire (528 bits), 66 bytes captured (528 bits)
Ethernet II, Src: aa:aa:03:00:00:00 (aa:aa:03:00:00:00), Dst: 1b:24:63:41:00:3c (1b:24:63:41:00:3c)
Internet Protocol Version 4, Src: 192.168.1.101 (192.168.1.101), Dst: 173.194.70.188 (173.194.70.188)
Transmission Control Protocol, Src Port: 40830 (40830), Dst Port: hpvroom (5228), Seq: 421, Ack: 3978, Len: 0

No.     Time        Source                Destination           Protocol Length Info
     39 3.248457    192.168.1.101         173.194.70.188        TCP      556    40830 > hpvroom [PSH, ACK] Seq=421 Ack=3978 Win=14528 Len=490 TSval=34239 TSecr=2863535184

Frame 39: 556 bytes on wire (4448 bits), 556 bytes captured (4448 bits)
Ethernet II, Src: aa:aa:03:00:00:00 (aa:aa:03:00:00:00), Dst: 1b:24:63:41:02:26 (1b:24:63:41:02:26)
Internet Protocol Version 4, Src: 192.168.1.101 (192.168.1.101), Dst: 173.194.70.188 (173.194.70.188)
Transmission Control Protocol, Src Port: 40830 (40830), Dst Port: hpvroom (5228), Seq: 421, Ack: 3978, Len: 490
Data (490 bytes)

0000  17 03 01 01 e5 e6 34 97 1e b9 2f 09 bd bf 97 65   ......4.../....e
0010  29 8d 78 c7 fc da 3a ee 4b 0e 2d 64 ea 16 b6 19   ).x...:.K.-d....
0020  b2 6f 6e ee 5e d9 2e e5 26 95 ea 9b 3b 15 49 da   .on.^...&...;.I.
0030  bf 20 71 e2 4c b7 a1 75 bd e7 e7 0e b2 94 b5 0c   . q.L..u........
0040  2a 04 70 f8 7f bc 6b e8 0f 66 23 8d ba 17 4a e8   *.p...k..f#...J.
0050  de 70 8a 0d 3b c9 cd d4 3f 4a 6f 97 51 a4 c3 25   .p..;...?Jo.Q..%
0060  23 1b 6f 9e 7d 03 f4 ec 17 ec 8b 04 55 68 99 a6   #.o.}.......Uh..
0070  69 c9 c2 cd 46 f5 00 44 d5 8f e4 a5 ad 3e b1 90   i...F..D.....>..
0080  7e 98 a1 d5 5e 8e bf d8 e6 bd d6 ff 4d 8e 2b 0a   ~...^.......M.+.
0090  59 88 9d 38 51 6e 22 ca ad 33 83 88 ff bb f9 fb   Y..8Qn"..3......
00a0  9b dc 1a 47 7b 88 c7 04 23 bb d3 1c bd 30 60 d8   ...G{...#....0`.
00b0  8e 81 05 02 6d 20 61 cf 1b 3d 3a 08 35 e5 41 91   ....m a..=:.5.A.
00c0  a4 a3 d3 74 9c 10 ed 2b a9 cd a6 c5 7b a6 73 ef   ...t...+....{.s.
00d0  31 8f 5c 11 3b 6f 2a de 51 bc 18 b3 b5 bf b4 e6   1.\.;o*.Q.......
00e0  e6 52 2f a7 e7 de 35 2b ea d3 16 bf 2f b2 95 5e   .R/...5+..../..^
00f0  19 86 73 96 5a 72 d7 fa 83 20 2d 1e d8 11 5d b5   ..s.Zr... -...].
0100  eb df 44 e8 12 15 f6 27 e0 7e eb 41 57 3f c0 6c   ..D....'.~.AW?.l
0110  84 46 83 87 fe 89 4b ad d1 b4 5d 62 11 bf 88 ad   .F....K...]b....
0120  9b 29 e4 a1 4d 3e 87 10 94 d2 3e e9 f0 72 25 56   .)..M>....>..r%V
0130  a9 d7 5d dc 37 07 78 3d f0 bf be f9 3f 2f 3a c5   ..].7.x=....?/:.
0140  2a 19 fa 8e fc 41 1c 8a 0f 1d 42 e7 a4 41 32 2f   *....A....B..A2/
0150  ef 9b 8e 43 e2 cb 6c 8b 3c da ce e0 65 83 f1 50   ...C..l.<...e..P
0160  29 f0 a1 8e 46 a8 9e 61 e0 a7 fe e4 9f a0 4c b7   )...F..a......L.
0170  38 1b d7 ef 58 74 66 78 d2 07 f5 06 0a 16 f6 9b   8...Xtfx........
0180  1a 5b aa 20 f6 d1 6d bf 95 6f 5a 9a 85 31 be d3   .[. ..m..oZ..1..
0190  48 2c 18 d7 d9 a8 0d d9 63 c3 6a 14 80 f1 34 67   H,......c.j...4g
01a0  ff ba 92 e7 c4 7d d6 01 ef 0e fd 20 83 96 0c f6   .....}..... ....
01b0  99 ba d2 94 44 67 37 a6 4f 95 59 d5 67 23 a8 3a   ....Dg7.O.Y.g#.:
01c0  12 34 ca df bd b3 d3 91 48 ad b9 51 b3 d5 fe ba   .4......H..Q....
01d0  e1 4a eb 1b ba 81 43 0e 0d dd 0d 24 a2 9d 63 7e   .J....C....$..c~
01e0  a6 a6 19 06 ad 00 78 c9 df 90                     ......x...

No.     Time        Source                Destination           Protocol Length Info
     40 3.403735    173.194.70.188        192.168.1.101         TCP      66     hpvroom > 40830 [ACK] Seq=3978 Ack=911 Win=42880 Len=0 TSval=2863535501 TSecr=34239

Frame 40: 66 bytes on wire (528 bits), 66 bytes captured (528 bits)
Ethernet II, Src: FonTechn_a5:e9:80 (00:18:84:a5:e9:80), Dst: SamsungE_24:63:41 (cc:05:1b:24:63:41)
Internet Protocol Version 4, Src: 173.194.70.188 (173.194.70.188), Dst: 192.168.1.101 (192.168.1.101)
Transmission Control Protocol, Src Port: hpvroom (5228), Dst Port: 40830 (40830), Seq: 3978, Ack: 911, Len: 0

No.     Time        Source                Destination           Protocol Length Info
     41 3.434137    173.194.70.188        192.168.1.101         TCP      157    hpvroom > 40830 [PSH, ACK] Seq=3978 Ack=911 Win=42880 Len=91 TSval=2863535538 TSecr=34239

Frame 41: 157 bytes on wire (1256 bits), 157 bytes captured (1256 bits)
Ethernet II, Src: FonTechn_a5:e9:80 (00:18:84:a5:e9:80), Dst: SamsungE_24:63:41 (cc:05:1b:24:63:41)
Internet Protocol Version 4, Src: 173.194.70.188 (173.194.70.188), Dst: 192.168.1.101 (192.168.1.101)
Transmission Control Protocol, Src Port: hpvroom (5228), Dst Port: 40830 (40830), Seq: 3978, Ack: 911, Len: 91
Data (91 bytes)

0000  17 03 01 00 56 37 8b f9 4d 2a 8a 6c 0c 11 18 14   ....V7..M*.l....
0010  be e0 0e 37 d0 4d bd 3b 4f 5b 86 dc e2 6c d6 75   ...7.M.;O[...l.u
0020  cd f4 41 ab 2d a8 da 5a 80 2d 8f 46 c3 03 ec a2   ..A.-..Z.-.F....
0030  03 19 3b ba ff 48 c7 b1 8c 09 4b e0 01 b2 17 30   ..;..H....K....0
0040  8a 23 10 04 9d 7e c3 2e 3d 46 d4 c6 40 58 0a 06   .#...~..=F..@X..
0050  6b 2c db 8a 1d 26 38 9e e4 87 ce                  k,...&8....

No.     Time        Source                Destination           Protocol Length Info
     42 3.434568    192.168.1.101         173.194.70.188        TCP      66     40830 > hpvroom [ACK] Seq=911 Ack=4069 Win=14528 Len=0 TSval=34257 TSecr=2863535538

Frame 42: 66 bytes on wire (528 bits), 66 bytes captured (528 bits)
Ethernet II, Src: aa:aa:03:00:00:00 (aa:aa:03:00:00:00), Dst: 1b:24:63:41:00:3c (1b:24:63:41:00:3c)
Internet Protocol Version 4, Src: 192.168.1.101 (192.168.1.101), Dst: 173.194.70.188 (173.194.70.188)
Transmission Control Protocol, Src Port: 40830 (40830), Dst Port: hpvroom (5228), Seq: 911, Ack: 4069, Len: 0

No.     Time        Source                Destination           Protocol Length Info
     43 3.539092    173.194.70.188        192.168.1.101         TCP      173    hpvroom > 40830 [PSH, ACK] Seq=4069 Ack=911 Win=42880 Len=107 TSval=2863535570 TSecr=34239

Frame 43: 173 bytes on wire (1384 bits), 173 bytes captured (1384 bits)
Ethernet II, Src: FonTechn_a5:e9:80 (00:18:84:a5:e9:80), Dst: SamsungE_24:63:41 (cc:05:1b:24:63:41)
Internet Protocol Version 4, Src: 173.194.70.188 (173.194.70.188), Dst: 192.168.1.101 (192.168.1.101)
Transmission Control Protocol, Src Port: hpvroom (5228), Dst Port: 40830 (40830), Seq: 4069, Ack: 911, Len: 107
Data (107 bytes)

0000  17 03 01 00 66 33 98 b9 20 30 09 f6 0a 06 43 a5   ....f3.. 0....C.
0010  8e ff 24 65 57 3f 9f 2d 3a 8b bd 8c 84 09 7b 6a   ..$eW?.-:.....{j
0020  d6 83 ec 50 94 e1 fe 25 70 14 98 af bf 5d cf d2   ...P...%p....]..
0030  9b 6d 33 12 03 68 57 b8 65 aa e2 fc 36 86 c4 d2   .m3..hW.e...6...
0040  4f 3b 6f 9b 30 20 67 7a 96 62 61 ab 47 81 1c 29   O;o.0 gz.ba.G..)
0050  77 a7 d7 66 71 30 35 a5 4a 38 2d ed ed 15 ff 71   w..fq05.J8-....q
0060  ba 71 fa e8 84 c4 d1 bb 1b 8b 1d                  .q.........

No.     Time        Source                Destination           Protocol Length Info
     44 3.575142    192.168.1.101         173.194.70.188        TCP      66     40830 > hpvroom [ACK] Seq=911 Ack=4176 Win=14528 Len=0 TSval=34272 TSecr=2863535570

Frame 44: 66 bytes on wire (528 bits), 66 bytes captured (528 bits)
Ethernet II, Src: aa:aa:03:00:00:00 (aa:aa:03:00:00:00), Dst: 1b:24:63:41:00:3c (1b:24:63:41:00:3c)
Internet Protocol Version 4, Src: 192.168.1.101 (192.168.1.101), Dst: 173.194.70.188 (173.194.70.188)
Transmission Control Protocol, Src Port: 40830 (40830), Dst Port: hpvroom (5228), Seq: 911, Ack: 4176, Len: 0

No.     Time        Source                Destination           Protocol Length Info
     45 3.607475    192.168.1.101         173.194.70.188        TCP      116    40830 > hpvroom [PSH, ACK] Seq=911 Ack=4176 Win=14528 Len=50 TSval=34275 TSecr=2863535570

Frame 45: 116 bytes on wire (928 bits), 116 bytes captured (928 bits)
Ethernet II, Src: aa:aa:03:00:00:00 (aa:aa:03:00:00:00), Dst: 1b:24:63:41:00:6e (1b:24:63:41:00:6e)
Internet Protocol Version 4, Src: 192.168.1.101 (192.168.1.101), Dst: 173.194.70.188 (173.194.70.188)
Transmission Control Protocol, Src Port: 40830 (40830), Dst Port: hpvroom (5228), Seq: 911, Ack: 4176, Len: 50
Data (50 bytes)

0000  17 03 01 00 2d a5 33 87 16 65 df f6 78 42 90 5b   ....-.3..e..xB.[
0010  90 3b b8 c9 00 f9 01 8e 91 cf 69 77 f5 44 09 1f   .;........iw.D..
0020  a2 10 39 c6 a6 c2 12 66 c3 0a e9 18 35 f1 bd 14   ..9....f....5...
0030  9f b4                                             ..

No.     Time        Source                Destination           Protocol Length Info
     46 3.700025    173.194.70.188        192.168.1.101         TCP      66     hpvroom > 40830 [ACK] Seq=4176 Ack=961 Win=42880 Len=0 TSval=2863535796 TSecr=34275

Frame 46: 66 bytes on wire (528 bits), 66 bytes captured (528 bits)
Ethernet II, Src: FonTechn_a5:e9:80 (00:18:84:a5:e9:80), Dst: SamsungE_24:63:41 (cc:05:1b:24:63:41)
Internet Protocol Version 4, Src: 173.194.70.188 (173.194.70.188), Dst: 192.168.1.101 (192.168.1.101)
Transmission Control Protocol, Src Port: hpvroom (5228), Dst Port: 40830 (40830), Seq: 4176, Ack: 961, Len: 0

No.     Time        Source                Destination           Protocol Length Info
     47 4.482132    192.168.1.101         198.232.124.224       TCP      66     43770 > http [FIN, ACK] Seq=1 Ack=2 Win=864 Len=0 TSval=34362 TSecr=2960442885

Frame 47: 66 bytes on wire (528 bits), 66 bytes captured (528 bits)
Ethernet II, Src: aa:aa:03:00:00:00 (aa:aa:03:00:00:00), Dst: 1b:24:63:41:00:3c (1b:24:63:41:00:3c)
Internet Protocol Version 4, Src: 192.168.1.101 (192.168.1.101), Dst: 198.232.124.224 (198.232.124.224)
Transmission Control Protocol, Src Port: 43770 (43770), Dst Port: http (80), Seq: 1, Ack: 2, Len: 0

No.     Time        Source                Destination           Protocol Length Info
     48 4.482723    192.168.1.101         54.235.185.74         TCP      66     51243 > http [FIN, ACK] Seq=1 Ack=1 Win=864 Len=0 TSval=34362 TSecr=4246383854

Frame 48: 66 bytes on wire (528 bits), 66 bytes captured (528 bits)
Ethernet II, Src: aa:aa:03:00:00:00 (aa:aa:03:00:00:00), Dst: 1b:24:63:41:00:3c (1b:24:63:41:00:3c)
Internet Protocol Version 4, Src: 192.168.1.101 (192.168.1.101), Dst: 54.235.185.74 (54.235.185.74)
Transmission Control Protocol, Src Port: 51243 (51243), Dst Port: http (80), Seq: 1, Ack: 1, Len: 0

No.     Time        Source                Destination           Protocol Length Info
     49 4.483022    192.168.1.101         108.168.157.116       TCP      54     35160 > http [FIN, ACK] Seq=1 Ack=1 Win=6432 Len=0

Frame 49: 54 bytes on wire (432 bits), 54 bytes captured (432 bits)
Ethernet II, Src: aa:aa:03:00:00:00 (aa:aa:03:00:00:00), Dst: 1b:24:63:41:00:30 (1b:24:63:41:00:30)
Internet Protocol Version 4, Src: 192.168.1.101 (192.168.1.101), Dst: 108.168.157.116 (108.168.157.116)
Transmission Control Protocol, Src Port: 35160 (35160), Dst Port: http (80), Seq: 1, Ack: 1, Len: 0

No.     Time        Source                Destination           Protocol Length Info
     50 4.589103    198.232.124.224       192.168.1.101         TCP      66     http > 43770 [ACK] Seq=2 Ack=2 Win=59 Len=0 TSval=2960445449 TSecr=34362

Frame 50: 66 bytes on wire (528 bits), 66 bytes captured (528 bits)
Ethernet II, Src: FonTechn_a5:e9:80 (00:18:84:a5:e9:80), Dst: SamsungE_24:63:41 (cc:05:1b:24:63:41)
Internet Protocol Version 4, Src: 198.232.124.224 (198.232.124.224), Dst: 192.168.1.101 (192.168.1.101)
Transmission Control Protocol, Src Port: http (80), Dst Port: 43770 (43770), Seq: 2, Ack: 2, Len: 0

No.     Time        Source                Destination           Protocol Length Info
     51 4.679275    54.235.185.74         192.168.1.101         TCP      66     http > 51243 [FIN, ACK] Seq=1 Ack=2 Win=61 Len=0 TSval=4246385494 TSecr=34362

Frame 51: 66 bytes on wire (528 bits), 66 bytes captured (528 bits)
Ethernet II, Src: FonTechn_a5:e9:80 (00:18:84:a5:e9:80), Dst: SamsungE_24:63:41 (cc:05:1b:24:63:41)
Internet Protocol Version 4, Src: 54.235.185.74 (54.235.185.74), Dst: 192.168.1.101 (192.168.1.101)
Transmission Control Protocol, Src Port: http (80), Dst Port: 51243 (51243), Seq: 1, Ack: 2, Len: 0

No.     Time        Source                Destination           Protocol Length Info
     52 4.679518    192.168.1.101         54.235.185.74         TCP      66     51243 > http [ACK] Seq=2 Ack=2 Win=864 Len=0 TSval=34382 TSecr=4246385494

Frame 52: 66 bytes on wire (528 bits), 66 bytes captured (528 bits)
Ethernet II, Src: aa:aa:03:00:00:00 (aa:aa:03:00:00:00), Dst: 1b:24:63:41:00:3c (1b:24:63:41:00:3c)
Internet Protocol Version 4, Src: 192.168.1.101 (192.168.1.101), Dst: 54.235.185.74 (54.235.185.74)
Transmission Control Protocol, Src Port: 51243 (51243), Dst Port: http (80), Seq: 2, Ack: 2, Len: 0

No.     Time        Source                Destination           Protocol Length Info
     53 4.683827    108.168.157.116       192.168.1.101         TCP      54     http > 35160 [ACK] Seq=1 Ack=2 Win=17519 Len=0

Frame 53: 54 bytes on wire (432 bits), 54 bytes captured (432 bits)
Ethernet II, Src: FonTechn_a5:e9:80 (00:18:84:a5:e9:80), Dst: SamsungE_24:63:41 (cc:05:1b:24:63:41)
Internet Protocol Version 4, Src: 108.168.157.116 (108.168.157.116), Dst: 192.168.1.101 (192.168.1.101)
Transmission Control Protocol, Src Port: http (80), Dst Port: 35160 (35160), Seq: 1, Ack: 2, Len: 0

No.     Time        Source                Destination           Protocol Length Info
     54 4.684412    108.168.157.116       192.168.1.101         TCP      54     http > 35160 [FIN, ACK] Seq=1 Ack=2 Win=17519 Len=0

Frame 54: 54 bytes on wire (432 bits), 54 bytes captured (432 bits)
Ethernet II, Src: FonTechn_a5:e9:80 (00:18:84:a5:e9:80), Dst: SamsungE_24:63:41 (cc:05:1b:24:63:41)
Internet Protocol Version 4, Src: 108.168.157.116 (108.168.157.116), Dst: 192.168.1.101 (192.168.1.101)
Transmission Control Protocol, Src Port: http (80), Dst Port: 35160 (35160), Seq: 1, Ack: 2, Len: 0

No.     Time        Source                Destination           Protocol Length Info
     55 4.684575    192.168.1.101         108.168.157.116       TCP      54     35160 > http [ACK] Seq=2 Ack=2 Win=6432 Len=0

Frame 55: 54 bytes on wire (432 bits), 54 bytes captured (432 bits)
Ethernet II, Src: aa:aa:03:00:00:00 (aa:aa:03:00:00:00), Dst: 1b:24:63:41:00:30 (1b:24:63:41:00:30)
Internet Protocol Version 4, Src: 192.168.1.101 (192.168.1.101), Dst: 108.168.157.116 (108.168.157.116)
Transmission Control Protocol, Src Port: 35160 (35160), Dst Port: http (80), Seq: 2, Ack: 2, Len: 0

No.     Time        Source                Destination           Protocol Length Info
     56 6.911417    192.168.1.101         108.168.176.249       SSL      95     Continuation Data

Frame 56: 95 bytes on wire (760 bits), 95 bytes captured (760 bits)
Ethernet II, Src: aa:aa:03:00:00:00 (aa:aa:03:00:00:00), Dst: 1b:24:63:41:00:59 (1b:24:63:41:00:59)
Internet Protocol Version 4, Src: 192.168.1.101 (192.168.1.101), Dst: 108.168.176.249 (108.168.176.249)
Transmission Control Protocol, Src Port: 34097 (34097), Dst Port: https (443), Seq: 174, Ack: 278, Len: 29
Secure Sockets Layer

No.     Time        Source                Destination           Protocol Length Info
     57 7.345105    192.168.1.101         108.168.176.249       SSL      95     [TCP Retransmission] Continuation Data

Frame 57: 95 bytes on wire (760 bits), 95 bytes captured (760 bits)
Ethernet II, Src: aa:aa:03:00:00:00 (aa:aa:03:00:00:00), Dst: 1b:24:63:41:00:59 (1b:24:63:41:00:59)
Internet Protocol Version 4, Src: 192.168.1.101 (192.168.1.101), Dst: 108.168.176.249 (108.168.176.249)
Transmission Control Protocol, Src Port: 34097 (34097), Dst Port: https (443), Seq: 174, Ack: 278, Len: 29
Secure Sockets Layer

No.     Time        Source                Destination           Protocol Length Info
     58 7.443797    108.168.176.249       192.168.1.101         TCP      66     https > 34097 [ACK] Seq=278 Ack=203 Win=263168 Len=0 TSval=1864098537 TSecr=34605

Frame 58: 66 bytes on wire (528 bits), 66 bytes captured (528 bits)
Ethernet II, Src: FonTechn_a5:e9:80 (00:18:84:a5:e9:80), Dst: SamsungE_24:63:41 (cc:05:1b:24:63:41)
Internet Protocol Version 4, Src: 108.168.176.249 (108.168.176.249), Dst: 192.168.1.101 (192.168.1.101)
Transmission Control Protocol, Src Port: https (443), Dst Port: 34097 (34097), Seq: 278, Ack: 203, Len: 0

No.     Time        Source                Destination           Protocol Length Info
     59 7.444108    192.168.1.101         108.168.176.249       SSL      106    Continuation Data

Frame 59: 106 bytes on wire (848 bits), 106 bytes captured (848 bits)
Ethernet II, Src: aa:aa:03:00:00:00 (aa:aa:03:00:00:00), Dst: 1b:24:63:41:00:64 (1b:24:63:41:00:64)
Internet Protocol Version 4, Src: 192.168.1.101 (192.168.1.101), Dst: 108.168.176.249 (108.168.176.249)
Transmission Control Protocol, Src Port: 34097 (34097), Dst Port: https (443), Seq: 203, Ack: 278, Len: 40
Secure Sockets Layer

No.     Time        Source                Destination           Protocol Length Info
     60 7.546278    108.168.176.249       192.168.1.101         TCP      66     [TCP Dup ACK 58#1] https > 34097 [ACK] Seq=278 Ack=203 Win=263168 Len=0 TSval=1864098877 TSecr=34649

Frame 60: 66 bytes on wire (528 bits), 66 bytes captured (528 bits)
Ethernet II, Src: FonTechn_a5:e9:80 (00:18:84:a5:e9:80), Dst: SamsungE_24:63:41 (cc:05:1b:24:63:41)
Internet Protocol Version 4, Src: 108.168.176.249 (108.168.176.249), Dst: 192.168.1.101 (192.168.1.101)
Transmission Control Protocol, Src Port: https (443), Dst Port: 34097 (34097), Seq: 278, Ack: 203, Len: 0

No.     Time        Source                Destination           Protocol Length Info
     61 7.648960    108.168.176.249       192.168.1.101         SSL      112    Continuation Data

Frame 61: 112 bytes on wire (896 bits), 112 bytes captured (896 bits)
Ethernet II, Src: FonTechn_a5:e9:80 (00:18:84:a5:e9:80), Dst: SamsungE_24:63:41 (cc:05:1b:24:63:41)
Internet Protocol Version 4, Src: 108.168.176.249 (108.168.176.249), Dst: 192.168.1.101 (192.168.1.101)
Transmission Control Protocol, Src Port: https (443), Dst Port: 34097 (34097), Seq: 278, Ack: 243, Len: 46
Secure Sockets Layer

No.     Time        Source                Destination           Protocol Length Info
     62 7.649593    192.168.1.101         108.168.176.249       TCP      66     34097 > https [ACK] Seq=243 Ack=324 Win=6912 Len=0 TSval=34679 TSecr=1864098984

Frame 62: 66 bytes on wire (528 bits), 66 bytes captured (528 bits)
Ethernet II, Src: aa:aa:03:00:00:00 (aa:aa:03:00:00:00), Dst: 1b:24:63:41:00:3c (1b:24:63:41:00:3c)
Internet Protocol Version 4, Src: 192.168.1.101 (192.168.1.101), Dst: 108.168.176.249 (108.168.176.249)
Transmission Control Protocol, Src Port: 34097 (34097), Dst Port: https (443), Seq: 243, Ack: 324, Len: 0

No.     Time        Source                Destination           Protocol Length Info
     63 9.769567    192.168.1.101         108.168.176.249       SSL      78     Continuation Data

Frame 63: 78 bytes on wire (624 bits), 78 bytes captured (624 bits)
Ethernet II, Src: aa:aa:03:00:00:00 (aa:aa:03:00:00:00), Dst: 1b:24:63:41:00:48 (1b:24:63:41:00:48)
Internet Protocol Version 4, Src: 192.168.1.101 (192.168.1.101), Dst: 108.168.176.249 (108.168.176.249)
Transmission Control Protocol, Src Port: 34097 (34097), Dst Port: https (443), Seq: 243, Ack: 324, Len: 12
Secure Sockets Layer

No.     Time        Source                Destination           Protocol Length Info
     64 10.515150   192.168.1.101         108.168.176.249       SSL      78     [TCP Retransmission] Continuation Data

Frame 64: 78 bytes on wire (624 bits), 78 bytes captured (624 bits)
Ethernet II, Src: aa:aa:03:00:00:00 (aa:aa:03:00:00:00), Dst: 1b:24:63:41:00:48 (1b:24:63:41:00:48)
Internet Protocol Version 4, Src: 192.168.1.101 (192.168.1.101), Dst: 108.168.176.249 (108.168.176.249)
Transmission Control Protocol, Src Port: 34097 (34097), Dst Port: https (443), Seq: 243, Ack: 324, Len: 12
Secure Sockets Layer

No.     Time        Source                Destination           Protocol Length Info
     65 10.515925   108.168.176.249       192.168.1.101         SSL      93     Continuation Data

Frame 65: 93 bytes on wire (744 bits), 93 bytes captured (744 bits)
Ethernet II, Src: FonTechn_a5:e9:80 (00:18:84:a5:e9:80), Dst: SamsungE_24:63:41 (cc:05:1b:24:63:41)
Internet Protocol Version 4, Src: 108.168.176.249 (108.168.176.249), Dst: 192.168.1.101 (192.168.1.101)
Transmission Control Protocol, Src Port: https (443), Dst Port: 34097 (34097), Seq: 324, Ack: 255, Len: 27
Secure Sockets Layer

No.     Time        Source                Destination           Protocol Length Info
     66 10.516187   192.168.1.101         108.168.176.249       SSL      91     Continuation Data

Frame 66: 91 bytes on wire (728 bits), 91 bytes captured (728 bits)
Ethernet II, Src: aa:aa:03:00:00:00 (aa:aa:03:00:00:00), Dst: 1b:24:63:41:00:55 (1b:24:63:41:00:55)
Internet Protocol Version 4, Src: 192.168.1.101 (192.168.1.101), Dst: 108.168.176.249 (108.168.176.249)
Transmission Control Protocol, Src Port: 34097 (34097), Dst Port: https (443), Seq: 255, Ack: 351, Len: 25
Secure Sockets Layer

No.     Time        Source                Destination           Protocol Length Info
     67 10.521955   108.168.176.249       192.168.1.101         SSL      93     [TCP Retransmission] Continuation Data

Frame 67: 93 bytes on wire (744 bits), 93 bytes captured (744 bits)
Ethernet II, Src: FonTechn_a5:e9:80 (00:18:84:a5:e9:80), Dst: SamsungE_24:63:41 (cc:05:1b:24:63:41)
Internet Protocol Version 4, Src: 108.168.176.249 (108.168.176.249), Dst: 192.168.1.101 (192.168.1.101)
Transmission Control Protocol, Src Port: https (443), Dst Port: 34097 (34097), Seq: 324, Ack: 255, Len: 27
Secure Sockets Layer

No.     Time        Source                Destination           Protocol Length Info
     68 10.522150   192.168.1.101         108.168.176.249       TCP      78     [TCP Dup ACK 66#1] 34097 > https [ACK] Seq=280 Ack=351 Win=6912 Len=0 TSval=34966 TSecr=1864101854 SLE=324 SRE=351

Frame 68: 78 bytes on wire (624 bits), 78 bytes captured (624 bits)
Ethernet II, Src: aa:aa:03:00:00:00 (aa:aa:03:00:00:00), Dst: 1b:24:63:41:00:48 (1b:24:63:41:00:48)
Internet Protocol Version 4, Src: 192.168.1.101 (192.168.1.101), Dst: 108.168.176.249 (108.168.176.249)
Transmission Control Protocol, Src Port: 34097 (34097), Dst Port: https (443), Seq: 280, Ack: 351, Len: 0

No.     Time        Source                Destination           Protocol Length Info
     69 10.703942   108.168.176.249       192.168.1.101         SSL      84     Continuation Data

Frame 69: 84 bytes on wire (672 bits), 84 bytes captured (672 bits)
Ethernet II, Src: FonTechn_a5:e9:80 (00:18:84:a5:e9:80), Dst: SamsungE_24:63:41 (cc:05:1b:24:63:41)
Internet Protocol Version 4, Src: 108.168.176.249 (108.168.176.249), Dst: 192.168.1.101 (192.168.1.101)
Transmission Control Protocol, Src Port: https (443), Dst Port: 34097 (34097), Seq: 351, Ack: 280, Len: 18
Secure Sockets Layer

No.     Time        Source                Destination           Protocol Length Info
     70 10.704320   192.168.1.101         108.168.176.249       TCP      66     34097 > https [ACK] Seq=280 Ack=369 Win=6912 Len=0 TSval=34984 TSecr=1864102062

Frame 70: 66 bytes on wire (528 bits), 66 bytes captured (528 bits)
Ethernet II, Src: aa:aa:03:00:00:00 (aa:aa:03:00:00:00), Dst: 1b:24:63:41:00:3c (1b:24:63:41:00:3c)
Internet Protocol Version 4, Src: 192.168.1.101 (192.168.1.101), Dst: 108.168.176.249 (108.168.176.249)
Transmission Control Protocol, Src Port: 34097 (34097), Dst Port: https (443), Seq: 280, Ack: 369, Len: 0

No.     Time        Source                Destination           Protocol Length Info
     71 11.020150   192.168.1.101         108.168.176.249       SSL      127    Continuation Data

Frame 71: 127 bytes on wire (1016 bits), 127 bytes captured (1016 bits)
Ethernet II, Src: aa:aa:03:00:00:00 (aa:aa:03:00:00:00), Dst: 1b:24:63:41:00:79 (1b:24:63:41:00:79)
Internet Protocol Version 4, Src: 192.168.1.101 (192.168.1.101), Dst: 108.168.176.249 (108.168.176.249)
Transmission Control Protocol, Src Port: 34097 (34097), Dst Port: https (443), Seq: 280, Ack: 369, Len: 61
Secure Sockets Layer

No.     Time        Source                Destination           Protocol Length Info
     72 12.052145   108.168.176.249       192.168.1.101         SSL      110    Continuation Data

Frame 72: 110 bytes on wire (880 bits), 110 bytes captured (880 bits)
Ethernet II, Src: FonTechn_a5:e9:80 (00:18:84:a5:e9:80), Dst: SamsungE_24:63:41 (cc:05:1b:24:63:41)
Internet Protocol Version 4, Src: 108.168.176.249 (108.168.176.249), Dst: 192.168.1.101 (192.168.1.101)
Transmission Control Protocol, Src Port: https (443), Dst Port: 34097 (34097), Seq: 369, Ack: 341, Len: 44
Secure Sockets Layer

No.     Time        Source                Destination           Protocol Length Info
     73 12.052490   192.168.1.101         108.168.176.249       TCP      66     34097 > https [ACK] Seq=341 Ack=413 Win=6912 Len=0 TSval=35119 TSecr=1864102567

Frame 73: 66 bytes on wire (528 bits), 66 bytes captured (528 bits)
Ethernet II, Src: aa:aa:03:00:00:00 (aa:aa:03:00:00:00), Dst: 1b:24:63:41:00:3c (1b:24:63:41:00:3c)
Internet Protocol Version 4, Src: 192.168.1.101 (192.168.1.101), Dst: 108.168.176.249 (108.168.176.249)
Transmission Control Protocol, Src Port: 34097 (34097), Dst Port: https (443), Seq: 341, Ack: 413, Len: 0

No.     Time        Source                Destination           Protocol Length Info
     74 12.106758   192.168.1.101         108.168.176.249       SSL      121    Continuation Data

Frame 74: 121 bytes on wire (968 bits), 121 bytes captured (968 bits)
Ethernet II, Src: aa:aa:03:00:00:00 (aa:aa:03:00:00:00), Dst: 1b:24:63:41:00:73 (1b:24:63:41:00:73)
Internet Protocol Version 4, Src: 192.168.1.101 (192.168.1.101), Dst: 108.168.176.249 (108.168.176.249)
Transmission Control Protocol, Src Port: 34097 (34097), Dst Port: https (443), Seq: 341, Ack: 413, Len: 55
Secure Sockets Layer

No.     Time        Source                Destination           Protocol Length Info
     75 12.213722   108.168.176.249       192.168.1.101         SSL      110    [TCP Retransmission] Continuation Data

Frame 75: 110 bytes on wire (880 bits), 110 bytes captured (880 bits)
Ethernet II, Src: FonTechn_a5:e9:80 (00:18:84:a5:e9:80), Dst: SamsungE_24:63:41 (cc:05:1b:24:63:41)
Internet Protocol Version 4, Src: 108.168.176.249 (108.168.176.249), Dst: 192.168.1.101 (192.168.1.101)
Transmission Control Protocol, Src Port: https (443), Dst Port: 34097 (34097), Seq: 369, Ack: 341, Len: 44
Secure Sockets Layer

No.     Time        Source                Destination           Protocol Length Info
     76 12.214095   192.168.1.101         108.168.176.249       TCP      78     [TCP Dup ACK 74#1] 34097 > https [ACK] Seq=396 Ack=413 Win=6912 Len=0 TSval=35135 TSecr=1864103576 SLE=369 SRE=413

Frame 76: 78 bytes on wire (624 bits), 78 bytes captured (624 bits)
Ethernet II, Src: aa:aa:03:00:00:00 (aa:aa:03:00:00:00), Dst: 1b:24:63:41:00:48 (1b:24:63:41:00:48)
Internet Protocol Version 4, Src: 192.168.1.101 (192.168.1.101), Dst: 108.168.176.249 (108.168.176.249)
Transmission Control Protocol, Src Port: 34097 (34097), Dst Port: https (443), Seq: 396, Ack: 413, Len: 0

No.     Time        Source                Destination           Protocol Length Info
     77 12.293777   108.168.176.249       192.168.1.101         SSL      110    Continuation Data

Frame 77: 110 bytes on wire (880 bits), 110 bytes captured (880 bits)
Ethernet II, Src: FonTechn_a5:e9:80 (00:18:84:a5:e9:80), Dst: SamsungE_24:63:41 (cc:05:1b:24:63:41)
Internet Protocol Version 4, Src: 108.168.176.249 (108.168.176.249), Dst: 192.168.1.101 (192.168.1.101)
Transmission Control Protocol, Src Port: https (443), Dst Port: 34097 (34097), Seq: 413, Ack: 396, Len: 44
Secure Sockets Layer

No.     Time        Source                Destination           Protocol Length Info
     78 12.294117   192.168.1.101         108.168.176.249       TCP      66     34097 > https [ACK] Seq=396 Ack=457 Win=6912 Len=0 TSval=35143 TSecr=1864103662

Frame 78: 66 bytes on wire (528 bits), 66 bytes captured (528 bits)
Ethernet II, Src: aa:aa:03:00:00:00 (aa:aa:03:00:00:00), Dst: 1b:24:63:41:00:3c (1b:24:63:41:00:3c)
Internet Protocol Version 4, Src: 192.168.1.101 (192.168.1.101), Dst: 108.168.176.249 (108.168.176.249)
Transmission Control Protocol, Src Port: 34097 (34097), Dst Port: https (443), Seq: 396, Ack: 457, Len: 0

No.     Time        Source                Destination           Protocol Length Info
     79 12.461940   FonTechn_a5:e9:81     Spanning-tree-(for-bridges)_00 STP      52     Conf. Root = 32768/0/00:18:84:a5:e9:80  Cost = 0  Port = 0x8002

Frame 79: 52 bytes on wire (416 bits), 52 bytes captured (416 bits)
IEEE 802.3 Ethernet 
Logical-Link Control
Spanning Tree Protocol

No.     Time        Source                Destination           Protocol Length Info
     80 12.768637   FonTechn_a5:e9:80     SamsungE_24:63:41     ARP      42     Who has 192.168.1.101?  Tell 192.168.1.1

Frame 80: 42 bytes on wire (336 bits), 42 bytes captured (336 bits)
Ethernet II, Src: FonTechn_a5:e9:80 (00:18:84:a5:e9:80), Dst: SamsungE_24:63:41 (cc:05:1b:24:63:41)
Address Resolution Protocol (request)

No.     Time        Source                Destination           Protocol Length Info
     81 12.768705   aa:aa:03:00:00:00     1b:24:63:41:00:24     ARP      42     192.168.1.101 is at cc:05:1b:24:63:41

Frame 81: 42 bytes on wire (336 bits), 42 bytes captured (336 bits)
Ethernet II, Src: aa:aa:03:00:00:00 (aa:aa:03:00:00:00), Dst: 1b:24:63:41:00:24 (1b:24:63:41:00:24)
Address Resolution Protocol (reply)

No.     Time        Source                Destination           Protocol Length Info
     82 13.322652   192.168.1.101         108.168.176.249       SSL      121    Continuation Data

Frame 82: 121 bytes on wire (968 bits), 121 bytes captured (968 bits)
Ethernet II, Src: aa:aa:03:00:00:00 (aa:aa:03:00:00:00), Dst: 1b:24:63:41:00:73 (1b:24:63:41:00:73)
Internet Protocol Version 4, Src: 192.168.1.101 (192.168.1.101), Dst: 108.168.176.249 (108.168.176.249)
Transmission Control Protocol, Src Port: 34097 (34097), Dst Port: https (443), Seq: 396, Ack: 457, Len: 55
Secure Sockets Layer

No.     Time        Source                Destination           Protocol Length Info
     83 14.816962   108.168.176.249       192.168.1.101         SSL      110    Continuation Data

Frame 83: 110 bytes on wire (880 bits), 110 bytes captured (880 bits)
Ethernet II, Src: FonTechn_a5:e9:80 (00:18:84:a5:e9:80), Dst: SamsungE_24:63:41 (cc:05:1b:24:63:41)
Internet Protocol Version 4, Src: 108.168.176.249 (108.168.176.249), Dst: 192.168.1.101 (192.168.1.101)
Transmission Control Protocol, Src Port: https (443), Dst Port: 34097 (34097), Seq: 457, Ack: 451, Len: 44
Secure Sockets Layer

No.     Time        Source                Destination           Protocol Length Info
     84 14.817337   192.168.1.101         108.168.176.249       TCP      66     34097 > https [ACK] Seq=451 Ack=501 Win=6912 Len=0 TSval=35396 TSecr=1864104887

Frame 84: 66 bytes on wire (528 bits), 66 bytes captured (528 bits)
Ethernet II, Src: aa:aa:03:00:00:00 (aa:aa:03:00:00:00), Dst: 1b:24:63:41:00:3c (1b:24:63:41:00:3c)
Internet Protocol Version 4, Src: 192.168.1.101 (192.168.1.101), Dst: 108.168.176.249 (108.168.176.249)
Transmission Control Protocol, Src Port: 34097 (34097), Dst Port: https (443), Seq: 451, Ack: 501, Len: 0

No.     Time        Source                Destination           Protocol Length Info
     85 16.996613   192.168.1.101         108.168.176.249       SSL      95     Continuation Data

Frame 85: 95 bytes on wire (760 bits), 95 bytes captured (760 bits)
Ethernet II, Src: aa:aa:03:00:00:00 (aa:aa:03:00:00:00), Dst: 1b:24:63:41:00:59 (1b:24:63:41:00:59)
Internet Protocol Version 4, Src: 192.168.1.101 (192.168.1.101), Dst: 108.168.176.249 (108.168.176.249)
Transmission Control Protocol, Src Port: 34097 (34097), Dst Port: https (443), Seq: 451, Ack: 501, Len: 29
Secure Sockets Layer

No.     Time        Source                Destination           Protocol Length Info
     86 18.198712   108.168.176.249       192.168.1.101         TCP      66     https > 34097 [ACK] Seq=501 Ack=480 Win=263168 Len=0 TSval=1864108583 TSecr=35614

Frame 86: 66 bytes on wire (528 bits), 66 bytes captured (528 bits)
Ethernet II, Src: FonTechn_a5:e9:80 (00:18:84:a5:e9:80), Dst: SamsungE_24:63:41 (cc:05:1b:24:63:41)
Internet Protocol Version 4, Src: 108.168.176.249 (108.168.176.249), Dst: 192.168.1.101 (192.168.1.101)
Transmission Control Protocol, Src Port: https (443), Dst Port: 34097 (34097), Seq: 501, Ack: 480, Len: 0

No.     Time        Source                Destination           Protocol Length Info
     87 18.199093   192.168.1.101         108.168.176.249       SSL      106    Continuation Data

Frame 87: 106 bytes on wire (848 bits), 106 bytes captured (848 bits)
Ethernet II, Src: aa:aa:03:00:00:00 (aa:aa:03:00:00:00), Dst: 1b:24:63:41:00:64 (1b:24:63:41:00:64)
Internet Protocol Version 4, Src: 192.168.1.101 (192.168.1.101), Dst: 108.168.176.249 (108.168.176.249)
Transmission Control Protocol, Src Port: 34097 (34097), Dst Port: https (443), Seq: 480, Ack: 501, Len: 40
Secure Sockets Layer

No.     Time        Source                Destination           Protocol Length Info
     88 18.401795   FonTechn_a5:e9:81     Spanning-tree-(for-bridges)_00 STP      52     Conf. Root = 32768/0/00:18:84:a5:e9:80  Cost = 0  Port = 0x8002

Frame 88: 52 bytes on wire (416 bits), 52 bytes captured (416 bits)
IEEE 802.3 Ethernet 
Logical-Link Control
Spanning Tree Protocol

No.     Time        Source                Destination           Protocol Length Info
     89 18.606302   108.168.176.249       192.168.1.101         SSL      112    Continuation Data

Frame 89: 112 bytes on wire (896 bits), 112 bytes captured (896 bits)
Ethernet II, Src: FonTechn_a5:e9:80 (00:18:84:a5:e9:80), Dst: SamsungE_24:63:41 (cc:05:1b:24:63:41)
Internet Protocol Version 4, Src: 108.168.176.249 (108.168.176.249), Dst: 192.168.1.101 (192.168.1.101)
Transmission Control Protocol, Src Port: https (443), Dst Port: 34097 (34097), Seq: 501, Ack: 520, Len: 46
Secure Sockets Layer

No.     Time        Source                Destination           Protocol Length Info
     90 18.606703   192.168.1.101         108.168.176.249       TCP      66     34097 > https [ACK] Seq=520 Ack=547 Win=6912 Len=0 TSval=35775 TSecr=1864109765

Frame 90: 66 bytes on wire (528 bits), 66 bytes captured (528 bits)
Ethernet II, Src: aa:aa:03:00:00:00 (aa:aa:03:00:00:00), Dst: 1b:24:63:41:00:3c (1b:24:63:41:00:3c)
Internet Protocol Version 4, Src: 192.168.1.101 (192.168.1.101), Dst: 108.168.176.249 (108.168.176.249)
Transmission Control Protocol, Src Port: 34097 (34097), Dst Port: https (443), Seq: 520, Ack: 547, Len: 0

No.     Time        Source                Destination           Protocol Length Info
     91 21.774685   192.168.1.101         108.168.176.249       SSL      127    Continuation Data

Frame 91: 127 bytes on wire (1016 bits), 127 bytes captured (1016 bits)
Ethernet II, Src: aa:aa:03:00:00:00 (aa:aa:03:00:00:00), Dst: 1b:24:63:41:00:79 (1b:24:63:41:00:79)
Internet Protocol Version 4, Src: 192.168.1.101 (192.168.1.101), Dst: 108.168.176.249 (108.168.176.249)
Transmission Control Protocol, Src Port: 34097 (34097), Dst Port: https (443), Seq: 520, Ack: 547, Len: 61
Secure Sockets Layer

No.     Time        Source                Destination           Protocol Length Info
     92 24.505222   192.168.1.101         108.168.176.249       SSL      127    [TCP Retransmission] Continuation Data

Frame 92: 127 bytes on wire (1016 bits), 127 bytes captured (1016 bits)
Ethernet II, Src: aa:aa:03:00:00:00 (aa:aa:03:00:00:00), Dst: 1b:24:63:41:00:79 (1b:24:63:41:00:79)
Internet Protocol Version 4, Src: 192.168.1.101 (192.168.1.101), Dst: 108.168.176.249 (108.168.176.249)
Transmission Control Protocol, Src Port: 34097 (34097), Dst Port: https (443), Seq: 520, Ack: 547, Len: 61
Secure Sockets Layer

No.     Time        Source                Destination           Protocol Length Info
     93 28.131522   108.168.176.249       192.168.1.101         SSL      110    Continuation Data

Frame 93: 110 bytes on wire (880 bits), 110 bytes captured (880 bits)
Ethernet II, Src: FonTechn_a5:e9:80 (00:18:84:a5:e9:80), Dst: SamsungE_24:63:41 (cc:05:1b:24:63:41)
Internet Protocol Version 4, Src: 108.168.176.249 (108.168.176.249), Dst: 192.168.1.101 (192.168.1.101)
Transmission Control Protocol, Src Port: https (443), Dst Port: 34097 (34097), Seq: 547, Ack: 581, Len: 44
Secure Sockets Layer

No.     Time        Source                Destination           Protocol Length Info
     94 28.132177   192.168.1.101         108.168.176.249       SSL      179    Continuation Data

Frame 94: 179 bytes on wire (1432 bits), 179 bytes captured (1432 bits)
Ethernet II, Src: aa:aa:03:00:00:00 (aa:aa:03:00:00:00), Dst: 1b:24:63:41:00:ad (1b:24:63:41:00:ad)
Internet Protocol Version 4, Src: 192.168.1.101 (192.168.1.101), Dst: 108.168.176.249 (108.168.176.249)
Transmission Control Protocol, Src Port: 34097 (34097), Dst Port: https (443), Seq: 581, Ack: 591, Len: 113
Secure Sockets Layer

No.     Time        Source                Destination           Protocol Length Info
     95 28.138553   108.168.176.249       192.168.1.101         SSL      110    [TCP Retransmission] Continuation Data

Frame 95: 110 bytes on wire (880 bits), 110 bytes captured (880 bits)
Ethernet II, Src: FonTechn_a5:e9:80 (00:18:84:a5:e9:80), Dst: SamsungE_24:63:41 (cc:05:1b:24:63:41)
Internet Protocol Version 4, Src: 108.168.176.249 (108.168.176.249), Dst: 192.168.1.101 (192.168.1.101)
Transmission Control Protocol, Src Port: https (443), Dst Port: 34097 (34097), Seq: 547, Ack: 581, Len: 44
Secure Sockets Layer

No.     Time        Source                Destination           Protocol Length Info
     96 28.138890   192.168.1.101         108.168.176.249       TCP      78     [TCP Dup ACK 94#1] 34097 > https [ACK] Seq=694 Ack=591 Win=6912 Len=0 TSval=36728 TSecr=1864118269 SLE=547 SRE=591

Frame 96: 78 bytes on wire (624 bits), 78 bytes captured (624 bits)
Ethernet II, Src: aa:aa:03:00:00:00 (aa:aa:03:00:00:00), Dst: 1b:24:63:41:00:48 (1b:24:63:41:00:48)
Internet Protocol Version 4, Src: 192.168.1.101 (192.168.1.101), Dst: 108.168.176.249 (108.168.176.249)
Transmission Control Protocol, Src Port: 34097 (34097), Dst Port: https (443), Seq: 694, Ack: 591, Len: 0

No.     Time        Source                Destination           Protocol Length Info
     97 33.555143   192.168.1.101         108.168.176.249       SSL      179    [TCP Retransmission] Continuation Data

Frame 97: 179 bytes on wire (1432 bits), 179 bytes captured (1432 bits)
Ethernet II, Src: aa:aa:03:00:00:00 (aa:aa:03:00:00:00), Dst: 1b:24:63:41:00:ad (1b:24:63:41:00:ad)
Internet Protocol Version 4, Src: 192.168.1.101 (192.168.1.101), Dst: 108.168.176.249 (108.168.176.249)
Transmission Control Protocol, Src Port: 34097 (34097), Dst Port: https (443), Seq: 581, Ack: 591, Len: 113
Secure Sockets Layer
