No.     Time        Source                Destination           Protocol Length Info
      1 0.000000    198.232.124.224       37.179.170.215        HTTP     1366   Continuation or non-HTTP traffic

Frame 1: 1366 bytes on wire (10928 bits), 1366 bytes captured (10928 bits)
Linux cooked capture
Internet Protocol Version 4, Src: 198.232.124.224 (198.232.124.224), Dst: 37.179.170.215 (37.179.170.215)
Transmission Control Protocol, Src Port: http (80), Dst Port: 48723 (48723), Seq: 1, Ack: 1, Len: 1298
Hypertext Transfer Protocol

No.     Time        Source                Destination           Protocol Length Info
      2 0.000053    37.179.170.215        198.232.124.224       TCP      68     48723 > http [ACK] Seq=1 Ack=1299 Win=3906 Len=0 TSval=15244 TSecr=1716032392

Frame 2: 68 bytes on wire (544 bits), 68 bytes captured (544 bits)
Linux cooked capture
Internet Protocol Version 4, Src: 37.179.170.215 (37.179.170.215), Dst: 198.232.124.224 (198.232.124.224)
Transmission Control Protocol, Src Port: 48723 (48723), Dst Port: http (80), Seq: 1, Ack: 1299, Len: 0

No.     Time        Source                Destination           Protocol Length Info
      3 0.374993    108.168.157.116       37.179.170.215        TCP      68     http > 51955 [ACK] Seq=1 Ack=1 Win=64251 Len=0 TSval=1716032443 TSecr=15186

Frame 3: 68 bytes on wire (544 bits), 68 bytes captured (544 bits)
Linux cooked capture
Internet Protocol Version 4, Src: 108.168.157.116 (108.168.157.116), Dst: 37.179.170.215 (37.179.170.215)
Transmission Control Protocol, Src Port: http (80), Dst Port: 51955 (51955), Seq: 1, Ack: 1, Len: 0

No.     Time        Source                Destination           Protocol Length Info
      4 0.645060    108.168.157.116       37.179.170.215        HTTP     336    HTTP/1.1 200 OK  (text/html)

Frame 4: 336 bytes on wire (2688 bits), 336 bytes captured (2688 bits)
Linux cooked capture
Internet Protocol Version 4, Src: 108.168.157.116 (108.168.157.116), Dst: 37.179.170.215 (37.179.170.215)
Transmission Control Protocol, Src Port: http (80), Dst Port: 51955 (51955), Seq: 1, Ack: 1, Len: 268
Hypertext Transfer Protocol
Line-based text data: text/html

No.     Time        Source                Destination           Protocol Length Info
      5 0.645563    37.179.170.215        108.168.157.116       TCP      68     51955 > http [ACK] Seq=1 Ack=269 Win=1959 Len=0 TSval=15309 TSecr=1716032471

Frame 5: 68 bytes on wire (544 bits), 68 bytes captured (544 bits)
Linux cooked capture
Internet Protocol Version 4, Src: 37.179.170.215 (37.179.170.215), Dst: 108.168.157.116 (108.168.157.116)
Transmission Control Protocol, Src Port: 51955 (51955), Dst Port: http (80), Seq: 1, Ack: 269, Len: 0

No.     Time        Source                Destination           Protocol Length Info
      6 0.734910    54.235.185.74         37.179.170.215        TCP      68     http > 43725 [ACK] Seq=1 Ack=1 Win=64251 Len=0 TSval=1716032479 TSecr=15190

Frame 6: 68 bytes on wire (544 bits), 68 bytes captured (544 bits)
Linux cooked capture
Internet Protocol Version 4, Src: 54.235.185.74 (54.235.185.74), Dst: 37.179.170.215 (37.179.170.215)
Transmission Control Protocol, Src Port: http (80), Dst Port: 43725 (43725), Seq: 1, Ack: 1, Len: 0

No.     Time        Source                Destination           Protocol Length Info
      7 0.925077    54.235.185.74         37.179.170.215        HTTP     291    HTTP/1.1 200 OK  (GIF89a)

Frame 7: 291 bytes on wire (2328 bits), 291 bytes captured (2328 bits)
Linux cooked capture
Internet Protocol Version 4, Src: 54.235.185.74 (54.235.185.74), Dst: 37.179.170.215 (37.179.170.215)
Transmission Control Protocol, Src Port: http (80), Dst Port: 43725 (43725), Seq: 1, Ack: 1, Len: 223
Hypertext Transfer Protocol
Compuserve GIF, Version: GIF89a

No.     Time        Source                Destination           Protocol Length Info
      8 0.925537    37.179.170.215        54.235.185.74         TCP      68     43725 > http [ACK] Seq=1 Ack=224 Win=1578 Len=0 TSval=15337 TSecr=1716032499

Frame 8: 68 bytes on wire (544 bits), 68 bytes captured (544 bits)
Linux cooked capture
Internet Protocol Version 4, Src: 37.179.170.215 (37.179.170.215), Dst: 54.235.185.74 (54.235.185.74)
Transmission Control Protocol, Src Port: 43725 (43725), Dst Port: http (80), Seq: 1, Ack: 224, Len: 0

No.     Time        Source                Destination           Protocol Length Info
      9 0.995122    198.232.124.224       37.179.170.215        TCP      1366   [TCP Retransmission] [TCP segment of a reassembled PDU]

Frame 9: 1366 bytes on wire (10928 bits), 1366 bytes captured (10928 bits)
Linux cooked capture
Internet Protocol Version 4, Src: 198.232.124.224 (198.232.124.224), Dst: 37.179.170.215 (37.179.170.215)
Transmission Control Protocol, Src Port: http (80), Dst Port: 48723 (48723), Seq: 4294963403, Ack: 1, Len: 1298

No.     Time        Source                Destination           Protocol Length Info
     10 0.995637    37.179.170.215        198.232.124.224       TCP      80     [TCP Dup ACK 2#1] 48723 > http [ACK] Seq=1 Ack=1299 Win=3906 Len=0 TSval=15344 TSecr=1716032392 SLE=4294963403 SRE=4294964701

Frame 10: 80 bytes on wire (640 bits), 80 bytes captured (640 bits)
Linux cooked capture
Internet Protocol Version 4, Src: 37.179.170.215 (37.179.170.215), Dst: 198.232.124.224 (198.232.124.224)
Transmission Control Protocol, Src Port: 48723 (48723), Dst Port: http (80), Seq: 1, Ack: 1299, Len: 0

No.     Time        Source                Destination           Protocol Length Info
     11 1.014898    198.232.124.224       37.179.170.215        TCP      68     [TCP Dup ACK 9#1] http > 48723 [ACK] Seq=1299 Ack=1 Win=64251 Len=0 TSval=1716032507 TSecr=15183

Frame 11: 68 bytes on wire (544 bits), 68 bytes captured (544 bits)
Linux cooked capture
Internet Protocol Version 4, Src: 198.232.124.224 (198.232.124.224), Dst: 37.179.170.215 (37.179.170.215)
Transmission Control Protocol, Src Port: http (80), Dst Port: 48723 (48723), Seq: 1299, Ack: 1, Len: 0

No.     Time        Source                Destination           Protocol Length Info
     12 1.574943    108.168.157.116       37.179.170.215        TCP      68     [TCP Dup ACK 4#1] http > 51955 [ACK] Seq=269 Ack=1 Win=64251 Len=0 TSval=1716032563 TSecr=15186

Frame 12: 68 bytes on wire (544 bits), 68 bytes captured (544 bits)
Linux cooked capture
Internet Protocol Version 4, Src: 108.168.157.116 (108.168.157.116), Dst: 37.179.170.215 (37.179.170.215)
Transmission Control Protocol, Src Port: http (80), Dst Port: 51955 (51955), Seq: 269, Ack: 1, Len: 0

No.     Time        Source                Destination           Protocol Length Info
     13 1.625217    198.232.124.224       37.179.170.215        HTTP     1366   [TCP Retransmission] Continuation or non-HTTP traffic

Frame 13: 1366 bytes on wire (10928 bits), 1366 bytes captured (10928 bits)
Linux cooked capture
Internet Protocol Version 4, Src: 198.232.124.224 (198.232.124.224), Dst: 37.179.170.215 (37.179.170.215)
Transmission Control Protocol, Src Port: http (80), Dst Port: 48723 (48723), Seq: 4294964701, Ack: 1, Len: 1298
Hypertext Transfer Protocol

No.     Time        Source                Destination           Protocol Length Info
     14 1.625772    37.179.170.215        198.232.124.224       TCP      80     [TCP Dup ACK 2#2] 48723 > http [ACK] Seq=1 Ack=1299 Win=3906 Len=0 TSval=15407 TSecr=1716032507 SLE=4294964701 SRE=4294965999

Frame 14: 80 bytes on wire (640 bits), 80 bytes captured (640 bits)
Linux cooked capture
Internet Protocol Version 4, Src: 37.179.170.215 (37.179.170.215), Dst: 198.232.124.224 (198.232.124.224)
Transmission Control Protocol, Src Port: 48723 (48723), Dst Port: http (80), Seq: 1, Ack: 1299, Len: 0

No.     Time        Source                Destination           Protocol Length Info
     15 1.645118    198.232.124.224       37.179.170.215        HTTP     1366   [TCP Retransmission] Continuation or non-HTTP traffic

Frame 15: 1366 bytes on wire (10928 bits), 1366 bytes captured (10928 bits)
Linux cooked capture
Internet Protocol Version 4, Src: 198.232.124.224 (198.232.124.224), Dst: 37.179.170.215 (37.179.170.215)
Transmission Control Protocol, Src Port: http (80), Dst Port: 48723 (48723), Seq: 4294965999, Ack: 1, Len: 1298
Hypertext Transfer Protocol

No.     Time        Source                Destination           Protocol Length Info
     16 1.645433    37.179.170.215        198.232.124.224       TCP      80     [TCP Dup ACK 2#3] 48723 > http [ACK] Seq=1 Ack=1299 Win=3906 Len=0 TSval=15409 TSecr=1716032507 SLE=4294965999 SRE=1

Frame 16: 80 bytes on wire (640 bits), 80 bytes captured (640 bits)
Linux cooked capture
Internet Protocol Version 4, Src: 37.179.170.215 (37.179.170.215), Dst: 198.232.124.224 (198.232.124.224)
Transmission Control Protocol, Src Port: 48723 (48723), Dst Port: http (80), Seq: 1, Ack: 1299, Len: 0

No.     Time        Source                Destination           Protocol Length Info
     17 1.665380    198.232.124.224       37.179.170.215        HTTP     1366   [TCP Retransmission] Continuation or non-HTTP traffic

Frame 17: 1366 bytes on wire (10928 bits), 1366 bytes captured (10928 bits)
Linux cooked capture
Internet Protocol Version 4, Src: 198.232.124.224 (198.232.124.224), Dst: 37.179.170.215 (37.179.170.215)
Transmission Control Protocol, Src Port: http (80), Dst Port: 48723 (48723), Seq: 1, Ack: 1, Len: 1298
Hypertext Transfer Protocol

No.     Time        Source                Destination           Protocol Length Info
     18 1.665643    198.232.124.224       37.179.170.215        HTTP     1366   Continuation or non-HTTP traffic

Frame 18: 1366 bytes on wire (10928 bits), 1366 bytes captured (10928 bits)
Linux cooked capture
Internet Protocol Version 4, Src: 198.232.124.224 (198.232.124.224), Dst: 37.179.170.215 (37.179.170.215)
Transmission Control Protocol, Src Port: http (80), Dst Port: 48723 (48723), Seq: 1299, Ack: 1, Len: 1298
Hypertext Transfer Protocol

No.     Time        Source                Destination           Protocol Length Info
     19 1.666168    37.179.170.215        198.232.124.224       TCP      80     [TCP Dup ACK 2#4] 48723 > http [ACK] Seq=1 Ack=1299 Win=3906 Len=0 TSval=15411 TSecr=1716032571 SLE=1 SRE=1299

Frame 19: 80 bytes on wire (640 bits), 80 bytes captured (640 bits)
Linux cooked capture
Internet Protocol Version 4, Src: 37.179.170.215 (37.179.170.215), Dst: 198.232.124.224 (198.232.124.224)
Transmission Control Protocol, Src Port: 48723 (48723), Dst Port: http (80), Seq: 1, Ack: 1299, Len: 0

No.     Time        Source                Destination           Protocol Length Info
     20 1.666638    37.179.170.215        198.232.124.224       TCP      68     48723 > http [ACK] Seq=1 Ack=2597 Win=4555 Len=0 TSval=15411 TSecr=1716032571

Frame 20: 68 bytes on wire (544 bits), 68 bytes captured (544 bits)
Linux cooked capture
Internet Protocol Version 4, Src: 37.179.170.215 (37.179.170.215), Dst: 198.232.124.224 (198.232.124.224)
Transmission Control Protocol, Src Port: 48723 (48723), Dst Port: http (80), Seq: 1, Ack: 2597, Len: 0

No.     Time        Source                Destination           Protocol Length Info
     21 1.695062    198.232.124.224       37.179.170.215        HTTP     1366   Continuation or non-HTTP traffic

Frame 21: 1366 bytes on wire (10928 bits), 1366 bytes captured (10928 bits)
Linux cooked capture
Internet Protocol Version 4, Src: 198.232.124.224 (198.232.124.224), Dst: 37.179.170.215 (37.179.170.215)
Transmission Control Protocol, Src Port: http (80), Dst Port: 48723 (48723), Seq: 2597, Ack: 1, Len: 1298
Hypertext Transfer Protocol

No.     Time        Source                Destination           Protocol Length Info
     22 1.696112    37.179.170.215        198.232.124.224       TCP      68     48723 > http [ACK] Seq=1 Ack=3895 Win=5204 Len=0 TSval=15414 TSecr=1716032571

Frame 22: 68 bytes on wire (544 bits), 68 bytes captured (544 bits)
Linux cooked capture
Internet Protocol Version 4, Src: 37.179.170.215 (37.179.170.215), Dst: 198.232.124.224 (198.232.124.224)
Transmission Control Protocol, Src Port: 48723 (48723), Dst Port: http (80), Seq: 1, Ack: 3895, Len: 0

No.     Time        Source                Destination           Protocol Length Info
     23 1.745123    198.232.124.224       37.179.170.215        HTTP     1366   Continuation or non-HTTP traffic

Frame 23: 1366 bytes on wire (10928 bits), 1366 bytes captured (10928 bits)
Linux cooked capture
Internet Protocol Version 4, Src: 198.232.124.224 (198.232.124.224), Dst: 37.179.170.215 (37.179.170.215)
Transmission Control Protocol, Src Port: http (80), Dst Port: 48723 (48723), Seq: 3895, Ack: 1, Len: 1298
Hypertext Transfer Protocol

No.     Time        Source                Destination           Protocol Length Info
     24 1.745887    37.179.170.215        198.232.124.224       TCP      68     48723 > http [ACK] Seq=1 Ack=5193 Win=5853 Len=0 TSval=15419 TSecr=1716032579

Frame 24: 68 bytes on wire (544 bits), 68 bytes captured (544 bits)
Linux cooked capture
Internet Protocol Version 4, Src: 37.179.170.215 (37.179.170.215), Dst: 198.232.124.224 (198.232.124.224)
Transmission Control Protocol, Src Port: 48723 (48723), Dst Port: http (80), Seq: 1, Ack: 5193, Len: 0

No.     Time        Source                Destination           Protocol Length Info
     25 1.945153    198.232.124.224       37.179.170.215        HTTP     1366   Continuation or non-HTTP traffic

Frame 25: 1366 bytes on wire (10928 bits), 1366 bytes captured (10928 bits)
Linux cooked capture
Internet Protocol Version 4, Src: 198.232.124.224 (198.232.124.224), Dst: 37.179.170.215 (37.179.170.215)
Transmission Control Protocol, Src Port: http (80), Dst Port: 48723 (48723), Seq: 5193, Ack: 1, Len: 1298
Hypertext Transfer Protocol

No.     Time        Source                Destination           Protocol Length Info
     26 1.945518    37.179.170.215        198.232.124.224       TCP      68     48723 > http [ACK] Seq=1 Ack=6491 Win=6502 Len=0 TSval=15439 TSecr=1716032599

Frame 26: 68 bytes on wire (544 bits), 68 bytes captured (544 bits)
Linux cooked capture
Internet Protocol Version 4, Src: 37.179.170.215 (37.179.170.215), Dst: 198.232.124.224 (198.232.124.224)
Transmission Control Protocol, Src Port: 48723 (48723), Dst Port: http (80), Seq: 1, Ack: 6491, Len: 0

No.     Time        Source                Destination           Protocol Length Info
     27 1.965230    198.232.124.224       37.179.170.215        HTTP     1366   Continuation or non-HTTP traffic

Frame 27: 1366 bytes on wire (10928 bits), 1366 bytes captured (10928 bits)
Linux cooked capture
Internet Protocol Version 4, Src: 198.232.124.224 (198.232.124.224), Dst: 37.179.170.215 (37.179.170.215)
Transmission Control Protocol, Src Port: http (80), Dst Port: 48723 (48723), Seq: 6491, Ack: 1, Len: 1298
Hypertext Transfer Protocol

No.     Time        Source                Destination           Protocol Length Info
     28 1.965683    198.232.124.224       37.179.170.215        HTTP     1366   Continuation or non-HTTP traffic

Frame 28: 1366 bytes on wire (10928 bits), 1366 bytes captured (10928 bits)
Linux cooked capture
Internet Protocol Version 4, Src: 198.232.124.224 (198.232.124.224), Dst: 37.179.170.215 (37.179.170.215)
Transmission Control Protocol, Src Port: http (80), Dst Port: 48723 (48723), Seq: 7789, Ack: 1, Len: 1298
Hypertext Transfer Protocol

No.     Time        Source                Destination           Protocol Length Info
     29 1.965875    37.179.170.215        198.232.124.224       TCP      68     48723 > http [ACK] Seq=1 Ack=7789 Win=7151 Len=0 TSval=15441 TSecr=1716032599

Frame 29: 68 bytes on wire (544 bits), 68 bytes captured (544 bits)
Linux cooked capture
Internet Protocol Version 4, Src: 37.179.170.215 (37.179.170.215), Dst: 198.232.124.224 (198.232.124.224)
Transmission Control Protocol, Src Port: 48723 (48723), Dst Port: http (80), Seq: 1, Ack: 7789, Len: 0

No.     Time        Source                Destination           Protocol Length Info
     30 1.966092    37.179.170.215        198.232.124.224       TCP      68     48723 > http [ACK] Seq=1 Ack=9087 Win=7800 Len=0 TSval=15441 TSecr=1716032599

Frame 30: 68 bytes on wire (544 bits), 68 bytes captured (544 bits)
Linux cooked capture
Internet Protocol Version 4, Src: 37.179.170.215 (37.179.170.215), Dst: 198.232.124.224 (198.232.124.224)
Transmission Control Protocol, Src Port: 48723 (48723), Dst Port: http (80), Seq: 1, Ack: 9087, Len: 0

No.     Time        Source                Destination           Protocol Length Info
     31 1.985118    198.232.124.224       37.179.170.215        HTTP     1366   Continuation or non-HTTP traffic

Frame 31: 1366 bytes on wire (10928 bits), 1366 bytes captured (10928 bits)
Linux cooked capture
Internet Protocol Version 4, Src: 198.232.124.224 (198.232.124.224), Dst: 37.179.170.215 (37.179.170.215)
Transmission Control Protocol, Src Port: http (80), Dst Port: 48723 (48723), Seq: 9087, Ack: 1, Len: 1298
Hypertext Transfer Protocol

No.     Time        Source                Destination           Protocol Length Info
     32 1.985468    37.179.170.215        198.232.124.224       TCP      68     48723 > http [ACK] Seq=1 Ack=10385 Win=8449 Len=0 TSval=15443 TSecr=1716032603

Frame 32: 68 bytes on wire (544 bits), 68 bytes captured (544 bits)
Linux cooked capture
Internet Protocol Version 4, Src: 37.179.170.215 (37.179.170.215), Dst: 198.232.124.224 (198.232.124.224)
Transmission Control Protocol, Src Port: 48723 (48723), Dst Port: http (80), Seq: 1, Ack: 10385, Len: 0

No.     Time        Source                Destination           Protocol Length Info
     33 2.075142    198.232.124.224       37.179.170.215        HTTP     1366   Continuation or non-HTTP traffic

Frame 33: 1366 bytes on wire (10928 bits), 1366 bytes captured (10928 bits)
Linux cooked capture
Internet Protocol Version 4, Src: 198.232.124.224 (198.232.124.224), Dst: 37.179.170.215 (37.179.170.215)
Transmission Control Protocol, Src Port: http (80), Dst Port: 48723 (48723), Seq: 10385, Ack: 1, Len: 1298
Hypertext Transfer Protocol

No.     Time        Source                Destination           Protocol Length Info
     34 2.075470    37.179.170.215        198.232.124.224       TCP      68     48723 > http [ACK] Seq=1 Ack=11683 Win=9098 Len=0 TSval=15452 TSecr=1716032611

Frame 34: 68 bytes on wire (544 bits), 68 bytes captured (544 bits)
Linux cooked capture
Internet Protocol Version 4, Src: 37.179.170.215 (37.179.170.215), Dst: 198.232.124.224 (198.232.124.224)
Transmission Control Protocol, Src Port: 48723 (48723), Dst Port: http (80), Seq: 1, Ack: 11683, Len: 0

No.     Time        Source                Destination           Protocol Length Info
     35 2.104952    198.232.124.224       37.179.170.215        HTTP     904    Continuation or non-HTTP traffic

Frame 35: 904 bytes on wire (7232 bits), 904 bytes captured (7232 bits)
Linux cooked capture
Internet Protocol Version 4, Src: 198.232.124.224 (198.232.124.224), Dst: 37.179.170.215 (37.179.170.215)
Transmission Control Protocol, Src Port: http (80), Dst Port: 48723 (48723), Seq: 11683, Ack: 1, Len: 836
Hypertext Transfer Protocol

No.     Time        Source                Destination           Protocol Length Info
     36 2.106380    37.179.170.215        198.232.124.224       TCP      68     48723 > http [ACK] Seq=1 Ack=12519 Win=9747 Len=0 TSval=15455 TSecr=1716032615

Frame 36: 68 bytes on wire (544 bits), 68 bytes captured (544 bits)
Linux cooked capture
Internet Protocol Version 4, Src: 37.179.170.215 (37.179.170.215), Dst: 198.232.124.224 (198.232.124.224)
Transmission Control Protocol, Src Port: 48723 (48723), Dst Port: http (80), Seq: 1, Ack: 12519, Len: 0

No.     Time        Source                Destination           Protocol Length Info
     37 2.155390    198.232.124.224       37.179.170.215        HTTP     1366   Continuation or non-HTTP traffic

Frame 37: 1366 bytes on wire (10928 bits), 1366 bytes captured (10928 bits)
Linux cooked capture
Internet Protocol Version 4, Src: 198.232.124.224 (198.232.124.224), Dst: 37.179.170.215 (37.179.170.215)
Transmission Control Protocol, Src Port: http (80), Dst Port: 48723 (48723), Seq: 12519, Ack: 1, Len: 1298
Hypertext Transfer Protocol

No.     Time        Source                Destination           Protocol Length Info
     38 2.155683    198.232.124.224       37.179.170.215        HTTP     1366   Continuation or non-HTTP traffic

Frame 38: 1366 bytes on wire (10928 bits), 1366 bytes captured (10928 bits)
Linux cooked capture
Internet Protocol Version 4, Src: 198.232.124.224 (198.232.124.224), Dst: 37.179.170.215 (37.179.170.215)
Transmission Control Protocol, Src Port: http (80), Dst Port: 48723 (48723), Seq: 13817, Ack: 1, Len: 1298
Hypertext Transfer Protocol

No.     Time        Source                Destination           Protocol Length Info
     39 2.155972    198.232.124.224       37.179.170.215        HTTP     1366   Continuation or non-HTTP traffic

Frame 39: 1366 bytes on wire (10928 bits), 1366 bytes captured (10928 bits)
Linux cooked capture
Internet Protocol Version 4, Src: 198.232.124.224 (198.232.124.224), Dst: 37.179.170.215 (37.179.170.215)
Transmission Control Protocol, Src Port: http (80), Dst Port: 48723 (48723), Seq: 15115, Ack: 1, Len: 1298
Hypertext Transfer Protocol

No.     Time        Source                Destination           Protocol Length Info
     40 2.156477    37.179.170.215        198.232.124.224       TCP      68     48723 > http [ACK] Seq=1 Ack=13817 Win=10396 Len=0 TSval=15460 TSecr=1716032619

Frame 40: 68 bytes on wire (544 bits), 68 bytes captured (544 bits)
Linux cooked capture
Internet Protocol Version 4, Src: 37.179.170.215 (37.179.170.215), Dst: 198.232.124.224 (198.232.124.224)
Transmission Control Protocol, Src Port: 48723 (48723), Dst Port: http (80), Seq: 1, Ack: 13817, Len: 0

No.     Time        Source                Destination           Protocol Length Info
     41 2.156765    37.179.170.215        198.232.124.224       TCP      68     48723 > http [ACK] Seq=1 Ack=15115 Win=10598 Len=0 TSval=15460 TSecr=1716032619

Frame 41: 68 bytes on wire (544 bits), 68 bytes captured (544 bits)
Linux cooked capture
Internet Protocol Version 4, Src: 37.179.170.215 (37.179.170.215), Dst: 198.232.124.224 (198.232.124.224)
Transmission Control Protocol, Src Port: 48723 (48723), Dst Port: http (80), Seq: 1, Ack: 15115, Len: 0

No.     Time        Source                Destination           Protocol Length Info
     42 2.156995    37.179.170.215        198.232.124.224       TCP      68     48723 > http [ACK] Seq=1 Ack=16413 Win=10598 Len=0 TSval=15460 TSecr=1716032619

Frame 42: 68 bytes on wire (544 bits), 68 bytes captured (544 bits)
Linux cooked capture
Internet Protocol Version 4, Src: 37.179.170.215 (37.179.170.215), Dst: 198.232.124.224 (198.232.124.224)
Transmission Control Protocol, Src Port: 48723 (48723), Dst Port: http (80), Seq: 1, Ack: 16413, Len: 0

No.     Time        Source                Destination           Protocol Length Info
     43 2.225070    198.232.124.224       37.179.170.215        HTTP     1366   Continuation or non-HTTP traffic

Frame 43: 1366 bytes on wire (10928 bits), 1366 bytes captured (10928 bits)
Linux cooked capture
Internet Protocol Version 4, Src: 198.232.124.224 (198.232.124.224), Dst: 37.179.170.215 (37.179.170.215)
Transmission Control Protocol, Src Port: http (80), Dst Port: 48723 (48723), Seq: 16413, Ack: 1, Len: 1298
Hypertext Transfer Protocol

No.     Time        Source                Destination           Protocol Length Info
     44 2.225888    37.179.170.215        198.232.124.224       TCP      68     48723 > http [ACK] Seq=1 Ack=17711 Win=10598 Len=0 TSval=15467 TSecr=1716032627

Frame 44: 68 bytes on wire (544 bits), 68 bytes captured (544 bits)
Linux cooked capture
Internet Protocol Version 4, Src: 37.179.170.215 (37.179.170.215), Dst: 198.232.124.224 (198.232.124.224)
Transmission Control Protocol, Src Port: 48723 (48723), Dst Port: http (80), Seq: 1, Ack: 17711, Len: 0

No.     Time        Source                Destination           Protocol Length Info
     45 2.265215    198.232.124.224       37.179.170.215        HTTP     1366   Continuation or non-HTTP traffic

Frame 45: 1366 bytes on wire (10928 bits), 1366 bytes captured (10928 bits)
Linux cooked capture
Internet Protocol Version 4, Src: 198.232.124.224 (198.232.124.224), Dst: 37.179.170.215 (37.179.170.215)
Transmission Control Protocol, Src Port: http (80), Dst Port: 48723 (48723), Seq: 17711, Ack: 1, Len: 1298
Hypertext Transfer Protocol

No.     Time        Source                Destination           Protocol Length Info
     46 2.265587    37.179.170.215        198.232.124.224       TCP      68     48723 > http [ACK] Seq=1 Ack=19009 Win=10598 Len=0 TSval=15471 TSecr=1716032631

Frame 46: 68 bytes on wire (544 bits), 68 bytes captured (544 bits)
Linux cooked capture
Internet Protocol Version 4, Src: 37.179.170.215 (37.179.170.215), Dst: 198.232.124.224 (198.232.124.224)
Transmission Control Protocol, Src Port: 48723 (48723), Dst Port: http (80), Seq: 1, Ack: 19009, Len: 0

No.     Time        Source                Destination           Protocol Length Info
     47 2.305068    198.232.124.224       37.179.170.215        HTTP     1366   Continuation or non-HTTP traffic

Frame 47: 1366 bytes on wire (10928 bits), 1366 bytes captured (10928 bits)
Linux cooked capture
Internet Protocol Version 4, Src: 198.232.124.224 (198.232.124.224), Dst: 37.179.170.215 (37.179.170.215)
Transmission Control Protocol, Src Port: http (80), Dst Port: 48723 (48723), Seq: 19009, Ack: 1, Len: 1298
Hypertext Transfer Protocol

No.     Time        Source                Destination           Protocol Length Info
     48 2.305818    37.179.170.215        198.232.124.224       TCP      68     48723 > http [ACK] Seq=1 Ack=20307 Win=10598 Len=0 TSval=15475 TSecr=1716032635

Frame 48: 68 bytes on wire (544 bits), 68 bytes captured (544 bits)
Linux cooked capture
Internet Protocol Version 4, Src: 37.179.170.215 (37.179.170.215), Dst: 198.232.124.224 (198.232.124.224)
Transmission Control Protocol, Src Port: 48723 (48723), Dst Port: http (80), Seq: 1, Ack: 20307, Len: 0

No.     Time        Source                Destination           Protocol Length Info
     49 2.345047    198.232.124.224       37.179.170.215        HTTP     1366   Continuation or non-HTTP traffic

Frame 49: 1366 bytes on wire (10928 bits), 1366 bytes captured (10928 bits)
Linux cooked capture
Internet Protocol Version 4, Src: 198.232.124.224 (198.232.124.224), Dst: 37.179.170.215 (37.179.170.215)
Transmission Control Protocol, Src Port: http (80), Dst Port: 48723 (48723), Seq: 20307, Ack: 1, Len: 1298
Hypertext Transfer Protocol

No.     Time        Source                Destination           Protocol Length Info
     50 2.345405    37.179.170.215        198.232.124.224       TCP      68     48723 > http [ACK] Seq=1 Ack=21605 Win=10598 Len=0 TSval=15479 TSecr=1716032639

Frame 50: 68 bytes on wire (544 bits), 68 bytes captured (544 bits)
Linux cooked capture
Internet Protocol Version 4, Src: 37.179.170.215 (37.179.170.215), Dst: 198.232.124.224 (198.232.124.224)
Transmission Control Protocol, Src Port: 48723 (48723), Dst Port: http (80), Seq: 1, Ack: 21605, Len: 0

No.     Time        Source                Destination           Protocol Length Info
     51 2.385142    198.232.124.224       37.179.170.215        HTTP     1366   Continuation or non-HTTP traffic

Frame 51: 1366 bytes on wire (10928 bits), 1366 bytes captured (10928 bits)
Linux cooked capture
Internet Protocol Version 4, Src: 198.232.124.224 (198.232.124.224), Dst: 37.179.170.215 (37.179.170.215)
Transmission Control Protocol, Src Port: http (80), Dst Port: 48723 (48723), Seq: 21605, Ack: 1, Len: 1298
Hypertext Transfer Protocol

No.     Time        Source                Destination           Protocol Length Info
     52 2.385808    37.179.170.215        198.232.124.224       TCP      68     48723 > http [ACK] Seq=1 Ack=22903 Win=10598 Len=0 TSval=15483 TSecr=1716032643

Frame 52: 68 bytes on wire (544 bits), 68 bytes captured (544 bits)
Linux cooked capture
Internet Protocol Version 4, Src: 37.179.170.215 (37.179.170.215), Dst: 198.232.124.224 (198.232.124.224)
Transmission Control Protocol, Src Port: 48723 (48723), Dst Port: http (80), Seq: 1, Ack: 22903, Len: 0

No.     Time        Source                Destination           Protocol Length Info
     53 2.435308    198.232.124.224       37.179.170.215        HTTP     1366   Continuation or non-HTTP traffic

Frame 53: 1366 bytes on wire (10928 bits), 1366 bytes captured (10928 bits)
Linux cooked capture
Internet Protocol Version 4, Src: 198.232.124.224 (198.232.124.224), Dst: 37.179.170.215 (37.179.170.215)
Transmission Control Protocol, Src Port: http (80), Dst Port: 48723 (48723), Seq: 22903, Ack: 1, Len: 1298
Hypertext Transfer Protocol

No.     Time        Source                Destination           Protocol Length Info
     54 2.435738    198.232.124.224       37.179.170.215        HTTP     1366   Continuation or non-HTTP traffic

Frame 54: 1366 bytes on wire (10928 bits), 1366 bytes captured (10928 bits)
Linux cooked capture
Internet Protocol Version 4, Src: 198.232.124.224 (198.232.124.224), Dst: 37.179.170.215 (37.179.170.215)
Transmission Control Protocol, Src Port: http (80), Dst Port: 48723 (48723), Seq: 24201, Ack: 1, Len: 1298
Hypertext Transfer Protocol

No.     Time        Source                Destination           Protocol Length Info
     55 2.437278    198.232.124.224       37.179.170.215        HTTP     1366   Continuation or non-HTTP traffic

Frame 55: 1366 bytes on wire (10928 bits), 1366 bytes captured (10928 bits)
Linux cooked capture
Internet Protocol Version 4, Src: 198.232.124.224 (198.232.124.224), Dst: 37.179.170.215 (37.179.170.215)
Transmission Control Protocol, Src Port: http (80), Dst Port: 48723 (48723), Seq: 25499, Ack: 1, Len: 1298
Hypertext Transfer Protocol

No.     Time        Source                Destination           Protocol Length Info
     56 2.437763    37.179.170.215        198.232.124.224       TCP      68     48723 > http [ACK] Seq=1 Ack=25499 Win=10598 Len=0 TSval=15488 TSecr=1716032647

Frame 56: 68 bytes on wire (544 bits), 68 bytes captured (544 bits)
Linux cooked capture
Internet Protocol Version 4, Src: 37.179.170.215 (37.179.170.215), Dst: 198.232.124.224 (198.232.124.224)
Transmission Control Protocol, Src Port: 48723 (48723), Dst Port: http (80), Seq: 1, Ack: 25499, Len: 0

No.     Time        Source                Destination           Protocol Length Info
     57 2.455140    198.232.124.224       37.179.170.215        HTTP     1366   Continuation or non-HTTP traffic

Frame 57: 1366 bytes on wire (10928 bits), 1366 bytes captured (10928 bits)
Linux cooked capture
Internet Protocol Version 4, Src: 198.232.124.224 (198.232.124.224), Dst: 37.179.170.215 (37.179.170.215)
Transmission Control Protocol, Src Port: http (80), Dst Port: 48723 (48723), Seq: 26797, Ack: 1, Len: 1298
Hypertext Transfer Protocol

No.     Time        Source                Destination           Protocol Length Info
     58 2.455482    37.179.170.215        198.232.124.224       TCP      68     48723 > http [ACK] Seq=1 Ack=28095 Win=10598 Len=0 TSval=15490 TSecr=1716032647

Frame 58: 68 bytes on wire (544 bits), 68 bytes captured (544 bits)
Linux cooked capture
Internet Protocol Version 4, Src: 37.179.170.215 (37.179.170.215), Dst: 198.232.124.224 (198.232.124.224)
Transmission Control Protocol, Src Port: 48723 (48723), Dst Port: http (80), Seq: 1, Ack: 28095, Len: 0

No.     Time        Source                Destination           Protocol Length Info
     59 2.495062    198.232.124.224       37.179.170.215        HTTP     836    Continuation or non-HTTP traffic

Frame 59: 836 bytes on wire (6688 bits), 836 bytes captured (6688 bits)
Linux cooked capture
Internet Protocol Version 4, Src: 198.232.124.224 (198.232.124.224), Dst: 37.179.170.215 (37.179.170.215)
Transmission Control Protocol, Src Port: http (80), Dst Port: 48723 (48723), Seq: 28095, Ack: 1, Len: 768
Hypertext Transfer Protocol

No.     Time        Source                Destination           Protocol Length Info
     60 2.515102    198.232.124.224       37.179.170.215        HTTP     1366   Continuation or non-HTTP traffic

Frame 60: 1366 bytes on wire (10928 bits), 1366 bytes captured (10928 bits)
Linux cooked capture
Internet Protocol Version 4, Src: 198.232.124.224 (198.232.124.224), Dst: 37.179.170.215 (37.179.170.215)
Transmission Control Protocol, Src Port: http (80), Dst Port: 48723 (48723), Seq: 28863, Ack: 1, Len: 1298
Hypertext Transfer Protocol

No.     Time        Source                Destination           Protocol Length Info
     61 2.595312    198.232.124.224       37.179.170.215        HTTP     1366   Continuation or non-HTTP traffic

Frame 61: 1366 bytes on wire (10928 bits), 1366 bytes captured (10928 bits)
Linux cooked capture
Internet Protocol Version 4, Src: 198.232.124.224 (198.232.124.224), Dst: 37.179.170.215 (37.179.170.215)
Transmission Control Protocol, Src Port: http (80), Dst Port: 48723 (48723), Seq: 30161, Ack: 1, Len: 1298
Hypertext Transfer Protocol

No.     Time        Source                Destination           Protocol Length Info
     62 2.595575    198.232.124.224       37.179.170.215        HTTP     1366   Continuation or non-HTTP traffic

Frame 62: 1366 bytes on wire (10928 bits), 1366 bytes captured (10928 bits)
Linux cooked capture
Internet Protocol Version 4, Src: 198.232.124.224 (198.232.124.224), Dst: 37.179.170.215 (37.179.170.215)
Transmission Control Protocol, Src Port: http (80), Dst Port: 48723 (48723), Seq: 31459, Ack: 1, Len: 1298
Hypertext Transfer Protocol

No.     Time        Source                Destination           Protocol Length Info
     63 2.625228    198.232.124.224       37.179.170.215        HTTP     1366   Continuation or non-HTTP traffic

Frame 63: 1366 bytes on wire (10928 bits), 1366 bytes captured (10928 bits)
Linux cooked capture
Internet Protocol Version 4, Src: 198.232.124.224 (198.232.124.224), Dst: 37.179.170.215 (37.179.170.215)
Transmission Control Protocol, Src Port: http (80), Dst Port: 48723 (48723), Seq: 32757, Ack: 1, Len: 1298
Hypertext Transfer Protocol

No.     Time        Source                Destination           Protocol Length Info
     64 2.626985    37.179.170.215        198.232.124.224       TCP      68     48723 > http [ACK] Seq=1 Ack=30161 Win=10598 Len=0 TSval=15507 TSecr=1716032655

Frame 64: 68 bytes on wire (544 bits), 68 bytes captured (544 bits)
Linux cooked capture
Internet Protocol Version 4, Src: 37.179.170.215 (37.179.170.215), Dst: 198.232.124.224 (198.232.124.224)
Transmission Control Protocol, Src Port: 48723 (48723), Dst Port: http (80), Seq: 1, Ack: 30161, Len: 0

No.     Time        Source                Destination           Protocol Length Info
     65 2.635088    198.232.124.224       37.179.170.215        HTTP     1366   Continuation or non-HTTP traffic

Frame 65: 1366 bytes on wire (10928 bits), 1366 bytes captured (10928 bits)
Linux cooked capture
Internet Protocol Version 4, Src: 198.232.124.224 (198.232.124.224), Dst: 37.179.170.215 (37.179.170.215)
Transmission Control Protocol, Src Port: http (80), Dst Port: 48723 (48723), Seq: 34055, Ack: 1, Len: 1298
Hypertext Transfer Protocol

No.     Time        Source                Destination           Protocol Length Info
     66 2.710585    37.179.170.215        198.232.124.224       TCP      68     48723 > http [ACK] Seq=1 Ack=32757 Win=10598 Len=0 TSval=15516 TSecr=1716032663

Frame 66: 68 bytes on wire (544 bits), 68 bytes captured (544 bits)
Linux cooked capture
Internet Protocol Version 4, Src: 37.179.170.215 (37.179.170.215), Dst: 198.232.124.224 (198.232.124.224)
Transmission Control Protocol, Src Port: 48723 (48723), Dst Port: http (80), Seq: 1, Ack: 32757, Len: 0

No.     Time        Source                Destination           Protocol Length Info
     67 2.710868    37.179.170.215        198.232.124.224       TCP      68     48723 > http [ACK] Seq=1 Ack=35353 Win=10598 Len=0 TSval=15516 TSecr=1716032667

Frame 67: 68 bytes on wire (544 bits), 68 bytes captured (544 bits)
Linux cooked capture
Internet Protocol Version 4, Src: 37.179.170.215 (37.179.170.215), Dst: 198.232.124.224 (198.232.124.224)
Transmission Control Protocol, Src Port: 48723 (48723), Dst Port: http (80), Seq: 1, Ack: 35353, Len: 0

No.     Time        Source                Destination           Protocol Length Info
     68 2.745317    198.232.124.224       37.179.170.215        HTTP     1366   Continuation or non-HTTP traffic

Frame 68: 1366 bytes on wire (10928 bits), 1366 bytes captured (10928 bits)
Linux cooked capture
Internet Protocol Version 4, Src: 198.232.124.224 (198.232.124.224), Dst: 37.179.170.215 (37.179.170.215)
Transmission Control Protocol, Src Port: http (80), Dst Port: 48723 (48723), Seq: 35353, Ack: 1, Len: 1298
Hypertext Transfer Protocol

No.     Time        Source                Destination           Protocol Length Info
     69 2.755075    198.232.124.224       37.179.170.215        HTTP     1366   Continuation or non-HTTP traffic

Frame 69: 1366 bytes on wire (10928 bits), 1366 bytes captured (10928 bits)
Linux cooked capture
Internet Protocol Version 4, Src: 198.232.124.224 (198.232.124.224), Dst: 37.179.170.215 (37.179.170.215)
Transmission Control Protocol, Src Port: http (80), Dst Port: 48723 (48723), Seq: 36651, Ack: 1, Len: 1298
Hypertext Transfer Protocol

No.     Time        Source                Destination           Protocol Length Info
     70 2.756250    37.179.170.215        198.232.124.224       TCP      68     48723 > http [ACK] Seq=1 Ack=37949 Win=10598 Len=0 TSval=15520 TSecr=1716032679

Frame 70: 68 bytes on wire (544 bits), 68 bytes captured (544 bits)
Linux cooked capture
Internet Protocol Version 4, Src: 37.179.170.215 (37.179.170.215), Dst: 198.232.124.224 (198.232.124.224)
Transmission Control Protocol, Src Port: 48723 (48723), Dst Port: http (80), Seq: 1, Ack: 37949, Len: 0

No.     Time        Source                Destination           Protocol Length Info
     71 2.775130    198.232.124.224       37.179.170.215        HTTP     1366   Continuation or non-HTTP traffic

Frame 71: 1366 bytes on wire (10928 bits), 1366 bytes captured (10928 bits)
Linux cooked capture
Internet Protocol Version 4, Src: 198.232.124.224 (198.232.124.224), Dst: 37.179.170.215 (37.179.170.215)
Transmission Control Protocol, Src Port: http (80), Dst Port: 48723 (48723), Seq: 37949, Ack: 1, Len: 1298
Hypertext Transfer Protocol

No.     Time        Source                Destination           Protocol Length Info
     72 2.829735    37.179.170.215        198.232.124.224       TCP      68     48723 > http [ACK] Seq=1 Ack=39247 Win=10598 Len=0 TSval=15528 TSecr=1716032679

Frame 72: 68 bytes on wire (544 bits), 68 bytes captured (544 bits)
Linux cooked capture
Internet Protocol Version 4, Src: 37.179.170.215 (37.179.170.215), Dst: 198.232.124.224 (198.232.124.224)
Transmission Control Protocol, Src Port: 48723 (48723), Dst Port: http (80), Seq: 1, Ack: 39247, Len: 0

No.     Time        Source                Destination           Protocol Length Info
     73 2.904935    198.232.124.224       37.179.170.215        HTTP     203    Continuation or non-HTTP traffic

Frame 73: 203 bytes on wire (1624 bits), 203 bytes captured (1624 bits)
Linux cooked capture
Internet Protocol Version 4, Src: 198.232.124.224 (198.232.124.224), Dst: 37.179.170.215 (37.179.170.215)
Transmission Control Protocol, Src Port: http (80), Dst Port: 48723 (48723), Seq: 39247, Ack: 1, Len: 135
Hypertext Transfer Protocol

No.     Time        Source                Destination           Protocol Length Info
     74 2.922513    37.179.170.215        198.232.124.224       TCP      68     48723 > http [ACK] Seq=1 Ack=39382 Win=10598 Len=0 TSval=15537 TSecr=1716032695

Frame 74: 68 bytes on wire (544 bits), 68 bytes captured (544 bits)
Linux cooked capture
Internet Protocol Version 4, Src: 37.179.170.215 (37.179.170.215), Dst: 198.232.124.224 (198.232.124.224)
Transmission Control Protocol, Src Port: 48723 (48723), Dst Port: http (80), Seq: 1, Ack: 39382, Len: 0

No.     Time        Source                Destination           Protocol Length Info
     75 6.730247    37.179.170.215        108.168.157.116       TCP      68     51955 > http [FIN, ACK] Seq=1 Ack=269 Win=1959 Len=0 TSval=15918 TSecr=1716032563

Frame 75: 68 bytes on wire (544 bits), 68 bytes captured (544 bits)
Linux cooked capture
Internet Protocol Version 4, Src: 37.179.170.215 (37.179.170.215), Dst: 108.168.157.116 (108.168.157.116)
Transmission Control Protocol, Src Port: 51955 (51955), Dst Port: http (80), Seq: 1, Ack: 269, Len: 0

No.     Time        Source                Destination           Protocol Length Info
     76 6.834975    108.168.157.116       37.179.170.215        TCP      68     http > 51955 [ACK] Seq=269 Ack=2 Win=64251 Len=0 TSval=1716033087 TSecr=15918

Frame 76: 68 bytes on wire (544 bits), 68 bytes captured (544 bits)
Linux cooked capture
Internet Protocol Version 4, Src: 108.168.157.116 (108.168.157.116), Dst: 37.179.170.215 (37.179.170.215)
Transmission Control Protocol, Src Port: http (80), Dst Port: 51955 (51955), Seq: 269, Ack: 2, Len: 0

No.     Time        Source                Destination           Protocol Length Info
     77 6.835320    108.168.157.116       37.179.170.215        TCP      68     http > 51955 [FIN, ACK] Seq=269 Ack=2 Win=64251 Len=0 TSval=1716033087 TSecr=15918

Frame 77: 68 bytes on wire (544 bits), 68 bytes captured (544 bits)
Linux cooked capture
Internet Protocol Version 4, Src: 108.168.157.116 (108.168.157.116), Dst: 37.179.170.215 (37.179.170.215)
Transmission Control Protocol, Src Port: http (80), Dst Port: 51955 (51955), Seq: 269, Ack: 2, Len: 0

No.     Time        Source                Destination           Protocol Length Info
     78 6.835497    37.179.170.215        108.168.157.116       TCP      68     51955 > http [ACK] Seq=2 Ack=270 Win=1959 Len=0 TSval=15928 TSecr=1716033087

Frame 78: 68 bytes on wire (544 bits), 68 bytes captured (544 bits)
Linux cooked capture
Internet Protocol Version 4, Src: 37.179.170.215 (37.179.170.215), Dst: 108.168.157.116 (108.168.157.116)
Transmission Control Protocol, Src Port: 51955 (51955), Dst Port: http (80), Seq: 2, Ack: 270, Len: 0

No.     Time        Source                Destination           Protocol Length Info
     79 7.096858    37.179.170.215        173.192.222.181       SSL      80     Continuation Data

Frame 79: 80 bytes on wire (640 bits), 80 bytes captured (640 bits)
Linux cooked capture
Internet Protocol Version 4, Src: 37.179.170.215 (37.179.170.215), Dst: 173.192.222.181 (173.192.222.181)
Transmission Control Protocol, Src Port: 35079 (35079), Dst Port: https (443), Seq: 1, Ack: 1, Len: 12
Secure Sockets Layer

No.     Time        Source                Destination           Protocol Length Info
     80 7.315087    173.192.222.181       37.179.170.215        SSL      95     Continuation Data

Frame 80: 95 bytes on wire (760 bits), 95 bytes captured (760 bits)
Linux cooked capture
Internet Protocol Version 4, Src: 173.192.222.181 (173.192.222.181), Dst: 37.179.170.215 (37.179.170.215)
Transmission Control Protocol, Src Port: https (443), Dst Port: 35079 (35079), Seq: 1, Ack: 13, Len: 27
Secure Sockets Layer

No.     Time        Source                Destination           Protocol Length Info
     81 7.315602    37.179.170.215        173.192.222.181       SSL      93     Continuation Data

Frame 81: 93 bytes on wire (744 bits), 93 bytes captured (744 bits)
Linux cooked capture
Internet Protocol Version 4, Src: 37.179.170.215 (37.179.170.215), Dst: 173.192.222.181 (173.192.222.181)
Transmission Control Protocol, Src Port: 35079 (35079), Dst Port: https (443), Seq: 13, Ack: 28, Len: 25
Secure Sockets Layer

No.     Time        Source                Destination           Protocol Length Info
     82 7.494948    173.192.222.181       37.179.170.215        SSL      86     Continuation Data

Frame 82: 86 bytes on wire (688 bits), 86 bytes captured (688 bits)
Linux cooked capture
Internet Protocol Version 4, Src: 173.192.222.181 (173.192.222.181), Dst: 37.179.170.215 (37.179.170.215)
Transmission Control Protocol, Src Port: https (443), Dst Port: 35079 (35079), Seq: 28, Ack: 38, Len: 18
Secure Sockets Layer

No.     Time        Source                Destination           Protocol Length Info
     83 7.529732    37.179.170.215        173.192.222.181       TCP      68     35079 > https [ACK] Seq=38 Ack=46 Win=2227 Len=0 TSval=15998 TSecr=196481325

Frame 83: 68 bytes on wire (544 bits), 68 bytes captured (544 bits)
Linux cooked capture
Internet Protocol Version 4, Src: 37.179.170.215 (37.179.170.215), Dst: 173.192.222.181 (173.192.222.181)
Transmission Control Protocol, Src Port: 35079 (35079), Dst Port: https (443), Seq: 38, Ack: 46, Len: 0

No.     Time        Source                Destination           Protocol Length Info
     84 8.731335    37.179.170.215        54.235.185.74         TCP      68     43725 > http [FIN, ACK] Seq=1 Ack=224 Win=1578 Len=0 TSval=16118 TSecr=1716032499

Frame 84: 68 bytes on wire (544 bits), 68 bytes captured (544 bits)
Linux cooked capture
Internet Protocol Version 4, Src: 37.179.170.215 (37.179.170.215), Dst: 54.235.185.74 (54.235.185.74)
Transmission Control Protocol, Src Port: 43725 (43725), Dst Port: http (80), Seq: 1, Ack: 224, Len: 0

No.     Time        Source                Destination           Protocol Length Info
     85 8.814948    54.235.185.74         37.179.170.215        TCP      68     http > 43725 [ACK] Seq=224 Ack=2 Win=64251 Len=0 TSval=1716033287 TSecr=16118

Frame 85: 68 bytes on wire (544 bits), 68 bytes captured (544 bits)
Linux cooked capture
Internet Protocol Version 4, Src: 54.235.185.74 (54.235.185.74), Dst: 37.179.170.215 (37.179.170.215)
Transmission Control Protocol, Src Port: http (80), Dst Port: 43725 (43725), Seq: 224, Ack: 2, Len: 0

No.     Time        Source                Destination           Protocol Length Info
     86 8.815258    54.235.185.74         37.179.170.215        TCP      68     http > 43725 [FIN, ACK] Seq=224 Ack=2 Win=64251 Len=0 TSval=1716033287 TSecr=16118

Frame 86: 68 bytes on wire (544 bits), 68 bytes captured (544 bits)
Linux cooked capture
Internet Protocol Version 4, Src: 54.235.185.74 (54.235.185.74), Dst: 37.179.170.215 (37.179.170.215)
Transmission Control Protocol, Src Port: http (80), Dst Port: 43725 (43725), Seq: 224, Ack: 2, Len: 0

No.     Time        Source                Destination           Protocol Length Info
     87 8.815363    37.179.170.215        54.235.185.74         TCP      68     43725 > http [ACK] Seq=2 Ack=225 Win=1578 Len=0 TSval=16126 TSecr=1716033287

Frame 87: 68 bytes on wire (544 bits), 68 bytes captured (544 bits)
Linux cooked capture
Internet Protocol Version 4, Src: 37.179.170.215 (37.179.170.215), Dst: 54.235.185.74 (54.235.185.74)
Transmission Control Protocol, Src Port: 43725 (43725), Dst Port: http (80), Seq: 2, Ack: 225, Len: 0

No.     Time        Source                Destination           Protocol Length Info
     88 9.890508    37.179.170.215        173.192.222.181       SSL      97     Continuation Data

Frame 88: 97 bytes on wire (776 bits), 97 bytes captured (776 bits)
Linux cooked capture
Internet Protocol Version 4, Src: 37.179.170.215 (37.179.170.215), Dst: 173.192.222.181 (173.192.222.181)
Transmission Control Protocol, Src Port: 35079 (35079), Dst Port: https (443), Seq: 38, Ack: 46, Len: 29
Secure Sockets Layer

No.     Time        Source                Destination           Protocol Length Info
     89 10.155057   173.192.222.181       37.179.170.215        TCP      68     https > 35079 [ACK] Seq=46 Ack=67 Win=512 Len=0 TSval=196483985 TSecr=16234

Frame 89: 68 bytes on wire (544 bits), 68 bytes captured (544 bits)
Linux cooked capture
Internet Protocol Version 4, Src: 173.192.222.181 (173.192.222.181), Dst: 37.179.170.215 (37.179.170.215)
Transmission Control Protocol, Src Port: https (443), Dst Port: 35079 (35079), Seq: 46, Ack: 67, Len: 0

No.     Time        Source                Destination           Protocol Length Info
     90 10.155435   37.179.170.215        173.192.222.181       SSL      108    Continuation Data

Frame 90: 108 bytes on wire (864 bits), 108 bytes captured (864 bits)
Linux cooked capture
Internet Protocol Version 4, Src: 37.179.170.215 (37.179.170.215), Dst: 173.192.222.181 (173.192.222.181)
Transmission Control Protocol, Src Port: 35079 (35079), Dst Port: https (443), Seq: 67, Ack: 46, Len: 40
Secure Sockets Layer

No.     Time        Source                Destination           Protocol Length Info
     91 10.354985   173.192.222.181       37.179.170.215        SSL      114    Continuation Data

Frame 91: 114 bytes on wire (912 bits), 114 bytes captured (912 bits)
Linux cooked capture
Internet Protocol Version 4, Src: 173.192.222.181 (173.192.222.181), Dst: 37.179.170.215 (37.179.170.215)
Transmission Control Protocol, Src Port: https (443), Dst Port: 35079 (35079), Seq: 46, Ack: 107, Len: 46
Secure Sockets Layer

No.     Time        Source                Destination           Protocol Length Info
     92 10.355345   37.179.170.215        173.192.222.181       TCP      68     35079 > https [ACK] Seq=107 Ack=92 Win=2227 Len=0 TSval=16280 TSecr=196484182

Frame 92: 68 bytes on wire (544 bits), 68 bytes captured (544 bits)
Linux cooked capture
Internet Protocol Version 4, Src: 37.179.170.215 (37.179.170.215), Dst: 173.192.222.181 (173.192.222.181)
Transmission Control Protocol, Src Port: 35079 (35079), Dst Port: https (443), Seq: 107, Ack: 92, Len: 0

No.     Time        Source                Destination           Protocol Length Info
     93 10.737712   37.179.170.215        198.232.124.224       TCP      68     48723 > http [FIN, ACK] Seq=1 Ack=39382 Win=10598 Len=0 TSval=16318 TSecr=1716032695

Frame 93: 68 bytes on wire (544 bits), 68 bytes captured (544 bits)
Linux cooked capture
Internet Protocol Version 4, Src: 37.179.170.215 (37.179.170.215), Dst: 198.232.124.224 (198.232.124.224)
Transmission Control Protocol, Src Port: 48723 (48723), Dst Port: http (80), Seq: 1, Ack: 39382, Len: 0

No.     Time        Source                Destination           Protocol Length Info
     94 10.824993   198.232.124.224       37.179.170.215        TCP      68     http > 48723 [ACK] Seq=39382 Ack=2 Win=64251 Len=0 TSval=1716033489 TSecr=16318

Frame 94: 68 bytes on wire (544 bits), 68 bytes captured (544 bits)
Linux cooked capture
Internet Protocol Version 4, Src: 198.232.124.224 (198.232.124.224), Dst: 37.179.170.215 (37.179.170.215)
Transmission Control Protocol, Src Port: http (80), Dst Port: 48723 (48723), Seq: 39382, Ack: 2, Len: 0

No.     Time        Source                Destination           Protocol Length Info
     95 10.825407   198.232.124.224       37.179.170.215        TCP      68     http > 48723 [FIN, ACK] Seq=39382 Ack=2 Win=64251 Len=0 TSval=1716033489 TSecr=16318

Frame 95: 68 bytes on wire (544 bits), 68 bytes captured (544 bits)
Linux cooked capture
Internet Protocol Version 4, Src: 198.232.124.224 (198.232.124.224), Dst: 37.179.170.215 (37.179.170.215)
Transmission Control Protocol, Src Port: http (80), Dst Port: 48723 (48723), Seq: 39382, Ack: 2, Len: 0

No.     Time        Source                Destination           Protocol Length Info
     96 10.825590   37.179.170.215        198.232.124.224       TCP      68     48723 > http [ACK] Seq=2 Ack=39383 Win=10598 Len=0 TSval=16327 TSecr=1716033489

Frame 96: 68 bytes on wire (544 bits), 68 bytes captured (544 bits)
Linux cooked capture
Internet Protocol Version 4, Src: 37.179.170.215 (37.179.170.215), Dst: 198.232.124.224 (198.232.124.224)
Transmission Control Protocol, Src Port: 48723 (48723), Dst Port: http (80), Seq: 2, Ack: 39383, Len: 0

No.     Time        Source                Destination           Protocol Length Info
     97 17.600963   37.179.170.215        173.192.222.181       SSL      136    Continuation Data

Frame 97: 136 bytes on wire (1088 bits), 136 bytes captured (1088 bits)
Linux cooked capture
Internet Protocol Version 4, Src: 37.179.170.215 (37.179.170.215), Dst: 173.192.222.181 (173.192.222.181)
Transmission Control Protocol, Src Port: 35079 (35079), Dst Port: https (443), Seq: 107, Ack: 92, Len: 68
Secure Sockets Layer

No.     Time        Source                Destination           Protocol Length Info
     98 18.211602   173.192.222.181       37.179.170.215        SSL      112    Continuation Data

Frame 98: 112 bytes on wire (896 bits), 112 bytes captured (896 bits)
Linux cooked capture
Internet Protocol Version 4, Src: 173.192.222.181 (173.192.222.181), Dst: 37.179.170.215 (37.179.170.215)
Transmission Control Protocol, Src Port: https (443), Dst Port: 35079 (35079), Seq: 92, Ack: 175, Len: 44
Secure Sockets Layer

No.     Time        Source                Destination           Protocol Length Info
     99 18.212260   37.179.170.215        173.192.222.181       TCP      68     35079 > https [ACK] Seq=175 Ack=136 Win=2227 Len=0 TSval=17066 TSecr=196491942

Frame 99: 68 bytes on wire (544 bits), 68 bytes captured (544 bits)
Linux cooked capture
Internet Protocol Version 4, Src: 37.179.170.215 (37.179.170.215), Dst: 173.192.222.181 (173.192.222.181)
Transmission Control Protocol, Src Port: 35079 (35079), Dst Port: https (443), Seq: 175, Ack: 136, Len: 0

No.     Time        Source                Destination           Protocol Length Info
    100 20.921937   37.179.170.215        173.192.222.181       SSL      124    Continuation Data

Frame 100: 124 bytes on wire (992 bits), 124 bytes captured (992 bits)
Linux cooked capture
Internet Protocol Version 4, Src: 37.179.170.215 (37.179.170.215), Dst: 173.192.222.181 (173.192.222.181)
Transmission Control Protocol, Src Port: 35079 (35079), Dst Port: https (443), Seq: 175, Ack: 136, Len: 56
Secure Sockets Layer

No.     Time        Source                Destination           Protocol Length Info
    101 21.382627   173.192.222.181       37.179.170.215        SSL      112    Continuation Data

Frame 101: 112 bytes on wire (896 bits), 112 bytes captured (896 bits)
Linux cooked capture
Internet Protocol Version 4, Src: 173.192.222.181 (173.192.222.181), Dst: 37.179.170.215 (37.179.170.215)
Transmission Control Protocol, Src Port: https (443), Dst Port: 35079 (35079), Seq: 136, Ack: 231, Len: 44
Secure Sockets Layer

No.     Time        Source                Destination           Protocol Length Info
    102 21.383267   37.179.170.215        173.192.222.181       TCP      68     35079 > https [ACK] Seq=231 Ack=180 Win=2227 Len=0 TSval=17383 TSecr=196495124

Frame 102: 68 bytes on wire (544 bits), 68 bytes captured (544 bits)
Linux cooked capture
Internet Protocol Version 4, Src: 37.179.170.215 (37.179.170.215), Dst: 173.192.222.181 (173.192.222.181)
Transmission Control Protocol, Src Port: 35079 (35079), Dst Port: https (443), Seq: 231, Ack: 180, Len: 0

No.     Time        Source                Destination           Protocol Length Info
    103 24.212618   37.179.170.215        173.192.222.181       SSL      124    Continuation Data

Frame 103: 124 bytes on wire (992 bits), 124 bytes captured (992 bits)
Linux cooked capture
Internet Protocol Version 4, Src: 37.179.170.215 (37.179.170.215), Dst: 173.192.222.181 (173.192.222.181)
Transmission Control Protocol, Src Port: 35079 (35079), Dst Port: https (443), Seq: 231, Ack: 180, Len: 56
Secure Sockets Layer

No.     Time        Source                Destination           Protocol Length Info
    104 25.264682   173.192.222.181       37.179.170.215        SSL      112    Continuation Data

Frame 104: 112 bytes on wire (896 bits), 112 bytes captured (896 bits)
Linux cooked capture
Internet Protocol Version 4, Src: 173.192.222.181 (173.192.222.181), Dst: 37.179.170.215 (37.179.170.215)
Transmission Control Protocol, Src Port: https (443), Dst Port: 35079 (35079), Seq: 180, Ack: 287, Len: 44
Secure Sockets Layer

No.     Time        Source                Destination           Protocol Length Info
    105 25.265160   37.179.170.215        173.192.222.181       TCP      68     35079 > https [ACK] Seq=287 Ack=224 Win=2227 Len=0 TSval=17771 TSecr=196498403

Frame 105: 68 bytes on wire (544 bits), 68 bytes captured (544 bits)
Linux cooked capture
Internet Protocol Version 4, Src: 37.179.170.215 (37.179.170.215), Dst: 173.192.222.181 (173.192.222.181)
Transmission Control Protocol, Src Port: 35079 (35079), Dst Port: https (443), Seq: 287, Ack: 224, Len: 0

No.     Time        Source                Destination           Protocol Length Info
    106 34.015833   37.179.170.215        173.192.222.181       SSL      138    Continuation Data

Frame 106: 138 bytes on wire (1104 bits), 138 bytes captured (1104 bits)
Linux cooked capture
Internet Protocol Version 4, Src: 37.179.170.215 (37.179.170.215), Dst: 173.192.222.181 (173.192.222.181)
Transmission Control Protocol, Src Port: 35079 (35079), Dst Port: https (443), Seq: 287, Ack: 224, Len: 70
Secure Sockets Layer

No.     Time        Source                Destination           Protocol Length Info
    107 34.511977   173.192.222.181       37.179.170.215        SSL      112    Continuation Data

Frame 107: 112 bytes on wire (896 bits), 112 bytes captured (896 bits)
Linux cooked capture
Internet Protocol Version 4, Src: 173.192.222.181 (173.192.222.181), Dst: 37.179.170.215 (37.179.170.215)
Transmission Control Protocol, Src Port: https (443), Dst Port: 35079 (35079), Seq: 224, Ack: 357, Len: 44
Secure Sockets Layer

No.     Time        Source                Destination           Protocol Length Info
    108 34.512683   37.179.170.215        173.192.222.181       TCP      68     35079 > https [ACK] Seq=357 Ack=268 Win=2227 Len=0 TSval=18696 TSecr=196508240

Frame 108: 68 bytes on wire (544 bits), 68 bytes captured (544 bits)
Linux cooked capture
Internet Protocol Version 4, Src: 37.179.170.215 (37.179.170.215), Dst: 173.192.222.181 (173.192.222.181)
Transmission Control Protocol, Src Port: 35079 (35079), Dst Port: https (443), Seq: 357, Ack: 268, Len: 0

No.     Time        Source                Destination           Protocol Length Info
    109 39.623610   37.179.170.215        173.192.222.181       SSL      134    Continuation Data

Frame 109: 134 bytes on wire (1072 bits), 134 bytes captured (1072 bits)
Linux cooked capture
Internet Protocol Version 4, Src: 37.179.170.215 (37.179.170.215), Dst: 173.192.222.181 (173.192.222.181)
Transmission Control Protocol, Src Port: 35079 (35079), Dst Port: https (443), Seq: 357, Ack: 268, Len: 66
Secure Sockets Layer

No.     Time        Source                Destination           Protocol Length Info
    110 40.105128   173.192.222.181       37.179.170.215        SSL      112    Continuation Data

Frame 110: 112 bytes on wire (896 bits), 112 bytes captured (896 bits)
Linux cooked capture
Internet Protocol Version 4, Src: 173.192.222.181 (173.192.222.181), Dst: 37.179.170.215 (37.179.170.215)
Transmission Control Protocol, Src Port: https (443), Dst Port: 35079 (35079), Seq: 268, Ack: 423, Len: 44
Secure Sockets Layer

No.     Time        Source                Destination           Protocol Length Info
    111 40.105795   37.179.170.215        173.192.222.181       TCP      68     35079 > https [ACK] Seq=423 Ack=312 Win=2227 Len=0 TSval=19255 TSecr=196513837

Frame 111: 68 bytes on wire (544 bits), 68 bytes captured (544 bits)
Linux cooked capture
Internet Protocol Version 4, Src: 37.179.170.215 (37.179.170.215), Dst: 173.192.222.181 (173.192.222.181)
Transmission Control Protocol, Src Port: 35079 (35079), Dst Port: https (443), Seq: 423, Ack: 312, Len: 0

No.     Time        Source                Destination           Protocol Length Info
    112 48.104190   37.179.170.215        173.192.222.181       SSL      127    Continuation Data

Frame 112: 127 bytes on wire (1016 bits), 127 bytes captured (1016 bits)
Linux cooked capture
Internet Protocol Version 4, Src: 37.179.170.215 (37.179.170.215), Dst: 173.192.222.181 (173.192.222.181)
Transmission Control Protocol, Src Port: 35079 (35079), Dst Port: https (443), Seq: 423, Ack: 312, Len: 59
Secure Sockets Layer

No.     Time        Source                Destination           Protocol Length Info
    113 48.671632   173.192.222.181       37.179.170.215        SSL      112    Continuation Data

Frame 113: 112 bytes on wire (896 bits), 112 bytes captured (896 bits)
Linux cooked capture
Internet Protocol Version 4, Src: 173.192.222.181 (173.192.222.181), Dst: 37.179.170.215 (37.179.170.215)
Transmission Control Protocol, Src Port: https (443), Dst Port: 35079 (35079), Seq: 312, Ack: 482, Len: 44
Secure Sockets Layer

No.     Time        Source                Destination           Protocol Length Info
    114 48.672290   37.179.170.215        173.192.222.181       TCP      68     35079 > https [ACK] Seq=482 Ack=356 Win=2227 Len=0 TSval=20112 TSecr=196522410

Frame 114: 68 bytes on wire (544 bits), 68 bytes captured (544 bits)
Linux cooked capture
Internet Protocol Version 4, Src: 37.179.170.215 (37.179.170.215), Dst: 173.192.222.181 (173.192.222.181)
Transmission Control Protocol, Src Port: 35079 (35079), Dst Port: https (443), Seq: 482, Ack: 356, Len: 0

No.     Time        Source                Destination           Protocol Length Info
    115 52.979025   37.179.170.215        173.192.222.181       SSL      124    Continuation Data

Frame 115: 124 bytes on wire (992 bits), 124 bytes captured (992 bits)
Linux cooked capture
Internet Protocol Version 4, Src: 37.179.170.215 (37.179.170.215), Dst: 173.192.222.181 (173.192.222.181)
Transmission Control Protocol, Src Port: 35079 (35079), Dst Port: https (443), Seq: 482, Ack: 356, Len: 56
Secure Sockets Layer

No.     Time        Source                Destination           Protocol Length Info
    116 53.485197   173.192.222.181       37.179.170.215        SSL      112    Continuation Data

Frame 116: 112 bytes on wire (896 bits), 112 bytes captured (896 bits)
Linux cooked capture
Internet Protocol Version 4, Src: 173.192.222.181 (173.192.222.181), Dst: 37.179.170.215 (37.179.170.215)
Transmission Control Protocol, Src Port: https (443), Dst Port: 35079 (35079), Seq: 356, Ack: 538, Len: 44
Secure Sockets Layer

No.     Time        Source                Destination           Protocol Length Info
    117 53.485860   37.179.170.215        173.192.222.181       TCP      68     35079 > https [ACK] Seq=538 Ack=400 Win=2227 Len=0 TSval=20593 TSecr=196527223

Frame 117: 68 bytes on wire (544 bits), 68 bytes captured (544 bits)
Linux cooked capture
Internet Protocol Version 4, Src: 37.179.170.215 (37.179.170.215), Dst: 173.192.222.181 (173.192.222.181)
Transmission Control Protocol, Src Port: 35079 (35079), Dst Port: https (443), Seq: 538, Ack: 400, Len: 0

No.     Time        Source                Destination           Protocol Length Info
    118 60.528153   37.179.170.215        173.192.222.181       SSL      134    Continuation Data

Frame 118: 134 bytes on wire (1072 bits), 134 bytes captured (1072 bits)
Linux cooked capture
Internet Protocol Version 4, Src: 37.179.170.215 (37.179.170.215), Dst: 173.192.222.181 (173.192.222.181)
Transmission Control Protocol, Src Port: 35079 (35079), Dst Port: https (443), Seq: 538, Ack: 400, Len: 66
Secure Sockets Layer

No.     Time        Source                Destination           Protocol Length Info
    119 61.065108   173.192.222.181       37.179.170.215        SSL      112    Continuation Data

Frame 119: 112 bytes on wire (896 bits), 112 bytes captured (896 bits)
Linux cooked capture
Internet Protocol Version 4, Src: 173.192.222.181 (173.192.222.181), Dst: 37.179.170.215 (37.179.170.215)
Transmission Control Protocol, Src Port: https (443), Dst Port: 35079 (35079), Seq: 400, Ack: 604, Len: 44
Secure Sockets Layer

No.     Time        Source                Destination           Protocol Length Info
    120 61.065975   37.179.170.215        173.192.222.181       TCP      68     35079 > https [ACK] Seq=604 Ack=444 Win=2227 Len=0 TSval=21351 TSecr=196534782

Frame 120: 68 bytes on wire (544 bits), 68 bytes captured (544 bits)
Linux cooked capture
Internet Protocol Version 4, Src: 37.179.170.215 (37.179.170.215), Dst: 173.192.222.181 (173.192.222.181)
Transmission Control Protocol, Src Port: 35079 (35079), Dst Port: https (443), Seq: 604, Ack: 444, Len: 0

No.     Time        Source                Destination           Protocol Length Info
    121 66.458087   37.179.170.215        173.192.222.181       SSL      125    Continuation Data

Frame 121: 125 bytes on wire (1000 bits), 125 bytes captured (1000 bits)
Linux cooked capture
Internet Protocol Version 4, Src: 37.179.170.215 (37.179.170.215), Dst: 173.192.222.181 (173.192.222.181)
Transmission Control Protocol, Src Port: 35079 (35079), Dst Port: https (443), Seq: 604, Ack: 444, Len: 57
Secure Sockets Layer

No.     Time        Source                Destination           Protocol Length Info
    122 66.931682   173.192.222.181       37.179.170.215        SSL      112    Continuation Data

Frame 122: 112 bytes on wire (896 bits), 112 bytes captured (896 bits)
Linux cooked capture
Internet Protocol Version 4, Src: 173.192.222.181 (173.192.222.181), Dst: 37.179.170.215 (37.179.170.215)
Transmission Control Protocol, Src Port: https (443), Dst Port: 35079 (35079), Seq: 444, Ack: 661, Len: 44
Secure Sockets Layer

No.     Time        Source                Destination           Protocol Length Info
    123 66.932028   37.179.170.215        173.192.222.181       TCP      68     35079 > https [ACK] Seq=661 Ack=488 Win=2227 Len=0 TSval=21938 TSecr=196540662

Frame 123: 68 bytes on wire (544 bits), 68 bytes captured (544 bits)
Linux cooked capture
Internet Protocol Version 4, Src: 37.179.170.215 (37.179.170.215), Dst: 173.192.222.181 (173.192.222.181)
Transmission Control Protocol, Src Port: 35079 (35079), Dst Port: https (443), Seq: 661, Ack: 488, Len: 0

No.     Time        Source                Destination           Protocol Length Info
    124 71.359457   37.179.170.215        173.192.222.181       SSL      132    Continuation Data

Frame 124: 132 bytes on wire (1056 bits), 132 bytes captured (1056 bits)
Linux cooked capture
Internet Protocol Version 4, Src: 37.179.170.215 (37.179.170.215), Dst: 173.192.222.181 (173.192.222.181)
Transmission Control Protocol, Src Port: 35079 (35079), Dst Port: https (443), Seq: 661, Ack: 488, Len: 64
Secure Sockets Layer

No.     Time        Source                Destination           Protocol Length Info
    125 71.871698   173.192.222.181       37.179.170.215        SSL      113    Continuation Data

Frame 125: 113 bytes on wire (904 bits), 113 bytes captured (904 bits)
Linux cooked capture
Internet Protocol Version 4, Src: 173.192.222.181 (173.192.222.181), Dst: 37.179.170.215 (37.179.170.215)
Transmission Control Protocol, Src Port: https (443), Dst Port: 35079 (35079), Seq: 488, Ack: 725, Len: 45
Secure Sockets Layer

No.     Time        Source                Destination           Protocol Length Info
    126 71.872038   37.179.170.215        173.192.222.181       TCP      68     35079 > https [ACK] Seq=725 Ack=533 Win=2227 Len=0 TSval=22432 TSecr=196545604

Frame 126: 68 bytes on wire (544 bits), 68 bytes captured (544 bits)
Linux cooked capture
Internet Protocol Version 4, Src: 37.179.170.215 (37.179.170.215), Dst: 173.192.222.181 (173.192.222.181)
Transmission Control Protocol, Src Port: 35079 (35079), Dst Port: https (443), Seq: 725, Ack: 533, Len: 0
