No.     Time        Source                Destination           Protocol Length Info
      1 0.000000    198.232.124.224       100.77.157.208        HTTP     1366   Continuation or non-HTTP traffic

Frame 1: 1366 bytes on wire (10928 bits), 1366 bytes captured (10928 bits)
Linux cooked capture
Internet Protocol Version 4, Src: 198.232.124.224 (198.232.124.224), Dst: 100.77.157.208 (100.77.157.208)
Transmission Control Protocol, Src Port: http (80), Dst Port: 34809 (34809), Seq: 1, Ack: 1, Len: 1298
Hypertext Transfer Protocol

No.     Time        Source                Destination           Protocol Length Info
      2 0.007653    198.232.124.224       100.77.157.208        HTTP     1366   Continuation or non-HTTP traffic

Frame 2: 1366 bytes on wire (10928 bits), 1366 bytes captured (10928 bits)
Linux cooked capture
Internet Protocol Version 4, Src: 198.232.124.224 (198.232.124.224), Dst: 100.77.157.208 (100.77.157.208)
Transmission Control Protocol, Src Port: http (80), Dst Port: 34809 (34809), Seq: 1299, Ack: 1, Len: 1298
Hypertext Transfer Protocol

No.     Time        Source                Destination           Protocol Length Info
      3 0.008153    100.77.157.208        198.232.124.224       TCP      68     34809 > http [ACK] Seq=1 Ack=2597 Win=2920 Len=0 TSval=144326 TSecr=320209273

Frame 3: 68 bytes on wire (544 bits), 68 bytes captured (544 bits)
Linux cooked capture
Internet Protocol Version 4, Src: 100.77.157.208 (100.77.157.208), Dst: 198.232.124.224 (198.232.124.224)
Transmission Control Protocol, Src Port: 34809 (34809), Dst Port: http (80), Seq: 1, Ack: 2597, Len: 0

No.     Time        Source                Destination           Protocol Length Info
      4 0.017928    198.232.124.224       100.77.157.208        HTTP     1366   Continuation or non-HTTP traffic

Frame 4: 1366 bytes on wire (10928 bits), 1366 bytes captured (10928 bits)
Linux cooked capture
Internet Protocol Version 4, Src: 198.232.124.224 (198.232.124.224), Dst: 100.77.157.208 (100.77.157.208)
Transmission Control Protocol, Src Port: http (80), Dst Port: 34809 (34809), Seq: 2597, Ack: 1, Len: 1298
Hypertext Transfer Protocol

No.     Time        Source                Destination           Protocol Length Info
      5 0.027495    198.232.124.224       100.77.157.208        HTTP     904    Continuation or non-HTTP traffic

Frame 5: 904 bytes on wire (7232 bits), 904 bytes captured (7232 bits)
Linux cooked capture
Internet Protocol Version 4, Src: 198.232.124.224 (198.232.124.224), Dst: 100.77.157.208 (100.77.157.208)
Transmission Control Protocol, Src Port: http (80), Dst Port: 34809 (34809), Seq: 3895, Ack: 1, Len: 836
Hypertext Transfer Protocol

No.     Time        Source                Destination           Protocol Length Info
      6 0.030355    100.77.157.208        198.232.124.224       TCP      68     34809 > http [ACK] Seq=1 Ack=4731 Win=2920 Len=0 TSval=144328 TSecr=320209273

Frame 6: 68 bytes on wire (544 bits), 68 bytes captured (544 bits)
Linux cooked capture
Internet Protocol Version 4, Src: 100.77.157.208 (100.77.157.208), Dst: 198.232.124.224 (198.232.124.224)
Transmission Control Protocol, Src Port: 34809 (34809), Dst Port: http (80), Seq: 1, Ack: 4731, Len: 0

No.     Time        Source                Destination           Protocol Length Info
      7 0.367732    198.232.124.224       100.77.157.208        HTTP     1366   Continuation or non-HTTP traffic

Frame 7: 1366 bytes on wire (10928 bits), 1366 bytes captured (10928 bits)
Linux cooked capture
Internet Protocol Version 4, Src: 198.232.124.224 (198.232.124.224), Dst: 100.77.157.208 (100.77.157.208)
Transmission Control Protocol, Src Port: http (80), Dst Port: 34809 (34809), Seq: 4731, Ack: 1, Len: 1298
Hypertext Transfer Protocol

No.     Time        Source                Destination           Protocol Length Info
      8 0.377738    198.232.124.224       100.77.157.208        HTTP     1366   Continuation or non-HTTP traffic

Frame 8: 1366 bytes on wire (10928 bits), 1366 bytes captured (10928 bits)
Linux cooked capture
Internet Protocol Version 4, Src: 198.232.124.224 (198.232.124.224), Dst: 100.77.157.208 (100.77.157.208)
Transmission Control Protocol, Src Port: http (80), Dst Port: 34809 (34809), Seq: 6029, Ack: 1, Len: 1298
Hypertext Transfer Protocol

No.     Time        Source                Destination           Protocol Length Info
      9 0.378065    198.232.124.224       100.77.157.208        HTTP     1366   Continuation or non-HTTP traffic

Frame 9: 1366 bytes on wire (10928 bits), 1366 bytes captured (10928 bits)
Linux cooked capture
Internet Protocol Version 4, Src: 198.232.124.224 (198.232.124.224), Dst: 100.77.157.208 (100.77.157.208)
Transmission Control Protocol, Src Port: http (80), Dst Port: 34809 (34809), Seq: 7327, Ack: 1, Len: 1298
Hypertext Transfer Protocol

No.     Time        Source                Destination           Protocol Length Info
     10 0.378873    100.77.157.208        198.232.124.224       TCP      68     34809 > http [ACK] Seq=1 Ack=7327 Win=2920 Len=0 TSval=144363 TSecr=320209310

Frame 10: 68 bytes on wire (544 bits), 68 bytes captured (544 bits)
Linux cooked capture
Internet Protocol Version 4, Src: 100.77.157.208 (100.77.157.208), Dst: 198.232.124.224 (198.232.124.224)
Transmission Control Protocol, Src Port: 34809 (34809), Dst Port: http (80), Seq: 1, Ack: 7327, Len: 0

No.     Time        Source                Destination           Protocol Length Info
     11 0.387583    198.232.124.224       100.77.157.208        HTTP     1366   Continuation or non-HTTP traffic

Frame 11: 1366 bytes on wire (10928 bits), 1366 bytes captured (10928 bits)
Linux cooked capture
Internet Protocol Version 4, Src: 198.232.124.224 (198.232.124.224), Dst: 100.77.157.208 (100.77.157.208)
Transmission Control Protocol, Src Port: http (80), Dst Port: 34809 (34809), Seq: 8625, Ack: 1, Len: 1298
Hypertext Transfer Protocol

No.     Time        Source                Destination           Protocol Length Info
     12 0.388172    100.77.157.208        198.232.124.224       TCP      68     34809 > http [ACK] Seq=1 Ack=9923 Win=2920 Len=0 TSval=144364 TSecr=320209310

Frame 12: 68 bytes on wire (544 bits), 68 bytes captured (544 bits)
Linux cooked capture
Internet Protocol Version 4, Src: 100.77.157.208 (100.77.157.208), Dst: 198.232.124.224 (198.232.124.224)
Transmission Control Protocol, Src Port: 34809 (34809), Dst Port: http (80), Seq: 1, Ack: 9923, Len: 0

No.     Time        Source                Destination           Protocol Length Info
     13 1.517603    198.232.124.224       100.77.157.208        HTTP     1366   Continuation or non-HTTP traffic

Frame 13: 1366 bytes on wire (10928 bits), 1366 bytes captured (10928 bits)
Linux cooked capture
Internet Protocol Version 4, Src: 198.232.124.224 (198.232.124.224), Dst: 100.77.157.208 (100.77.157.208)
Transmission Control Protocol, Src Port: http (80), Dst Port: 34809 (34809), Seq: 9923, Ack: 1, Len: 1298
Hypertext Transfer Protocol

No.     Time        Source                Destination           Protocol Length Info
     14 1.518153    100.77.157.208        198.232.124.224       TCP      68     34809 > http [ACK] Seq=1 Ack=11221 Win=2920 Len=0 TSval=144477 TSecr=320209425

Frame 14: 68 bytes on wire (544 bits), 68 bytes captured (544 bits)
Linux cooked capture
Internet Protocol Version 4, Src: 100.77.157.208 (100.77.157.208), Dst: 198.232.124.224 (198.232.124.224)
Transmission Control Protocol, Src Port: 34809 (34809), Dst Port: http (80), Seq: 1, Ack: 11221, Len: 0

No.     Time        Source                Destination           Protocol Length Info
     15 1.557722    198.232.124.224       100.77.157.208        HTTP     1366   Continuation or non-HTTP traffic

Frame 15: 1366 bytes on wire (10928 bits), 1366 bytes captured (10928 bits)
Linux cooked capture
Internet Protocol Version 4, Src: 198.232.124.224 (198.232.124.224), Dst: 100.77.157.208 (100.77.157.208)
Transmission Control Protocol, Src Port: http (80), Dst Port: 34809 (34809), Seq: 11221, Ack: 1, Len: 1298
Hypertext Transfer Protocol

No.     Time        Source                Destination           Protocol Length Info
     16 1.558117    198.232.124.224       100.77.157.208        HTTP     1366   Continuation or non-HTTP traffic

Frame 16: 1366 bytes on wire (10928 bits), 1366 bytes captured (10928 bits)
Linux cooked capture
Internet Protocol Version 4, Src: 198.232.124.224 (198.232.124.224), Dst: 100.77.157.208 (100.77.157.208)
Transmission Control Protocol, Src Port: http (80), Dst Port: 34809 (34809), Seq: 12519, Ack: 1, Len: 1298
Hypertext Transfer Protocol

No.     Time        Source                Destination           Protocol Length Info
     17 1.558290    198.232.124.224       100.77.157.208        HTTP     1366   Continuation or non-HTTP traffic

Frame 17: 1366 bytes on wire (10928 bits), 1366 bytes captured (10928 bits)
Linux cooked capture
Internet Protocol Version 4, Src: 198.232.124.224 (198.232.124.224), Dst: 100.77.157.208 (100.77.157.208)
Transmission Control Protocol, Src Port: http (80), Dst Port: 34809 (34809), Seq: 13817, Ack: 1, Len: 1298
Hypertext Transfer Protocol

No.     Time        Source                Destination           Protocol Length Info
     18 1.559182    100.77.157.208        198.232.124.224       TCP      68     34809 > http [ACK] Seq=1 Ack=12519 Win=2920 Len=0 TSval=144481 TSecr=320209425

Frame 18: 68 bytes on wire (544 bits), 68 bytes captured (544 bits)
Linux cooked capture
Internet Protocol Version 4, Src: 100.77.157.208 (100.77.157.208), Dst: 198.232.124.224 (198.232.124.224)
Transmission Control Protocol, Src Port: 34809 (34809), Dst Port: http (80), Seq: 1, Ack: 12519, Len: 0

No.     Time        Source                Destination           Protocol Length Info
     19 1.560650    100.77.157.208        198.232.124.224       TCP      68     34809 > http [ACK] Seq=1 Ack=15115 Win=2920 Len=0 TSval=144481 TSecr=320209425

Frame 19: 68 bytes on wire (544 bits), 68 bytes captured (544 bits)
Linux cooked capture
Internet Protocol Version 4, Src: 100.77.157.208 (100.77.157.208), Dst: 198.232.124.224 (198.232.124.224)
Transmission Control Protocol, Src Port: 34809 (34809), Dst Port: http (80), Seq: 1, Ack: 15115, Len: 0

No.     Time        Source                Destination           Protocol Length Info
     20 1.647497    198.232.124.224       100.77.157.208        HTTP     1366   Continuation or non-HTTP traffic

Frame 20: 1366 bytes on wire (10928 bits), 1366 bytes captured (10928 bits)
Linux cooked capture
Internet Protocol Version 4, Src: 198.232.124.224 (198.232.124.224), Dst: 100.77.157.208 (100.77.157.208)
Transmission Control Protocol, Src Port: http (80), Dst Port: 34809 (34809), Seq: 15115, Ack: 1, Len: 1298
Hypertext Transfer Protocol

No.     Time        Source                Destination           Protocol Length Info
     21 1.688352    100.77.157.208        198.232.124.224       TCP      68     34809 > http [ACK] Seq=1 Ack=16413 Win=2920 Len=0 TSval=144494 TSecr=320209438

Frame 21: 68 bytes on wire (544 bits), 68 bytes captured (544 bits)
Linux cooked capture
Internet Protocol Version 4, Src: 100.77.157.208 (100.77.157.208), Dst: 198.232.124.224 (198.232.124.224)
Transmission Control Protocol, Src Port: 34809 (34809), Dst Port: http (80), Seq: 1, Ack: 16413, Len: 0

No.     Time        Source                Destination           Protocol Length Info
     22 1.697643    198.232.124.224       100.77.157.208        HTTP     1366   Continuation or non-HTTP traffic

Frame 22: 1366 bytes on wire (10928 bits), 1366 bytes captured (10928 bits)
Linux cooked capture
Internet Protocol Version 4, Src: 198.232.124.224 (198.232.124.224), Dst: 100.77.157.208 (100.77.157.208)
Transmission Control Protocol, Src Port: http (80), Dst Port: 34809 (34809), Seq: 16413, Ack: 1, Len: 1298
Hypertext Transfer Protocol

No.     Time        Source                Destination           Protocol Length Info
     23 1.707748    198.232.124.224       100.77.157.208        HTTP     1366   Continuation or non-HTTP traffic

Frame 23: 1366 bytes on wire (10928 bits), 1366 bytes captured (10928 bits)
Linux cooked capture
Internet Protocol Version 4, Src: 198.232.124.224 (198.232.124.224), Dst: 100.77.157.208 (100.77.157.208)
Transmission Control Protocol, Src Port: http (80), Dst Port: 34809 (34809), Seq: 17711, Ack: 1, Len: 1298
Hypertext Transfer Protocol

No.     Time        Source                Destination           Protocol Length Info
     24 1.709078    100.77.157.208        198.232.124.224       TCP      68     34809 > http [ACK] Seq=1 Ack=19009 Win=2920 Len=0 TSval=144496 TSecr=320209443

Frame 24: 68 bytes on wire (544 bits), 68 bytes captured (544 bits)
Linux cooked capture
Internet Protocol Version 4, Src: 100.77.157.208 (100.77.157.208), Dst: 198.232.124.224 (198.232.124.224)
Transmission Control Protocol, Src Port: 34809 (34809), Dst Port: http (80), Seq: 1, Ack: 19009, Len: 0

No.     Time        Source                Destination           Protocol Length Info
     25 1.717368    198.232.124.224       100.77.157.208        HTTP     1366   Continuation or non-HTTP traffic

Frame 25: 1366 bytes on wire (10928 bits), 1366 bytes captured (10928 bits)
Linux cooked capture
Internet Protocol Version 4, Src: 198.232.124.224 (198.232.124.224), Dst: 100.77.157.208 (100.77.157.208)
Transmission Control Protocol, Src Port: http (80), Dst Port: 34809 (34809), Seq: 19009, Ack: 1, Len: 1298
Hypertext Transfer Protocol

No.     Time        Source                Destination           Protocol Length Info
     26 1.758153    100.77.157.208        198.232.124.224       TCP      68     34809 > http [ACK] Seq=1 Ack=20307 Win=2920 Len=0 TSval=144501 TSecr=320209444

Frame 26: 68 bytes on wire (544 bits), 68 bytes captured (544 bits)
Linux cooked capture
Internet Protocol Version 4, Src: 100.77.157.208 (100.77.157.208), Dst: 198.232.124.224 (198.232.124.224)
Transmission Control Protocol, Src Port: 34809 (34809), Dst Port: http (80), Seq: 1, Ack: 20307, Len: 0

No.     Time        Source                Destination           Protocol Length Info
     27 1.817468    198.232.124.224       100.77.157.208        HTTP     836    Continuation or non-HTTP traffic

Frame 27: 836 bytes on wire (6688 bits), 836 bytes captured (6688 bits)
Linux cooked capture
Internet Protocol Version 4, Src: 198.232.124.224 (198.232.124.224), Dst: 100.77.157.208 (100.77.157.208)
Transmission Control Protocol, Src Port: http (80), Dst Port: 34809 (34809), Seq: 20307, Ack: 1, Len: 768
Hypertext Transfer Protocol

No.     Time        Source                Destination           Protocol Length Info
     28 1.818120    100.77.157.208        198.232.124.224       TCP      68     34809 > http [ACK] Seq=1 Ack=21075 Win=2920 Len=0 TSval=144506 TSecr=320209455

Frame 28: 68 bytes on wire (544 bits), 68 bytes captured (544 bits)
Linux cooked capture
Internet Protocol Version 4, Src: 100.77.157.208 (100.77.157.208), Dst: 198.232.124.224 (198.232.124.224)
Transmission Control Protocol, Src Port: 34809 (34809), Dst Port: http (80), Seq: 1, Ack: 21075, Len: 0

No.     Time        Source                Destination           Protocol Length Info
     29 1.837733    198.232.124.224       100.77.157.208        HTTP     997    Continuation or non-HTTP traffic

Frame 29: 997 bytes on wire (7976 bits), 997 bytes captured (7976 bits)
Linux cooked capture
Internet Protocol Version 4, Src: 198.232.124.224 (198.232.124.224), Dst: 100.77.157.208 (100.77.157.208)
Transmission Control Protocol, Src Port: http (80), Dst Port: 34809 (34809), Seq: 21075, Ack: 1, Len: 929
Hypertext Transfer Protocol

No.     Time        Source                Destination           Protocol Length Info
     30 1.838277    100.77.157.208        198.232.124.224       TCP      68     34809 > http [ACK] Seq=1 Ack=22004 Win=2920 Len=0 TSval=144509 TSecr=320209457

Frame 30: 68 bytes on wire (544 bits), 68 bytes captured (544 bits)
Linux cooked capture
Internet Protocol Version 4, Src: 100.77.157.208 (100.77.157.208), Dst: 198.232.124.224 (198.232.124.224)
Transmission Control Protocol, Src Port: 34809 (34809), Dst Port: http (80), Seq: 1, Ack: 22004, Len: 0

No.     Time        Source                Destination           Protocol Length Info
     31 1.847710    198.232.124.224       100.77.157.208        HTTP     1366   Continuation or non-HTTP traffic

Frame 31: 1366 bytes on wire (10928 bits), 1366 bytes captured (10928 bits)
Linux cooked capture
Internet Protocol Version 4, Src: 198.232.124.224 (198.232.124.224), Dst: 100.77.157.208 (100.77.157.208)
Transmission Control Protocol, Src Port: http (80), Dst Port: 34809 (34809), Seq: 22004, Ack: 1, Len: 1298
Hypertext Transfer Protocol

No.     Time        Source                Destination           Protocol Length Info
     32 1.848048    198.232.124.224       100.77.157.208        HTTP     1366   Continuation or non-HTTP traffic

Frame 32: 1366 bytes on wire (10928 bits), 1366 bytes captured (10928 bits)
Linux cooked capture
Internet Protocol Version 4, Src: 198.232.124.224 (198.232.124.224), Dst: 100.77.157.208 (100.77.157.208)
Transmission Control Protocol, Src Port: http (80), Dst Port: 34809 (34809), Seq: 23302, Ack: 1, Len: 1298
Hypertext Transfer Protocol

No.     Time        Source                Destination           Protocol Length Info
     33 1.848850    100.77.157.208        198.232.124.224       TCP      68     34809 > http [ACK] Seq=1 Ack=24600 Win=2920 Len=0 TSval=144510 TSecr=320209457

Frame 33: 68 bytes on wire (544 bits), 68 bytes captured (544 bits)
Linux cooked capture
Internet Protocol Version 4, Src: 100.77.157.208 (100.77.157.208), Dst: 198.232.124.224 (198.232.124.224)
Transmission Control Protocol, Src Port: 34809 (34809), Dst Port: http (80), Seq: 1, Ack: 24600, Len: 0

No.     Time        Source                Destination           Protocol Length Info
     34 1.887533    198.232.124.224       100.77.157.208        HTTP     1366   Continuation or non-HTTP traffic

Frame 34: 1366 bytes on wire (10928 bits), 1366 bytes captured (10928 bits)
Linux cooked capture
Internet Protocol Version 4, Src: 198.232.124.224 (198.232.124.224), Dst: 100.77.157.208 (100.77.157.208)
Transmission Control Protocol, Src Port: http (80), Dst Port: 34809 (34809), Seq: 24600, Ack: 1, Len: 1298
Hypertext Transfer Protocol

No.     Time        Source                Destination           Protocol Length Info
     35 1.948168    100.77.157.208        198.232.124.224       TCP      68     34809 > http [ACK] Seq=1 Ack=25898 Win=2920 Len=0 TSval=144520 TSecr=320209462

Frame 35: 68 bytes on wire (544 bits), 68 bytes captured (544 bits)
Linux cooked capture
Internet Protocol Version 4, Src: 100.77.157.208 (100.77.157.208), Dst: 198.232.124.224 (198.232.124.224)
Transmission Control Protocol, Src Port: 34809 (34809), Dst Port: http (80), Seq: 1, Ack: 25898, Len: 0

No.     Time        Source                Destination           Protocol Length Info
     36 1.987823    198.232.124.224       100.77.157.208        HTTP     1366   Continuation or non-HTTP traffic

Frame 36: 1366 bytes on wire (10928 bits), 1366 bytes captured (10928 bits)
Linux cooked capture
Internet Protocol Version 4, Src: 198.232.124.224 (198.232.124.224), Dst: 100.77.157.208 (100.77.157.208)
Transmission Control Protocol, Src Port: http (80), Dst Port: 34809 (34809), Seq: 25898, Ack: 1, Len: 1298
Hypertext Transfer Protocol

No.     Time        Source                Destination           Protocol Length Info
     37 1.988183    198.232.124.224       100.77.157.208        HTTP     1366   Continuation or non-HTTP traffic

Frame 37: 1366 bytes on wire (10928 bits), 1366 bytes captured (10928 bits)
Linux cooked capture
Internet Protocol Version 4, Src: 198.232.124.224 (198.232.124.224), Dst: 100.77.157.208 (100.77.157.208)
Transmission Control Protocol, Src Port: http (80), Dst Port: 34809 (34809), Seq: 27196, Ack: 1, Len: 1298
Hypertext Transfer Protocol

No.     Time        Source                Destination           Protocol Length Info
     38 1.988693    100.77.157.208        198.232.124.224       TCP      68     34809 > http [ACK] Seq=1 Ack=28494 Win=2920 Len=0 TSval=144524 TSecr=320209471

Frame 38: 68 bytes on wire (544 bits), 68 bytes captured (544 bits)
Linux cooked capture
Internet Protocol Version 4, Src: 100.77.157.208 (100.77.157.208), Dst: 198.232.124.224 (198.232.124.224)
Transmission Control Protocol, Src Port: 34809 (34809), Dst Port: http (80), Seq: 1, Ack: 28494, Len: 0

No.     Time        Source                Destination           Protocol Length Info
     39 2.007497    198.232.124.224       100.77.157.208        HTTP     1366   Continuation or non-HTTP traffic

Frame 39: 1366 bytes on wire (10928 bits), 1366 bytes captured (10928 bits)
Linux cooked capture
Internet Protocol Version 4, Src: 198.232.124.224 (198.232.124.224), Dst: 100.77.157.208 (100.77.157.208)
Transmission Control Protocol, Src Port: http (80), Dst Port: 34809 (34809), Seq: 28494, Ack: 1, Len: 1298
Hypertext Transfer Protocol

No.     Time        Source                Destination           Protocol Length Info
     40 2.077562    198.232.124.224       100.77.157.208        HTTP     1366   Continuation or non-HTTP traffic

Frame 40: 1366 bytes on wire (10928 bits), 1366 bytes captured (10928 bits)
Linux cooked capture
Internet Protocol Version 4, Src: 198.232.124.224 (198.232.124.224), Dst: 100.77.157.208 (100.77.157.208)
Transmission Control Protocol, Src Port: http (80), Dst Port: 34809 (34809), Seq: 29792, Ack: 1, Len: 1298
Hypertext Transfer Protocol

No.     Time        Source                Destination           Protocol Length Info
     41 2.078125    100.77.157.208        198.232.124.224       TCP      68     34809 > http [ACK] Seq=1 Ack=31090 Win=2532 Len=0 TSval=144533 TSecr=320209472

Frame 41: 68 bytes on wire (544 bits), 68 bytes captured (544 bits)
Linux cooked capture
Internet Protocol Version 4, Src: 100.77.157.208 (100.77.157.208), Dst: 198.232.124.224 (198.232.124.224)
Transmission Control Protocol, Src Port: 34809 (34809), Dst Port: http (80), Seq: 1, Ack: 31090, Len: 0

No.     Time        Source                Destination           Protocol Length Info
     42 2.127722    198.232.124.224       100.77.157.208        HTTP     1366   Continuation or non-HTTP traffic

Frame 42: 1366 bytes on wire (10928 bits), 1366 bytes captured (10928 bits)
Linux cooked capture
Internet Protocol Version 4, Src: 198.232.124.224 (198.232.124.224), Dst: 100.77.157.208 (100.77.157.208)
Transmission Control Protocol, Src Port: http (80), Dst Port: 34809 (34809), Seq: 31090, Ack: 1, Len: 1298
Hypertext Transfer Protocol

No.     Time        Source                Destination           Protocol Length Info
     43 2.128103    198.232.124.224       100.77.157.208        HTTP     1366   Continuation or non-HTTP traffic

Frame 43: 1366 bytes on wire (10928 bits), 1366 bytes captured (10928 bits)
Linux cooked capture
Internet Protocol Version 4, Src: 198.232.124.224 (198.232.124.224), Dst: 100.77.157.208 (100.77.157.208)
Transmission Control Protocol, Src Port: http (80), Dst Port: 34809 (34809), Seq: 32388, Ack: 1, Len: 1298
Hypertext Transfer Protocol

No.     Time        Source                Destination           Protocol Length Info
     44 2.128948    100.77.157.208        198.232.124.224       TCP      68     34809 > http [ACK] Seq=1 Ack=33686 Win=2920 Len=0 TSval=144538 TSecr=320209485

Frame 44: 68 bytes on wire (544 bits), 68 bytes captured (544 bits)
Linux cooked capture
Internet Protocol Version 4, Src: 100.77.157.208 (100.77.157.208), Dst: 198.232.124.224 (198.232.124.224)
Transmission Control Protocol, Src Port: 34809 (34809), Dst Port: http (80), Seq: 1, Ack: 33686, Len: 0

No.     Time        Source                Destination           Protocol Length Info
     45 2.207587    198.232.124.224       100.77.157.208        HTTP     1366   Continuation or non-HTTP traffic

Frame 45: 1366 bytes on wire (10928 bits), 1366 bytes captured (10928 bits)
Linux cooked capture
Internet Protocol Version 4, Src: 198.232.124.224 (198.232.124.224), Dst: 100.77.157.208 (100.77.157.208)
Transmission Control Protocol, Src Port: http (80), Dst Port: 34809 (34809), Seq: 33686, Ack: 1, Len: 1298
Hypertext Transfer Protocol

No.     Time        Source                Destination           Protocol Length Info
     46 2.267807    198.232.124.224       100.77.157.208        HTTP     1366   Continuation or non-HTTP traffic

Frame 46: 1366 bytes on wire (10928 bits), 1366 bytes captured (10928 bits)
Linux cooked capture
Internet Protocol Version 4, Src: 198.232.124.224 (198.232.124.224), Dst: 100.77.157.208 (100.77.157.208)
Transmission Control Protocol, Src Port: http (80), Dst Port: 34809 (34809), Seq: 34984, Ack: 1, Len: 1298
Hypertext Transfer Protocol

No.     Time        Source                Destination           Protocol Length Info
     47 2.268157    198.232.124.224       100.77.157.208        HTTP     1366   Continuation or non-HTTP traffic

Frame 47: 1366 bytes on wire (10928 bits), 1366 bytes captured (10928 bits)
Linux cooked capture
Internet Protocol Version 4, Src: 198.232.124.224 (198.232.124.224), Dst: 100.77.157.208 (100.77.157.208)
Transmission Control Protocol, Src Port: http (80), Dst Port: 34809 (34809), Seq: 36282, Ack: 1, Len: 1298
Hypertext Transfer Protocol

No.     Time        Source                Destination           Protocol Length Info
     48 2.268952    100.77.157.208        198.232.124.224       TCP      68     34809 > http [ACK] Seq=1 Ack=36282 Win=2920 Len=0 TSval=144552 TSecr=320209494

Frame 48: 68 bytes on wire (544 bits), 68 bytes captured (544 bits)
Linux cooked capture
Internet Protocol Version 4, Src: 100.77.157.208 (100.77.157.208), Dst: 198.232.124.224 (198.232.124.224)
Transmission Control Protocol, Src Port: 34809 (34809), Dst Port: http (80), Seq: 1, Ack: 36282, Len: 0

No.     Time        Source                Destination           Protocol Length Info
     49 2.277543    198.232.124.224       100.77.157.208        HTTP     836    Continuation or non-HTTP traffic

Frame 49: 836 bytes on wire (6688 bits), 836 bytes captured (6688 bits)
Linux cooked capture
Internet Protocol Version 4, Src: 198.232.124.224 (198.232.124.224), Dst: 100.77.157.208 (100.77.157.208)
Transmission Control Protocol, Src Port: http (80), Dst Port: 34809 (34809), Seq: 37580, Ack: 1, Len: 768
Hypertext Transfer Protocol

No.     Time        Source                Destination           Protocol Length Info
     50 2.278282    100.77.157.208        198.232.124.224       TCP      68     34809 > http [ACK] Seq=1 Ack=38348 Win=2920 Len=0 TSval=144553 TSecr=320209500

Frame 50: 68 bytes on wire (544 bits), 68 bytes captured (544 bits)
Linux cooked capture
Internet Protocol Version 4, Src: 100.77.157.208 (100.77.157.208), Dst: 198.232.124.224 (198.232.124.224)
Transmission Control Protocol, Src Port: 34809 (34809), Dst Port: http (80), Seq: 1, Ack: 38348, Len: 0

No.     Time        Source                Destination           Protocol Length Info
     51 2.398195    198.232.124.224       100.77.157.208        HTTP     1366   Continuation or non-HTTP traffic

Frame 51: 1366 bytes on wire (10928 bits), 1366 bytes captured (10928 bits)
Linux cooked capture
Internet Protocol Version 4, Src: 198.232.124.224 (198.232.124.224), Dst: 100.77.157.208 (100.77.157.208)
Transmission Control Protocol, Src Port: http (80), Dst Port: 34809 (34809), Seq: 38348, Ack: 1, Len: 1298
Hypertext Transfer Protocol

No.     Time        Source                Destination           Protocol Length Info
     52 2.407722    198.232.124.224       100.77.157.208        HTTP     1366   Continuation or non-HTTP traffic

Frame 52: 1366 bytes on wire (10928 bits), 1366 bytes captured (10928 bits)
Linux cooked capture
Internet Protocol Version 4, Src: 198.232.124.224 (198.232.124.224), Dst: 100.77.157.208 (100.77.157.208)
Transmission Control Protocol, Src Port: http (80), Dst Port: 34809 (34809), Seq: 39646, Ack: 1, Len: 1298
Hypertext Transfer Protocol

No.     Time        Source                Destination           Protocol Length Info
     53 2.408067    198.232.124.224       100.77.157.208        HTTP     1366   Continuation or non-HTTP traffic

Frame 53: 1366 bytes on wire (10928 bits), 1366 bytes captured (10928 bits)
Linux cooked capture
Internet Protocol Version 4, Src: 198.232.124.224 (198.232.124.224), Dst: 100.77.157.208 (100.77.157.208)
Transmission Control Protocol, Src Port: http (80), Dst Port: 34809 (34809), Seq: 40944, Ack: 1, Len: 1298
Hypertext Transfer Protocol

No.     Time        Source                Destination           Protocol Length Info
     54 2.408840    100.77.157.208        198.232.124.224       TCP      68     34809 > http [ACK] Seq=1 Ack=40944 Win=2920 Len=0 TSval=144566 TSecr=320209513

Frame 54: 68 bytes on wire (544 bits), 68 bytes captured (544 bits)
Linux cooked capture
Internet Protocol Version 4, Src: 100.77.157.208 (100.77.157.208), Dst: 198.232.124.224 (198.232.124.224)
Transmission Control Protocol, Src Port: 34809 (34809), Dst Port: http (80), Seq: 1, Ack: 40944, Len: 0

No.     Time        Source                Destination           Protocol Length Info
     55 2.417688    198.232.124.224       100.77.157.208        HTTP     1366   Continuation or non-HTTP traffic

Frame 55: 1366 bytes on wire (10928 bits), 1366 bytes captured (10928 bits)
Linux cooked capture
Internet Protocol Version 4, Src: 198.232.124.224 (198.232.124.224), Dst: 100.77.157.208 (100.77.157.208)
Transmission Control Protocol, Src Port: http (80), Dst Port: 34809 (34809), Seq: 42242, Ack: 1, Len: 1298
Hypertext Transfer Protocol

No.     Time        Source                Destination           Protocol Length Info
     56 2.418597    100.77.157.208        198.232.124.224       TCP      68     34809 > http [ACK] Seq=1 Ack=43540 Win=2920 Len=0 TSval=144567 TSecr=320209514

Frame 56: 68 bytes on wire (544 bits), 68 bytes captured (544 bits)
Linux cooked capture
Internet Protocol Version 4, Src: 100.77.157.208 (100.77.157.208), Dst: 198.232.124.224 (198.232.124.224)
Transmission Control Protocol, Src Port: 34809 (34809), Dst Port: http (80), Seq: 1, Ack: 43540, Len: 0

No.     Time        Source                Destination           Protocol Length Info
     57 2.538343    198.232.124.224       100.77.157.208        HTTP     1366   Continuation or non-HTTP traffic

Frame 57: 1366 bytes on wire (10928 bits), 1366 bytes captured (10928 bits)
Linux cooked capture
Internet Protocol Version 4, Src: 198.232.124.224 (198.232.124.224), Dst: 100.77.157.208 (100.77.157.208)
Transmission Control Protocol, Src Port: http (80), Dst Port: 34809 (34809), Seq: 43540, Ack: 1, Len: 1298
Hypertext Transfer Protocol

No.     Time        Source                Destination           Protocol Length Info
     58 2.538703    198.232.124.224       100.77.157.208        HTTP     1366   Continuation or non-HTTP traffic

Frame 58: 1366 bytes on wire (10928 bits), 1366 bytes captured (10928 bits)
Linux cooked capture
Internet Protocol Version 4, Src: 198.232.124.224 (198.232.124.224), Dst: 100.77.157.208 (100.77.157.208)
Transmission Control Protocol, Src Port: http (80), Dst Port: 34809 (34809), Seq: 44838, Ack: 1, Len: 1298
Hypertext Transfer Protocol

No.     Time        Source                Destination           Protocol Length Info
     59 2.539428    100.77.157.208        198.232.124.224       TCP      68     34809 > http [ACK] Seq=1 Ack=46136 Win=2920 Len=0 TSval=144579 TSecr=320209527

Frame 59: 68 bytes on wire (544 bits), 68 bytes captured (544 bits)
Linux cooked capture
Internet Protocol Version 4, Src: 100.77.157.208 (100.77.157.208), Dst: 198.232.124.224 (198.232.124.224)
Transmission Control Protocol, Src Port: 34809 (34809), Dst Port: http (80), Seq: 1, Ack: 46136, Len: 0

No.     Time        Source                Destination           Protocol Length Info
     60 2.547735    198.232.124.224       100.77.157.208        HTTP     1366   Continuation or non-HTTP traffic

Frame 60: 1366 bytes on wire (10928 bits), 1366 bytes captured (10928 bits)
Linux cooked capture
Internet Protocol Version 4, Src: 198.232.124.224 (198.232.124.224), Dst: 100.77.157.208 (100.77.157.208)
Transmission Control Protocol, Src Port: http (80), Dst Port: 34809 (34809), Seq: 46136, Ack: 1, Len: 1298
Hypertext Transfer Protocol

No.     Time        Source                Destination           Protocol Length Info
     61 2.548048    198.232.124.224       100.77.157.208        HTTP     702    Continuation or non-HTTP traffic

Frame 61: 702 bytes on wire (5616 bits), 702 bytes captured (5616 bits)
Linux cooked capture
Internet Protocol Version 4, Src: 198.232.124.224 (198.232.124.224), Dst: 100.77.157.208 (100.77.157.208)
Transmission Control Protocol, Src Port: http (80), Dst Port: 34809 (34809), Seq: 47434, Ack: 1, Len: 634
Hypertext Transfer Protocol

No.     Time        Source                Destination           Protocol Length Info
     62 2.548598    100.77.157.208        198.232.124.224       TCP      68     34809 > http [ACK] Seq=1 Ack=48068 Win=2920 Len=0 TSval=144580 TSecr=320209528

Frame 62: 68 bytes on wire (544 bits), 68 bytes captured (544 bits)
Linux cooked capture
Internet Protocol Version 4, Src: 100.77.157.208 (100.77.157.208), Dst: 198.232.124.224 (198.232.124.224)
Transmission Control Protocol, Src Port: 34809 (34809), Dst Port: http (80), Seq: 1, Ack: 48068, Len: 0

No.     Time        Source                Destination           Protocol Length Info
     63 2.557570    198.232.124.224       100.77.157.208        HTTP     1366   Continuation or non-HTTP traffic

Frame 63: 1366 bytes on wire (10928 bits), 1366 bytes captured (10928 bits)
Linux cooked capture
Internet Protocol Version 4, Src: 198.232.124.224 (198.232.124.224), Dst: 100.77.157.208 (100.77.157.208)
Transmission Control Protocol, Src Port: http (80), Dst Port: 34809 (34809), Seq: 48068, Ack: 1, Len: 1298
Hypertext Transfer Protocol

No.     Time        Source                Destination           Protocol Length Info
     64 2.598165    100.77.157.208        198.232.124.224       TCP      68     34809 > http [ACK] Seq=1 Ack=49366 Win=2920 Len=0 TSval=144585 TSecr=320209528

Frame 64: 68 bytes on wire (544 bits), 68 bytes captured (544 bits)
Linux cooked capture
Internet Protocol Version 4, Src: 100.77.157.208 (100.77.157.208), Dst: 198.232.124.224 (198.232.124.224)
Transmission Control Protocol, Src Port: 34809 (34809), Dst Port: http (80), Seq: 1, Ack: 49366, Len: 0

No.     Time        Source                Destination           Protocol Length Info
     65 2.667683    198.232.124.224       100.77.157.208        HTTP     1366   Continuation or non-HTTP traffic

Frame 65: 1366 bytes on wire (10928 bits), 1366 bytes captured (10928 bits)
Linux cooked capture
Internet Protocol Version 4, Src: 198.232.124.224 (198.232.124.224), Dst: 100.77.157.208 (100.77.157.208)
Transmission Control Protocol, Src Port: http (80), Dst Port: 34809 (34809), Seq: 49366, Ack: 1, Len: 1298
Hypertext Transfer Protocol

No.     Time        Source                Destination           Protocol Length Info
     66 2.668083    198.232.124.224       100.77.157.208        HTTP     1366   Continuation or non-HTTP traffic

Frame 66: 1366 bytes on wire (10928 bits), 1366 bytes captured (10928 bits)
Linux cooked capture
Internet Protocol Version 4, Src: 198.232.124.224 (198.232.124.224), Dst: 100.77.157.208 (100.77.157.208)
Transmission Control Protocol, Src Port: http (80), Dst Port: 34809 (34809), Seq: 50664, Ack: 1, Len: 1298
Hypertext Transfer Protocol

No.     Time        Source                Destination           Protocol Length Info
     67 2.668883    100.77.157.208        198.232.124.224       TCP      68     34809 > http [ACK] Seq=1 Ack=51962 Win=2920 Len=0 TSval=144592 TSecr=320209540

Frame 67: 68 bytes on wire (544 bits), 68 bytes captured (544 bits)
Linux cooked capture
Internet Protocol Version 4, Src: 100.77.157.208 (100.77.157.208), Dst: 198.232.124.224 (198.232.124.224)
Transmission Control Protocol, Src Port: 34809 (34809), Dst Port: http (80), Seq: 1, Ack: 51962, Len: 0

No.     Time        Source                Destination           Protocol Length Info
     68 2.687602    198.232.124.224       100.77.157.208        HTTP     1366   Continuation or non-HTTP traffic

Frame 68: 1366 bytes on wire (10928 bits), 1366 bytes captured (10928 bits)
Linux cooked capture
Internet Protocol Version 4, Src: 198.232.124.224 (198.232.124.224), Dst: 100.77.157.208 (100.77.157.208)
Transmission Control Protocol, Src Port: http (80), Dst Port: 34809 (34809), Seq: 51962, Ack: 1, Len: 1298
Hypertext Transfer Protocol

No.     Time        Source                Destination           Protocol Length Info
     69 2.738143    100.77.157.208        198.232.124.224       TCP      68     34809 > http [ACK] Seq=1 Ack=53260 Win=2920 Len=0 TSval=144599 TSecr=320209542

Frame 69: 68 bytes on wire (544 bits), 68 bytes captured (544 bits)
Linux cooked capture
Internet Protocol Version 4, Src: 100.77.157.208 (100.77.157.208), Dst: 198.232.124.224 (198.232.124.224)
Transmission Control Protocol, Src Port: 34809 (34809), Dst Port: http (80), Seq: 1, Ack: 53260, Len: 0

No.     Time        Source                Destination           Protocol Length Info
     70 2.957560    198.232.124.224       100.77.157.208        HTTP     1366   Continuation or non-HTTP traffic

Frame 70: 1366 bytes on wire (10928 bits), 1366 bytes captured (10928 bits)
Linux cooked capture
Internet Protocol Version 4, Src: 198.232.124.224 (198.232.124.224), Dst: 100.77.157.208 (100.77.157.208)
Transmission Control Protocol, Src Port: http (80), Dst Port: 34809 (34809), Seq: 53260, Ack: 1, Len: 1298
Hypertext Transfer Protocol

No.     Time        Source                Destination           Protocol Length Info
     71 3.058178    100.77.157.208        198.232.124.224       TCP      68     34809 > http [ACK] Seq=1 Ack=54558 Win=2920 Len=0 TSval=144631 TSecr=320209569

Frame 71: 68 bytes on wire (544 bits), 68 bytes captured (544 bits)
Linux cooked capture
Internet Protocol Version 4, Src: 100.77.157.208 (100.77.157.208), Dst: 198.232.124.224 (198.232.124.224)
Transmission Control Protocol, Src Port: 34809 (34809), Dst Port: http (80), Seq: 1, Ack: 54558, Len: 0

No.     Time        Source                Destination           Protocol Length Info
     72 3.467455    198.232.124.224       100.77.157.208        HTTP     1366   [TCP Retransmission] Continuation or non-HTTP traffic

Frame 72: 1366 bytes on wire (10928 bits), 1366 bytes captured (10928 bits)
Linux cooked capture
Internet Protocol Version 4, Src: 198.232.124.224 (198.232.124.224), Dst: 100.77.157.208 (100.77.157.208)
Transmission Control Protocol, Src Port: http (80), Dst Port: 34809 (34809), Seq: 49366, Ack: 1, Len: 1298
Hypertext Transfer Protocol

No.     Time        Source                Destination           Protocol Length Info
     73 3.468540    100.77.157.208        198.232.124.224       TCP      80     [TCP Dup ACK 71#1] 34809 > http [ACK] Seq=1 Ack=54558 Win=2920 Len=0 TSval=144672 TSecr=320209569 SLE=49366 SRE=50664

Frame 73: 80 bytes on wire (640 bits), 80 bytes captured (640 bits)
Linux cooked capture
Internet Protocol Version 4, Src: 100.77.157.208 (100.77.157.208), Dst: 198.232.124.224 (198.232.124.224)
Transmission Control Protocol, Src Port: 34809 (34809), Dst Port: http (80), Seq: 1, Ack: 54558, Len: 0

No.     Time        Source                Destination           Protocol Length Info
     74 3.507563    198.232.124.224       100.77.157.208        HTTP     1366   [TCP Retransmission] Continuation or non-HTTP traffic

Frame 74: 1366 bytes on wire (10928 bits), 1366 bytes captured (10928 bits)
Linux cooked capture
Internet Protocol Version 4, Src: 198.232.124.224 (198.232.124.224), Dst: 100.77.157.208 (100.77.157.208)
