No.     Time        Source                Destination           Protocol Length Info
      1 0.000000    192.168.1.101         184.173.147.59        TCP      95     [TCP segment of a reassembled PDU]

Frame 1: 95 bytes on wire (760 bits), 95 bytes captured (760 bits)
Ethernet II, Src: aa:aa:03:00:00:00 (aa:aa:03:00:00:00), Dst: 1b:24:63:41:00:59 (1b:24:63:41:00:59)
Internet Protocol Version 4, Src: 192.168.1.101 (192.168.1.101), Dst: 184.173.147.59 (184.173.147.59)
Transmission Control Protocol, Src Port: 33252 (33252), Dst Port: xmpp-client (5222), Seq: 1, Ack: 1, Len: 29

No.     Time        Source                Destination           Protocol Length Info
      2 0.993835    184.173.147.59        192.168.1.101         TCP      66     xmpp-client > 33252 [ACK] Seq=1 Ack=30 Win=514 Len=0 TSval=2383692068 TSecr=255105

Frame 2: 66 bytes on wire (528 bits), 66 bytes captured (528 bits)
Ethernet II, Src: FonTechn_a5:e9:80 (00:18:84:a5:e9:80), Dst: SamsungE_24:63:41 (cc:05:1b:24:63:41)
Internet Protocol Version 4, Src: 184.173.147.59 (184.173.147.59), Dst: 192.168.1.101 (192.168.1.101)
Transmission Control Protocol, Src Port: xmpp-client (5222), Dst Port: 33252 (33252), Seq: 1, Ack: 30, Len: 0

No.     Time        Source                Destination           Protocol Length Info
      3 0.994273    192.168.1.101         184.173.147.59        TCP      106    [TCP segment of a reassembled PDU]

Frame 3: 106 bytes on wire (848 bits), 106 bytes captured (848 bits)
Ethernet II, Src: aa:aa:03:00:00:00 (aa:aa:03:00:00:00), Dst: 1b:24:63:41:00:64 (1b:24:63:41:00:64)
Internet Protocol Version 4, Src: 192.168.1.101 (192.168.1.101), Dst: 184.173.147.59 (184.173.147.59)
Transmission Control Protocol, Src Port: 33252 (33252), Dst Port: xmpp-client (5222), Seq: 30, Ack: 1, Len: 40

No.     Time        Source                Destination           Protocol Length Info
      4 1.202190    184.173.147.59        192.168.1.101         TCP      112    [TCP segment of a reassembled PDU]

Frame 4: 112 bytes on wire (896 bits), 112 bytes captured (896 bits)
Ethernet II, Src: FonTechn_a5:e9:80 (00:18:84:a5:e9:80), Dst: SamsungE_24:63:41 (cc:05:1b:24:63:41)
Internet Protocol Version 4, Src: 184.173.147.59 (184.173.147.59), Dst: 192.168.1.101 (192.168.1.101)
Transmission Control Protocol, Src Port: xmpp-client (5222), Dst Port: 33252 (33252), Seq: 1, Ack: 70, Len: 46

No.     Time        Source                Destination           Protocol Length Info
      5 1.202572    192.168.1.101         184.173.147.59        TCP      66     33252 > xmpp-client [ACK] Seq=70 Ack=47 Win=864 Len=0 TSval=255225 TSecr=2383693039

Frame 5: 66 bytes on wire (528 bits), 66 bytes captured (528 bits)
Ethernet II, Src: aa:aa:03:00:00:00 (aa:aa:03:00:00:00), Dst: 1b:24:63:41:00:3c (1b:24:63:41:00:3c)
Internet Protocol Version 4, Src: 192.168.1.101 (192.168.1.101), Dst: 184.173.147.59 (184.173.147.59)
Transmission Control Protocol, Src Port: 33252 (33252), Dst Port: xmpp-client (5222), Seq: 70, Ack: 47, Len: 0

No.     Time        Source                Destination           Protocol Length Info
      6 2.372193    192.168.1.101         184.173.147.59        TCP      124    [TCP segment of a reassembled PDU]

Frame 6: 124 bytes on wire (992 bits), 124 bytes captured (992 bits)
Ethernet II, Src: aa:aa:03:00:00:00 (aa:aa:03:00:00:00), Dst: 1b:24:63:41:00:76 (1b:24:63:41:00:76)
Internet Protocol Version 4, Src: 192.168.1.101 (192.168.1.101), Dst: 184.173.147.59 (184.173.147.59)
Transmission Control Protocol, Src Port: 33252 (33252), Dst Port: xmpp-client (5222), Seq: 70, Ack: 47, Len: 58

No.     Time        Source                Destination           Protocol Length Info
      7 2.841208    192.168.1.103         239.255.255.250       SSDP     554    NOTIFY * HTTP/1.1 

Frame 7: 554 bytes on wire (4432 bits), 554 bytes captured (4432 bits)
Ethernet II, Src: HonHaiPr_aa:03:be (c4:17:fe:aa:03:be), Dst: IPv4mcast_7f:ff:fa (01:00:5e:7f:ff:fa)
Internet Protocol Version 4, Src: 192.168.1.103 (192.168.1.103), Dst: 239.255.255.250 (239.255.255.250)
User Datagram Protocol, Src Port: ssdp (1900), Dst Port: ssdp (1900)
Hypertext Transfer Protocol

No.     Time        Source                Destination           Protocol Length Info
      8 2.847353    fe80::435:237d:d570:1f64 ff02::c               SSDP     581    NOTIFY * HTTP/1.1 

Frame 8: 581 bytes on wire (4648 bits), 581 bytes captured (4648 bits)
Ethernet II, Src: HonHaiPr_aa:03:be (c4:17:fe:aa:03:be), Dst: IPv6mcast_00:00:00:0c (33:33:00:00:00:0c)
Internet Protocol Version 6, Src: fe80::435:237d:d570:1f64 (fe80::435:237d:d570:1f64), Dst: ff02::c (ff02::c)
User Datagram Protocol, Src Port: ssdp (1900), Dst Port: ssdp (1900)
Hypertext Transfer Protocol

No.     Time        Source                Destination           Protocol Length Info
      9 2.847708    184.173.147.59        192.168.1.101         TCP      111    [TCP segment of a reassembled PDU]

Frame 9: 111 bytes on wire (888 bits), 111 bytes captured (888 bits)
Ethernet II, Src: FonTechn_a5:e9:80 (00:18:84:a5:e9:80), Dst: SamsungE_24:63:41 (cc:05:1b:24:63:41)
Internet Protocol Version 4, Src: 184.173.147.59 (184.173.147.59), Dst: 192.168.1.101 (192.168.1.101)
Transmission Control Protocol, Src Port: xmpp-client (5222), Dst Port: 33252 (33252), Seq: 47, Ack: 128, Len: 45

No.     Time        Source                Destination           Protocol Length Info
     10 2.847995    192.168.1.101         184.173.147.59        TCP      66     33252 > xmpp-client [ACK] Seq=128 Ack=92 Win=864 Len=0 TSval=255390 TSecr=2383694383

Frame 10: 66 bytes on wire (528 bits), 66 bytes captured (528 bits)
Ethernet II, Src: aa:aa:03:00:00:00 (aa:aa:03:00:00:00), Dst: 1b:24:63:41:00:3c (1b:24:63:41:00:3c)
Internet Protocol Version 4, Src: 192.168.1.101 (192.168.1.101), Dst: 184.173.147.59 (184.173.147.59)
Transmission Control Protocol, Src Port: 33252 (33252), Dst Port: xmpp-client (5222), Seq: 128, Ack: 92, Len: 0

No.     Time        Source                Destination           Protocol Length Info
     11 2.976693    192.168.1.101         184.173.147.59        TCP      78     [TCP segment of a reassembled PDU]

Frame 11: 78 bytes on wire (624 bits), 78 bytes captured (624 bits)
Ethernet II, Src: aa:aa:03:00:00:00 (aa:aa:03:00:00:00), Dst: 1b:24:63:41:00:48 (1b:24:63:41:00:48)
Internet Protocol Version 4, Src: 192.168.1.101 (192.168.1.101), Dst: 184.173.147.59 (184.173.147.59)
Transmission Control Protocol, Src Port: 33252 (33252), Dst Port: xmpp-client (5222), Seq: 128, Ack: 92, Len: 12

No.     Time        Source                Destination           Protocol Length Info
     12 3.968983    192.168.1.103         239.255.255.250       SSDP     483    NOTIFY * HTTP/1.1 

Frame 12: 483 bytes on wire (3864 bits), 483 bytes captured (3864 bits)
Ethernet II, Src: HonHaiPr_aa:03:be (c4:17:fe:aa:03:be), Dst: IPv4mcast_7f:ff:fa (01:00:5e:7f:ff:fa)
Internet Protocol Version 4, Src: 192.168.1.103 (192.168.1.103), Dst: 239.255.255.250 (239.255.255.250)
User Datagram Protocol, Src Port: ssdp (1900), Dst Port: ssdp (1900)
Hypertext Transfer Protocol

No.     Time        Source                Destination           Protocol Length Info
     13 3.975288    fe80::435:237d:d570:1f64 ff02::c               SSDP     510    NOTIFY * HTTP/1.1 

Frame 13: 510 bytes on wire (4080 bits), 510 bytes captured (4080 bits)
Ethernet II, Src: HonHaiPr_aa:03:be (c4:17:fe:aa:03:be), Dst: IPv6mcast_00:00:00:0c (33:33:00:00:00:0c)
Internet Protocol Version 6, Src: fe80::435:237d:d570:1f64 (fe80::435:237d:d570:1f64), Dst: ff02::c (ff02::c)
User Datagram Protocol, Src Port: ssdp (1900), Dst Port: ssdp (1900)
Hypertext Transfer Protocol

No.     Time        Source                Destination           Protocol Length Info
     14 3.975538    184.173.147.59        192.168.1.101         TCP      93     [TCP segment of a reassembled PDU]

Frame 14: 93 bytes on wire (744 bits), 93 bytes captured (744 bits)
Ethernet II, Src: FonTechn_a5:e9:80 (00:18:84:a5:e9:80), Dst: SamsungE_24:63:41 (cc:05:1b:24:63:41)
Internet Protocol Version 4, Src: 184.173.147.59 (184.173.147.59), Dst: 192.168.1.101 (192.168.1.101)
Transmission Control Protocol, Src Port: xmpp-client (5222), Dst Port: 33252 (33252), Seq: 92, Ack: 140, Len: 27

No.     Time        Source                Destination           Protocol Length Info
     15 3.976050    192.168.1.101         184.173.147.59        TCP      91     [TCP segment of a reassembled PDU]

Frame 15: 91 bytes on wire (728 bits), 91 bytes captured (728 bits)
Ethernet II, Src: aa:aa:03:00:00:00 (aa:aa:03:00:00:00), Dst: 1b:24:63:41:00:55 (1b:24:63:41:00:55)
Internet Protocol Version 4, Src: 192.168.1.101 (192.168.1.101), Dst: 184.173.147.59 (184.173.147.59)
Transmission Control Protocol, Src Port: 33252 (33252), Dst Port: xmpp-client (5222), Seq: 140, Ack: 119, Len: 25

No.     Time        Source                Destination           Protocol Length Info
     16 4.066175    192.168.1.103         192.168.1.255         NBNS     92     Name query NB WPAD<00>

Frame 16: 92 bytes on wire (736 bits), 92 bytes captured (736 bits)
Ethernet II, Src: HonHaiPr_aa:03:be (c4:17:fe:aa:03:be), Dst: Broadcast (ff:ff:ff:ff:ff:ff)
Internet Protocol Version 4, Src: 192.168.1.103 (192.168.1.103), Dst: 192.168.1.255 (192.168.1.255)
User Datagram Protocol, Src Port: netbios-ns (137), Dst Port: netbios-ns (137)
NetBIOS Name Service

No.     Time        Source                Destination           Protocol Length Info
     17 4.067360    192.168.1.103         192.168.1.255         NBNS     92     Name query NB WPAD<00>

Frame 17: 92 bytes on wire (736 bits), 92 bytes captured (736 bits)
Ethernet II, Src: HonHaiPr_aa:03:be (c4:17:fe:aa:03:be), Dst: Broadcast (ff:ff:ff:ff:ff:ff)
Internet Protocol Version 4, Src: 192.168.1.103 (192.168.1.103), Dst: 192.168.1.255 (192.168.1.255)
User Datagram Protocol, Src Port: netbios-ns (137), Dst Port: netbios-ns (137)
NetBIOS Name Service

No.     Time        Source                Destination           Protocol Length Info
     18 4.069292    fe80::435:237d:d570:1f64 ff02::1:3             LLMNR    84     Standard query 0x61b9  A wpad

Frame 18: 84 bytes on wire (672 bits), 84 bytes captured (672 bits)
Ethernet II, Src: HonHaiPr_aa:03:be (c4:17:fe:aa:03:be), Dst: IPv6mcast_00:01:00:03 (33:33:00:01:00:03)
Internet Protocol Version 6, Src: fe80::435:237d:d570:1f64 (fe80::435:237d:d570:1f64), Dst: ff02::1:3 (ff02::1:3)
User Datagram Protocol, Src Port: 60846 (60846), Dst Port: llmnr (5355)
Link-local Multicast Name Resolution (query)

No.     Time        Source                Destination           Protocol Length Info
     19 4.070660    fe80::435:237d:d570:1f64 ff02::1:3             LLMNR    84     Standard query 0x1acc  A wpad

Frame 19: 84 bytes on wire (672 bits), 84 bytes captured (672 bits)
Ethernet II, Src: HonHaiPr_aa:03:be (c4:17:fe:aa:03:be), Dst: IPv6mcast_00:01:00:03 (33:33:00:01:00:03)
Internet Protocol Version 6, Src: fe80::435:237d:d570:1f64 (fe80::435:237d:d570:1f64), Dst: ff02::1:3 (ff02::1:3)
User Datagram Protocol, Src Port: 51721 (51721), Dst Port: llmnr (5355)
Link-local Multicast Name Resolution (query)

No.     Time        Source                Destination           Protocol Length Info
     20 4.071742    192.168.1.103         224.0.0.252           LLMNR    64     Standard query 0x61b9  A wpad

Frame 20: 64 bytes on wire (512 bits), 64 bytes captured (512 bits)
Ethernet II, Src: HonHaiPr_aa:03:be (c4:17:fe:aa:03:be), Dst: IPv4mcast_00:00:fc (01:00:5e:00:00:fc)
Internet Protocol Version 4, Src: 192.168.1.103 (192.168.1.103), Dst: 224.0.0.252 (224.0.0.252)
User Datagram Protocol, Src Port: 60846 (60846), Dst Port: llmnr (5355)
Link-local Multicast Name Resolution (query)

No.     Time        Source                Destination           Protocol Length Info
     21 4.073032    192.168.1.103         224.0.0.252           LLMNR    64     Standard query 0x1acc  A wpad

Frame 21: 64 bytes on wire (512 bits), 64 bytes captured (512 bits)
Ethernet II, Src: HonHaiPr_aa:03:be (c4:17:fe:aa:03:be), Dst: IPv4mcast_00:00:fc (01:00:5e:00:00:fc)
Internet Protocol Version 4, Src: 192.168.1.103 (192.168.1.103), Dst: 224.0.0.252 (224.0.0.252)
User Datagram Protocol, Src Port: 51721 (51721), Dst Port: llmnr (5355)
Link-local Multicast Name Resolution (query)

No.     Time        Source                Destination           Protocol Length Info
     22 4.074465    fe80::435:237d:d570:1f64 ff02::1:3             LLMNR    84     Standard query 0xe8ff  AAAA wpad

Frame 22: 84 bytes on wire (672 bits), 84 bytes captured (672 bits)
Ethernet II, Src: HonHaiPr_aa:03:be (c4:17:fe:aa:03:be), Dst: IPv6mcast_00:01:00:03 (33:33:00:01:00:03)
Internet Protocol Version 6, Src: fe80::435:237d:d570:1f64 (fe80::435:237d:d570:1f64), Dst: ff02::1:3 (ff02::1:3)
User Datagram Protocol, Src Port: 56193 (56193), Dst Port: llmnr (5355)
Link-local Multicast Name Resolution (query)

No.     Time        Source                Destination           Protocol Length Info
     23 4.075750    192.168.1.103         224.0.0.252           LLMNR    64     Standard query 0xe8ff  AAAA wpad

Frame 23: 64 bytes on wire (512 bits), 64 bytes captured (512 bits)
Ethernet II, Src: HonHaiPr_aa:03:be (c4:17:fe:aa:03:be), Dst: IPv4mcast_00:00:fc (01:00:5e:00:00:fc)
Internet Protocol Version 4, Src: 192.168.1.103 (192.168.1.103), Dst: 224.0.0.252 (224.0.0.252)
User Datagram Protocol, Src Port: 56193 (56193), Dst Port: llmnr (5355)
Link-local Multicast Name Resolution (query)

No.     Time        Source                Destination           Protocol Length Info
     24 4.077853    fe80::435:237d:d570:1f64 ff02::1:3             LLMNR    84     Standard query 0xe92d  AAAA wpad

Frame 24: 84 bytes on wire (672 bits), 84 bytes captured (672 bits)
Ethernet II, Src: HonHaiPr_aa:03:be (c4:17:fe:aa:03:be), Dst: IPv6mcast_00:01:00:03 (33:33:00:01:00:03)
Internet Protocol Version 6, Src: fe80::435:237d:d570:1f64 (fe80::435:237d:d570:1f64), Dst: ff02::1:3 (ff02::1:3)
User Datagram Protocol, Src Port: 57976 (57976), Dst Port: llmnr (5355)
Link-local Multicast Name Resolution (query)

No.     Time        Source                Destination           Protocol Length Info
     25 4.078158    FonTechn_a5:e9:81     Spanning-tree-(for-bridges)_00 STP      52     Conf. Root = 32768/0/00:18:84:a5:e9:80  Cost = 0  Port = 0x8002

Frame 25: 52 bytes on wire (416 bits), 52 bytes captured (416 bits)
IEEE 802.3 Ethernet 
Logical-Link Control
Spanning Tree Protocol

No.     Time        Source                Destination           Protocol Length Info
     26 4.079242    192.168.1.103         224.0.0.252           LLMNR    64     Standard query 0xe92d  AAAA wpad

Frame 26: 64 bytes on wire (512 bits), 64 bytes captured (512 bits)
Ethernet II, Src: HonHaiPr_aa:03:be (c4:17:fe:aa:03:be), Dst: IPv4mcast_00:00:fc (01:00:5e:00:00:fc)
Internet Protocol Version 4, Src: 192.168.1.103 (192.168.1.103), Dst: 224.0.0.252 (224.0.0.252)
User Datagram Protocol, Src Port: 57976 (57976), Dst Port: llmnr (5355)
Link-local Multicast Name Resolution (query)

No.     Time        Source                Destination           Protocol Length Info
     27 4.476130    fe80::435:237d:d570:1f64 ff02::1:3             LLMNR    84     Standard query 0x61b9  A wpad

Frame 27: 84 bytes on wire (672 bits), 84 bytes captured (672 bits)
Ethernet II, Src: HonHaiPr_aa:03:be (c4:17:fe:aa:03:be), Dst: IPv6mcast_00:01:00:03 (33:33:00:01:00:03)
Internet Protocol Version 6, Src: fe80::435:237d:d570:1f64 (fe80::435:237d:d570:1f64), Dst: ff02::1:3 (ff02::1:3)
User Datagram Protocol, Src Port: 60846 (60846), Dst Port: llmnr (5355)
Link-local Multicast Name Resolution (query)

No.     Time        Source                Destination           Protocol Length Info
     28 4.477775    fe80::435:237d:d570:1f64 ff02::1:3             LLMNR    84     Standard query 0x1acc  A wpad

Frame 28: 84 bytes on wire (672 bits), 84 bytes captured (672 bits)
Ethernet II, Src: HonHaiPr_aa:03:be (c4:17:fe:aa:03:be), Dst: IPv6mcast_00:01:00:03 (33:33:00:01:00:03)
Internet Protocol Version 6, Src: fe80::435:237d:d570:1f64 (fe80::435:237d:d570:1f64), Dst: ff02::1:3 (ff02::1:3)
User Datagram Protocol, Src Port: 51721 (51721), Dst Port: llmnr (5355)
Link-local Multicast Name Resolution (query)

No.     Time        Source                Destination           Protocol Length Info
     29 4.479025    192.168.1.103         224.0.0.252           LLMNR    64     Standard query 0x61b9  A wpad

Frame 29: 64 bytes on wire (512 bits), 64 bytes captured (512 bits)
Ethernet II, Src: HonHaiPr_aa:03:be (c4:17:fe:aa:03:be), Dst: IPv4mcast_00:00:fc (01:00:5e:00:00:fc)
Internet Protocol Version 4, Src: 192.168.1.103 (192.168.1.103), Dst: 224.0.0.252 (224.0.0.252)
User Datagram Protocol, Src Port: 60846 (60846), Dst Port: llmnr (5355)
Link-local Multicast Name Resolution (query)

No.     Time        Source                Destination           Protocol Length Info
     30 4.480170    192.168.1.103         224.0.0.252           LLMNR    64     Standard query 0x1acc  A wpad

Frame 30: 64 bytes on wire (512 bits), 64 bytes captured (512 bits)
Ethernet II, Src: HonHaiPr_aa:03:be (c4:17:fe:aa:03:be), Dst: IPv4mcast_00:00:fc (01:00:5e:00:00:fc)
Internet Protocol Version 4, Src: 192.168.1.103 (192.168.1.103), Dst: 224.0.0.252 (224.0.0.252)
User Datagram Protocol, Src Port: 51721 (51721), Dst Port: llmnr (5355)
Link-local Multicast Name Resolution (query)

No.     Time        Source                Destination           Protocol Length Info
     31 4.482907    fe80::435:237d:d570:1f64 ff02::1:3             LLMNR    84     Standard query 0xe92d  AAAA wpad

Frame 31: 84 bytes on wire (672 bits), 84 bytes captured (672 bits)
Ethernet II, Src: HonHaiPr_aa:03:be (c4:17:fe:aa:03:be), Dst: IPv6mcast_00:01:00:03 (33:33:00:01:00:03)
Internet Protocol Version 6, Src: fe80::435:237d:d570:1f64 (fe80::435:237d:d570:1f64), Dst: ff02::1:3 (ff02::1:3)
User Datagram Protocol, Src Port: 57976 (57976), Dst Port: llmnr (5355)
Link-local Multicast Name Resolution (query)

No.     Time        Source                Destination           Protocol Length Info
     32 4.483232    fe80::435:237d:d570:1f64 ff02::1:3             LLMNR    84     Standard query 0xe8ff  AAAA wpad

Frame 32: 84 bytes on wire (672 bits), 84 bytes captured (672 bits)
Ethernet II, Src: HonHaiPr_aa:03:be (c4:17:fe:aa:03:be), Dst: IPv6mcast_00:01:00:03 (33:33:00:01:00:03)
Internet Protocol Version 6, Src: fe80::435:237d:d570:1f64 (fe80::435:237d:d570:1f64), Dst: ff02::1:3 (ff02::1:3)
User Datagram Protocol, Src Port: 56193 (56193), Dst Port: llmnr (5355)
Link-local Multicast Name Resolution (query)

No.     Time        Source                Destination           Protocol Length Info
     33 4.484337    192.168.1.103         224.0.0.252           LLMNR    64     Standard query 0xe92d  AAAA wpad

Frame 33: 64 bytes on wire (512 bits), 64 bytes captured (512 bits)
Ethernet II, Src: HonHaiPr_aa:03:be (c4:17:fe:aa:03:be), Dst: IPv4mcast_00:00:fc (01:00:5e:00:00:fc)
Internet Protocol Version 4, Src: 192.168.1.103 (192.168.1.103), Dst: 224.0.0.252 (224.0.0.252)
User Datagram Protocol, Src Port: 57976 (57976), Dst Port: llmnr (5355)
Link-local Multicast Name Resolution (query)

No.     Time        Source                Destination           Protocol Length Info
     34 4.485718    192.168.1.103         224.0.0.252           LLMNR    64     Standard query 0xe8ff  AAAA wpad

Frame 34: 64 bytes on wire (512 bits), 64 bytes captured (512 bits)
Ethernet II, Src: HonHaiPr_aa:03:be (c4:17:fe:aa:03:be), Dst: IPv4mcast_00:00:fc (01:00:5e:00:00:fc)
Internet Protocol Version 4, Src: 192.168.1.103 (192.168.1.103), Dst: 224.0.0.252 (224.0.0.252)
User Datagram Protocol, Src Port: 56193 (56193), Dst Port: llmnr (5355)
Link-local Multicast Name Resolution (query)

No.     Time        Source                Destination           Protocol Length Info
     35 4.486053    184.173.147.59        192.168.1.101         TCP      84     [TCP segment of a reassembled PDU]

Frame 35: 84 bytes on wire (672 bits), 84 bytes captured (672 bits)
Ethernet II, Src: FonTechn_a5:e9:80 (00:18:84:a5:e9:80), Dst: SamsungE_24:63:41 (cc:05:1b:24:63:41)
Internet Protocol Version 4, Src: 184.173.147.59 (184.173.147.59), Dst: 192.168.1.101 (192.168.1.101)
Transmission Control Protocol, Src Port: xmpp-client (5222), Dst Port: 33252 (33252), Seq: 119, Ack: 165, Len: 18

No.     Time        Source                Destination           Protocol Length Info
     36 4.525295    192.168.1.101         184.173.147.59        TCP      66     33252 > xmpp-client [ACK] Seq=165 Ack=137 Win=864 Len=0 TSval=255558 TSecr=2383696045

Frame 36: 66 bytes on wire (528 bits), 66 bytes captured (528 bits)
Ethernet II, Src: aa:aa:03:00:00:00 (aa:aa:03:00:00:00), Dst: 1b:24:63:41:00:3c (1b:24:63:41:00:3c)
Internet Protocol Version 4, Src: 192.168.1.101 (192.168.1.101), Dst: 184.173.147.59 (184.173.147.59)
Transmission Control Protocol, Src Port: 33252 (33252), Dst Port: xmpp-client (5222), Seq: 165, Ack: 137, Len: 0

No.     Time        Source                Destination           Protocol Length Info
     37 4.665823    192.168.1.101         184.173.147.59        TCP      133    [TCP segment of a reassembled PDU]

Frame 37: 133 bytes on wire (1064 bits), 133 bytes captured (1064 bits)
Ethernet II, Src: aa:aa:03:00:00:00 (aa:aa:03:00:00:00), Dst: 1b:24:63:41:00:7f (1b:24:63:41:00:7f)
Internet Protocol Version 4, Src: 192.168.1.101 (192.168.1.101), Dst: 184.173.147.59 (184.173.147.59)
Transmission Control Protocol, Src Port: 33252 (33252), Dst Port: xmpp-client (5222), Seq: 165, Ack: 137, Len: 67

No.     Time        Source                Destination           Protocol Length Info
     38 5.300213    192.168.1.103         239.255.255.250       SSDP     526    NOTIFY * HTTP/1.1 

Frame 38: 526 bytes on wire (4208 bits), 526 bytes captured (4208 bits)
Ethernet II, Src: HonHaiPr_aa:03:be (c4:17:fe:aa:03:be), Dst: IPv4mcast_7f:ff:fa (01:00:5e:7f:ff:fa)
Internet Protocol Version 4, Src: 192.168.1.103 (192.168.1.103), Dst: 239.255.255.250 (239.255.255.250)
User Datagram Protocol, Src Port: ssdp (1900), Dst Port: ssdp (1900)
Hypertext Transfer Protocol

No.     Time        Source                Destination           Protocol Length Info
     39 5.304642    fe80::435:237d:d570:1f64 ff02::c               SSDP     553    NOTIFY * HTTP/1.1 

Frame 39: 553 bytes on wire (4424 bits), 553 bytes captured (4424 bits)
Ethernet II, Src: HonHaiPr_aa:03:be (c4:17:fe:aa:03:be), Dst: IPv6mcast_00:00:00:0c (33:33:00:00:00:0c)
Internet Protocol Version 6, Src: fe80::435:237d:d570:1f64 (fe80::435:237d:d570:1f64), Dst: ff02::c (ff02::c)
User Datagram Protocol, Src Port: ssdp (1900), Dst Port: ssdp (1900)
Hypertext Transfer Protocol

No.     Time        Source                Destination           Protocol Length Info
     40 5.304875    184.173.147.59        192.168.1.101         TCP      111    [TCP segment of a reassembled PDU]

Frame 40: 111 bytes on wire (888 bits), 111 bytes captured (888 bits)
Ethernet II, Src: FonTechn_a5:e9:80 (00:18:84:a5:e9:80), Dst: SamsungE_24:63:41 (cc:05:1b:24:63:41)
Internet Protocol Version 4, Src: 184.173.147.59 (184.173.147.59), Dst: 192.168.1.101 (192.168.1.101)
Transmission Control Protocol, Src Port: xmpp-client (5222), Dst Port: 33252 (33252), Seq: 137, Ack: 232, Len: 45

No.     Time        Source                Destination           Protocol Length Info
     41 5.305167    192.168.1.101         184.173.147.59        TCP      66     33252 > xmpp-client [ACK] Seq=232 Ack=182 Win=864 Len=0 TSval=255635 TSecr=2383696699

Frame 41: 66 bytes on wire (528 bits), 66 bytes captured (528 bits)
Ethernet II, Src: aa:aa:03:00:00:00 (aa:aa:03:00:00:00), Dst: 1b:24:63:41:00:3c (1b:24:63:41:00:3c)
Internet Protocol Version 4, Src: 192.168.1.101 (192.168.1.101), Dst: 184.173.147.59 (184.173.147.59)
Transmission Control Protocol, Src Port: 33252 (33252), Dst Port: xmpp-client (5222), Seq: 232, Ack: 182, Len: 0

No.     Time        Source                Destination           Protocol Length Info
     42 5.499802    192.168.1.103         192.168.1.255         NBNS     92     Name query NB WPAD<00>

Frame 42: 92 bytes on wire (736 bits), 92 bytes captured (736 bits)
Ethernet II, Src: HonHaiPr_aa:03:be (c4:17:fe:aa:03:be), Dst: Broadcast (ff:ff:ff:ff:ff:ff)
Internet Protocol Version 4, Src: 192.168.1.103 (192.168.1.103), Dst: 192.168.1.255 (192.168.1.255)
User Datagram Protocol, Src Port: netbios-ns (137), Dst Port: netbios-ns (137)
NetBIOS Name Service

No.     Time        Source                Destination           Protocol Length Info
     43 5.501908    192.168.1.103         192.168.1.255         NBNS     92     Name query NB WPAD<00>

Frame 43: 92 bytes on wire (736 bits), 92 bytes captured (736 bits)
Ethernet II, Src: HonHaiPr_aa:03:be (c4:17:fe:aa:03:be), Dst: Broadcast (ff:ff:ff:ff:ff:ff)
Internet Protocol Version 4, Src: 192.168.1.103 (192.168.1.103), Dst: 192.168.1.255 (192.168.1.255)
User Datagram Protocol, Src Port: netbios-ns (137), Dst Port: netbios-ns (137)
NetBIOS Name Service

No.     Time        Source                Destination           Protocol Length Info
     44 6.119820    192.168.1.103         239.255.255.250       SSDP     540    NOTIFY * HTTP/1.1 

Frame 44: 540 bytes on wire (4320 bits), 540 bytes captured (4320 bits)
Ethernet II, Src: HonHaiPr_aa:03:be (c4:17:fe:aa:03:be), Dst: IPv4mcast_7f:ff:fa (01:00:5e:7f:ff:fa)
Internet Protocol Version 4, Src: 192.168.1.103 (192.168.1.103), Dst: 239.255.255.250 (239.255.255.250)
User Datagram Protocol, Src Port: ssdp (1900), Dst Port: ssdp (1900)
Hypertext Transfer Protocol

No.     Time        Source                Destination           Protocol Length Info
     45 6.123132    fe80::435:237d:d570:1f64 ff02::c               SSDP     567    NOTIFY * HTTP/1.1 

Frame 45: 567 bytes on wire (4536 bits), 567 bytes captured (4536 bits)
Ethernet II, Src: HonHaiPr_aa:03:be (c4:17:fe:aa:03:be), Dst: IPv6mcast_00:00:00:0c (33:33:00:00:00:0c)
Internet Protocol Version 6, Src: fe80::435:237d:d570:1f64 (fe80::435:237d:d570:1f64), Dst: ff02::c (ff02::c)
User Datagram Protocol, Src Port: ssdp (1900), Dst Port: ssdp (1900)
Hypertext Transfer Protocol

No.     Time        Source                Destination           Protocol Length Info
     46 6.220173    192.168.1.103         239.255.255.250       SSDP     538    NOTIFY * HTTP/1.1 

Frame 46: 538 bytes on wire (4304 bits), 538 bytes captured (4304 bits)
Ethernet II, Src: HonHaiPr_aa:03:be (c4:17:fe:aa:03:be), Dst: IPv4mcast_7f:ff:fa (01:00:5e:7f:ff:fa)
Internet Protocol Version 4, Src: 192.168.1.103 (192.168.1.103), Dst: 239.255.255.250 (239.255.255.250)
User Datagram Protocol, Src Port: ssdp (1900), Dst Port: ssdp (1900)
Hypertext Transfer Protocol

No.     Time        Source                Destination           Protocol Length Info
     47 6.225245    fe80::435:237d:d570:1f64 ff02::c               SSDP     565    NOTIFY * HTTP/1.1 

Frame 47: 565 bytes on wire (4520 bits), 565 bytes captured (4520 bits)
Ethernet II, Src: HonHaiPr_aa:03:be (c4:17:fe:aa:03:be), Dst: IPv6mcast_00:00:00:0c (33:33:00:00:00:0c)
Internet Protocol Version 6, Src: fe80::435:237d:d570:1f64 (fe80::435:237d:d570:1f64), Dst: ff02::c (ff02::c)
User Datagram Protocol, Src Port: ssdp (1900), Dst Port: ssdp (1900)
Hypertext Transfer Protocol

No.     Time        Source                Destination           Protocol Length Info
     48 7.756633    192.168.1.101         184.173.147.59        TCP      142    [TCP segment of a reassembled PDU]

Frame 48: 142 bytes on wire (1136 bits), 142 bytes captured (1136 bits)
Ethernet II, Src: aa:aa:03:00:00:00 (aa:aa:03:00:00:00), Dst: 1b:24:63:41:00:88 (1b:24:63:41:00:88)
Internet Protocol Version 4, Src: 192.168.1.101 (192.168.1.101), Dst: 184.173.147.59 (184.173.147.59)
Transmission Control Protocol, Src Port: 33252 (33252), Dst Port: xmpp-client (5222), Seq: 232, Ack: 182, Len: 76

No.     Time        Source                Destination           Protocol Length Info
     49 8.059467    FonTechn_a5:e9:81     Spanning-tree-(for-bridges)_00 STP      52     Conf. Root = 32768/0/00:18:84:a5:e9:80  Cost = 0  Port = 0x8002

Frame 49: 52 bytes on wire (416 bits), 52 bytes captured (416 bits)
IEEE 802.3 Ethernet 
Logical-Link Control
Spanning Tree Protocol

No.     Time        Source                Destination           Protocol Length Info
     50 8.061267    184.173.147.59        192.168.1.101         TCP      111    [TCP segment of a reassembled PDU]

Frame 50: 111 bytes on wire (888 bits), 111 bytes captured (888 bits)
Ethernet II, Src: FonTechn_a5:e9:80 (00:18:84:a5:e9:80), Dst: SamsungE_24:63:41 (cc:05:1b:24:63:41)
Internet Protocol Version 4, Src: 184.173.147.59 (184.173.147.59), Dst: 192.168.1.101 (192.168.1.101)
Transmission Control Protocol, Src Port: xmpp-client (5222), Dst Port: 33252 (33252), Seq: 182, Ack: 308, Len: 45

No.     Time        Source                Destination           Protocol Length Info
     51 8.061522    192.168.1.101         184.173.147.59        TCP      66     33252 > xmpp-client [ACK] Seq=308 Ack=227 Win=864 Len=0 TSval=255911 TSecr=2383699799

Frame 51: 66 bytes on wire (528 bits), 66 bytes captured (528 bits)
Ethernet II, Src: aa:aa:03:00:00:00 (aa:aa:03:00:00:00), Dst: 1b:24:63:41:00:3c (1b:24:63:41:00:3c)
Internet Protocol Version 4, Src: 192.168.1.101 (192.168.1.101), Dst: 184.173.147.59 (184.173.147.59)
Transmission Control Protocol, Src Port: 33252 (33252), Dst Port: xmpp-client (5222), Seq: 308, Ack: 227, Len: 0
