No.     Time        Source                Destination           Protocol Length Info
      1 0.000000    10.162.86.111         83.224.70.94          DNS      81     Standard query 0x27d6  A static.ak.fbcdn.net

Frame 1: 81 bytes on wire (648 bits), 81 bytes captured (648 bits)
Linux cooked capture
Internet Protocol Version 4, Src: 10.162.86.111 (10.162.86.111), Dst: 83.224.70.94 (83.224.70.94)
User Datagram Protocol, Src Port: 11175 (11175), Dst Port: domain (53)
Domain Name System (query)

No.     Time        Source                Destination           Protocol Length Info
      2 0.154260    83.224.70.94          10.162.86.111         DNS      191    Standard query response 0x27d6  CNAME static.ak.facebook.com.edgesuite.net CNAME a749.dsw4.akamai.net A 47.73.196.24 A 47.73.196.19

Frame 2: 191 bytes on wire (1528 bits), 191 bytes captured (1528 bits)
Linux cooked capture
Internet Protocol Version 4, Src: 83.224.70.94 (83.224.70.94), Dst: 10.162.86.111 (10.162.86.111)
User Datagram Protocol, Src Port: domain (53), Dst Port: 11175 (11175)
Domain Name System (response)

No.     Time        Source                Destination           Protocol Length Info
      3 0.275016    10.162.86.111         47.73.196.24          TCP      76     42215 > http [SYN] Seq=0 Win=5240 Len=0 MSS=1310 SACK_PERM=1 TSval=419837 TSecr=0 WS=4

Frame 3: 76 bytes on wire (608 bits), 76 bytes captured (608 bits)
Linux cooked capture
Internet Protocol Version 4, Src: 10.162.86.111 (10.162.86.111), Dst: 47.73.196.24 (47.73.196.24)
Transmission Control Protocol, Src Port: 42215 (42215), Dst Port: http (80), Seq: 0, Len: 0

No.     Time        Source                Destination           Protocol Length Info
      4 0.394205    47.73.196.24          10.162.86.111         TCP      80     http > 42215 [SYN, ACK] Seq=0 Ack=1 Win=64251 Len=0 TSval=151255894 TSecr=419837 MSS=1400 WS=4 SACK_PERM=1

Frame 4: 80 bytes on wire (640 bits), 80 bytes captured (640 bits)
Linux cooked capture
Internet Protocol Version 4, Src: 47.73.196.24 (47.73.196.24), Dst: 10.162.86.111 (10.162.86.111)
Transmission Control Protocol, Src Port: http (80), Dst Port: 42215 (42215), Seq: 0, Ack: 1, Len: 0

No.     Time        Source                Destination           Protocol Length Info
      5 0.394496    10.162.86.111         47.73.196.24          TCP      68     42215 > http [ACK] Seq=1 Ack=1 Win=5240 Len=0 TSval=419849 TSecr=151255894

Frame 5: 68 bytes on wire (544 bits), 68 bytes captured (544 bits)
Linux cooked capture
Internet Protocol Version 4, Src: 10.162.86.111 (10.162.86.111), Dst: 47.73.196.24 (47.73.196.24)
Transmission Control Protocol, Src Port: 42215 (42215), Dst Port: http (80), Seq: 1, Ack: 1, Len: 0

No.     Time        Source                Destination           Protocol Length Info
      6 0.582908    10.162.86.111         47.73.196.24          HTTP     928    GET /rsrc.php/v2/ym/r/3oMmlQdugzF.js HTTP/1.1 

Frame 6: 928 bytes on wire (7424 bits), 928 bytes captured (7424 bits)
Linux cooked capture
Internet Protocol Version 4, Src: 10.162.86.111 (10.162.86.111), Dst: 47.73.196.24 (47.73.196.24)
Transmission Control Protocol, Src Port: 42215 (42215), Dst Port: http (80), Seq: 1, Ack: 1, Len: 860
Hypertext Transfer Protocol

No.     Time        Source                Destination           Protocol Length Info
      7 0.954083    10.162.86.111         47.73.196.24          HTTP     928    [TCP Retransmission] GET /rsrc.php/v2/ym/r/3oMmlQdugzF.js HTTP/1.1 

Frame 7: 928 bytes on wire (7424 bits), 928 bytes captured (7424 bits)
Linux cooked capture
Internet Protocol Version 4, Src: 10.162.86.111 (10.162.86.111), Dst: 47.73.196.24 (47.73.196.24)
Transmission Control Protocol, Src Port: 42215 (42215), Dst Port: http (80), Seq: 1, Ack: 1, Len: 860
Hypertext Transfer Protocol

No.     Time        Source                Destination           Protocol Length Info
      8 1.154360    47.73.196.24          10.162.86.111         TCP      68     http > 42215 [ACK] Seq=1 Ack=861 Win=257004 Len=0 TSval=151255970 TSecr=419867

Frame 8: 68 bytes on wire (544 bits), 68 bytes captured (544 bits)
Linux cooked capture
Internet Protocol Version 4, Src: 47.73.196.24 (47.73.196.24), Dst: 10.162.86.111 (10.162.86.111)
Transmission Control Protocol, Src Port: http (80), Dst Port: 42215 (42215), Seq: 1, Ack: 861, Len: 0

No.     Time        Source                Destination           Protocol Length Info
      9 1.164358    47.73.196.24          10.162.86.111         TCP      1366   [TCP segment of a reassembled PDU]

Frame 9: 1366 bytes on wire (10928 bits), 1366 bytes captured (10928 bits)
Linux cooked capture
Internet Protocol Version 4, Src: 47.73.196.24 (47.73.196.24), Dst: 10.162.86.111 (10.162.86.111)
Transmission Control Protocol, Src Port: http (80), Dst Port: 42215 (42215), Seq: 1, Ack: 861, Len: 1298

No.     Time        Source                Destination           Protocol Length Info
     10 1.234143    10.162.86.111         47.73.196.24          TCP      68     42215 > http [ACK] Seq=861 Ack=1299 Win=7836 Len=0 TSval=419933 TSecr=151255970

Frame 10: 68 bytes on wire (544 bits), 68 bytes captured (544 bits)
Linux cooked capture
Internet Protocol Version 4, Src: 10.162.86.111 (10.162.86.111), Dst: 47.73.196.24 (47.73.196.24)
Transmission Control Protocol, Src Port: 42215 (42215), Dst Port: http (80), Seq: 861, Ack: 1299, Len: 0

No.     Time        Source                Destination           Protocol Length Info
     11 1.244330    47.73.196.24          10.162.86.111         TCP      1366   [TCP segment of a reassembled PDU]

Frame 11: 1366 bytes on wire (10928 bits), 1366 bytes captured (10928 bits)
Linux cooked capture
Internet Protocol Version 4, Src: 47.73.196.24 (47.73.196.24), Dst: 10.162.86.111 (10.162.86.111)
Transmission Control Protocol, Src Port: http (80), Dst Port: 42215 (42215), Seq: 1299, Ack: 861, Len: 1298

No.     Time        Source                Destination           Protocol Length Info
     12 1.244490    10.162.86.111         47.73.196.24          TCP      68     42215 > http [ACK] Seq=861 Ack=2597 Win=10432 Len=0 TSval=419934 TSecr=151255970

Frame 12: 68 bytes on wire (544 bits), 68 bytes captured (544 bits)
Linux cooked capture
Internet Protocol Version 4, Src: 10.162.86.111 (10.162.86.111), Dst: 47.73.196.24 (47.73.196.24)
Transmission Control Protocol, Src Port: 42215 (42215), Dst Port: http (80), Seq: 861, Ack: 2597, Len: 0

No.     Time        Source                Destination           Protocol Length Info
     13 1.284286    47.73.196.24          10.162.86.111         TCP      1366   [TCP segment of a reassembled PDU]

Frame 13: 1366 bytes on wire (10928 bits), 1366 bytes captured (10928 bits)
Linux cooked capture
Internet Protocol Version 4, Src: 47.73.196.24 (47.73.196.24), Dst: 10.162.86.111 (10.162.86.111)
Transmission Control Protocol, Src Port: http (80), Dst Port: 42215 (42215), Seq: 2597, Ack: 861, Len: 1298

No.     Time        Source                Destination           Protocol Length Info
     14 1.294330    47.73.196.24          10.162.86.111         TCP      1366   [TCP segment of a reassembled PDU]

Frame 14: 1366 bytes on wire (10928 bits), 1366 bytes captured (10928 bits)
Linux cooked capture
Internet Protocol Version 4, Src: 47.73.196.24 (47.73.196.24), Dst: 10.162.86.111 (10.162.86.111)
Transmission Control Protocol, Src Port: http (80), Dst Port: 42215 (42215), Seq: 3895, Ack: 861, Len: 1298

No.     Time        Source                Destination           Protocol Length Info
     15 1.381760    10.162.86.111         47.73.196.24          TCP      68     42215 > http [ACK] Seq=861 Ack=3895 Win=13028 Len=0 TSval=419947 TSecr=151255970

Frame 15: 68 bytes on wire (544 bits), 68 bytes captured (544 bits)
Linux cooked capture
Internet Protocol Version 4, Src: 10.162.86.111 (10.162.86.111), Dst: 47.73.196.24 (47.73.196.24)
Transmission Control Protocol, Src Port: 42215 (42215), Dst Port: http (80), Seq: 861, Ack: 3895, Len: 0

No.     Time        Source                Destination           Protocol Length Info
     16 1.394085    10.162.86.111         47.73.196.24          TCP      68     42215 > http [ACK] Seq=861 Ack=5193 Win=15624 Len=0 TSval=419949 TSecr=151255970

Frame 16: 68 bytes on wire (544 bits), 68 bytes captured (544 bits)
Linux cooked capture
Internet Protocol Version 4, Src: 10.162.86.111 (10.162.86.111), Dst: 47.73.196.24 (47.73.196.24)
Transmission Control Protocol, Src Port: 42215 (42215), Dst Port: http (80), Seq: 861, Ack: 5193, Len: 0

No.     Time        Source                Destination           Protocol Length Info
     17 1.634178    47.73.196.24          10.162.86.111         TCP      68     [TCP Dup ACK 14#1] http > 42215 [ACK] Seq=5193 Ack=861 Win=257004 Len=0 TSval=151256018 TSecr=419867

Frame 17: 68 bytes on wire (544 bits), 68 bytes captured (544 bits)
Linux cooked capture
Internet Protocol Version 4, Src: 47.73.196.24 (47.73.196.24), Dst: 10.162.86.111 (10.162.86.111)
Transmission Control Protocol, Src Port: http (80), Dst Port: 42215 (42215), Seq: 5193, Ack: 861, Len: 0

No.     Time        Source                Destination           Protocol Length Info
     18 1.704498    47.73.196.24          10.162.86.111         TCP      1366   [TCP segment of a reassembled PDU]

Frame 18: 1366 bytes on wire (10928 bits), 1366 bytes captured (10928 bits)
Linux cooked capture
Internet Protocol Version 4, Src: 47.73.196.24 (47.73.196.24), Dst: 10.162.86.111 (10.162.86.111)
Transmission Control Protocol, Src Port: http (80), Dst Port: 42215 (42215), Seq: 5193, Ack: 861, Len: 1298

No.     Time        Source                Destination           Protocol Length Info
     19 1.714443    47.73.196.24          10.162.86.111         TCP      1366   [TCP segment of a reassembled PDU]

Frame 19: 1366 bytes on wire (10928 bits), 1366 bytes captured (10928 bits)
Linux cooked capture
Internet Protocol Version 4, Src: 47.73.196.24 (47.73.196.24), Dst: 10.162.86.111 (10.162.86.111)
Transmission Control Protocol, Src Port: http (80), Dst Port: 42215 (42215), Seq: 6491, Ack: 861, Len: 1298

No.     Time        Source                Destination           Protocol Length Info
     20 1.714800    47.73.196.24          10.162.86.111         TCP      1366   [TCP segment of a reassembled PDU]

Frame 20: 1366 bytes on wire (10928 bits), 1366 bytes captured (10928 bits)
Linux cooked capture
Internet Protocol Version 4, Src: 47.73.196.24 (47.73.196.24), Dst: 10.162.86.111 (10.162.86.111)
Transmission Control Protocol, Src Port: http (80), Dst Port: 42215 (42215), Seq: 7789, Ack: 861, Len: 1298

No.     Time        Source                Destination           Protocol Length Info
     21 1.721913    10.162.86.111         47.73.196.24          TCP      68     42215 > http [ACK] Seq=861 Ack=6491 Win=18220 Len=0 TSval=419981 TSecr=151256022

Frame 21: 68 bytes on wire (544 bits), 68 bytes captured (544 bits)
Linux cooked capture
Internet Protocol Version 4, Src: 10.162.86.111 (10.162.86.111), Dst: 47.73.196.24 (47.73.196.24)
Transmission Control Protocol, Src Port: 42215 (42215), Dst Port: http (80), Seq: 861, Ack: 6491, Len: 0

No.     Time        Source                Destination           Protocol Length Info
     22 1.726005    10.162.86.111         47.73.196.24          TCP      68     42215 > http [ACK] Seq=861 Ack=7789 Win=20816 Len=0 TSval=419982 TSecr=151256022

Frame 22: 68 bytes on wire (544 bits), 68 bytes captured (544 bits)
Linux cooked capture
Internet Protocol Version 4, Src: 10.162.86.111 (10.162.86.111), Dst: 47.73.196.24 (47.73.196.24)
Transmission Control Protocol, Src Port: 42215 (42215), Dst Port: http (80), Seq: 861, Ack: 7789, Len: 0

No.     Time        Source                Destination           Protocol Length Info
     23 1.728711    10.162.86.111         47.73.196.24          TCP      68     42215 > http [ACK] Seq=861 Ack=9087 Win=23412 Len=0 TSval=419982 TSecr=151256022

Frame 23: 68 bytes on wire (544 bits), 68 bytes captured (544 bits)
Linux cooked capture
Internet Protocol Version 4, Src: 10.162.86.111 (10.162.86.111), Dst: 47.73.196.24 (47.73.196.24)
Transmission Control Protocol, Src Port: 42215 (42215), Dst Port: http (80), Seq: 861, Ack: 9087, Len: 0

No.     Time        Source                Destination           Protocol Length Info
     24 1.764353    47.73.196.24          10.162.86.111         TCP      1366   [TCP segment of a reassembled PDU]

Frame 24: 1366 bytes on wire (10928 bits), 1366 bytes captured (10928 bits)
Linux cooked capture
Internet Protocol Version 4, Src: 47.73.196.24 (47.73.196.24), Dst: 10.162.86.111 (10.162.86.111)
Transmission Control Protocol, Src Port: http (80), Dst Port: 42215 (42215), Seq: 9087, Ack: 861, Len: 1298

No.     Time        Source                Destination           Protocol Length Info
     25 1.764578    10.162.86.111         47.73.196.24          TCP      68     42215 > http [ACK] Seq=861 Ack=10385 Win=26008 Len=0 TSval=419986 TSecr=151256026

Frame 25: 68 bytes on wire (544 bits), 68 bytes captured (544 bits)
Linux cooked capture
Internet Protocol Version 4, Src: 10.162.86.111 (10.162.86.111), Dst: 47.73.196.24 (47.73.196.24)
Transmission Control Protocol, Src Port: 42215 (42215), Dst Port: http (80), Seq: 861, Ack: 10385, Len: 0

No.     Time        Source                Destination           Protocol Length Info
     26 1.774438    47.73.196.24          10.162.86.111         TCP      1366   [TCP segment of a reassembled PDU]

Frame 26: 1366 bytes on wire (10928 bits), 1366 bytes captured (10928 bits)
Linux cooked capture
Internet Protocol Version 4, Src: 47.73.196.24 (47.73.196.24), Dst: 10.162.86.111 (10.162.86.111)
Transmission Control Protocol, Src Port: http (80), Dst Port: 42215 (42215), Seq: 10385, Ack: 861, Len: 1298

No.     Time        Source                Destination           Protocol Length Info
     27 1.784486    47.73.196.24          10.162.86.111         TCP      1366   [TCP segment of a reassembled PDU]

Frame 27: 1366 bytes on wire (10928 bits), 1366 bytes captured (10928 bits)
Linux cooked capture
Internet Protocol Version 4, Src: 47.73.196.24 (47.73.196.24), Dst: 10.162.86.111 (10.162.86.111)
Transmission Control Protocol, Src Port: http (80), Dst Port: 42215 (42215), Seq: 11683, Ack: 861, Len: 1298

No.     Time        Source                Destination           Protocol Length Info
     28 1.794433    47.73.196.24          10.162.86.111         TCP      1366   [TCP segment of a reassembled PDU]

Frame 28: 1366 bytes on wire (10928 bits), 1366 bytes captured (10928 bits)
Linux cooked capture
Internet Protocol Version 4, Src: 47.73.196.24 (47.73.196.24), Dst: 10.162.86.111 (10.162.86.111)
Transmission Control Protocol, Src Port: http (80), Dst Port: 42215 (42215), Seq: 12981, Ack: 861, Len: 1298

No.     Time        Source                Destination           Protocol Length Info
     29 1.804438    47.73.196.24          10.162.86.111         TCP      1366   [TCP segment of a reassembled PDU]

Frame 29: 1366 bytes on wire (10928 bits), 1366 bytes captured (10928 bits)
Linux cooked capture
Internet Protocol Version 4, Src: 47.73.196.24 (47.73.196.24), Dst: 10.162.86.111 (10.162.86.111)
Transmission Control Protocol, Src Port: http (80), Dst Port: 42215 (42215), Seq: 14279, Ack: 861, Len: 1298

No.     Time        Source                Destination           Protocol Length Info
     30 1.804748    47.73.196.24          10.162.86.111         TCP      876    [TCP segment of a reassembled PDU]

Frame 30: 876 bytes on wire (7008 bits), 876 bytes captured (7008 bits)
Linux cooked capture
Internet Protocol Version 4, Src: 47.73.196.24 (47.73.196.24), Dst: 10.162.86.111 (10.162.86.111)
Transmission Control Protocol, Src Port: http (80), Dst Port: 42215 (42215), Seq: 15577, Ack: 861, Len: 808

No.     Time        Source                Destination           Protocol Length Info
     31 1.834510    47.73.196.24          10.162.86.111         TCP      1366   [TCP segment of a reassembled PDU]

Frame 31: 1366 bytes on wire (10928 bits), 1366 bytes captured (10928 bits)
Linux cooked capture
Internet Protocol Version 4, Src: 47.73.196.24 (47.73.196.24), Dst: 10.162.86.111 (10.162.86.111)
Transmission Control Protocol, Src Port: http (80), Dst Port: 42215 (42215), Seq: 16385, Ack: 861, Len: 1298

No.     Time        Source                Destination           Protocol Length Info
     32 1.834803    47.73.196.24          10.162.86.111         TCP      1366   [TCP segment of a reassembled PDU]

Frame 32: 1366 bytes on wire (10928 bits), 1366 bytes captured (10928 bits)
Linux cooked capture
Internet Protocol Version 4, Src: 47.73.196.24 (47.73.196.24), Dst: 10.162.86.111 (10.162.86.111)
Transmission Control Protocol, Src Port: http (80), Dst Port: 42215 (42215), Seq: 17683, Ack: 861, Len: 1298

No.     Time        Source                Destination           Protocol Length Info
     33 1.854305    47.73.196.24          10.162.86.111         TCP      1366   [TCP segment of a reassembled PDU]

Frame 33: 1366 bytes on wire (10928 bits), 1366 bytes captured (10928 bits)
Linux cooked capture
Internet Protocol Version 4, Src: 47.73.196.24 (47.73.196.24), Dst: 10.162.86.111 (10.162.86.111)
Transmission Control Protocol, Src Port: http (80), Dst Port: 42215 (42215), Seq: 18981, Ack: 861, Len: 1298

No.     Time        Source                Destination           Protocol Length Info
     34 1.884531    47.73.196.24          10.162.86.111         TCP      1366   [TCP segment of a reassembled PDU]

Frame 34: 1366 bytes on wire (10928 bits), 1366 bytes captured (10928 bits)
Linux cooked capture
Internet Protocol Version 4, Src: 47.73.196.24 (47.73.196.24), Dst: 10.162.86.111 (10.162.86.111)
Transmission Control Protocol, Src Port: http (80), Dst Port: 42215 (42215), Seq: 20279, Ack: 861, Len: 1298

No.     Time        Source                Destination           Protocol Length Info
     35 1.884938    47.73.196.24          10.162.86.111         TCP      1366   [TCP segment of a reassembled PDU]

Frame 35: 1366 bytes on wire (10928 bits), 1366 bytes captured (10928 bits)
Linux cooked capture
Internet Protocol Version 4, Src: 47.73.196.24 (47.73.196.24), Dst: 10.162.86.111 (10.162.86.111)
Transmission Control Protocol, Src Port: http (80), Dst Port: 42215 (42215), Seq: 21577, Ack: 861, Len: 1298

No.     Time        Source                Destination           Protocol Length Info
     36 1.894388    47.73.196.24          10.162.86.111         TCP      1366   [TCP segment of a reassembled PDU]

Frame 36: 1366 bytes on wire (10928 bits), 1366 bytes captured (10928 bits)
Linux cooked capture
Internet Protocol Version 4, Src: 47.73.196.24 (47.73.196.24), Dst: 10.162.86.111 (10.162.86.111)
Transmission Control Protocol, Src Port: http (80), Dst Port: 42215 (42215), Seq: 22875, Ack: 861, Len: 1298

No.     Time        Source                Destination           Protocol Length Info
     37 1.924161    10.162.86.111         47.73.196.24          TCP      68     42215 > http [ACK] Seq=861 Ack=11683 Win=28604 Len=0 TSval=420002 TSecr=151256026

Frame 37: 68 bytes on wire (544 bits), 68 bytes captured (544 bits)
Linux cooked capture
Internet Protocol Version 4, Src: 10.162.86.111 (10.162.86.111), Dst: 47.73.196.24 (47.73.196.24)
Transmission Control Protocol, Src Port: 42215 (42215), Dst Port: http (80), Seq: 861, Ack: 11683, Len: 0

No.     Time        Source                Destination           Protocol Length Info
     38 1.924575    47.73.196.24          10.162.86.111         TCP      1366   [TCP segment of a reassembled PDU]

Frame 38: 1366 bytes on wire (10928 bits), 1366 bytes captured (10928 bits)
Linux cooked capture
Internet Protocol Version 4, Src: 47.73.196.24 (47.73.196.24), Dst: 10.162.86.111 (10.162.86.111)
Transmission Control Protocol, Src Port: http (80), Dst Port: 42215 (42215), Seq: 24173, Ack: 861, Len: 1298

No.     Time        Source                Destination           Protocol Length Info
     39 1.924803    10.162.86.111         47.73.196.24          TCP      68     42215 > http [ACK] Seq=861 Ack=12981 Win=31200 Len=0 TSval=420002 TSecr=151256026

Frame 39: 68 bytes on wire (544 bits), 68 bytes captured (544 bits)
Linux cooked capture
Internet Protocol Version 4, Src: 10.162.86.111 (10.162.86.111), Dst: 47.73.196.24 (47.73.196.24)
Transmission Control Protocol, Src Port: 42215 (42215), Dst Port: http (80), Seq: 861, Ack: 12981, Len: 0

No.     Time        Source                Destination           Protocol Length Info
     40 1.924856    10.162.86.111         47.73.196.24          TCP      68     42215 > http [ACK] Seq=861 Ack=14279 Win=33796 Len=0 TSval=420002 TSecr=151256026

Frame 40: 68 bytes on wire (544 bits), 68 bytes captured (544 bits)
Linux cooked capture
Internet Protocol Version 4, Src: 10.162.86.111 (10.162.86.111), Dst: 47.73.196.24 (47.73.196.24)
Transmission Control Protocol, Src Port: 42215 (42215), Dst Port: http (80), Seq: 861, Ack: 14279, Len: 0

No.     Time        Source                Destination           Protocol Length Info
     41 1.924888    10.162.86.111         47.73.196.24          TCP      68     42215 > http [ACK] Seq=861 Ack=15577 Win=36392 Len=0 TSval=420002 TSecr=151256026

Frame 41: 68 bytes on wire (544 bits), 68 bytes captured (544 bits)
Linux cooked capture
Internet Protocol Version 4, Src: 10.162.86.111 (10.162.86.111), Dst: 47.73.196.24 (47.73.196.24)
Transmission Control Protocol, Src Port: 42215 (42215), Dst Port: http (80), Seq: 861, Ack: 15577, Len: 0

No.     Time        Source                Destination           Protocol Length Info
     42 1.924921    10.162.86.111         47.73.196.24          TCP      68     42215 > http [ACK] Seq=861 Ack=16385 Win=38988 Len=0 TSval=420002 TSecr=151256026

Frame 42: 68 bytes on wire (544 bits), 68 bytes captured (544 bits)
Linux cooked capture
Internet Protocol Version 4, Src: 10.162.86.111 (10.162.86.111), Dst: 47.73.196.24 (47.73.196.24)
Transmission Control Protocol, Src Port: 42215 (42215), Dst Port: http (80), Seq: 861, Ack: 16385, Len: 0

No.     Time        Source                Destination           Protocol Length Info
     43 1.925001    10.162.86.111         47.73.196.24          TCP      68     42215 > http [ACK] Seq=861 Ack=17683 Win=39292 Len=0 TSval=420002 TSecr=151256030

Frame 43: 68 bytes on wire (544 bits), 68 bytes captured (544 bits)
Linux cooked capture
Internet Protocol Version 4, Src: 10.162.86.111 (10.162.86.111), Dst: 47.73.196.24 (47.73.196.24)
Transmission Control Protocol, Src Port: 42215 (42215), Dst Port: http (80), Seq: 861, Ack: 17683, Len: 0

No.     Time        Source                Destination           Protocol Length Info
     44 1.925040    10.162.86.111         47.73.196.24          TCP      68     42215 > http [ACK] Seq=861 Ack=18981 Win=38516 Len=0 TSval=420002 TSecr=151256030

Frame 44: 68 bytes on wire (544 bits), 68 bytes captured (544 bits)
Linux cooked capture
Internet Protocol Version 4, Src: 10.162.86.111 (10.162.86.111), Dst: 47.73.196.24 (47.73.196.24)
Transmission Control Protocol, Src Port: 42215 (42215), Dst Port: http (80), Seq: 861, Ack: 18981, Len: 0

No.     Time        Source                Destination           Protocol Length Info
     45 1.925096    10.162.86.111         47.73.196.24          TCP      68     42215 > http [ACK] Seq=861 Ack=20279 Win=37740 Len=0 TSval=420002 TSecr=151256030

Frame 45: 68 bytes on wire (544 bits), 68 bytes captured (544 bits)
Linux cooked capture
Internet Protocol Version 4, Src: 10.162.86.111 (10.162.86.111), Dst: 47.73.196.24 (47.73.196.24)
Transmission Control Protocol, Src Port: 42215 (42215), Dst Port: http (80), Seq: 861, Ack: 20279, Len: 0

No.     Time        Source                Destination           Protocol Length Info
     46 1.925146    10.162.86.111         47.73.196.24          TCP      68     42215 > http [ACK] Seq=861 Ack=24173 Win=35412 Len=0 TSval=420002 TSecr=151256042

Frame 46: 68 bytes on wire (544 bits), 68 bytes captured (544 bits)
Linux cooked capture
Internet Protocol Version 4, Src: 10.162.86.111 (10.162.86.111), Dst: 47.73.196.24 (47.73.196.24)
Transmission Control Protocol, Src Port: 42215 (42215), Dst Port: http (80), Seq: 861, Ack: 24173, Len: 0

No.     Time        Source                Destination           Protocol Length Info
     47 1.934421    47.73.196.24          10.162.86.111         TCP      1366   [TCP segment of a reassembled PDU]

Frame 47: 1366 bytes on wire (10928 bits), 1366 bytes captured (10928 bits)
Linux cooked capture
Internet Protocol Version 4, Src: 47.73.196.24 (47.73.196.24), Dst: 10.162.86.111 (10.162.86.111)
Transmission Control Protocol, Src Port: http (80), Dst Port: 42215 (42215), Seq: 25471, Ack: 861, Len: 1298

No.     Time        Source                Destination           Protocol Length Info
     48 1.934833    47.73.196.24          10.162.86.111         TCP      1366   [TCP segment of a reassembled PDU]

Frame 48: 1366 bytes on wire (10928 bits), 1366 bytes captured (10928 bits)
Linux cooked capture
Internet Protocol Version 4, Src: 47.73.196.24 (47.73.196.24), Dst: 10.162.86.111 (10.162.86.111)
Transmission Control Protocol, Src Port: http (80), Dst Port: 42215 (42215), Seq: 26769, Ack: 861, Len: 1298

No.     Time        Source                Destination           Protocol Length Info
     49 1.964463    47.73.196.24          10.162.86.111         TCP      1366   [TCP segment of a reassembled PDU]

Frame 49: 1366 bytes on wire (10928 bits), 1366 bytes captured (10928 bits)
Linux cooked capture
Internet Protocol Version 4, Src: 47.73.196.24 (47.73.196.24), Dst: 10.162.86.111 (10.162.86.111)
Transmission Control Protocol, Src Port: http (80), Dst Port: 42215 (42215), Seq: 28067, Ack: 861, Len: 1298

No.     Time        Source                Destination           Protocol Length Info
     50 1.974468    47.73.196.24          10.162.86.111         TCP      1366   [TCP segment of a reassembled PDU]

Frame 50: 1366 bytes on wire (10928 bits), 1366 bytes captured (10928 bits)
Linux cooked capture
Internet Protocol Version 4, Src: 47.73.196.24 (47.73.196.24), Dst: 10.162.86.111 (10.162.86.111)
Transmission Control Protocol, Src Port: http (80), Dst Port: 42215 (42215), Seq: 29365, Ack: 861, Len: 1298

No.     Time        Source                Destination           Protocol Length Info
     51 1.974790    47.73.196.24          10.162.86.111         TCP      1366   [TCP segment of a reassembled PDU]

Frame 51: 1366 bytes on wire (10928 bits), 1366 bytes captured (10928 bits)
Linux cooked capture
Internet Protocol Version 4, Src: 47.73.196.24 (47.73.196.24), Dst: 10.162.86.111 (10.162.86.111)
Transmission Control Protocol, Src Port: http (80), Dst Port: 42215 (42215), Seq: 30663, Ack: 861, Len: 1298

No.     Time        Source                Destination           Protocol Length Info
     52 1.994308    47.73.196.24          10.162.86.111         TCP      836    [TCP segment of a reassembled PDU]

Frame 52: 836 bytes on wire (6688 bits), 836 bytes captured (6688 bits)
Linux cooked capture
Internet Protocol Version 4, Src: 47.73.196.24 (47.73.196.24), Dst: 10.162.86.111 (10.162.86.111)
Transmission Control Protocol, Src Port: http (80), Dst Port: 42215 (42215), Seq: 31961, Ack: 861, Len: 768

No.     Time        Source                Destination           Protocol Length Info
     53 2.004616    47.73.196.24          10.162.86.111         TCP      1366   [TCP segment of a reassembled PDU]

Frame 53: 1366 bytes on wire (10928 bits), 1366 bytes captured (10928 bits)
Linux cooked capture
Internet Protocol Version 4, Src: 47.73.196.24 (47.73.196.24), Dst: 10.162.86.111 (10.162.86.111)
Transmission Control Protocol, Src Port: http (80), Dst Port: 42215 (42215), Seq: 32729, Ack: 861, Len: 1298

No.     Time        Source                Destination           Protocol Length Info
     54 2.004918    47.73.196.24          10.162.86.111         TCP      1366   [TCP segment of a reassembled PDU]

Frame 54: 1366 bytes on wire (10928 bits), 1366 bytes captured (10928 bits)
Linux cooked capture
Internet Protocol Version 4, Src: 47.73.196.24 (47.73.196.24), Dst: 10.162.86.111 (10.162.86.111)
Transmission Control Protocol, Src Port: http (80), Dst Port: 42215 (42215), Seq: 34027, Ack: 861, Len: 1298

No.     Time        Source                Destination           Protocol Length Info
     55 2.074160    10.162.86.111         47.73.196.24          TCP      68     42215 > http [ACK] Seq=861 Ack=35325 Win=28700 Len=0 TSval=420017 TSecr=151256046

Frame 55: 68 bytes on wire (544 bits), 68 bytes captured (544 bits)
Linux cooked capture
Internet Protocol Version 4, Src: 10.162.86.111 (10.162.86.111), Dst: 47.73.196.24 (47.73.196.24)
Transmission Control Protocol, Src Port: 42215 (42215), Dst Port: http (80), Seq: 861, Ack: 35325, Len: 0

No.     Time        Source                Destination           Protocol Length Info
     56 2.125268    47.73.196.24          10.162.86.111         TCP      1366   [TCP segment of a reassembled PDU]

Frame 56: 1366 bytes on wire (10928 bits), 1366 bytes captured (10928 bits)
Linux cooked capture
Internet Protocol Version 4, Src: 47.73.196.24 (47.73.196.24), Dst: 10.162.86.111 (10.162.86.111)
Transmission Control Protocol, Src Port: http (80), Dst Port: 42215 (42215), Seq: 35325, Ack: 861, Len: 1298

No.     Time        Source                Destination           Protocol Length Info
     57 2.125551    10.162.86.111         47.73.196.24          TCP      68     42215 > http [ACK] Seq=861 Ack=36623 Win=42140 Len=0 TSval=420022 TSecr=151256066

Frame 57: 68 bytes on wire (544 bits), 68 bytes captured (544 bits)
Linux cooked capture
Internet Protocol Version 4, Src: 10.162.86.111 (10.162.86.111), Dst: 47.73.196.24 (47.73.196.24)
Transmission Control Protocol, Src Port: 42215 (42215), Dst Port: http (80), Seq: 861, Ack: 36623, Len: 0

No.     Time        Source                Destination           Protocol Length Info
     58 2.125688    47.73.196.24          10.162.86.111         TCP      1366   [TCP segment of a reassembled PDU]

Frame 58: 1366 bytes on wire (10928 bits), 1366 bytes captured (10928 bits)
Linux cooked capture
Internet Protocol Version 4, Src: 47.73.196.24 (47.73.196.24), Dst: 10.162.86.111 (10.162.86.111)
Transmission Control Protocol, Src Port: http (80), Dst Port: 42215 (42215), Seq: 36623, Ack: 861, Len: 1298

No.     Time        Source                Destination           Protocol Length Info
     59 2.125958    47.73.196.24          10.162.86.111         TCP      1366   [TCP segment of a reassembled PDU]

Frame 59: 1366 bytes on wire (10928 bits), 1366 bytes captured (10928 bits)
Linux cooked capture
Internet Protocol Version 4, Src: 47.73.196.24 (47.73.196.24), Dst: 10.162.86.111 (10.162.86.111)
Transmission Control Protocol, Src Port: http (80), Dst Port: 42215 (42215), Seq: 37921, Ack: 861, Len: 1298

No.     Time        Source                Destination           Protocol Length Info
     60 2.164166    10.162.86.111         47.73.196.24          TCP      68     42215 > http [ACK] Seq=861 Ack=39219 Win=40588 Len=0 TSval=420026 TSecr=151256066

Frame 60: 68 bytes on wire (544 bits), 68 bytes captured (544 bits)
Linux cooked capture
Internet Protocol Version 4, Src: 10.162.86.111 (10.162.86.111), Dst: 47.73.196.24 (47.73.196.24)
Transmission Control Protocol, Src Port: 42215 (42215), Dst Port: http (80), Seq: 861, Ack: 39219, Len: 0

No.     Time        Source                Destination           Protocol Length Info
     61 2.164748    47.73.196.24          10.162.86.111         TCP      1366   [TCP segment of a reassembled PDU]

Frame 61: 1366 bytes on wire (10928 bits), 1366 bytes captured (10928 bits)
Linux cooked capture
Internet Protocol Version 4, Src: 47.73.196.24 (47.73.196.24), Dst: 10.162.86.111 (10.162.86.111)
Transmission Control Protocol, Src Port: http (80), Dst Port: 42215 (42215), Seq: 39219, Ack: 861, Len: 1298

No.     Time        Source                Destination           Protocol Length Info
     62 2.165446    47.73.196.24          10.162.86.111         TCP      1366   [TCP segment of a reassembled PDU]

Frame 62: 1366 bytes on wire (10928 bits), 1366 bytes captured (10928 bits)
Linux cooked capture
Internet Protocol Version 4, Src: 47.73.196.24 (47.73.196.24), Dst: 10.162.86.111 (10.162.86.111)
Transmission Control Protocol, Src Port: http (80), Dst Port: 42215 (42215), Seq: 40517, Ack: 861, Len: 1298

No.     Time        Source                Destination           Protocol Length Info
     63 2.174386    47.73.196.24          10.162.86.111         TCP      1366   [TCP segment of a reassembled PDU]

Frame 63: 1366 bytes on wire (10928 bits), 1366 bytes captured (10928 bits)
Linux cooked capture
Internet Protocol Version 4, Src: 47.73.196.24 (47.73.196.24), Dst: 10.162.86.111 (10.162.86.111)
Transmission Control Protocol, Src Port: http (80), Dst Port: 42215 (42215), Seq: 41815, Ack: 861, Len: 1298

No.     Time        Source                Destination           Protocol Length Info
     64 2.204521    47.73.196.24          10.162.86.111         TCP      1366   [TCP segment of a reassembled PDU]

Frame 64: 1366 bytes on wire (10928 bits), 1366 bytes captured (10928 bits)
Linux cooked capture
Internet Protocol Version 4, Src: 47.73.196.24 (47.73.196.24), Dst: 10.162.86.111 (10.162.86.111)
Transmission Control Protocol, Src Port: http (80), Dst Port: 42215 (42215), Seq: 43113, Ack: 861, Len: 1298

No.     Time        Source                Destination           Protocol Length Info
     65 2.204846    47.73.196.24          10.162.86.111         TCP      1366   [TCP segment of a reassembled PDU]

Frame 65: 1366 bytes on wire (10928 bits), 1366 bytes captured (10928 bits)
Linux cooked capture
Internet Protocol Version 4, Src: 47.73.196.24 (47.73.196.24), Dst: 10.162.86.111 (10.162.86.111)
Transmission Control Protocol, Src Port: http (80), Dst Port: 42215 (42215), Seq: 44411, Ack: 861, Len: 1298

No.     Time        Source                Destination           Protocol Length Info
     66 2.214426    47.73.196.24          10.162.86.111         TCP      1366   [TCP segment of a reassembled PDU]

Frame 66: 1366 bytes on wire (10928 bits), 1366 bytes captured (10928 bits)
Linux cooked capture
Internet Protocol Version 4, Src: 47.73.196.24 (47.73.196.24), Dst: 10.162.86.111 (10.162.86.111)
Transmission Control Protocol, Src Port: http (80), Dst Port: 42215 (42215), Seq: 45709, Ack: 861, Len: 1298

No.     Time        Source                Destination           Protocol Length Info
     67 2.214630    10.162.86.111         47.73.196.24          TCP      68     42215 > http [ACK] Seq=861 Ack=47007 Win=35932 Len=0 TSval=420031 TSecr=151256070

Frame 67: 68 bytes on wire (544 bits), 68 bytes captured (544 bits)
Linux cooked capture
Internet Protocol Version 4, Src: 10.162.86.111 (10.162.86.111), Dst: 47.73.196.24 (47.73.196.24)
Transmission Control Protocol, Src Port: 42215 (42215), Dst Port: http (80), Seq: 861, Ack: 47007, Len: 0

No.     Time        Source                Destination           Protocol Length Info
     68 2.244696    47.73.196.24          10.162.86.111         TCP      1366   [TCP segment of a reassembled PDU]

Frame 68: 1366 bytes on wire (10928 bits), 1366 bytes captured (10928 bits)
Linux cooked capture
Internet Protocol Version 4, Src: 47.73.196.24 (47.73.196.24), Dst: 10.162.86.111 (10.162.86.111)
Transmission Control Protocol, Src Port: http (80), Dst Port: 42215 (42215), Seq: 47007, Ack: 861, Len: 1298

No.     Time        Source                Destination           Protocol Length Info
     69 2.245011    47.73.196.24          10.162.86.111         TCP      836    [TCP segment of a reassembled PDU]

Frame 69: 836 bytes on wire (6688 bits), 836 bytes captured (6688 bits)
Linux cooked capture
Internet Protocol Version 4, Src: 47.73.196.24 (47.73.196.24), Dst: 10.162.86.111 (10.162.86.111)
Transmission Control Protocol, Src Port: http (80), Dst Port: 42215 (42215), Seq: 48305, Ack: 861, Len: 768

No.     Time        Source                Destination           Protocol Length Info
     70 2.247793    10.162.86.111         47.73.196.24          TCP      68     42215 > http [ACK] Seq=861 Ack=49073 Win=40084 Len=0 TSval=420034 TSecr=151256078

Frame 70: 68 bytes on wire (544 bits), 68 bytes captured (544 bits)
Linux cooked capture
Internet Protocol Version 4, Src: 10.162.86.111 (10.162.86.111), Dst: 47.73.196.24 (47.73.196.24)
Transmission Control Protocol, Src Port: 42215 (42215), Dst Port: http (80), Seq: 861, Ack: 49073, Len: 0

No.     Time        Source                Destination           Protocol Length Info
     71 2.254488    47.73.196.24          10.162.86.111         TCP      1366   [TCP segment of a reassembled PDU]

Frame 71: 1366 bytes on wire (10928 bits), 1366 bytes captured (10928 bits)
Linux cooked capture
Internet Protocol Version 4, Src: 47.73.196.24 (47.73.196.24), Dst: 10.162.86.111 (10.162.86.111)
Transmission Control Protocol, Src Port: http (80), Dst Port: 42215 (42215), Seq: 49073, Ack: 861, Len: 1298

No.     Time        Source                Destination           Protocol Length Info
     72 2.254761    47.73.196.24          10.162.86.111         TCP      1366   [TCP segment of a reassembled PDU]

Frame 72: 1366 bytes on wire (10928 bits), 1366 bytes captured (10928 bits)
Linux cooked capture
Internet Protocol Version 4, Src: 47.73.196.24 (47.73.196.24), Dst: 10.162.86.111 (10.162.86.111)
Transmission Control Protocol, Src Port: http (80), Dst Port: 42215 (42215), Seq: 50371, Ack: 861, Len: 1298

No.     Time        Source                Destination           Protocol Length Info
     73 2.284238    10.162.86.111         47.73.196.24          TCP      68     42215 > http [ACK] Seq=861 Ack=51669 Win=38532 Len=0 TSval=420038 TSecr=151256078

Frame 73: 68 bytes on wire (544 bits), 68 bytes captured (544 bits)
Linux cooked capture
Internet Protocol Version 4, Src: 10.162.86.111 (10.162.86.111), Dst: 47.73.196.24 (47.73.196.24)
Transmission Control Protocol, Src Port: 42215 (42215), Dst Port: http (80), Seq: 861, Ack: 51669, Len: 0

No.     Time        Source                Destination           Protocol Length Info
     74 2.284361    47.73.196.24          10.162.86.111         TCP      1366   [TCP segment of a reassembled PDU]

Frame 74: 1366 bytes on wire (10928 bits), 1366 bytes captured (10928 bits)
Linux cooked capture
Internet Protocol Version 4, Src: 47.73.196.24 (47.73.196.24), Dst: 10.162.86.111 (10.162.86.111)
Transmission Control Protocol, Src Port: http (80), Dst Port: 42215 (42215), Seq: 51669, Ack: 861, Len: 1298

No.     Time        Source                Destination           Protocol Length Info
     75 2.324443    47.73.196.24          10.162.86.111         TCP      1366   [TCP segment of a reassembled PDU]

Frame 75: 1366 bytes on wire (10928 bits), 1366 bytes captured (10928 bits)
Linux cooked capture
Internet Protocol Version 4, Src: 47.73.196.24 (47.73.196.24), Dst: 10.162.86.111 (10.162.86.111)
Transmission Control Protocol, Src Port: http (80), Dst Port: 42215 (42215), Seq: 52967, Ack: 861, Len: 1298

No.     Time        Source                Destination           Protocol Length Info
     76 2.324653    10.162.86.111         47.73.196.24          TCP      68     42215 > http [ACK] Seq=861 Ack=54265 Win=36980 Len=0 TSval=420042 TSecr=151256082

Frame 76: 68 bytes on wire (544 bits), 68 bytes captured (544 bits)
Linux cooked capture
Internet Protocol Version 4, Src: 10.162.86.111 (10.162.86.111), Dst: 47.73.196.24 (47.73.196.24)
Transmission Control Protocol, Src Port: 42215 (42215), Dst Port: http (80), Seq: 861, Ack: 54265, Len: 0

No.     Time        Source                Destination           Protocol Length Info
     77 2.344360    47.73.196.24          10.162.86.111         TCP      1366   [TCP segment of a reassembled PDU]

Frame 77: 1366 bytes on wire (10928 bits), 1366 bytes captured (10928 bits)
Linux cooked capture
