No.     Time        Source                Destination           Protocol Length Info
      1 0.000000    192.168.1.101         88.149.128.12         DNS      78     Standard query 0x494e  A s0.doubleclick.net

Frame 1: 78 bytes on wire (624 bits), 78 bytes captured (624 bits)
Ethernet II, Src: aa:aa:03:00:00:00 (aa:aa:03:00:00:00), Dst: 1b:24:63:41:00:48 (1b:24:63:41:00:48)
Internet Protocol Version 4, Src: 192.168.1.101 (192.168.1.101), Dst: 88.149.128.12 (88.149.128.12)
User Datagram Protocol, Src Port: 19828 (19828), Dst Port: domain (53)
Domain Name System (query)

No.     Time        Source                Destination           Protocol Length Info
      2 0.073403    192.168.1.101         88.149.128.12         DNS      87     Standard query 0x2981  A oauth.googleusercontent.com

Frame 2: 87 bytes on wire (696 bits), 87 bytes captured (696 bits)
Ethernet II, Src: aa:aa:03:00:00:00 (aa:aa:03:00:00:00), Dst: 1b:24:63:41:00:51 (1b:24:63:41:00:51)
Internet Protocol Version 4, Src: 192.168.1.101 (192.168.1.101), Dst: 88.149.128.12 (88.149.128.12)
User Datagram Protocol, Src Port: 11701 (11701), Dst Port: domain (53)
Domain Name System (query)

No.     Time        Source                Destination           Protocol Length Info
      3 0.082961    192.168.1.101         173.194.116.15        TCP      74     51813 > https [SYN] Seq=0 Win=5840 Len=0 MSS=1460 SACK_PERM=1 TSval=122425 TSecr=0 WS=8

Frame 3: 74 bytes on wire (592 bits), 74 bytes captured (592 bits)
Ethernet II, Src: aa:aa:03:00:00:00 (aa:aa:03:00:00:00), Dst: 1b:24:63:41:00:44 (1b:24:63:41:00:44)
Internet Protocol Version 4, Src: 192.168.1.101 (192.168.1.101), Dst: 173.194.116.15 (173.194.116.15)
Transmission Control Protocol, Src Port: 51813 (51813), Dst Port: https (443), Seq: 0, Len: 0

No.     Time        Source                Destination           Protocol Length Info
      4 0.095341    88.149.128.12         192.168.1.101         DNS      159    Standard query response 0x494e  CNAME static-doubleclick-net.l.google.com A 173.194.116.27 A 173.194.116.28

Frame 4: 159 bytes on wire (1272 bits), 159 bytes captured (1272 bits)
Ethernet II, Src: FonTechn_a5:e9:80 (00:18:84:a5:e9:80), Dst: SamsungE_24:63:41 (cc:05:1b:24:63:41)
Internet Protocol Version 4, Src: 88.149.128.12 (88.149.128.12), Dst: 192.168.1.101 (192.168.1.101)
User Datagram Protocol, Src Port: domain (53), Dst Port: 19828 (19828)
Domain Name System (response)

No.     Time        Source                Destination           Protocol Length Info
      5 0.096666    192.168.1.101         173.194.116.27        TCP      74     56021 > https [SYN] Seq=0 Win=5840 Len=0 MSS=1460 SACK_PERM=1 TSval=122426 TSecr=0 WS=8

Frame 5: 74 bytes on wire (592 bits), 74 bytes captured (592 bits)
Ethernet II, Src: aa:aa:03:00:00:00 (aa:aa:03:00:00:00), Dst: 1b:24:63:41:00:44 (1b:24:63:41:00:44)
Internet Protocol Version 4, Src: 192.168.1.101 (192.168.1.101), Dst: 173.194.116.27 (173.194.116.27)
Transmission Control Protocol, Src Port: 56021 (56021), Dst Port: https (443), Seq: 0, Len: 0

No.     Time        Source                Destination           Protocol Length Info
      6 0.135761    173.194.116.15        192.168.1.101         TCP      74     https > 51813 [SYN, ACK] Seq=0 Ack=1 Win=42540 Len=0 MSS=1430 SACK_PERM=1 TSval=964404191 TSecr=122425 WS=64

Frame 6: 74 bytes on wire (592 bits), 74 bytes captured (592 bits)
Ethernet II, Src: FonTechn_a5:e9:80 (00:18:84:a5:e9:80), Dst: SamsungE_24:63:41 (cc:05:1b:24:63:41)
Internet Protocol Version 4, Src: 173.194.116.15 (173.194.116.15), Dst: 192.168.1.101 (192.168.1.101)
Transmission Control Protocol, Src Port: https (443), Dst Port: 51813 (51813), Seq: 0, Ack: 1, Len: 0

No.     Time        Source                Destination           Protocol Length Info
      7 0.136010    192.168.1.101         173.194.116.15        TCP      66     51813 > https [ACK] Seq=1 Ack=1 Win=5840 Len=0 TSval=122430 TSecr=964404191

Frame 7: 66 bytes on wire (528 bits), 66 bytes captured (528 bits)
Ethernet II, Src: aa:aa:03:00:00:00 (aa:aa:03:00:00:00), Dst: 1b:24:63:41:00:3c (1b:24:63:41:00:3c)
Internet Protocol Version 4, Src: 192.168.1.101 (192.168.1.101), Dst: 173.194.116.15 (173.194.116.15)
Transmission Control Protocol, Src Port: 51813 (51813), Dst Port: https (443), Seq: 1, Ack: 1, Len: 0

No.     Time        Source                Destination           Protocol Length Info
      8 0.136488    173.194.116.27        192.168.1.101         TCP      74     https > 56021 [SYN, ACK] Seq=0 Ack=1 Win=42540 Len=0 MSS=1430 SACK_PERM=1 TSval=964405228 TSecr=122426 WS=64

Frame 8: 74 bytes on wire (592 bits), 74 bytes captured (592 bits)
Ethernet II, Src: FonTechn_a5:e9:80 (00:18:84:a5:e9:80), Dst: SamsungE_24:63:41 (cc:05:1b:24:63:41)
Internet Protocol Version 4, Src: 173.194.116.27 (173.194.116.27), Dst: 192.168.1.101 (192.168.1.101)
Transmission Control Protocol, Src Port: https (443), Dst Port: 56021 (56021), Seq: 0, Ack: 1, Len: 0

No.     Time        Source                Destination           Protocol Length Info
      9 0.136646    192.168.1.101         173.194.116.27        TCP      66     56021 > https [ACK] Seq=1 Ack=1 Win=5840 Len=0 TSval=122430 TSecr=964405228

Frame 9: 66 bytes on wire (528 bits), 66 bytes captured (528 bits)
Ethernet II, Src: aa:aa:03:00:00:00 (aa:aa:03:00:00:00), Dst: 1b:24:63:41:00:3c (1b:24:63:41:00:3c)
Internet Protocol Version 4, Src: 192.168.1.101 (192.168.1.101), Dst: 173.194.116.27 (173.194.116.27)
Transmission Control Protocol, Src Port: 56021 (56021), Dst Port: https (443), Seq: 1, Ack: 1, Len: 0

No.     Time        Source                Destination           Protocol Length Info
     10 0.140190    88.149.128.12         192.168.1.101         DNS      164    Standard query response 0x2981  CNAME googlehosted.l.googleusercontent.com A 74.125.232.140 A 74.125.232.138 A 74.125.232.139

Frame 10: 164 bytes on wire (1312 bits), 164 bytes captured (1312 bits)
Ethernet II, Src: FonTechn_a5:e9:80 (00:18:84:a5:e9:80), Dst: SamsungE_24:63:41 (cc:05:1b:24:63:41)
Internet Protocol Version 4, Src: 88.149.128.12 (88.149.128.12), Dst: 192.168.1.101 (192.168.1.101)
User Datagram Protocol, Src Port: domain (53), Dst Port: 11701 (11701)
Domain Name System (response)

No.     Time        Source                Destination           Protocol Length Info
     11 0.141491    192.168.1.101         74.125.232.140        TCP      74     44439 > https [SYN] Seq=0 Win=5840 Len=0 MSS=1460 SACK_PERM=1 TSval=122430 TSecr=0 WS=8

Frame 11: 74 bytes on wire (592 bits), 74 bytes captured (592 bits)
Ethernet II, Src: aa:aa:03:00:00:00 (aa:aa:03:00:00:00), Dst: 1b:24:63:41:00:44 (1b:24:63:41:00:44)
Internet Protocol Version 4, Src: 192.168.1.101 (192.168.1.101), Dst: 74.125.232.140 (74.125.232.140)
Transmission Control Protocol, Src Port: 44439 (44439), Dst Port: https (443), Seq: 0, Len: 0

No.     Time        Source                Destination           Protocol Length Info
     12 0.144483    192.168.1.101         173.194.116.15        TLSv1    178    Client Hello

Frame 12: 178 bytes on wire (1424 bits), 178 bytes captured (1424 bits)
Ethernet II, Src: aa:aa:03:00:00:00 (aa:aa:03:00:00:00), Dst: 1b:24:63:41:00:ac (1b:24:63:41:00:ac)
Internet Protocol Version 4, Src: 192.168.1.101 (192.168.1.101), Dst: 173.194.116.15 (173.194.116.15)
Transmission Control Protocol, Src Port: 51813 (51813), Dst Port: https (443), Seq: 1, Ack: 1, Len: 112
Secure Sockets Layer

No.     Time        Source                Destination           Protocol Length Info
     13 0.146548    192.168.1.101         173.194.116.27        TLSv1    146    Client Hello

Frame 13: 146 bytes on wire (1168 bits), 146 bytes captured (1168 bits)
Ethernet II, Src: aa:aa:03:00:00:00 (aa:aa:03:00:00:00), Dst: 1b:24:63:41:00:8c (1b:24:63:41:00:8c)
Internet Protocol Version 4, Src: 192.168.1.101 (192.168.1.101), Dst: 173.194.116.27 (173.194.116.27)
Transmission Control Protocol, Src Port: 56021 (56021), Dst Port: https (443), Seq: 1, Ack: 1, Len: 80
Secure Sockets Layer

No.     Time        Source                Destination           Protocol Length Info
     14 0.178245    192.168.1.101         88.149.128.12         DNS      75     Standard query 0x8009  A www.gstatic.com

Frame 14: 75 bytes on wire (600 bits), 75 bytes captured (600 bits)
Ethernet II, Src: aa:aa:03:00:00:00 (aa:aa:03:00:00:00), Dst: 1b:24:63:41:00:45 (1b:24:63:41:00:45)
Internet Protocol Version 4, Src: 192.168.1.101 (192.168.1.101), Dst: 88.149.128.12 (88.149.128.12)
User Datagram Protocol, Src Port: 33854 (33854), Dst Port: domain (53)
Domain Name System (query)

No.     Time        Source                Destination           Protocol Length Info
     15 0.203346    192.168.1.101         88.149.128.12         DNS      82     Standard query 0x2615  A static.ak.facebook.com

Frame 15: 82 bytes on wire (656 bits), 82 bytes captured (656 bits)
Ethernet II, Src: aa:aa:03:00:00:00 (aa:aa:03:00:00:00), Dst: 1b:24:63:41:00:4c (1b:24:63:41:00:4c)
Internet Protocol Version 4, Src: 192.168.1.101 (192.168.1.101), Dst: 88.149.128.12 (88.149.128.12)
User Datagram Protocol, Src Port: 10831 (10831), Dst Port: domain (53)
Domain Name System (query)

No.     Time        Source                Destination           Protocol Length Info
     16 0.210708    74.125.232.140        192.168.1.101         TCP      74     https > 44439 [SYN, ACK] Seq=0 Ack=1 Win=42540 Len=0 MSS=1430 SACK_PERM=1 TSval=4137289389 TSecr=122430 WS=64

Frame 16: 74 bytes on wire (592 bits), 74 bytes captured (592 bits)
Ethernet II, Src: FonTechn_a5:e9:80 (00:18:84:a5:e9:80), Dst: SamsungE_24:63:41 (cc:05:1b:24:63:41)
Internet Protocol Version 4, Src: 74.125.232.140 (74.125.232.140), Dst: 192.168.1.101 (192.168.1.101)
Transmission Control Protocol, Src Port: https (443), Dst Port: 44439 (44439), Seq: 0, Ack: 1, Len: 0

No.     Time        Source                Destination           Protocol Length Info
     17 0.210988    192.168.1.101         74.125.232.140        TCP      66     44439 > https [ACK] Seq=1 Ack=1 Win=5840 Len=0 TSval=122437 TSecr=4137289389

Frame 17: 66 bytes on wire (528 bits), 66 bytes captured (528 bits)
Ethernet II, Src: aa:aa:03:00:00:00 (aa:aa:03:00:00:00), Dst: 1b:24:63:41:00:3c (1b:24:63:41:00:3c)
Internet Protocol Version 4, Src: 192.168.1.101 (192.168.1.101), Dst: 74.125.232.140 (74.125.232.140)
Transmission Control Protocol, Src Port: 44439 (44439), Dst Port: https (443), Seq: 1, Ack: 1, Len: 0

No.     Time        Source                Destination           Protocol Length Info
     18 0.214666    192.168.1.101         74.125.232.140        TLSv1    146    Client Hello

Frame 18: 146 bytes on wire (1168 bits), 146 bytes captured (1168 bits)
Ethernet II, Src: aa:aa:03:00:00:00 (aa:aa:03:00:00:00), Dst: 1b:24:63:41:00:8c (1b:24:63:41:00:8c)
Internet Protocol Version 4, Src: 192.168.1.101 (192.168.1.101), Dst: 74.125.232.140 (74.125.232.140)
Transmission Control Protocol, Src Port: 44439 (44439), Dst Port: https (443), Seq: 1, Ack: 1, Len: 80
Secure Sockets Layer

No.     Time        Source                Destination           Protocol Length Info
     19 0.215646    192.168.1.101         88.149.128.12         DNS      84     Standard query 0x163b  A s-static.ak.facebook.com

Frame 19: 84 bytes on wire (672 bits), 84 bytes captured (672 bits)
Ethernet II, Src: aa:aa:03:00:00:00 (aa:aa:03:00:00:00), Dst: 1b:24:63:41:00:4e (1b:24:63:41:00:4e)
Internet Protocol Version 4, Src: 192.168.1.101 (192.168.1.101), Dst: 88.149.128.12 (88.149.128.12)
User Datagram Protocol, Src Port: bmc-perf-agent (6767), Dst Port: domain (53)
Domain Name System (query)

No.     Time        Source                Destination           Protocol Length Info
     20 0.223178    192.168.1.101         88.149.128.12         DNS      76     Standard query 0xf099  A www.facebook.com

Frame 20: 76 bytes on wire (608 bits), 76 bytes captured (608 bits)
Ethernet II, Src: aa:aa:03:00:00:00 (aa:aa:03:00:00:00), Dst: 1b:24:63:41:00:46 (1b:24:63:41:00:46)
Internet Protocol Version 4, Src: 192.168.1.101 (192.168.1.101), Dst: 88.149.128.12 (88.149.128.12)
User Datagram Protocol, Src Port: 62669 (62669), Dst Port: domain (53)
Domain Name System (query)

No.     Time        Source                Destination           Protocol Length Info
     21 0.230720    173.194.116.15        192.168.1.101         TCP      66     https > 51813 [ACK] Seq=1 Ack=113 Win=42560 Len=0 TSval=964404286 TSecr=122431

Frame 21: 66 bytes on wire (528 bits), 66 bytes captured (528 bits)
Ethernet II, Src: FonTechn_a5:e9:80 (00:18:84:a5:e9:80), Dst: SamsungE_24:63:41 (cc:05:1b:24:63:41)
Internet Protocol Version 4, Src: 173.194.116.15 (173.194.116.15), Dst: 192.168.1.101 (192.168.1.101)
Transmission Control Protocol, Src Port: https (443), Dst Port: 51813 (51813), Seq: 1, Ack: 113, Len: 0

No.     Time        Source                Destination           Protocol Length Info
     22 0.231275    173.194.116.27        192.168.1.101         TCP      66     https > 56021 [ACK] Seq=1 Ack=81 Win=42560 Len=0 TSval=964405323 TSecr=122431

Frame 22: 66 bytes on wire (528 bits), 66 bytes captured (528 bits)
Ethernet II, Src: FonTechn_a5:e9:80 (00:18:84:a5:e9:80), Dst: SamsungE_24:63:41 (cc:05:1b:24:63:41)
Internet Protocol Version 4, Src: 173.194.116.27 (173.194.116.27), Dst: 192.168.1.101 (192.168.1.101)
Transmission Control Protocol, Src Port: https (443), Dst Port: 56021 (56021), Seq: 1, Ack: 81, Len: 0

No.     Time        Source                Destination           Protocol Length Info
     23 0.231993    88.149.128.12         192.168.1.101         DNS      91     Standard query response 0x8009  A 74.125.232.143

Frame 23: 91 bytes on wire (728 bits), 91 bytes captured (728 bits)
Ethernet II, Src: FonTechn_a5:e9:80 (00:18:84:a5:e9:80), Dst: SamsungE_24:63:41 (cc:05:1b:24:63:41)
Internet Protocol Version 4, Src: 88.149.128.12 (88.149.128.12), Dst: 192.168.1.101 (192.168.1.101)
User Datagram Protocol, Src Port: domain (53), Dst Port: 33854 (33854)
Domain Name System (response)

No.     Time        Source                Destination           Protocol Length Info
     24 0.232571    173.194.116.15        192.168.1.101         TLSv1    199    Server Hello, Change Cipher Spec, Encrypted Handshake Message

Frame 24: 199 bytes on wire (1592 bits), 199 bytes captured (1592 bits)
Ethernet II, Src: FonTechn_a5:e9:80 (00:18:84:a5:e9:80), Dst: SamsungE_24:63:41 (cc:05:1b:24:63:41)
Internet Protocol Version 4, Src: 173.194.116.15 (173.194.116.15), Dst: 192.168.1.101 (192.168.1.101)
Transmission Control Protocol, Src Port: https (443), Dst Port: 51813 (51813), Seq: 1, Ack: 113, Len: 133
Secure Sockets Layer

No.     Time        Source                Destination           Protocol Length Info
     25 0.232706    192.168.1.101         173.194.116.15        TCP      66     51813 > https [ACK] Seq=113 Ack=134 Win=6912 Len=0 TSval=122440 TSecr=964404286

Frame 25: 66 bytes on wire (528 bits), 66 bytes captured (528 bits)
Ethernet II, Src: aa:aa:03:00:00:00 (aa:aa:03:00:00:00), Dst: 1b:24:63:41:00:3c (1b:24:63:41:00:3c)
Internet Protocol Version 4, Src: 192.168.1.101 (192.168.1.101), Dst: 173.194.116.15 (173.194.116.15)
Transmission Control Protocol, Src Port: 51813 (51813), Dst Port: https (443), Seq: 113, Ack: 134, Len: 0

No.     Time        Source                Destination           Protocol Length Info
     26 0.234516    192.168.1.101         173.194.116.15        TLSv1    113    Change Cipher Spec, Encrypted Handshake Message

Frame 26: 113 bytes on wire (904 bits), 113 bytes captured (904 bits)
Ethernet II, Src: aa:aa:03:00:00:00 (aa:aa:03:00:00:00), Dst: 1b:24:63:41:00:6b (1b:24:63:41:00:6b)
Internet Protocol Version 4, Src: 192.168.1.101 (192.168.1.101), Dst: 173.194.116.15 (173.194.116.15)
Transmission Control Protocol, Src Port: 51813 (51813), Dst Port: https (443), Seq: 113, Ack: 134, Len: 47
Secure Sockets Layer

No.     Time        Source                Destination           Protocol Length Info
     27 0.235236    173.194.116.27        192.168.1.101         TLSv1    1484   Server Hello

Frame 27: 1484 bytes on wire (11872 bits), 1484 bytes captured (11872 bits)
Ethernet II, Src: FonTechn_a5:e9:80 (00:18:84:a5:e9:80), Dst: SamsungE_24:63:41 (cc:05:1b:24:63:41)
Internet Protocol Version 4, Src: 173.194.116.27 (173.194.116.27), Dst: 192.168.1.101 (192.168.1.101)
Transmission Control Protocol, Src Port: https (443), Dst Port: 56021 (56021), Seq: 1, Ack: 81, Len: 1418
Secure Sockets Layer

No.     Time        Source                Destination           Protocol Length Info
     28 0.235366    192.168.1.101         173.194.116.27        TCP      66     56021 > https [ACK] Seq=81 Ack=1419 Win=8736 Len=0 TSval=122440 TSecr=964405323

Frame 28: 66 bytes on wire (528 bits), 66 bytes captured (528 bits)
Ethernet II, Src: aa:aa:03:00:00:00 (aa:aa:03:00:00:00), Dst: 1b:24:63:41:00:3c (1b:24:63:41:00:3c)
Internet Protocol Version 4, Src: 192.168.1.101 (192.168.1.101), Dst: 173.194.116.27 (173.194.116.27)
Transmission Control Protocol, Src Port: 56021 (56021), Dst Port: https (443), Seq: 81, Ack: 1419, Len: 0

No.     Time        Source                Destination           Protocol Length Info
     29 0.236513    173.194.116.27        192.168.1.101         TCP      1484   [TCP segment of a reassembled PDU]

Frame 29: 1484 bytes on wire (11872 bits), 1484 bytes captured (11872 bits)
Ethernet II, Src: FonTechn_a5:e9:80 (00:18:84:a5:e9:80), Dst: SamsungE_24:63:41 (cc:05:1b:24:63:41)
Internet Protocol Version 4, Src: 173.194.116.27 (173.194.116.27), Dst: 192.168.1.101 (192.168.1.101)
Transmission Control Protocol, Src Port: https (443), Dst Port: 56021 (56021), Seq: 1419, Ack: 81, Len: 1418

No.     Time        Source                Destination           Protocol Length Info
     30 0.236661    192.168.1.101         173.194.116.27        TCP      66     56021 > https [ACK] Seq=81 Ack=2837 Win=11632 Len=0 TSval=122440 TSecr=964405323

Frame 30: 66 bytes on wire (528 bits), 66 bytes captured (528 bits)
Ethernet II, Src: aa:aa:03:00:00:00 (aa:aa:03:00:00:00), Dst: 1b:24:63:41:00:3c (1b:24:63:41:00:3c)
Internet Protocol Version 4, Src: 192.168.1.101 (192.168.1.101), Dst: 173.194.116.27 (173.194.116.27)
Transmission Control Protocol, Src Port: 56021 (56021), Dst Port: https (443), Seq: 81, Ack: 2837, Len: 0

No.     Time        Source                Destination           Protocol Length Info
     31 0.237938    192.168.1.101         74.125.232.143        TCP      74     46374 > http [SYN] Seq=0 Win=5840 Len=0 MSS=1460 SACK_PERM=1 TSval=122440 TSecr=0 WS=8

Frame 31: 74 bytes on wire (592 bits), 74 bytes captured (592 bits)
Ethernet II, Src: aa:aa:03:00:00:00 (aa:aa:03:00:00:00), Dst: 1b:24:63:41:00:44 (1b:24:63:41:00:44)
Internet Protocol Version 4, Src: 192.168.1.101 (192.168.1.101), Dst: 74.125.232.143 (74.125.232.143)
Transmission Control Protocol, Src Port: 46374 (46374), Dst Port: http (80), Seq: 0, Len: 0

No.     Time        Source                Destination           Protocol Length Info
     32 0.238418    173.194.116.27        192.168.1.101         TLSv1    647    Certificate, Server Hello Done

Frame 32: 647 bytes on wire (5176 bits), 647 bytes captured (5176 bits)
Ethernet II, Src: FonTechn_a5:e9:80 (00:18:84:a5:e9:80), Dst: SamsungE_24:63:41 (cc:05:1b:24:63:41)
Internet Protocol Version 4, Src: 173.194.116.27 (173.194.116.27), Dst: 192.168.1.101 (192.168.1.101)
Transmission Control Protocol, Src Port: https (443), Dst Port: 56021 (56021), Seq: 2837, Ack: 81, Len: 581
[3 Reassembled TCP Segments (3331 bytes): #27(1332), #29(1418), #32(581)]
Secure Sockets Layer

No.     Time        Source                Destination           Protocol Length Info
     33 0.238543    192.168.1.101         173.194.116.27        TCP      66     56021 > https [ACK] Seq=81 Ack=3418 Win=14472 Len=0 TSval=122440 TSecr=964405323

Frame 33: 66 bytes on wire (528 bits), 66 bytes captured (528 bits)
Ethernet II, Src: aa:aa:03:00:00:00 (aa:aa:03:00:00:00), Dst: 1b:24:63:41:00:3c (1b:24:63:41:00:3c)
Internet Protocol Version 4, Src: 192.168.1.101 (192.168.1.101), Dst: 173.194.116.27 (173.194.116.27)
Transmission Control Protocol, Src Port: 56021 (56021), Dst Port: https (443), Seq: 81, Ack: 3418, Len: 0

No.     Time        Source                Destination           Protocol Length Info
     34 0.285730    88.149.128.12         192.168.1.101         DNS      195    Standard query response 0x2615  CNAME static.ak.facebook.com.edgesuite.net CNAME a749.dsw4.akamai.net A 88.149.196.144 A 88.149.196.147

Frame 34: 195 bytes on wire (1560 bits), 195 bytes captured (1560 bits)
Ethernet II, Src: FonTechn_a5:e9:80 (00:18:84:a5:e9:80), Dst: SamsungE_24:63:41 (cc:05:1b:24:63:41)
Internet Protocol Version 4, Src: 88.149.128.12 (88.149.128.12), Dst: 192.168.1.101 (192.168.1.101)
User Datagram Protocol, Src Port: domain (53), Dst Port: 10831 (10831)
Domain Name System (response)

No.     Time        Source                Destination           Protocol Length Info
     35 0.286175    74.125.232.140        192.168.1.101         TCP      66     https > 44439 [ACK] Seq=1 Ack=81 Win=42496 Len=0 TSval=4137289459 TSecr=122438

Frame 35: 66 bytes on wire (528 bits), 66 bytes captured (528 bits)
Ethernet II, Src: FonTechn_a5:e9:80 (00:18:84:a5:e9:80), Dst: SamsungE_24:63:41 (cc:05:1b:24:63:41)
Internet Protocol Version 4, Src: 74.125.232.140 (74.125.232.140), Dst: 192.168.1.101 (192.168.1.101)
Transmission Control Protocol, Src Port: https (443), Dst Port: 44439 (44439), Seq: 1, Ack: 81, Len: 0

No.     Time        Source                Destination           Protocol Length Info
     36 0.287081    88.149.128.12         192.168.1.101         DNS      183    Standard query response 0xf099  CNAME star.c10r.facebook.com A 31.13.86.33

Frame 36: 183 bytes on wire (1464 bits), 183 bytes captured (1464 bits)
Ethernet II, Src: FonTechn_a5:e9:80 (00:18:84:a5:e9:80), Dst: SamsungE_24:63:41 (cc:05:1b:24:63:41)
Internet Protocol Version 4, Src: 88.149.128.12 (88.149.128.12), Dst: 192.168.1.101 (192.168.1.101)
User Datagram Protocol, Src Port: domain (53), Dst Port: 62669 (62669)
Domain Name System (response)

No.     Time        Source                Destination           Protocol Length Info
     37 0.287671    88.149.128.12         192.168.1.101         DNS      186    Standard query response 0x163b  CNAME s-static.ak.facebook.com.edgekey.net CNAME e566.dspe1.akamaiedge.net A 23.33.1.105

Frame 37: 186 bytes on wire (1488 bits), 186 bytes captured (1488 bits)
Ethernet II, Src: FonTechn_a5:e9:80 (00:18:84:a5:e9:80), Dst: SamsungE_24:63:41 (cc:05:1b:24:63:41)
Internet Protocol Version 4, Src: 88.149.128.12 (88.149.128.12), Dst: 192.168.1.101 (192.168.1.101)
User Datagram Protocol, Src Port: domain (53), Dst Port: bmc-perf-agent (6767)
Domain Name System (response)

No.     Time        Source                Destination           Protocol Length Info
     38 0.288603    192.168.1.101         31.13.86.33           TCP      74     46410 > https [SYN] Seq=0 Win=5840 Len=0 MSS=1460 SACK_PERM=1 TSval=122445 TSecr=0 WS=8

Frame 38: 74 bytes on wire (592 bits), 74 bytes captured (592 bits)
Ethernet II, Src: aa:aa:03:00:00:00 (aa:aa:03:00:00:00), Dst: 1b:24:63:41:00:44 (1b:24:63:41:00:44)
Internet Protocol Version 4, Src: 192.168.1.101 (192.168.1.101), Dst: 31.13.86.33 (31.13.86.33)
Transmission Control Protocol, Src Port: 46410 (46410), Dst Port: https (443), Seq: 0, Len: 0

No.     Time        Source                Destination           Protocol Length Info
     39 0.289700    74.125.232.140        192.168.1.101         TLSv1    1484   Server Hello

Frame 39: 1484 bytes on wire (11872 bits), 1484 bytes captured (11872 bits)
Ethernet II, Src: FonTechn_a5:e9:80 (00:18:84:a5:e9:80), Dst: SamsungE_24:63:41 (cc:05:1b:24:63:41)
Internet Protocol Version 4, Src: 74.125.232.140 (74.125.232.140), Dst: 192.168.1.101 (192.168.1.101)
Transmission Control Protocol, Src Port: https (443), Dst Port: 44439 (44439), Seq: 1, Ack: 81, Len: 1418
Secure Sockets Layer

No.     Time        Source                Destination           Protocol Length Info
     40 0.289890    192.168.1.101         74.125.232.140        TCP      66     44439 > https [ACK] Seq=81 Ack=1419 Win=8736 Len=0 TSval=122445 TSecr=4137289459

Frame 40: 66 bytes on wire (528 bits), 66 bytes captured (528 bits)
Ethernet II, Src: aa:aa:03:00:00:00 (aa:aa:03:00:00:00), Dst: 1b:24:63:41:00:3c (1b:24:63:41:00:3c)
Internet Protocol Version 4, Src: 192.168.1.101 (192.168.1.101), Dst: 74.125.232.140 (74.125.232.140)
Transmission Control Protocol, Src Port: 44439 (44439), Dst Port: https (443), Seq: 81, Ack: 1419, Len: 0

No.     Time        Source                Destination           Protocol Length Info
     41 0.290861    74.125.232.140        192.168.1.101         TCP      1484   [TCP segment of a reassembled PDU]

Frame 41: 1484 bytes on wire (11872 bits), 1484 bytes captured (11872 bits)
Ethernet II, Src: FonTechn_a5:e9:80 (00:18:84:a5:e9:80), Dst: SamsungE_24:63:41 (cc:05:1b:24:63:41)
Internet Protocol Version 4, Src: 74.125.232.140 (74.125.232.140), Dst: 192.168.1.101 (192.168.1.101)
Transmission Control Protocol, Src Port: https (443), Dst Port: 44439 (44439), Seq: 1419, Ack: 81, Len: 1418

No.     Time        Source                Destination           Protocol Length Info
     42 0.291001    192.168.1.101         74.125.232.140        TCP      66     44439 > https [ACK] Seq=81 Ack=2837 Win=11632 Len=0 TSval=122445 TSecr=4137289459

Frame 42: 66 bytes on wire (528 bits), 66 bytes captured (528 bits)
Ethernet II, Src: aa:aa:03:00:00:00 (aa:aa:03:00:00:00), Dst: 1b:24:63:41:00:3c (1b:24:63:41:00:3c)
Internet Protocol Version 4, Src: 192.168.1.101 (192.168.1.101), Dst: 74.125.232.140 (74.125.232.140)
Transmission Control Protocol, Src Port: 44439 (44439), Dst Port: https (443), Seq: 81, Ack: 2837, Len: 0

No.     Time        Source                Destination           Protocol Length Info
     43 0.292031    74.125.232.140        192.168.1.101         TLSv1    842    Certificate, Server Hello Done

Frame 43: 842 bytes on wire (6736 bits), 842 bytes captured (6736 bits)
Ethernet II, Src: FonTechn_a5:e9:80 (00:18:84:a5:e9:80), Dst: SamsungE_24:63:41 (cc:05:1b:24:63:41)
Internet Protocol Version 4, Src: 74.125.232.140 (74.125.232.140), Dst: 192.168.1.101 (192.168.1.101)
Transmission Control Protocol, Src Port: https (443), Dst Port: 44439 (44439), Seq: 2837, Ack: 81, Len: 776
[4 Reassembled TCP Segments (3526 bytes): #39(1332), #41(1418), #43(776), #55(776)]
Secure Sockets Layer

No.     Time        Source                Destination           Protocol Length Info
     44 0.292156    192.168.1.101         74.125.232.140        TCP      66     44439 > https [ACK] Seq=81 Ack=3613 Win=14472 Len=0 TSval=122446 TSecr=4137289459

Frame 44: 66 bytes on wire (528 bits), 66 bytes captured (528 bits)
Ethernet II, Src: aa:aa:03:00:00:00 (aa:aa:03:00:00:00), Dst: 1b:24:63:41:00:3c (1b:24:63:41:00:3c)
Internet Protocol Version 4, Src: 192.168.1.101 (192.168.1.101), Dst: 74.125.232.140 (74.125.232.140)
Transmission Control Protocol, Src Port: 44439 (44439), Dst Port: https (443), Seq: 81, Ack: 3613, Len: 0

No.     Time        Source                Destination           Protocol Length Info
     45 0.300366    74.125.232.143        192.168.1.101         TCP      74     http > 46374 [SYN, ACK] Seq=0 Ack=1 Win=42540 Len=0 MSS=1430 SACK_PERM=1 TSval=4137290451 TSecr=122440 WS=64

Frame 45: 74 bytes on wire (592 bits), 74 bytes captured (592 bits)
Ethernet II, Src: FonTechn_a5:e9:80 (00:18:84:a5:e9:80), Dst: SamsungE_24:63:41 (cc:05:1b:24:63:41)
Internet Protocol Version 4, Src: 74.125.232.143 (74.125.232.143), Dst: 192.168.1.101 (192.168.1.101)
Transmission Control Protocol, Src Port: http (80), Dst Port: 46374 (46374), Seq: 0, Ack: 1, Len: 0

No.     Time        Source                Destination           Protocol Length Info
     46 0.300573    192.168.1.101         74.125.232.143        TCP      66     46374 > http [ACK] Seq=1 Ack=1 Win=5840 Len=0 TSval=122446 TSecr=4137290451

Frame 46: 66 bytes on wire (528 bits), 66 bytes captured (528 bits)
Ethernet II, Src: aa:aa:03:00:00:00 (aa:aa:03:00:00:00), Dst: 1b:24:63:41:00:3c (1b:24:63:41:00:3c)
Internet Protocol Version 4, Src: 192.168.1.101 (192.168.1.101), Dst: 74.125.232.143 (74.125.232.143)
Transmission Control Protocol, Src Port: 46374 (46374), Dst Port: http (80), Seq: 1, Ack: 1, Len: 0

No.     Time        Source                Destination           Protocol Length Info
     47 0.302565    192.168.1.101         88.149.196.144        TCP      74     33597 > http [SYN] Seq=0 Win=5840 Len=0 MSS=1460 SACK_PERM=1 TSval=122447 TSecr=0 WS=8

Frame 47: 74 bytes on wire (592 bits), 74 bytes captured (592 bits)
Ethernet II, Src: aa:aa:03:00:00:00 (aa:aa:03:00:00:00), Dst: 1b:24:63:41:00:44 (1b:24:63:41:00:44)
Internet Protocol Version 4, Src: 192.168.1.101 (192.168.1.101), Dst: 88.149.196.144 (88.149.196.144)
Transmission Control Protocol, Src Port: 33597 (33597), Dst Port: http (80), Seq: 0, Len: 0

No.     Time        Source                Destination           Protocol Length Info
     48 0.303086    192.168.1.101         23.33.1.105           TCP      74     58860 > https [SYN] Seq=0 Win=5840 Len=0 MSS=1460 SACK_PERM=1 TSval=122447 TSecr=0 WS=8

Frame 48: 74 bytes on wire (592 bits), 74 bytes captured (592 bits)
Ethernet II, Src: aa:aa:03:00:00:00 (aa:aa:03:00:00:00), Dst: 1b:24:63:41:00:44 (1b:24:63:41:00:44)
Internet Protocol Version 4, Src: 192.168.1.101 (192.168.1.101), Dst: 23.33.1.105 (23.33.1.105)
Transmission Control Protocol, Src Port: 58860 (58860), Dst Port: https (443), Seq: 0, Len: 0

No.     Time        Source                Destination           Protocol Length Info
     49 0.305150    192.168.1.101         74.125.232.143        HTTP     520    GET /bg/p9NP-eAlPFnIwCXQTIVv825QGiGzgBLP56m5NwS9QPk.js HTTP/1.1 

Frame 49: 520 bytes on wire (4160 bits), 520 bytes captured (4160 bits)
Ethernet II, Src: aa:aa:03:00:00:00 (aa:aa:03:00:00:00), Dst: 1b:24:63:41:02:02 (1b:24:63:41:02:02)
Internet Protocol Version 4, Src: 192.168.1.101 (192.168.1.101), Dst: 74.125.232.143 (74.125.232.143)
Transmission Control Protocol, Src Port: 46374 (46374), Dst Port: http (80), Seq: 1, Ack: 1, Len: 454
Hypertext Transfer Protocol

No.     Time        Source                Destination           Protocol Length Info
     50 0.320570    173.194.116.15        192.168.1.101         TCP      66     https > 51813 [ACK] Seq=134 Ack=160 Win=42560 Len=0 TSval=964404377 TSecr=122440

Frame 50: 66 bytes on wire (528 bits), 66 bytes captured (528 bits)
Ethernet II, Src: FonTechn_a5:e9:80 (00:18:84:a5:e9:80), Dst: SamsungE_24:63:41 (cc:05:1b:24:63:41)
Internet Protocol Version 4, Src: 173.194.116.15 (173.194.116.15), Dst: 192.168.1.101 (192.168.1.101)
Transmission Control Protocol, Src Port: https (443), Dst Port: 51813 (51813), Seq: 134, Ack: 160, Len: 0

No.     Time        Source                Destination           Protocol Length Info
     51 0.332278    192.168.1.101         173.194.116.27        TLSv1    380    Client Key Exchange, Change Cipher Spec, Encrypted Handshake Message

Frame 51: 380 bytes on wire (3040 bits), 380 bytes captured (3040 bits)
Ethernet II, Src: aa:aa:03:00:00:00 (aa:aa:03:00:00:00), Dst: 1b:24:63:41:01:76 (1b:24:63:41:01:76)
Internet Protocol Version 4, Src: 192.168.1.101 (192.168.1.101), Dst: 173.194.116.27 (173.194.116.27)
Transmission Control Protocol, Src Port: 56021 (56021), Dst Port: https (443), Seq: 81, Ack: 3418, Len: 314
Secure Sockets Layer

No.     Time        Source                Destination           Protocol Length Info
     52 0.360045    192.168.1.103         192.168.1.255         NBNS     92     Name query NB ISATAP<00>

Frame 52: 92 bytes on wire (736 bits), 92 bytes captured (736 bits)
Ethernet II, Src: HonHaiPr_aa:03:be (c4:17:fe:aa:03:be), Dst: Broadcast (ff:ff:ff:ff:ff:ff)
Internet Protocol Version 4, Src: 192.168.1.103 (192.168.1.103), Dst: 192.168.1.255 (192.168.1.255)
User Datagram Protocol, Src Port: netbios-ns (137), Dst Port: netbios-ns (137)
NetBIOS Name Service

No.     Time        Source                Destination           Protocol Length Info
     53 0.381265    192.168.1.101         74.125.232.140        TLSv1    380    Client Key Exchange, Change Cipher Spec, Encrypted Handshake Message

Frame 53: 380 bytes on wire (3040 bits), 380 bytes captured (3040 bits)
Ethernet II, Src: aa:aa:03:00:00:00 (aa:aa:03:00:00:00), Dst: 1b:24:63:41:01:76 (1b:24:63:41:01:76)
Internet Protocol Version 4, Src: 192.168.1.101 (192.168.1.101), Dst: 74.125.232.140 (74.125.232.140)
Transmission Control Protocol, Src Port: 44439 (44439), Dst Port: https (443), Seq: 81, Ack: 3613, Len: 314
Secure Sockets Layer

No.     Time        Source                Destination           Protocol Length Info
     54 0.409160    192.168.1.101         173.194.116.15        TLSv1    635    Application Data

Frame 54: 635 bytes on wire (5080 bits), 635 bytes captured (5080 bits)
Ethernet II, Src: aa:aa:03:00:00:00 (aa:aa:03:00:00:00), Dst: 1b:24:63:41:02:75 (1b:24:63:41:02:75)
Internet Protocol Version 4, Src: 192.168.1.101 (192.168.1.101), Dst: 173.194.116.15 (173.194.116.15)
Transmission Control Protocol, Src Port: 51813 (51813), Dst Port: https (443), Seq: 160, Ack: 134, Len: 569
Secure Sockets Layer

No.     Time        Source                Destination           Protocol Length Info
     55 0.421651    74.125.232.140        192.168.1.101         TCP      842    [TCP Retransmission] [TCP segment of a reassembled PDU]

Frame 55: 842 bytes on wire (6736 bits), 842 bytes captured (6736 bits)
Ethernet II, Src: FonTechn_a5:e9:80 (00:18:84:a5:e9:80), Dst: SamsungE_24:63:41 (cc:05:1b:24:63:41)
Internet Protocol Version 4, Src: 74.125.232.140 (74.125.232.140), Dst: 192.168.1.101 (192.168.1.101)
Transmission Control Protocol, Src Port: https (443), Dst Port: 44439 (44439), Seq: 2837, Ack: 81, Len: 776

No.     Time        Source                Destination           Protocol Length Info
     56 0.421923    192.168.1.101         74.125.232.140        TCP      78     [TCP Dup ACK 53#1] 44439 > https [ACK] Seq=395 Ack=3613 Win=14472 Len=0 TSval=122459 TSecr=4137289459 SLE=2837 SRE=3613

Frame 56: 78 bytes on wire (624 bits), 78 bytes captured (624 bits)
Ethernet II, Src: aa:aa:03:00:00:00 (aa:aa:03:00:00:00), Dst: 1b:24:63:41:00:48 (1b:24:63:41:00:48)
Internet Protocol Version 4, Src: 192.168.1.101 (192.168.1.101), Dst: 74.125.232.140 (74.125.232.140)
Transmission Control Protocol, Src Port: 44439 (44439), Dst Port: https (443), Seq: 395, Ack: 3613, Len: 0

No.     Time        Source                Destination           Protocol Length Info
     57 0.425945    88.149.196.144        192.168.1.101         TCP      74     http > 33597 [SYN, ACK] Seq=0 Ack=1 Win=14480 Len=0 MSS=1452 SACK_PERM=1 TSval=945724629 TSecr=122447 WS=2

Frame 57: 74 bytes on wire (592 bits), 74 bytes captured (592 bits)
Ethernet II, Src: FonTechn_a5:e9:80 (00:18:84:a5:e9:80), Dst: SamsungE_24:63:41 (cc:05:1b:24:63:41)
Internet Protocol Version 4, Src: 88.149.196.144 (88.149.196.144), Dst: 192.168.1.101 (192.168.1.101)
Transmission Control Protocol, Src Port: http (80), Dst Port: 33597 (33597), Seq: 0, Ack: 1, Len: 0

No.     Time        Source                Destination           Protocol Length Info
     58 0.426185    192.168.1.101         88.149.196.144        TCP      66     33597 > http [ACK] Seq=1 Ack=1 Win=5840 Len=0 TSval=122459 TSecr=945724629

Frame 58: 66 bytes on wire (528 bits), 66 bytes captured (528 bits)
Ethernet II, Src: aa:aa:03:00:00:00 (aa:aa:03:00:00:00), Dst: 1b:24:63:41:00:3c (1b:24:63:41:00:3c)
Internet Protocol Version 4, Src: 192.168.1.101 (192.168.1.101), Dst: 88.149.196.144 (88.149.196.144)
Transmission Control Protocol, Src Port: 33597 (33597), Dst Port: http (80), Seq: 1, Ack: 1, Len: 0

No.     Time        Source                Destination           Protocol Length Info
     59 0.426763    31.13.86.33           192.168.1.101         TCP      74     https > 46410 [SYN, ACK] Seq=0 Ack=1 Win=14480 Len=0 MSS=1452 SACK_PERM=1 TSval=1612562869 TSecr=122445 WS=256

Frame 59: 74 bytes on wire (592 bits), 74 bytes captured (592 bits)
Ethernet II, Src: FonTechn_a5:e9:80 (00:18:84:a5:e9:80), Dst: SamsungE_24:63:41 (cc:05:1b:24:63:41)
Internet Protocol Version 4, Src: 31.13.86.33 (31.13.86.33), Dst: 192.168.1.101 (192.168.1.101)
Transmission Control Protocol, Src Port: https (443), Dst Port: 46410 (46410), Seq: 0, Ack: 1, Len: 0

No.     Time        Source                Destination           Protocol Length Info
     60 0.426895    192.168.1.101         31.13.86.33           TCP      66     46410 > https [ACK] Seq=1 Ack=1 Win=5840 Len=0 TSval=122459 TSecr=1612562869

Frame 60: 66 bytes on wire (528 bits), 66 bytes captured (528 bits)
Ethernet II, Src: aa:aa:03:00:00:00 (aa:aa:03:00:00:00), Dst: 1b:24:63:41:00:3c (1b:24:63:41:00:3c)
Internet Protocol Version 4, Src: 192.168.1.101 (192.168.1.101), Dst: 31.13.86.33 (31.13.86.33)
Transmission Control Protocol, Src Port: 46410 (46410), Dst Port: https (443), Seq: 1, Ack: 1, Len: 0

No.     Time        Source                Destination           Protocol Length Info
     61 0.430693    192.168.1.101         31.13.86.33           TLSv1    146    Client Hello

Frame 61: 146 bytes on wire (1168 bits), 146 bytes captured (1168 bits)
Ethernet II, Src: aa:aa:03:00:00:00 (aa:aa:03:00:00:00), Dst: 1b:24:63:41:00:8c (1b:24:63:41:00:8c)
Internet Protocol Version 4, Src: 192.168.1.101 (192.168.1.101), Dst: 31.13.86.33 (31.13.86.33)
Transmission Control Protocol, Src Port: 46410 (46410), Dst Port: https (443), Seq: 1, Ack: 1, Len: 80
Secure Sockets Layer

No.     Time        Source                Destination           Protocol Length Info
     62 0.431203    74.125.232.143        192.168.1.101         TCP      66     http > 46374 [ACK] Seq=1 Ack=455 Win=42304 Len=0 TSval=4137290581 TSecr=122447

Frame 62: 66 bytes on wire (528 bits), 66 bytes captured (528 bits)
Ethernet II, Src: FonTechn_a5:e9:80 (00:18:84:a5:e9:80), Dst: SamsungE_24:63:41 (cc:05:1b:24:63:41)
Internet Protocol Version 4, Src: 74.125.232.143 (74.125.232.143), Dst: 192.168.1.101 (192.168.1.101)
Transmission Control Protocol, Src Port: http (80), Dst Port: 46374 (46374), Seq: 1, Ack: 455, Len: 0

No.     Time        Source                Destination           Protocol Length Info
     63 0.433266    74.125.232.143        192.168.1.101         TCP      1484   [TCP segment of a reassembled PDU]

Frame 63: 1484 bytes on wire (11872 bits), 1484 bytes captured (11872 bits)
Ethernet II, Src: FonTechn_a5:e9:80 (00:18:84:a5:e9:80), Dst: SamsungE_24:63:41 (cc:05:1b:24:63:41)
Internet Protocol Version 4, Src: 74.125.232.143 (74.125.232.143), Dst: 192.168.1.101 (192.168.1.101)
Transmission Control Protocol, Src Port: http (80), Dst Port: 46374 (46374), Seq: 1, Ack: 455, Len: 1418

No.     Time        Source                Destination           Protocol Length Info
     64 0.433736    192.168.1.101         74.125.232.143        TCP      66     46374 > http [ACK] Seq=455 Ack=1419 Win=8736 Len=0 TSval=122460 TSecr=4137290581

Frame 64: 66 bytes on wire (528 bits), 66 bytes captured (528 bits)
Ethernet II, Src: aa:aa:03:00:00:00 (aa:aa:03:00:00:00), Dst: 1b:24:63:41:00:3c (1b:24:63:41:00:3c)
Internet Protocol Version 4, Src: 192.168.1.101 (192.168.1.101), Dst: 74.125.232.143 (74.125.232.143)
Transmission Control Protocol, Src Port: 46374 (46374), Dst Port: http (80), Seq: 455, Ack: 1419, Len: 0

No.     Time        Source                Destination           Protocol Length Info
     65 0.434593    74.125.232.143        192.168.1.101         TCP      1484   [TCP segment of a reassembled PDU]

Frame 65: 1484 bytes on wire (11872 bits), 1484 bytes captured (11872 bits)
Ethernet II, Src: FonTechn_a5:e9:80 (00:18:84:a5:e9:80), Dst: SamsungE_24:63:41 (cc:05:1b:24:63:41)
Internet Protocol Version 4, Src: 74.125.232.143 (74.125.232.143), Dst: 192.168.1.101 (192.168.1.101)
