No.     Time        Source                Destination           Protocol Length Info
      1 0.000000    192.168.1.101         184.173.161.162       SSL      78     Continuation Data

Frame 1: 78 bytes on wire (624 bits), 78 bytes captured (624 bits)
Ethernet II, Src: aa:aa:03:00:00:00 (aa:aa:03:00:00:00), Dst: 1b:24:63:41:00:48 (1b:24:63:41:00:48)
Internet Protocol Version 4, Src: 192.168.1.101 (192.168.1.101), Dst: 184.173.161.162 (184.173.161.162)
Transmission Control Protocol, Src Port: 40112 (40112), Dst Port: https (443), Seq: 1, Ack: 1, Len: 12
Secure Sockets Layer

No.     Time        Source                Destination           Protocol Length Info
      2 0.554616    192.168.1.101         184.173.161.162       SSL      78     [TCP Retransmission] Continuation Data

Frame 2: 78 bytes on wire (624 bits), 78 bytes captured (624 bits)
Ethernet II, Src: aa:aa:03:00:00:00 (aa:aa:03:00:00:00), Dst: 1b:24:63:41:00:48 (1b:24:63:41:00:48)
Internet Protocol Version 4, Src: 192.168.1.101 (192.168.1.101), Dst: 184.173.161.162 (184.173.161.162)
Transmission Control Protocol, Src Port: 40112 (40112), Dst Port: https (443), Seq: 1, Ack: 1, Len: 12
Secure Sockets Layer

No.     Time        Source                Destination           Protocol Length Info
      3 0.646200    184.173.161.162       192.168.1.101         SSL      93     Continuation Data

Frame 3: 93 bytes on wire (744 bits), 93 bytes captured (744 bits)
Ethernet II, Src: FonTechn_a5:e9:80 (00:18:84:a5:e9:80), Dst: SamsungE_24:63:41 (cc:05:1b:24:63:41)
Internet Protocol Version 4, Src: 184.173.161.162 (184.173.161.162), Dst: 192.168.1.101 (192.168.1.101)
Transmission Control Protocol, Src Port: https (443), Dst Port: 40112 (40112), Seq: 1, Ack: 13, Len: 27
Secure Sockets Layer

No.     Time        Source                Destination           Protocol Length Info
      4 0.646563    192.168.1.101         184.173.161.162       SSL      91     Continuation Data

Frame 4: 91 bytes on wire (728 bits), 91 bytes captured (728 bits)
Ethernet II, Src: aa:aa:03:00:00:00 (aa:aa:03:00:00:00), Dst: 1b:24:63:41:00:55 (1b:24:63:41:00:55)
Internet Protocol Version 4, Src: 192.168.1.101 (192.168.1.101), Dst: 184.173.161.162 (184.173.161.162)
Transmission Control Protocol, Src Port: 40112 (40112), Dst Port: https (443), Seq: 13, Ack: 28, Len: 25
Secure Sockets Layer

No.     Time        Source                Destination           Protocol Length Info
      5 0.695428    184.173.161.162       192.168.1.101         SSL      93     [TCP Retransmission] Continuation Data

Frame 5: 93 bytes on wire (744 bits), 93 bytes captured (744 bits)
Ethernet II, Src: FonTechn_a5:e9:80 (00:18:84:a5:e9:80), Dst: SamsungE_24:63:41 (cc:05:1b:24:63:41)
Internet Protocol Version 4, Src: 184.173.161.162 (184.173.161.162), Dst: 192.168.1.101 (192.168.1.101)
Transmission Control Protocol, Src Port: https (443), Dst Port: 40112 (40112), Seq: 1, Ack: 13, Len: 27
Secure Sockets Layer

No.     Time        Source                Destination           Protocol Length Info
      6 0.695831    192.168.1.101         184.173.161.162       TCP      78     [TCP Dup ACK 4#1] 40112 > https [ACK] Seq=38 Ack=28 Win=864 Len=0 TSval=6300 TSecr=2612825200 SLE=1 SRE=28

Frame 6: 78 bytes on wire (624 bits), 78 bytes captured (624 bits)
Ethernet II, Src: aa:aa:03:00:00:00 (aa:aa:03:00:00:00), Dst: 1b:24:63:41:00:48 (1b:24:63:41:00:48)
Internet Protocol Version 4, Src: 192.168.1.101 (192.168.1.101), Dst: 184.173.161.162 (184.173.161.162)
Transmission Control Protocol, Src Port: 40112 (40112), Dst Port: https (443), Seq: 38, Ack: 28, Len: 0

No.     Time        Source                Destination           Protocol Length Info
      7 0.816988    184.173.161.162       192.168.1.101         TCP      66     https > 40112 [ACK] Seq=28 Ack=38 Win=514 Len=0 TSval=2612825319 TSecr=6295

Frame 7: 66 bytes on wire (528 bits), 66 bytes captured (528 bits)
Ethernet II, Src: FonTechn_a5:e9:80 (00:18:84:a5:e9:80), Dst: SamsungE_24:63:41 (cc:05:1b:24:63:41)
Internet Protocol Version 4, Src: 184.173.161.162 (184.173.161.162), Dst: 192.168.1.101 (192.168.1.101)
Transmission Control Protocol, Src Port: https (443), Dst Port: 40112 (40112), Seq: 28, Ack: 38, Len: 0

No.     Time        Source                Destination           Protocol Length Info
      8 0.817763    184.173.161.162       192.168.1.101         SSL      84     Continuation Data

Frame 8: 84 bytes on wire (672 bits), 84 bytes captured (672 bits)
Ethernet II, Src: FonTechn_a5:e9:80 (00:18:84:a5:e9:80), Dst: SamsungE_24:63:41 (cc:05:1b:24:63:41)
Internet Protocol Version 4, Src: 184.173.161.162 (184.173.161.162), Dst: 192.168.1.101 (192.168.1.101)
Transmission Control Protocol, Src Port: https (443), Dst Port: 40112 (40112), Seq: 28, Ack: 38, Len: 18
Secure Sockets Layer

No.     Time        Source                Destination           Protocol Length Info
      9 0.818085    192.168.1.101         184.173.161.162       TCP      66     40112 > https [ACK] Seq=38 Ack=46 Win=864 Len=0 TSval=6312 TSecr=2612825319

Frame 9: 66 bytes on wire (528 bits), 66 bytes captured (528 bits)
Ethernet II, Src: aa:aa:03:00:00:00 (aa:aa:03:00:00:00), Dst: 1b:24:63:41:00:3c (1b:24:63:41:00:3c)
Internet Protocol Version 4, Src: 192.168.1.101 (192.168.1.101), Dst: 184.173.161.162 (184.173.161.162)
Transmission Control Protocol, Src Port: 40112 (40112), Dst Port: https (443), Seq: 38, Ack: 46, Len: 0

No.     Time        Source                Destination           Protocol Length Info
     10 3.799740    192.168.1.101         184.173.161.162       SSL      95     Continuation Data

Frame 10: 95 bytes on wire (760 bits), 95 bytes captured (760 bits)
Ethernet II, Src: aa:aa:03:00:00:00 (aa:aa:03:00:00:00), Dst: 1b:24:63:41:00:59 (1b:24:63:41:00:59)
Internet Protocol Version 4, Src: 192.168.1.101 (192.168.1.101), Dst: 184.173.161.162 (184.173.161.162)
Transmission Control Protocol, Src Port: 40112 (40112), Dst Port: https (443), Seq: 38, Ack: 46, Len: 29
Secure Sockets Layer

No.     Time        Source                Destination           Protocol Length Info
     11 4.694616    192.168.1.101         184.173.161.162       SSL      95     [TCP Retransmission] Continuation Data

Frame 11: 95 bytes on wire (760 bits), 95 bytes captured (760 bits)
Ethernet II, Src: aa:aa:03:00:00:00 (aa:aa:03:00:00:00), Dst: 1b:24:63:41:00:59 (1b:24:63:41:00:59)
Internet Protocol Version 4, Src: 192.168.1.101 (192.168.1.101), Dst: 184.173.161.162 (184.173.161.162)
Transmission Control Protocol, Src Port: 40112 (40112), Dst Port: https (443), Seq: 38, Ack: 46, Len: 29
Secure Sockets Layer

No.     Time        Source                Destination           Protocol Length Info
     12 4.742133    184.173.161.162       192.168.1.101         TCP      66     https > 40112 [ACK] Seq=46 Ack=67 Win=514 Len=0 TSval=2612828509 TSecr=6610

Frame 12: 66 bytes on wire (528 bits), 66 bytes captured (528 bits)
Ethernet II, Src: FonTechn_a5:e9:80 (00:18:84:a5:e9:80), Dst: SamsungE_24:63:41 (cc:05:1b:24:63:41)
Internet Protocol Version 4, Src: 184.173.161.162 (184.173.161.162), Dst: 192.168.1.101 (192.168.1.101)
Transmission Control Protocol, Src Port: https (443), Dst Port: 40112 (40112), Seq: 46, Ack: 67, Len: 0

No.     Time        Source                Destination           Protocol Length Info
     13 4.742481    192.168.1.101         184.173.161.162       SSL      106    Continuation Data

Frame 13: 106 bytes on wire (848 bits), 106 bytes captured (848 bits)
Ethernet II, Src: aa:aa:03:00:00:00 (aa:aa:03:00:00:00), Dst: 1b:24:63:41:00:64 (1b:24:63:41:00:64)
Internet Protocol Version 4, Src: 192.168.1.101 (192.168.1.101), Dst: 184.173.161.162 (184.173.161.162)
Transmission Control Protocol, Src Port: 40112 (40112), Dst Port: https (443), Seq: 67, Ack: 46, Len: 40
Secure Sockets Layer

No.     Time        Source                Destination           Protocol Length Info
     14 4.870543    184.173.161.162       192.168.1.101         TCP      66     [TCP Dup ACK 12#1] https > 40112 [ACK] Seq=46 Ack=67 Win=514 Len=0 TSval=2612829364 TSecr=6700

Frame 14: 66 bytes on wire (528 bits), 66 bytes captured (528 bits)
Ethernet II, Src: FonTechn_a5:e9:80 (00:18:84:a5:e9:80), Dst: SamsungE_24:63:41 (cc:05:1b:24:63:41)
Internet Protocol Version 4, Src: 184.173.161.162 (184.173.161.162), Dst: 192.168.1.101 (192.168.1.101)
Transmission Control Protocol, Src Port: https (443), Dst Port: 40112 (40112), Seq: 46, Ack: 67, Len: 0

No.     Time        Source                Destination           Protocol Length Info
     15 4.905740    184.173.161.162       192.168.1.101         SSL      112    Continuation Data

Frame 15: 112 bytes on wire (896 bits), 112 bytes captured (896 bits)
Ethernet II, Src: FonTechn_a5:e9:80 (00:18:84:a5:e9:80), Dst: SamsungE_24:63:41 (cc:05:1b:24:63:41)
Internet Protocol Version 4, Src: 184.173.161.162 (184.173.161.162), Dst: 192.168.1.101 (192.168.1.101)
Transmission Control Protocol, Src Port: https (443), Dst Port: 40112 (40112), Seq: 46, Ack: 107, Len: 46
Secure Sockets Layer

No.     Time        Source                Destination           Protocol Length Info
     16 4.906116    192.168.1.101         184.173.161.162       TCP      66     40112 > https [ACK] Seq=107 Ack=92 Win=864 Len=0 TSval=6721 TSecr=2612829414

Frame 16: 66 bytes on wire (528 bits), 66 bytes captured (528 bits)
Ethernet II, Src: aa:aa:03:00:00:00 (aa:aa:03:00:00:00), Dst: 1b:24:63:41:00:3c (1b:24:63:41:00:3c)
Internet Protocol Version 4, Src: 192.168.1.101 (192.168.1.101), Dst: 184.173.161.162 (184.173.161.162)
Transmission Control Protocol, Src Port: 40112 (40112), Dst Port: https (443), Seq: 107, Ack: 92, Len: 0

No.     Time        Source                Destination           Protocol Length Info
     17 5.464890    FonTechn_a5:e9:80     SamsungE_24:63:41     ARP      42     Who has 192.168.1.101?  Tell 192.168.1.1

Frame 17: 42 bytes on wire (336 bits), 42 bytes captured (336 bits)
Ethernet II, Src: FonTechn_a5:e9:80 (00:18:84:a5:e9:80), Dst: SamsungE_24:63:41 (cc:05:1b:24:63:41)
Address Resolution Protocol (request)

No.     Time        Source                Destination           Protocol Length Info
     18 5.464961    aa:aa:03:00:00:00     1b:24:63:41:00:24     ARP      42     192.168.1.101 is at cc:05:1b:24:63:41

Frame 18: 42 bytes on wire (336 bits), 42 bytes captured (336 bits)
Ethernet II, Src: aa:aa:03:00:00:00 (aa:aa:03:00:00:00), Dst: 1b:24:63:41:00:24 (1b:24:63:41:00:24)
Address Resolution Protocol (reply)

No.     Time        Source                Destination           Protocol Length Info
     19 9.454628    192.168.1.101         173.194.113.52        TCP      66     42064 > http [FIN, ACK] Seq=1 Ack=1 Win=3029 Len=0 TSval=7176 TSecr=2160109237

Frame 19: 66 bytes on wire (528 bits), 66 bytes captured (528 bits)
Ethernet II, Src: aa:aa:03:00:00:00 (aa:aa:03:00:00:00), Dst: 1b:24:63:41:00:3c (1b:24:63:41:00:3c)
Internet Protocol Version 4, Src: 192.168.1.101 (192.168.1.101), Dst: 173.194.113.52 (173.194.113.52)
Transmission Control Protocol, Src Port: 42064 (42064), Dst Port: http (80), Seq: 1, Ack: 1, Len: 0

No.     Time        Source                Destination           Protocol Length Info
     20 11.406073   192.168.1.101         184.173.161.162       SSL      127    Continuation Data

Frame 20: 127 bytes on wire (1016 bits), 127 bytes captured (1016 bits)
Ethernet II, Src: aa:aa:03:00:00:00 (aa:aa:03:00:00:00), Dst: 1b:24:63:41:00:79 (1b:24:63:41:00:79)
Internet Protocol Version 4, Src: 192.168.1.101 (192.168.1.101), Dst: 184.173.161.162 (184.173.161.162)
Transmission Control Protocol, Src Port: 40112 (40112), Dst Port: https (443), Seq: 107, Ack: 92, Len: 61
Secure Sockets Layer

No.     Time        Source                Destination           Protocol Length Info
     21 11.705503   FonTechn_a5:e9:81     Spanning-tree-(for-bridges)_00 STP      52     Conf. Root = 32768/0/00:18:84:a5:e9:80  Cost = 0  Port = 0x8002

Frame 21: 52 bytes on wire (416 bits), 52 bytes captured (416 bits)
IEEE 802.3 Ethernet 
Logical-Link Control
Spanning Tree Protocol

No.     Time        Source                Destination           Protocol Length Info
     22 11.706543   184.173.161.162       192.168.1.101         SSL      110    Continuation Data

Frame 22: 110 bytes on wire (880 bits), 110 bytes captured (880 bits)
Ethernet II, Src: FonTechn_a5:e9:80 (00:18:84:a5:e9:80), Dst: SamsungE_24:63:41 (cc:05:1b:24:63:41)
Internet Protocol Version 4, Src: 184.173.161.162 (184.173.161.162), Dst: 192.168.1.101 (192.168.1.101)
Transmission Control Protocol, Src Port: https (443), Dst Port: 40112 (40112), Seq: 92, Ack: 168, Len: 44
Secure Sockets Layer

No.     Time        Source                Destination           Protocol Length Info
     23 11.707005   192.168.1.101         184.173.161.162       TCP      66     40112 > https [ACK] Seq=168 Ack=136 Win=864 Len=0 TSval=7401 TSecr=2612836099

Frame 23: 66 bytes on wire (528 bits), 66 bytes captured (528 bits)
Ethernet II, Src: aa:aa:03:00:00:00 (aa:aa:03:00:00:00), Dst: 1b:24:63:41:00:3c (1b:24:63:41:00:3c)
Internet Protocol Version 4, Src: 192.168.1.101 (192.168.1.101), Dst: 184.173.161.162 (184.173.161.162)
Transmission Control Protocol, Src Port: 40112 (40112), Dst Port: https (443), Seq: 168, Ack: 136, Len: 0

No.     Time        Source                Destination           Protocol Length Info
     24 19.686041   192.168.1.101         184.173.161.162       SSL      131    Continuation Data

Frame 24: 131 bytes on wire (1048 bits), 131 bytes captured (1048 bits)
Ethernet II, Src: aa:aa:03:00:00:00 (aa:aa:03:00:00:00), Dst: 1b:24:63:41:00:7d (1b:24:63:41:00:7d)
Internet Protocol Version 4, Src: 192.168.1.101 (192.168.1.101), Dst: 184.173.161.162 (184.173.161.162)
Transmission Control Protocol, Src Port: 40112 (40112), Dst Port: https (443), Seq: 168, Ack: 136, Len: 65
Secure Sockets Layer

No.     Time        Source                Destination           Protocol Length Info
     25 20.000128   184.173.161.162       192.168.1.101         SSL      110    Continuation Data

Frame 25: 110 bytes on wire (880 bits), 110 bytes captured (880 bits)
Ethernet II, Src: FonTechn_a5:e9:80 (00:18:84:a5:e9:80), Dst: SamsungE_24:63:41 (cc:05:1b:24:63:41)
Internet Protocol Version 4, Src: 184.173.161.162 (184.173.161.162), Dst: 192.168.1.101 (192.168.1.101)
Transmission Control Protocol, Src Port: https (443), Dst Port: 40112 (40112), Seq: 136, Ack: 233, Len: 44
Secure Sockets Layer

No.     Time        Source                Destination           Protocol Length Info
     26 20.000753   192.168.1.101         184.173.161.162       TCP      66     40112 > https [ACK] Seq=233 Ack=180 Win=864 Len=0 TSval=8230 TSecr=2612844350

Frame 26: 66 bytes on wire (528 bits), 66 bytes captured (528 bits)
Ethernet II, Src: aa:aa:03:00:00:00 (aa:aa:03:00:00:00), Dst: 1b:24:63:41:00:3c (1b:24:63:41:00:3c)
Internet Protocol Version 4, Src: 192.168.1.101 (192.168.1.101), Dst: 184.173.161.162 (184.173.161.162)
Transmission Control Protocol, Src Port: 40112 (40112), Dst Port: https (443), Seq: 233, Ack: 180, Len: 0

No.     Time        Source                Destination           Protocol Length Info
     27 26.750255   192.168.1.101         184.173.161.162       SSL      133    Continuation Data

Frame 27: 133 bytes on wire (1064 bits), 133 bytes captured (1064 bits)
Ethernet II, Src: aa:aa:03:00:00:00 (aa:aa:03:00:00:00), Dst: 1b:24:63:41:00:7f (1b:24:63:41:00:7f)
Internet Protocol Version 4, Src: 192.168.1.101 (192.168.1.101), Dst: 184.173.161.162 (184.173.161.162)
Transmission Control Protocol, Src Port: 40112 (40112), Dst Port: https (443), Seq: 233, Ack: 180, Len: 67
Secure Sockets Layer

No.     Time        Source                Destination           Protocol Length Info
     28 27.167930   184.173.161.162       192.168.1.101         SSL      110    Continuation Data

Frame 28: 110 bytes on wire (880 bits), 110 bytes captured (880 bits)
Ethernet II, Src: FonTechn_a5:e9:80 (00:18:84:a5:e9:80), Dst: SamsungE_24:63:41 (cc:05:1b:24:63:41)
Internet Protocol Version 4, Src: 184.173.161.162 (184.173.161.162), Dst: 192.168.1.101 (192.168.1.101)
Transmission Control Protocol, Src Port: https (443), Dst Port: 40112 (40112), Seq: 180, Ack: 300, Len: 44
Secure Sockets Layer

No.     Time        Source                Destination           Protocol Length Info
     29 27.168560   192.168.1.101         184.173.161.162       TCP      66     40112 > https [ACK] Seq=300 Ack=224 Win=864 Len=0 TSval=8947 TSecr=2612851439

Frame 29: 66 bytes on wire (528 bits), 66 bytes captured (528 bits)
Ethernet II, Src: aa:aa:03:00:00:00 (aa:aa:03:00:00:00), Dst: 1b:24:63:41:00:3c (1b:24:63:41:00:3c)
Internet Protocol Version 4, Src: 192.168.1.101 (192.168.1.101), Dst: 184.173.161.162 (184.173.161.162)
Transmission Control Protocol, Src Port: 40112 (40112), Dst Port: https (443), Seq: 300, Ack: 224, Len: 0

No.     Time        Source                Destination           Protocol Length Info
     30 41.934035   192.168.1.101         184.173.161.162       SSL      140    Continuation Data

Frame 30: 140 bytes on wire (1120 bits), 140 bytes captured (1120 bits)
Ethernet II, Src: aa:aa:03:00:00:00 (aa:aa:03:00:00:00), Dst: 1b:24:63:41:00:86 (1b:24:63:41:00:86)
Internet Protocol Version 4, Src: 192.168.1.101 (192.168.1.101), Dst: 184.173.161.162 (184.173.161.162)
Transmission Control Protocol, Src Port: 40112 (40112), Dst Port: https (443), Seq: 300, Ack: 224, Len: 74
Secure Sockets Layer

No.     Time        Source                Destination           Protocol Length Info
     31 42.323206   184.173.161.162       192.168.1.101         SSL      110    Continuation Data

Frame 31: 110 bytes on wire (880 bits), 110 bytes captured (880 bits)
Ethernet II, Src: FonTechn_a5:e9:80 (00:18:84:a5:e9:80), Dst: SamsungE_24:63:41 (cc:05:1b:24:63:41)
Internet Protocol Version 4, Src: 184.173.161.162 (184.173.161.162), Dst: 192.168.1.101 (192.168.1.101)
Transmission Control Protocol, Src Port: https (443), Dst Port: 40112 (40112), Seq: 224, Ack: 374, Len: 44
Secure Sockets Layer

No.     Time        Source                Destination           Protocol Length Info
     32 42.323696   192.168.1.101         184.173.161.162       TCP      66     40112 > https [ACK] Seq=374 Ack=268 Win=864 Len=0 TSval=10462 TSecr=2612866639

Frame 32: 66 bytes on wire (528 bits), 66 bytes captured (528 bits)
Ethernet II, Src: aa:aa:03:00:00:00 (aa:aa:03:00:00:00), Dst: 1b:24:63:41:00:3c (1b:24:63:41:00:3c)
Internet Protocol Version 4, Src: 192.168.1.101 (192.168.1.101), Dst: 184.173.161.162 (184.173.161.162)
Transmission Control Protocol, Src Port: 40112 (40112), Dst Port: https (443), Seq: 374, Ack: 268, Len: 0

No.     Time        Source                Destination           Protocol Length Info
     33 47.443205   FonTechn_a5:e9:80     SamsungE_24:63:41     ARP      42     Who has 192.168.1.101?  Tell 192.168.1.1

Frame 33: 42 bytes on wire (336 bits), 42 bytes captured (336 bits)
Ethernet II, Src: FonTechn_a5:e9:80 (00:18:84:a5:e9:80), Dst: SamsungE_24:63:41 (cc:05:1b:24:63:41)
Address Resolution Protocol (request)

No.     Time        Source                Destination           Protocol Length Info
     34 47.443303   aa:aa:03:00:00:00     1b:24:63:41:00:24     ARP      42     192.168.1.101 is at cc:05:1b:24:63:41

Frame 34: 42 bytes on wire (336 bits), 42 bytes captured (336 bits)
Ethernet II, Src: aa:aa:03:00:00:00 (aa:aa:03:00:00:00), Dst: 1b:24:63:41:00:24 (1b:24:63:41:00:24)
Address Resolution Protocol (reply)

No.     Time        Source                Destination           Protocol Length Info
     35 47.469558   192.168.1.101         184.173.161.162       SSL      124    Continuation Data

Frame 35: 124 bytes on wire (992 bits), 124 bytes captured (992 bits)
Ethernet II, Src: aa:aa:03:00:00:00 (aa:aa:03:00:00:00), Dst: 1b:24:63:41:00:76 (1b:24:63:41:00:76)
Internet Protocol Version 4, Src: 192.168.1.101 (192.168.1.101), Dst: 184.173.161.162 (184.173.161.162)
Transmission Control Protocol, Src Port: 40112 (40112), Dst Port: https (443), Seq: 374, Ack: 268, Len: 58
Secure Sockets Layer

No.     Time        Source                Destination           Protocol Length Info
     36 47.660181   184.173.161.162       192.168.1.101         SSL      110    Continuation Data

Frame 36: 110 bytes on wire (880 bits), 110 bytes captured (880 bits)
Ethernet II, Src: FonTechn_a5:e9:80 (00:18:84:a5:e9:80), Dst: SamsungE_24:63:41 (cc:05:1b:24:63:41)
Internet Protocol Version 4, Src: 184.173.161.162 (184.173.161.162), Dst: 192.168.1.101 (192.168.1.101)
Transmission Control Protocol, Src Port: https (443), Dst Port: 40112 (40112), Seq: 268, Ack: 432, Len: 44
Secure Sockets Layer

No.     Time        Source                Destination           Protocol Length Info
     37 47.660525   192.168.1.101         184.173.161.162       TCP      66     40112 > https [ACK] Seq=432 Ack=312 Win=864 Len=0 TSval=10996 TSecr=2612872169

Frame 37: 66 bytes on wire (528 bits), 66 bytes captured (528 bits)
Ethernet II, Src: aa:aa:03:00:00:00 (aa:aa:03:00:00:00), Dst: 1b:24:63:41:00:3c (1b:24:63:41:00:3c)
Internet Protocol Version 4, Src: 192.168.1.101 (192.168.1.101), Dst: 184.173.161.162 (184.173.161.162)
Transmission Control Protocol, Src Port: 40112 (40112), Dst Port: https (443), Seq: 432, Ack: 312, Len: 0

No.     Time        Source                Destination           Protocol Length Info
     38 47.750020   FonTechn_a5:e9:81     Spanning-tree-(for-bridges)_00 STP      52     Conf. Root = 32768/0/00:18:84:a5:e9:80  Cost = 0  Port = 0x8002

Frame 38: 52 bytes on wire (416 bits), 52 bytes captured (416 bits)
IEEE 802.3 Ethernet 
Logical-Link Control
Spanning Tree Protocol

No.     Time        Source                Destination           Protocol Length Info
     39 61.111963   192.168.1.101         88.149.128.12         DNS      79     Standard query 0x2e0f  A play.googleapis.com

Frame 39: 79 bytes on wire (632 bits), 79 bytes captured (632 bits)
Ethernet II, Src: aa:aa:03:00:00:00 (aa:aa:03:00:00:00), Dst: 1b:24:63:41:00:49 (1b:24:63:41:00:49)
Internet Protocol Version 4, Src: 192.168.1.101 (192.168.1.101), Dst: 88.149.128.12 (88.149.128.12)
User Datagram Protocol, Src Port: 12949 (12949), Dst Port: domain (53)
Domain Name System (query)

No.     Time        Source                Destination           Protocol Length Info
     40 61.370120   88.149.128.12         192.168.1.101         DNS      129    Standard query response 0x2e0f  CNAME googleapis.l.google.com A 173.194.70.95

Frame 40: 129 bytes on wire (1032 bits), 129 bytes captured (1032 bits)
Ethernet II, Src: FonTechn_a5:e9:80 (00:18:84:a5:e9:80), Dst: SamsungE_24:63:41 (cc:05:1b:24:63:41)
Internet Protocol Version 4, Src: 88.149.128.12 (88.149.128.12), Dst: 192.168.1.101 (192.168.1.101)
User Datagram Protocol, Src Port: domain (53), Dst Port: 12949 (12949)
Domain Name System (response)

No.     Time        Source                Destination           Protocol Length Info
     41 61.373531   192.168.1.101         173.194.70.95         TCP      74     54068 > https [SYN] Seq=0 Win=5840 Len=0 MSS=1460 SACK_PERM=1 TSval=12367 TSecr=0 WS=8

Frame 41: 74 bytes on wire (592 bits), 74 bytes captured (592 bits)
Ethernet II, Src: aa:aa:03:00:00:00 (aa:aa:03:00:00:00), Dst: 1b:24:63:41:00:44 (1b:24:63:41:00:44)
Internet Protocol Version 4, Src: 192.168.1.101 (192.168.1.101), Dst: 173.194.70.95 (173.194.70.95)
Transmission Control Protocol, Src Port: 54068 (54068), Dst Port: https (443), Seq: 0, Len: 0

No.     Time        Source                Destination           Protocol Length Info
     42 61.471880   173.194.70.95         192.168.1.101         TCP      74     https > 54068 [SYN, ACK] Seq=0 Ack=1 Win=42540 Len=0 MSS=1430 SACK_PERM=1 TSval=2716325440 TSecr=12367 WS=64

Frame 42: 74 bytes on wire (592 bits), 74 bytes captured (592 bits)
Ethernet II, Src: FonTechn_a5:e9:80 (00:18:84:a5:e9:80), Dst: SamsungE_24:63:41 (cc:05:1b:24:63:41)
Internet Protocol Version 4, Src: 173.194.70.95 (173.194.70.95), Dst: 192.168.1.101 (192.168.1.101)
Transmission Control Protocol, Src Port: https (443), Dst Port: 54068 (54068), Seq: 0, Ack: 1, Len: 0

No.     Time        Source                Destination           Protocol Length Info
     43 61.472346   192.168.1.101         173.194.70.95         TCP      66     54068 > https [ACK] Seq=1 Ack=1 Win=5840 Len=0 TSval=12377 TSecr=2716325440

Frame 43: 66 bytes on wire (528 bits), 66 bytes captured (528 bits)
Ethernet II, Src: aa:aa:03:00:00:00 (aa:aa:03:00:00:00), Dst: 1b:24:63:41:00:3c (1b:24:63:41:00:3c)
Internet Protocol Version 4, Src: 192.168.1.101 (192.168.1.101), Dst: 173.194.70.95 (173.194.70.95)
Transmission Control Protocol, Src Port: 54068 (54068), Dst Port: https (443), Seq: 1, Ack: 1, Len: 0

No.     Time        Source                Destination           Protocol Length Info
     44 61.487355   192.168.1.101         173.194.70.95         TLSv1    146    Client Hello

Frame 44: 146 bytes on wire (1168 bits), 146 bytes captured (1168 bits)
Ethernet II, Src: aa:aa:03:00:00:00 (aa:aa:03:00:00:00), Dst: 1b:24:63:41:00:8c (1b:24:63:41:00:8c)
Internet Protocol Version 4, Src: 192.168.1.101 (192.168.1.101), Dst: 173.194.70.95 (173.194.70.95)
Transmission Control Protocol, Src Port: 54068 (54068), Dst Port: https (443), Seq: 1, Ack: 1, Len: 80
Secure Sockets Layer

No.     Time        Source                Destination           Protocol Length Info
     45 61.579965   173.194.70.95         192.168.1.101         TCP      66     https > 54068 [ACK] Seq=1 Ack=81 Win=42560 Len=0 TSval=2716325550 TSecr=12379

Frame 45: 66 bytes on wire (528 bits), 66 bytes captured (528 bits)
Ethernet II, Src: FonTechn_a5:e9:80 (00:18:84:a5:e9:80), Dst: SamsungE_24:63:41 (cc:05:1b:24:63:41)
Internet Protocol Version 4, Src: 173.194.70.95 (173.194.70.95), Dst: 192.168.1.101 (192.168.1.101)
Transmission Control Protocol, Src Port: https (443), Dst Port: 54068 (54068), Seq: 1, Ack: 81, Len: 0

No.     Time        Source                Destination           Protocol Length Info
     46 61.582920   173.194.70.95         192.168.1.101         TLSv1    1484   Server Hello

Frame 46: 1484 bytes on wire (11872 bits), 1484 bytes captured (11872 bits)
Ethernet II, Src: FonTechn_a5:e9:80 (00:18:84:a5:e9:80), Dst: SamsungE_24:63:41 (cc:05:1b:24:63:41)
Internet Protocol Version 4, Src: 173.194.70.95 (173.194.70.95), Dst: 192.168.1.101 (192.168.1.101)
Transmission Control Protocol, Src Port: https (443), Dst Port: 54068 (54068), Seq: 1, Ack: 81, Len: 1418
Secure Sockets Layer

No.     Time        Source                Destination           Protocol Length Info
     47 61.583140   192.168.1.101         173.194.70.95         TCP      66     54068 > https [ACK] Seq=81 Ack=1419 Win=8736 Len=0 TSval=12388 TSecr=2716325550

Frame 47: 66 bytes on wire (528 bits), 66 bytes captured (528 bits)
Ethernet II, Src: aa:aa:03:00:00:00 (aa:aa:03:00:00:00), Dst: 1b:24:63:41:00:3c (1b:24:63:41:00:3c)
Internet Protocol Version 4, Src: 192.168.1.101 (192.168.1.101), Dst: 173.194.70.95 (173.194.70.95)
Transmission Control Protocol, Src Port: 54068 (54068), Dst Port: https (443), Seq: 81, Ack: 1419, Len: 0

No.     Time        Source                Destination           Protocol Length Info
     48 61.585210   173.194.70.95         192.168.1.101         TCP      1484   [TCP segment of a reassembled PDU]

Frame 48: 1484 bytes on wire (11872 bits), 1484 bytes captured (11872 bits)
Ethernet II, Src: FonTechn_a5:e9:80 (00:18:84:a5:e9:80), Dst: SamsungE_24:63:41 (cc:05:1b:24:63:41)
Internet Protocol Version 4, Src: 173.194.70.95 (173.194.70.95), Dst: 192.168.1.101 (192.168.1.101)
Transmission Control Protocol, Src Port: https (443), Dst Port: 54068 (54068), Seq: 1419, Ack: 81, Len: 1418

No.     Time        Source                Destination           Protocol Length Info
     49 61.585670   192.168.1.101         173.194.70.95         TCP      66     54068 > https [ACK] Seq=81 Ack=2837 Win=11632 Len=0 TSval=12389 TSecr=2716325550

Frame 49: 66 bytes on wire (528 bits), 66 bytes captured (528 bits)
Ethernet II, Src: aa:aa:03:00:00:00 (aa:aa:03:00:00:00), Dst: 1b:24:63:41:00:3c (1b:24:63:41:00:3c)
Internet Protocol Version 4, Src: 192.168.1.101 (192.168.1.101), Dst: 173.194.70.95 (173.194.70.95)
Transmission Control Protocol, Src Port: 54068 (54068), Dst Port: https (443), Seq: 81, Ack: 2837, Len: 0

No.     Time        Source                Destination           Protocol Length Info
     50 61.586423   173.194.70.95         192.168.1.101         TLSv1    491    Certificate, Server Hello Done

Frame 50: 491 bytes on wire (3928 bits), 491 bytes captured (3928 bits)
Ethernet II, Src: FonTechn_a5:e9:80 (00:18:84:a5:e9:80), Dst: SamsungE_24:63:41 (cc:05:1b:24:63:41)
Internet Protocol Version 4, Src: 173.194.70.95 (173.194.70.95), Dst: 192.168.1.101 (192.168.1.101)
Transmission Control Protocol, Src Port: https (443), Dst Port: 54068 (54068), Seq: 2837, Ack: 81, Len: 425
[3 Reassembled TCP Segments (3175 bytes): #46(1332), #48(1418), #50(425)]
Secure Sockets Layer

No.     Time        Source                Destination           Protocol Length Info
     51 61.587161   192.168.1.101         173.194.70.95         TCP      66     54068 > https [ACK] Seq=81 Ack=3262 Win=14472 Len=0 TSval=12389 TSecr=2716325550

Frame 51: 66 bytes on wire (528 bits), 66 bytes captured (528 bits)
Ethernet II, Src: aa:aa:03:00:00:00 (aa:aa:03:00:00:00), Dst: 1b:24:63:41:00:3c (1b:24:63:41:00:3c)
Internet Protocol Version 4, Src: 192.168.1.101 (192.168.1.101), Dst: 173.194.70.95 (173.194.70.95)
Transmission Control Protocol, Src Port: 54068 (54068), Dst Port: https (443), Seq: 81, Ack: 3262, Len: 0

No.     Time        Source                Destination           Protocol Length Info
     52 61.676331   FonTechn_a5:e9:81     Spanning-tree-(for-bridges)_00 STP      52     Conf. Root = 32768/0/00:18:84:a5:e9:80  Cost = 0  Port = 0x8002

Frame 52: 52 bytes on wire (416 bits), 52 bytes captured (416 bits)
IEEE 802.3 Ethernet 
Logical-Link Control
Spanning Tree Protocol

No.     Time        Source                Destination           Protocol Length Info
     53 61.712853   192.168.1.101         173.194.70.95         TLSv1    380    Client Key Exchange, Change Cipher Spec, Encrypted Handshake Message

Frame 53: 380 bytes on wire (3040 bits), 380 bytes captured (3040 bits)
Ethernet II, Src: aa:aa:03:00:00:00 (aa:aa:03:00:00:00), Dst: 1b:24:63:41:01:76 (1b:24:63:41:01:76)
Internet Protocol Version 4, Src: 192.168.1.101 (192.168.1.101), Dst: 173.194.70.95 (173.194.70.95)
Transmission Control Protocol, Src Port: 54068 (54068), Dst Port: https (443), Seq: 81, Ack: 3262, Len: 314
Secure Sockets Layer

No.     Time        Source                Destination           Protocol Length Info
     54 61.810006   173.194.70.95         192.168.1.101         TLSv1    113    Change Cipher Spec, Encrypted Handshake Message

Frame 54: 113 bytes on wire (904 bits), 113 bytes captured (904 bits)
Ethernet II, Src: FonTechn_a5:e9:80 (00:18:84:a5:e9:80), Dst: SamsungE_24:63:41 (cc:05:1b:24:63:41)
Internet Protocol Version 4, Src: 173.194.70.95 (173.194.70.95), Dst: 192.168.1.101 (192.168.1.101)
Transmission Control Protocol, Src Port: https (443), Dst Port: 54068 (54068), Seq: 3262, Ack: 395, Len: 47
Secure Sockets Layer

No.     Time        Source                Destination           Protocol Length Info
     55 61.810253   192.168.1.101         173.194.70.95         TCP      66     54068 > https [ACK] Seq=395 Ack=3309 Win=14472 Len=0 TSval=12411 TSecr=2716325791

Frame 55: 66 bytes on wire (528 bits), 66 bytes captured (528 bits)
Ethernet II, Src: aa:aa:03:00:00:00 (aa:aa:03:00:00:00), Dst: 1b:24:63:41:00:3c (1b:24:63:41:00:3c)
Internet Protocol Version 4, Src: 192.168.1.101 (192.168.1.101), Dst: 173.194.70.95 (173.194.70.95)
Transmission Control Protocol, Src Port: 54068 (54068), Dst Port: https (443), Seq: 395, Ack: 3309, Len: 0

No.     Time        Source                Destination           Protocol Length Info
     56 61.916856   192.168.1.101         184.173.161.162       SSL      136    Continuation Data

Frame 56: 136 bytes on wire (1088 bits), 136 bytes captured (1088 bits)
Ethernet II, Src: aa:aa:03:00:00:00 (aa:aa:03:00:00:00), Dst: 1b:24:63:41:00:82 (1b:24:63:41:00:82)
Internet Protocol Version 4, Src: 192.168.1.101 (192.168.1.101), Dst: 184.173.161.162 (184.173.161.162)
Transmission Control Protocol, Src Port: 40112 (40112), Dst Port: https (443), Seq: 432, Ack: 312, Len: 70
Secure Sockets Layer

No.     Time        Source                Destination           Protocol Length Info
     57 62.079641   184.173.161.162       192.168.1.101         SSL      110    Continuation Data

Frame 57: 110 bytes on wire (880 bits), 110 bytes captured (880 bits)
Ethernet II, Src: FonTechn_a5:e9:80 (00:18:84:a5:e9:80), Dst: SamsungE_24:63:41 (cc:05:1b:24:63:41)
Internet Protocol Version 4, Src: 184.173.161.162 (184.173.161.162), Dst: 192.168.1.101 (192.168.1.101)
Transmission Control Protocol, Src Port: https (443), Dst Port: 40112 (40112), Seq: 312, Ack: 502, Len: 44
Secure Sockets Layer

No.     Time        Source                Destination           Protocol Length Info
     58 62.080023   192.168.1.101         184.173.161.162       TCP      66     40112 > https [ACK] Seq=502 Ack=356 Win=864 Len=0 TSval=12438 TSecr=2612886585

Frame 58: 66 bytes on wire (528 bits), 66 bytes captured (528 bits)
Ethernet II, Src: aa:aa:03:00:00:00 (aa:aa:03:00:00:00), Dst: 1b:24:63:41:00:3c (1b:24:63:41:00:3c)
Internet Protocol Version 4, Src: 192.168.1.101 (192.168.1.101), Dst: 184.173.161.162 (184.173.161.162)
Transmission Control Protocol, Src Port: 40112 (40112), Dst Port: https (443), Seq: 502, Ack: 356, Len: 0

No.     Time        Source                Destination           Protocol Length Info
     59 62.714188   192.168.1.101         88.149.128.12         DNS      86     Standard query 0x1f0e  PTR 95.70.194.173.in-addr.arpa

Frame 59: 86 bytes on wire (688 bits), 86 bytes captured (688 bits)
Ethernet II, Src: aa:aa:03:00:00:00 (aa:aa:03:00:00:00), Dst: 1b:24:63:41:00:50 (1b:24:63:41:00:50)
Internet Protocol Version 4, Src: 192.168.1.101 (192.168.1.101), Dst: 88.149.128.12 (88.149.128.12)
User Datagram Protocol, Src Port: 9181 (9181), Dst Port: domain (53)
Domain Name System (query)

No.     Time        Source                Destination           Protocol Length Info
     60 63.110381   88.149.128.12         192.168.1.101         DNS      119    Standard query response 0x1f0e  PTR fa-in-f95.1e100.net

Frame 60: 119 bytes on wire (952 bits), 119 bytes captured (952 bits)
Ethernet II, Src: FonTechn_a5:e9:80 (00:18:84:a5:e9:80), Dst: SamsungE_24:63:41 (cc:05:1b:24:63:41)
Internet Protocol Version 4, Src: 88.149.128.12 (88.149.128.12), Dst: 192.168.1.101 (192.168.1.101)
User Datagram Protocol, Src Port: domain (53), Dst Port: 9181 (9181)
Domain Name System (response)

No.     Time        Source                Destination           Protocol Length Info
     61 63.143000   192.168.1.101         173.194.70.95         TLSv1    634    Application Data

Frame 61: 634 bytes on wire (5072 bits), 634 bytes captured (5072 bits)
Ethernet II, Src: aa:aa:03:00:00:00 (aa:aa:03:00:00:00), Dst: 1b:24:63:41:02:74 (1b:24:63:41:02:74)
Internet Protocol Version 4, Src: 192.168.1.101 (192.168.1.101), Dst: 173.194.70.95 (173.194.70.95)
Transmission Control Protocol, Src Port: 54068 (54068), Dst Port: https (443), Seq: 395, Ack: 3309, Len: 568
Secure Sockets Layer

No.     Time        Source                Destination           Protocol Length Info
     62 63.144195   192.168.1.101         173.194.70.95         TLSv1    925    Application Data

Frame 62: 925 bytes on wire (7400 bits), 925 bytes captured (7400 bits)
Ethernet II, Src: aa:aa:03:00:00:00 (aa:aa:03:00:00:00), Dst: 1b:24:63:41:03:97 (1b:24:63:41:03:97)
Internet Protocol Version 4, Src: 192.168.1.101 (192.168.1.101), Dst: 173.194.70.95 (173.194.70.95)
Transmission Control Protocol, Src Port: 54068 (54068), Dst Port: https (443), Seq: 963, Ack: 3309, Len: 859
Secure Sockets Layer

No.     Time        Source                Destination           Protocol Length Info
     63 63.250740   173.194.70.95         192.168.1.101         TCP      66     https > 54068 [ACK] Seq=3309 Ack=1822 Win=42880 Len=0 TSval=2716327221 TSecr=12544

Frame 63: 66 bytes on wire (528 bits), 66 bytes captured (528 bits)
Ethernet II, Src: FonTechn_a5:e9:80 (00:18:84:a5:e9:80), Dst: SamsungE_24:63:41 (cc:05:1b:24:63:41)
Internet Protocol Version 4, Src: 173.194.70.95 (173.194.70.95), Dst: 192.168.1.101 (192.168.1.101)
Transmission Control Protocol, Src Port: https (443), Dst Port: 54068 (54068), Seq: 3309, Ack: 1822, Len: 0

No.     Time        Source                Destination           Protocol Length Info
     64 63.256483   173.194.70.95         192.168.1.101         TLSv1    363    Application Data

Frame 64: 363 bytes on wire (2904 bits), 363 bytes captured (2904 bits)
Ethernet II, Src: FonTechn_a5:e9:80 (00:18:84:a5:e9:80), Dst: SamsungE_24:63:41 (cc:05:1b:24:63:41)
Internet Protocol Version 4, Src: 173.194.70.95 (173.194.70.95), Dst: 192.168.1.101 (192.168.1.101)
Transmission Control Protocol, Src Port: https (443), Dst Port: 54068 (54068), Seq: 3309, Ack: 1822, Len: 297
Secure Sockets Layer

No.     Time        Source                Destination           Protocol Length Info
     65 63.256675   192.168.1.101         173.194.70.95         TCP      66     54068 > https [ACK] Seq=1822 Ack=3606 Win=17304 Len=0 TSval=12556 TSecr=2716327237

Frame 65: 66 bytes on wire (528 bits), 66 bytes captured (528 bits)
Ethernet II, Src: aa:aa:03:00:00:00 (aa:aa:03:00:00:00), Dst: 1b:24:63:41:00:3c (1b:24:63:41:00:3c)
Internet Protocol Version 4, Src: 192.168.1.101 (192.168.1.101), Dst: 173.194.70.95 (173.194.70.95)
Transmission Control Protocol, Src Port: 54068 (54068), Dst Port: https (443), Seq: 1822, Ack: 3606, Len: 0

No.     Time        Source                Destination           Protocol Length Info
     66 77.429861   192.168.1.101         184.173.161.162       SSL      78     Continuation Data

Frame 66: 78 bytes on wire (624 bits), 78 bytes captured (624 bits)
Ethernet II, Src: aa:aa:03:00:00:00 (aa:aa:03:00:00:00), Dst: 1b:24:63:41:00:48 (1b:24:63:41:00:48)
Internet Protocol Version 4, Src: 192.168.1.101 (192.168.1.101), Dst: 184.173.161.162 (184.173.161.162)
Transmission Control Protocol, Src Port: 40112 (40112), Dst Port: https (443), Seq: 502, Ack: 356, Len: 12
Secure Sockets Layer

No.     Time        Source                Destination           Protocol Length Info
     67 77.753448   FonTechn_a5:e9:81     Spanning-tree-(for-bridges)_00 STP      52     Conf. Root = 32768/0/00:18:84:a5:e9:80  Cost = 0  Port = 0x8002

Frame 67: 52 bytes on wire (416 bits), 52 bytes captured (416 bits)
IEEE 802.3 Ethernet 
Logical-Link Control
Spanning Tree Protocol

No.     Time        Source                Destination           Protocol Length Info
     68 77.754331   184.173.161.162       192.168.1.101         SSL      95     Continuation Data

Frame 68: 95 bytes on wire (760 bits), 95 bytes captured (760 bits)
Ethernet II, Src: FonTechn_a5:e9:80 (00:18:84:a5:e9:80), Dst: SamsungE_24:63:41 (cc:05:1b:24:63:41)
Internet Protocol Version 4, Src: 184.173.161.162 (184.173.161.162), Dst: 192.168.1.101 (192.168.1.101)
Transmission Control Protocol, Src Port: https (443), Dst Port: 40112 (40112), Seq: 356, Ack: 514, Len: 29
Secure Sockets Layer

No.     Time        Source                Destination           Protocol Length Info
     69 77.755265   192.168.1.101         184.173.161.162       TCP      66     40112 > https [ACK] Seq=514 Ack=385 Win=864 Len=0 TSval=14006 TSecr=2612902129

Frame 69: 66 bytes on wire (528 bits), 66 bytes captured (528 bits)
Ethernet II, Src: aa:aa:03:00:00:00 (aa:aa:03:00:00:00), Dst: 1b:24:63:41:00:3c (1b:24:63:41:00:3c)
Internet Protocol Version 4, Src: 192.168.1.101 (192.168.1.101), Dst: 184.173.161.162 (184.173.161.162)
