No.     Time        Source                Destination           Protocol Length Info
      1 0.000000    10.163.108.219        130.186.6.177         TCP      68     49561 > imaps [ACK] Seq=1 Ack=1 Win=1310 Len=0 TSval=1177966 TSecr=2274256990

Frame 1: 68 bytes on wire (544 bits), 68 bytes captured (544 bits)
Linux cooked capture
Internet Protocol Version 4, Src: 10.163.108.219 (10.163.108.219), Dst: 130.186.6.177 (130.186.6.177)
Transmission Control Protocol, Src Port: 49561 (49561), Dst Port: imaps (993), Seq: 1, Ack: 1, Len: 0

No.     Time        Source                Destination           Protocol Length Info
      2 0.009810    10.163.108.219        130.186.6.177         TLSv1    180    Client Hello

Frame 2: 180 bytes on wire (1440 bits), 180 bytes captured (1440 bits)
Linux cooked capture
Internet Protocol Version 4, Src: 10.163.108.219 (10.163.108.219), Dst: 130.186.6.177 (130.186.6.177)
Transmission Control Protocol, Src Port: 49561 (49561), Dst Port: imaps (993), Seq: 1, Ack: 1, Len: 112
Secure Sockets Layer

No.     Time        Source                Destination           Protocol Length Info
      3 0.199258    130.186.6.177         10.163.108.219        TCP      68     imaps > 49561 [ACK] Seq=1 Ack=113 Win=46 Len=0 TSval=2274257310 TSecr=1177966

Frame 3: 68 bytes on wire (544 bits), 68 bytes captured (544 bits)
Linux cooked capture
Internet Protocol Version 4, Src: 130.186.6.177 (130.186.6.177), Dst: 10.163.108.219 (10.163.108.219)
Transmission Control Protocol, Src Port: imaps (993), Dst Port: 49561 (49561), Seq: 1, Ack: 113, Len: 0

No.     Time        Source                Destination           Protocol Length Info
      4 0.239280    130.186.6.177         10.163.108.219        TLSv1    1366   Server Hello

Frame 4: 1366 bytes on wire (10928 bits), 1366 bytes captured (10928 bits)
Linux cooked capture
Internet Protocol Version 4, Src: 130.186.6.177 (130.186.6.177), Dst: 10.163.108.219 (10.163.108.219)
Transmission Control Protocol, Src Port: imaps (993), Dst Port: 49561 (49561), Seq: 1, Ack: 113, Len: 1298
Secure Sockets Layer

No.     Time        Source                Destination           Protocol Length Info
      5 0.239521    10.163.108.219        130.186.6.177         TCP      68     49561 > imaps [ACK] Seq=113 Ack=1299 Win=1959 Len=0 TSval=1177989 TSecr=2274257310

Frame 5: 68 bytes on wire (544 bits), 68 bytes captured (544 bits)
Linux cooked capture
Internet Protocol Version 4, Src: 10.163.108.219 (10.163.108.219), Dst: 130.186.6.177 (130.186.6.177)
Transmission Control Protocol, Src Port: 49561 (49561), Dst Port: imaps (993), Seq: 113, Ack: 1299, Len: 0

No.     Time        Source                Destination           Protocol Length Info
      6 0.269516    130.186.6.177         10.163.108.219        TCP      1366   [TCP segment of a reassembled PDU]

Frame 6: 1366 bytes on wire (10928 bits), 1366 bytes captured (10928 bits)
Linux cooked capture
Internet Protocol Version 4, Src: 130.186.6.177 (130.186.6.177), Dst: 10.163.108.219 (10.163.108.219)
Transmission Control Protocol, Src Port: imaps (993), Dst Port: 49561 (49561), Seq: 1299, Ack: 113, Len: 1298

No.     Time        Source                Destination           Protocol Length Info
      7 0.269741    10.163.108.219        130.186.6.177         TCP      68     49561 > imaps [ACK] Seq=113 Ack=2597 Win=2608 Len=0 TSval=1177992 TSecr=2274257310

Frame 7: 68 bytes on wire (544 bits), 68 bytes captured (544 bits)
Linux cooked capture
Internet Protocol Version 4, Src: 10.163.108.219 (10.163.108.219), Dst: 130.186.6.177 (130.186.6.177)
Transmission Control Protocol, Src Port: 49561 (49561), Dst Port: imaps (993), Seq: 113, Ack: 2597, Len: 0

No.     Time        Source                Destination           Protocol Length Info
      8 0.329383    130.186.6.177         10.163.108.219        TCP      1366   [TCP segment of a reassembled PDU]

Frame 8: 1366 bytes on wire (10928 bits), 1366 bytes captured (10928 bits)
Linux cooked capture
Internet Protocol Version 4, Src: 130.186.6.177 (130.186.6.177), Dst: 10.163.108.219 (10.163.108.219)
Transmission Control Protocol, Src Port: imaps (993), Dst Port: 49561 (49561), Seq: 2597, Ack: 113, Len: 1298

No.     Time        Source                Destination           Protocol Length Info
      9 0.329633    10.163.108.219        130.186.6.177         TCP      68     49561 > imaps [ACK] Seq=113 Ack=3895 Win=3257 Len=0 TSval=1177998 TSecr=2274257310

Frame 9: 68 bytes on wire (544 bits), 68 bytes captured (544 bits)
Linux cooked capture
Internet Protocol Version 4, Src: 10.163.108.219 (10.163.108.219), Dst: 130.186.6.177 (130.186.6.177)
Transmission Control Protocol, Src Port: 49561 (49561), Dst Port: imaps (993), Seq: 113, Ack: 3895, Len: 0

No.     Time        Source                Destination           Protocol Length Info
     10 0.379271    130.186.6.177         10.163.108.219        TLSv1    1318   Certificate, Server Key Exchange, Server Hello Done

Frame 10: 1318 bytes on wire (10544 bits), 1318 bytes captured (10544 bits)
Linux cooked capture
Internet Protocol Version 4, Src: 130.186.6.177 (130.186.6.177), Dst: 10.163.108.219 (10.163.108.219)
Transmission Control Protocol, Src Port: imaps (993), Dst Port: 49561 (49561), Seq: 3895, Ack: 113, Len: 1250
[4 Reassembled TCP Segments (5058 bytes): #4(1212), #6(1298), #8(1298), #10(1250)]
Secure Sockets Layer

No.     Time        Source                Destination           Protocol Length Info
     11 0.379488    10.163.108.219        130.186.6.177         TCP      68     49561 > imaps [ACK] Seq=113 Ack=5145 Win=3906 Len=0 TSval=1178003 TSecr=2274257469

Frame 11: 68 bytes on wire (544 bits), 68 bytes captured (544 bits)
Linux cooked capture
Internet Protocol Version 4, Src: 10.163.108.219 (10.163.108.219), Dst: 130.186.6.177 (130.186.6.177)
Transmission Control Protocol, Src Port: 49561 (49561), Dst Port: imaps (993), Seq: 113, Ack: 5145, Len: 0

No.     Time        Source                Destination           Protocol Length Info
     12 4.866591    10.163.108.219        83.224.70.77          DNS      78     Standard query 0xc313  A e10.whatsapp.net

Frame 12: 78 bytes on wire (624 bits), 78 bytes captured (624 bits)
Linux cooked capture
Internet Protocol Version 4, Src: 10.163.108.219 (10.163.108.219), Dst: 83.224.70.77 (83.224.70.77)
User Datagram Protocol, Src Port: 51089 (51089), Dst Port: domain (53)
Domain Name System (query)

No.     Time        Source                Destination           Protocol Length Info
     13 6.229621    10.163.108.219        130.186.6.177         TLSv1    258    Client Key Exchange, Change Cipher Spec, Encrypted Handshake Message

Frame 13: 258 bytes on wire (2064 bits), 258 bytes captured (2064 bits)
Linux cooked capture
Internet Protocol Version 4, Src: 10.163.108.219 (10.163.108.219), Dst: 130.186.6.177 (130.186.6.177)
Transmission Control Protocol, Src Port: 49561 (49561), Dst Port: imaps (993), Seq: 113, Ack: 5145, Len: 190
Secure Sockets Layer

No.     Time        Source                Destination           Protocol Length Info
     14 7.339846    10.163.108.219        130.186.6.177         TLSv1    258    [TCP Retransmission] Client Key Exchange, Change Cipher Spec, Encrypted Handshake Message

Frame 14: 258 bytes on wire (2064 bits), 258 bytes captured (2064 bits)
Linux cooked capture
Internet Protocol Version 4, Src: 10.163.108.219 (10.163.108.219), Dst: 130.186.6.177 (130.186.6.177)
Transmission Control Protocol, Src Port: 49561 (49561), Dst Port: imaps (993), Seq: 113, Ack: 5145, Len: 190
Secure Sockets Layer

No.     Time        Source                Destination           Protocol Length Info
     15 7.735436    83.224.70.77          10.163.108.219        DNS      206    Standard query response 0xc313  A 184.173.161.162 A 184.173.161.163 A 184.173.179.37 A 208.43.122.131 A 208.43.122.144 A 184.173.147.60 A 184.173.147.61 A 184.173.147.62

Frame 15: 206 bytes on wire (1648 bits), 206 bytes captured (1648 bits)
Linux cooked capture
Internet Protocol Version 4, Src: 83.224.70.77 (83.224.70.77), Dst: 10.163.108.219 (10.163.108.219)
User Datagram Protocol, Src Port: domain (53), Dst Port: 51089 (51089)
Domain Name System (response)

No.     Time        Source                Destination           Protocol Length Info
     16 7.735708    130.186.6.177         10.163.108.219        TLSv1    119    Change Cipher Spec, Encrypted Handshake Message

Frame 16: 119 bytes on wire (952 bits), 119 bytes captured (952 bits)
Linux cooked capture
Internet Protocol Version 4, Src: 130.186.6.177 (130.186.6.177), Dst: 10.163.108.219 (10.163.108.219)
Transmission Control Protocol, Src Port: imaps (993), Dst Port: 49561 (49561), Seq: 5145, Ack: 303, Len: 51
Secure Sockets Layer

No.     Time        Source                Destination           Protocol Length Info
     17 7.735906    10.163.108.219        130.186.6.177         TCP      68     49561 > imaps [ACK] Seq=303 Ack=5196 Win=3906 Len=0 TSval=1178739 TSecr=2274264051

Frame 17: 68 bytes on wire (544 bits), 68 bytes captured (544 bits)
Linux cooked capture
Internet Protocol Version 4, Src: 10.163.108.219 (10.163.108.219), Dst: 130.186.6.177 (130.186.6.177)
Transmission Control Protocol, Src Port: 49561 (49561), Dst Port: imaps (993), Seq: 303, Ack: 5196, Len: 0

No.     Time        Source                Destination           Protocol Length Info
     18 7.753750    10.163.108.219        184.173.161.162       TCP      76     55191 > https [SYN] Seq=0 Win=5240 Len=0 MSS=1310 SACK_PERM=1 TSval=1178741 TSecr=0 WS=4

Frame 18: 76 bytes on wire (608 bits), 76 bytes captured (608 bits)
Linux cooked capture
Internet Protocol Version 4, Src: 10.163.108.219 (10.163.108.219), Dst: 184.173.161.162 (184.173.161.162)
Transmission Control Protocol, Src Port: 55191 (55191), Dst Port: https (443), Seq: 0, Len: 0

No.     Time        Source                Destination           Protocol Length Info
     19 7.755315    130.186.6.177         10.163.108.219        TLSv1    119    [TCP Retransmission] Change Cipher Spec, Encrypted Handshake Message

Frame 19: 119 bytes on wire (952 bits), 119 bytes captured (952 bits)
Linux cooked capture
Internet Protocol Version 4, Src: 130.186.6.177 (130.186.6.177), Dst: 10.163.108.219 (10.163.108.219)
Transmission Control Protocol, Src Port: imaps (993), Dst Port: 49561 (49561), Seq: 5145, Ack: 303, Len: 51
Secure Sockets Layer

No.     Time        Source                Destination           Protocol Length Info
     20 7.755496    10.163.108.219        130.186.6.177         TCP      80     [TCP Dup ACK 17#1] 49561 > imaps [ACK] Seq=303 Ack=5196 Win=3906 Len=0 TSval=1178741 TSecr=2274264728 SLE=5145 SRE=5196

Frame 20: 80 bytes on wire (640 bits), 80 bytes captured (640 bits)
Linux cooked capture
Internet Protocol Version 4, Src: 10.163.108.219 (10.163.108.219), Dst: 130.186.6.177 (130.186.6.177)
Transmission Control Protocol, Src Port: 49561 (49561), Dst Port: imaps (993), Seq: 303, Ack: 5196, Len: 0

No.     Time        Source                Destination           Protocol Length Info
     21 7.785313    130.186.6.177         10.163.108.219        TCP      80     [TCP Dup ACK 19#1] imaps > 49561 [ACK] Seq=5196 Ack=303 Win=54 Len=0 TSval=2274264885 TSecr=1178700 SLE=113 SRE=303

Frame 21: 80 bytes on wire (640 bits), 80 bytes captured (640 bits)
Linux cooked capture
Internet Protocol Version 4, Src: 130.186.6.177 (130.186.6.177), Dst: 10.163.108.219 (10.163.108.219)
Transmission Control Protocol, Src Port: imaps (993), Dst Port: 49561 (49561), Seq: 5196, Ack: 303, Len: 0

No.     Time        Source                Destination           Protocol Length Info
     22 7.905520    130.186.6.177         10.163.108.219        TLSv1    113    Application Data

Frame 22: 113 bytes on wire (904 bits), 113 bytes captured (904 bits)
Linux cooked capture
Internet Protocol Version 4, Src: 130.186.6.177 (130.186.6.177), Dst: 10.163.108.219 (10.163.108.219)
Transmission Control Protocol, Src Port: imaps (993), Dst Port: 49561 (49561), Seq: 5196, Ack: 303, Len: 45
Secure Sockets Layer

No.     Time        Source                Destination           Protocol Length Info
     23 7.905741    10.163.108.219        130.186.6.177         TCP      68     49561 > imaps [ACK] Seq=303 Ack=5241 Win=3906 Len=0 TSval=1178756 TSecr=2274265004

Frame 23: 68 bytes on wire (544 bits), 68 bytes captured (544 bits)
Linux cooked capture
Internet Protocol Version 4, Src: 10.163.108.219 (10.163.108.219), Dst: 130.186.6.177 (130.186.6.177)
Transmission Control Protocol, Src Port: 49561 (49561), Dst Port: imaps (993), Seq: 303, Ack: 5241, Len: 0

No.     Time        Source                Destination           Protocol Length Info
     24 8.036256    184.173.161.162       10.163.108.219        TCP      76     https > 55191 [SYN, ACK] Seq=0 Ack=1 Win=65535 Len=0 MSS=1310 WS=512 SACK_PERM=1 TSval=713384060 TSecr=1178741

Frame 24: 76 bytes on wire (608 bits), 76 bytes captured (608 bits)
Linux cooked capture
Internet Protocol Version 4, Src: 184.173.161.162 (184.173.161.162), Dst: 10.163.108.219 (10.163.108.219)
Transmission Control Protocol, Src Port: https (443), Dst Port: 55191 (55191), Seq: 0, Ack: 1, Len: 0

No.     Time        Source                Destination           Protocol Length Info
     25 8.036581    10.163.108.219        184.173.161.162       TCP      68     55191 > https [ACK] Seq=1 Ack=1 Win=5240 Len=0 TSval=1178769 TSecr=713384060

Frame 25: 68 bytes on wire (544 bits), 68 bytes captured (544 bits)
Linux cooked capture
Internet Protocol Version 4, Src: 10.163.108.219 (10.163.108.219), Dst: 184.173.161.162 (184.173.161.162)
Transmission Control Protocol, Src Port: 55191 (55191), Dst Port: https (443), Seq: 1, Ack: 1, Len: 0

No.     Time        Source                Destination           Protocol Length Info
     26 8.315403    184.173.161.162       10.163.108.219        TCP      68     [TCP Window Update] https > 55191 [ACK] Seq=1 Ack=1 Win=262144 Len=0 TSval=713384340 TSecr=1178769

Frame 26: 68 bytes on wire (544 bits), 68 bytes captured (544 bits)
Linux cooked capture
Internet Protocol Version 4, Src: 184.173.161.162 (184.173.161.162), Dst: 10.163.108.219 (10.163.108.219)
Transmission Control Protocol, Src Port: https (443), Dst Port: 55191 (55191), Seq: 1, Ack: 1, Len: 0

No.     Time        Source                Destination           Protocol Length Info
     27 8.594035    10.163.108.219        184.173.161.162       SSL      189    Continuation Data

Frame 27: 189 bytes on wire (1512 bits), 189 bytes captured (1512 bits)
Linux cooked capture
Internet Protocol Version 4, Src: 10.163.108.219 (10.163.108.219), Dst: 184.173.161.162 (184.173.161.162)
Transmission Control Protocol, Src Port: 55191 (55191), Dst Port: https (443), Seq: 1, Ack: 1, Len: 121
Secure Sockets Layer

No.     Time        Source                Destination           Protocol Length Info
     28 8.905345    184.173.161.162       10.163.108.219        SSL      157    Continuation Data

Frame 28: 157 bytes on wire (1256 bits), 157 bytes captured (1256 bits)
Linux cooked capture
Internet Protocol Version 4, Src: 184.173.161.162 (184.173.161.162), Dst: 10.163.108.219 (10.163.108.219)
Transmission Control Protocol, Src Port: https (443), Dst Port: 55191 (55191), Seq: 1, Ack: 122, Len: 89
Secure Sockets Layer

No.     Time        Source                Destination           Protocol Length Info
     29 8.905728    10.163.108.219        184.173.161.162       TCP      68     55191 > https [ACK] Seq=122 Ack=90 Win=5240 Len=0 TSval=1178856 TSecr=713384941

Frame 29: 68 bytes on wire (544 bits), 68 bytes captured (544 bits)
Linux cooked capture
Internet Protocol Version 4, Src: 10.163.108.219 (10.163.108.219), Dst: 184.173.161.162 (184.173.161.162)
Transmission Control Protocol, Src Port: 55191 (55191), Dst Port: https (443), Seq: 122, Ack: 90, Len: 0

No.     Time        Source                Destination           Protocol Length Info
     30 8.911408    10.163.108.219        184.173.161.162       SSL      97     Continuation Data

Frame 30: 97 bytes on wire (776 bits), 97 bytes captured (776 bits)
Linux cooked capture
Internet Protocol Version 4, Src: 10.163.108.219 (10.163.108.219), Dst: 184.173.161.162 (184.173.161.162)
Transmission Control Protocol, Src Port: 55191 (55191), Dst Port: https (443), Seq: 122, Ack: 90, Len: 29
Secure Sockets Layer

No.     Time        Source                Destination           Protocol Length Info
     31 8.965331    184.173.161.162       10.163.108.219        SSL      89     Continuation Data

Frame 31: 89 bytes on wire (712 bits), 89 bytes captured (712 bits)
Linux cooked capture
Internet Protocol Version 4, Src: 184.173.161.162 (184.173.161.162), Dst: 10.163.108.219 (10.163.108.219)
Transmission Control Protocol, Src Port: https (443), Dst Port: 55191 (55191), Seq: 90, Ack: 122, Len: 21
Secure Sockets Layer

No.     Time        Source                Destination           Protocol Length Info
     32 8.999843    10.163.108.219        184.173.161.162       TCP      68     55191 > https [ACK] Seq=151 Ack=111 Win=5240 Len=0 TSval=1178866 TSecr=713384990

Frame 32: 68 bytes on wire (544 bits), 68 bytes captured (544 bits)
Linux cooked capture
Internet Protocol Version 4, Src: 10.163.108.219 (10.163.108.219), Dst: 184.173.161.162 (184.173.161.162)
Transmission Control Protocol, Src Port: 55191 (55191), Dst Port: https (443), Seq: 151, Ack: 111, Len: 0

No.     Time        Source                Destination           Protocol Length Info
     33 9.225500    184.173.161.162       10.163.108.219        TCP      68     https > 55191 [ACK] Seq=111 Ack=151 Win=262144 Len=0 TSval=713385250 TSecr=1178857

Frame 33: 68 bytes on wire (544 bits), 68 bytes captured (544 bits)
Linux cooked capture
Internet Protocol Version 4, Src: 184.173.161.162 (184.173.161.162), Dst: 10.163.108.219 (10.163.108.219)
Transmission Control Protocol, Src Port: https (443), Dst Port: 55191 (55191), Seq: 111, Ack: 151, Len: 0

No.     Time        Source                Destination           Protocol Length Info
     34 9.225868    10.163.108.219        184.173.161.162       SSL      121    Continuation Data

Frame 34: 121 bytes on wire (968 bits), 121 bytes captured (968 bits)
Linux cooked capture
Internet Protocol Version 4, Src: 10.163.108.219 (10.163.108.219), Dst: 184.173.161.162 (184.173.161.162)
Transmission Control Protocol, Src Port: 55191 (55191), Dst Port: https (443), Seq: 151, Ack: 111, Len: 53
Secure Sockets Layer

No.     Time        Source                Destination           Protocol Length Info
     35 9.515570    184.173.161.162       10.163.108.219        SSL      109    Continuation Data

Frame 35: 109 bytes on wire (872 bits), 109 bytes captured (872 bits)
Linux cooked capture
Internet Protocol Version 4, Src: 184.173.161.162 (184.173.161.162), Dst: 10.163.108.219 (10.163.108.219)
Transmission Control Protocol, Src Port: https (443), Dst Port: 55191 (55191), Seq: 111, Ack: 204, Len: 41
Secure Sockets Layer

No.     Time        Source                Destination           Protocol Length Info
     36 9.516141    10.163.108.219        184.173.161.162       TCP      68     55191 > https [ACK] Seq=204 Ack=152 Win=5240 Len=0 TSval=1178917 TSecr=713385540

Frame 36: 68 bytes on wire (544 bits), 68 bytes captured (544 bits)
Linux cooked capture
Internet Protocol Version 4, Src: 10.163.108.219 (10.163.108.219), Dst: 184.173.161.162 (184.173.161.162)
Transmission Control Protocol, Src Port: 55191 (55191), Dst Port: https (443), Seq: 204, Ack: 152, Len: 0

No.     Time        Source                Destination           Protocol Length Info
     37 9.525371    184.173.161.162       10.163.108.219        SSL      237    Continuation Data

Frame 37: 237 bytes on wire (1896 bits), 237 bytes captured (1896 bits)
Linux cooked capture
Internet Protocol Version 4, Src: 184.173.161.162 (184.173.161.162), Dst: 10.163.108.219 (10.163.108.219)
Transmission Control Protocol, Src Port: https (443), Dst Port: 55191 (55191), Seq: 152, Ack: 204, Len: 169
Secure Sockets Layer

No.     Time        Source                Destination           Protocol Length Info
     38 9.525710    10.163.108.219        184.173.161.162       TCP      68     55191 > https [ACK] Seq=204 Ack=321 Win=6312 Len=0 TSval=1178918 TSecr=713385548

Frame 38: 68 bytes on wire (544 bits), 68 bytes captured (544 bits)
Linux cooked capture
Internet Protocol Version 4, Src: 10.163.108.219 (10.163.108.219), Dst: 184.173.161.162 (184.173.161.162)
Transmission Control Protocol, Src Port: 55191 (55191), Dst Port: https (443), Seq: 204, Ack: 321, Len: 0

No.     Time        Source                Destination           Protocol Length Info
     39 9.615768    10.163.108.219        130.186.6.177         TLSv1    113    Application Data

Frame 39: 113 bytes on wire (904 bits), 113 bytes captured (904 bits)
Linux cooked capture
Internet Protocol Version 4, Src: 10.163.108.219 (10.163.108.219), Dst: 130.186.6.177 (130.186.6.177)
Transmission Control Protocol, Src Port: 49561 (49561), Dst Port: imaps (993), Seq: 303, Ack: 5241, Len: 45
Secure Sockets Layer

No.     Time        Source                Destination           Protocol Length Info
     40 9.825385    130.186.6.177         10.163.108.219        TCP      68     imaps > 49561 [ACK] Seq=5241 Ack=348 Win=54 Len=0 TSval=2274266925 TSecr=1178927

Frame 40: 68 bytes on wire (544 bits), 68 bytes captured (544 bits)
Linux cooked capture
Internet Protocol Version 4, Src: 130.186.6.177 (130.186.6.177), Dst: 10.163.108.219 (10.163.108.219)
Transmission Control Protocol, Src Port: imaps (993), Dst Port: 49561 (49561), Seq: 5241, Ack: 348, Len: 0

No.     Time        Source                Destination           Protocol Length Info
     41 9.825695    130.186.6.177         10.163.108.219        TLSv1    369    Application Data

Frame 41: 369 bytes on wire (2952 bits), 369 bytes captured (2952 bits)
Linux cooked capture
Internet Protocol Version 4, Src: 130.186.6.177 (130.186.6.177), Dst: 10.163.108.219 (10.163.108.219)
Transmission Control Protocol, Src Port: imaps (993), Dst Port: 49561 (49561), Seq: 5241, Ack: 348, Len: 301
Secure Sockets Layer

No.     Time        Source                Destination           Protocol Length Info
     42 9.825803    10.163.108.219        130.186.6.177         TCP      68     49561 > imaps [ACK] Seq=348 Ack=5542 Win=4555 Len=0 TSval=1178948 TSecr=2274266925

Frame 42: 68 bytes on wire (544 bits), 68 bytes captured (544 bits)
Linux cooked capture
Internet Protocol Version 4, Src: 10.163.108.219 (10.163.108.219), Dst: 130.186.6.177 (130.186.6.177)
Transmission Control Protocol, Src Port: 49561 (49561), Dst Port: imaps (993), Seq: 348, Ack: 5542, Len: 0

No.     Time        Source                Destination           Protocol Length Info
     43 9.871083    10.163.108.219        130.186.6.177         TLSv1    113    Application Data

Frame 43: 113 bytes on wire (904 bits), 113 bytes captured (904 bits)
Linux cooked capture
Internet Protocol Version 4, Src: 10.163.108.219 (10.163.108.219), Dst: 130.186.6.177 (130.186.6.177)
Transmission Control Protocol, Src Port: 49561 (49561), Dst Port: imaps (993), Seq: 348, Ack: 5542, Len: 45
Secure Sockets Layer

No.     Time        Source                Destination           Protocol Length Info
     44 10.065398   130.186.6.177         10.163.108.219        TLSv1    369    Application Data

Frame 44: 369 bytes on wire (2952 bits), 369 bytes captured (2952 bits)
Linux cooked capture
Internet Protocol Version 4, Src: 130.186.6.177 (130.186.6.177), Dst: 10.163.108.219 (10.163.108.219)
Transmission Control Protocol, Src Port: imaps (993), Dst Port: 49561 (49561), Seq: 5542, Ack: 393, Len: 301
Secure Sockets Layer

No.     Time        Source                Destination           Protocol Length Info
     45 10.065646   10.163.108.219        130.186.6.177         TCP      68     49561 > imaps [ACK] Seq=393 Ack=5843 Win=5204 Len=0 TSval=1178972 TSecr=2274267166

Frame 45: 68 bytes on wire (544 bits), 68 bytes captured (544 bits)
Linux cooked capture
Internet Protocol Version 4, Src: 10.163.108.219 (10.163.108.219), Dst: 130.186.6.177 (130.186.6.177)
Transmission Control Protocol, Src Port: 49561 (49561), Dst Port: imaps (993), Seq: 393, Ack: 5843, Len: 0

No.     Time        Source                Destination           Protocol Length Info
     46 10.249010   10.163.108.219        83.224.70.77          DNS      77     Standard query 0x7750  A csi.gstatic.com

Frame 46: 77 bytes on wire (616 bits), 77 bytes captured (616 bits)
Linux cooked capture
Internet Protocol Version 4, Src: 10.163.108.219 (10.163.108.219), Dst: 83.224.70.77 (83.224.70.77)
User Datagram Protocol, Src Port: 31586 (31586), Dst Port: domain (53)
Domain Name System (query)

No.     Time        Source                Destination           Protocol Length Info
     47 10.312038   10.163.108.219        184.173.161.162       SSL      80     Continuation Data

Frame 47: 80 bytes on wire (640 bits), 80 bytes captured (640 bits)
Linux cooked capture
Internet Protocol Version 4, Src: 10.163.108.219 (10.163.108.219), Dst: 184.173.161.162 (184.173.161.162)
Transmission Control Protocol, Src Port: 55191 (55191), Dst Port: https (443), Seq: 204, Ack: 321, Len: 12
Secure Sockets Layer

No.     Time        Source                Destination           Protocol Length Info
     48 10.375345   83.224.70.77          10.163.108.219        DNS      141    Standard query response 0x7750  A 173.194.38.56 A 173.194.38.55 A 173.194.38.63 A 173.194.38.47

Frame 48: 141 bytes on wire (1128 bits), 141 bytes captured (1128 bits)
Linux cooked capture
Internet Protocol Version 4, Src: 83.224.70.77 (83.224.70.77), Dst: 10.163.108.219 (10.163.108.219)
User Datagram Protocol, Src Port: domain (53), Dst Port: 31586 (31586)
Domain Name System (response)

No.     Time        Source                Destination           Protocol Length Info
     49 10.376883   10.163.108.219        173.194.38.56         TCP      76     43317 > http [SYN] Seq=0 Win=5240 Len=0 MSS=1310 SACK_PERM=1 TSval=1179003 TSecr=0 WS=4

Frame 49: 76 bytes on wire (608 bits), 76 bytes captured (608 bits)
Linux cooked capture
Internet Protocol Version 4, Src: 10.163.108.219 (10.163.108.219), Dst: 173.194.38.56 (173.194.38.56)
Transmission Control Protocol, Src Port: 43317 (43317), Dst Port: http (80), Seq: 0, Len: 0

No.     Time        Source                Destination           Protocol Length Info
     50 10.424948   10.163.108.219        130.186.6.177         TLSv1    145    Application Data

Frame 50: 145 bytes on wire (1160 bits), 145 bytes captured (1160 bits)
Linux cooked capture
Internet Protocol Version 4, Src: 10.163.108.219 (10.163.108.219), Dst: 130.186.6.177 (130.186.6.177)
Transmission Control Protocol, Src Port: 49561 (49561), Dst Port: imaps (993), Seq: 393, Ack: 5843, Len: 77
Secure Sockets Layer

No.     Time        Source                Destination           Protocol Length Info
     51 10.535396   173.194.38.56         10.163.108.219        TCP      80     http > 43317 [SYN, ACK] Seq=0 Ack=1 Win=64251 Len=0 TSval=1631313287 TSecr=1179003 MSS=1400 WS=4 SACK_PERM=1

Frame 51: 80 bytes on wire (640 bits), 80 bytes captured (640 bits)
Linux cooked capture
Internet Protocol Version 4, Src: 173.194.38.56 (173.194.38.56), Dst: 10.163.108.219 (10.163.108.219)
Transmission Control Protocol, Src Port: http (80), Dst Port: 43317 (43317), Seq: 0, Ack: 1, Len: 0

No.     Time        Source                Destination           Protocol Length Info
     52 10.535710   10.163.108.219        173.194.38.56         TCP      68     43317 > http [ACK] Seq=1 Ack=1 Win=5240 Len=0 TSval=1179019 TSecr=1631313287

Frame 52: 68 bytes on wire (544 bits), 68 bytes captured (544 bits)
Linux cooked capture
Internet Protocol Version 4, Src: 10.163.108.219 (10.163.108.219), Dst: 173.194.38.56 (173.194.38.56)
Transmission Control Protocol, Src Port: 43317 (43317), Dst Port: http (80), Seq: 1, Ack: 1, Len: 0

No.     Time        Source                Destination           Protocol Length Info
     53 10.537855   10.163.108.219        173.194.38.56         HTTP     1216   GET /csi?v=3&s=gmob&action=&rt=crf.22462,cri.26562 HTTP/1.1 

Frame 53: 1216 bytes on wire (9728 bits), 1216 bytes captured (9728 bits)
Linux cooked capture
Internet Protocol Version 4, Src: 10.163.108.219 (10.163.108.219), Dst: 173.194.38.56 (173.194.38.56)
Transmission Control Protocol, Src Port: 43317 (43317), Dst Port: http (80), Seq: 1, Ack: 1, Len: 1148
Hypertext Transfer Protocol

No.     Time        Source                Destination           Protocol Length Info
     54 10.555298   184.173.161.162       10.163.108.219        SSL      95     Continuation Data

Frame 54: 95 bytes on wire (760 bits), 95 bytes captured (760 bits)
Linux cooked capture
Internet Protocol Version 4, Src: 184.173.161.162 (184.173.161.162), Dst: 10.163.108.219 (10.163.108.219)
Transmission Control Protocol, Src Port: https (443), Dst Port: 55191 (55191), Seq: 321, Ack: 216, Len: 27
Secure Sockets Layer

No.     Time        Source                Destination           Protocol Length Info
     55 10.555600   10.163.108.219        184.173.161.162       SSL      93     Continuation Data

Frame 55: 93 bytes on wire (744 bits), 93 bytes captured (744 bits)
Linux cooked capture
Internet Protocol Version 4, Src: 10.163.108.219 (10.163.108.219), Dst: 184.173.161.162 (184.173.161.162)
Transmission Control Protocol, Src Port: 55191 (55191), Dst Port: https (443), Seq: 216, Ack: 348, Len: 25
Secure Sockets Layer

No.     Time        Source                Destination           Protocol Length Info
     56 10.635383   130.186.6.177         10.163.108.219        TLSv1    393    Application Data

Frame 56: 393 bytes on wire (3144 bits), 393 bytes captured (3144 bits)
Linux cooked capture
Internet Protocol Version 4, Src: 130.186.6.177 (130.186.6.177), Dst: 10.163.108.219 (10.163.108.219)
Transmission Control Protocol, Src Port: imaps (993), Dst Port: 49561 (49561), Seq: 5843, Ack: 470, Len: 325
Secure Sockets Layer

No.     Time        Source                Destination           Protocol Length Info
     57 10.635625   10.163.108.219        130.186.6.177         TCP      68     49561 > imaps [ACK] Seq=470 Ack=6168 Win=5853 Len=0 TSval=1179029 TSecr=2274267734

Frame 57: 68 bytes on wire (544 bits), 68 bytes captured (544 bits)
Linux cooked capture
Internet Protocol Version 4, Src: 10.163.108.219 (10.163.108.219), Dst: 130.186.6.177 (130.186.6.177)
Transmission Control Protocol, Src Port: 49561 (49561), Dst Port: imaps (993), Seq: 470, Ack: 6168, Len: 0

No.     Time        Source                Destination           Protocol Length Info
     58 10.704953   10.163.108.219        130.186.6.177         TLSv1    113    Application Data

Frame 58: 113 bytes on wire (904 bits), 113 bytes captured (904 bits)
Linux cooked capture
Internet Protocol Version 4, Src: 10.163.108.219 (10.163.108.219), Dst: 130.186.6.177 (130.186.6.177)
Transmission Control Protocol, Src Port: 49561 (49561), Dst Port: imaps (993), Seq: 470, Ack: 6168, Len: 45
Secure Sockets Layer

No.     Time        Source                Destination           Protocol Length Info
     59 11.009880   10.163.108.219        173.194.38.56         HTTP     1216   [TCP Retransmission] GET /csi?v=3&s=gmob&action=&rt=crf.22462,cri.26562 HTTP/1.1 

Frame 59: 1216 bytes on wire (9728 bits), 1216 bytes captured (9728 bits)
Linux cooked capture
Internet Protocol Version 4, Src: 10.163.108.219 (10.163.108.219), Dst: 173.194.38.56 (173.194.38.56)
Transmission Control Protocol, Src Port: 43317 (43317), Dst Port: http (80), Seq: 1, Ack: 1, Len: 1148
Hypertext Transfer Protocol

No.     Time        Source                Destination           Protocol Length Info
     60 11.249878   10.163.108.219        184.173.161.162       SSL      93     [TCP Retransmission] Continuation Data

Frame 60: 93 bytes on wire (744 bits), 93 bytes captured (744 bits)
Linux cooked capture
Internet Protocol Version 4, Src: 10.163.108.219 (10.163.108.219), Dst: 184.173.161.162 (184.173.161.162)
Transmission Control Protocol, Src Port: 55191 (55191), Dst Port: https (443), Seq: 216, Ack: 348, Len: 25
Secure Sockets Layer

No.     Time        Source                Destination           Protocol Length Info
     61 11.265328   184.173.161.162       10.163.108.219        SSL      95     [TCP Retransmission] Continuation Data

Frame 61: 95 bytes on wire (760 bits), 95 bytes captured (760 bits)
Linux cooked capture
Internet Protocol Version 4, Src: 184.173.161.162 (184.173.161.162), Dst: 10.163.108.219 (10.163.108.219)
Transmission Control Protocol, Src Port: https (443), Dst Port: 55191 (55191), Seq: 321, Ack: 216, Len: 27
Secure Sockets Layer

No.     Time        Source                Destination           Protocol Length Info
     62 11.265678   10.163.108.219        184.173.161.162       TCP      80     [TCP Dup ACK 60#1] 55191 > https [ACK] Seq=241 Ack=348 Win=6312 Len=0 TSval=1179092 TSecr=713387298 SLE=321 SRE=348

Frame 62: 80 bytes on wire (640 bits), 80 bytes captured (640 bits)
Linux cooked capture
Internet Protocol Version 4, Src: 10.163.108.219 (10.163.108.219), Dst: 184.173.161.162 (184.173.161.162)
Transmission Control Protocol, Src Port: 55191 (55191), Dst Port: https (443), Seq: 241, Ack: 348, Len: 0

No.     Time        Source                Destination           Protocol Length Info
     63 11.325323   173.194.38.56         10.163.108.219        TCP      68     http > 43317 [ACK] Seq=1 Ack=1149 Win=257004 Len=0 TSval=1631313367 TSecr=1179019

Frame 63: 68 bytes on wire (544 bits), 68 bytes captured (544 bits)
Linux cooked capture
Internet Protocol Version 4, Src: 173.194.38.56 (173.194.38.56), Dst: 10.163.108.219 (10.163.108.219)
Transmission Control Protocol, Src Port: http (80), Dst Port: 43317 (43317), Seq: 1, Ack: 1149, Len: 0

No.     Time        Source                Destination           Protocol Length Info
     64 11.475343   184.173.161.162       10.163.108.219        SSL      86     Continuation Data

Frame 64: 86 bytes on wire (688 bits), 86 bytes captured (688 bits)
Linux cooked capture
Internet Protocol Version 4, Src: 184.173.161.162 (184.173.161.162), Dst: 10.163.108.219 (10.163.108.219)
Transmission Control Protocol, Src Port: https (443), Dst Port: 55191 (55191), Seq: 348, Ack: 241, Len: 18
Secure Sockets Layer

No.     Time        Source                Destination           Protocol Length Info
     65 11.475745   10.163.108.219        184.173.161.162       TCP      68     55191 > https [ACK] Seq=241 Ack=366 Win=6312 Len=0 TSval=1179113 TSecr=713387500

Frame 65: 68 bytes on wire (544 bits), 68 bytes captured (544 bits)
Linux cooked capture
Internet Protocol Version 4, Src: 10.163.108.219 (10.163.108.219), Dst: 184.173.161.162 (184.173.161.162)
Transmission Control Protocol, Src Port: 55191 (55191), Dst Port: https (443), Seq: 241, Ack: 366, Len: 0

No.     Time        Source                Destination           Protocol Length Info
     66 11.515555   130.186.6.177         10.163.108.219        TLSv1    1329   Application Data

Frame 66: 1329 bytes on wire (10632 bits), 1329 bytes captured (10632 bits)
Linux cooked capture
Internet Protocol Version 4, Src: 130.186.6.177 (130.186.6.177), Dst: 10.163.108.219 (10.163.108.219)
Transmission Control Protocol, Src Port: imaps (993), Dst Port: 49561 (49561), Seq: 6168, Ack: 515, Len: 1261
Secure Sockets Layer

No.     Time        Source                Destination           Protocol Length Info
     67 11.515825   10.163.108.219        130.186.6.177         TCP      68     49561 > imaps [ACK] Seq=515 Ack=7429 Win=6502 Len=0 TSval=1179117 TSecr=2274268606

Frame 67: 68 bytes on wire (544 bits), 68 bytes captured (544 bits)
Linux cooked capture
Internet Protocol Version 4, Src: 10.163.108.219 (10.163.108.219), Dst: 130.186.6.177 (130.186.6.177)
Transmission Control Protocol, Src Port: 49561 (49561), Dst Port: imaps (993), Seq: 515, Ack: 7429, Len: 0

No.     Time        Source                Destination           Protocol Length Info
     68 11.560258   10.163.108.219        69.171.248.65         TCP      68     47925 > https [FIN, ACK] Seq=1 Ack=1 Win=9233 Len=0 TSval=1179122 TSecr=939305321

Frame 68: 68 bytes on wire (544 bits), 68 bytes captured (544 bits)
Linux cooked capture
Internet Protocol Version 4, Src: 10.163.108.219 (10.163.108.219), Dst: 69.171.248.65 (69.171.248.65)
Transmission Control Protocol, Src Port: 47925 (47925), Dst Port: https (443), Seq: 1, Ack: 1, Len: 0

No.     Time        Source                Destination           Protocol Length Info
     69 11.568256   10.163.108.219        31.13.86.65           TCP      68     38536 > https [RST, ACK] Seq=1 Ack=1 Win=4555 Len=0 TSval=1179122 TSecr=2739465340

Frame 69: 68 bytes on wire (544 bits), 68 bytes captured (544 bits)
Linux cooked capture
Internet Protocol Version 4, Src: 10.163.108.219 (10.163.108.219), Dst: 31.13.86.65 (31.13.86.65)
Transmission Control Protocol, Src Port: 38536 (38536), Dst Port: https (443), Seq: 1, Ack: 1, Len: 0

No.     Time        Source                Destination           Protocol Length Info
     70 11.905416   173.194.38.56         10.163.108.219        HTTP     443    HTTP/1.1 204 No Content 

Frame 70: 443 bytes on wire (3544 bits), 443 bytes captured (3544 bits)
Linux cooked capture
Internet Protocol Version 4, Src: 173.194.38.56 (173.194.38.56), Dst: 10.163.108.219 (10.163.108.219)
Transmission Control Protocol, Src Port: http (80), Dst Port: 43317 (43317), Seq: 1, Ack: 1149, Len: 375
Hypertext Transfer Protocol

No.     Time        Source                Destination           Protocol Length Info
     71 12.049898   10.163.108.219        173.194.38.56         TCP      68     43317 > http [ACK] Seq=1149 Ack=376 Win=7836 Len=0 TSval=1179171 TSecr=1631313423

Frame 71: 68 bytes on wire (544 bits), 68 bytes captured (544 bits)
Linux cooked capture
Internet Protocol Version 4, Src: 10.163.108.219 (10.163.108.219), Dst: 173.194.38.56 (173.194.38.56)
Transmission Control Protocol, Src Port: 43317 (43317), Dst Port: http (80), Seq: 1149, Ack: 376, Len: 0

No.     Time        Source                Destination           Protocol Length Info
     72 12.165336   173.194.38.56         10.163.108.219        TCP      68     [TCP Dup ACK 70#1] http > 43317 [ACK] Seq=376 Ack=1149 Win=257004 Len=0 TSval=1631313451 TSecr=1179019

Frame 72: 68 bytes on wire (544 bits), 68 bytes captured (544 bits)
Linux cooked capture
Internet Protocol Version 4, Src: 173.194.38.56 (173.194.38.56), Dst: 10.163.108.219 (10.163.108.219)
Transmission Control Protocol, Src Port: http (80), Dst Port: 43317 (43317), Seq: 376, Ack: 1149, Len: 0

No.     Time        Source                Destination           Protocol Length Info
     73 12.445360   69.171.248.65         10.163.108.219        TCP      68     https > 47925 [ACK] Seq=1 Ack=2 Win=122 Len=0 TSval=939353968 TSecr=1179122

Frame 73: 68 bytes on wire (544 bits), 68 bytes captured (544 bits)
Linux cooked capture
Internet Protocol Version 4, Src: 69.171.248.65 (69.171.248.65), Dst: 10.163.108.219 (10.163.108.219)
Transmission Control Protocol, Src Port: https (443), Dst Port: 47925 (47925), Seq: 1, Ack: 2, Len: 0

No.     Time        Source                Destination           Protocol Length Info
     74 12.445688   69.171.248.65         10.163.108.219        TLSv1    95     Encrypted Alert

Frame 74: 95 bytes on wire (760 bits), 95 bytes captured (760 bits)
Linux cooked capture
Internet Protocol Version 4, Src: 69.171.248.65 (69.171.248.65), Dst: 10.163.108.219 (10.163.108.219)
Transmission Control Protocol, Src Port: https (443), Dst Port: 47925 (47925), Seq: 1, Ack: 2, Len: 27
Secure Sockets Layer

No.     Time        Source                Destination           Protocol Length Info
     75 12.445818   10.163.108.219        69.171.248.65         TCP      56     47925 > https [RST] Seq=2 Win=0 Len=0

