No.     Time        Source                Destination           Protocol Length Info
      1 0.000000    10.163.108.219        173.194.44.57         TCP      68     56509 > http [FIN, ACK] Seq=1 Ack=1 Win=2920 Len=0 TSval=5167407 TSecr=1635300952

Frame 1: 68 bytes on wire (544 bits), 68 bytes captured (544 bits)
Linux cooked capture
Internet Protocol Version 4, Src: 10.163.108.219 (10.163.108.219), Dst: 173.194.44.57 (173.194.44.57)
Transmission Control Protocol, Src Port: 56509 (56509), Dst Port: http (80), Seq: 1, Ack: 1, Len: 0

No.     Time        Source                Destination           Protocol Length Info
      2 0.110913    173.194.44.57         10.163.108.219        TCP      68     http > 56509 [ACK] Seq=1 Ack=2 Win=64251 Len=0 TSval=1635301745 TSecr=5167407

Frame 2: 68 bytes on wire (544 bits), 68 bytes captured (544 bits)
Linux cooked capture
Internet Protocol Version 4, Src: 173.194.44.57 (173.194.44.57), Dst: 10.163.108.219 (10.163.108.219)
Transmission Control Protocol, Src Port: http (80), Dst Port: 56509 (56509), Seq: 1, Ack: 2, Len: 0

No.     Time        Source                Destination           Protocol Length Info
      3 0.111238    173.194.44.57         10.163.108.219        TCP      68     http > 56509 [FIN, ACK] Seq=1 Ack=2 Win=64251 Len=0 TSval=1635301745 TSecr=5167407

Frame 3: 68 bytes on wire (544 bits), 68 bytes captured (544 bits)
Linux cooked capture
Internet Protocol Version 4, Src: 173.194.44.57 (173.194.44.57), Dst: 10.163.108.219 (10.163.108.219)
Transmission Control Protocol, Src Port: http (80), Dst Port: 56509 (56509), Seq: 1, Ack: 2, Len: 0

No.     Time        Source                Destination           Protocol Length Info
      4 0.111358    10.163.108.219        173.194.44.57         TCP      68     56509 > http [ACK] Seq=2 Ack=2 Win=2920 Len=0 TSval=5167418 TSecr=1635301745

Frame 4: 68 bytes on wire (544 bits), 68 bytes captured (544 bits)
Linux cooked capture
Internet Protocol Version 4, Src: 10.163.108.219 (10.163.108.219), Dst: 173.194.44.57 (173.194.44.57)
Transmission Control Protocol, Src Port: 56509 (56509), Dst Port: http (80), Seq: 2, Ack: 2, Len: 0

No.     Time        Source                Destination           Protocol Length Info
      5 2.004562    10.163.108.219        68.232.35.139         TCP      68     50020 > http [FIN, ACK] Seq=1 Ack=1 Win=2009 Len=0 TSval=5167608 TSecr=1635301039

Frame 5: 68 bytes on wire (544 bits), 68 bytes captured (544 bits)
Linux cooked capture
Internet Protocol Version 4, Src: 10.163.108.219 (10.163.108.219), Dst: 68.232.35.139 (68.232.35.139)
Transmission Control Protocol, Src Port: 50020 (50020), Dst Port: http (80), Seq: 1, Ack: 1, Len: 0

No.     Time        Source                Destination           Protocol Length Info
      6 2.150540    68.232.35.139         10.163.108.219        TCP      68     http > 50020 [ACK] Seq=1 Ack=2 Win=64251 Len=0 TSval=1635301949 TSecr=5167608

Frame 6: 68 bytes on wire (544 bits), 68 bytes captured (544 bits)
Linux cooked capture
Internet Protocol Version 4, Src: 68.232.35.139 (68.232.35.139), Dst: 10.163.108.219 (10.163.108.219)
Transmission Control Protocol, Src Port: http (80), Dst Port: 50020 (50020), Seq: 1, Ack: 2, Len: 0

No.     Time        Source                Destination           Protocol Length Info
      7 2.150865    68.232.35.139         10.163.108.219        TCP      68     http > 50020 [FIN, ACK] Seq=1 Ack=2 Win=64251 Len=0 TSval=1635301949 TSecr=5167608

Frame 7: 68 bytes on wire (544 bits), 68 bytes captured (544 bits)
Linux cooked capture
Internet Protocol Version 4, Src: 68.232.35.139 (68.232.35.139), Dst: 10.163.108.219 (10.163.108.219)
Transmission Control Protocol, Src Port: http (80), Dst Port: 50020 (50020), Seq: 1, Ack: 2, Len: 0

No.     Time        Source                Destination           Protocol Length Info
      8 2.150973    10.163.108.219        68.232.35.139         TCP      68     50020 > http [ACK] Seq=2 Ack=2 Win=2009 Len=0 TSval=5167622 TSecr=1635301949

Frame 8: 68 bytes on wire (544 bits), 68 bytes captured (544 bits)
Linux cooked capture
Internet Protocol Version 4, Src: 10.163.108.219 (10.163.108.219), Dst: 68.232.35.139 (68.232.35.139)
Transmission Control Protocol, Src Port: 50020 (50020), Dst Port: http (80), Seq: 2, Ack: 2, Len: 0

No.     Time        Source                Destination           Protocol Length Info
      9 2.761820    10.163.108.219        83.224.70.77          DNS      77     Standard query 0x13ca  A csi.gstatic.com

Frame 9: 77 bytes on wire (616 bits), 77 bytes captured (616 bits)
Linux cooked capture
Internet Protocol Version 4, Src: 10.163.108.219 (10.163.108.219), Dst: 83.224.70.77 (83.224.70.77)
User Datagram Protocol, Src Port: 6045 (6045), Dst Port: domain (53)
Domain Name System (query)

No.     Time        Source                Destination           Protocol Length Info
     10 2.891212    83.224.70.77          10.163.108.219        DNS      141    Standard query response 0x13ca  A 74.125.228.79 A 74.125.228.87 A 74.125.228.95 A 74.125.228.88

Frame 10: 141 bytes on wire (1128 bits), 141 bytes captured (1128 bits)
Linux cooked capture
Internet Protocol Version 4, Src: 83.224.70.77 (83.224.70.77), Dst: 10.163.108.219 (10.163.108.219)
User Datagram Protocol, Src Port: domain (53), Dst Port: 6045 (6045)
Domain Name System (response)

No.     Time        Source                Destination           Protocol Length Info
     11 2.892737    10.163.108.219        74.125.228.79         TCP      76     59179 > http [SYN] Seq=0 Win=3930 Len=0 MSS=1310 SACK_PERM=1 TSval=5167696 TSecr=0 WS=2

Frame 11: 76 bytes on wire (608 bits), 76 bytes captured (608 bits)
Linux cooked capture
Internet Protocol Version 4, Src: 10.163.108.219 (10.163.108.219), Dst: 74.125.228.79 (74.125.228.79)
Transmission Control Protocol, Src Port: 59179 (59179), Dst Port: http (80), Seq: 0, Len: 0

No.     Time        Source                Destination           Protocol Length Info
     12 2.967750    10.163.108.219        74.125.228.79         TCP      76     57115 > http [SYN] Seq=0 Win=3930 Len=0 MSS=1310 SACK_PERM=1 TSval=5167704 TSecr=0 WS=2

Frame 12: 76 bytes on wire (608 bits), 76 bytes captured (608 bits)
Linux cooked capture
Internet Protocol Version 4, Src: 10.163.108.219 (10.163.108.219), Dst: 74.125.228.79 (74.125.228.79)
Transmission Control Protocol, Src Port: 57115 (57115), Dst Port: http (80), Seq: 0, Len: 0

No.     Time        Source                Destination           Protocol Length Info
     13 3.050890    74.125.228.79         10.163.108.219        TCP      80     http > 59179 [SYN, ACK] Seq=0 Ack=1 Win=64251 Len=0 TSval=1635302041 TSecr=5167696 MSS=1400 WS=4 SACK_PERM=1

Frame 13: 80 bytes on wire (640 bits), 80 bytes captured (640 bits)
Linux cooked capture
Internet Protocol Version 4, Src: 74.125.228.79 (74.125.228.79), Dst: 10.163.108.219 (10.163.108.219)
Transmission Control Protocol, Src Port: http (80), Dst Port: 59179 (59179), Seq: 0, Ack: 1, Len: 0

No.     Time        Source                Destination           Protocol Length Info
     14 3.051210    10.163.108.219        74.125.228.79         TCP      68     59179 > http [ACK] Seq=1 Ack=1 Win=3930 Len=0 TSval=5167712 TSecr=1635302041

Frame 14: 68 bytes on wire (544 bits), 68 bytes captured (544 bits)
Linux cooked capture
Internet Protocol Version 4, Src: 10.163.108.219 (10.163.108.219), Dst: 74.125.228.79 (74.125.228.79)
Transmission Control Protocol, Src Port: 59179 (59179), Dst Port: http (80), Seq: 1, Ack: 1, Len: 0

No.     Time        Source                Destination           Protocol Length Info
     15 3.054030    10.163.108.219        74.125.228.79         HTTP     1177   GET /csi?v=3&s=gmob&action=&rt=crf.6560,cri.12294 HTTP/1.1 

Frame 15: 1177 bytes on wire (9416 bits), 1177 bytes captured (9416 bits)
Linux cooked capture
Internet Protocol Version 4, Src: 10.163.108.219 (10.163.108.219), Dst: 74.125.228.79 (74.125.228.79)
Transmission Control Protocol, Src Port: 59179 (59179), Dst Port: http (80), Seq: 1, Ack: 1, Len: 1109
Hypertext Transfer Protocol

No.     Time        Source                Destination           Protocol Length Info
     16 3.090990    74.125.228.79         10.163.108.219        TCP      80     http > 57115 [SYN, ACK] Seq=0 Ack=1 Win=64251 Len=0 TSval=1635302045 TSecr=5167704 MSS=1400 WS=4 SACK_PERM=1

Frame 16: 80 bytes on wire (640 bits), 80 bytes captured (640 bits)
Linux cooked capture
Internet Protocol Version 4, Src: 74.125.228.79 (74.125.228.79), Dst: 10.163.108.219 (10.163.108.219)
Transmission Control Protocol, Src Port: http (80), Dst Port: 57115 (57115), Seq: 0, Ack: 1, Len: 0

No.     Time        Source                Destination           Protocol Length Info
     17 3.091257    10.163.108.219        74.125.228.79         TCP      68     57115 > http [ACK] Seq=1 Ack=1 Win=3930 Len=0 TSval=5167716 TSecr=1635302045

Frame 17: 68 bytes on wire (544 bits), 68 bytes captured (544 bits)
Linux cooked capture
Internet Protocol Version 4, Src: 10.163.108.219 (10.163.108.219), Dst: 74.125.228.79 (74.125.228.79)
Transmission Control Protocol, Src Port: 57115 (57115), Dst Port: http (80), Seq: 1, Ack: 1, Len: 0

No.     Time        Source                Destination           Protocol Length Info
     18 3.093875    10.163.108.219        74.125.228.79         HTTP     1202   GET /csi?v=3&s=gmob&action=&rt=crf.6614,cri.12043 HTTP/1.1 

Frame 18: 1202 bytes on wire (9616 bits), 1202 bytes captured (9616 bits)
Linux cooked capture
Internet Protocol Version 4, Src: 10.163.108.219 (10.163.108.219), Dst: 74.125.228.79 (74.125.228.79)
Transmission Control Protocol, Src Port: 57115 (57115), Dst Port: http (80), Seq: 1, Ack: 1, Len: 1134
Hypertext Transfer Protocol

No.     Time        Source                Destination           Protocol Length Info
     19 3.444402    10.163.108.219        74.125.228.79         HTTP     1202   [TCP Retransmission] GET /csi?v=3&s=gmob&action=&rt=crf.6614,cri.12043 HTTP/1.1 

Frame 19: 1202 bytes on wire (9616 bits), 1202 bytes captured (9616 bits)
Linux cooked capture
Internet Protocol Version 4, Src: 10.163.108.219 (10.163.108.219), Dst: 74.125.228.79 (74.125.228.79)
Transmission Control Protocol, Src Port: 57115 (57115), Dst Port: http (80), Seq: 1, Ack: 1, Len: 1134
Hypertext Transfer Protocol

No.     Time        Source                Destination           Protocol Length Info
     20 3.544390    10.163.108.219        74.125.228.79         HTTP     1177   [TCP Retransmission] GET /csi?v=3&s=gmob&action=&rt=crf.6560,cri.12294 HTTP/1.1 

Frame 20: 1177 bytes on wire (9416 bits), 1177 bytes captured (9416 bits)
Linux cooked capture
Internet Protocol Version 4, Src: 10.163.108.219 (10.163.108.219), Dst: 74.125.228.79 (74.125.228.79)
Transmission Control Protocol, Src Port: 59179 (59179), Dst Port: http (80), Seq: 1, Ack: 1, Len: 1109
Hypertext Transfer Protocol

No.     Time        Source                Destination           Protocol Length Info
     21 3.810973    74.125.228.79         10.163.108.219        TCP      68     http > 59179 [ACK] Seq=1 Ack=1110 Win=257004 Len=0 TSval=1635302117 TSecr=5167712

Frame 21: 68 bytes on wire (544 bits), 68 bytes captured (544 bits)
Linux cooked capture
Internet Protocol Version 4, Src: 74.125.228.79 (74.125.228.79), Dst: 10.163.108.219 (10.163.108.219)
Transmission Control Protocol, Src Port: http (80), Dst Port: 59179 (59179), Seq: 1, Ack: 1110, Len: 0

No.     Time        Source                Destination           Protocol Length Info
     22 4.040945    74.125.228.79         10.163.108.219        HTTP     443    HTTP/1.1 204 No Content 

Frame 22: 443 bytes on wire (3544 bits), 443 bytes captured (3544 bits)
Linux cooked capture
Internet Protocol Version 4, Src: 74.125.228.79 (74.125.228.79), Dst: 10.163.108.219 (10.163.108.219)
Transmission Control Protocol, Src Port: http (80), Dst Port: 59179 (59179), Seq: 1, Ack: 1110, Len: 375
Hypertext Transfer Protocol

No.     Time        Source                Destination           Protocol Length Info
     23 4.094767    10.163.108.219        199.16.156.6          TLSv1    95     Encrypted Alert

Frame 23: 95 bytes on wire (760 bits), 95 bytes captured (760 bits)
Linux cooked capture
Internet Protocol Version 4, Src: 10.163.108.219 (10.163.108.219), Dst: 199.16.156.6 (199.16.156.6)
Transmission Control Protocol, Src Port: 43948 (43948), Dst Port: https (443), Seq: 1, Ack: 1, Len: 27
Secure Sockets Layer

No.     Time        Source                Destination           Protocol Length Info
     24 4.104367    10.163.108.219        74.125.228.79         TCP      68     59179 > http [ACK] Seq=1110 Ack=376 Win=4018 Len=0 TSval=5167818 TSecr=1635302139

Frame 24: 68 bytes on wire (544 bits), 68 bytes captured (544 bits)
Linux cooked capture
Internet Protocol Version 4, Src: 10.163.108.219 (10.163.108.219), Dst: 74.125.228.79 (74.125.228.79)
Transmission Control Protocol, Src Port: 59179 (59179), Dst Port: http (80), Seq: 1110, Ack: 376, Len: 0

No.     Time        Source                Destination           Protocol Length Info
     25 4.164360    10.163.108.219        74.125.228.79         HTTP     1202   [TCP Retransmission] GET /csi?v=3&s=gmob&action=&rt=crf.6614,cri.12043 HTTP/1.1 

Frame 25: 1202 bytes on wire (9616 bits), 1202 bytes captured (9616 bits)
Linux cooked capture
Internet Protocol Version 4, Src: 10.163.108.219 (10.163.108.219), Dst: 74.125.228.79 (74.125.228.79)
Transmission Control Protocol, Src Port: 57115 (57115), Dst Port: http (80), Seq: 1, Ack: 1, Len: 1134
Hypertext Transfer Protocol

No.     Time        Source                Destination           Protocol Length Info
     26 4.434923    10.163.108.219        199.16.156.6          TCP      68     43948 > https [FIN, ACK] Seq=28 Ack=1 Win=2009 Len=0 TSval=5167851 TSecr=382626953

Frame 26: 68 bytes on wire (544 bits), 68 bytes captured (544 bits)
Linux cooked capture
Internet Protocol Version 4, Src: 10.163.108.219 (10.163.108.219), Dst: 199.16.156.6 (199.16.156.6)
Transmission Control Protocol, Src Port: 43948 (43948), Dst Port: https (443), Seq: 28, Ack: 1, Len: 0

No.     Time        Source                Destination           Protocol Length Info
     27 4.490883    74.125.228.79         10.163.108.219        TCP      68     http > 57115 [ACK] Seq=1 Ack=1135 Win=257004 Len=0 TSval=1635302185 TSecr=5167716

Frame 27: 68 bytes on wire (544 bits), 68 bytes captured (544 bits)
Linux cooked capture
Internet Protocol Version 4, Src: 74.125.228.79 (74.125.228.79), Dst: 10.163.108.219 (10.163.108.219)
Transmission Control Protocol, Src Port: http (80), Dst Port: 57115 (57115), Seq: 1, Ack: 1135, Len: 0

No.     Time        Source                Destination           Protocol Length Info
     28 4.711005    74.125.228.79         10.163.108.219        HTTP     443    HTTP/1.1 204 No Content 

Frame 28: 443 bytes on wire (3544 bits), 443 bytes captured (3544 bits)
Linux cooked capture
Internet Protocol Version 4, Src: 74.125.228.79 (74.125.228.79), Dst: 10.163.108.219 (10.163.108.219)
Transmission Control Protocol, Src Port: http (80), Dst Port: 57115 (57115), Seq: 1, Ack: 1135, Len: 375
Hypertext Transfer Protocol

No.     Time        Source                Destination           Protocol Length Info
     29 4.717365    10.163.108.219        74.125.228.79         TCP      68     57115 > http [ACK] Seq=1135 Ack=376 Win=4018 Len=0 TSval=5167879 TSecr=1635302206

Frame 29: 68 bytes on wire (544 bits), 68 bytes captured (544 bits)
Linux cooked capture
Internet Protocol Version 4, Src: 10.163.108.219 (10.163.108.219), Dst: 74.125.228.79 (74.125.228.79)
Transmission Control Protocol, Src Port: 57115 (57115), Dst Port: http (80), Seq: 1135, Ack: 376, Len: 0

No.     Time        Source                Destination           Protocol Length Info
     30 5.160943    74.125.228.79         10.163.108.219        TCP      68     [TCP Dup ACK 28#1] http > 57115 [ACK] Seq=376 Ack=1135 Win=257004 Len=0 TSval=1635302249 TSecr=5167716

Frame 30: 68 bytes on wire (544 bits), 68 bytes captured (544 bits)
Linux cooked capture
Internet Protocol Version 4, Src: 74.125.228.79 (74.125.228.79), Dst: 10.163.108.219 (10.163.108.219)
Transmission Control Protocol, Src Port: http (80), Dst Port: 57115 (57115), Seq: 376, Ack: 1135, Len: 0

No.     Time        Source                Destination           Protocol Length Info
     31 5.170975    74.125.228.79         10.163.108.219        HTTP     443    [TCP Retransmission] HTTP/1.1 204 No Content 

Frame 31: 443 bytes on wire (3544 bits), 443 bytes captured (3544 bits)
Linux cooked capture
Internet Protocol Version 4, Src: 74.125.228.79 (74.125.228.79), Dst: 10.163.108.219 (10.163.108.219)
Transmission Control Protocol, Src Port: http (80), Dst Port: 59179 (59179), Seq: 1, Ack: 1110, Len: 375
Hypertext Transfer Protocol

No.     Time        Source                Destination           Protocol Length Info
     32 5.171175    10.163.108.219        74.125.228.79         TCP      80     [TCP Dup ACK 24#1] 59179 > http [ACK] Seq=1110 Ack=376 Win=4018 Len=0 TSval=5167924 TSecr=1635302251 SLE=1 SRE=376

Frame 32: 80 bytes on wire (640 bits), 80 bytes captured (640 bits)
Linux cooked capture
Internet Protocol Version 4, Src: 10.163.108.219 (10.163.108.219), Dst: 74.125.228.79 (74.125.228.79)
Transmission Control Protocol, Src Port: 59179 (59179), Dst Port: http (80), Seq: 1110, Ack: 376, Len: 0

No.     Time        Source                Destination           Protocol Length Info
     33 5.574422    10.163.108.219        199.16.156.6          TLSv1    95     [TCP Retransmission] Encrypted Alert

Frame 33: 95 bytes on wire (760 bits), 95 bytes captured (760 bits)
Linux cooked capture
Internet Protocol Version 4, Src: 10.163.108.219 (10.163.108.219), Dst: 199.16.156.6 (199.16.156.6)
Transmission Control Protocol, Src Port: 43948 (43948), Dst Port: https (443), Seq: 1, Ack: 1, Len: 27
Secure Sockets Layer

No.     Time        Source                Destination           Protocol Length Info
     34 5.770988    74.125.228.79         10.163.108.219        TCP      68     [TCP Dup ACK 31#1] http > 59179 [ACK] Seq=376 Ack=1110 Win=257004 Len=0 TSval=1635302313 TSecr=5167712

Frame 34: 68 bytes on wire (544 bits), 68 bytes captured (544 bits)
Linux cooked capture
Internet Protocol Version 4, Src: 74.125.228.79 (74.125.228.79), Dst: 10.163.108.219 (10.163.108.219)
Transmission Control Protocol, Src Port: http (80), Dst Port: 59179 (59179), Seq: 376, Ack: 1110, Len: 0

No.     Time        Source                Destination           Protocol Length Info
     35 5.840945    74.125.228.79         10.163.108.219        HTTP     443    [TCP Retransmission] HTTP/1.1 204 No Content 

Frame 35: 443 bytes on wire (3544 bits), 443 bytes captured (3544 bits)
Linux cooked capture
Internet Protocol Version 4, Src: 74.125.228.79 (74.125.228.79), Dst: 10.163.108.219 (10.163.108.219)
Transmission Control Protocol, Src Port: http (80), Dst Port: 57115 (57115), Seq: 1, Ack: 1135, Len: 375
Hypertext Transfer Protocol

No.     Time        Source                Destination           Protocol Length Info
     36 5.841150    10.163.108.219        74.125.228.79         TCP      80     [TCP Dup ACK 29#1] 57115 > http [ACK] Seq=1135 Ack=376 Win=4018 Len=0 TSval=5167991 TSecr=1635302319 SLE=1 SRE=376

Frame 36: 80 bytes on wire (640 bits), 80 bytes captured (640 bits)
Linux cooked capture
Internet Protocol Version 4, Src: 10.163.108.219 (10.163.108.219), Dst: 74.125.228.79 (74.125.228.79)
Transmission Control Protocol, Src Port: 57115 (57115), Dst Port: http (80), Seq: 1135, Ack: 376, Len: 0

No.     Time        Source                Destination           Protocol Length Info
     37 5.940870    199.16.156.6          10.163.108.219        TLSv1    95     Encrypted Alert

Frame 37: 95 bytes on wire (760 bits), 95 bytes captured (760 bits)
Linux cooked capture
Internet Protocol Version 4, Src: 199.16.156.6 (199.16.156.6), Dst: 10.163.108.219 (10.163.108.219)
Transmission Control Protocol, Src Port: https (443), Dst Port: 43948 (43948), Seq: 1, Ack: 28, Len: 27
Secure Sockets Layer

No.     Time        Source                Destination           Protocol Length Info
     38 5.941142    10.163.108.219        199.16.156.6          TCP      56     43948 > https [RST] Seq=28 Win=0 Len=0

Frame 38: 56 bytes on wire (448 bits), 56 bytes captured (448 bits)
Linux cooked capture
Internet Protocol Version 4, Src: 10.163.108.219 (10.163.108.219), Dst: 199.16.156.6 (199.16.156.6)
Transmission Control Protocol, Src Port: 43948 (43948), Dst Port: https (443), Seq: 28, Len: 0

No.     Time        Source                Destination           Protocol Length Info
     39 6.410967    74.125.228.79         10.163.108.219        TCP      68     [TCP Dup ACK 35#1] http > 57115 [ACK] Seq=376 Ack=1135 Win=257004 Len=0 TSval=1635302377 TSecr=5167716

Frame 39: 68 bytes on wire (544 bits), 68 bytes captured (544 bits)
Linux cooked capture
Internet Protocol Version 4, Src: 74.125.228.79 (74.125.228.79), Dst: 10.163.108.219 (10.163.108.219)
Transmission Control Protocol, Src Port: http (80), Dst Port: 57115 (57115), Seq: 376, Ack: 1135, Len: 0

No.     Time        Source                Destination           Protocol Length Info
     40 6.541005    199.16.156.6          10.163.108.219        TCP      68     https > 43948 [FIN, ACK] Seq=28 Ack=29 Win=73 Len=0 TSval=382637029 TSecr=5167851

Frame 40: 68 bytes on wire (544 bits), 68 bytes captured (544 bits)
Linux cooked capture
Internet Protocol Version 4, Src: 199.16.156.6 (199.16.156.6), Dst: 10.163.108.219 (10.163.108.219)
Transmission Control Protocol, Src Port: https (443), Dst Port: 43948 (43948), Seq: 28, Ack: 29, Len: 0

No.     Time        Source                Destination           Protocol Length Info
     41 6.541208    10.163.108.219        199.16.156.6          TCP      56     43948 > https [RST] Seq=29 Win=0 Len=0

Frame 41: 56 bytes on wire (448 bits), 56 bytes captured (448 bits)
Linux cooked capture
Internet Protocol Version 4, Src: 10.163.108.219 (10.163.108.219), Dst: 199.16.156.6 (199.16.156.6)
Transmission Control Protocol, Src Port: 43948 (43948), Dst Port: https (443), Seq: 29, Len: 0

No.     Time        Source                Destination           Protocol Length Info
     42 7.364378    10.163.108.219        173.194.45.51         TCP      68     44882 > https [FIN, ACK] Seq=1 Ack=1 Win=2009 Len=0 TSval=5168144 TSecr=2963045966

Frame 42: 68 bytes on wire (544 bits), 68 bytes captured (544 bits)
Linux cooked capture
Internet Protocol Version 4, Src: 10.163.108.219 (10.163.108.219), Dst: 173.194.45.51 (173.194.45.51)
Transmission Control Protocol, Src Port: 44882 (44882), Dst Port: https (443), Seq: 1, Ack: 1, Len: 0

No.     Time        Source                Destination           Protocol Length Info
     43 10.484940   10.163.108.219        173.252.103.16        TCP      68     44944 > https [FIN, ACK] Seq=1 Ack=1 Win=1965 Len=0 TSval=5168456 TSecr=844453893

Frame 43: 68 bytes on wire (544 bits), 68 bytes captured (544 bits)
Linux cooked capture
Internet Protocol Version 4, Src: 10.163.108.219 (10.163.108.219), Dst: 173.252.103.16 (173.252.103.16)
Transmission Control Protocol, Src Port: 44944 (44944), Dst Port: https (443), Seq: 1, Ack: 1, Len: 0

No.     Time        Source                Destination           Protocol Length Info
     44 10.485743   10.163.108.219        31.13.86.65           TCP      68     50536 > https [RST, ACK] Seq=1 Ack=1 Win=2009 Len=0 TSval=5168456 TSecr=2837477038

Frame 44: 68 bytes on wire (544 bits), 68 bytes captured (544 bits)
Linux cooked capture
Internet Protocol Version 4, Src: 10.163.108.219 (10.163.108.219), Dst: 31.13.86.65 (31.13.86.65)
Transmission Control Protocol, Src Port: 50536 (50536), Dst Port: https (443), Seq: 1, Ack: 1, Len: 0

No.     Time        Source                Destination           Protocol Length Info
     45 10.680920   173.252.103.16        10.163.108.219        TCP      68     https > 44944 [ACK] Seq=1 Ack=2 Win=79 Len=0 TSval=844530912 TSecr=5168456

Frame 45: 68 bytes on wire (544 bits), 68 bytes captured (544 bits)
Linux cooked capture
Internet Protocol Version 4, Src: 173.252.103.16 (173.252.103.16), Dst: 10.163.108.219 (10.163.108.219)
Transmission Control Protocol, Src Port: https (443), Dst Port: 44944 (44944), Seq: 1, Ack: 2, Len: 0

No.     Time        Source                Destination           Protocol Length Info
     46 10.681257   173.252.103.16        10.163.108.219        TLSv1    95     Encrypted Alert

Frame 46: 95 bytes on wire (760 bits), 95 bytes captured (760 bits)
Linux cooked capture
Internet Protocol Version 4, Src: 173.252.103.16 (173.252.103.16), Dst: 10.163.108.219 (10.163.108.219)
Transmission Control Protocol, Src Port: https (443), Dst Port: 44944 (44944), Seq: 1, Ack: 2, Len: 27
Secure Sockets Layer

No.     Time        Source                Destination           Protocol Length Info
     47 10.681398   10.163.108.219        173.252.103.16        TCP      56     44944 > https [RST] Seq=2 Win=0 Len=0

Frame 47: 56 bytes on wire (448 bits), 56 bytes captured (448 bits)
Linux cooked capture
Internet Protocol Version 4, Src: 10.163.108.219 (10.163.108.219), Dst: 173.252.103.16 (173.252.103.16)
Transmission Control Protocol, Src Port: 44944 (44944), Dst Port: https (443), Seq: 2, Len: 0

No.     Time        Source                Destination           Protocol Length Info
     48 10.681485   173.252.103.16        10.163.108.219        TCP      68     https > 44944 [FIN, ACK] Seq=28 Ack=2 Win=79 Len=0 TSval=844530913 TSecr=5168456

Frame 48: 68 bytes on wire (544 bits), 68 bytes captured (544 bits)
Linux cooked capture
Internet Protocol Version 4, Src: 173.252.103.16 (173.252.103.16), Dst: 10.163.108.219 (10.163.108.219)
Transmission Control Protocol, Src Port: https (443), Dst Port: 44944 (44944), Seq: 28, Ack: 2, Len: 0

No.     Time        Source                Destination           Protocol Length Info
     49 10.681700   10.163.108.219        173.252.103.16        TCP      56     44944 > https [RST] Seq=2 Win=0 Len=0

Frame 49: 56 bytes on wire (448 bits), 56 bytes captured (448 bits)
Linux cooked capture
Internet Protocol Version 4, Src: 10.163.108.219 (10.163.108.219), Dst: 173.252.103.16 (173.252.103.16)
Transmission Control Protocol, Src Port: 44944 (44944), Dst Port: https (443), Seq: 2, Len: 0

No.     Time        Source                Destination           Protocol Length Info
     50 12.684483   10.163.108.219        74.125.228.79         TCP      68     59179 > http [FIN, ACK] Seq=1110 Ack=376 Win=4018 Len=0 TSval=5168676 TSecr=1635302313

Frame 50: 68 bytes on wire (544 bits), 68 bytes captured (544 bits)
Linux cooked capture
Internet Protocol Version 4, Src: 10.163.108.219 (10.163.108.219), Dst: 74.125.228.79 (74.125.228.79)
Transmission Control Protocol, Src Port: 59179 (59179), Dst Port: http (80), Seq: 1110, Ack: 376, Len: 0

No.     Time        Source                Destination           Protocol Length Info
     51 12.800895   74.125.228.79         10.163.108.219        TCP      68     http > 59179 [ACK] Seq=376 Ack=1111 Win=257004 Len=0 TSval=1635303013 TSecr=5168676

Frame 51: 68 bytes on wire (544 bits), 68 bytes captured (544 bits)
Linux cooked capture
Internet Protocol Version 4, Src: 74.125.228.79 (74.125.228.79), Dst: 10.163.108.219 (10.163.108.219)
Transmission Control Protocol, Src Port: http (80), Dst Port: 59179 (59179), Seq: 376, Ack: 1111, Len: 0

No.     Time        Source                Destination           Protocol Length Info
     52 12.801173   74.125.228.79         10.163.108.219        TCP      68     http > 59179 [FIN, ACK] Seq=376 Ack=1111 Win=257004 Len=0 TSval=1635303013 TSecr=5168676

Frame 52: 68 bytes on wire (544 bits), 68 bytes captured (544 bits)
Linux cooked capture
Internet Protocol Version 4, Src: 74.125.228.79 (74.125.228.79), Dst: 10.163.108.219 (10.163.108.219)
Transmission Control Protocol, Src Port: http (80), Dst Port: 59179 (59179), Seq: 376, Ack: 1111, Len: 0

No.     Time        Source                Destination           Protocol Length Info
     53 12.914445   10.163.108.219        74.125.228.79         TCP      68     59179 > http [ACK] Seq=1111 Ack=377 Win=4018 Len=0 TSval=5168699 TSecr=1635303013

Frame 53: 68 bytes on wire (544 bits), 68 bytes captured (544 bits)
Linux cooked capture
Internet Protocol Version 4, Src: 10.163.108.219 (10.163.108.219), Dst: 74.125.228.79 (74.125.228.79)
Transmission Control Protocol, Src Port: 59179 (59179), Dst Port: http (80), Seq: 1111, Ack: 377, Len: 0

No.     Time        Source                Destination           Protocol Length Info
     54 12.915307   10.163.108.219        74.125.228.79         TCP      68     57115 > http [FIN, ACK] Seq=1135 Ack=376 Win=4018 Len=0 TSval=5168699 TSecr=1635302377

Frame 54: 68 bytes on wire (544 bits), 68 bytes captured (544 bits)
Linux cooked capture
Internet Protocol Version 4, Src: 10.163.108.219 (10.163.108.219), Dst: 74.125.228.79 (74.125.228.79)
Transmission Control Protocol, Src Port: 57115 (57115), Dst Port: http (80), Seq: 1135, Ack: 376, Len: 0

No.     Time        Source                Destination           Protocol Length Info
     55 13.016680   74.125.228.79         10.163.108.219        TCP      68     http > 57115 [FIN, ACK] Seq=376 Ack=1136 Win=257004 Len=0 TSval=1635303037 TSecr=5168699

Frame 55: 68 bytes on wire (544 bits), 68 bytes captured (544 bits)
Linux cooked capture
Internet Protocol Version 4, Src: 74.125.228.79 (74.125.228.79), Dst: 10.163.108.219 (10.163.108.219)
Transmission Control Protocol, Src Port: http (80), Dst Port: 57115 (57115), Seq: 376, Ack: 1136, Len: 0

No.     Time        Source                Destination           Protocol Length Info
     56 13.020840   74.125.228.79         10.163.108.219        TCP      68     [TCP Keep-Alive] http > 57115 [ACK] Seq=376 Ack=1136 Win=257004 Len=0 TSval=1635303037 TSecr=5168699

Frame 56: 68 bytes on wire (544 bits), 68 bytes captured (544 bits)
Linux cooked capture
Internet Protocol Version 4, Src: 74.125.228.79 (74.125.228.79), Dst: 10.163.108.219 (10.163.108.219)
Transmission Control Protocol, Src Port: http (80), Dst Port: 57115 (57115), Seq: 376, Ack: 1136, Len: 0

No.     Time        Source                Destination           Protocol Length Info
     57 13.786077   10.163.108.219        74.125.228.79         TCP      68     57115 > http [ACK] Seq=1136 Ack=377 Win=4018 Len=0 TSval=5168786 TSecr=1635303037

Frame 57: 68 bytes on wire (544 bits), 68 bytes captured (544 bits)
Linux cooked capture
Internet Protocol Version 4, Src: 10.163.108.219 (10.163.108.219), Dst: 74.125.228.79 (74.125.228.79)
Transmission Control Protocol, Src Port: 57115 (57115), Dst Port: http (80), Seq: 1136, Ack: 377, Len: 0

No.     Time        Source                Destination           Protocol Length Info
     58 14.865075   10.163.108.219        83.224.70.77          DNS      77     Standard query 0xe12f  A e9.whatsapp.net

Frame 58: 77 bytes on wire (616 bits), 77 bytes captured (616 bits)
Linux cooked capture
Internet Protocol Version 4, Src: 10.163.108.219 (10.163.108.219), Dst: 83.224.70.77 (83.224.70.77)
User Datagram Protocol, Src Port: 58819 (58819), Dst Port: domain (53)
Domain Name System (query)

No.     Time        Source                Destination           Protocol Length Info
     59 14.971757   83.224.70.77          10.163.108.219        DNS      205    Standard query response 0xe12f  A 184.173.147.58 A 184.173.147.59 A 184.173.179.49 A 208.43.122.143 A 184.173.147.53 A 184.173.147.54 A 184.173.147.56 A 184.173.147.57

Frame 59: 205 bytes on wire (1640 bits), 205 bytes captured (1640 bits)
Linux cooked capture
Internet Protocol Version 4, Src: 83.224.70.77 (83.224.70.77), Dst: 10.163.108.219 (10.163.108.219)
User Datagram Protocol, Src Port: domain (53), Dst Port: 58819 (58819)
Domain Name System (response)

No.     Time        Source                Destination           Protocol Length Info
     60 15.021257   10.163.108.219        184.173.147.59        TCP      76     55927 > https [SYN] Seq=0 Win=3930 Len=0 MSS=1310 SACK_PERM=1 TSval=5168909 TSecr=0 WS=2

Frame 60: 76 bytes on wire (608 bits), 76 bytes captured (608 bits)
Linux cooked capture
Internet Protocol Version 4, Src: 10.163.108.219 (10.163.108.219), Dst: 184.173.147.59 (184.173.147.59)
Transmission Control Protocol, Src Port: 55927 (55927), Dst Port: https (443), Seq: 0, Len: 0

No.     Time        Source                Destination           Protocol Length Info
     61 15.211223   184.173.147.59        10.163.108.219        TCP      76     https > 55927 [SYN, ACK] Seq=0 Ack=1 Win=65535 Len=0 MSS=1310 WS=512 SACK_PERM=1 TSval=1383810364 TSecr=5168909

Frame 61: 76 bytes on wire (608 bits), 76 bytes captured (608 bits)
Linux cooked capture
Internet Protocol Version 4, Src: 184.173.147.59 (184.173.147.59), Dst: 10.163.108.219 (10.163.108.219)
Transmission Control Protocol, Src Port: https (443), Dst Port: 55927 (55927), Seq: 0, Ack: 1, Len: 0

No.     Time        Source                Destination           Protocol Length Info
     62 15.211542   10.163.108.219        184.173.147.59        TCP      68     55927 > https [ACK] Seq=1 Ack=1 Win=3930 Len=0 TSval=5168928 TSecr=1383810364

Frame 62: 68 bytes on wire (544 bits), 68 bytes captured (544 bits)
Linux cooked capture
Internet Protocol Version 4, Src: 10.163.108.219 (10.163.108.219), Dst: 184.173.147.59 (184.173.147.59)
Transmission Control Protocol, Src Port: 55927 (55927), Dst Port: https (443), Seq: 1, Ack: 1, Len: 0

No.     Time        Source                Destination           Protocol Length Info
     63 15.390962   184.173.147.59        10.163.108.219        TCP      68     [TCP Window Update] https > 55927 [ACK] Seq=1 Ack=1 Win=262144 Len=0 TSval=1383810545 TSecr=5168928

Frame 63: 68 bytes on wire (544 bits), 68 bytes captured (544 bits)
Linux cooked capture
Internet Protocol Version 4, Src: 184.173.147.59 (184.173.147.59), Dst: 10.163.108.219 (10.163.108.219)
Transmission Control Protocol, Src Port: https (443), Dst Port: 55927 (55927), Seq: 1, Ack: 1, Len: 0

No.     Time        Source                Destination           Protocol Length Info
     64 15.467040   10.163.108.219        184.173.147.59        SSL      189    Continuation Data

Frame 64: 189 bytes on wire (1512 bits), 189 bytes captured (1512 bits)
Linux cooked capture
Internet Protocol Version 4, Src: 10.163.108.219 (10.163.108.219), Dst: 184.173.147.59 (184.173.147.59)
Transmission Control Protocol, Src Port: 55927 (55927), Dst Port: https (443), Seq: 1, Ack: 1, Len: 121
Secure Sockets Layer

No.     Time        Source                Destination           Protocol Length Info
     65 15.710950   184.173.147.59        10.163.108.219        SSL      157    Continuation Data

Frame 65: 157 bytes on wire (1256 bits), 157 bytes captured (1256 bits)
Linux cooked capture
Internet Protocol Version 4, Src: 184.173.147.59 (184.173.147.59), Dst: 10.163.108.219 (10.163.108.219)
Transmission Control Protocol, Src Port: https (443), Dst Port: 55927 (55927), Seq: 1, Ack: 122, Len: 89
Secure Sockets Layer

No.     Time        Source                Destination           Protocol Length Info
     66 15.711337   10.163.108.219        184.173.147.59        TCP      68     55927 > https [ACK] Seq=122 Ack=90 Win=3930 Len=0 TSval=5168978 TSecr=1383810857

Frame 66: 68 bytes on wire (544 bits), 68 bytes captured (544 bits)
Linux cooked capture
Internet Protocol Version 4, Src: 10.163.108.219 (10.163.108.219), Dst: 184.173.147.59 (184.173.147.59)
Transmission Control Protocol, Src Port: 55927 (55927), Dst Port: https (443), Seq: 122, Ack: 90, Len: 0

No.     Time        Source                Destination           Protocol Length Info
     67 15.740955   184.173.147.59        10.163.108.219        SSL      89     Continuation Data

Frame 67: 89 bytes on wire (712 bits), 89 bytes captured (712 bits)
Linux cooked capture
Internet Protocol Version 4, Src: 184.173.147.59 (184.173.147.59), Dst: 10.163.108.219 (10.163.108.219)
Transmission Control Protocol, Src Port: https (443), Dst Port: 55927 (55927), Seq: 90, Ack: 122, Len: 21
Secure Sockets Layer

No.     Time        Source                Destination           Protocol Length Info
     68 15.741168   10.163.108.219        184.173.147.59        TCP      68     55927 > https [ACK] Seq=122 Ack=111 Win=3930 Len=0 TSval=5168981 TSecr=1383810891

Frame 68: 68 bytes on wire (544 bits), 68 bytes captured (544 bits)
Linux cooked capture
Internet Protocol Version 4, Src: 10.163.108.219 (10.163.108.219), Dst: 184.173.147.59 (184.173.147.59)
Transmission Control Protocol, Src Port: 55927 (55927), Dst Port: https (443), Seq: 122, Ack: 111, Len: 0

No.     Time        Source                Destination           Protocol Length Info
     69 15.909137   10.163.108.219        184.173.147.59        SSL      97     Continuation Data

Frame 69: 97 bytes on wire (776 bits), 97 bytes captured (776 bits)
Linux cooked capture
Internet Protocol Version 4, Src: 10.163.108.219 (10.163.108.219), Dst: 184.173.147.59 (184.173.147.59)
Transmission Control Protocol, Src Port: 55927 (55927), Dst Port: https (443), Seq: 122, Ack: 111, Len: 29
Secure Sockets Layer

No.     Time        Source                Destination           Protocol Length Info
     70 16.100895   184.173.147.59        10.163.108.219        SSL      95     Continuation Data

Frame 70: 95 bytes on wire (760 bits), 95 bytes captured (760 bits)
Linux cooked capture
Internet Protocol Version 4, Src: 184.173.147.59 (184.173.147.59), Dst: 10.163.108.219 (10.163.108.219)
Transmission Control Protocol, Src Port: https (443), Dst Port: 55927 (55927), Seq: 111, Ack: 151, Len: 27
Secure Sockets Layer

No.     Time        Source                Destination           Protocol Length Info
     71 16.134407   10.163.108.219        184.173.147.59        TCP      68     55927 > https [ACK] Seq=151 Ack=138 Win=3930 Len=0 TSval=5169021 TSecr=1383811255

Frame 71: 68 bytes on wire (544 bits), 68 bytes captured (544 bits)
Linux cooked capture
Internet Protocol Version 4, Src: 10.163.108.219 (10.163.108.219), Dst: 184.173.147.59 (184.173.147.59)
Transmission Control Protocol, Src Port: 55927 (55927), Dst Port: https (443), Seq: 151, Ack: 138, Len: 0

No.     Time        Source                Destination           Protocol Length Info
     72 16.859027   10.163.108.219        184.173.147.59        SSL      96     Continuation Data

Frame 72: 96 bytes on wire (768 bits), 96 bytes captured (768 bits)
Linux cooked capture
Internet Protocol Version 4, Src: 10.163.108.219 (10.163.108.219), Dst: 184.173.147.59 (184.173.147.59)
Transmission Control Protocol, Src Port: 55927 (55927), Dst Port: https (443), Seq: 151, Ack: 138, Len: 28
Secure Sockets Layer

No.     Time        Source                Destination           Protocol Length Info
     73 17.050890   184.173.147.59        10.163.108.219        SSL      109    Continuation Data

Frame 73: 109 bytes on wire (872 bits), 109 bytes captured (872 bits)
Linux cooked capture
Internet Protocol Version 4, Src: 184.173.147.59 (184.173.147.59), Dst: 10.163.108.219 (10.163.108.219)
Transmission Control Protocol, Src Port: https (443), Dst Port: 55927 (55927), Seq: 138, Ack: 179, Len: 41
Secure Sockets Layer

No.     Time        Source                Destination           Protocol Length Info
     74 17.051432   10.163.108.219        184.173.147.59        SSL      93     Continuation Data

Frame 74: 93 bytes on wire (744 bits), 93 bytes captured (744 bits)
Linux cooked capture
Internet Protocol Version 4, Src: 10.163.108.219 (10.163.108.219), Dst: 184.173.147.59 (184.173.147.59)
Transmission Control Protocol, Src Port: 55927 (55927), Dst Port: https (443), Seq: 179, Ack: 179, Len: 25
Secure Sockets Layer

No.     Time        Source                Destination           Protocol Length Info
