No.     Time        Source                Destination           Protocol Length Info
      1 0.000000    192.168.1.102         198.232.124.224       TCP      66     59821 > http [FIN, ACK] Seq=1 Ack=1 Win=5281 Len=0 TSval=4294959594 TSecr=2703923499

Frame 1: 66 bytes on wire (528 bits), 66 bytes captured (528 bits)
Ethernet II, Src: aa:aa:03:00:00:00 (aa:aa:03:00:00:00), Dst: 1b:24:63:41:00:3c (1b:24:63:41:00:3c)
Internet Protocol Version 4, Src: 192.168.1.102 (192.168.1.102), Dst: 198.232.124.224 (198.232.124.224)
Transmission Control Protocol, Src Port: 59821 (59821), Dst Port: http (80), Seq: 1, Ack: 1, Len: 0

No.     Time        Source                Destination           Protocol Length Info
      2 0.000853    192.168.1.102         50.23.201.7           TCP      66     36951 > http [FIN, ACK] Seq=1 Ack=1 Win=864 Len=0 TSval=4294959594 TSecr=3429975576

Frame 2: 66 bytes on wire (528 bits), 66 bytes captured (528 bits)
Ethernet II, Src: aa:aa:03:00:00:00 (aa:aa:03:00:00:00), Dst: 1b:24:63:41:00:3c (1b:24:63:41:00:3c)
Internet Protocol Version 4, Src: 192.168.1.102 (192.168.1.102), Dst: 50.23.201.7 (50.23.201.7)
Transmission Control Protocol, Src Port: 36951 (36951), Dst Port: http (80), Seq: 1, Ack: 1, Len: 0

No.     Time        Source                Destination           Protocol Length Info
      3 0.293547    192.168.1.102         198.232.124.224       TCP      66     59821 > http [FIN, ACK] Seq=1 Ack=1 Win=5281 Len=0 TSval=4294959624 TSecr=2703923499

Frame 3: 66 bytes on wire (528 bits), 66 bytes captured (528 bits)
Ethernet II, Src: aa:aa:03:00:00:00 (aa:aa:03:00:00:00), Dst: 1b:24:63:41:00:3c (1b:24:63:41:00:3c)
Internet Protocol Version 4, Src: 192.168.1.102 (192.168.1.102), Dst: 198.232.124.224 (198.232.124.224)
Transmission Control Protocol, Src Port: 59821 (59821), Dst Port: http (80), Seq: 1, Ack: 1, Len: 0

No.     Time        Source                Destination           Protocol Length Info
      4 0.563548    192.168.1.102         50.23.201.7           TCP      66     36951 > http [FIN, ACK] Seq=1 Ack=1 Win=864 Len=0 TSval=4294959651 TSecr=3429975576

Frame 4: 66 bytes on wire (528 bits), 66 bytes captured (528 bits)
Ethernet II, Src: aa:aa:03:00:00:00 (aa:aa:03:00:00:00), Dst: 1b:24:63:41:00:3c (1b:24:63:41:00:3c)
Internet Protocol Version 4, Src: 192.168.1.102 (192.168.1.102), Dst: 50.23.201.7 (50.23.201.7)
Transmission Control Protocol, Src Port: 36951 (36951), Dst Port: http (80), Seq: 1, Ack: 1, Len: 0

No.     Time        Source                Destination           Protocol Length Info
      5 0.869387    198.232.124.224       192.168.1.102         TCP      66     http > 59821 [ACK] Seq=1 Ack=2 Win=59 Len=0 TSval=2703925649 TSecr=4294959594

Frame 5: 66 bytes on wire (528 bits), 66 bytes captured (528 bits)
Ethernet II, Src: FonTechn_a5:e9:80 (00:18:84:a5:e9:80), Dst: SamsungE_24:63:41 (cc:05:1b:24:63:41)
Internet Protocol Version 4, Src: 198.232.124.224 (198.232.124.224), Dst: 192.168.1.102 (192.168.1.102)
Transmission Control Protocol, Src Port: http (80), Dst Port: 59821 (59821), Seq: 1, Ack: 2, Len: 0

No.     Time        Source                Destination           Protocol Length Info
      6 0.870343    50.23.201.7           192.168.1.102         TCP      66     http > 36951 [ACK] Seq=1 Ack=2 Win=131 Len=0 TSval=3429977019 TSecr=4294959594

Frame 6: 66 bytes on wire (528 bits), 66 bytes captured (528 bits)
Ethernet II, Src: FonTechn_a5:e9:80 (00:18:84:a5:e9:80), Dst: SamsungE_24:63:41 (cc:05:1b:24:63:41)
Internet Protocol Version 4, Src: 50.23.201.7 (50.23.201.7), Dst: 192.168.1.102 (192.168.1.102)
Transmission Control Protocol, Src Port: http (80), Dst Port: 36951 (36951), Seq: 1, Ack: 2, Len: 0

No.     Time        Source                Destination           Protocol Length Info
      7 0.870993    198.232.124.224       192.168.1.102         TCP      66     [TCP Dup ACK 5#1] http > 59821 [ACK] Seq=1 Ack=2 Win=59 Len=0 TSval=2703925914 TSecr=4294959594

Frame 7: 66 bytes on wire (528 bits), 66 bytes captured (528 bits)
Ethernet II, Src: FonTechn_a5:e9:80 (00:18:84:a5:e9:80), Dst: SamsungE_24:63:41 (cc:05:1b:24:63:41)
Internet Protocol Version 4, Src: 198.232.124.224 (198.232.124.224), Dst: 192.168.1.102 (192.168.1.102)
Transmission Control Protocol, Src Port: http (80), Dst Port: 59821 (59821), Seq: 1, Ack: 2, Len: 0

No.     Time        Source                Destination           Protocol Length Info
      8 0.871207    192.168.1.102         198.232.124.224       TCP      54     59821 > http [RST] Seq=2 Win=0 Len=0

Frame 8: 54 bytes on wire (432 bits), 54 bytes captured (432 bits)
Ethernet II, Src: aa:aa:03:00:00:00 (aa:aa:03:00:00:00), Dst: 1b:24:63:41:00:30 (1b:24:63:41:00:30)
Internet Protocol Version 4, Src: 192.168.1.102 (192.168.1.102), Dst: 198.232.124.224 (198.232.124.224)
Transmission Control Protocol, Src Port: 59821 (59821), Dst Port: http (80), Seq: 2, Len: 0

No.     Time        Source                Destination           Protocol Length Info
      9 0.871923    50.23.201.7           192.168.1.102         TCP      66     [TCP Dup ACK 6#1] http > 36951 [ACK] Seq=1 Ack=2 Win=131 Len=0 TSval=3429977545 TSecr=4294959594

Frame 9: 66 bytes on wire (528 bits), 66 bytes captured (528 bits)
Ethernet II, Src: FonTechn_a5:e9:80 (00:18:84:a5:e9:80), Dst: SamsungE_24:63:41 (cc:05:1b:24:63:41)
Internet Protocol Version 4, Src: 50.23.201.7 (50.23.201.7), Dst: 192.168.1.102 (192.168.1.102)
Transmission Control Protocol, Src Port: http (80), Dst Port: 36951 (36951), Seq: 1, Ack: 2, Len: 0

No.     Time        Source                Destination           Protocol Length Info
     10 0.872090    192.168.1.102         50.23.201.7           TCP      54     36951 > http [RST] Seq=2 Win=0 Len=0

Frame 10: 54 bytes on wire (432 bits), 54 bytes captured (432 bits)
Ethernet II, Src: aa:aa:03:00:00:00 (aa:aa:03:00:00:00), Dst: 1b:24:63:41:00:30 (1b:24:63:41:00:30)
Internet Protocol Version 4, Src: 192.168.1.102 (192.168.1.102), Dst: 50.23.201.7 (50.23.201.7)
Transmission Control Protocol, Src Port: 36951 (36951), Dst Port: http (80), Seq: 2, Len: 0

No.     Time        Source                Destination           Protocol Length Info
     11 2.005045    192.168.1.102         54.235.185.74         TCP      66     44787 > http [FIN, ACK] Seq=1 Ack=1 Win=864 Len=0 TSval=4294959795 TSecr=4183551752

Frame 11: 66 bytes on wire (528 bits), 66 bytes captured (528 bits)
Ethernet II, Src: aa:aa:03:00:00:00 (aa:aa:03:00:00:00), Dst: 1b:24:63:41:00:3c (1b:24:63:41:00:3c)
Internet Protocol Version 4, Src: 192.168.1.102 (192.168.1.102), Dst: 54.235.185.74 (54.235.185.74)
Transmission Control Protocol, Src Port: 44787 (44787), Dst Port: http (80), Seq: 1, Ack: 1, Len: 0

No.     Time        Source                Destination           Protocol Length Info
     12 3.252427    192.168.1.102         184.173.179.49        SSL      95     Continuation Data

Frame 12: 95 bytes on wire (760 bits), 95 bytes captured (760 bits)
Ethernet II, Src: aa:aa:03:00:00:00 (aa:aa:03:00:00:00), Dst: 1b:24:63:41:00:59 (1b:24:63:41:00:59)
Internet Protocol Version 4, Src: 192.168.1.102 (192.168.1.102), Dst: 184.173.179.49 (184.173.179.49)
Transmission Control Protocol, Src Port: 56163 (56163), Dst Port: https (443), Seq: 1, Ack: 1, Len: 29
Secure Sockets Layer

No.     Time        Source                Destination           Protocol Length Info
     13 3.326308    FonTechn_a5:e9:81     Spanning-tree-(for-bridges)_00 STP      52     Conf. Root = 32768/0/00:18:84:a5:e9:80  Cost = 0  Port = 0x8002

Frame 13: 52 bytes on wire (416 bits), 52 bytes captured (416 bits)
IEEE 802.3 Ethernet 
Logical-Link Control
Spanning Tree Protocol

No.     Time        Source                Destination           Protocol Length Info
     14 3.327128    54.235.185.74         192.168.1.102         TCP      66     http > 44787 [FIN, ACK] Seq=1 Ack=2 Win=61 Len=0 TSval=4183553788 TSecr=4294959795

Frame 14: 66 bytes on wire (528 bits), 66 bytes captured (528 bits)
Ethernet II, Src: FonTechn_a5:e9:80 (00:18:84:a5:e9:80), Dst: SamsungE_24:63:41 (cc:05:1b:24:63:41)
Internet Protocol Version 4, Src: 54.235.185.74 (54.235.185.74), Dst: 192.168.1.102 (192.168.1.102)
Transmission Control Protocol, Src Port: http (80), Dst Port: 44787 (44787), Seq: 1, Ack: 2, Len: 0

No.     Time        Source                Destination           Protocol Length Info
     15 3.327357    192.168.1.102         54.235.185.74         TCP      66     44787 > http [ACK] Seq=2 Ack=2 Win=864 Len=0 TSval=4294959927 TSecr=4183553788

Frame 15: 66 bytes on wire (528 bits), 66 bytes captured (528 bits)
Ethernet II, Src: aa:aa:03:00:00:00 (aa:aa:03:00:00:00), Dst: 1b:24:63:41:00:3c (1b:24:63:41:00:3c)
Internet Protocol Version 4, Src: 192.168.1.102 (192.168.1.102), Dst: 54.235.185.74 (54.235.185.74)
Transmission Control Protocol, Src Port: 44787 (44787), Dst Port: http (80), Seq: 2, Ack: 2, Len: 0

No.     Time        Source                Destination           Protocol Length Info
     16 3.470157    184.173.179.49        192.168.1.102         TCP      66     https > 56163 [ACK] Seq=1 Ack=30 Win=514 Len=0 TSval=2120447068 TSecr=4294959919

Frame 16: 66 bytes on wire (528 bits), 66 bytes captured (528 bits)
Ethernet II, Src: FonTechn_a5:e9:80 (00:18:84:a5:e9:80), Dst: SamsungE_24:63:41 (cc:05:1b:24:63:41)
Internet Protocol Version 4, Src: 184.173.179.49 (184.173.179.49), Dst: 192.168.1.102 (192.168.1.102)
Transmission Control Protocol, Src Port: https (443), Dst Port: 56163 (56163), Seq: 1, Ack: 30, Len: 0

No.     Time        Source                Destination           Protocol Length Info
     17 3.470490    192.168.1.102         184.173.179.49        SSL      106    Continuation Data

Frame 17: 106 bytes on wire (848 bits), 106 bytes captured (848 bits)
Ethernet II, Src: aa:aa:03:00:00:00 (aa:aa:03:00:00:00), Dst: 1b:24:63:41:00:64 (1b:24:63:41:00:64)
Internet Protocol Version 4, Src: 192.168.1.102 (192.168.1.102), Dst: 184.173.179.49 (184.173.179.49)
Transmission Control Protocol, Src Port: 56163 (56163), Dst Port: https (443), Seq: 30, Ack: 1, Len: 40
Secure Sockets Layer

No.     Time        Source                Destination           Protocol Length Info
     18 3.499442    192.168.1.102         173.194.116.114       TCP      66     57576 > http [FIN, ACK] Seq=1 Ack=1 Win=4469 Len=0 TSval=4294959944 TSecr=3907256297

Frame 18: 66 bytes on wire (528 bits), 66 bytes captured (528 bits)
Ethernet II, Src: aa:aa:03:00:00:00 (aa:aa:03:00:00:00), Dst: 1b:24:63:41:00:3c (1b:24:63:41:00:3c)
Internet Protocol Version 4, Src: 192.168.1.102 (192.168.1.102), Dst: 173.194.116.114 (173.194.116.114)
Transmission Control Protocol, Src Port: 57576 (57576), Dst Port: http (80), Seq: 1, Ack: 1, Len: 0

No.     Time        Source                Destination           Protocol Length Info
     19 3.573118    173.194.116.114       192.168.1.102         TCP      66     http > 57576 [FIN, ACK] Seq=1 Ack=2 Win=670 Len=0 TSval=3907388016 TSecr=4294959944

Frame 19: 66 bytes on wire (528 bits), 66 bytes captured (528 bits)
Ethernet II, Src: FonTechn_a5:e9:80 (00:18:84:a5:e9:80), Dst: SamsungE_24:63:41 (cc:05:1b:24:63:41)
Internet Protocol Version 4, Src: 173.194.116.114 (173.194.116.114), Dst: 192.168.1.102 (192.168.1.102)
Transmission Control Protocol, Src Port: http (80), Dst Port: 57576 (57576), Seq: 1, Ack: 2, Len: 0

No.     Time        Source                Destination           Protocol Length Info
     20 3.573638    192.168.1.102         173.194.116.114       TCP      66     57576 > http [ACK] Seq=2 Ack=2 Win=4469 Len=0 TSval=4294959952 TSecr=3907388016

Frame 20: 66 bytes on wire (528 bits), 66 bytes captured (528 bits)
Ethernet II, Src: aa:aa:03:00:00:00 (aa:aa:03:00:00:00), Dst: 1b:24:63:41:00:3c (1b:24:63:41:00:3c)
Internet Protocol Version 4, Src: 192.168.1.102 (192.168.1.102), Dst: 173.194.116.114 (173.194.116.114)
Transmission Control Protocol, Src Port: 57576 (57576), Dst Port: http (80), Seq: 2, Ack: 2, Len: 0

No.     Time        Source                Destination           Protocol Length Info
     21 3.643165    184.173.179.49        192.168.1.102         SSL      111    Continuation Data

Frame 21: 111 bytes on wire (888 bits), 111 bytes captured (888 bits)
Ethernet II, Src: FonTechn_a5:e9:80 (00:18:84:a5:e9:80), Dst: SamsungE_24:63:41 (cc:05:1b:24:63:41)
Internet Protocol Version 4, Src: 184.173.179.49 (184.173.179.49), Dst: 192.168.1.102 (192.168.1.102)
Transmission Control Protocol, Src Port: https (443), Dst Port: 56163 (56163), Seq: 1, Ack: 70, Len: 45
Secure Sockets Layer

No.     Time        Source                Destination           Protocol Length Info
     22 3.643645    192.168.1.102         184.173.179.49        TCP      66     56163 > https [ACK] Seq=70 Ack=46 Win=1741 Len=0 TSval=4294959959 TSecr=2120447239

Frame 22: 66 bytes on wire (528 bits), 66 bytes captured (528 bits)
Ethernet II, Src: aa:aa:03:00:00:00 (aa:aa:03:00:00:00), Dst: 1b:24:63:41:00:3c (1b:24:63:41:00:3c)
Internet Protocol Version 4, Src: 192.168.1.102 (192.168.1.102), Dst: 184.173.179.49 (184.173.179.49)
Transmission Control Protocol, Src Port: 56163 (56163), Dst Port: https (443), Seq: 70, Ack: 46, Len: 0

No.     Time        Source                Destination           Protocol Length Info
     23 6.184678    192.168.1.102         184.173.179.49        SSL      78     Continuation Data

Frame 23: 78 bytes on wire (624 bits), 78 bytes captured (624 bits)
Ethernet II, Src: aa:aa:03:00:00:00 (aa:aa:03:00:00:00), Dst: 1b:24:63:41:00:48 (1b:24:63:41:00:48)
Internet Protocol Version 4, Src: 192.168.1.102 (192.168.1.102), Dst: 184.173.179.49 (184.173.179.49)
Transmission Control Protocol, Src Port: 56163 (56163), Dst Port: https (443), Seq: 70, Ack: 46, Len: 12
Secure Sockets Layer

No.     Time        Source                Destination           Protocol Length Info
     24 9.563553    192.168.1.102         184.173.179.49        SSL      78     [TCP Retransmission] Continuation Data

Frame 24: 78 bytes on wire (624 bits), 78 bytes captured (624 bits)
Ethernet II, Src: aa:aa:03:00:00:00 (aa:aa:03:00:00:00), Dst: 1b:24:63:41:00:48 (1b:24:63:41:00:48)
Internet Protocol Version 4, Src: 192.168.1.102 (192.168.1.102), Dst: 184.173.179.49 (184.173.179.49)
Transmission Control Protocol, Src Port: 56163 (56163), Dst Port: https (443), Seq: 70, Ack: 46, Len: 12
Secure Sockets Layer

No.     Time        Source                Destination           Protocol Length Info
     25 10.187272   184.173.179.49        192.168.1.102         SSL      93     Continuation Data

Frame 25: 93 bytes on wire (744 bits), 93 bytes captured (744 bits)
Ethernet II, Src: FonTechn_a5:e9:80 (00:18:84:a5:e9:80), Dst: SamsungE_24:63:41 (cc:05:1b:24:63:41)
Internet Protocol Version 4, Src: 184.173.179.49 (184.173.179.49), Dst: 192.168.1.102 (192.168.1.102)
Transmission Control Protocol, Src Port: https (443), Dst Port: 56163 (56163), Seq: 46, Ack: 82, Len: 27
Secure Sockets Layer

No.     Time        Source                Destination           Protocol Length Info
     26 10.187660   192.168.1.102         184.173.179.49        SSL      152    Continuation Data

Frame 26: 152 bytes on wire (1216 bits), 152 bytes captured (1216 bits)
Ethernet II, Src: aa:aa:03:00:00:00 (aa:aa:03:00:00:00), Dst: 1b:24:63:41:00:92 (1b:24:63:41:00:92)
Internet Protocol Version 4, Src: 192.168.1.102 (192.168.1.102), Dst: 184.173.179.49 (184.173.179.49)
Transmission Control Protocol, Src Port: 56163 (56163), Dst Port: https (443), Seq: 82, Ack: 73, Len: 86
Secure Sockets Layer

No.     Time        Source                Destination           Protocol Length Info
     27 14.387665   184.173.179.49        192.168.1.102         TCP      66     https > 56163 [ACK] Seq=73 Ack=168 Win=514 Len=0 TSval=2120454023 TSecr=4294960613

Frame 27: 66 bytes on wire (528 bits), 66 bytes captured (528 bits)
Ethernet II, Src: FonTechn_a5:e9:80 (00:18:84:a5:e9:80), Dst: SamsungE_24:63:41 (cc:05:1b:24:63:41)
Internet Protocol Version 4, Src: 184.173.179.49 (184.173.179.49), Dst: 192.168.1.102 (192.168.1.102)
Transmission Control Protocol, Src Port: https (443), Dst Port: 56163 (56163), Seq: 73, Ack: 168, Len: 0

No.     Time        Source                Destination           Protocol Length Info
     28 14.388212   192.168.1.102         184.173.179.49        SSL      131    Continuation Data

Frame 28: 131 bytes on wire (1048 bits), 131 bytes captured (1048 bits)
Ethernet II, Src: aa:aa:03:00:00:00 (aa:aa:03:00:00:00), Dst: 1b:24:63:41:00:7d (1b:24:63:41:00:7d)
Internet Protocol Version 4, Src: 192.168.1.102 (192.168.1.102), Dst: 184.173.179.49 (184.173.179.49)
Transmission Control Protocol, Src Port: 56163 (56163), Dst Port: https (443), Seq: 168, Ack: 73, Len: 65
Secure Sockets Layer

No.     Time        Source                Destination           Protocol Length Info
     29 14.388890   184.173.179.49        192.168.1.102         SSL      110    Continuation Data

Frame 29: 110 bytes on wire (880 bits), 110 bytes captured (880 bits)
Ethernet II, Src: FonTechn_a5:e9:80 (00:18:84:a5:e9:80), Dst: SamsungE_24:63:41 (cc:05:1b:24:63:41)
Internet Protocol Version 4, Src: 184.173.179.49 (184.173.179.49), Dst: 192.168.1.102 (192.168.1.102)
Transmission Control Protocol, Src Port: https (443), Dst Port: 56163 (56163), Seq: 73, Ack: 168, Len: 44
Secure Sockets Layer

No.     Time        Source                Destination           Protocol Length Info
     30 14.396343   184.173.179.49        192.168.1.102         SSL      84     Continuation Data

Frame 30: 84 bytes on wire (672 bits), 84 bytes captured (672 bits)
Ethernet II, Src: FonTechn_a5:e9:80 (00:18:84:a5:e9:80), Dst: SamsungE_24:63:41 (cc:05:1b:24:63:41)
Internet Protocol Version 4, Src: 184.173.179.49 (184.173.179.49), Dst: 192.168.1.102 (192.168.1.102)
Transmission Control Protocol, Src Port: https (443), Dst Port: 56163 (56163), Seq: 117, Ack: 168, Len: 18
Secure Sockets Layer

No.     Time        Source                Destination           Protocol Length Info
     31 14.397323   192.168.1.102         184.173.179.49        TCP      66     56163 > https [ACK] Seq=233 Ack=135 Win=1741 Len=0 TSval=4294961034 TSecr=2120454024

Frame 31: 66 bytes on wire (528 bits), 66 bytes captured (528 bits)
Ethernet II, Src: aa:aa:03:00:00:00 (aa:aa:03:00:00:00), Dst: 1b:24:63:41:00:3c (1b:24:63:41:00:3c)
Internet Protocol Version 4, Src: 192.168.1.102 (192.168.1.102), Dst: 184.173.179.49 (184.173.179.49)
Transmission Control Protocol, Src Port: 56163 (56163), Dst Port: https (443), Seq: 233, Ack: 135, Len: 0

No.     Time        Source                Destination           Protocol Length Info
     32 14.578740   184.173.179.49        192.168.1.102         SSL      110    Continuation Data

Frame 32: 110 bytes on wire (880 bits), 110 bytes captured (880 bits)
Ethernet II, Src: FonTechn_a5:e9:80 (00:18:84:a5:e9:80), Dst: SamsungE_24:63:41 (cc:05:1b:24:63:41)
Internet Protocol Version 4, Src: 184.173.179.49 (184.173.179.49), Dst: 192.168.1.102 (192.168.1.102)
Transmission Control Protocol, Src Port: https (443), Dst Port: 56163 (56163), Seq: 135, Ack: 233, Len: 44
Secure Sockets Layer

No.     Time        Source                Destination           Protocol Length Info
     33 14.613467   192.168.1.102         184.173.179.49        TCP      66     56163 > https [ACK] Seq=233 Ack=179 Win=1741 Len=0 TSval=4294961056 TSecr=2120458178

Frame 33: 66 bytes on wire (528 bits), 66 bytes captured (528 bits)
Ethernet II, Src: aa:aa:03:00:00:00 (aa:aa:03:00:00:00), Dst: 1b:24:63:41:00:3c (1b:24:63:41:00:3c)
Internet Protocol Version 4, Src: 192.168.1.102 (192.168.1.102), Dst: 184.173.179.49 (184.173.179.49)
Transmission Control Protocol, Src Port: 56163 (56163), Dst Port: https (443), Seq: 233, Ack: 179, Len: 0

No.     Time        Source                Destination           Protocol Length Info
     34 18.405672   192.168.1.102         184.173.179.49        SSL      130    Continuation Data

Frame 34: 130 bytes on wire (1040 bits), 130 bytes captured (1040 bits)
Ethernet II, Src: aa:aa:03:00:00:00 (aa:aa:03:00:00:00), Dst: 1b:24:63:41:00:7c (1b:24:63:41:00:7c)
Internet Protocol Version 4, Src: 192.168.1.102 (192.168.1.102), Dst: 184.173.179.49 (184.173.179.49)
Transmission Control Protocol, Src Port: 56163 (56163), Dst Port: https (443), Seq: 233, Ack: 179, Len: 64
Secure Sockets Layer

No.     Time        Source                Destination           Protocol Length Info
     35 20.222523   184.173.179.49        192.168.1.102         SSL      110    Continuation Data

Frame 35: 110 bytes on wire (880 bits), 110 bytes captured (880 bits)
Ethernet II, Src: FonTechn_a5:e9:80 (00:18:84:a5:e9:80), Dst: SamsungE_24:63:41 (cc:05:1b:24:63:41)
Internet Protocol Version 4, Src: 184.173.179.49 (184.173.179.49), Dst: 192.168.1.102 (192.168.1.102)
Transmission Control Protocol, Src Port: https (443), Dst Port: 56163 (56163), Seq: 179, Ack: 297, Len: 44
Secure Sockets Layer

No.     Time        Source                Destination           Protocol Length Info
     36 20.223857   192.168.1.102         184.173.179.49        TCP      66     56163 > https [ACK] Seq=297 Ack=223 Win=1741 Len=0 TSval=4294961617 TSecr=2120462204

Frame 36: 66 bytes on wire (528 bits), 66 bytes captured (528 bits)
Ethernet II, Src: aa:aa:03:00:00:00 (aa:aa:03:00:00:00), Dst: 1b:24:63:41:00:3c (1b:24:63:41:00:3c)
Internet Protocol Version 4, Src: 192.168.1.102 (192.168.1.102), Dst: 184.173.179.49 (184.173.179.49)
Transmission Control Protocol, Src Port: 56163 (56163), Dst Port: https (443), Seq: 297, Ack: 223, Len: 0

No.     Time        Source                Destination           Protocol Length Info
     37 31.070795   192.168.1.102         184.173.179.49        SSL      134    Continuation Data

Frame 37: 134 bytes on wire (1072 bits), 134 bytes captured (1072 bits)
Ethernet II, Src: aa:aa:03:00:00:00 (aa:aa:03:00:00:00), Dst: 1b:24:63:41:00:80 (1b:24:63:41:00:80)
Internet Protocol Version 4, Src: 192.168.1.102 (192.168.1.102), Dst: 184.173.179.49 (184.173.179.49)
Transmission Control Protocol, Src Port: 56163 (56163), Dst Port: https (443), Seq: 297, Ack: 223, Len: 68
Secure Sockets Layer

No.     Time        Source                Destination           Protocol Length Info
     38 31.693240   184.173.179.49        192.168.1.102         SSL      110    Continuation Data

Frame 38: 110 bytes on wire (880 bits), 110 bytes captured (880 bits)
Ethernet II, Src: FonTechn_a5:e9:80 (00:18:84:a5:e9:80), Dst: SamsungE_24:63:41 (cc:05:1b:24:63:41)
Internet Protocol Version 4, Src: 184.173.179.49 (184.173.179.49), Dst: 192.168.1.102 (192.168.1.102)
Transmission Control Protocol, Src Port: https (443), Dst Port: 56163 (56163), Seq: 223, Ack: 365, Len: 44
Secure Sockets Layer

No.     Time        Source                Destination           Protocol Length Info
     39 31.693815   192.168.1.102         184.173.179.49        TCP      66     56163 > https [ACK] Seq=365 Ack=267 Win=1741 Len=0 TSval=4294962764 TSecr=2120474838

Frame 39: 66 bytes on wire (528 bits), 66 bytes captured (528 bits)
Ethernet II, Src: aa:aa:03:00:00:00 (aa:aa:03:00:00:00), Dst: 1b:24:63:41:00:3c (1b:24:63:41:00:3c)
Internet Protocol Version 4, Src: 192.168.1.102 (192.168.1.102), Dst: 184.173.179.49 (184.173.179.49)
Transmission Control Protocol, Src Port: 56163 (56163), Dst Port: https (443), Seq: 365, Ack: 267, Len: 0

No.     Time        Source                Destination           Protocol Length Info
     40 33.330028   FonTechn_a5:e9:81     Spanning-tree-(for-bridges)_00 STP      52     Conf. Root = 32768/0/00:18:84:a5:e9:80  Cost = 0  Port = 0x8002

Frame 40: 52 bytes on wire (416 bits), 52 bytes captured (416 bits)
IEEE 802.3 Ethernet 
Logical-Link Control
Spanning Tree Protocol

No.     Time        Source                Destination           Protocol Length Info
     41 37.630433   FonTechn_a5:e9:80     SamsungE_24:63:41     ARP      42     Who has 192.168.1.102?  Tell 192.168.1.1

Frame 41: 42 bytes on wire (336 bits), 42 bytes captured (336 bits)
Ethernet II, Src: FonTechn_a5:e9:80 (00:18:84:a5:e9:80), Dst: SamsungE_24:63:41 (cc:05:1b:24:63:41)
Address Resolution Protocol (request)

No.     Time        Source                Destination           Protocol Length Info
     42 37.630502   aa:aa:03:00:00:00     1b:24:63:41:00:24     ARP      42     192.168.1.102 is at cc:05:1b:24:63:41

Frame 42: 42 bytes on wire (336 bits), 42 bytes captured (336 bits)
Ethernet II, Src: aa:aa:03:00:00:00 (aa:aa:03:00:00:00), Dst: 1b:24:63:41:00:24 (1b:24:63:41:00:24)
Address Resolution Protocol (reply)

No.     Time        Source                Destination           Protocol Length Info
     43 37.631430   FonTechn_a5:e9:80     SamsungE_24:63:41     ARP      42     Who has 192.168.1.102?  Tell 192.168.1.1

Frame 43: 42 bytes on wire (336 bits), 42 bytes captured (336 bits)
Ethernet II, Src: FonTechn_a5:e9:80 (00:18:84:a5:e9:80), Dst: SamsungE_24:63:41 (cc:05:1b:24:63:41)
Address Resolution Protocol (request)

No.     Time        Source                Destination           Protocol Length Info
     44 37.631472   aa:aa:03:00:00:00     1b:24:63:41:00:24     ARP      42     192.168.1.102 is at cc:05:1b:24:63:41

Frame 44: 42 bytes on wire (336 bits), 42 bytes captured (336 bits)
Ethernet II, Src: aa:aa:03:00:00:00 (aa:aa:03:00:00:00), Dst: 1b:24:63:41:00:24 (1b:24:63:41:00:24)
Address Resolution Protocol (reply)

No.     Time        Source                Destination           Protocol Length Info
     45 40.250388   192.168.1.102         184.173.179.49        SSL      141    Continuation Data

Frame 45: 141 bytes on wire (1128 bits), 141 bytes captured (1128 bits)
Ethernet II, Src: aa:aa:03:00:00:00 (aa:aa:03:00:00:00), Dst: 1b:24:63:41:00:87 (1b:24:63:41:00:87)
Internet Protocol Version 4, Src: 192.168.1.102 (192.168.1.102), Dst: 184.173.179.49 (184.173.179.49)
Transmission Control Protocol, Src Port: 56163 (56163), Dst Port: https (443), Seq: 365, Ack: 267, Len: 75
Secure Sockets Layer

No.     Time        Source                Destination           Protocol Length Info
     46 41.625148   184.173.179.49        192.168.1.102         SSL      110    Continuation Data

Frame 46: 110 bytes on wire (880 bits), 110 bytes captured (880 bits)
Ethernet II, Src: FonTechn_a5:e9:80 (00:18:84:a5:e9:80), Dst: SamsungE_24:63:41 (cc:05:1b:24:63:41)
Internet Protocol Version 4, Src: 184.173.179.49 (184.173.179.49), Dst: 192.168.1.102 (192.168.1.102)
Transmission Control Protocol, Src Port: https (443), Dst Port: 56163 (56163), Seq: 267, Ack: 440, Len: 44
Secure Sockets Layer

No.     Time        Source                Destination           Protocol Length Info
     47 41.625633   192.168.1.102         184.173.179.49        TCP      66     56163 > https [ACK] Seq=440 Ack=311 Win=1741 Len=0 TSval=4294963757 TSecr=2120484044

Frame 47: 66 bytes on wire (528 bits), 66 bytes captured (528 bits)
Ethernet II, Src: aa:aa:03:00:00:00 (aa:aa:03:00:00:00), Dst: 1b:24:63:41:00:3c (1b:24:63:41:00:3c)
Internet Protocol Version 4, Src: 192.168.1.102 (192.168.1.102), Dst: 184.173.179.49 (184.173.179.49)
Transmission Control Protocol, Src Port: 56163 (56163), Dst Port: https (443), Seq: 440, Ack: 311, Len: 0

No.     Time        Source                Destination           Protocol Length Info
     48 45.412968   FonTechn_a5:e9:81     Spanning-tree-(for-bridges)_00 STP      52     Conf. Root = 32768/0/00:18:84:a5:e9:80  Cost = 0  Port = 0x8002

Frame 48: 52 bytes on wire (416 bits), 52 bytes captured (416 bits)
IEEE 802.3 Ethernet 
Logical-Link Control
Spanning Tree Protocol

No.     Time        Source                Destination           Protocol Length Info
     49 52.995645   192.168.1.102         184.173.179.49        SSL      132    Continuation Data

Frame 49: 132 bytes on wire (1056 bits), 132 bytes captured (1056 bits)
Ethernet II, Src: aa:aa:03:00:00:00 (aa:aa:03:00:00:00), Dst: 1b:24:63:41:00:7e (1b:24:63:41:00:7e)
Internet Protocol Version 4, Src: 192.168.1.102 (192.168.1.102), Dst: 184.173.179.49 (184.173.179.49)
Transmission Control Protocol, Src Port: 56163 (56163), Dst Port: https (443), Seq: 440, Ack: 311, Len: 66
Secure Sockets Layer

No.     Time        Source                Destination           Protocol Length Info
     50 54.425137   184.173.179.49        192.168.1.102         SSL      110    Continuation Data

Frame 50: 110 bytes on wire (880 bits), 110 bytes captured (880 bits)
Ethernet II, Src: FonTechn_a5:e9:80 (00:18:84:a5:e9:80), Dst: SamsungE_24:63:41 (cc:05:1b:24:63:41)
Internet Protocol Version 4, Src: 184.173.179.49 (184.173.179.49), Dst: 192.168.1.102 (192.168.1.102)
Transmission Control Protocol, Src Port: https (443), Dst Port: 56163 (56163), Seq: 311, Ack: 506, Len: 44
Secure Sockets Layer

No.     Time        Source                Destination           Protocol Length Info
     51 54.425488   192.168.1.102         184.173.179.49        TCP      66     56163 > https [ACK] Seq=506 Ack=355 Win=1741 Len=0 TSval=4294965037 TSecr=2120496798

Frame 51: 66 bytes on wire (528 bits), 66 bytes captured (528 bits)
Ethernet II, Src: aa:aa:03:00:00:00 (aa:aa:03:00:00:00), Dst: 1b:24:63:41:00:3c (1b:24:63:41:00:3c)
Internet Protocol Version 4, Src: 192.168.1.102 (192.168.1.102), Dst: 184.173.179.49 (184.173.179.49)
Transmission Control Protocol, Src Port: 56163 (56163), Dst Port: https (443), Seq: 506, Ack: 355, Len: 0

No.     Time        Source                Destination           Protocol Length Info
     52 54.427593   31.13.86.38           192.168.1.102         TLSv1    93     Encrypted Alert

Frame 52: 93 bytes on wire (744 bits), 93 bytes captured (744 bits)
Ethernet II, Src: FonTechn_a5:e9:80 (00:18:84:a5:e9:80), Dst: SamsungE_24:63:41 (cc:05:1b:24:63:41)
Internet Protocol Version 4, Src: 31.13.86.38 (31.13.86.38), Dst: 192.168.1.102 (192.168.1.102)
Transmission Control Protocol, Src Port: https (443), Dst Port: 38142 (38142), Seq: 1, Ack: 1, Len: 27
Secure Sockets Layer

No.     Time        Source                Destination           Protocol Length Info
     53 54.427747   192.168.1.102         31.13.86.38           TCP      66     38142 > https [ACK] Seq=1 Ack=28 Win=2534 Len=0 TSval=4294965037 TSecr=259723072

Frame 53: 66 bytes on wire (528 bits), 66 bytes captured (528 bits)
Ethernet II, Src: aa:aa:03:00:00:00 (aa:aa:03:00:00:00), Dst: 1b:24:63:41:00:3c (1b:24:63:41:00:3c)
Internet Protocol Version 4, Src: 192.168.1.102 (192.168.1.102), Dst: 31.13.86.38 (31.13.86.38)
Transmission Control Protocol, Src Port: 38142 (38142), Dst Port: https (443), Seq: 1, Ack: 28, Len: 0

No.     Time        Source                Destination           Protocol Length Info
     54 54.428120   31.13.86.38           192.168.1.102         TCP      66     https > 38142 [FIN, ACK] Seq=28 Ack=1 Win=91 Len=0 TSval=259723072 TSecr=4294953025

Frame 54: 66 bytes on wire (528 bits), 66 bytes captured (528 bits)
Ethernet II, Src: FonTechn_a5:e9:80 (00:18:84:a5:e9:80), Dst: SamsungE_24:63:41 (cc:05:1b:24:63:41)
Internet Protocol Version 4, Src: 31.13.86.38 (31.13.86.38), Dst: 192.168.1.102 (192.168.1.102)
Transmission Control Protocol, Src Port: https (443), Dst Port: 38142 (38142), Seq: 28, Ack: 1, Len: 0

No.     Time        Source                Destination           Protocol Length Info
     55 54.428302   31.13.86.38           192.168.1.102         TLSv1    93     [TCP Out-Of-Order] Encrypted Alert

Frame 55: 93 bytes on wire (744 bits), 93 bytes captured (744 bits)
Ethernet II, Src: FonTechn_a5:e9:80 (00:18:84:a5:e9:80), Dst: SamsungE_24:63:41 (cc:05:1b:24:63:41)
Internet Protocol Version 4, Src: 31.13.86.38 (31.13.86.38), Dst: 192.168.1.102 (192.168.1.102)
Transmission Control Protocol, Src Port: https (443), Dst Port: 38142 (38142), Seq: 1, Ack: 1, Len: 27
Secure Sockets Layer

No.     Time        Source                Destination           Protocol Length Info
     56 54.428377   192.168.1.102         31.13.86.38           TCP      78     38142 > https [ACK] Seq=1 Ack=29 Win=2534 Len=0 TSval=4294965037 TSecr=259723344 SLE=1 SRE=29

Frame 56: 78 bytes on wire (624 bits), 78 bytes captured (624 bits)
Ethernet II, Src: aa:aa:03:00:00:00 (aa:aa:03:00:00:00), Dst: 1b:24:63:41:00:48 (1b:24:63:41:00:48)
Internet Protocol Version 4, Src: 192.168.1.102 (192.168.1.102), Dst: 31.13.86.38 (31.13.86.38)
Transmission Control Protocol, Src Port: 38142 (38142), Dst Port: https (443), Seq: 1, Ack: 29, Len: 0

No.     Time        Source                Destination           Protocol Length Info
     57 56.557100   192.168.1.102         184.173.179.49        SSL      120    Continuation Data

Frame 57: 120 bytes on wire (960 bits), 120 bytes captured (960 bits)
Ethernet II, Src: aa:aa:03:00:00:00 (aa:aa:03:00:00:00), Dst: 1b:24:63:41:00:72 (1b:24:63:41:00:72)
Internet Protocol Version 4, Src: 192.168.1.102 (192.168.1.102), Dst: 184.173.179.49 (184.173.179.49)
Transmission Control Protocol, Src Port: 56163 (56163), Dst Port: https (443), Seq: 506, Ack: 355, Len: 54
Secure Sockets Layer

No.     Time        Source                Destination           Protocol Length Info
     58 60.260780   184.173.179.49        192.168.1.102         SSL      110    Continuation Data

Frame 58: 110 bytes on wire (880 bits), 110 bytes captured (880 bits)
Ethernet II, Src: FonTechn_a5:e9:80 (00:18:84:a5:e9:80), Dst: SamsungE_24:63:41 (cc:05:1b:24:63:41)
Internet Protocol Version 4, Src: 184.173.179.49 (184.173.179.49), Dst: 192.168.1.102 (192.168.1.102)
Transmission Control Protocol, Src Port: https (443), Dst Port: 56163 (56163), Seq: 355, Ack: 560, Len: 44
Secure Sockets Layer

No.     Time        Source                Destination           Protocol Length Info
     59 60.261117   192.168.1.102         184.173.179.49        TCP      66     56163 > https [ACK] Seq=560 Ack=399 Win=1741 Len=0 TSval=4294965620 TSecr=2120500358

Frame 59: 66 bytes on wire (528 bits), 66 bytes captured (528 bits)
Ethernet II, Src: aa:aa:03:00:00:00 (aa:aa:03:00:00:00), Dst: 1b:24:63:41:00:3c (1b:24:63:41:00:3c)
Internet Protocol Version 4, Src: 192.168.1.102 (192.168.1.102), Dst: 184.173.179.49 (184.173.179.49)
Transmission Control Protocol, Src Port: 56163 (56163), Dst Port: https (443), Seq: 560, Ack: 399, Len: 0

No.     Time        Source                Destination           Protocol Length Info
     60 61.333135   192.168.1.102         184.173.179.49        SSL      132    Continuation Data

Frame 60: 132 bytes on wire (1056 bits), 132 bytes captured (1056 bits)
Ethernet II, Src: aa:aa:03:00:00:00 (aa:aa:03:00:00:00), Dst: 1b:24:63:41:00:7e (1b:24:63:41:00:7e)
Internet Protocol Version 4, Src: 192.168.1.102 (192.168.1.102), Dst: 184.173.179.49 (184.173.179.49)
Transmission Control Protocol, Src Port: 56163 (56163), Dst Port: https (443), Seq: 560, Ack: 399, Len: 66
Secure Sockets Layer

No.     Time        Source                Destination           Protocol Length Info
     61 63.333650   FonTechn_a5:e9:81     Spanning-tree-(for-bridges)_00 STP      52     Conf. Root = 32768/0/00:18:84:a5:e9:80  Cost = 0  Port = 0x8002

Frame 61: 52 bytes on wire (416 bits), 52 bytes captured (416 bits)
IEEE 802.3 Ethernet 
Logical-Link Control
Spanning Tree Protocol

No.     Time        Source                Destination           Protocol Length Info
     62 64.356958   184.173.179.49        192.168.1.102         SSL      110    Continuation Data

Frame 62: 110 bytes on wire (880 bits), 110 bytes captured (880 bits)
Ethernet II, Src: FonTechn_a5:e9:80 (00:18:84:a5:e9:80), Dst: SamsungE_24:63:41 (cc:05:1b:24:63:41)
Internet Protocol Version 4, Src: 184.173.179.49 (184.173.179.49), Dst: 192.168.1.102 (192.168.1.102)
Transmission Control Protocol, Src Port: https (443), Dst Port: 56163 (56163), Seq: 399, Ack: 626, Len: 44
Secure Sockets Layer

No.     Time        Source                Destination           Protocol Length Info
     63 64.357597   192.168.1.102         184.173.179.49        SSL      129    Continuation Data

Frame 63: 129 bytes on wire (1032 bits), 129 bytes captured (1032 bits)
Ethernet II, Src: aa:aa:03:00:00:00 (aa:aa:03:00:00:00), Dst: 1b:24:63:41:00:7b (1b:24:63:41:00:7b)
Internet Protocol Version 4, Src: 192.168.1.102 (192.168.1.102), Dst: 184.173.179.49 (184.173.179.49)
Transmission Control Protocol, Src Port: 56163 (56163), Dst Port: https (443), Seq: 626, Ack: 443, Len: 63
Secure Sockets Layer

No.     Time        Source                Destination           Protocol Length Info
     64 64.561392   184.173.179.49        192.168.1.102         SSL      110    Continuation Data

Frame 64: 110 bytes on wire (880 bits), 110 bytes captured (880 bits)
Ethernet II, Src: FonTechn_a5:e9:80 (00:18:84:a5:e9:80), Dst: SamsungE_24:63:41 (cc:05:1b:24:63:41)
Internet Protocol Version 4, Src: 184.173.179.49 (184.173.179.49), Dst: 192.168.1.102 (192.168.1.102)
Transmission Control Protocol, Src Port: https (443), Dst Port: 56163 (56163), Seq: 443, Ack: 689, Len: 44
Secure Sockets Layer

No.     Time        Source                Destination           Protocol Length Info
     65 64.593533   192.168.1.102         184.173.179.49        TCP      66     56163 > https [ACK] Seq=689 Ack=487 Win=1741 Len=0 TSval=4294966054 TSecr=2120508153

Frame 65: 66 bytes on wire (528 bits), 66 bytes captured (528 bits)
Ethernet II, Src: aa:aa:03:00:00:00 (aa:aa:03:00:00:00), Dst: 1b:24:63:41:00:3c (1b:24:63:41:00:3c)
Internet Protocol Version 4, Src: 192.168.1.102 (192.168.1.102), Dst: 184.173.179.49 (184.173.179.49)
Transmission Control Protocol, Src Port: 56163 (56163), Dst Port: https (443), Seq: 689, Ack: 487, Len: 0

No.     Time        Source                Destination           Protocol Length Info
     66 68.845662   192.168.1.102         184.173.179.49        SSL      127    Continuation Data

Frame 66: 127 bytes on wire (1016 bits), 127 bytes captured (1016 bits)
Ethernet II, Src: aa:aa:03:00:00:00 (aa:aa:03:00:00:00), Dst: 1b:24:63:41:00:79 (1b:24:63:41:00:79)
Internet Protocol Version 4, Src: 192.168.1.102 (192.168.1.102), Dst: 184.173.179.49 (184.173.179.49)
Transmission Control Protocol, Src Port: 56163 (56163), Dst Port: https (443), Seq: 689, Ack: 487, Len: 61
Secure Sockets Layer

No.     Time        Source                Destination           Protocol Length Info
     67 70.398507   184.173.179.49        192.168.1.102         SSL      111    Continuation Data

Frame 67: 111 bytes on wire (888 bits), 111 bytes captured (888 bits)
Ethernet II, Src: FonTechn_a5:e9:80 (00:18:84:a5:e9:80), Dst: SamsungE_24:63:41 (cc:05:1b:24:63:41)
Internet Protocol Version 4, Src: 184.173.179.49 (184.173.179.49), Dst: 192.168.1.102 (192.168.1.102)
Transmission Control Protocol, Src Port: https (443), Dst Port: 56163 (56163), Seq: 487, Ack: 750, Len: 45
Secure Sockets Layer

No.     Time        Source                Destination           Protocol Length Info
     68 70.399570   192.168.1.102         184.173.179.49        TCP      66     56163 > https [ACK] Seq=750 Ack=532 Win=1741 Len=0 TSval=4294966634 TSecr=2120512704

Frame 68: 66 bytes on wire (528 bits), 66 bytes captured (528 bits)
Ethernet II, Src: aa:aa:03:00:00:00 (aa:aa:03:00:00:00), Dst: 1b:24:63:41:00:3c (1b:24:63:41:00:3c)
Internet Protocol Version 4, Src: 192.168.1.102 (192.168.1.102), Dst: 184.173.179.49 (184.173.179.49)
Transmission Control Protocol, Src Port: 56163 (56163), Dst Port: https (443), Seq: 750, Ack: 532, Len: 0

No.     Time        Source                Destination           Protocol Length Info
     69 74.289750   173.194.116.114       192.168.1.102         TCP      66     https > 59663 [FIN, ACK] Seq=1 Ack=1 Win=670 Len=0 TSval=3907448095 TSecr=4294942844

Frame 69: 66 bytes on wire (528 bits), 66 bytes captured (528 bits)
Ethernet II, Src: FonTechn_a5:e9:80 (00:18:84:a5:e9:80), Dst: SamsungE_24:63:41 (cc:05:1b:24:63:41)
Internet Protocol Version 4, Src: 173.194.116.114 (173.194.116.114), Dst: 192.168.1.102 (192.168.1.102)
Transmission Control Protocol, Src Port: https (443), Dst Port: 59663 (59663), Seq: 1, Ack: 1, Len: 0

No.     Time        Source                Destination           Protocol Length Info
     70 74.291058   173.194.116.114       192.168.1.102         TCP      66     https > 59663 [FIN, ACK] Seq=1 Ack=1 Win=670 Len=0 TSval=3907449507 TSecr=4294942844

Frame 70: 66 bytes on wire (528 bits), 66 bytes captured (528 bits)
Ethernet II, Src: FonTechn_a5:e9:80 (00:18:84:a5:e9:80), Dst: SamsungE_24:63:41 (cc:05:1b:24:63:41)
Internet Protocol Version 4, Src: 173.194.116.114 (173.194.116.114), Dst: 192.168.1.102 (192.168.1.102)
Transmission Control Protocol, Src Port: https (443), Dst Port: 59663 (59663), Seq: 1, Ack: 1, Len: 0

No.     Time        Source                Destination           Protocol Length Info
     71 74.291328   192.168.1.102         173.194.116.114       TCP      78     59663 > https [ACK] Seq=1 Ack=2 Win=2163 Len=0 TSval=4294967023 TSecr=3907449507 SLE=1 SRE=2

Frame 71: 78 bytes on wire (624 bits), 78 bytes captured (624 bits)
Ethernet II, Src: aa:aa:03:00:00:00 (aa:aa:03:00:00:00), Dst: 1b:24:63:41:00:48 (1b:24:63:41:00:48)
Internet Protocol Version 4, Src: 192.168.1.102 (192.168.1.102), Dst: 173.194.116.114 (173.194.116.114)
Transmission Control Protocol, Src Port: 59663 (59663), Dst Port: https (443), Seq: 1, Ack: 2, Len: 0

No.     Time        Source                Destination           Protocol Length Info
     72 74.292078   FonTechn_a5:e9:80     SamsungE_24:63:41     ARP      42     Who has 192.168.1.102?  Tell 192.168.1.1

Frame 72: 42 bytes on wire (336 bits), 42 bytes captured (336 bits)
Ethernet II, Src: FonTechn_a5:e9:80 (00:18:84:a5:e9:80), Dst: SamsungE_24:63:41 (cc:05:1b:24:63:41)
Address Resolution Protocol (request)

No.     Time        Source                Destination           Protocol Length Info
     73 74.292163   aa:aa:03:00:00:00     1b:24:63:41:00:24     ARP      42     192.168.1.102 is at cc:05:1b:24:63:41

Frame 73: 42 bytes on wire (336 bits), 42 bytes captured (336 bits)
Ethernet II, Src: aa:aa:03:00:00:00 (aa:aa:03:00:00:00), Dst: 1b:24:63:41:00:24 (1b:24:63:41:00:24)
Address Resolution Protocol (reply)
