No.     Time        Source                Destination           Protocol Length Info
      1 0.000000    FonTechn_a5:e9:80     SamsungE_24:63:41     ARP      42     Who has 192.168.1.102?  Tell 192.168.1.1

Frame 1: 42 bytes on wire (336 bits), 42 bytes captured (336 bits)
Ethernet II, Src: FonTechn_a5:e9:80 (00:18:84:a5:e9:80), Dst: SamsungE_24:63:41 (cc:05:1b:24:63:41)
Address Resolution Protocol (request)

No.     Time        Source                Destination           Protocol Length Info
      2 0.000023    aa:aa:03:00:00:00     1b:24:63:41:00:24     ARP      42     192.168.1.102 is at cc:05:1b:24:63:41

Frame 2: 42 bytes on wire (336 bits), 42 bytes captured (336 bits)
Ethernet II, Src: aa:aa:03:00:00:00 (aa:aa:03:00:00:00), Dst: 1b:24:63:41:00:24 (1b:24:63:41:00:24)
Address Resolution Protocol (reply)

No.     Time        Source                Destination           Protocol Length Info
      3 6.105381    192.168.1.102         184.173.161.162       TCP      95     [TCP segment of a reassembled PDU]

Frame 3: 95 bytes on wire (760 bits), 95 bytes captured (760 bits)
Ethernet II, Src: aa:aa:03:00:00:00 (aa:aa:03:00:00:00), Dst: 1b:24:63:41:00:59 (1b:24:63:41:00:59)
Internet Protocol Version 4, Src: 192.168.1.102 (192.168.1.102), Dst: 184.173.161.162 (184.173.161.162)
Transmission Control Protocol, Src Port: 46152 (46152), Dst Port: xmpp-client (5222), Seq: 1, Ack: 1, Len: 29

No.     Time        Source                Destination           Protocol Length Info
      4 6.451028    184.173.161.162       192.168.1.102         TCP      66     xmpp-client > 46152 [ACK] Seq=1 Ack=30 Win=514 Len=0 TSval=3169622626 TSecr=50988

Frame 4: 66 bytes on wire (528 bits), 66 bytes captured (528 bits)
Ethernet II, Src: FonTechn_a5:e9:80 (00:18:84:a5:e9:80), Dst: SamsungE_24:63:41 (cc:05:1b:24:63:41)
Internet Protocol Version 4, Src: 184.173.161.162 (184.173.161.162), Dst: 192.168.1.102 (192.168.1.102)
Transmission Control Protocol, Src Port: xmpp-client (5222), Dst Port: 46152 (46152), Seq: 1, Ack: 30, Len: 0

No.     Time        Source                Destination           Protocol Length Info
      5 6.451401    192.168.1.102         184.173.161.162       TCP      106    [TCP segment of a reassembled PDU]

Frame 5: 106 bytes on wire (848 bits), 106 bytes captured (848 bits)
Ethernet II, Src: aa:aa:03:00:00:00 (aa:aa:03:00:00:00), Dst: 1b:24:63:41:00:64 (1b:24:63:41:00:64)
Internet Protocol Version 4, Src: 192.168.1.102 (192.168.1.102), Dst: 184.173.161.162 (184.173.161.162)
Transmission Control Protocol, Src Port: 46152 (46152), Dst Port: xmpp-client (5222), Seq: 30, Ack: 1, Len: 40

No.     Time        Source                Destination           Protocol Length Info
      6 6.758588    184.173.161.162       192.168.1.102         TCP      110    [TCP segment of a reassembled PDU]

Frame 6: 110 bytes on wire (880 bits), 110 bytes captured (880 bits)
Ethernet II, Src: FonTechn_a5:e9:80 (00:18:84:a5:e9:80), Dst: SamsungE_24:63:41 (cc:05:1b:24:63:41)
Internet Protocol Version 4, Src: 184.173.161.162 (184.173.161.162), Dst: 192.168.1.102 (192.168.1.102)
Transmission Control Protocol, Src Port: xmpp-client (5222), Dst Port: 46152 (46152), Seq: 1, Ack: 70, Len: 44

No.     Time        Source                Destination           Protocol Length Info
      7 6.759228    192.168.1.102         184.173.161.162       TCP      66     46152 > xmpp-client [ACK] Seq=70 Ack=45 Win=2080 Len=0 TSval=51053 TSecr=3169622974

Frame 7: 66 bytes on wire (528 bits), 66 bytes captured (528 bits)
Ethernet II, Src: aa:aa:03:00:00:00 (aa:aa:03:00:00:00), Dst: 1b:24:63:41:00:3c (1b:24:63:41:00:3c)
Internet Protocol Version 4, Src: 192.168.1.102 (192.168.1.102), Dst: 184.173.161.162 (184.173.161.162)
Transmission Control Protocol, Src Port: 46152 (46152), Dst Port: xmpp-client (5222), Seq: 70, Ack: 45, Len: 0

No.     Time        Source                Destination           Protocol Length Info
      8 9.036330    192.168.1.102         184.173.161.162       TCP      78     [TCP segment of a reassembled PDU]

Frame 8: 78 bytes on wire (624 bits), 78 bytes captured (624 bits)
Ethernet II, Src: aa:aa:03:00:00:00 (aa:aa:03:00:00:00), Dst: 1b:24:63:41:00:48 (1b:24:63:41:00:48)
Internet Protocol Version 4, Src: 192.168.1.102 (192.168.1.102), Dst: 184.173.161.162 (184.173.161.162)
Transmission Control Protocol, Src Port: 46152 (46152), Dst Port: xmpp-client (5222), Seq: 70, Ack: 45, Len: 12

No.     Time        Source                Destination           Protocol Length Info
      9 9.325715    184.173.161.162       192.168.1.102         TCP      93     [TCP segment of a reassembled PDU]

Frame 9: 93 bytes on wire (744 bits), 93 bytes captured (744 bits)
Ethernet II, Src: FonTechn_a5:e9:80 (00:18:84:a5:e9:80), Dst: SamsungE_24:63:41 (cc:05:1b:24:63:41)
Internet Protocol Version 4, Src: 184.173.161.162 (184.173.161.162), Dst: 192.168.1.102 (192.168.1.102)
Transmission Control Protocol, Src Port: xmpp-client (5222), Dst Port: 46152 (46152), Seq: 45, Ack: 82, Len: 27

No.     Time        Source                Destination           Protocol Length Info
     10 9.326123    192.168.1.102         184.173.161.162       TCP      91     [TCP segment of a reassembled PDU]

Frame 10: 91 bytes on wire (728 bits), 91 bytes captured (728 bits)
Ethernet II, Src: aa:aa:03:00:00:00 (aa:aa:03:00:00:00), Dst: 1b:24:63:41:00:55 (1b:24:63:41:00:55)
Internet Protocol Version 4, Src: 192.168.1.102 (192.168.1.102), Dst: 184.173.161.162 (184.173.161.162)
Transmission Control Protocol, Src Port: 46152 (46152), Dst Port: xmpp-client (5222), Seq: 82, Ack: 72, Len: 25

No.     Time        Source                Destination           Protocol Length Info
     11 9.525991    184.173.161.162       192.168.1.102         TCP      84     [TCP segment of a reassembled PDU]

Frame 11: 84 bytes on wire (672 bits), 84 bytes captured (672 bits)
Ethernet II, Src: FonTechn_a5:e9:80 (00:18:84:a5:e9:80), Dst: SamsungE_24:63:41 (cc:05:1b:24:63:41)
Internet Protocol Version 4, Src: 184.173.161.162 (184.173.161.162), Dst: 192.168.1.102 (192.168.1.102)
Transmission Control Protocol, Src Port: xmpp-client (5222), Dst Port: 46152 (46152), Seq: 72, Ack: 107, Len: 18

No.     Time        Source                Destination           Protocol Length Info
     12 9.565318    192.168.1.102         184.173.161.162       TCP      66     46152 > xmpp-client [ACK] Seq=107 Ack=90 Win=2080 Len=0 TSval=51334 TSecr=3169625797

Frame 12: 66 bytes on wire (528 bits), 66 bytes captured (528 bits)
Ethernet II, Src: aa:aa:03:00:00:00 (aa:aa:03:00:00:00), Dst: 1b:24:63:41:00:3c (1b:24:63:41:00:3c)
Internet Protocol Version 4, Src: 192.168.1.102 (192.168.1.102), Dst: 184.173.161.162 (184.173.161.162)
Transmission Control Protocol, Src Port: 46152 (46152), Dst Port: xmpp-client (5222), Seq: 107, Ack: 90, Len: 0

No.     Time        Source                Destination           Protocol Length Info
     13 12.994781   192.168.1.102         184.173.161.162       TCP      134    [TCP segment of a reassembled PDU]

Frame 13: 134 bytes on wire (1072 bits), 134 bytes captured (1072 bits)
Ethernet II, Src: aa:aa:03:00:00:00 (aa:aa:03:00:00:00), Dst: 1b:24:63:41:00:80 (1b:24:63:41:00:80)
Internet Protocol Version 4, Src: 192.168.1.102 (192.168.1.102), Dst: 184.173.161.162 (184.173.161.162)
Transmission Control Protocol, Src Port: 46152 (46152), Dst Port: xmpp-client (5222), Seq: 107, Ack: 90, Len: 68

No.     Time        Source                Destination           Protocol Length Info
     14 13.312981   FonTechn_a5:e9:81     Spanning-tree-(for-bridges)_00 STP      52     Conf. Root = 32768/0/00:18:84:a5:e9:80  Cost = 0  Port = 0x8002

Frame 14: 52 bytes on wire (416 bits), 52 bytes captured (416 bits)
IEEE 802.3 Ethernet 
Logical-Link Control
Spanning Tree Protocol

No.     Time        Source                Destination           Protocol Length Info
     15 13.313625   184.173.161.162       192.168.1.102         TCP      110    [TCP segment of a reassembled PDU]

Frame 15: 110 bytes on wire (880 bits), 110 bytes captured (880 bits)
Ethernet II, Src: FonTechn_a5:e9:80 (00:18:84:a5:e9:80), Dst: SamsungE_24:63:41 (cc:05:1b:24:63:41)
Internet Protocol Version 4, Src: 184.173.161.162 (184.173.161.162), Dst: 192.168.1.102 (192.168.1.102)
Transmission Control Protocol, Src Port: xmpp-client (5222), Dst Port: 46152 (46152), Seq: 90, Ack: 175, Len: 44

No.     Time        Source                Destination           Protocol Length Info
     16 13.314068   192.168.1.102         184.173.161.162       TCP      66     46152 > xmpp-client [ACK] Seq=175 Ack=134 Win=2080 Len=0 TSval=51708 TSecr=3169629471

Frame 16: 66 bytes on wire (528 bits), 66 bytes captured (528 bits)
Ethernet II, Src: aa:aa:03:00:00:00 (aa:aa:03:00:00:00), Dst: 1b:24:63:41:00:3c (1b:24:63:41:00:3c)
Internet Protocol Version 4, Src: 192.168.1.102 (192.168.1.102), Dst: 184.173.161.162 (184.173.161.162)
Transmission Control Protocol, Src Port: 46152 (46152), Dst Port: xmpp-client (5222), Seq: 175, Ack: 134, Len: 0

No.     Time        Source                Destination           Protocol Length Info
     17 17.407936   FonTechn_a5:e9:81     Spanning-tree-(for-bridges)_00 STP      52     Conf. Root = 32768/0/00:18:84:a5:e9:80  Cost = 0  Port = 0x8002

Frame 17: 52 bytes on wire (416 bits), 52 bytes captured (416 bits)
IEEE 802.3 Ethernet 
Logical-Link Control
Spanning Tree Protocol

No.     Time        Source                Destination           Protocol Length Info
     18 19.353586   FonTechn_a5:e9:81     Spanning-tree-(for-bridges)_00 STP      52     Conf. Root = 32768/0/00:18:84:a5:e9:80  Cost = 0  Port = 0x8002

Frame 18: 52 bytes on wire (416 bits), 52 bytes captured (416 bits)
IEEE 802.3 Ethernet 
Logical-Link Control
Spanning Tree Protocol

No.     Time        Source                Destination           Protocol Length Info
     19 20.210500   192.168.1.102         184.173.161.162       TCP      128    [TCP segment of a reassembled PDU]

Frame 19: 128 bytes on wire (1024 bits), 128 bytes captured (1024 bits)
Ethernet II, Src: aa:aa:03:00:00:00 (aa:aa:03:00:00:00), Dst: 1b:24:63:41:00:7a (1b:24:63:41:00:7a)
Internet Protocol Version 4, Src: 192.168.1.102 (192.168.1.102), Dst: 184.173.161.162 (184.173.161.162)
Transmission Control Protocol, Src Port: 46152 (46152), Dst Port: xmpp-client (5222), Seq: 175, Ack: 134, Len: 62

No.     Time        Source                Destination           Protocol Length Info
     20 20.583021   184.173.161.162       192.168.1.102         TCP      110    [TCP segment of a reassembled PDU]

Frame 20: 110 bytes on wire (880 bits), 110 bytes captured (880 bits)
Ethernet II, Src: FonTechn_a5:e9:80 (00:18:84:a5:e9:80), Dst: SamsungE_24:63:41 (cc:05:1b:24:63:41)
Internet Protocol Version 4, Src: 184.173.161.162 (184.173.161.162), Dst: 192.168.1.102 (192.168.1.102)
Transmission Control Protocol, Src Port: xmpp-client (5222), Dst Port: 46152 (46152), Seq: 134, Ack: 237, Len: 44

No.     Time        Source                Destination           Protocol Length Info
     21 20.583391   192.168.1.102         184.173.161.162       TCP      66     46152 > xmpp-client [ACK] Seq=237 Ack=178 Win=2080 Len=0 TSval=52435 TSecr=3169636762

Frame 21: 66 bytes on wire (528 bits), 66 bytes captured (528 bits)
Ethernet II, Src: aa:aa:03:00:00:00 (aa:aa:03:00:00:00), Dst: 1b:24:63:41:00:3c (1b:24:63:41:00:3c)
Internet Protocol Version 4, Src: 192.168.1.102 (192.168.1.102), Dst: 184.173.161.162 (184.173.161.162)
Transmission Control Protocol, Src Port: 46152 (46152), Dst Port: xmpp-client (5222), Seq: 237, Ack: 178, Len: 0

No.     Time        Source                Destination           Protocol Length Info
     22 21.665293   192.168.1.102         74.125.232.130        TCP      66     54686 > https [FIN, ACK] Seq=1 Ack=1 Win=5281 Len=0 TSval=52544 TSecr=4041383414

Frame 22: 66 bytes on wire (528 bits), 66 bytes captured (528 bits)
Ethernet II, Src: aa:aa:03:00:00:00 (aa:aa:03:00:00:00), Dst: 1b:24:63:41:00:3c (1b:24:63:41:00:3c)
Internet Protocol Version 4, Src: 192.168.1.102 (192.168.1.102), Dst: 74.125.232.130 (74.125.232.130)
Transmission Control Protocol, Src Port: 54686 (54686), Dst Port: https (443), Seq: 1, Ack: 1, Len: 0

No.     Time        Source                Destination           Protocol Length Info
     23 26.316750   FonTechn_a5:e9:80     SamsungE_24:63:41     ARP      42     Who has 192.168.1.102?  Tell 192.168.1.1

Frame 23: 42 bytes on wire (336 bits), 42 bytes captured (336 bits)
Ethernet II, Src: FonTechn_a5:e9:80 (00:18:84:a5:e9:80), Dst: SamsungE_24:63:41 (cc:05:1b:24:63:41)
Address Resolution Protocol (request)

No.     Time        Source                Destination           Protocol Length Info
     24 26.316875   aa:aa:03:00:00:00     1b:24:63:41:00:24     ARP      42     192.168.1.102 is at cc:05:1b:24:63:41

Frame 24: 42 bytes on wire (336 bits), 42 bytes captured (336 bits)
Ethernet II, Src: aa:aa:03:00:00:00 (aa:aa:03:00:00:00), Dst: 1b:24:63:41:00:24 (1b:24:63:41:00:24)
Address Resolution Protocol (reply)

No.     Time        Source                Destination           Protocol Length Info
     25 29.319233   192.168.1.102         184.173.161.162       TCP      144    [TCP segment of a reassembled PDU]

Frame 25: 144 bytes on wire (1152 bits), 144 bytes captured (1152 bits)
Ethernet II, Src: aa:aa:03:00:00:00 (aa:aa:03:00:00:00), Dst: 1b:24:63:41:00:8a (1b:24:63:41:00:8a)
Internet Protocol Version 4, Src: 192.168.1.102 (192.168.1.102), Dst: 184.173.161.162 (184.173.161.162)
Transmission Control Protocol, Src Port: 46152 (46152), Dst Port: xmpp-client (5222), Seq: 237, Ack: 178, Len: 78

No.     Time        Source                Destination           Protocol Length Info
     26 30.208071   184.173.161.162       192.168.1.102         TCP      111    [TCP segment of a reassembled PDU]

Frame 26: 111 bytes on wire (888 bits), 111 bytes captured (888 bits)
Ethernet II, Src: FonTechn_a5:e9:80 (00:18:84:a5:e9:80), Dst: SamsungE_24:63:41 (cc:05:1b:24:63:41)
Internet Protocol Version 4, Src: 184.173.161.162 (184.173.161.162), Dst: 192.168.1.102 (192.168.1.102)
Transmission Control Protocol, Src Port: xmpp-client (5222), Dst Port: 46152 (46152), Seq: 178, Ack: 315, Len: 45

No.     Time        Source                Destination           Protocol Length Info
     27 30.215330   192.168.1.102         184.173.161.162       TCP      66     46152 > xmpp-client [ACK] Seq=315 Ack=223 Win=2080 Len=0 TSval=53398 TSecr=3169645811

Frame 27: 66 bytes on wire (528 bits), 66 bytes captured (528 bits)
Ethernet II, Src: aa:aa:03:00:00:00 (aa:aa:03:00:00:00), Dst: 1b:24:63:41:00:3c (1b:24:63:41:00:3c)
Internet Protocol Version 4, Src: 192.168.1.102 (192.168.1.102), Dst: 184.173.161.162 (184.173.161.162)
Transmission Control Protocol, Src Port: 46152 (46152), Dst Port: xmpp-client (5222), Seq: 315, Ack: 223, Len: 0

No.     Time        Source                Destination           Protocol Length Info
     28 32.118255   192.168.1.102         184.173.161.162       TCP      125    [TCP segment of a reassembled PDU]

Frame 28: 125 bytes on wire (1000 bits), 125 bytes captured (1000 bits)
Ethernet II, Src: aa:aa:03:00:00:00 (aa:aa:03:00:00:00), Dst: 1b:24:63:41:00:77 (1b:24:63:41:00:77)
Internet Protocol Version 4, Src: 192.168.1.102 (192.168.1.102), Dst: 184.173.161.162 (184.173.161.162)
Transmission Control Protocol, Src Port: 46152 (46152), Dst Port: xmpp-client (5222), Seq: 315, Ack: 223, Len: 59

No.     Time        Source                Destination           Protocol Length Info
     29 32.565958   184.173.161.162       192.168.1.102         TCP      111    [TCP segment of a reassembled PDU]

Frame 29: 111 bytes on wire (888 bits), 111 bytes captured (888 bits)
Ethernet II, Src: FonTechn_a5:e9:80 (00:18:84:a5:e9:80), Dst: SamsungE_24:63:41 (cc:05:1b:24:63:41)
Internet Protocol Version 4, Src: 184.173.161.162 (184.173.161.162), Dst: 192.168.1.102 (192.168.1.102)
Transmission Control Protocol, Src Port: xmpp-client (5222), Dst Port: 46152 (46152), Seq: 223, Ack: 374, Len: 45

No.     Time        Source                Destination           Protocol Length Info
     30 32.566538   192.168.1.102         184.173.161.162       TCP      66     46152 > xmpp-client [ACK] Seq=374 Ack=268 Win=2080 Len=0 TSval=53634 TSecr=3169648636

Frame 30: 66 bytes on wire (528 bits), 66 bytes captured (528 bits)
Ethernet II, Src: aa:aa:03:00:00:00 (aa:aa:03:00:00:00), Dst: 1b:24:63:41:00:3c (1b:24:63:41:00:3c)
Internet Protocol Version 4, Src: 192.168.1.102 (192.168.1.102), Dst: 184.173.161.162 (184.173.161.162)
Transmission Control Protocol, Src Port: 46152 (46152), Dst Port: xmpp-client (5222), Seq: 374, Ack: 268, Len: 0

No.     Time        Source                Destination           Protocol Length Info
     31 35.030798   192.168.1.102         184.173.161.162       TCP      131    [TCP segment of a reassembled PDU]

Frame 31: 131 bytes on wire (1048 bits), 131 bytes captured (1048 bits)
Ethernet II, Src: aa:aa:03:00:00:00 (aa:aa:03:00:00:00), Dst: 1b:24:63:41:00:7d (1b:24:63:41:00:7d)
Internet Protocol Version 4, Src: 192.168.1.102 (192.168.1.102), Dst: 184.173.161.162 (184.173.161.162)
Transmission Control Protocol, Src Port: 46152 (46152), Dst Port: xmpp-client (5222), Seq: 374, Ack: 268, Len: 65

No.     Time        Source                Destination           Protocol Length Info
     32 35.430383   184.173.161.162       192.168.1.102         TCP      111    [TCP segment of a reassembled PDU]

Frame 32: 111 bytes on wire (888 bits), 111 bytes captured (888 bits)
Ethernet II, Src: FonTechn_a5:e9:80 (00:18:84:a5:e9:80), Dst: SamsungE_24:63:41 (cc:05:1b:24:63:41)
Internet Protocol Version 4, Src: 184.173.161.162 (184.173.161.162), Dst: 192.168.1.102 (192.168.1.102)
Transmission Control Protocol, Src Port: xmpp-client (5222), Dst Port: 46152 (46152), Seq: 268, Ack: 439, Len: 45

No.     Time        Source                Destination           Protocol Length Info
     33 35.431008   192.168.1.102         184.173.161.162       TCP      66     46152 > xmpp-client [ACK] Seq=439 Ack=313 Win=2080 Len=0 TSval=53920 TSecr=3169651551

Frame 33: 66 bytes on wire (528 bits), 66 bytes captured (528 bits)
Ethernet II, Src: aa:aa:03:00:00:00 (aa:aa:03:00:00:00), Dst: 1b:24:63:41:00:3c (1b:24:63:41:00:3c)
Internet Protocol Version 4, Src: 192.168.1.102 (192.168.1.102), Dst: 184.173.161.162 (184.173.161.162)
Transmission Control Protocol, Src Port: 46152 (46152), Dst Port: xmpp-client (5222), Seq: 439, Ack: 313, Len: 0

No.     Time        Source                Destination           Protocol Length Info
     34 43.315006   FonTechn_a5:e9:81     Spanning-tree-(for-bridges)_00 STP      52     Conf. Root = 32768/0/00:18:84:a5:e9:80  Cost = 0  Port = 0x8002

Frame 34: 52 bytes on wire (416 bits), 52 bytes captured (416 bits)
IEEE 802.3 Ethernet 
Logical-Link Control
Spanning Tree Protocol
