No.     Time        Source                Destination           Protocol Length Info
     12 2.283933    100.77.14.234         184.173.161.163       TCP      76     41265 > https [SYN] Seq=0 Win=5240 Len=0 MSS=1310 SACK_PERM=1 TSval=38704 TSecr=0 WS=4

Frame 12: 76 bytes on wire (608 bits), 76 bytes captured (608 bits)
Linux cooked capture
Internet Protocol Version 4, Src: 100.77.14.234 (100.77.14.234), Dst: 184.173.161.163 (184.173.161.163)
Transmission Control Protocol, Src Port: 41265 (41265), Dst Port: https (443), Seq: 0, Len: 0

No.     Time        Source                Destination           Protocol Length Info
     17 2.537055    100.77.14.234         184.173.161.163       TCP      68     41265 > https [ACK] Seq=1 Ack=1 Win=5240 Len=0 TSval=38729 TSecr=2582313200

Frame 17: 68 bytes on wire (544 bits), 68 bytes captured (544 bits)
Linux cooked capture
Internet Protocol Version 4, Src: 100.77.14.234 (100.77.14.234), Dst: 184.173.161.163 (184.173.161.163)
Transmission Control Protocol, Src Port: 41265 (41265), Dst Port: https (443), Seq: 1, Ack: 1, Len: 0

No.     Time        Source                Destination           Protocol Length Info
     18 2.591803    100.77.14.234         184.173.161.163       SSL      189    Continuation Data

Frame 18: 189 bytes on wire (1512 bits), 189 bytes captured (1512 bits)
Linux cooked capture
Internet Protocol Version 4, Src: 100.77.14.234 (100.77.14.234), Dst: 184.173.161.163 (184.173.161.163)
Transmission Control Protocol, Src Port: 41265 (41265), Dst Port: https (443), Seq: 1, Ack: 1, Len: 121
Secure Sockets Layer

No.     Time        Source                Destination           Protocol Length Info
     31 2.906931    100.77.14.234         184.173.161.163       TCP      68     41265 > https [ACK] Seq=122 Ack=90 Win=5240 Len=0 TSval=38766 TSecr=2582313560

Frame 31: 68 bytes on wire (544 bits), 68 bytes captured (544 bits)
Linux cooked capture
Internet Protocol Version 4, Src: 100.77.14.234 (100.77.14.234), Dst: 184.173.161.163 (184.173.161.163)
Transmission Control Protocol, Src Port: 41265 (41265), Dst Port: https (443), Seq: 122, Ack: 90, Len: 0

No.     Time        Source                Destination           Protocol Length Info
     32 2.912228    100.77.14.234         184.173.161.163       SSL      97     Continuation Data

Frame 32: 97 bytes on wire (776 bits), 97 bytes captured (776 bits)
Linux cooked capture
Internet Protocol Version 4, Src: 100.77.14.234 (100.77.14.234), Dst: 184.173.161.163 (184.173.161.163)
Transmission Control Protocol, Src Port: 41265 (41265), Dst Port: https (443), Seq: 122, Ack: 90, Len: 29
Secure Sockets Layer

No.     Time        Source                Destination           Protocol Length Info
     34 3.001846    100.77.14.234         184.173.161.163       TCP      68     41265 > https [ACK] Seq=151 Ack=111 Win=5240 Len=0 TSval=38776 TSecr=2582313609

Frame 34: 68 bytes on wire (544 bits), 68 bytes captured (544 bits)
Linux cooked capture
Internet Protocol Version 4, Src: 100.77.14.234 (100.77.14.234), Dst: 184.173.161.163 (184.173.161.163)
Transmission Control Protocol, Src Port: 41265 (41265), Dst Port: https (443), Seq: 151, Ack: 111, Len: 0

No.     Time        Source                Destination           Protocol Length Info
     38 3.377055    100.77.14.234         184.173.161.163       SSL      160    Continuation Data

Frame 38: 160 bytes on wire (1280 bits), 160 bytes captured (1280 bits)
Linux cooked capture
Internet Protocol Version 4, Src: 100.77.14.234 (100.77.14.234), Dst: 184.173.161.163 (184.173.161.163)
Transmission Control Protocol, Src Port: 41265 (41265), Dst Port: https (443), Seq: 151, Ack: 138, Len: 92
Secure Sockets Layer

No.     Time        Source                Destination           Protocol Length Info
     45 3.749090    100.77.14.234         184.173.161.163       TCP      68     41265 > https [ACK] Seq=243 Ack=351 Win=6312 Len=0 TSval=38850 TSecr=2582314375

Frame 45: 68 bytes on wire (544 bits), 68 bytes captured (544 bits)
Linux cooked capture
Internet Protocol Version 4, Src: 100.77.14.234 (100.77.14.234), Dst: 184.173.161.163 (184.173.161.163)
Transmission Control Protocol, Src Port: 41265 (41265), Dst Port: https (443), Seq: 243, Ack: 351, Len: 0

No.     Time        Source                Destination           Protocol Length Info
     46 3.892523    100.77.14.234         184.173.161.163       SSL      125    Continuation Data

Frame 46: 125 bytes on wire (1000 bits), 125 bytes captured (1000 bits)
Linux cooked capture
Internet Protocol Version 4, Src: 100.77.14.234 (100.77.14.234), Dst: 184.173.161.163 (184.173.161.163)
Transmission Control Protocol, Src Port: 41265 (41265), Dst Port: https (443), Seq: 243, Ack: 351, Len: 57
Secure Sockets Layer

No.     Time        Source                Destination           Protocol Length Info
     52 4.277023    100.77.14.234         184.173.161.163       SSL      298    Continuation Data

Frame 52: 298 bytes on wire (2384 bits), 298 bytes captured (2384 bits)
Linux cooked capture
Internet Protocol Version 4, Src: 100.77.14.234 (100.77.14.234), Dst: 184.173.161.163 (184.173.161.163)
Transmission Control Protocol, Src Port: 41265 (41265), Dst Port: https (443), Seq: 300, Ack: 395, Len: 230
Secure Sockets Layer

No.     Time        Source                Destination           Protocol Length Info
     59 4.893631    100.77.14.234         184.173.161.163       TCP      68     41265 > https [ACK] Seq=530 Ack=527 Win=6312 Len=0 TSval=38965 TSecr=2582315531

Frame 59: 68 bytes on wire (544 bits), 68 bytes captured (544 bits)
Linux cooked capture
Internet Protocol Version 4, Src: 100.77.14.234 (100.77.14.234), Dst: 184.173.161.163 (184.173.161.163)
Transmission Control Protocol, Src Port: 41265 (41265), Dst Port: https (443), Seq: 530, Ack: 527, Len: 0

No.     Time        Source                Destination           Protocol Length Info
     61 4.941880    100.77.14.234         184.173.161.163       TCP      68     41265 > https [ACK] Seq=530 Ack=571 Win=6312 Len=0 TSval=38970 TSecr=2582315551

Frame 61: 68 bytes on wire (544 bits), 68 bytes captured (544 bits)
Linux cooked capture
Internet Protocol Version 4, Src: 100.77.14.234 (100.77.14.234), Dst: 184.173.161.163 (184.173.161.163)
Transmission Control Protocol, Src Port: 41265 (41265), Dst Port: https (443), Seq: 530, Ack: 571, Len: 0

No.     Time        Source                Destination           Protocol Length Info
     63 12.522456   100.77.14.234         50.22.225.86          TCP      56     58600 > https [RST] Seq=1 Win=0 Len=0

Frame 63: 56 bytes on wire (448 bits), 56 bytes captured (448 bits)
Linux cooked capture
Internet Protocol Version 4, Src: 100.77.14.234 (100.77.14.234), Dst: 50.22.225.86 (50.22.225.86)
Transmission Control Protocol, Src Port: 58600 (58600), Dst Port: https (443), Seq: 1, Len: 0

No.     Time        Source                Destination           Protocol Length Info
     64 33.835980   100.77.14.234         184.173.161.163       SSL      162    Continuation Data

Frame 64: 162 bytes on wire (1296 bits), 162 bytes captured (1296 bits)
Linux cooked capture
Internet Protocol Version 4, Src: 100.77.14.234 (100.77.14.234), Dst: 184.173.161.163 (184.173.161.163)
Transmission Control Protocol, Src Port: 41265 (41265), Dst Port: https (443), Seq: 530, Ack: 571, Len: 94
Secure Sockets Layer

No.     Time        Source                Destination           Protocol Length Info
     66 34.716748   100.77.14.234         184.173.161.163       TCP      68     41265 > https [ACK] Seq=624 Ack=616 Win=6312 Len=0 TSval=41947 TSecr=2582345300

Frame 66: 68 bytes on wire (544 bits), 68 bytes captured (544 bits)
Linux cooked capture
Internet Protocol Version 4, Src: 100.77.14.234 (100.77.14.234), Dst: 184.173.161.163 (184.173.161.163)
Transmission Control Protocol, Src Port: 41265 (41265), Dst Port: https (443), Seq: 624, Ack: 616, Len: 0

No.     Time        Source                Destination           Protocol Length Info
     67 38.124233   100.77.14.234         184.173.161.163       SSL      128    Continuation Data

Frame 67: 128 bytes on wire (1024 bits), 128 bytes captured (1024 bits)
Linux cooked capture
Internet Protocol Version 4, Src: 100.77.14.234 (100.77.14.234), Dst: 184.173.161.163 (184.173.161.163)
Transmission Control Protocol, Src Port: 41265 (41265), Dst Port: https (443), Seq: 624, Ack: 616, Len: 60
Secure Sockets Layer

No.     Time        Source                Destination           Protocol Length Info
     69 38.580760   100.77.14.234         184.173.161.163       TCP      68     41265 > https [ACK] Seq=684 Ack=661 Win=6312 Len=0 TSval=42333 TSecr=2582349154

Frame 69: 68 bytes on wire (544 bits), 68 bytes captured (544 bits)
Linux cooked capture
Internet Protocol Version 4, Src: 100.77.14.234 (100.77.14.234), Dst: 184.173.161.163 (184.173.161.163)
Transmission Control Protocol, Src Port: 41265 (41265), Dst Port: https (443), Seq: 684, Ack: 661, Len: 0

No.     Time        Source                Destination           Protocol Length Info
     70 56.124485   100.77.14.234         184.173.161.163       SSL      80     Continuation Data

Frame 70: 80 bytes on wire (640 bits), 80 bytes captured (640 bits)
Linux cooked capture
Internet Protocol Version 4, Src: 100.77.14.234 (100.77.14.234), Dst: 184.173.161.163 (184.173.161.163)
Transmission Control Protocol, Src Port: 41265 (41265), Dst Port: https (443), Seq: 684, Ack: 661, Len: 12
Secure Sockets Layer

No.     Time        Source                Destination           Protocol Length Info
     71 57.509322   100.77.14.234         184.173.161.163       SSL      80     [TCP Retransmission] Continuation Data

Frame 71: 80 bytes on wire (640 bits), 80 bytes captured (640 bits)
Linux cooked capture
Internet Protocol Version 4, Src: 100.77.14.234 (100.77.14.234), Dst: 184.173.161.163 (184.173.161.163)
Transmission Control Protocol, Src Port: 41265 (41265), Dst Port: https (443), Seq: 684, Ack: 661, Len: 12
Secure Sockets Layer

No.     Time        Source                Destination           Protocol Length Info
     72 60.299643   100.77.14.234         184.173.161.163       SSL      80     [TCP Retransmission] Continuation Data

Frame 72: 80 bytes on wire (640 bits), 80 bytes captured (640 bits)
Linux cooked capture
Internet Protocol Version 4, Src: 100.77.14.234 (100.77.14.234), Dst: 184.173.161.163 (184.173.161.163)
Transmission Control Protocol, Src Port: 41265 (41265), Dst Port: https (443), Seq: 684, Ack: 661, Len: 12
Secure Sockets Layer

No.     Time        Source                Destination           Protocol Length Info
     74 60.980098   100.77.14.234         184.173.161.163       TCP      68     41265 > https [ACK] Seq=696 Ack=690 Win=6312 Len=0 TSval=44114 TSecr=2582369015

Frame 74: 68 bytes on wire (544 bits), 68 bytes captured (544 bits)
Linux cooked capture
Internet Protocol Version 4, Src: 100.77.14.234 (100.77.14.234), Dst: 184.173.161.163 (184.173.161.163)
Transmission Control Protocol, Src Port: 41265 (41265), Dst Port: https (443), Seq: 696, Ack: 690, Len: 0

No.     Time        Source                Destination           Protocol Length Info
     76 61.009718   100.77.14.234         184.173.161.163       TCP      80     [TCP Dup ACK 74#1] 41265 > https [ACK] Seq=696 Ack=690 Win=6312 Len=0 TSval=44117 TSecr=2582370034 SLE=661 SRE=690

Frame 76: 80 bytes on wire (640 bits), 80 bytes captured (640 bits)
Linux cooked capture
Internet Protocol Version 4, Src: 100.77.14.234 (100.77.14.234), Dst: 184.173.161.163 (184.173.161.163)
Transmission Control Protocol, Src Port: 41265 (41265), Dst Port: https (443), Seq: 696, Ack: 690, Len: 0

No.     Time        Source                Destination           Protocol Length Info
     78 61.052396   100.77.14.234         184.173.161.163       TCP      80     [TCP Dup ACK 74#2] 41265 > https [ACK] Seq=696 Ack=690 Win=6312 Len=0 TSval=44121 TSecr=2582371872 SLE=661 SRE=690

Frame 78: 80 bytes on wire (640 bits), 80 bytes captured (640 bits)
Linux cooked capture
Internet Protocol Version 4, Src: 100.77.14.234 (100.77.14.234), Dst: 184.173.161.163 (184.173.161.163)
Transmission Control Protocol, Src Port: 41265 (41265), Dst Port: https (443), Seq: 696, Ack: 690, Len: 0

No.     Time        Source                Destination           Protocol Length Info
    320 371.020426  100.77.14.234         184.173.161.163       SSL      97     Continuation Data

Frame 320: 97 bytes on wire (776 bits), 97 bytes captured (776 bits)
Linux cooked capture
Internet Protocol Version 4, Src: 100.77.14.234 (100.77.14.234), Dst: 184.173.161.163 (184.173.161.163)
Transmission Control Protocol, Src Port: 41265 (41265), Dst Port: https (443), Seq: 696, Ack: 690, Len: 29
Secure Sockets Layer

No.     Time        Source                Destination           Protocol Length Info
    322 372.053420  100.77.14.234         184.173.161.163       SSL      108    Continuation Data

Frame 322: 108 bytes on wire (864 bits), 108 bytes captured (864 bits)
Linux cooked capture
Internet Protocol Version 4, Src: 100.77.14.234 (100.77.14.234), Dst: 184.173.161.163 (184.173.161.163)
Transmission Control Protocol, Src Port: 41265 (41265), Dst Port: https (443), Seq: 725, Ack: 690, Len: 40
Secure Sockets Layer

No.     Time        Source                Destination           Protocol Length Info
    324 373.834675  100.77.14.234         184.173.161.163       TCP      68     41265 > https [ACK] Seq=765 Ack=736 Win=6312 Len=0 TSval=52243 TSecr=2582684138

Frame 324: 68 bytes on wire (544 bits), 68 bytes captured (544 bits)
Linux cooked capture
Internet Protocol Version 4, Src: 100.77.14.234 (100.77.14.234), Dst: 184.173.161.163 (184.173.161.163)
Transmission Control Protocol, Src Port: 41265 (41265), Dst Port: https (443), Seq: 765, Ack: 736, Len: 0

No.     Time        Source                Destination           Protocol Length Info
    325 374.218120  100.77.14.234         184.173.161.163       SSL      80     Continuation Data

Frame 325: 80 bytes on wire (640 bits), 80 bytes captured (640 bits)
Linux cooked capture
Internet Protocol Version 4, Src: 100.77.14.234 (100.77.14.234), Dst: 184.173.161.163 (184.173.161.163)
Transmission Control Protocol, Src Port: 41265 (41265), Dst Port: https (443), Seq: 765, Ack: 736, Len: 12
Secure Sockets Layer

No.     Time        Source                Destination           Protocol Length Info
    329 375.512406  100.77.14.234         184.173.161.163       SSL      93     Continuation Data

Frame 329: 93 bytes on wire (744 bits), 93 bytes captured (744 bits)
Linux cooked capture
Internet Protocol Version 4, Src: 100.77.14.234 (100.77.14.234), Dst: 184.173.161.163 (184.173.161.163)
Transmission Control Protocol, Src Port: 41265 (41265), Dst Port: https (443), Seq: 777, Ack: 763, Len: 25
Secure Sockets Layer

No.     Time        Source                Destination           Protocol Length Info
    331 375.810936  100.77.14.234         184.173.161.163       TCP      68     41265 > https [ACK] Seq=802 Ack=781 Win=6312 Len=0 TSval=52441 TSecr=2582686189

Frame 331: 68 bytes on wire (544 bits), 68 bytes captured (544 bits)
Linux cooked capture
Internet Protocol Version 4, Src: 100.77.14.234 (100.77.14.234), Dst: 184.173.161.163 (184.173.161.163)
Transmission Control Protocol, Src Port: 41265 (41265), Dst Port: https (443), Seq: 802, Ack: 781, Len: 0

No.     Time        Source                Destination           Protocol Length Info
    332 382.833210  100.77.14.234         184.173.161.163       SSL      139    Continuation Data

Frame 332: 139 bytes on wire (1112 bits), 139 bytes captured (1112 bits)
Linux cooked capture
Internet Protocol Version 4, Src: 100.77.14.234 (100.77.14.234), Dst: 184.173.161.163 (184.173.161.163)
Transmission Control Protocol, Src Port: 41265 (41265), Dst Port: https (443), Seq: 802, Ack: 781, Len: 71
Secure Sockets Layer

No.     Time        Source                Destination           Protocol Length Info
    334 383.443530  100.77.14.234         184.173.161.163       TCP      68     41265 > https [ACK] Seq=873 Ack=826 Win=6312 Len=0 TSval=53204 TSecr=2582693782

Frame 334: 68 bytes on wire (544 bits), 68 bytes captured (544 bits)
Linux cooked capture
Internet Protocol Version 4, Src: 100.77.14.234 (100.77.14.234), Dst: 184.173.161.163 (184.173.161.163)
Transmission Control Protocol, Src Port: 41265 (41265), Dst Port: https (443), Seq: 873, Ack: 826, Len: 0

No.     Time        Source                Destination           Protocol Length Info
    335 399.789008  100.77.14.234         184.173.161.163       SSL      153    Continuation Data

Frame 335: 153 bytes on wire (1224 bits), 153 bytes captured (1224 bits)
Linux cooked capture
Internet Protocol Version 4, Src: 100.77.14.234 (100.77.14.234), Dst: 184.173.161.163 (184.173.161.163)
Transmission Control Protocol, Src Port: 41265 (41265), Dst Port: https (443), Seq: 873, Ack: 826, Len: 85
Secure Sockets Layer

No.     Time        Source                Destination           Protocol Length Info
    337 400.346911  100.77.14.234         184.173.161.163       TCP      68     41265 > https [ACK] Seq=958 Ack=871 Win=6312 Len=0 TSval=54894 TSecr=2582710675

Frame 337: 68 bytes on wire (544 bits), 68 bytes captured (544 bits)
Linux cooked capture
Internet Protocol Version 4, Src: 100.77.14.234 (100.77.14.234), Dst: 184.173.161.163 (184.173.161.163)
Transmission Control Protocol, Src Port: 41265 (41265), Dst Port: https (443), Seq: 958, Ack: 871, Len: 0

No.     Time        Source                Destination           Protocol Length Info
    338 426.535060  100.77.14.234         184.173.161.163       SSL      179    Continuation Data

Frame 338: 179 bytes on wire (1432 bits), 179 bytes captured (1432 bits)
Linux cooked capture
Internet Protocol Version 4, Src: 100.77.14.234 (100.77.14.234), Dst: 184.173.161.163 (184.173.161.163)
Transmission Control Protocol, Src Port: 41265 (41265), Dst Port: https (443), Seq: 958, Ack: 871, Len: 111
Secure Sockets Layer

No.     Time        Source                Destination           Protocol Length Info
    340 427.206768  100.77.14.234         184.173.161.163       TCP      68     41265 > https [ACK] Seq=1069 Ack=916 Win=6312 Len=0 TSval=57580 TSecr=2582737531

Frame 340: 68 bytes on wire (544 bits), 68 bytes captured (544 bits)
Linux cooked capture
Internet Protocol Version 4, Src: 100.77.14.234 (100.77.14.234), Dst: 184.173.161.163 (184.173.161.163)
Transmission Control Protocol, Src Port: 41265 (41265), Dst Port: https (443), Seq: 1069, Ack: 916, Len: 0

No.     Time        Source                Destination           Protocol Length Info
    346 444.575771  100.77.14.234         184.173.161.163       SSL      80     Continuation Data

Frame 346: 80 bytes on wire (640 bits), 80 bytes captured (640 bits)
Linux cooked capture
Internet Protocol Version 4, Src: 100.77.14.234 (100.77.14.234), Dst: 184.173.161.163 (184.173.161.163)
Transmission Control Protocol, Src Port: 41265 (41265), Dst Port: https (443), Seq: 1069, Ack: 916, Len: 12
Secure Sockets Layer

No.     Time        Source                Destination           Protocol Length Info
    348 444.789054  100.77.14.234         184.173.161.163       TCP      68     41265 > https [ACK] Seq=1081 Ack=945 Win=6312 Len=0 TSval=59338 TSecr=2582755216

Frame 348: 68 bytes on wire (544 bits), 68 bytes captured (544 bits)
Linux cooked capture
Internet Protocol Version 4, Src: 100.77.14.234 (100.77.14.234), Dst: 184.173.161.163 (184.173.161.163)
Transmission Control Protocol, Src Port: 41265 (41265), Dst Port: https (443), Seq: 1081, Ack: 945, Len: 0

No.     Time        Source                Destination           Protocol Length Info
    544 1346.117952 100.77.14.234         184.173.161.163       TCP      68     41265 > https [ACK] Seq=1081 Ack=979 Win=6312 Len=0 TSval=68545 TSecr=2583655230

Frame 544: 68 bytes on wire (544 bits), 68 bytes captured (544 bits)
Linux cooked capture
Internet Protocol Version 4, Src: 100.77.14.234 (100.77.14.234), Dst: 184.173.161.163 (184.173.161.163)
Transmission Control Protocol, Src Port: 41265 (41265), Dst Port: https (443), Seq: 1081, Ack: 979, Len: 0

No.     Time        Source                Destination           Protocol Length Info
    545 1346.197565 100.77.14.234         184.173.161.163       SSL      100    Continuation Data

Frame 545: 100 bytes on wire (800 bits), 100 bytes captured (800 bits)
Linux cooked capture
Internet Protocol Version 4, Src: 100.77.14.234 (100.77.14.234), Dst: 184.173.161.163 (184.173.161.163)
Transmission Control Protocol, Src Port: 41265 (41265), Dst Port: https (443), Seq: 1081, Ack: 979, Len: 32
Secure Sockets Layer

No.     Time        Source                Destination           Protocol Length Info
    711 1658.870401 100.77.14.234         184.173.161.163       SSL      97     Continuation Data

Frame 711: 97 bytes on wire (776 bits), 97 bytes captured (776 bits)
Linux cooked capture
Internet Protocol Version 4, Src: 100.77.14.234 (100.77.14.234), Dst: 184.173.161.163 (184.173.161.163)
Transmission Control Protocol, Src Port: 41265 (41265), Dst Port: https (443), Seq: 1113, Ack: 979, Len: 29
Secure Sockets Layer

No.     Time        Source                Destination           Protocol Length Info
    714 1659.429186 100.77.14.234         184.173.161.163       SSL      108    Continuation Data

Frame 714: 108 bytes on wire (864 bits), 108 bytes captured (864 bits)
Linux cooked capture
Internet Protocol Version 4, Src: 100.77.14.234 (100.77.14.234), Dst: 184.173.161.163 (184.173.161.163)
Transmission Control Protocol, Src Port: 41265 (41265), Dst Port: https (443), Seq: 1142, Ack: 979, Len: 40
Secure Sockets Layer

No.     Time        Source                Destination           Protocol Length Info
    716 1659.998960 100.77.14.234         184.173.161.163       TCP      68     41265 > https [ACK] Seq=1182 Ack=1025 Win=6312 Len=0 TSval=75222 TSecr=2583970961

Frame 716: 68 bytes on wire (544 bits), 68 bytes captured (544 bits)
Linux cooked capture
Internet Protocol Version 4, Src: 100.77.14.234 (100.77.14.234), Dst: 184.173.161.163 (184.173.161.163)
Transmission Control Protocol, Src Port: 41265 (41265), Dst Port: https (443), Seq: 1182, Ack: 1025, Len: 0

No.     Time        Source                Destination           Protocol Length Info
    717 1661.571865 100.77.14.234         184.173.161.163       SSL      97     Continuation Data

Frame 717: 97 bytes on wire (776 bits), 97 bytes captured (776 bits)
Linux cooked capture
Internet Protocol Version 4, Src: 100.77.14.234 (100.77.14.234), Dst: 184.173.161.163 (184.173.161.163)
Transmission Control Protocol, Src Port: 41265 (41265), Dst Port: https (443), Seq: 1182, Ack: 1025, Len: 29
Secure Sockets Layer

No.     Time        Source                Destination           Protocol Length Info
    719 1662.078973 100.77.14.234         184.173.161.163       SSL      108    Continuation Data

Frame 719: 108 bytes on wire (864 bits), 108 bytes captured (864 bits)
Linux cooked capture
Internet Protocol Version 4, Src: 100.77.14.234 (100.77.14.234), Dst: 184.173.161.163 (184.173.161.163)
Transmission Control Protocol, Src Port: 41265 (41265), Dst Port: https (443), Seq: 1211, Ack: 1025, Len: 40
Secure Sockets Layer

No.     Time        Source                Destination           Protocol Length Info
    721 1662.608535 100.77.14.234         184.173.161.163       TCP      68     41265 > https [ACK] Seq=1251 Ack=1069 Win=6312 Len=0 TSval=75483 TSecr=2583973570

Frame 721: 68 bytes on wire (544 bits), 68 bytes captured (544 bits)
Linux cooked capture
Internet Protocol Version 4, Src: 100.77.14.234 (100.77.14.234), Dst: 184.173.161.163 (184.173.161.163)
Transmission Control Protocol, Src Port: 41265 (41265), Dst Port: https (443), Seq: 1251, Ack: 1069, Len: 0

No.     Time        Source                Destination           Protocol Length Info
    722 1664.559560 100.77.14.234         184.173.161.163       SSL      80     Continuation Data

Frame 722: 80 bytes on wire (640 bits), 80 bytes captured (640 bits)
Linux cooked capture
Internet Protocol Version 4, Src: 100.77.14.234 (100.77.14.234), Dst: 184.173.161.163 (184.173.161.163)
Transmission Control Protocol, Src Port: 41265 (41265), Dst Port: https (443), Seq: 1251, Ack: 1069, Len: 12
Secure Sockets Layer

No.     Time        Source                Destination           Protocol Length Info
    724 1664.982738 100.77.14.234         184.173.161.163       SSL      93     Continuation Data

Frame 724: 93 bytes on wire (744 bits), 93 bytes captured (744 bits)
Linux cooked capture
Internet Protocol Version 4, Src: 100.77.14.234 (100.77.14.234), Dst: 184.173.161.163 (184.173.161.163)
Transmission Control Protocol, Src Port: 41265 (41265), Dst Port: https (443), Seq: 1263, Ack: 1096, Len: 25
Secure Sockets Layer

No.     Time        Source                Destination           Protocol Length Info
    726 1665.080341 100.77.14.234         184.173.161.163       TCP      68     41265 > https [ACK] Seq=1288 Ack=1123 Win=6312 Len=0 TSval=75731 TSecr=2583975999

Frame 726: 68 bytes on wire (544 bits), 68 bytes captured (544 bits)
Linux cooked capture
Internet Protocol Version 4, Src: 100.77.14.234 (100.77.14.234), Dst: 184.173.161.163 (184.173.161.163)
Transmission Control Protocol, Src Port: 41265 (41265), Dst Port: https (443), Seq: 1288, Ack: 1123, Len: 0

No.     Time        Source                Destination           Protocol Length Info
    728 1665.909393 100.77.14.234         184.173.161.163       TCP      68     41265 > https [ACK] Seq=1288 Ack=1141 Win=6312 Len=0 TSval=75813 TSecr=2583976869

Frame 728: 68 bytes on wire (544 bits), 68 bytes captured (544 bits)
Linux cooked capture
Internet Protocol Version 4, Src: 100.77.14.234 (100.77.14.234), Dst: 184.173.161.163 (184.173.161.163)
Transmission Control Protocol, Src Port: 41265 (41265), Dst Port: https (443), Seq: 1288, Ack: 1141, Len: 0

No.     Time        Source                Destination           Protocol Length Info
    729 1669.328751 100.77.14.234         184.173.161.163       SSL      100    Continuation Data

Frame 729: 100 bytes on wire (800 bits), 100 bytes captured (800 bits)
Linux cooked capture
Internet Protocol Version 4, Src: 100.77.14.234 (100.77.14.234), Dst: 184.173.161.163 (184.173.161.163)
Transmission Control Protocol, Src Port: 41265 (41265), Dst Port: https (443), Seq: 1288, Ack: 1141, Len: 32
Secure Sockets Layer

No.     Time        Source                Destination           Protocol Length Info
    731 1669.848378 100.77.14.234         184.173.161.163       SSL      100    Continuation Data

Frame 731: 100 bytes on wire (800 bits), 100 bytes captured (800 bits)
Linux cooked capture
Internet Protocol Version 4, Src: 100.77.14.234 (100.77.14.234), Dst: 184.173.161.163 (184.173.161.163)
Transmission Control Protocol, Src Port: 41265 (41265), Dst Port: https (443), Seq: 1320, Ack: 1141, Len: 32
Secure Sockets Layer

No.     Time        Source                Destination           Protocol Length Info
    733 1680.522468 100.77.14.234         184.173.161.163       SSL      100    Continuation Data

Frame 733: 100 bytes on wire (800 bits), 100 bytes captured (800 bits)
Linux cooked capture
Internet Protocol Version 4, Src: 100.77.14.234 (100.77.14.234), Dst: 184.173.161.163 (184.173.161.163)
Transmission Control Protocol, Src Port: 41265 (41265), Dst Port: https (443), Seq: 1352, Ack: 1141, Len: 32
Secure Sockets Layer

No.     Time        Source                Destination           Protocol Length Info
    735 1681.068450 100.77.14.234         184.173.161.163       SSL      146    Continuation Data

Frame 735: 146 bytes on wire (1168 bits), 146 bytes captured (1168 bits)
Linux cooked capture
Internet Protocol Version 4, Src: 100.77.14.234 (100.77.14.234), Dst: 184.173.161.163 (184.173.161.163)
Transmission Control Protocol, Src Port: 41265 (41265), Dst Port: https (443), Seq: 1384, Ack: 1141, Len: 78
Secure Sockets Layer

No.     Time        Source                Destination           Protocol Length Info
    737 1681.689688 100.77.14.234         184.173.161.163       TCP      68     41265 > https [ACK] Seq=1462 Ack=1186 Win=6312 Len=0 TSval=77391 TSecr=2583992649

Frame 737: 68 bytes on wire (544 bits), 68 bytes captured (544 bits)
Linux cooked capture
Internet Protocol Version 4, Src: 100.77.14.234 (100.77.14.234), Dst: 184.173.161.163 (184.173.161.163)
Transmission Control Protocol, Src Port: 41265 (41265), Dst Port: https (443), Seq: 1462, Ack: 1186, Len: 0

No.     Time        Source                Destination           Protocol Length Info
    739 1681.879056 100.77.14.234         184.173.161.163       TCP      68     41265 > https [ACK] Seq=1462 Ack=1229 Win=6312 Len=0 TSval=77410 TSecr=2583992844

Frame 739: 68 bytes on wire (544 bits), 68 bytes captured (544 bits)
Linux cooked capture
Internet Protocol Version 4, Src: 100.77.14.234 (100.77.14.234), Dst: 184.173.161.163 (184.173.161.163)
Transmission Control Protocol, Src Port: 41265 (41265), Dst Port: https (443), Seq: 1462, Ack: 1229, Len: 0

No.     Time        Source                Destination           Protocol Length Info
    740 1681.902596 100.77.14.234         184.173.161.163       SSL      113    Continuation Data

Frame 740: 113 bytes on wire (904 bits), 113 bytes captured (904 bits)
Linux cooked capture
Internet Protocol Version 4, Src: 100.77.14.234 (100.77.14.234), Dst: 184.173.161.163 (184.173.161.163)
Transmission Control Protocol, Src Port: 41265 (41265), Dst Port: https (443), Seq: 1462, Ack: 1229, Len: 45
Secure Sockets Layer

No.     Time        Source                Destination           Protocol Length Info
    741 1683.490405 100.77.14.234         184.173.161.163       SSL      113    [TCP Retransmission] Continuation Data

Frame 741: 113 bytes on wire (904 bits), 113 bytes captured (904 bits)
Linux cooked capture
Internet Protocol Version 4, Src: 100.77.14.234 (100.77.14.234), Dst: 184.173.161.163 (184.173.161.163)
Transmission Control Protocol, Src Port: 41265 (41265), Dst Port: https (443), Seq: 1462, Ack: 1229, Len: 45
Secure Sockets Layer

No.     Time        Source                Destination           Protocol Length Info
    748 1699.564840 100.77.14.234         184.173.161.163       SSL      80     Continuation Data

Frame 748: 80 bytes on wire (640 bits), 80 bytes captured (640 bits)
Linux cooked capture
Internet Protocol Version 4, Src: 100.77.14.234 (100.77.14.234), Dst: 184.173.161.163 (184.173.161.163)
Transmission Control Protocol, Src Port: 41265 (41265), Dst Port: https (443), Seq: 1507, Ack: 1229, Len: 12
Secure Sockets Layer

No.     Time        Source                Destination           Protocol Length Info
    750 1700.020681 100.77.14.234         184.173.161.163       TCP      68     41265 > https [ACK] Seq=1519 Ack=1258 Win=6312 Len=0 TSval=79225 TSecr=2584010917

Frame 750: 68 bytes on wire (544 bits), 68 bytes captured (544 bits)
Linux cooked capture
Internet Protocol Version 4, Src: 100.77.14.234 (100.77.14.234), Dst: 184.173.161.163 (184.173.161.163)
Transmission Control Protocol, Src Port: 41265 (41265), Dst Port: https (443), Seq: 1519, Ack: 1258, Len: 0

No.     Time        Source                Destination           Protocol Length Info
    752 1707.351485 100.77.14.234         184.173.161.163       TCP      68     41265 > https [ACK] Seq=1519 Ack=1300 Win=6312 Len=0 TSval=79958 TSecr=2584117243

Frame 752: 68 bytes on wire (544 bits), 68 bytes captured (544 bits)
Linux cooked capture
Internet Protocol Version 4, Src: 100.77.14.234 (100.77.14.234), Dst: 184.173.161.163 (184.173.161.163)
Transmission Control Protocol, Src Port: 41265 (41265), Dst Port: https (443), Seq: 1519, Ack: 1300, Len: 0

No.     Time        Source                Destination           Protocol Length Info
    757 1707.352050 100.77.14.234         184.173.161.163       TCP      68     41265 > https [ACK] Seq=1519 Ack=1342 Win=6312 Len=0 TSval=79958 TSecr=2584117479

Frame 757: 68 bytes on wire (544 bits), 68 bytes captured (544 bits)
Linux cooked capture
Internet Protocol Version 4, Src: 100.77.14.234 (100.77.14.234), Dst: 184.173.161.163 (184.173.161.163)
Transmission Control Protocol, Src Port: 41265 (41265), Dst Port: https (443), Seq: 1519, Ack: 1342, Len: 0

No.     Time        Source                Destination           Protocol Length Info
    758 1707.352144 100.77.14.234         184.173.161.163       TCP      68     41265 > https [ACK] Seq=1519 Ack=1384 Win=6312 Len=0 TSval=79958 TSecr=2584117479

Frame 758: 68 bytes on wire (544 bits), 68 bytes captured (544 bits)
Linux cooked capture
Internet Protocol Version 4, Src: 100.77.14.234 (100.77.14.234), Dst: 184.173.161.163 (184.173.161.163)
Transmission Control Protocol, Src Port: 41265 (41265), Dst Port: https (443), Seq: 1519, Ack: 1384, Len: 0

No.     Time        Source                Destination           Protocol Length Info
    759 1707.352219 100.77.14.234         184.173.161.163       TCP      68     41265 > https [ACK] Seq=1519 Ack=1426 Win=6312 Len=0 TSval=79958 TSecr=2584117479

Frame 759: 68 bytes on wire (544 bits), 68 bytes captured (544 bits)
Linux cooked capture
Internet Protocol Version 4, Src: 100.77.14.234 (100.77.14.234), Dst: 184.173.161.163 (184.173.161.163)
Transmission Control Protocol, Src Port: 41265 (41265), Dst Port: https (443), Seq: 1519, Ack: 1426, Len: 0

No.     Time        Source                Destination           Protocol Length Info
    760 1707.352289 100.77.14.234         184.173.161.163       TCP      68     41265 > https [ACK] Seq=1519 Ack=1468 Win=6312 Len=0 TSval=79958 TSecr=2584117480

Frame 760: 68 bytes on wire (544 bits), 68 bytes captured (544 bits)
Linux cooked capture
Internet Protocol Version 4, Src: 100.77.14.234 (100.77.14.234), Dst: 184.173.161.163 (184.173.161.163)
Transmission Control Protocol, Src Port: 41265 (41265), Dst Port: https (443), Seq: 1519, Ack: 1468, Len: 0

No.     Time        Source                Destination           Protocol Length Info
    763 1707.390280 100.77.14.234         184.173.161.163       TCP      68     41265 > https [ACK] Seq=1519 Ack=1552 Win=6312 Len=0 TSval=79962 TSecr=2584118285

Frame 763: 68 bytes on wire (544 bits), 68 bytes captured (544 bits)
Linux cooked capture
Internet Protocol Version 4, Src: 100.77.14.234 (100.77.14.234), Dst: 184.173.161.163 (184.173.161.163)
Transmission Control Protocol, Src Port: 41265 (41265), Dst Port: https (443), Seq: 1519, Ack: 1552, Len: 0

No.     Time        Source                Destination           Protocol Length Info
    765 1707.597436 100.77.14.234         184.173.161.163       TCP      80     [TCP Dup ACK 763#1] 41265 > https [ACK] Seq=1519 Ack=1552 Win=6312 Len=0 TSval=79982 TSecr=2584119127 SLE=1258 SRE=1552

Frame 765: 80 bytes on wire (640 bits), 80 bytes captured (640 bits)
Linux cooked capture
Internet Protocol Version 4, Src: 100.77.14.234 (100.77.14.234), Dst: 184.173.161.163 (184.173.161.163)
Transmission Control Protocol, Src Port: 41265 (41265), Dst Port: https (443), Seq: 1519, Ack: 1552, Len: 0

No.     Time        Source                Destination           Protocol Length Info
    766 1809.044845 100.77.14.234         184.173.161.163       SSL      112    Continuation Data

Frame 766: 112 bytes on wire (896 bits), 112 bytes captured (896 bits)
Linux cooked capture
Internet Protocol Version 4, Src: 100.77.14.234 (100.77.14.234), Dst: 184.173.161.163 (184.173.161.163)
Transmission Control Protocol, Src Port: 41265 (41265), Dst Port: https (443), Seq: 1519, Ack: 1552, Len: 44
Secure Sockets Layer

No.     Time        Source                Destination           Protocol Length Info
    768 1809.380043 100.77.14.234         184.173.161.163       SSL      332    Continuation Data

Frame 768: 332 bytes on wire (2656 bits), 332 bytes captured (2656 bits)
Linux cooked capture
Internet Protocol Version 4, Src: 100.77.14.234 (100.77.14.234), Dst: 184.173.161.163 (184.173.161.163)
Transmission Control Protocol, Src Port: 41265 (41265), Dst Port: https (443), Seq: 1563, Ack: 1552, Len: 264
Secure Sockets Layer

No.     Time        Source                Destination           Protocol Length Info
    770 1809.489870 100.77.14.234         184.173.161.163       TCP      68     41265 > https [ACK] Seq=1827 Ack=1594 Win=6312 Len=0 TSval=80094 TSecr=2584120278

Frame 770: 68 bytes on wire (544 bits), 68 bytes captured (544 bits)
Linux cooked capture
Internet Protocol Version 4, Src: 100.77.14.234 (100.77.14.234), Dst: 184.173.161.163 (184.173.161.163)
Transmission Control Protocol, Src Port: 41265 (41265), Dst Port: https (443), Seq: 1827, Ack: 1594, Len: 0

No.     Time        Source                Destination           Protocol Length Info
    772 1809.780182 100.77.14.234         184.173.161.163       SSL      112    Continuation Data

Frame 772: 112 bytes on wire (896 bits), 112 bytes captured (896 bits)
Linux cooked capture
Internet Protocol Version 4, Src: 100.77.14.234 (100.77.14.234), Dst: 184.173.161.163 (184.173.161.163)
Transmission Control Protocol, Src Port: 41265 (41265), Dst Port: https (443), Seq: 1827, Ack: 1594, Len: 44
Secure Sockets Layer

No.     Time        Source                Destination           Protocol Length Info
    775 1810.740540 100.77.14.234         184.173.161.163       TCP      68     41265 > https [ACK] Seq=1871 Ack=1636 Win=6312 Len=0 TSval=80219 TSecr=2584121518

Frame 775: 68 bytes on wire (544 bits), 68 bytes captured (544 bits)
Linux cooked capture
Internet Protocol Version 4, Src: 100.77.14.234 (100.77.14.234), Dst: 184.173.161.163 (184.173.161.163)
Transmission Control Protocol, Src Port: 41265 (41265), Dst Port: https (443), Seq: 1871, Ack: 1636, Len: 0

No.     Time        Source                Destination           Protocol Length Info
    776 1810.756572 100.77.14.234         184.173.161.163       SSL      112    Continuation Data

Frame 776: 112 bytes on wire (896 bits), 112 bytes captured (896 bits)
Linux cooked capture
Internet Protocol Version 4, Src: 100.77.14.234 (100.77.14.234), Dst: 184.173.161.163 (184.173.161.163)
Transmission Control Protocol, Src Port: 41265 (41265), Dst Port: https (443), Seq: 1871, Ack: 1636, Len: 44
Secure Sockets Layer

No.     Time        Source                Destination           Protocol Length Info
    779 1812.516479 100.77.14.234         184.173.161.163       SSL      113    Continuation Data

Frame 779: 113 bytes on wire (904 bits), 113 bytes captured (904 bits)
Linux cooked capture
Internet Protocol Version 4, Src: 100.77.14.234 (100.77.14.234), Dst: 184.173.161.163 (184.173.161.163)
Transmission Control Protocol, Src Port: 41265 (41265), Dst Port: https (443), Seq: 1915, Ack: 1679, Len: 45
Secure Sockets Layer

No.     Time        Source                Destination           Protocol Length Info
    781 1812.662970 100.77.14.234         184.173.161.163       TCP      68     41265 > https [ACK] Seq=1960 Ack=1722 Win=6312 Len=0 TSval=80412 TSecr=2584123413

Frame 781: 68 bytes on wire (544 bits), 68 bytes captured (544 bits)
Linux cooked capture
Internet Protocol Version 4, Src: 100.77.14.234 (100.77.14.234), Dst: 184.173.161.163 (184.173.161.163)
Transmission Control Protocol, Src Port: 41265 (41265), Dst Port: https (443), Seq: 1960, Ack: 1722, Len: 0

No.     Time        Source                Destination           Protocol Length Info
    783 1812.810020 100.77.14.234         184.173.161.163       SSL      113    Continuation Data

Frame 783: 113 bytes on wire (904 bits), 113 bytes captured (904 bits)
Linux cooked capture
Internet Protocol Version 4, Src: 100.77.14.234 (100.77.14.234), Dst: 184.173.161.163 (184.173.161.163)
Transmission Control Protocol, Src Port: 41265 (41265), Dst Port: https (443), Seq: 1960, Ack: 1722, Len: 45
Secure Sockets Layer

No.     Time        Source                Destination           Protocol Length Info
