No.     Time        Source                Destination           Protocol Length Info
      1 0.000000    10.150.223.113        50.22.225.67          TCP      76     47193 > xmpp-client [SYN] Seq=0 Win=5240 Len=0 MSS=1310 SACK_PERM=1 TSval=428909 TSecr=0 WS=4

Frame 1: 76 bytes on wire (608 bits), 76 bytes captured (608 bits)
Linux cooked capture
Internet Protocol Version 4, Src: 10.150.223.113 (10.150.223.113), Dst: 50.22.225.67 (50.22.225.67)
Transmission Control Protocol, Src Port: 47193 (47193), Dst Port: xmpp-client (5222), Seq: 0, Len: 0

No.     Time        Source                Destination           Protocol Length Info
      2 0.943435    50.22.225.67          10.150.223.113        TCP      76     xmpp-client > 47193 [SYN, ACK] Seq=0 Ack=1 Win=65535 Len=0 MSS=1310 WS=512 SACK_PERM=1 TSval=2463953385 TSecr=428909

Frame 2: 76 bytes on wire (608 bits), 76 bytes captured (608 bits)
Linux cooked capture
Internet Protocol Version 4, Src: 50.22.225.67 (50.22.225.67), Dst: 10.150.223.113 (10.150.223.113)
Transmission Control Protocol, Src Port: xmpp-client (5222), Dst Port: 47193 (47193), Seq: 0, Ack: 1, Len: 0

No.     Time        Source                Destination           Protocol Length Info
      3 0.943744    10.150.223.113        50.22.225.67          TCP      68     47193 > xmpp-client [ACK] Seq=1 Ack=1 Win=5240 Len=0 TSval=429003 TSecr=2463953385

Frame 3: 68 bytes on wire (544 bits), 68 bytes captured (544 bits)
Linux cooked capture
Internet Protocol Version 4, Src: 10.150.223.113 (10.150.223.113), Dst: 50.22.225.67 (50.22.225.67)
Transmission Control Protocol, Src Port: 47193 (47193), Dst Port: xmpp-client (5222), Seq: 1, Ack: 1, Len: 0

No.     Time        Source                Destination           Protocol Length Info
      4 1.026512    10.150.223.113        50.22.225.67          TCP      176    [TCP segment of a reassembled PDU]

Frame 4: 176 bytes on wire (1408 bits), 176 bytes captured (1408 bits)
Linux cooked capture
Internet Protocol Version 4, Src: 10.150.223.113 (10.150.223.113), Dst: 50.22.225.67 (50.22.225.67)
Transmission Control Protocol, Src Port: 47193 (47193), Dst Port: xmpp-client (5222), Seq: 1, Ack: 1, Len: 108

No.     Time        Source                Destination           Protocol Length Info
      5 1.203299    50.22.225.67          10.150.223.113        TCP      68     [TCP Window Update] xmpp-client > 47193 [ACK] Seq=1 Ack=1 Win=262144 Len=0 TSval=2463954273 TSecr=429003

Frame 5: 68 bytes on wire (544 bits), 68 bytes captured (544 bits)
Linux cooked capture
Internet Protocol Version 4, Src: 50.22.225.67 (50.22.225.67), Dst: 10.150.223.113 (10.150.223.113)
Transmission Control Protocol, Src Port: xmpp-client (5222), Dst Port: 47193 (47193), Seq: 1, Ack: 1, Len: 0

No.     Time        Source                Destination           Protocol Length Info
      6 1.323780    50.22.225.67          10.150.223.113        TCP      157    [TCP segment of a reassembled PDU]

Frame 6: 157 bytes on wire (1256 bits), 157 bytes captured (1256 bits)
Linux cooked capture
Internet Protocol Version 4, Src: 50.22.225.67 (50.22.225.67), Dst: 10.150.223.113 (10.150.223.113)
Transmission Control Protocol, Src Port: xmpp-client (5222), Dst Port: 47193 (47193), Seq: 1, Ack: 109, Len: 89

No.     Time        Source                Destination           Protocol Length Info
      7 1.324115    10.150.223.113        50.22.225.67          TCP      68     47193 > xmpp-client [ACK] Seq=109 Ack=90 Win=5240 Len=0 TSval=429041 TSecr=2463954393

Frame 7: 68 bytes on wire (544 bits), 68 bytes captured (544 bits)
Linux cooked capture
Internet Protocol Version 4, Src: 10.150.223.113 (10.150.223.113), Dst: 50.22.225.67 (50.22.225.67)
Transmission Control Protocol, Src Port: 47193 (47193), Dst Port: xmpp-client (5222), Seq: 109, Ack: 90, Len: 0

No.     Time        Source                Destination           Protocol Length Info
      8 1.328014    10.150.223.113        50.22.225.67          TCP      97     [TCP segment of a reassembled PDU]

Frame 8: 97 bytes on wire (776 bits), 97 bytes captured (776 bits)
Linux cooked capture
Internet Protocol Version 4, Src: 10.150.223.113 (10.150.223.113), Dst: 50.22.225.67 (50.22.225.67)
Transmission Control Protocol, Src Port: 47193 (47193), Dst Port: xmpp-client (5222), Seq: 109, Ack: 90, Len: 29

No.     Time        Source                Destination           Protocol Length Info
      9 1.363247    50.22.225.67          10.150.223.113        TCP      89     [TCP segment of a reassembled PDU]

Frame 9: 89 bytes on wire (712 bits), 89 bytes captured (712 bits)
Linux cooked capture
Internet Protocol Version 4, Src: 50.22.225.67 (50.22.225.67), Dst: 10.150.223.113 (10.150.223.113)
Transmission Control Protocol, Src Port: xmpp-client (5222), Dst Port: 47193 (47193), Seq: 90, Ack: 109, Len: 21

No.     Time        Source                Destination           Protocol Length Info
     10 1.398032    10.150.223.113        50.22.225.67          TCP      68     47193 > xmpp-client [ACK] Seq=138 Ack=111 Win=5240 Len=0 TSval=429049 TSecr=2463954437

Frame 10: 68 bytes on wire (544 bits), 68 bytes captured (544 bits)
Linux cooked capture
Internet Protocol Version 4, Src: 10.150.223.113 (10.150.223.113), Dst: 50.22.225.67 (50.22.225.67)
Transmission Control Protocol, Src Port: 47193 (47193), Dst Port: xmpp-client (5222), Seq: 138, Ack: 111, Len: 0

No.     Time        Source                Destination           Protocol Length Info
     11 1.663247    50.22.225.67          10.150.223.113        TCP      68     xmpp-client > 47193 [ACK] Seq=111 Ack=138 Win=262144 Len=0 TSval=2463954742 TSecr=429041

Frame 11: 68 bytes on wire (544 bits), 68 bytes captured (544 bits)
Linux cooked capture
Internet Protocol Version 4, Src: 50.22.225.67 (50.22.225.67), Dst: 10.150.223.113 (10.150.223.113)
Transmission Control Protocol, Src Port: xmpp-client (5222), Dst Port: 47193 (47193), Seq: 111, Ack: 138, Len: 0

No.     Time        Source                Destination           Protocol Length Info
     12 1.663612    10.150.223.113        50.22.225.67          TCP      160    [TCP segment of a reassembled PDU]

Frame 12: 160 bytes on wire (1280 bits), 160 bytes captured (1280 bits)
Linux cooked capture
Internet Protocol Version 4, Src: 10.150.223.113 (10.150.223.113), Dst: 50.22.225.67 (50.22.225.67)
Transmission Control Protocol, Src Port: 47193 (47193), Dst Port: xmpp-client (5222), Seq: 138, Ack: 111, Len: 92

No.     Time        Source                Destination           Protocol Length Info
     13 1.973292    50.22.225.67          10.150.223.113        TCP      257    [TCP segment of a reassembled PDU]

Frame 13: 257 bytes on wire (2056 bits), 257 bytes captured (2056 bits)
Linux cooked capture
Internet Protocol Version 4, Src: 50.22.225.67 (50.22.225.67), Dst: 10.150.223.113 (10.150.223.113)
Transmission Control Protocol, Src Port: xmpp-client (5222), Dst Port: 47193 (47193), Seq: 111, Ack: 230, Len: 189

No.     Time        Source                Destination           Protocol Length Info
     14 1.973642    10.150.223.113        50.22.225.67          TCP      68     47193 > xmpp-client [ACK] Seq=230 Ack=300 Win=6312 Len=0 TSval=429106 TSecr=2463955034

Frame 14: 68 bytes on wire (544 bits), 68 bytes captured (544 bits)
Linux cooked capture
Internet Protocol Version 4, Src: 10.150.223.113 (10.150.223.113), Dst: 50.22.225.67 (50.22.225.67)
Transmission Control Protocol, Src Port: 47193 (47193), Dst Port: xmpp-client (5222), Seq: 230, Ack: 300, Len: 0

No.     Time        Source                Destination           Protocol Length Info
     15 2.003369    50.22.225.67          10.150.223.113        TCP      113    [TCP segment of a reassembled PDU]

Frame 15: 113 bytes on wire (904 bits), 113 bytes captured (904 bits)
Linux cooked capture
Internet Protocol Version 4, Src: 50.22.225.67 (50.22.225.67), Dst: 10.150.223.113 (10.150.223.113)
Transmission Control Protocol, Src Port: xmpp-client (5222), Dst Port: 47193 (47193), Seq: 300, Ack: 230, Len: 45

No.     Time        Source                Destination           Protocol Length Info
     16 2.004294    10.150.223.113        50.22.225.67          TCP      68     47193 > xmpp-client [ACK] Seq=230 Ack=345 Win=6312 Len=0 TSval=429109 TSecr=2463955072

Frame 16: 68 bytes on wire (544 bits), 68 bytes captured (544 bits)
Linux cooked capture
Internet Protocol Version 4, Src: 10.150.223.113 (10.150.223.113), Dst: 50.22.225.67 (50.22.225.67)
Transmission Control Protocol, Src Port: 47193 (47193), Dst Port: xmpp-client (5222), Seq: 230, Ack: 345, Len: 0

No.     Time        Source                Destination           Protocol Length Info
     17 3.181775    10.150.223.113        50.22.225.67          TCP      80     [TCP segment of a reassembled PDU]

Frame 17: 80 bytes on wire (640 bits), 80 bytes captured (640 bits)
Linux cooked capture
Internet Protocol Version 4, Src: 10.150.223.113 (10.150.223.113), Dst: 50.22.225.67 (50.22.225.67)
Transmission Control Protocol, Src Port: 47193 (47193), Dst Port: xmpp-client (5222), Seq: 230, Ack: 345, Len: 12

No.     Time        Source                Destination           Protocol Length Info
     18 3.403269    50.22.225.67          10.150.223.113        TCP      95     [TCP segment of a reassembled PDU]

Frame 18: 95 bytes on wire (760 bits), 95 bytes captured (760 bits)
Linux cooked capture
Internet Protocol Version 4, Src: 50.22.225.67 (50.22.225.67), Dst: 10.150.223.113 (10.150.223.113)
Transmission Control Protocol, Src Port: xmpp-client (5222), Dst Port: 47193 (47193), Seq: 345, Ack: 242, Len: 27

No.     Time        Source                Destination           Protocol Length Info
     19 3.404182    10.150.223.113        50.22.225.67          TCP      68     47193 > xmpp-client [ACK] Seq=242 Ack=372 Win=6312 Len=0 TSval=429249 TSecr=2463956472

Frame 19: 68 bytes on wire (544 bits), 68 bytes captured (544 bits)
Linux cooked capture
Internet Protocol Version 4, Src: 10.150.223.113 (10.150.223.113), Dst: 50.22.225.67 (50.22.225.67)
Transmission Control Protocol, Src Port: 47193 (47193), Dst Port: xmpp-client (5222), Seq: 242, Ack: 372, Len: 0

No.     Time        Source                Destination           Protocol Length Info
     20 5.374042    10.150.223.113        50.22.225.67          TCP      132    [TCP segment of a reassembled PDU]

Frame 20: 132 bytes on wire (1056 bits), 132 bytes captured (1056 bits)
Linux cooked capture
Internet Protocol Version 4, Src: 10.150.223.113 (10.150.223.113), Dst: 50.22.225.67 (50.22.225.67)
Transmission Control Protocol, Src Port: 47193 (47193), Dst Port: xmpp-client (5222), Seq: 242, Ack: 372, Len: 64

No.     Time        Source                Destination           Protocol Length Info
     21 5.643275    50.22.225.67          10.150.223.113        TCP      113    [TCP segment of a reassembled PDU]

Frame 21: 113 bytes on wire (904 bits), 113 bytes captured (904 bits)
Linux cooked capture
Internet Protocol Version 4, Src: 50.22.225.67 (50.22.225.67), Dst: 10.150.223.113 (10.150.223.113)
Transmission Control Protocol, Src Port: xmpp-client (5222), Dst Port: 47193 (47193), Seq: 372, Ack: 306, Len: 45

No.     Time        Source                Destination           Protocol Length Info
     22 5.644165    10.150.223.113        50.22.225.67          TCP      68     47193 > xmpp-client [ACK] Seq=306 Ack=417 Win=6312 Len=0 TSval=429473 TSecr=2463958712

Frame 22: 68 bytes on wire (544 bits), 68 bytes captured (544 bits)
Linux cooked capture
Internet Protocol Version 4, Src: 10.150.223.113 (10.150.223.113), Dst: 50.22.225.67 (50.22.225.67)
Transmission Control Protocol, Src Port: 47193 (47193), Dst Port: xmpp-client (5222), Seq: 306, Ack: 417, Len: 0

No.     Time        Source                Destination           Protocol Length Info
     23 7.613277    50.22.225.67          10.150.223.113        TCP      111    [TCP segment of a reassembled PDU]

Frame 23: 111 bytes on wire (888 bits), 111 bytes captured (888 bits)
Linux cooked capture
Internet Protocol Version 4, Src: 50.22.225.67 (50.22.225.67), Dst: 10.150.223.113 (10.150.223.113)
Transmission Control Protocol, Src Port: xmpp-client (5222), Dst Port: 47193 (47193), Seq: 417, Ack: 306, Len: 43

No.     Time        Source                Destination           Protocol Length Info
     24 7.614122    10.150.223.113        50.22.225.67          TCP      68     47193 > xmpp-client [ACK] Seq=306 Ack=460 Win=6312 Len=0 TSval=429670 TSecr=2463960654

Frame 24: 68 bytes on wire (544 bits), 68 bytes captured (544 bits)
Linux cooked capture
Internet Protocol Version 4, Src: 10.150.223.113 (10.150.223.113), Dst: 50.22.225.67 (50.22.225.67)
Transmission Control Protocol, Src Port: 47193 (47193), Dst Port: xmpp-client (5222), Seq: 306, Ack: 460, Len: 0

No.     Time        Source                Destination           Protocol Length Info
     25 7.630375    10.150.223.113        50.22.225.67          TCP      115    [TCP segment of a reassembled PDU]

Frame 25: 115 bytes on wire (920 bits), 115 bytes captured (920 bits)
Linux cooked capture
Internet Protocol Version 4, Src: 10.150.223.113 (10.150.223.113), Dst: 50.22.225.67 (50.22.225.67)
Transmission Control Protocol, Src Port: 47193 (47193), Dst Port: xmpp-client (5222), Seq: 306, Ack: 460, Len: 47

No.     Time        Source                Destination           Protocol Length Info
     26 7.953242    50.22.225.67          10.150.223.113        TCP      68     xmpp-client > 47193 [ACK] Seq=460 Ack=353 Win=262144 Len=0 TSval=2463961022 TSecr=429672

Frame 26: 68 bytes on wire (544 bits), 68 bytes captured (544 bits)
Linux cooked capture
Internet Protocol Version 4, Src: 50.22.225.67 (50.22.225.67), Dst: 10.150.223.113 (10.150.223.113)
Transmission Control Protocol, Src Port: xmpp-client (5222), Dst Port: 47193 (47193), Seq: 460, Ack: 353, Len: 0

No.     Time        Source                Destination           Protocol Length Info
     27 8.108622    10.150.223.113        50.22.225.67          TCP      123    [TCP segment of a reassembled PDU]

Frame 27: 123 bytes on wire (984 bits), 123 bytes captured (984 bits)
Linux cooked capture
Internet Protocol Version 4, Src: 10.150.223.113 (10.150.223.113), Dst: 50.22.225.67 (50.22.225.67)
Transmission Control Protocol, Src Port: 47193 (47193), Dst Port: xmpp-client (5222), Seq: 353, Ack: 460, Len: 55

No.     Time        Source                Destination           Protocol Length Info
     28 8.363375    50.22.225.67          10.150.223.113        TCP      113    [TCP segment of a reassembled PDU]

Frame 28: 113 bytes on wire (904 bits), 113 bytes captured (904 bits)
Linux cooked capture
Internet Protocol Version 4, Src: 50.22.225.67 (50.22.225.67), Dst: 10.150.223.113 (10.150.223.113)
Transmission Control Protocol, Src Port: xmpp-client (5222), Dst Port: 47193 (47193), Seq: 460, Ack: 408, Len: 45

No.     Time        Source                Destination           Protocol Length Info
     29 8.408024    10.150.223.113        50.22.225.67          TCP      68     47193 > xmpp-client [ACK] Seq=408 Ack=505 Win=6312 Len=0 TSval=429750 TSecr=2463961432

Frame 29: 68 bytes on wire (544 bits), 68 bytes captured (544 bits)
Linux cooked capture
Internet Protocol Version 4, Src: 10.150.223.113 (10.150.223.113), Dst: 50.22.225.67 (50.22.225.67)
Transmission Control Protocol, Src Port: 47193 (47193), Dst Port: xmpp-client (5222), Seq: 408, Ack: 505, Len: 0

No.     Time        Source                Destination           Protocol Length Info
     30 8.743279    50.22.225.67          10.150.223.113        TCP      111    [TCP segment of a reassembled PDU]

Frame 30: 111 bytes on wire (888 bits), 111 bytes captured (888 bits)
Linux cooked capture
Internet Protocol Version 4, Src: 50.22.225.67 (50.22.225.67), Dst: 10.150.223.113 (10.150.223.113)
Transmission Control Protocol, Src Port: xmpp-client (5222), Dst Port: 47193 (47193), Seq: 505, Ack: 408, Len: 43

No.     Time        Source                Destination           Protocol Length Info
     31 8.744127    10.150.223.113        50.22.225.67          TCP      68     47193 > xmpp-client [ACK] Seq=408 Ack=548 Win=6312 Len=0 TSval=429783 TSecr=2463961754

Frame 31: 68 bytes on wire (544 bits), 68 bytes captured (544 bits)
Linux cooked capture
Internet Protocol Version 4, Src: 10.150.223.113 (10.150.223.113), Dst: 50.22.225.67 (50.22.225.67)
Transmission Control Protocol, Src Port: 47193 (47193), Dst Port: xmpp-client (5222), Seq: 408, Ack: 548, Len: 0

No.     Time        Source                Destination           Protocol Length Info
     32 8.756204    10.150.223.113        50.22.225.67          TCP      115    [TCP segment of a reassembled PDU]

Frame 32: 115 bytes on wire (920 bits), 115 bytes captured (920 bits)
Linux cooked capture
Internet Protocol Version 4, Src: 10.150.223.113 (10.150.223.113), Dst: 50.22.225.67 (50.22.225.67)
Transmission Control Protocol, Src Port: 47193 (47193), Dst Port: xmpp-client (5222), Seq: 408, Ack: 548, Len: 47

No.     Time        Source                Destination           Protocol Length Info
     33 9.133332    50.22.225.67          10.150.223.113        TCP      68     xmpp-client > 47193 [ACK] Seq=548 Ack=455 Win=262144 Len=0 TSval=2463962144 TSecr=429784

Frame 33: 68 bytes on wire (544 bits), 68 bytes captured (544 bits)
Linux cooked capture
Internet Protocol Version 4, Src: 50.22.225.67 (50.22.225.67), Dst: 10.150.223.113 (10.150.223.113)
Transmission Control Protocol, Src Port: xmpp-client (5222), Dst Port: 47193 (47193), Seq: 548, Ack: 455, Len: 0

No.     Time        Source                Destination           Protocol Length Info
     34 11.742525   10.150.223.113        83.224.70.78          DNS      90     Standard query 0x39a5  A services.dolphin-browser.com

Frame 34: 90 bytes on wire (720 bits), 90 bytes captured (720 bits)
Linux cooked capture
Internet Protocol Version 4, Src: 10.150.223.113 (10.150.223.113), Dst: 83.224.70.78 (83.224.70.78)
User Datagram Protocol, Src Port: 15641 (15641), Dst Port: domain (53)
Domain Name System (query)

No.     Time        Source                Destination           Protocol Length Info
     35 11.826599   10.150.223.113        83.224.70.78          DNS      86     Standard query 0xf483  A home.dolphin-browser.com

Frame 35: 86 bytes on wire (688 bits), 86 bytes captured (688 bits)
Linux cooked capture
Internet Protocol Version 4, Src: 10.150.223.113 (10.150.223.113), Dst: 83.224.70.78 (83.224.70.78)
User Datagram Protocol, Src Port: 63579 (63579), Dst Port: domain (53)
Domain Name System (query)

No.     Time        Source                Destination           Protocol Length Info
     36 11.883250   83.224.70.78          10.150.223.113        DNS      147    Standard query response 0x39a5  CNAME androidservice.cloudapp.net A 65.52.244.183

Frame 36: 147 bytes on wire (1176 bits), 147 bytes captured (1176 bits)
Linux cooked capture
Internet Protocol Version 4, Src: 83.224.70.78 (83.224.70.78), Dst: 10.150.223.113 (10.150.223.113)
User Datagram Protocol, Src Port: domain (53), Dst Port: 15641 (15641)
Domain Name System (response)

No.     Time        Source                Destination           Protocol Length Info
     37 11.885477   10.150.223.113        65.52.244.183         TCP      76     51461 > http [SYN] Seq=0 Win=5240 Len=0 MSS=1310 SACK_PERM=1 TSval=430097 TSecr=0 WS=4

Frame 37: 76 bytes on wire (608 bits), 76 bytes captured (608 bits)
Linux cooked capture
Internet Protocol Version 4, Src: 10.150.223.113 (10.150.223.113), Dst: 65.52.244.183 (65.52.244.183)
Transmission Control Protocol, Src Port: 51461 (51461), Dst Port: http (80), Seq: 0, Len: 0

No.     Time        Source                Destination           Protocol Length Info
     38 11.953420   83.224.70.78          10.150.223.113        DNS      118    Standard query response 0xf483  A 174.129.95.13 A 174.129.112.104

Frame 38: 118 bytes on wire (944 bits), 118 bytes captured (944 bits)
Linux cooked capture
Internet Protocol Version 4, Src: 83.224.70.78 (83.224.70.78), Dst: 10.150.223.113 (10.150.223.113)
User Datagram Protocol, Src Port: domain (53), Dst Port: 63579 (63579)
Domain Name System (response)

No.     Time        Source                Destination           Protocol Length Info
     39 11.957545   10.150.223.113        174.129.95.13         TCP      76     36612 > http [SYN] Seq=0 Win=5240 Len=0 MSS=1310 SACK_PERM=1 TSval=430104 TSecr=0 WS=4

Frame 39: 76 bytes on wire (608 bits), 76 bytes captured (608 bits)
Linux cooked capture
Internet Protocol Version 4, Src: 10.150.223.113 (10.150.223.113), Dst: 174.129.95.13 (174.129.95.13)
Transmission Control Protocol, Src Port: 36612 (36612), Dst Port: http (80), Seq: 0, Len: 0

No.     Time        Source                Destination           Protocol Length Info
     40 12.073347   65.52.244.183         10.150.223.113        TCP      80     http > 51461 [SYN, ACK] Seq=0 Ack=1 Win=64251 Len=0 TSval=361103784 TSecr=430097 MSS=1400 WS=4 SACK_PERM=1

Frame 40: 80 bytes on wire (640 bits), 80 bytes captured (640 bits)
Linux cooked capture
Internet Protocol Version 4, Src: 65.52.244.183 (65.52.244.183), Dst: 10.150.223.113 (10.150.223.113)
Transmission Control Protocol, Src Port: http (80), Dst Port: 51461 (51461), Seq: 0, Ack: 1, Len: 0

No.     Time        Source                Destination           Protocol Length Info
     41 12.073794   10.150.223.113        65.52.244.183         TCP      68     51461 > http [ACK] Seq=1 Ack=1 Win=5240 Len=0 TSval=430116 TSecr=361103784

Frame 41: 68 bytes on wire (544 bits), 68 bytes captured (544 bits)
Linux cooked capture
Internet Protocol Version 4, Src: 10.150.223.113 (10.150.223.113), Dst: 65.52.244.183 (65.52.244.183)
Transmission Control Protocol, Src Port: 51461 (51461), Dst Port: http (80), Seq: 1, Ack: 1, Len: 0

No.     Time        Source                Destination           Protocol Length Info
     42 12.077785   10.150.223.113        65.52.244.183         HTTP     833    GET /api/api.ashx?cmd=Multi&sig=H3bPHIUBxBlA9y6eABI7kvQ9vnyCSVhw7XrxzMkQV5OhCUgKWPryhgb%2FAZSGqef%2F%2BlQoOHl51f3MfPpYCSzMo1vFVyziADCQZENKAjQfWf64HNLExsZGUw9DA8r5Y3fzChnpt3etevp%2Fqe%2BX4%2BPX5HgQevE4F8JACCAkD%2BVwTl17N1z5o1x90BON3%2FWZnfTZ9bHdMXUxI7u4z3yXtyFxcObe1U3LzNImar7sE3As%2BoYyTm2vOua0Guc%2F%2F6R5wygLalKzJfOz1eoK%2BZaEaxBEWWPljtOUY%2BwLl0k%2F%2B7jtM6E96pdkvc0ZPhrKrhoP0U5UyREr2URlq1af7HDaci2Y4u8b2i6Awp1eXO4xch4S1Yfzjf1%2BcHaPXxX3tWPKjQPE HTTP/1.1 

Frame 42: 833 bytes on wire (6664 bits), 833 bytes captured (6664 bits)
Linux cooked capture
Internet Protocol Version 4, Src: 10.150.223.113 (10.150.223.113), Dst: 65.52.244.183 (65.52.244.183)
Transmission Control Protocol, Src Port: 51461 (51461), Dst Port: http (80), Seq: 1, Ack: 1, Len: 765
Hypertext Transfer Protocol

No.     Time        Source                Destination           Protocol Length Info
     43 12.113255   174.129.95.13         10.150.223.113        TCP      80     http > 36612 [SYN, ACK] Seq=0 Ack=1 Win=64251 Len=0 TSval=361103788 TSecr=430104 MSS=1400 WS=4 SACK_PERM=1

Frame 43: 80 bytes on wire (640 bits), 80 bytes captured (640 bits)
Linux cooked capture
Internet Protocol Version 4, Src: 174.129.95.13 (174.129.95.13), Dst: 10.150.223.113 (10.150.223.113)
Transmission Control Protocol, Src Port: http (80), Dst Port: 36612 (36612), Seq: 0, Ack: 1, Len: 0

No.     Time        Source                Destination           Protocol Length Info
     44 12.113612   10.150.223.113        174.129.95.13         TCP      68     36612 > http [ACK] Seq=1 Ack=1 Win=5240 Len=0 TSval=430120 TSecr=361103788

Frame 44: 68 bytes on wire (544 bits), 68 bytes captured (544 bits)
Linux cooked capture
Internet Protocol Version 4, Src: 10.150.223.113 (10.150.223.113), Dst: 174.129.95.13 (174.129.95.13)
Transmission Control Protocol, Src Port: 36612 (36612), Dst Port: http (80), Seq: 1, Ack: 1, Len: 0

No.     Time        Source                Destination           Protocol Length Info
     45 12.129437   10.150.223.113        174.129.95.13         HTTP     319    GET /PromoLink.ashx?pid=2 HTTP/1.1 

Frame 45: 319 bytes on wire (2552 bits), 319 bytes captured (2552 bits)
Linux cooked capture
Internet Protocol Version 4, Src: 10.150.223.113 (10.150.223.113), Dst: 174.129.95.13 (174.129.95.13)
Transmission Control Protocol, Src Port: 36612 (36612), Dst Port: http (80), Seq: 1, Ack: 1, Len: 251
Hypertext Transfer Protocol

No.     Time        Source                Destination           Protocol Length Info
     46 12.608042   10.150.223.113        174.129.95.13         HTTP     319    [TCP Retransmission] GET /PromoLink.ashx?pid=2 HTTP/1.1 

Frame 46: 319 bytes on wire (2552 bits), 319 bytes captured (2552 bits)
Linux cooked capture
Internet Protocol Version 4, Src: 10.150.223.113 (10.150.223.113), Dst: 174.129.95.13 (174.129.95.13)
Transmission Control Protocol, Src Port: 36612 (36612), Dst Port: http (80), Seq: 1, Ack: 1, Len: 251
Hypertext Transfer Protocol

No.     Time        Source                Destination           Protocol Length Info
     47 12.638065   10.150.223.113        65.52.244.183         HTTP     833    [TCP Retransmission] GET /api/api.ashx?cmd=Multi&sig=H3bPHIUBxBlA9y6eABI7kvQ9vnyCSVhw7XrxzMkQV5OhCUgKWPryhgb%2FAZSGqef%2F%2BlQoOHl51f3MfPpYCSzMo1vFVyziADCQZENKAjQfWf64HNLExsZGUw9DA8r5Y3fzChnpt3etevp%2Fqe%2BX4%2BPX5HgQevE4F8JACCAkD%2BVwTl17N1z5o1x90BON3%2FWZnfTZ9bHdMXUxI7u4z3yXtyFxcObe1U3LzNImar7sE3As%2BoYyTm2vOua0Guc%2F%2F6R5wygLalKzJfOz1eoK%2BZaEaxBEWWPljtOUY%2BwLl0k%2F%2B7jtM6E96pdkvc0ZPhrKrhoP0U5UyREr2URlq1af7HDaci2Y4u8b2i6Awp1eXO4xch4S1Yfzjf1%2BcHaPXxX3tWPKjQPE HTTP/1.1 

Frame 47: 833 bytes on wire (6664 bits), 833 bytes captured (6664 bits)
Linux cooked capture
Internet Protocol Version 4, Src: 10.150.223.113 (10.150.223.113), Dst: 65.52.244.183 (65.52.244.183)
Transmission Control Protocol, Src Port: 51461 (51461), Dst Port: http (80), Seq: 1, Ack: 1, Len: 765
Hypertext Transfer Protocol

No.     Time        Source                Destination           Protocol Length Info
     48 12.673319   65.52.244.183         10.150.223.113        TCP      68     http > 51461 [ACK] Seq=1 Ack=766 Win=257004 Len=0 TSval=361103844 TSecr=430116

Frame 48: 68 bytes on wire (544 bits), 68 bytes captured (544 bits)
Linux cooked capture
Internet Protocol Version 4, Src: 65.52.244.183 (65.52.244.183), Dst: 10.150.223.113 (10.150.223.113)
Transmission Control Protocol, Src Port: http (80), Dst Port: 51461 (51461), Seq: 1, Ack: 766, Len: 0

No.     Time        Source                Destination           Protocol Length Info
     49 12.873272   174.129.95.13         10.150.223.113        TCP      68     http > 36612 [ACK] Seq=1 Ack=252 Win=257004 Len=0 TSval=361103864 TSecr=430122

Frame 49: 68 bytes on wire (544 bits), 68 bytes captured (544 bits)
Linux cooked capture
Internet Protocol Version 4, Src: 174.129.95.13 (174.129.95.13), Dst: 10.150.223.113 (10.150.223.113)
Transmission Control Protocol, Src Port: http (80), Dst Port: 36612 (36612), Seq: 1, Ack: 252, Len: 0

No.     Time        Source                Destination           Protocol Length Info
     50 12.983427   65.52.244.183         10.150.223.113        HTTP     1143   HTTP/1.0 200 OK  (text/plain)

Frame 50: 1143 bytes on wire (9144 bits), 1143 bytes captured (9144 bits)
Linux cooked capture
Internet Protocol Version 4, Src: 65.52.244.183 (65.52.244.183), Dst: 10.150.223.113 (10.150.223.113)
Transmission Control Protocol, Src Port: http (80), Dst Port: 51461 (51461), Seq: 1, Ack: 766, Len: 1075
Hypertext Transfer Protocol
Line-based text data: text/plain

No.     Time        Source                Destination           Protocol Length Info
     51 12.983974   10.150.223.113        65.52.244.183         TCP      68     51461 > http [ACK] Seq=766 Ack=1076 Win=7836 Len=0 TSval=430207 TSecr=361103867

Frame 51: 68 bytes on wire (544 bits), 68 bytes captured (544 bits)
Linux cooked capture
Internet Protocol Version 4, Src: 10.150.223.113 (10.150.223.113), Dst: 65.52.244.183 (65.52.244.183)
Transmission Control Protocol, Src Port: 51461 (51461), Dst Port: http (80), Seq: 766, Ack: 1076, Len: 0

No.     Time        Source                Destination           Protocol Length Info
     52 13.033237   174.129.95.13         10.150.223.113        TCP      68     [TCP Dup ACK 49#1] http > 36612 [ACK] Seq=1 Ack=252 Win=257004 Len=0 TSval=361103880 TSecr=430122

Frame 52: 68 bytes on wire (544 bits), 68 bytes captured (544 bits)
Linux cooked capture
Internet Protocol Version 4, Src: 174.129.95.13 (174.129.95.13), Dst: 10.150.223.113 (10.150.223.113)
Transmission Control Protocol, Src Port: http (80), Dst Port: 36612 (36612), Seq: 1, Ack: 252, Len: 0

No.     Time        Source                Destination           Protocol Length Info
     53 13.133295   174.129.95.13         10.150.223.113        HTTP     330    HTTP/1.1 200 OK  (text/plain)

Frame 53: 330 bytes on wire (2640 bits), 330 bytes captured (2640 bits)
Linux cooked capture
Internet Protocol Version 4, Src: 174.129.95.13 (174.129.95.13), Dst: 10.150.223.113 (10.150.223.113)
Transmission Control Protocol, Src Port: http (80), Dst Port: 36612 (36612), Seq: 1, Ack: 252, Len: 262
Hypertext Transfer Protocol
Line-based text data: text/plain

No.     Time        Source                Destination           Protocol Length Info
     54 13.137592   10.150.223.113        174.129.95.13         TCP      68     36612 > http [ACK] Seq=252 Ack=263 Win=7836 Len=0 TSval=430222 TSecr=361103890

Frame 54: 68 bytes on wire (544 bits), 68 bytes captured (544 bits)
Linux cooked capture
Internet Protocol Version 4, Src: 10.150.223.113 (10.150.223.113), Dst: 174.129.95.13 (174.129.95.13)
Transmission Control Protocol, Src Port: 36612 (36612), Dst Port: http (80), Seq: 252, Ack: 263, Len: 0

No.     Time        Source                Destination           Protocol Length Info
     55 13.563267   65.52.244.183         10.150.223.113        TCP      68     [TCP Dup ACK 50#1] http > 51461 [ACK] Seq=1076 Ack=766 Win=257004 Len=0 TSval=361103932 TSecr=430116

Frame 55: 68 bytes on wire (544 bits), 68 bytes captured (544 bits)
Linux cooked capture
Internet Protocol Version 4, Src: 65.52.244.183 (65.52.244.183), Dst: 10.150.223.113 (10.150.223.113)
Transmission Control Protocol, Src Port: http (80), Dst Port: 51461 (51461), Seq: 1076, Ack: 766, Len: 0

No.     Time        Source                Destination           Protocol Length Info
     56 14.197704   10.150.223.113        174.129.95.13         TCP      68     36612 > http [FIN, ACK] Seq=252 Ack=263 Win=7836 Len=0 TSval=430328 TSecr=361103890

Frame 56: 68 bytes on wire (544 bits), 68 bytes captured (544 bits)
Linux cooked capture
Internet Protocol Version 4, Src: 10.150.223.113 (10.150.223.113), Dst: 174.129.95.13 (174.129.95.13)
Transmission Control Protocol, Src Port: 36612 (36612), Dst Port: http (80), Seq: 252, Ack: 263, Len: 0

No.     Time        Source                Destination           Protocol Length Info
     57 14.353265   174.129.95.13         10.150.223.113        TCP      68     http > 36612 [ACK] Seq=263 Ack=253 Win=257004 Len=0 TSval=361104012 TSecr=430328

Frame 57: 68 bytes on wire (544 bits), 68 bytes captured (544 bits)
Linux cooked capture
Internet Protocol Version 4, Src: 174.129.95.13 (174.129.95.13), Dst: 10.150.223.113 (10.150.223.113)
Transmission Control Protocol, Src Port: http (80), Dst Port: 36612 (36612), Seq: 263, Ack: 253, Len: 0

No.     Time        Source                Destination           Protocol Length Info
     58 14.353600   174.129.95.13         10.150.223.113        TCP      68     http > 36612 [FIN, ACK] Seq=263 Ack=253 Win=257004 Len=0 TSval=361104012 TSecr=430328

Frame 58: 68 bytes on wire (544 bits), 68 bytes captured (544 bits)
Linux cooked capture
Internet Protocol Version 4, Src: 174.129.95.13 (174.129.95.13), Dst: 10.150.223.113 (10.150.223.113)
Transmission Control Protocol, Src Port: http (80), Dst Port: 36612 (36612), Seq: 263, Ack: 253, Len: 0

No.     Time        Source                Destination           Protocol Length Info
     59 14.353704   10.150.223.113        174.129.95.13         TCP      68     36612 > http [ACK] Seq=253 Ack=264 Win=7836 Len=0 TSval=430344 TSecr=361104012

Frame 59: 68 bytes on wire (544 bits), 68 bytes captured (544 bits)
Linux cooked capture
Internet Protocol Version 4, Src: 10.150.223.113 (10.150.223.113), Dst: 174.129.95.13 (174.129.95.13)
Transmission Control Protocol, Src Port: 36612 (36612), Dst Port: http (80), Seq: 253, Ack: 264, Len: 0

No.     Time        Source                Destination           Protocol Length Info
     60 15.493327   10.150.223.113        83.224.70.78          DNS      77     Standard query 0xe6fe  A www.di.univr.it

Frame 60: 77 bytes on wire (616 bits), 77 bytes captured (616 bits)
Linux cooked capture
Internet Protocol Version 4, Src: 10.150.223.113 (10.150.223.113), Dst: 83.224.70.78 (83.224.70.78)
User Datagram Protocol, Src Port: 60086 (60086), Dst Port: domain (53)
Domain Name System (query)

No.     Time        Source                Destination           Protocol Length Info
     61 15.663275   83.224.70.78          10.150.223.113        DNS      114    Standard query response 0xe6fe  CNAME websrv.univr.it A 157.27.6.235

Frame 61: 114 bytes on wire (912 bits), 114 bytes captured (912 bits)
Linux cooked capture
Internet Protocol Version 4, Src: 83.224.70.78 (83.224.70.78), Dst: 10.150.223.113 (10.150.223.113)
User Datagram Protocol, Src Port: domain (53), Dst Port: 60086 (60086)
Domain Name System (response)

No.     Time        Source                Destination           Protocol Length Info
     62 15.664659   10.150.223.113        157.27.6.235          TCP      76     45350 > http [SYN] Seq=0 Win=5240 Len=0 MSS=1310 SACK_PERM=1 TSval=430475 TSecr=0 WS=4

Frame 62: 76 bytes on wire (608 bits), 76 bytes captured (608 bits)
Linux cooked capture
Internet Protocol Version 4, Src: 10.150.223.113 (10.150.223.113), Dst: 157.27.6.235 (157.27.6.235)
Transmission Control Protocol, Src Port: 45350 (45350), Dst Port: http (80), Seq: 0, Len: 0

No.     Time        Source                Destination           Protocol Length Info
     63 15.823272   157.27.6.235          10.150.223.113        TCP      80     http > 45350 [SYN, ACK] Seq=0 Ack=1 Win=64251 Len=0 TSval=361104160 TSecr=430475 MSS=1400 WS=4 SACK_PERM=1

Frame 63: 80 bytes on wire (640 bits), 80 bytes captured (640 bits)
Linux cooked capture
Internet Protocol Version 4, Src: 157.27.6.235 (157.27.6.235), Dst: 10.150.223.113 (10.150.223.113)
Transmission Control Protocol, Src Port: http (80), Dst Port: 45350 (45350), Seq: 0, Ack: 1, Len: 0

No.     Time        Source                Destination           Protocol Length Info
     64 15.823734   10.150.223.113        157.27.6.235          TCP      68     45350 > http [ACK] Seq=1 Ack=1 Win=5240 Len=0 TSval=430491 TSecr=361104160

Frame 64: 68 bytes on wire (544 bits), 68 bytes captured (544 bits)
Linux cooked capture
Internet Protocol Version 4, Src: 10.150.223.113 (10.150.223.113), Dst: 157.27.6.235 (157.27.6.235)
Transmission Control Protocol, Src Port: 45350 (45350), Dst Port: http (80), Seq: 1, Ack: 1, Len: 0

No.     Time        Source                Destination           Protocol Length Info
     65 15.830165   10.150.223.113        157.27.6.235          HTTP     580    GET /?ent=avvisoin&cs=420 HTTP/1.1 

Frame 65: 580 bytes on wire (4640 bits), 580 bytes captured (4640 bits)
Linux cooked capture
Internet Protocol Version 4, Src: 10.150.223.113 (10.150.223.113), Dst: 157.27.6.235 (157.27.6.235)
Transmission Control Protocol, Src Port: 45350 (45350), Dst Port: http (80), Seq: 1, Ack: 1, Len: 512
Hypertext Transfer Protocol

No.     Time        Source                Destination           Protocol Length Info
     66 16.263252   157.27.6.235          10.150.223.113        TCP      68     http > 45350 [ACK] Seq=1 Ack=513 Win=257004 Len=0 TSval=361104204 TSecr=430492

Frame 66: 68 bytes on wire (544 bits), 68 bytes captured (544 bits)
Linux cooked capture
Internet Protocol Version 4, Src: 157.27.6.235 (157.27.6.235), Dst: 10.150.223.113 (10.150.223.113)
Transmission Control Protocol, Src Port: http (80), Dst Port: 45350 (45350), Seq: 1, Ack: 513, Len: 0

No.     Time        Source                Destination           Protocol Length Info
     67 16.473515   157.27.6.235          10.150.223.113        TCP      1366   [TCP segment of a reassembled PDU]

Frame 67: 1366 bytes on wire (10928 bits), 1366 bytes captured (10928 bits)
Linux cooked capture
Internet Protocol Version 4, Src: 157.27.6.235 (157.27.6.235), Dst: 10.150.223.113 (10.150.223.113)
Transmission Control Protocol, Src Port: http (80), Dst Port: 45350 (45350), Seq: 1, Ack: 513, Len: 1298

No.     Time        Source                Destination           Protocol Length Info
     68 16.474002   10.150.223.113        157.27.6.235          TCP      68     45350 > http [ACK] Seq=513 Ack=1299 Win=7836 Len=0 TSval=430556 TSecr=361104223

Frame 68: 68 bytes on wire (544 bits), 68 bytes captured (544 bits)
Linux cooked capture
Internet Protocol Version 4, Src: 10.150.223.113 (10.150.223.113), Dst: 157.27.6.235 (157.27.6.235)
Transmission Control Protocol, Src Port: 45350 (45350), Dst Port: http (80), Seq: 513, Ack: 1299, Len: 0

No.     Time        Source                Destination           Protocol Length Info
     69 16.493639   157.27.6.235          10.150.223.113        TCP      1366   [TCP segment of a reassembled PDU]

Frame 69: 1366 bytes on wire (10928 bits), 1366 bytes captured (10928 bits)
Linux cooked capture
Internet Protocol Version 4, Src: 157.27.6.235 (157.27.6.235), Dst: 10.150.223.113 (10.150.223.113)
Transmission Control Protocol, Src Port: http (80), Dst Port: 45350 (45350), Seq: 1299, Ack: 513, Len: 1298

No.     Time        Source                Destination           Protocol Length Info
     70 16.493959   10.150.223.113        157.27.6.235          TCP      68     45350 > http [ACK] Seq=513 Ack=2597 Win=10432 Len=0 TSval=430558 TSecr=361104223

Frame 70: 68 bytes on wire (544 bits), 68 bytes captured (544 bits)
Linux cooked capture
Internet Protocol Version 4, Src: 10.150.223.113 (10.150.223.113), Dst: 157.27.6.235 (157.27.6.235)
Transmission Control Protocol, Src Port: 45350 (45350), Dst Port: http (80), Seq: 513, Ack: 2597, Len: 0

No.     Time        Source                Destination           Protocol Length Info
     71 16.543489   157.27.6.235          10.150.223.113        TCP      940    [TCP segment of a reassembled PDU]

Frame 71: 940 bytes on wire (7520 bits), 940 bytes captured (7520 bits)
Linux cooked capture
Internet Protocol Version 4, Src: 157.27.6.235 (157.27.6.235), Dst: 10.150.223.113 (10.150.223.113)
Transmission Control Protocol, Src Port: http (80), Dst Port: 45350 (45350), Seq: 2597, Ack: 513, Len: 872

No.     Time        Source                Destination           Protocol Length Info
     72 16.543792   10.150.223.113        157.27.6.235          TCP      68     45350 > http [ACK] Seq=513 Ack=3469 Win=13028 Len=0 TSval=430563 TSecr=361104223

Frame 72: 68 bytes on wire (544 bits), 68 bytes captured (544 bits)
Linux cooked capture
Internet Protocol Version 4, Src: 10.150.223.113 (10.150.223.113), Dst: 157.27.6.235 (157.27.6.235)
Transmission Control Protocol, Src Port: 45350 (45350), Dst Port: http (80), Seq: 513, Ack: 3469, Len: 0

No.     Time        Source                Destination           Protocol Length Info
     73 16.553305   157.27.6.235          10.150.223.113        TCP      679    [TCP segment of a reassembled PDU]

Frame 73: 679 bytes on wire (5432 bits), 679 bytes captured (5432 bits)
Linux cooked capture
Internet Protocol Version 4, Src: 157.27.6.235 (157.27.6.235), Dst: 10.150.223.113 (10.150.223.113)
Transmission Control Protocol, Src Port: http (80), Dst Port: 45350 (45350), Seq: 3469, Ack: 513, Len: 611

No.     Time        Source                Destination           Protocol Length Info
