No.     Time        Source                Destination           Protocol Length Info
      1 0.000000    176.244.206.69        69.171.248.65         TLSv1    382    Client Key Exchange, Change Cipher Spec, Encrypted Handshake Message

Frame 1: 382 bytes on wire (3056 bits), 382 bytes captured (3056 bits)
Linux cooked capture
Internet Protocol Version 4, Src: 176.244.206.69 (176.244.206.69), Dst: 69.171.248.65 (69.171.248.65)
Transmission Control Protocol, Src Port: 51867 (51867), Dst Port: https (443), Seq: 1, Ack: 1, Len: 314
Secure Sockets Layer

No.     Time        Source                Destination           Protocol Length Info
      2 0.424660    69.171.248.65         176.244.206.69        TCP      68     https > 51867 [ACK] Seq=1 Ack=315 Win=68 Len=0 TSval=1370985812 TSecr=462692

Frame 2: 68 bytes on wire (544 bits), 68 bytes captured (544 bits)
Linux cooked capture
Internet Protocol Version 4, Src: 69.171.248.65 (69.171.248.65), Dst: 176.244.206.69 (176.244.206.69)
Transmission Control Protocol, Src Port: https (443), Dst Port: 51867 (51867), Seq: 1, Ack: 315, Len: 0

No.     Time        Source                Destination           Protocol Length Info
      3 0.425040    69.171.248.65         176.244.206.69        TLSv1    322    New Session Ticket, Change Cipher Spec, Encrypted Handshake Message

Frame 3: 322 bytes on wire (2576 bits), 322 bytes captured (2576 bits)
Linux cooked capture
Internet Protocol Version 4, Src: 69.171.248.65 (69.171.248.65), Dst: 176.244.206.69 (176.244.206.69)
Transmission Control Protocol, Src Port: https (443), Dst Port: 51867 (51867), Seq: 1, Ack: 315, Len: 254
Secure Sockets Layer

No.     Time        Source                Destination           Protocol Length Info
      4 0.425217    176.244.206.69        69.171.248.65         TCP      68     51867 > https [ACK] Seq=315 Ack=255 Win=4555 Len=0 TSval=462734 TSecr=1370985814

Frame 4: 68 bytes on wire (544 bits), 68 bytes captured (544 bits)
Linux cooked capture
Internet Protocol Version 4, Src: 176.244.206.69 (176.244.206.69), Dst: 69.171.248.65 (69.171.248.65)
Transmission Control Protocol, Src Port: 51867 (51867), Dst Port: https (443), Seq: 315, Ack: 255, Len: 0

No.     Time        Source                Destination           Protocol Length Info
      5 0.507293    176.244.206.69        31.13.86.33           TLSv1    382    Client Key Exchange, Change Cipher Spec, Encrypted Handshake Message

Frame 5: 382 bytes on wire (3056 bits), 382 bytes captured (3056 bits)
Linux cooked capture
Internet Protocol Version 4, Src: 176.244.206.69 (176.244.206.69), Dst: 31.13.86.33 (31.13.86.33)
Transmission Control Protocol, Src Port: 41870 (41870), Dst Port: https (443), Seq: 1, Ack: 1, Len: 314
Secure Sockets Layer

No.     Time        Source                Destination           Protocol Length Info
      6 0.562118    176.244.206.69        69.171.248.65         TLSv1    838    Application Data

Frame 6: 838 bytes on wire (6704 bits), 838 bytes captured (6704 bits)
Linux cooked capture
Internet Protocol Version 4, Src: 176.244.206.69 (176.244.206.69), Dst: 69.171.248.65 (69.171.248.65)
Transmission Control Protocol, Src Port: 51867 (51867), Dst Port: https (443), Seq: 315, Ack: 255, Len: 770
Secure Sockets Layer

No.     Time        Source                Destination           Protocol Length Info
      7 0.824647    31.13.86.33           176.244.206.69        TCP      68     https > 41870 [ACK] Seq=1 Ack=315 Win=68 Len=0 TSval=3314259862 TSecr=462742

Frame 7: 68 bytes on wire (544 bits), 68 bytes captured (544 bits)
Linux cooked capture
Internet Protocol Version 4, Src: 31.13.86.33 (31.13.86.33), Dst: 176.244.206.69 (176.244.206.69)
Transmission Control Protocol, Src Port: https (443), Dst Port: 41870 (41870), Seq: 1, Ack: 315, Len: 0

No.     Time        Source                Destination           Protocol Length Info
      8 0.824952    31.13.86.33           176.244.206.69        TLSv1    322    New Session Ticket, Change Cipher Spec, Encrypted Handshake Message

Frame 8: 322 bytes on wire (2576 bits), 322 bytes captured (2576 bits)
Linux cooked capture
Internet Protocol Version 4, Src: 31.13.86.33 (31.13.86.33), Dst: 176.244.206.69 (176.244.206.69)
Transmission Control Protocol, Src Port: https (443), Dst Port: 41870 (41870), Seq: 1, Ack: 315, Len: 254
Secure Sockets Layer

No.     Time        Source                Destination           Protocol Length Info
      9 0.825067    176.244.206.69        31.13.86.33           TCP      68     41870 > https [ACK] Seq=315 Ack=255 Win=5204 Len=0 TSval=462774 TSecr=3314259864

Frame 9: 68 bytes on wire (544 bits), 68 bytes captured (544 bits)
Linux cooked capture
Internet Protocol Version 4, Src: 176.244.206.69 (176.244.206.69), Dst: 31.13.86.33 (31.13.86.33)
Transmission Control Protocol, Src Port: 41870 (41870), Dst Port: https (443), Seq: 315, Ack: 255, Len: 0

No.     Time        Source                Destination           Protocol Length Info
     10 1.040875    176.244.206.69        31.13.86.33           TLSv1    783    Application Data

Frame 10: 783 bytes on wire (6264 bits), 783 bytes captured (6264 bits)
Linux cooked capture
Internet Protocol Version 4, Src: 176.244.206.69 (176.244.206.69), Dst: 31.13.86.33 (31.13.86.33)
Transmission Control Protocol, Src Port: 41870 (41870), Dst Port: https (443), Seq: 315, Ack: 255, Len: 715
Secure Sockets Layer

No.     Time        Source                Destination           Protocol Length Info
     11 1.359295    176.244.206.69        69.171.248.65         TLSv1    838    [TCP Retransmission] Application Data

Frame 11: 838 bytes on wire (6704 bits), 838 bytes captured (6704 bits)
Linux cooked capture
Internet Protocol Version 4, Src: 176.244.206.69 (176.244.206.69), Dst: 69.171.248.65 (69.171.248.65)
Transmission Control Protocol, Src Port: 51867 (51867), Dst Port: https (443), Seq: 315, Ack: 255, Len: 770
Secure Sockets Layer

No.     Time        Source                Destination           Protocol Length Info
     12 1.384597    69.171.248.65         176.244.206.69        TCP      68     https > 51867 [ACK] Seq=255 Ack=1085 Win=80 Len=0 TSval=1370986771 TSecr=462748

Frame 12: 68 bytes on wire (544 bits), 68 bytes captured (544 bits)
Linux cooked capture
Internet Protocol Version 4, Src: 69.171.248.65 (69.171.248.65), Dst: 176.244.206.69 (176.244.206.69)
Transmission Control Protocol, Src Port: https (443), Dst Port: 51867 (51867), Seq: 255, Ack: 1085, Len: 0

No.     Time        Source                Destination           Protocol Length Info
     13 1.404697    69.171.248.65         176.244.206.69        TLSv1    97     Application Data

Frame 13: 97 bytes on wire (776 bits), 97 bytes captured (776 bits)
Linux cooked capture
Internet Protocol Version 4, Src: 69.171.248.65 (69.171.248.65), Dst: 176.244.206.69 (176.244.206.69)
Transmission Control Protocol, Src Port: https (443), Dst Port: 51867 (51867), Seq: 255, Ack: 1085, Len: 29
Secure Sockets Layer

No.     Time        Source                Destination           Protocol Length Info
     14 1.404950    176.244.206.69        69.171.248.65         TCP      68     51867 > https [ACK] Seq=1085 Ack=284 Win=4555 Len=0 TSval=462832 TSecr=1370986788

Frame 14: 68 bytes on wire (544 bits), 68 bytes captured (544 bits)
Linux cooked capture
Internet Protocol Version 4, Src: 176.244.206.69 (176.244.206.69), Dst: 69.171.248.65 (69.171.248.65)
Transmission Control Protocol, Src Port: 51867 (51867), Dst Port: https (443), Seq: 1085, Ack: 284, Len: 0

No.     Time        Source                Destination           Protocol Length Info
     15 1.442327    176.244.206.69        69.171.248.65         TLSv1    241    Application Data

Frame 15: 241 bytes on wire (1928 bits), 241 bytes captured (1928 bits)
Linux cooked capture
Internet Protocol Version 4, Src: 176.244.206.69 (176.244.206.69), Dst: 69.171.248.65 (69.171.248.65)
Transmission Control Protocol, Src Port: 51867 (51867), Dst Port: https (443), Seq: 1085, Ack: 284, Len: 173
Secure Sockets Layer

No.     Time        Source                Destination           Protocol Length Info
     16 1.479943    176.244.206.69        69.171.248.65         TLSv1    151    Application Data

Frame 16: 151 bytes on wire (1208 bits), 151 bytes captured (1208 bits)
Linux cooked capture
Internet Protocol Version 4, Src: 176.244.206.69 (176.244.206.69), Dst: 69.171.248.65 (69.171.248.65)
Transmission Control Protocol, Src Port: 51867 (51867), Dst Port: https (443), Seq: 1258, Ack: 284, Len: 83
Secure Sockets Layer

No.     Time        Source                Destination           Protocol Length Info
     17 1.744588    31.13.86.33           176.244.206.69        TCP      68     https > 41870 [ACK] Seq=255 Ack=1030 Win=80 Len=0 TSval=3314260783 TSecr=462796

Frame 17: 68 bytes on wire (544 bits), 68 bytes captured (544 bits)
Linux cooked capture
Internet Protocol Version 4, Src: 31.13.86.33 (31.13.86.33), Dst: 176.244.206.69 (176.244.206.69)
Transmission Control Protocol, Src Port: https (443), Dst Port: 41870 (41870), Seq: 255, Ack: 1030, Len: 0

No.     Time        Source                Destination           Protocol Length Info
     18 1.744830    176.244.206.69        31.13.86.33           TLSv1    687    Application Data, Application Data, Application Data, Application Data, Application Data

Frame 18: 687 bytes on wire (5496 bits), 687 bytes captured (5496 bits)
Linux cooked capture
Internet Protocol Version 4, Src: 176.244.206.69 (176.244.206.69), Dst: 31.13.86.33 (31.13.86.33)
Transmission Control Protocol, Src Port: 41870 (41870), Dst Port: https (443), Seq: 1030, Ack: 255, Len: 619
Secure Sockets Layer

No.     Time        Source                Destination           Protocol Length Info
     19 2.304670    69.171.248.65         176.244.206.69        TCP      68     [TCP Dup ACK 13#1] https > 51867 [ACK] Seq=284 Ack=1085 Win=80 Len=0 TSval=1370987692 TSecr=462828

Frame 19: 68 bytes on wire (544 bits), 68 bytes captured (544 bits)
Linux cooked capture
Internet Protocol Version 4, Src: 69.171.248.65 (69.171.248.65), Dst: 176.244.206.69 (176.244.206.69)
Transmission Control Protocol, Src Port: https (443), Dst Port: 51867 (51867), Seq: 284, Ack: 1085, Len: 0

No.     Time        Source                Destination           Protocol Length Info
     20 2.334637    69.171.248.65         176.244.206.69        TLSv1    97     [TCP Retransmission] Application Data

Frame 20: 97 bytes on wire (776 bits), 97 bytes captured (776 bits)
Linux cooked capture
Internet Protocol Version 4, Src: 69.171.248.65 (69.171.248.65), Dst: 176.244.206.69 (176.244.206.69)
Transmission Control Protocol, Src Port: https (443), Dst Port: 51867 (51867), Seq: 255, Ack: 1085, Len: 29
Secure Sockets Layer

No.     Time        Source                Destination           Protocol Length Info
     21 2.334872    176.244.206.69        69.171.248.65         TCP      80     [TCP Dup ACK 16#1] 51867 > https [ACK] Seq=1341 Ack=284 Win=4555 Len=0 TSval=462925 TSecr=1370987722 SLE=255 SRE=284

Frame 21: 80 bytes on wire (640 bits), 80 bytes captured (640 bits)
Linux cooked capture
Internet Protocol Version 4, Src: 176.244.206.69 (176.244.206.69), Dst: 69.171.248.65 (69.171.248.65)
Transmission Control Protocol, Src Port: 51867 (51867), Dst Port: https (443), Seq: 1341, Ack: 284, Len: 0

No.     Time        Source                Destination           Protocol Length Info
     22 2.418312    176.244.206.69        83.224.70.93          DNS      80     Standard query 0x246b  A graph.facebook.com

Frame 22: 80 bytes on wire (640 bits), 80 bytes captured (640 bits)
Linux cooked capture
Internet Protocol Version 4, Src: 176.244.206.69 (176.244.206.69), Dst: 83.224.70.93 (83.224.70.93)
User Datagram Protocol, Src Port: 10274 (10274), Dst Port: domain (53)
Domain Name System (query)

No.     Time        Source                Destination           Protocol Length Info
     23 2.424678    69.171.248.65         176.244.206.69        TCP      68     https > 51867 [ACK] Seq=284 Ack=1258 Win=86 Len=0 TSval=1370987811 TSecr=462836

Frame 23: 68 bytes on wire (544 bits), 68 bytes captured (544 bits)
Linux cooked capture
Internet Protocol Version 4, Src: 69.171.248.65 (69.171.248.65), Dst: 176.244.206.69 (176.244.206.69)
Transmission Control Protocol, Src Port: https (443), Dst Port: 51867 (51867), Seq: 284, Ack: 1258, Len: 0

No.     Time        Source                Destination           Protocol Length Info
     24 2.424960    69.171.248.65         176.244.206.69        TLSv1    104    Application Data

Frame 24: 104 bytes on wire (832 bits), 104 bytes captured (832 bits)
Linux cooked capture
Internet Protocol Version 4, Src: 69.171.248.65 (69.171.248.65), Dst: 176.244.206.69 (176.244.206.69)
Transmission Control Protocol, Src Port: https (443), Dst Port: 51867 (51867), Seq: 284, Ack: 1258, Len: 36
Secure Sockets Layer

No.     Time        Source                Destination           Protocol Length Info
     25 2.425058    176.244.206.69        69.171.248.65         TCP      68     51867 > https [ACK] Seq=1341 Ack=320 Win=4555 Len=0 TSval=462934 TSecr=1370987812

Frame 25: 68 bytes on wire (544 bits), 68 bytes captured (544 bits)
Linux cooked capture
Internet Protocol Version 4, Src: 176.244.206.69 (176.244.206.69), Dst: 69.171.248.65 (69.171.248.65)
Transmission Control Protocol, Src Port: 51867 (51867), Dst Port: https (443), Seq: 1341, Ack: 320, Len: 0

No.     Time        Source                Destination           Protocol Length Info
     26 2.504572    69.171.248.65         176.244.206.69        TCP      68     https > 51867 [ACK] Seq=320 Ack=1341 Win=86 Len=0 TSval=1370987891 TSecr=462840

Frame 26: 68 bytes on wire (544 bits), 68 bytes captured (544 bits)
Linux cooked capture
Internet Protocol Version 4, Src: 69.171.248.65 (69.171.248.65), Dst: 176.244.206.69 (176.244.206.69)
Transmission Control Protocol, Src Port: https (443), Dst Port: 51867 (51867), Seq: 320, Ack: 1341, Len: 0

No.     Time        Source                Destination           Protocol Length Info
     27 2.824587    31.13.86.33           176.244.206.69        TCP      68     https > 41870 [ACK] Seq=255 Ack=1649 Win=91 Len=0 TSval=3314261862 TSecr=462866

Frame 27: 68 bytes on wire (544 bits), 68 bytes captured (544 bits)
Linux cooked capture
Internet Protocol Version 4, Src: 31.13.86.33 (31.13.86.33), Dst: 176.244.206.69 (176.244.206.69)
Transmission Control Protocol, Src Port: https (443), Dst Port: 41870 (41870), Seq: 255, Ack: 1649, Len: 0

No.     Time        Source                Destination           Protocol Length Info
     28 2.874642    83.224.70.93          176.244.206.69        DNS      138    Standard query response 0x246b  CNAME api.facebook.com CNAME star.c10r.facebook.com A 31.13.86.33

Frame 28: 138 bytes on wire (1104 bits), 138 bytes captured (1104 bits)
Linux cooked capture
Internet Protocol Version 4, Src: 83.224.70.93 (83.224.70.93), Dst: 176.244.206.69 (176.244.206.69)
User Datagram Protocol, Src Port: domain (53), Dst Port: 10274 (10274)
Domain Name System (response)

No.     Time        Source                Destination           Protocol Length Info
     29 2.890470    176.244.206.69        31.13.86.33           TCP      76     59692 > https [SYN] Seq=0 Win=5240 Len=0 MSS=1310 SACK_PERM=1 TSval=462981 TSecr=0 WS=4

Frame 29: 76 bytes on wire (608 bits), 76 bytes captured (608 bits)
Linux cooked capture
Internet Protocol Version 4, Src: 176.244.206.69 (176.244.206.69), Dst: 31.13.86.33 (31.13.86.33)
Transmission Control Protocol, Src Port: 59692 (59692), Dst Port: https (443), Seq: 0, Len: 0

No.     Time        Source                Destination           Protocol Length Info
     30 3.074598    31.13.86.33           176.244.206.69        TCP      76     https > 59692 [SYN, ACK] Seq=0 Ack=1 Win=14480 Len=0 MSS=1400 SACK_PERM=1 TSval=3314262104 TSecr=462981 WS=256

Frame 30: 76 bytes on wire (608 bits), 76 bytes captured (608 bits)
Linux cooked capture
Internet Protocol Version 4, Src: 31.13.86.33 (31.13.86.33), Dst: 176.244.206.69 (176.244.206.69)
Transmission Control Protocol, Src Port: https (443), Dst Port: 59692 (59692), Seq: 0, Ack: 1, Len: 0

No.     Time        Source                Destination           Protocol Length Info
     31 3.074875    176.244.206.69        31.13.86.33           TCP      68     59692 > https [ACK] Seq=1 Ack=1 Win=5240 Len=0 TSval=462999 TSecr=3314262104

Frame 31: 68 bytes on wire (544 bits), 68 bytes captured (544 bits)
Linux cooked capture
Internet Protocol Version 4, Src: 176.244.206.69 (176.244.206.69), Dst: 31.13.86.33 (31.13.86.33)
Transmission Control Protocol, Src Port: 59692 (59692), Dst Port: https (443), Seq: 1, Ack: 1, Len: 0

No.     Time        Source                Destination           Protocol Length Info
     32 3.086200    176.244.206.69        31.13.86.33           TLSv1    181    Client Hello

Frame 32: 181 bytes on wire (1448 bits), 181 bytes captured (1448 bits)
Linux cooked capture
Internet Protocol Version 4, Src: 176.244.206.69 (176.244.206.69), Dst: 31.13.86.33 (31.13.86.33)
Transmission Control Protocol, Src Port: 59692 (59692), Dst Port: https (443), Seq: 1, Ack: 1, Len: 113
Secure Sockets Layer

No.     Time        Source                Destination           Protocol Length Info
     33 3.344717    31.13.86.33           176.244.206.69        TCP      68     https > 59692 [ACK] Seq=1 Ack=114 Win=14592 Len=0 TSval=3314262383 TSecr=463000

Frame 33: 68 bytes on wire (544 bits), 68 bytes captured (544 bits)
Linux cooked capture
Internet Protocol Version 4, Src: 31.13.86.33 (31.13.86.33), Dst: 176.244.206.69 (176.244.206.69)
Transmission Control Protocol, Src Port: https (443), Dst Port: 59692 (59692), Seq: 1, Ack: 114, Len: 0

No.     Time        Source                Destination           Protocol Length Info
     34 3.354740    31.13.86.33           176.244.206.69        TLSv1    1366   Server Hello

Frame 34: 1366 bytes on wire (10928 bits), 1366 bytes captured (10928 bits)
Linux cooked capture
Internet Protocol Version 4, Src: 31.13.86.33 (31.13.86.33), Dst: 176.244.206.69 (176.244.206.69)
Transmission Control Protocol, Src Port: https (443), Dst Port: 59692 (59692), Seq: 1, Ack: 114, Len: 1298
Secure Sockets Layer

No.     Time        Source                Destination           Protocol Length Info
     35 3.354947    176.244.206.69        31.13.86.33           TCP      68     59692 > https [ACK] Seq=114 Ack=1299 Win=7836 Len=0 TSval=463027 TSecr=3314262383

Frame 35: 68 bytes on wire (544 bits), 68 bytes captured (544 bits)
Linux cooked capture
Internet Protocol Version 4, Src: 176.244.206.69 (176.244.206.69), Dst: 31.13.86.33 (31.13.86.33)
Transmission Control Protocol, Src Port: 59692 (59692), Dst Port: https (443), Seq: 114, Ack: 1299, Len: 0

No.     Time        Source                Destination           Protocol Length Info
     36 3.384992    31.13.86.33           176.244.206.69        TCP      1366   [TCP segment of a reassembled PDU]

Frame 36: 1366 bytes on wire (10928 bits), 1366 bytes captured (10928 bits)
Linux cooked capture
Internet Protocol Version 4, Src: 31.13.86.33 (31.13.86.33), Dst: 176.244.206.69 (176.244.206.69)
Transmission Control Protocol, Src Port: https (443), Dst Port: 59692 (59692), Seq: 1299, Ack: 114, Len: 1298

No.     Time        Source                Destination           Protocol Length Info
     37 3.385257    176.244.206.69        31.13.86.33           TCP      68     59692 > https [ACK] Seq=114 Ack=2597 Win=10432 Len=0 TSval=463030 TSecr=3314262383

Frame 37: 68 bytes on wire (544 bits), 68 bytes captured (544 bits)
Linux cooked capture
Internet Protocol Version 4, Src: 176.244.206.69 (176.244.206.69), Dst: 31.13.86.33 (31.13.86.33)
Transmission Control Protocol, Src Port: 59692 (59692), Dst Port: https (443), Seq: 114, Ack: 2597, Len: 0

No.     Time        Source                Destination           Protocol Length Info
     38 3.385373    31.13.86.33           176.244.206.69        TCP      1366   [TCP segment of a reassembled PDU]

Frame 38: 1366 bytes on wire (10928 bits), 1366 bytes captured (10928 bits)
Linux cooked capture
Internet Protocol Version 4, Src: 31.13.86.33 (31.13.86.33), Dst: 176.244.206.69 (176.244.206.69)
Transmission Control Protocol, Src Port: https (443), Dst Port: 59692 (59692), Seq: 2597, Ack: 114, Len: 1298

No.     Time        Source                Destination           Protocol Length Info
     39 3.385507    31.13.86.33           176.244.206.69        TCP      270    [TCP segment of a reassembled PDU]

Frame 39: 270 bytes on wire (2160 bits), 270 bytes captured (2160 bits)
Linux cooked capture
Internet Protocol Version 4, Src: 31.13.86.33 (31.13.86.33), Dst: 176.244.206.69 (176.244.206.69)
Transmission Control Protocol, Src Port: https (443), Dst Port: 59692 (59692), Seq: 3895, Ack: 114, Len: 202

No.     Time        Source                Destination           Protocol Length Info
     40 3.385748    176.244.206.69        31.13.86.33           TCP      68     59692 > https [ACK] Seq=114 Ack=3895 Win=13028 Len=0 TSval=463030 TSecr=3314262383

Frame 40: 68 bytes on wire (544 bits), 68 bytes captured (544 bits)
Linux cooked capture
Internet Protocol Version 4, Src: 176.244.206.69 (176.244.206.69), Dst: 31.13.86.33 (31.13.86.33)
Transmission Control Protocol, Src Port: 59692 (59692), Dst Port: https (443), Seq: 114, Ack: 3895, Len: 0

No.     Time        Source                Destination           Protocol Length Info
     41 3.385802    176.244.206.69        31.13.86.33           TCP      68     59692 > https [ACK] Seq=114 Ack=4097 Win=15624 Len=0 TSval=463030 TSecr=3314262383

Frame 41: 68 bytes on wire (544 bits), 68 bytes captured (544 bits)
Linux cooked capture
Internet Protocol Version 4, Src: 176.244.206.69 (176.244.206.69), Dst: 31.13.86.33 (31.13.86.33)
Transmission Control Protocol, Src Port: 59692 (59692), Dst Port: https (443), Seq: 114, Ack: 4097, Len: 0

No.     Time        Source                Destination           Protocol Length Info
     42 3.385925    31.13.86.33           176.244.206.69        TLSv1    216    Certificate, Server Hello Done

Frame 42: 216 bytes on wire (1728 bits), 216 bytes captured (1728 bits)
Linux cooked capture
Internet Protocol Version 4, Src: 31.13.86.33 (31.13.86.33), Dst: 176.244.206.69 (176.244.206.69)
Transmission Control Protocol, Src Port: https (443), Dst Port: 59692 (59692), Seq: 4097, Ack: 114, Len: 148
[5 Reassembled TCP Segments (4182 bytes): #34(1236), #36(1298), #38(1298), #39(202), #42(148)]
Secure Sockets Layer

No.     Time        Source                Destination           Protocol Length Info
     43 3.386018    176.244.206.69        31.13.86.33           TCP      68     59692 > https [ACK] Seq=114 Ack=4245 Win=18220 Len=0 TSval=463030 TSecr=3314262383

Frame 43: 68 bytes on wire (544 bits), 68 bytes captured (544 bits)
Linux cooked capture
Internet Protocol Version 4, Src: 176.244.206.69 (176.244.206.69), Dst: 31.13.86.33 (31.13.86.33)
Transmission Control Protocol, Src Port: 59692 (59692), Dst Port: https (443), Seq: 114, Ack: 4245, Len: 0

No.     Time        Source                Destination           Protocol Length Info
     44 3.724827    31.13.86.33           176.244.206.69        TLSv1    497    Application Data

Frame 44: 497 bytes on wire (3976 bits), 497 bytes captured (3976 bits)
Linux cooked capture
Internet Protocol Version 4, Src: 31.13.86.33 (31.13.86.33), Dst: 176.244.206.69 (176.244.206.69)
Transmission Control Protocol, Src Port: https (443), Dst Port: 41870 (41870), Seq: 255, Ack: 1649, Len: 429
Secure Sockets Layer

No.     Time        Source                Destination           Protocol Length Info
     45 3.725050    176.244.206.69        31.13.86.33           TCP      68     41870 > https [ACK] Seq=1649 Ack=684 Win=5853 Len=0 TSval=463064 TSecr=3314262764

Frame 45: 68 bytes on wire (544 bits), 68 bytes captured (544 bits)
Linux cooked capture
Internet Protocol Version 4, Src: 176.244.206.69 (176.244.206.69), Dst: 31.13.86.33 (31.13.86.33)
Transmission Control Protocol, Src Port: 41870 (41870), Dst Port: https (443), Seq: 1649, Ack: 684, Len: 0

No.     Time        Source                Destination           Protocol Length Info
     46 7.178393    176.244.206.69        50.22.231.44          TCP      97     [TCP segment of a reassembled PDU]

Frame 46: 97 bytes on wire (776 bits), 97 bytes captured (776 bits)
Linux cooked capture
Internet Protocol Version 4, Src: 176.244.206.69 (176.244.206.69), Dst: 50.22.231.44 (50.22.231.44)
Transmission Control Protocol, Src Port: 60100 (60100), Dst Port: xmpp-client (5222), Seq: 1, Ack: 1, Len: 29

No.     Time        Source                Destination           Protocol Length Info
     47 7.393970    176.244.206.69        31.13.86.33           TLSv1    382    Client Key Exchange, Change Cipher Spec, Encrypted Handshake Message

Frame 47: 382 bytes on wire (3056 bits), 382 bytes captured (3056 bits)
Linux cooked capture
Internet Protocol Version 4, Src: 176.244.206.69 (176.244.206.69), Dst: 31.13.86.33 (31.13.86.33)
Transmission Control Protocol, Src Port: 59692 (59692), Dst Port: https (443), Seq: 114, Ack: 4245, Len: 314
Secure Sockets Layer

No.     Time        Source                Destination           Protocol Length Info
     48 8.919285    176.244.206.69        50.22.231.44          TCP      97     [TCP Retransmission] 60100 > xmpp-client [PSH, ACK] Seq=1 Ack=1 Win=1578 Len=29 TSval=463584 TSecr=334554236

Frame 48: 97 bytes on wire (776 bits), 97 bytes captured (776 bits)
Linux cooked capture
Internet Protocol Version 4, Src: 176.244.206.69 (176.244.206.69), Dst: 50.22.231.44 (50.22.231.44)
Transmission Control Protocol, Src Port: 60100 (60100), Dst Port: xmpp-client (5222), Seq: 1, Ack: 1, Len: 29

No.     Time        Source                Destination           Protocol Length Info
     49 9.208850    50.22.231.44          176.244.206.69        TCP      68     xmpp-client > 60100 [ACK] Seq=1 Ack=30 Win=512 Len=0 TSval=334647386 TSecr=463409

Frame 49: 68 bytes on wire (544 bits), 68 bytes captured (544 bits)
Linux cooked capture
Internet Protocol Version 4, Src: 50.22.231.44 (50.22.231.44), Dst: 176.244.206.69 (176.244.206.69)
Transmission Control Protocol, Src Port: xmpp-client (5222), Dst Port: 60100 (60100), Seq: 1, Ack: 30, Len: 0

No.     Time        Source                Destination           Protocol Length Info
     50 9.209353    176.244.206.69        50.22.231.44          TCP      108    [TCP segment of a reassembled PDU]

Frame 50: 108 bytes on wire (864 bits), 108 bytes captured (864 bits)
Linux cooked capture
Internet Protocol Version 4, Src: 176.244.206.69 (176.244.206.69), Dst: 50.22.231.44 (50.22.231.44)
Transmission Control Protocol, Src Port: 60100 (60100), Dst Port: xmpp-client (5222), Seq: 30, Ack: 1, Len: 40

No.     Time        Source                Destination           Protocol Length Info
     51 9.209423    31.13.86.33           176.244.206.69        TCP      68     https > 59692 [ACK] Seq=4245 Ack=428 Win=17408 Len=0 TSval=3314266743 TSecr=463431

Frame 51: 68 bytes on wire (544 bits), 68 bytes captured (544 bits)
Linux cooked capture
Internet Protocol Version 4, Src: 31.13.86.33 (31.13.86.33), Dst: 176.244.206.69 (176.244.206.69)
Transmission Control Protocol, Src Port: https (443), Dst Port: 59692 (59692), Seq: 4245, Ack: 428, Len: 0

No.     Time        Source                Destination           Protocol Length Info
     52 9.209735    31.13.86.33           176.244.206.69        TLSv1    322    New Session Ticket, Change Cipher Spec, Encrypted Handshake Message

Frame 52: 322 bytes on wire (2576 bits), 322 bytes captured (2576 bits)
Linux cooked capture
Internet Protocol Version 4, Src: 31.13.86.33 (31.13.86.33), Dst: 176.244.206.69 (176.244.206.69)
Transmission Control Protocol, Src Port: https (443), Dst Port: 59692 (59692), Seq: 4245, Ack: 428, Len: 254
Secure Sockets Layer

No.     Time        Source                Destination           Protocol Length Info
     53 9.209840    176.244.206.69        31.13.86.33           TCP      68     59692 > https [ACK] Seq=428 Ack=4499 Win=20816 Len=0 TSval=463613 TSecr=3314266745

Frame 53: 68 bytes on wire (544 bits), 68 bytes captured (544 bits)
Linux cooked capture
Internet Protocol Version 4, Src: 176.244.206.69 (176.244.206.69), Dst: 31.13.86.33 (31.13.86.33)
Transmission Control Protocol, Src Port: 59692 (59692), Dst Port: https (443), Seq: 428, Ack: 4499, Len: 0

No.     Time        Source                Destination           Protocol Length Info
     54 9.218953    31.13.86.33           176.244.206.69        TLSv1    322    [TCP Retransmission] New Session Ticket, Change Cipher Spec, Encrypted Handshake Message

Frame 54: 322 bytes on wire (2576 bits), 322 bytes captured (2576 bits)
Linux cooked capture
Internet Protocol Version 4, Src: 31.13.86.33 (31.13.86.33), Dst: 176.244.206.69 (176.244.206.69)
Transmission Control Protocol, Src Port: https (443), Dst Port: 59692 (59692), Seq: 4245, Ack: 428, Len: 254
Secure Sockets Layer

No.     Time        Source                Destination           Protocol Length Info
     55 9.219203    176.244.206.69        31.13.86.33           TCP      80     [TCP Dup ACK 53#1] 59692 > https [ACK] Seq=428 Ack=4499 Win=20816 Len=0 TSval=463613 TSecr=3314267368 SLE=4245 SRE=4499

Frame 55: 80 bytes on wire (640 bits), 80 bytes captured (640 bits)
Linux cooked capture
Internet Protocol Version 4, Src: 176.244.206.69 (176.244.206.69), Dst: 31.13.86.33 (31.13.86.33)
Transmission Control Protocol, Src Port: 59692 (59692), Dst Port: https (443), Seq: 428, Ack: 4499, Len: 0

No.     Time        Source                Destination           Protocol Length Info
     56 9.329022    50.22.231.44          176.244.206.69        TCP      68     [TCP Dup ACK 49#1] xmpp-client > 60100 [ACK] Seq=1 Ack=30 Win=512 Len=0 TSval=334649204 TSecr=463584

Frame 56: 68 bytes on wire (544 bits), 68 bytes captured (544 bits)
Linux cooked capture
Internet Protocol Version 4, Src: 50.22.231.44 (50.22.231.44), Dst: 176.244.206.69 (176.244.206.69)
Transmission Control Protocol, Src Port: xmpp-client (5222), Dst Port: 60100 (60100), Seq: 1, Ack: 30, Len: 0

No.     Time        Source                Destination           Protocol Length Info
     57 9.538875    50.22.231.44          176.244.206.69        TCP      112    [TCP segment of a reassembled PDU]

Frame 57: 112 bytes on wire (896 bits), 112 bytes captured (896 bits)
Linux cooked capture
Internet Protocol Version 4, Src: 50.22.231.44 (50.22.231.44), Dst: 176.244.206.69 (176.244.206.69)
Transmission Control Protocol, Src Port: xmpp-client (5222), Dst Port: 60100 (60100), Seq: 1, Ack: 70, Len: 44

No.     Time        Source                Destination           Protocol Length Info
     58 9.539307    176.244.206.69        50.22.231.44          TCP      68     60100 > xmpp-client [ACK] Seq=70 Ack=45 Win=1578 Len=0 TSval=463646 TSecr=334649408

Frame 58: 68 bytes on wire (544 bits), 68 bytes captured (544 bits)
Linux cooked capture
Internet Protocol Version 4, Src: 176.244.206.69 (176.244.206.69), Dst: 50.22.231.44 (50.22.231.44)
Transmission Control Protocol, Src Port: 60100 (60100), Dst Port: xmpp-client (5222), Seq: 70, Ack: 45, Len: 0

No.     Time        Source                Destination           Protocol Length Info
     59 9.790242    176.244.206.69        31.13.86.33           TLSv1    737    Application Data

Frame 59: 737 bytes on wire (5896 bits), 737 bytes captured (5896 bits)
Linux cooked capture
Internet Protocol Version 4, Src: 176.244.206.69 (176.244.206.69), Dst: 31.13.86.33 (31.13.86.33)
Transmission Control Protocol, Src Port: 59692 (59692), Dst Port: https (443), Seq: 428, Ack: 4499, Len: 669
Secure Sockets Layer

No.     Time        Source                Destination           Protocol Length Info
     60 10.144918   176.244.206.69        50.22.231.44          TCP      80     [TCP segment of a reassembled PDU]

Frame 60: 80 bytes on wire (640 bits), 80 bytes captured (640 bits)
Linux cooked capture
Internet Protocol Version 4, Src: 176.244.206.69 (176.244.206.69), Dst: 50.22.231.44 (50.22.231.44)
Transmission Control Protocol, Src Port: 60100 (60100), Dst Port: xmpp-client (5222), Seq: 70, Ack: 45, Len: 12

No.     Time        Source                Destination           Protocol Length Info
     61 10.298727   31.13.86.33           176.244.206.69        TCP      68     https > 59692 [ACK] Seq=4499 Ack=1097 Win=20480 Len=0 TSval=3314269347 TSecr=463671

Frame 61: 68 bytes on wire (544 bits), 68 bytes captured (544 bits)
Linux cooked capture
Internet Protocol Version 4, Src: 31.13.86.33 (31.13.86.33), Dst: 176.244.206.69 (176.244.206.69)
Transmission Control Protocol, Src Port: https (443), Dst Port: 59692 (59692), Seq: 4499, Ack: 1097, Len: 0

No.     Time        Source                Destination           Protocol Length Info
     62 10.298977   176.244.206.69        31.13.86.33           TLSv1    302    Application Data

Frame 62: 302 bytes on wire (2416 bits), 302 bytes captured (2416 bits)
Linux cooked capture
Internet Protocol Version 4, Src: 176.244.206.69 (176.244.206.69), Dst: 31.13.86.33 (31.13.86.33)
Transmission Control Protocol, Src Port: 59692 (59692), Dst Port: https (443), Seq: 1097, Ack: 4499, Len: 234
Secure Sockets Layer

No.     Time        Source                Destination           Protocol Length Info
     63 10.408770   50.22.231.44          176.244.206.69        TCP      95     [TCP segment of a reassembled PDU]

Frame 63: 95 bytes on wire (760 bits), 95 bytes captured (760 bits)
Linux cooked capture
Internet Protocol Version 4, Src: 50.22.231.44 (50.22.231.44), Dst: 176.244.206.69 (176.244.206.69)
Transmission Control Protocol, Src Port: xmpp-client (5222), Dst Port: 60100 (60100), Seq: 45, Ack: 82, Len: 27

No.     Time        Source                Destination           Protocol Length Info
     64 10.409295   176.244.206.69        50.22.231.44          TCP      93     [TCP segment of a reassembled PDU]

Frame 64: 93 bytes on wire (744 bits), 93 bytes captured (744 bits)
Linux cooked capture
Internet Protocol Version 4, Src: 176.244.206.69 (176.244.206.69), Dst: 50.22.231.44 (50.22.231.44)
Transmission Control Protocol, Src Port: 60100 (60100), Dst Port: xmpp-client (5222), Seq: 82, Ack: 72, Len: 25

No.     Time        Source                Destination           Protocol Length Info
     65 10.629043   31.13.86.33           176.244.206.69        TCP      68     https > 59692 [ACK] Seq=4499 Ack=1331 Win=21760 Len=0 TSval=3314269667 TSecr=463721

Frame 65: 68 bytes on wire (544 bits), 68 bytes captured (544 bits)
Linux cooked capture
Internet Protocol Version 4, Src: 31.13.86.33 (31.13.86.33), Dst: 176.244.206.69 (176.244.206.69)
Transmission Control Protocol, Src Port: https (443), Dst Port: 59692 (59692), Seq: 4499, Ack: 1331, Len: 0

No.     Time        Source                Destination           Protocol Length Info
     66 10.698787   31.13.86.33           176.244.206.69        TLSv1    528    Application Data

Frame 66: 528 bytes on wire (4224 bits), 528 bytes captured (4224 bits)
Linux cooked capture
Internet Protocol Version 4, Src: 31.13.86.33 (31.13.86.33), Dst: 176.244.206.69 (176.244.206.69)
Transmission Control Protocol, Src Port: https (443), Dst Port: 59692 (59692), Seq: 4499, Ack: 1331, Len: 460
Secure Sockets Layer

No.     Time        Source                Destination           Protocol Length Info
     67 10.699008   176.244.206.69        31.13.86.33           TCP      68     59692 > https [ACK] Seq=1331 Ack=4959 Win=23412 Len=0 TSval=463761 TSecr=3314269735

Frame 67: 68 bytes on wire (544 bits), 68 bytes captured (544 bits)
Linux cooked capture
Internet Protocol Version 4, Src: 176.244.206.69 (176.244.206.69), Dst: 31.13.86.33 (31.13.86.33)
Transmission Control Protocol, Src Port: 59692 (59692), Dst Port: https (443), Seq: 1331, Ack: 4959, Len: 0

No.     Time        Source                Destination           Protocol Length Info
     68 10.758707   50.22.231.44          176.244.206.69        TCP      86     [TCP segment of a reassembled PDU]

Frame 68: 86 bytes on wire (688 bits), 86 bytes captured (688 bits)
Linux cooked capture
Internet Protocol Version 4, Src: 50.22.231.44 (50.22.231.44), Dst: 176.244.206.69 (176.244.206.69)
Transmission Control Protocol, Src Port: xmpp-client (5222), Dst Port: 60100 (60100), Seq: 72, Ack: 107, Len: 18

No.     Time        Source                Destination           Protocol Length Info
     69 10.789282   176.244.206.69        50.22.231.44          TCP      68     60100 > xmpp-client [ACK] Seq=107 Ack=90 Win=1578 Len=0 TSval=463771 TSecr=334650641

Frame 69: 68 bytes on wire (544 bits), 68 bytes captured (544 bits)
Linux cooked capture
Internet Protocol Version 4, Src: 176.244.206.69 (176.244.206.69), Dst: 50.22.231.44 (50.22.231.44)
Transmission Control Protocol, Src Port: 60100 (60100), Dst Port: xmpp-client (5222), Seq: 107, Ack: 90, Len: 0

No.     Time        Source                Destination           Protocol Length Info
     70 15.199552   176.244.206.69        50.22.231.44          TCP      131    [TCP segment of a reassembled PDU]

Frame 70: 131 bytes on wire (1048 bits), 131 bytes captured (1048 bits)
Linux cooked capture
Internet Protocol Version 4, Src: 176.244.206.69 (176.244.206.69), Dst: 50.22.231.44 (50.22.231.44)
Transmission Control Protocol, Src Port: 60100 (60100), Dst Port: xmpp-client (5222), Seq: 107, Ack: 90, Len: 63

No.     Time        Source                Destination           Protocol Length Info
     71 16.950860   50.22.231.44          176.244.206.69        TCP      113    [TCP segment of a reassembled PDU]

Frame 71: 113 bytes on wire (904 bits), 113 bytes captured (904 bits)
Linux cooked capture
Internet Protocol Version 4, Src: 50.22.231.44 (50.22.231.44), Dst: 176.244.206.69 (176.244.206.69)
Transmission Control Protocol, Src Port: xmpp-client (5222), Dst Port: 60100 (60100), Seq: 90, Ack: 170, Len: 45

No.     Time        Source                Destination           Protocol Length Info
     72 16.951218   176.244.206.69        50.22.231.44          TCP      68     60100 > xmpp-client [ACK] Seq=170 Ack=135 Win=1578 Len=0 TSval=464387 TSecr=334655360

Frame 72: 68 bytes on wire (544 bits), 68 bytes captured (544 bits)
Linux cooked capture
Internet Protocol Version 4, Src: 176.244.206.69 (176.244.206.69), Dst: 50.22.231.44 (50.22.231.44)
Transmission Control Protocol, Src Port: 60100 (60100), Dst Port: xmpp-client (5222), Seq: 170, Ack: 135, Len: 0

No.     Time        Source                Destination           Protocol Length Info
     73 17.403135   176.244.206.69        31.13.86.33           TLSv1    756    Application Data

Frame 73: 756 bytes on wire (6048 bits), 756 bytes captured (6048 bits)
Linux cooked capture
Internet Protocol Version 4, Src: 176.244.206.69 (176.244.206.69), Dst: 31.13.86.33 (31.13.86.33)
Transmission Control Protocol, Src Port: 59692 (59692), Dst Port: https (443), Seq: 1331, Ack: 4959, Len: 688
Secure Sockets Layer

No.     Time        Source                Destination           Protocol Length Info
     74 18.635935   31.13.86.33           176.244.206.69        TCP      68     https > 59692 [ACK] Seq=4959 Ack=2019 Win=24576 Len=0 TSval=3314277674 TSecr=464432

Frame 74: 68 bytes on wire (544 bits), 68 bytes captured (544 bits)
Linux cooked capture
Internet Protocol Version 4, Src: 31.13.86.33 (31.13.86.33), Dst: 176.244.206.69 (176.244.206.69)
Transmission Control Protocol, Src Port: https (443), Dst Port: 59692 (59692), Seq: 4959, Ack: 2019, Len: 0

No.     Time        Source                Destination           Protocol Length Info
     75 18.636317   176.244.206.69        31.13.86.33           TLSv1    858    Application Data, Application Data, Application Data, Application Data, Application Data

Frame 75: 858 bytes on wire (6864 bits), 858 bytes captured (6864 bits)
Linux cooked capture
